;Ticker;Nombre_Completo;Date_Time;Titular;Subtitular;Texto
16;ALK;Alaska Air Group;2009-05-14T19:27:35Z;Branson hits out at BA/AA tie-up;;Sir Richard Branson warned on Thursday that British Airways’ planned transcontinental venture with American Airlines could imperil Virgin Atlantic Airways, the carrier he founded 25 years ago, if it wins approval from US regulators.In his most searing critique yet of his rivals’ proposal, Sir Richard said the venture would grant these rivals a dominant share of key take-off and landing slots at London’s Heathrow Airport, the world’s most important international gateway, weakening their competitors and leading to higher fares and fewer transatlantic flights.“I cannot guarantee VA’s survival,” Sir Richard said during a speech in Washington. “It will be like competing with our hands tied behind our back.”BA, American and several other peers are seeking immunity from US anti-trust rules that would hinder their ability to share revenue and coordinate schedules and fares. Virgin has filed to contest the application, and plans to make its final submissions to the US Department of Transportation by Monday.BA and American launched earlier attempts to co-ordinate their activities in 1997 and 2001, but regulators required them to divest a large number of take-off and landing slots at Heathrow, a price they deemed too high. The companies now argue that the competitive landscape has changed since the landmark ”open skies” accord opened Heathrow to more airlines.Besides, they point out, most of their biggest transcontinental competitors, from Air France-KLM and Delta Air Lines to Lufthansa and United Airlines, already enjoy immunised ventures.“Our application is good news for customers,” American said in a statement. “They will gain greater access to discounted fares, smoother connections and more frequent flyer benefits and ultimately more travel choices.”Sir Richard disagreed, noting that Heathrow remains too congested to open slots to new competition.While Virgin Atlantic sought to derail its rivals’ venture, its sister company, Virgin America, awaits word from US transport officials on its future.Alaska Airlines questioned the carrier’s ”US citizenship” and petitioned regulators in February to open an inquiry into its ownership structure. Federal laws cap foreign holdings of domestic airlines at no more than 25 per cent.Earlier this year two US hedge funds, Virgin America’s majority owners, exercised an option to recall their $150m - leaving Virgin Group, which owns a 24 per cent stake, as Virgin America’s sole shareholder, people familiar with the matter said.Virgin America is in talks with at least five US investors and expects to find replacements for the two funds, Black Canyon and Cyrus Capital Partners, within the next two months, the people said.
17;ALK;Alaska Air Group;2009-02-10T19:33:36Z;Rival urges scrutiny of Virgin America;;Alaska Airlines has urged federal regulators to scrutinise Virgin America, the US carrier founded by the UK entrepreneur Sir Richard Branson this decade, and its right to operate domestic flights.The regional airline, which competes with Virgin America on routes to Seattle and other cities along the US West Coast, questioned the fledgling carrier’s “US citizenship” and petitioned the US Department of Transportation to open an inquiry into its ownership structure. Federal laws cap foreign ownership of domestic airlines at no more than 25 per cent.The petition follows a report last month in the Financial Times that Sir Richard’s Virgin Group, which owns 24 per cent of Virgin America, had expected the US investors in its sister company to exercise an option to recall their $150m investment – leaving Virgin Group as Virgin America’s sole shareholder.Keith Loveless, Alaska’s general counsel, said in a statement: “Alaska makes this request to ensure all US carriers are held to the same standard of compliance.”Virgin America began service in 2007 after a protracted battle in Washington over its rights to operate domestic flights and the company’s ties to Virgin Group.Virgin Group hired Lazard, the investment bank, to recruit new investors in the event that Virgin America’s two US shareholders, Black Canyon and Cyrus Capital Partners, exercised their option.Virgin Group would in turn transfer the firms’ ownership stakes to new US investors once they had committed, remaining in compliance with foreign ownership rules.While Black Canyon and Cyrus had yet to put back their investment, Virgin Group was still bracing for the decision, a person familiar with the matter said on Tuesday.Virgin America said: “This is a meritless petition. We are a US-owned and controlled airline that is in full compliance with the law and all Department of Transportation regulations.“Nothing has changed in our ownership structure, which was approved by the DOT. Should our ownership structure change in the future, we will of course notify the DOT in advance, so they can confirm our continuing compliance.”
18;ALK;Alaska Air Group;2008-06-05T18:02:35Z;Take-off delayed: America’s airlines are making drastic cuts;;Thirty years ago this October, President Jimmy Carter brought the regulated era of commercial US aviation to a close, opening the domestic market to competition, freeing carriers to set their own fares and paving the way for decades of rapid expansion.Forgive executives if they neglect to uncork the anniversary champagne.US carriers have descended into a crisis that will leave few, if any, unscathed. Fuel costs have surged in the past year, wiping out earnings and threatening to send even some of the largest airlines back to bankruptcy court. The economy’s slowdown has damped demand for business and leisure travel alike, leaving more empty seats on flights already struggling to make money.Irritating fees and frequent delays have tarnished the industry’s reputation with passengers, while recent restructurings and bankruptcies have strained relations with workers. As for airline stocks, their performance this year would make even Wall Street executives blush.Further evidence of the harsh conditions faced by the industry came on Thursday when Continental Airlines said it was cutting 3,000 jobs and taking 73 aircraft out of service. The news came a day after United Airlines announced that it planned to ground a fifth of its fleet.“A durable competitive advantage has proven elusive ever since the days of the Wright Brothers,” Warren Buffett, the world’s richest man and a one-time airline investor, wrote recently. “If a farsighted capitalist had been present at Kitty Hawk, he would have done his successors a huge favour by shooting Orville down.”Mr Wright’s safe landing in North Carolina more than a century ago made it impossible for future generations of capitalists to imagine a world without flight, and it seems equally unlikely to many airline executives that the industry will ever return to a regulated era whose rationale, in part, was to help ensure their stability. The carriers that survive the current downturn will offset mounting fuel prices by finding the right balance between trimming unprofitable routes and raising fares, or merging with a peer that makes those choices easier.“We won’t see re-regulation,” says Richard Anderson, chief executive of Delta Air Lines. “The marketplace is going to react to supply and demand the way an unregulated market should.”Air travel is more popular than ever. The 1978 measure has largely lived up to its mandate to “encourage, develop, and attain an air transportation system which relies on competitive market forces”. Affordable fares have helped free businesses to reach the rest of the world from practically any sizeable US city, spurring global trade and transforming the professional and personal lives of countless Americans. For those reasons, there is little groundswell in Washington to bring back regulations that would shelter airlines from competition.“No, it was a good idea,” said Representative James Oberstar, the Minnesota Democrat who, as chairman of the US House Transportation and Infrastructure Committee, is one of Capitol Hill’s most vocal members on most aviation issues. “Air travellers are still saving compared to pre-deregulation ticket prices.”While cheap fares and intense competition have remained constant since deregulation, financial stability at the airlines themselves has not. “There’s just so many risks to mitigate – it’s energy-intensive, subject to weather, it’s tough to execute a schedule and labour-intensive,” says Gary Kelly, chief executive of Southwest Airlines, the world’s largest low-cost carrier. “It’s a marginal profit at best for most airlines. Any change in the variables can have a pretty dramatic impact.”No single variable looms larger this year than fuel, which for most carriers has surpassed labour as the single-biggest expense. The run-up has forced carriers to take increasingly desperate measures. American Airlines will soon charge some passengers $15 to check a single bag, while US Airways recently banished all free snacks.Most airline executives acknowledge the industry must take more drastic steps to return commercial aviation to the stability it enjoyed, however briefly, before the latest surge in fuel prices. “The simple fact is that the US airline industry, as it is constituted today, was not built for $125 per barrel oil,” Gerard Arpey, chief executive of American Airlines, said last month during the world’s biggest carrier’s annual shareholder meeting. “The industry will not and cannot continue in its current state.”Some industry insiders continue to argue that sweeping consolidation would help carriers shed unprofitable routes and wield enough market power to raise ticket prices without losing a significant amount of traffic to low-cost airlines. When Delta agreed to merge with Northwest Airlines earlier this year, those executives and their advisers predicted other deals would follow.But the window for reaching a deal in time for a regulatory review by Bush administration officials – viewed as being more open to mergers than any of their potential successors – has all but closed. Many other legacy carriers, including United and Continental, have bowed out of the M&A game, at least for now.In conceding that talks with US Airways had ended, Glenn Tilton, United’s chief executive and a vocal advocate for consolidation, said during a message to his employees that the costs of integrating two complex operations would threaten to overwhelm a carrier already burning through its cash reserves to pay for fuel.Should oil prices continue to climb, some battered carriers may have no choice but to return to the table. Indeed, many of the industry’s biggest deals took place when one of the merger partners was under duress, says Andrew Watterson, a partner with Oliver Wyman in Dallas. “You could see some shotgun weddings.”“Mergers are not easy,” says Ilker Baybars, a professor of operations management at Carnegie Mellon. “It is painful. But when an industry is so competitive and margins are so small, consolidation is inevitable.”In the meantime, carriers will take deeper cuts to their flight schedules, trim administrative staff and ground older, less fuel-efficient aircraft. But this may not be enough to counter fuel costs should oil prices remain where they are or climb higher. CreditSights, a debt-research firm, predicted that the 2008 fuel bills of Delta and United would surpass each airline’s current cash position should crude oil remain at $125 a barrel. Of the 11 biggest US carriers, only Southwest, US Airways, Alaska and Northwest would end the year with cash on hand with oil at $150.In past downturns, including the one triggered by recession and the 9-11 terrorist attacks, troubled airlines filed for bankruptcy. Under the court’s protection, US Airways, United, Delta and Northwest reduced their debts, won wage concessions from employees and discarded older aircraft. While they emerged healthier, their revivals did little to confront what some executives see as the industry’s real problem: too many legacy airlines flying too many planes.“If a tree is dead, it should die because it has had its use and can make for new shoots,” says Sir Richard Branson, founder of Virgin Atlantic. “In America most of these airlines have gone through Chapter 11 at least once. The quality is dreadful and the old planes stay in the air.” Sir Richard blames the ease with which US companies can emerge from bankruptcy largely intact. “You’re going to get a major carrier going into Chapter 11 again in the next few months, with fuel prices being at these levels,” he says. “Let those who should be dead die. That would be the best shot in the arm for the American industry.”If only it were that easy. The liquidation of a major airline would cost the economy thousands of jobs and dramatically reduce air service to some communities. Politicians would fight it, as may organised labour. “It is the worst scenario for the employees working for that carrier,” says Captain John Prater, president of the Air Line Pilots Association.Large suppliers, which often land influential seats on the creditors’ committees of bankrupt airlines, may seek to ensure that they do not lose customers. “Saving them is almost always the cheaper and easier option, even if it’s a government bailout,” says Peter Walsh, a managing partner at consultant Oliver Wyman who runs the firm’s manufacturing, transportation and energy business.Some executives believe the government can play a role in fixing the industry. They have lobbied federal, state and local officials to modernise US airports and air-traffic control systems, and aim to convince Washington to ease airlines’ tax burdens. Air-traffic delays cost carriers $19bn last year in excess labour, fuel and maintenance expenses as planes circled crowded airports or sat on gridlocked runways, according to a recent study by Congress’s Joint Economic Committee.Airline executives also argue they should no longer be subject to excise taxes generally levied on luxury items, cigarettes or alcohol. Carriers must pay those fees on the fares they sell, no matter how cheap the ticket or how unprofitable the airline, Mr Walsh says. “Flying airplanes is neither a sin nor is it an addictive substance,” he says. “It’s a commodity business.”Also awaiting a resolution from Washington are potential changes to the rules limiting foreign ownership of US airlines. Liberalising the cap of 25 per cent tops the agenda in the US and European Union “Open Skies” negotiations that opened last month in Slovenia.Removing or raising this cap could give carriers another source of potential capital. Germany’s Lufthansa bought a 19 per cent stake in JetBlue Airways, a low-cost US carrier, earlier this year, and Air France-KLM weighed making an investment in Delta while its transcontinental ally negotiated its merger with Northwest.Congress resisted past efforts to change the restrictions, with some members – including Mr Oberstar – concerned that foreign ownership could threaten carriers’ commitment to ferrying military personnel and supplies around the world in times of war. “Why should we let foreign airlines buy up extremely valuable US assets?” Mr Oberstar says. “We’d have to dramatically change the legal structure. And I’m not going to let that occur on my watch.”Mr Kelly, who succeeded Herb Kelleher as Southwest’s chairman last month, is optimistic his industry will rebound. The current challenges of record oil and a softened economy have punctuated what has been a “difficult decade” that began with terrorist attacks and recession and continued with adjustments to heightened security and record congestion at US airports.Most carriers, he says, have shown they can be profitable in more stable times, in the latter half of the 1990s and again in 2006-2007, when the industry enjoyed a fleeting renaissance. As they have in past downturns, the best airlines, large or small, legacy or low-cost, will adjust. “But it takes real resolve here,” he says. “There is not going to be instant gratification. There is very high demand for air travel, and if we can make improvements, demand will be even greater.”Prof Baybars agrees. “Service is not going to go away. Consumers are going to be fine and you’ll have plenty of seats.”But as services are cut, airline executives hope Americans accept they need to forgo a few of those seats, at least until fuel prices stabilise.
19;ALK;Alaska Air Group;2006-05-09T18:07:03Z;US Airways squeezes out $5m quarterly profit;;The rise in airline fares in US east-coast markets was underlined on Tuesday as US Airways reported a quarterly profit driven by sharply-higher revenues.The wave of airline bankruptcies over the past three years has seen the large US carriers withdraw hundreds of aircraft from the domestic market, and given carriers an opportunity to push up fares to counter rising fuel prices.US Airways, formed last year from the merger of its bankrupt namesake and America West, squeezed out a net profit of $5m in the three months to March 31 as it cut costs and lifted average fare levels.The performance surprised analysts, as only Southwest and Alaska had managed a profit in the traditionally weak March quarter.US Airways shares gained more than 8 per cent by midday in New York to reach a record high of $51.59.The old US Airways had struggled through two spells in bankruptcy protection after low-fare rivals such as Southwest, JetBlue and AirTran chewed into its strong position in east coast markets, which attract high levels of premium business passengers.The low-cost carriers are continuing their rapid expansion, but their cost advantage over the so-called legacy carriers has narrowed.The new US Airways is run by the management team at America West, which established a strong low-cost presence in the western US and transferred its strategy to its merger partner and linked the two networks.Revenue per available seat mile – a key industry measure - in the old US Airways’ standalone network rose 27.7 per cent in the March quarter, and by 16 per cent on western-focused America West routes. The performance is expected to continue in the second quarter.While domestic market conditions continue to improve, US Airways is also following the example of rivals by boosting its international network, where fare levels remain relatively high.The airline has forecast a net profit for 2006, but the integration of the two companies is being closely watched as labour and technical problems have blighted other airline mergers in the past.US Airways has transition agreements with its flight and cabin crew to move towards single contract negotiations in the future, though there remains some discontent as staff at the two constituent carriers had very different pay and benefit scales. Ground staff still have to decide on which union will represent them.
20;ALK;Alaska Air Group;2006-04-25T21:00:48Z;Fuel costs force JetBlue to clip wings;;JetBlue on Tuesday said it had scaled back its growth plans as rising fuel costs dragged the low-fare US airline to its second consecutive quarterly loss.The airline plans to sell some aircraft and defer deliveries as it shifts more capacity to short-haul flying from longer transcontinental markets, and will introduce new efforts to cut costs as crude oil pushes above $75 a barrel.The New York-based carrier has captured market share from established rivals with a mix of low costs and high service levels, but has deviated from the industry’s standard business model by introducing 90-seat Embraer 190s alongside its fleet of larger Airbus A320s.Analysts were concerned that the split fleet would push up costs, and the airline’s rapid expansion stumbled at the end of 2005 when it admitted to teething troubles in the introduction of the new aircraft, while soaring fuel prices led it to forecast a full-year loss for 2006.“They have had the advantage of being a low-cost carrier, but there is concern that the gap is waning,” said Matt Jacob, analyst at Majestic Research.Mr Jacob pointed to intensifying competition with Continental Airlines at Newark, though fare levels have benefited from cuts at Delta Air Lines, which overlapped with 70 per cent of JetBlue’s network.JetBlue grew by almost 25 per cent last year, but said that it would cut planned capacity expansion in 2006 from 28-30 per cent to 20-22 per cent.It aims to sell between two and five of its A320s. It will also defer 12 of the A320s due to arrive in 2007-09 until 2010-12. It has 82 Airbus aircraft on order, and will keep its E-190 deliveries unchanged.“We are going to cut our cost and figure out how our average fares can go up a bit,” chief executive David Neeleman said.Capacity cuts by airlines including Delta, Northwest and US Airways have helped carriers push up fares across the US industry, though only Southwest – which has accelerated its own growth plans – and Alaska Airlines managed to record a profit in the first quarter. AirTran, another fast-growing low-fare carrier, reports on Thursday.JetBlue forecast a profit in the second quarter but would still record a full-year loss. The airline reported a net loss of $32m for the quarter to March 31 compared with a profit of $6m in the same period last year.The loss per share of 18 cents was slightly better than analysts’ forecasts, as a 4 per cent rise in passenger yields lifted revenues by 31 per cent to 490m.JetBlue ended the quarter with $419m in cash and investment securities.
21;ALK;Alaska Air Group;2006-04-25T12:31:13Z;Fuel costs force JetBlue to clip wings;;JetBlue on Tuesday said it had scaled back its growth plans as rising fuel costs dragged the low-fare US airline to its second consecutive quarterly loss.The airline plans to sell some aircraft and defer deliveries as it shifts more capacity to short-haul flying from longer transcontinental markets, and will introduce new efforts to cut costs as crude oil pushes above $75 a barrel.The New York-based carrier has captured market share from established rivals with a mix of low costs and high service levels, but has deviated from the industry’s standard business model by introducing 100-seat Embraer 190s alongside its fleet of larger Airbus A320s.Analysts were concerned that the split fleet would push up costs, and the airline’s rapid expansion stumbled at the end of 2005 when admitted teething troubles in the introduction of the new aircraft, while soaring fuel prices led it to forecast a full-year loss for 2006.“They have had the advantage of being a low-cost carrier, but there is concern that the gap is waning,” said Matt Jacob, analyst at Majestic Research. Mr Jacob pointed to intensifying competition with Continental Airlines at Newark, though fare levels have benefited from cutbacks at Delta Air Lines, which overlapped with 70 per cent of JetBlue’s network.JetBlue grew by almost 25 per cent last year, but said that it would cut planned capacity expansion in 2006 from 28-30 per cent to 20-22 per cent, and aims to sell between two and five of its A320s. It will also defer 12 of the A320s due to arrive in 2007-09 until 2010-12. It has 82 Airbus aircraft on order, and will keep its E-190 deliveries unchanged.Capacity cuts by airlines including Delta, Northwest and US Airways have helped carriers push up fares across the US industry, though only Southwest – which has accelerated its own growth plans – and Alaska Airlines managed to record a profit in the first quarter. AirTran, another of the fast-growing low-fare carriers, reports on Thursday.JetBlue forecast a profit in the second quarter but would still record a full-year loss. The airline reported a net loss of $32m for the quarter to March 31 compared with a profit of $6m in the same period last year.The loss per share of 18 cents was slightly better than analysts’ forecasts, as a 4 per cent rise in passenger yields lifted revenues by 31 per cent to 490m.JetBlue ended the quarter with $419m in cash and investment securities.
