;Ticker;Nombre_Completo;Date_Time;Titular;Subtitular;Texto
10;ALK;Alaska Air Group;2011-12-02T19:23:05Z;American Airlines in search of new horizons;;In 2003 American Airlines was on the brink of declaring bankruptcy when it pulled back. After securing substantial concessions from its workers, American said it would not follow its peers into Chapter 11 but would stand behind its obligations.“We are not out of the woods yet,” Gerard Arpey, the then newly appointed chief executive told his staff. “Working with our unions and all of our employees, together we will put American Airlines back on top.”Eight years later, that co-operative approach is in tatters. American Airlines, once the most prestigious brand in aviation, is working its way through the bankruptcy process it fought so hard to avoid and its workers face dramatic cuts to pay and benefits.“Simply put, their strategy didn’t work,” said Adam Pilarski, with aviation consultancy Avitas. “Certainly people said ‘they are honest while the others are all crooks’ but, while that may reserve them a better spot in the afterlife, in practical terms it didn’t help.”Indeed, hobbled by uncompetitive costs, restive employees and a fleet of gas-guzzling aircraft, American continues to lose money, while its rivals, which used the courts to restructure, have returned to profitability.“We fought the good fight,” Tom Horton, the new chief executive of American, said on Tuesday. “We worked honourably to avoid [Chapter 11] but we have to turn the page. Circumstances have changed and we have to make the company competitive.”In bankruptcy, American and its parent company AMR Corporation, will have greater latitude to rewrite labour contracts and tear up leases for older aircraft that are less fuel efficient.American could even move on the offensive, said Will Randow with Citigroup. He notes that on Tuesday shares in US Airways jumped as investors speculated about an eventual tie-up between the two companies.“US Airways has tried to bid for every US legacy airline either inside or outside of bankruptcy,” he said. “Mr Horton is much more open to the consolidation process than his predecessor, and he might even try to make a bid for US Airways himself.”Still, according to Gordon Bethune, who led a turnround at Continental Airlines in the 1990s, bankruptcy is not a panacea. “Bankruptcy will fix your balance sheet and give you a chance. But it won’t fix your company. If you are a shitty company you need to change.”On Thursday morning, Gerard Arpey, the former chief executive of American Airlines, started his new job: partner in Emerald Creek Group, a tiny, Texas-based private equity company that invests in real estate, particularly Californian farm land, writes Jeremy Lemer.The move is a stark change for Mr Arpey, who spent almost 30 years working for American Airlines until abruptly retiring on Tuesday, just as the company entered Chapter 11 protection.Mr Arpey will find at least one familiar face at Emerald Creek. The group is headed by Larry Kellner, former chief executive of Continental Airlines and Mr Arpey’s long-time business rival.In an interview, Mr Kellner said he had made Mr Arpey an off-the-cuff offer to work together some years back but the partnership had actually come together quickly in the last week or so.Mr Kellner, who has a background in real estate, expects Mr Arpey to take to the business quickly.He said: “Real estate is different from running an airline, but I have always believed in working with smart people with great integrity, and that is Gerard.”In the short term, he expects the biggest beneficiaries to be AMR’s competitors. “There will be some migration to Delta Air Lines and United because of the uncertainty at American. Fairly or not, passengers worry about their frequent flyer miles,” he said.Since Tuesday, shares in United and Delta have jumped more than 15 per cent, outpacing the S&P 500 index.Other beneficiaries may include partners such as Alaska Airlines and regional airline operators such as SkyWest, which will be able to provide more of American’s domestic flights if the company uses bankruptcy to jettison restrictive clauses in its labour contracts.But executives expect the global airline industry to benefit broadly as American retrenches. As supply comes down, airlines should be able to take advantage of limited demand by raising, or at least stabilising, prices.“For the industry, the bankruptcy is probably positive because there will be fewer seats flying around. It is one of these bizarre situations where on average this is a pretty good thing,” said Domhnal Slattery, chief executive of Avolon, an aircraft leasing company.JPMorgan predicts that American will trim as much as 10 per cent of its flying, with cuts focused on markets such as Chicago and New York where rivals are strong.Gary Chase, at Barclays Capital, argues that the American bankruptcy filing, and the pain it is likely to impose on workers, may help other airlines cut better deals with their employees.“AMR is the high bar for labour costs among legacy carriers. If the company aggressively moves to reduce those costs, we believe carriers like United and Delta will experience less pressure on their own labour costs,” Mr Chase wrote to clients.But there are reasons for caution. Despite the sobering developments at American, relations between many airlines and their unions remain contentious. Just this month, pilots at United accused management of skimping on training and compromising safety, a claim the airline dismissed as “baseless”.Vicki Bryan, at Gimme Credit, a bond research company, says her peers may be too optimistic about industry prospects, pointing out that American has already launched cuts in fares to maintain market share.“Given AMR’s size and what will likely prove to be a long, messy restructuring process, its bankruptcy could have a prolonged and depressing effect on already precarious industry pricing and profits as travel demand continues to cool,” she wrote to clients.A faltering economic recovery could overturn any modest industry boost from the AMR bankruptcy. Air cargo volumes, widely seen as a leading indicator for passenger demand, have dropped about 5 per cent since June, according to industry figures.“We cannot ignore the facts. Airline data (has) weakened, and may weaken further, while airline news flow has also deteriorated. It is not all bad, but we would say it is definitely less good,” Rob Stallard of RBC Capital wrote in a note to clients.
11;ALK;Alaska Air Group;2011-07-24T18:35:28Z;Customers forced Boeing’s hand on new engine option;737 decision is a watershed for aircraft industry;At the American Airlines press conference to showcase a huge order for aircraft last week, Jim Albaugh, chief executive of Boeing Commercial, joked about sharing the limelight and the contract with his counterpart at rival Airbus.But the smiles and camaraderie could do little to disguise Mr Albaugh’s discomfort. Not only did the company receive a smaller order than Airbus from a traditionally stalwart customer, but to achieve that Boeing was rushed into announcing an upgrade of its popular 737 aircraft.While overshadowed by American’s near-$40bn order, for Boeing and the aircraft industry the 737 decision is a watershed. It gives the US company a chance to recapture ground lost to the Airbus A320 family in the battle for the lucrative short-haul market.The stakes are high. Narrow-body aircraft like the 737 are the workhorses of the global airline industry and analysts predict airlines will order about 23,000 worth almost $2,000bn over the next 20 years.That the move was publicised in such an unusual fashion demonstrates Boeing’s dilemma. For months the company has been mulling whether to add a new engine to its 737 family or redesign them completely.On the one hand, airlines and some leasing companies have pushed the company hard to find a short-term fix to the problem of rising oil prices by selecting existing engine technology capable of reducing fuel burn by about 15 per cent.On the other, the company’s engineering culture has pushed it to look beyond evolutionary improvements and gamble on a revolutionary approach that could lead to much greater fuel savings and allow it to dominate the market for decades.Caught between those two choices, Boeing has delayed, assigning two teams to rigorously assess each option, promising a decision by the end of the year and hoping that its customers would wait.In the end, they have not. Since Airbus, part of EADS, the European conglomerate, launched a re-engined version of its narrow-body last year, the a320neo has racked up well over 1,000 orders, most recently the sizeable commitment from American Airlines. The American order was particularly painful for Boeing. Since 1996 the group has had an exclusive supply arrangement with the airline. Southwest and Alaska are now the only big US airlines flying all-Boeing narrow-bodies.On Wednesday, Mr Albaugh said technology was available to develop a new narrow-body, but added that the company was not sure how to build 40 to 60 of them a month given the complex carbon composites they would likely require. “Quite frankly, we did not have those answers,” Mr Albaugh said. “And the longer it took to get that answer the more concern we got from our customers about the fact that they needed a more fuel efficient airplane now rather than later.”Still, observers argue Boeing has probably, belatedly, made the right choice. Once Boeing has completed its designs and received board approval, it will have a product to push back against Airbus. The re-engined 737 will enter service with American in 2018.“The only sorry thing about it is that Boeing didn’t wake up in time and messed its customers around for six months,” says Sash Tusa, with Echelon in London.Analysts estimate that developing the upgraded aircraft should cost up to $3bn. Conversely, developing an all-new aircraft could have cost more than $10bn, a huge sum for a company already investing in other programmes. At the same time, Doug Harned, with Bernstein Research, argues that a re-engined 737 will squeeze out new entrants to the narrow-body market, such as the CSeries produced by Bombardier of Canada, who have been nipping at the heels of Airbus and Boeing.Mr Albaugh says the company is already in discussions with partners and expects “quite a number of orders for whatever we call this re-engined 737” once it launches in the autumn.But Robert Stallard, with RBC Capital, argues that Boeing may regret its decision over the long term.“A completely new narrow-body, with [potentially] twice the efficiency savings of the Neo, would probably have been a big threat to Airbus post 2020. Instead, we have status quo at best – as we doubt Airbus will be content to stop with American,” he wrote.
12;ALK;Alaska Air Group;2011-07-21T18:05:03Z;US airlines hit by high oil prices;;High oil prices, volatile demand and the impact of the Japan earthquake dented second-quarter earnings at US airlines, but the carriers remained profitable as travellers continued to pay higher prices in order to take to the skies.United Continental Holdings, US Airways and Alaska Airlines all reported lower second-quarter earnings on Thursday, but higher yields – a rough measure of average ticket prices – helped offset surging fuel costs.United Continental Holdings, parent company of the merged United and Continental Airlines, said that net income slipped slightly to $538m, or $1.39 per share, from $611m in the same quarter a year earlier on revenues that rose about 10 per cent to $9.8bn.Meanwhile, US Airways said that net income for the second quarter dropped to $92m, or $0.49 per share, from $279m, or $1.41 per share, in the same period in 2010. Revenues rose 10.5 per cent to $3.5bn.Alaska Air Group, which runs Alaska Airlines, said that second-quarter net income fell to $28.8m, or $0.78 per share, compared to $58.6m, or $1.60 per share, in the same period in 2010. Revenues climbed 13.7 per cent to $1.1bn.In midday trading, shares in United Continental and Alaska Air were broadly flat at $20.34 and $65.81 respectively, while US Airways slipped about 2 per cent to $6.79.Scott Kirby, president of US Airways, said that, after a bumpy few months, underlying demand appeared to have stabilised and, with capacity set to decline towards the end of the year, airlines should be able to raise prices.“If you had a European sovereign default or that turned into a Lehman-like crisis then all bets are off the table or a US default, but absent an event like that … my guess is there’s probably more upside than most think right now in their base forecast,” Mr Kirby said.While Jeff Smisek, chief executive of United Continental, told investors: “We’re operating in a tepid economic environment in the US with significant uncertainty here and abroad.“[But] we have responded appropriately, raising fares in the face of high fuel costs and reducing our planned capacity to reflect the challenging environment that we face.”On Thursday, the company said it would further trim capacity in the fourth quarter.Mr Smisek said that the integration of United and Continental, which completed a $3.5bn merger last October, was progressing, but admitted that the company was not likely to reach a new deal with its unions this year, as previously predicted.Analysts are expecting a steady if unspectacular earnings season. Michael Linenberg at Deutsche Bank predicts sales at the largest US airlines will rise about 14 per cent to $35.3bn compared to last year, but pre-tax profits will slip 38 per cent to about $1.3bn.Mr Linenberg argues that airlines have been able to pass on higher fuel costs – although recent fare momentum has stalled – but he expects other items such as labour to eat into margins, trimming them to about 6.3 per cent from 10 per cent in the second quarter of 2010.On Wednesday, American Airlines reported a second-quarter loss but the figures were overshadowed by news that the carrier would place a huge aircraft order. American executives suggested they had stolen a march on their competitors by locking up production slots for new aircraft.But executives at United Continental said on Thursday that the order would have little impact on their airline and might even prove beneficial because it had encouraged Boeing to announce a long-awaited plan to re-engine its best-selling 737 aircraft in the next few years.“We are comfortable with the skyline that we have and the availability of the skyline,” Mr Smisek said. “We are more than happy to compete against American and anyone else with our network and our fleet and our product and our people.”
13;ALK;Alaska Air Group;2011-01-31T15:21:17Z;US airlines;Taking off again, but there may be turbulence ahead;After a horrible 2009, US airlines have surged back. American Airlines, Delta Air Lines, Southwest Airlines, United Continental and US Airways have all reported either jumbo profits for 2010, or significantly narrowed losses. And the good times look set to continue. Barclays Capital expects the US airline industry to earn about $9bn in operating profit in 2011, slightly higher than last year’s record.The bad news is that one key cause of the profit boost is not likely to last long. This reporting season, chief executives have been quick to thrust their capacity management capabilities into the limelight. The industry’s revenue per mile rose almost one-third in the past 12 months as 82 per cent of seats on North America’s planes carried paying passengers. That is a higher proportion than in any other region in the world, according to the International Air Transport Association, and was enabled by last year’s meagre 3.5 per cent increase in capacity, measured in available seat kilometres.However, limiting supply growth to drive ticket prices up and costs down creates a prisoner’s dilemma. There are short-term profits to be made by being the first to add seats on busy routes. In this super-competitive industry the temptation will be too great to resist, sooner rather than later.Even before then, fuel price inflation could slash profits. The economic recovery is gradual but – even before Egypt took the headlines – the price of oil has been rising fast. Morgan Stanley estimates that with jet fuel at $120 per barrel (up from the current $110), Delta could lose one-third of its net earnings, United and American more than half, and US Airways significantly more. The least worst off – a 14 per cent drop – would be Southwest and Alaska Air. The latter of these two trades below its peers yet has a robust earnings outlook. For investors who insist on owning airline shares, there appears to be value in the Arctic.E-mail the Lex team in confidence
14;ALK;Alaska Air Group;2009-07-26T21:19:25Z;Flying far and wide on the back of airline loyalty;;Another day, another flight. As sales director for Rearden Commerce, a start-up in Foster City, California, Mike Lawrence flies 100,000 miles a year but admits that since the recession, his travel is under greater scrutiny. “Not so much on whether I need to go to a different city for a meeting, but making sure I opt for the lowest cost in all areas of travel – air, car, hotel, dining, parking. All of it matters now,” he says.Yet Mr Lawrence still makes sure he chooses the same airline when possible. “Frequent flyer programmes have always been very important in influencing my choice. With Alaska Airlines, my Gold status means I get automatic upgrade to first class in most cases, better seats if not, pre-boarding, double miles – even a complimentary cocktail even if I’m in the back.”If you are lucky enough to still be in a job with an employer willing to pay your airfare, there has never been a better time to be a frequent flyer as under-pressure airlines slash the miles required by their loyalty programmes for redeeming free flights or doubling the miles that count towards “elite” status.But there is also another reason: frequent flyer miles sit heavily on an airline’s balance sheet as liabilities, until they are redeemed. So, it is little wonder that carriers are giving away more frequent flyer seats than ever. At Delta, the world’s biggest airline, the number of miles earned by customers annually over the past three years has grown 25 per cent, says Jeff Robertson, the company’s vice-president of loyalty programmes.Mr Robertson is behind perhaps this summer’s biggest promotion. Until the end of this year, passengers can earn double frequent flyer miles for all Delta and Northwest flights and in all classes of service. Flyers must hold a Delta SkyMiles credit card to earn the bonus miles, but the tickets do not have to be charged to the card.Other airlines, including American, United, Qantas and Jet Airways have been offering a raft of new deals to members of their loyalty programmes.Is the tactic working? There is some evidence that travellers are using miles now because they are cash strapped – or because they expect troubled airlines to increase reward levels in the coming months.But in this recession, the real value to airlines of loyalty programmes lies in their ability to generate cash rather than loyalty. “Frequent flyer programmes no longer serve to drive brand loyalty alone, but rather to deliver extra cash, mostly through the sale of miles to card-issuing banks,” says Jay Sorensen, a former Midwest Airlines executive and now president of IdeaWorks, a consulting firm.At Delta alone, Mr Robertson says the SkyMiles and WorldPerks programmes are expected to generate more than $2bn (€1.4bn, £1.2bn) in revenue in 2009. United and Continental each raised cash last year from the advance sales of miles to their card partner, JPMorgan Chase.“Tough economic times have encouraged airlines to rely upon this kind of short-term gratification,” says Mr Sorensen, who reckons that when investor confidence returns some of the biggest airlines will try selling off their programmes.Until then, some carriers are trying to generate extra income from loyal customers through charges for priority treatment, such as faster security screening, upgrades and even the processing of miles award tickets.“The most enduring effect of the recession will be the nuisance fees now associated with the loyalty programmes” says Tim Winship, publisher of the FrequentFlier website. “The airlines are imposing them in a desperate attempt to shore up sagging revenues, and they won’t be rescinded in the foreseeable future.”“Frankly, with all the new fees and less capacity and fewer first class upgrades available every day, I’d just be happy to keep things where they are,” says Mike Lawrence, as he prepares for his next flight. “It’s a bit of a lame wish, but with everything happening in travel these days, I’d consider that to be a big step forward.”
15;ALK;Alaska Air Group;2009-07-09T20:39:29Z;Virgin America plans shake-up;;Virgin America, the carrier founded by Sir Richard Branson, is seeking US approval for a new slate of domestic investors it expects will end a rival’s bid to challenge the company’s ownership structure.Under the plan submitted to the Department of Transportation, the airline would receive new capital from a group of investors that includes Cyrus Capital Partners, people familiar with the matter said. Cyrus, a New York hedge fund, was one of Virgin America’s original shareholders.Virgin America began service in 2007 after a battle in Washington over rights to operate domestic flights and its ties to Sir Richard’s Virgin Group, which owns 24 per cent of the US airline.Alaska Airlines, which competes with Virgin America on routes to Seattle and other west coast cities, has questioned the carrier’s “US citizenship” and petitioned transport regulators in February to investigate its ownership structure. Federal laws cap foreign ownership of domestic airlines at 25 per cent.“This is a meritless petition,” Virgin America said at the time. “Nothing has changed in our ownership structure, which was approved by the DoT.“Should our ownership structure change in the future, we will of course notify the DoT in advance, so they can confirm our continuing compliance.”Alaska’s petition came as Black Canyon and Cyrus, Virgin America’s two US shareholders, exercised an option to recall their $150m investment in the company.Virgin America had hired Lazard, the investment bank, earlier in the year to recruit new domestic investors.The new round of capital may be less than $150m, reflecting the steep falls many US airline stocks have endured as demand slumped. Shares of Delta Air Lines, the world’s largest carrier, have lost half their value since the start of the year.People familiar with Virgin America’s structure note that its agreement with the DoT enabled it to keep Black Canyon and Cyrus as stakeholders and remain in compliance with foreign-ownership rules even if the two firms recalled their capital.Virgin Group plans to transfer the two firms’ stakes to its new US investor group once the structure plan is approved.By May, Virgin America was in talks with at least five US funds. Virgin America and Cyrus did not return calls.
