;Ticker;Nombre_Completo;Date_Time;Titular;Subtitular;Texto
34;ADSK;Autodesk Inc;2009-05-22T20:37:46Z;US stocks sell off ahead of long weekend;;"US stocks ended a week of modest gains on Friday after optimism from home improvement retailer Lowe’s on Monday triggered a rally which fears over the
US credit rating failed to extinguish.Reassuring words from Moody’s on Friday helped calm fears of an imminent downgrade for US sovereign debt as the ratings agency said it was “comfortable” with the triple A rating.But equities suffered a late sell-off to take the markets to a fourth consecutive session of losses as investors repositioned themselves ahead of a three-day weekend.The market was also hampered by the failure of BankUnited, Florida’s largest bank, and the largest US bank to fail this year.But the falls came in spite of several pieces of pieces of positive earnings news.Sears, the largest US department store chain, jumped 10.4 per cent to $55.40 after reporting a surprise profit and far exceeding analysts’ expectations.The company cut costs faster than Wall Street had thought and increased its profit margins.It also said it had been able to extend a credit agreement to increase the amount that it can access to $4.1bn.Gap, the clothing company, beat its own forecasts by a single cent after also successfully cutting costs.It saw slower declines at its Old Navy line, although there was weakness from the more upmarket Banana Republic brand. Its shares rose 2.6 per cent to $16.39.The benchmark S&P 500 index, the Dow Jones Industrial Average and the Nasdaq Composite index all fell 0.2 per cent. The S&P finished at 887, the Dow at 8,277.32 and the Nasdaq at 1,692.01 That left them in line for weekly advances of between 0.6 and 1.5 per cent.Randy Frederick, director of active trading at Charles Schwab, said a quiet day with low volumes had seen equities drift ahead of the Memorial Day weekend. “There has got to be a reason for the market to go higher, especially after a 30 per cent rally, and I don’t see any reason for that today,” he said.Brett Hryb, senior portfolio manager at MFC Global added: “Nobody wants to be particularly long or short going into a long weekend.”Campbell Soup was another household consumer name to report its results after the market closed on Thursday, beating predictions with its profit, which was boosted by higher prices. Its shares rose 2.1 per cent to $27.35.Meanwhile, Autodesk, the engineering software company whose chief executive Carol Bartz left to take over at Yahoo this year, reported higher profit than expected but said it would make more job cuts as the recession continues to bite. Its shares climbed 9.9 per cent to $20.70.Johnson & Johnson ended 0.4 per cent lower at $54.77 after announcing that it would spend nearly $1bn on acquiring its smaller rival Cougar, which develops cancer drugs. Cougar jumped 15.8 per cent to $42.82.General Motors had a turbulent day. Its shares rose in early pre-market trade on optimism over the price that it could get for Opel, its European business, after China’s Beijing Automotive Industry Corp entered the bidding for the company.They then fell back shortly before the bell after the Washington Post reported that the government could force the company into bankruptcy as early as next week. Later reports denied that the government had any such plans, however, quoting unnamed sources.This sent the shares up sharply in early trade but they then slumped again as bondholders rejected the company’s latest restructuring proposals and the Canadian Auto Workers said it was very likely GM would file for bankruptcy.Its shares closed down 25.5 per cent at $1.43, having earlier hit $2.24.Friday’s falls capped two weeks during which stocks have struggled for momentum, falling 2.3 per cent, amid suggestions the rally that began in March may have stalled."
35;ADSK;Autodesk Inc;2009-02-27T00:29:03Z;Yahoo finance chief departs in reshuffle;;Yahoo, the internet company beset by a raft of executive departures, on Thursday announced a new management structure under Carol Bartz, its recently appointed chief executive.The much-anticipated news came as Yahoo also revealed Blake Jorgensen, its chief financial officer, would be the latest member of top management to leave.Ms Bartz, who took over from Yahoo co-founder Jerry Yang six weeks ago, took a similar approach of clearing out executives and reorganising at her previous company – software maker Autodesk. However, there had already been a heavy bleeding of executive talent from Yahoo under Mr Yang.In her first entry on the corporate blog, Ms Bartz explained the need for change: “There’s …plenty that has bogged this company down. For starters, you would be amazed at how complicated some things are here,” she said.“So today I’m rolling out a new management structure that I believe will make Yahoo a lot faster on its feet.”Yahoo’s “notorious silos” were gone, she said, without giving details. A Yahoo spokesperson later explained the company’s Tech and Products groups were being combined in a single Products division run by Ari Balogh, chief technology officer. Yahoo would also be organised under two regions – North America and International, compared to four in the past.Yahoo has often been criticised for slowness in its execution and taking decisions. Allen Weiner, analyst at the Gartner research firm, said the changes should mean a more efficient operation.“There will be people in mobile and product development who report directly to Carol whose butts will be on the line. The level of accountability is going to be significant,” Mr Weiner said.In a separate regulatory filing, Yahoo said Mr Jorgensen would be leaving the company and a search for a chief financial officer had been initiated.Mr Jorgensen joined Yahoo from Thomas Weisel Partners in June 2007 and was close to Sue Decker, Yahoo’s president.Ms Decker had been the top internal candidate for the chief executive job, but the company announced at the time of Ms Bartz’s appointment that she would be leaving Yahoo.Yahoo shares rose 50 cents or 4 per cent to close at $12.98 in New York on news of the reorganisation.www.ft.com/techblog
36;ADSK;Autodesk Inc;2009-02-25T23:55:46Z;Intel wants smarter stimulus tools;;Intel, the world’s biggest chip maker, is warning that companies taking advantage of government stimulus packages to build future infrastructure and transportation projects are relying on tools of the past that waste energy and cost more.Speaking at the Cleantech Forum in San Francisco, Sean Maloney, Intel executive vice president, urged the adoption of 3D simulation software to improve design and implementation.“Unless we move now, a lot of that [stimulus] money is going to get spent using techniques that were more appropriate to the 1980s and 1990s than now,” he said.“[Government] money would be spent far more efficiently with the maximum use of simulation and a coincidental benefit is energy reduction.”Mr Maloney, who also sits on the board of 3D computer-aided design software maker Autodesk, said 80 per cent of architects and engineers were not aware how computing performance had increased enough for them to trade in their 2D software packages for 3D ones that would work on cheaper, faster machines.He gave a number of examples in traditional manufacturing, construction and transportation industries – 3D modelling replacing physical prototypes of vehicles, designing buildings in 3D that revealed greater energy savings and computing power being brought to bear on building and running a new high-speed train network in China.On the energy theme, he urged the government to mandate instantaneous feedback on fuel consumption, citing the display in a Toyota Prius which shows fuel consumption and power sources being used. He also showed a software widget that could be brought up on a TV screen showing energy use within a home.Mr Maloney joked Intel was demonstrating “enlightened self-interest” in lobbying for smart technologies – it would ultimately help it sell more of its microprocessors.The US Congress has passed a $787bn stimulus package and other governments are also boosting spending on infrastructure to revive their economies. Technology companies like Intel are hoping some of the funds will trickle down to their businesses.
37;ADSK;Autodesk Inc;2009-02-23T23:48:07Z;Yahoo executive departs ahead of shake-up;;Yahoo has suffered the loss of a top executive ahead of an expected management reorganisation under Carol Bartz, its new chief executive.Hearst Corporation, the media company, said on Monday it had hired Neeraj Khemlani, 38, head of Yahoo’s news and information division.Mr Khemlani will take up the post of vice-president and special assistant to the chief executive for digital media on March 23.Ms Bartz, 60, who was appointed Yahoo’s chief executive last month, is on the verge of announcing a management shake-up, according to reports, although Mr Khemlani’s departure is thought to be unrelated to her plans.When she took over from Jerry Yang, Yahoo co-founder, six weeks ago, the former chief executive of the software company Autodesk said she would not need much time to get to know the company.“I see the company as one with enormous assets that frankly could use a little management,” she said.According to an internal memo, published by the All Things Digital blog on Friday, Ms Bartz said this week would be a “biggie”, prompting speculation about a reorganisation of the internet company.Yahoo said the company did not comment on rumours or speculation.However, a person close to Yahoo said it was logical that a new chief executive would want to restructure the company. No final decisions had been made and the situation was fluid, the person said.The Bloomberg news service reported on Monday that Ms Bartz had commissioned searches for several high-level executives amid a management shuffle, citing a ­person familiar with the matter.Mr Khemlani’s departure may have prompted a rethink of Yahoo’s news and information division, where he was in charge of the news, technology, weather and education services as well as the editorial programming for finance.He also directed original content programming and oversaw content deals with big media companies.Hearst said in a statement he would be responsible for promoting and co-ordinating “digital content transformation” across the corporation, which includes 16 daily and 49 weekly newspapers, nearly 200 magazines and 29 television stations.Yahoo had suffered an exodus of top executives under Mr Yang as it lost market share in the search business to Google and was distracted by a bid from Microsoft for the company.“Yahoo has been battered in the last year …More than anything, let’s give this company some friggin’ breathing room,” said Ms Bartz on her appointment.
38;ADSK;Autodesk Inc;2020-04-25T03:00:02+0000;Carol Bartz, Yahoo’s $20m-plus woman;;"Whatever you think about Jerry Yang, he was at least cheap. During his 18 months or so as Yahoo CEO he earned approximately $1.50. In fact, if you consider what’s happened to his 4 per cent stake in the company, his wealth actually decreased by around $750m.So what is there to make of Carol Bartz’s much more lucrative package?According to a filing on Thursday, the new boss will get a $1m annual salary and a target bonus of $2m, rising to $4m if she excels. On top of that is an $8m restricted stock award and another $10m to compensate her for various benefits she loses by giving up her job at Autodesk (this is not the kind of payment that corporate governance purists look too kindly on, but a reality of the CEO job market nonetheless.)She will also get options over another 5m shares. Some of those will only be exercisable if Yahoo’s stock price rises a lot from here. But with the stock currently in the dumps, she could stand to make a killing. For instance, if Yahoo gets back even to where it was before Microsoft made its takeover bid last year – a level that at the time was considered to be depressed – she could net another $37m.Will she be worth it?Certainly, the deal bears comparison with the one handed to another executive brought in to save a Valley icon: Mark Hurd at Hewlett-Packard. His package included $8.7m of restricted stock (plus options that are now showing a profit of $6m) for giving up his job at NCR; a “relocation bonus” of $2.75m for moving from the Midwest to sunny California; annual salary and target bonus of $4.2m; and options over a further 700,000 shares.Noone has been heard complaining lately that Mr Hurd is overpaid.And look at it this way: Terry Semel made nearly $72m in 2006, making him the highest-paid executive in the S&P 500 and drawing angry protests from shareholders. The largesse shown by Yahoo’s board to its new CEO certainly sounds more reasonable than that.It’s all down to Ms Bartz. Revive Yahoo, and she will be seen as value for money. Failure, though, would make her seem a very high-priced luxury."
39;ADSK;Autodesk Inc;2009-01-14T09:42:27Z;Yahoo’s new chief;;"Indifference is not the most auspicious start. On Tuesday the market pushed shares of Yahoo down 1 per cent on the news that Carol Bartz will be filling the chief executive’s chair. Given that its shares are already at a third of the group’s late 2007 peak, the reaction was the investment equivalent of a Gallic shrug.The reason is that after two months of searching for a successor to Jerry Yang – who returned to lead the company he founded only to commit a $28bn faux pas by failing to sell up to Microsoft last year – Yahoo is making a safe but uninspired choice. The 60-year-old Ms Bartz, who has a background in sales, was regarded as a capable operator while running the commercial software company Autodesk. A selection of directorships at other high-profile technology companies also indicates that she is a Silicon Valley fixture.Familiarity with Yahoo’s top table also suggests continuity. Ms Bartz sits on the Intel board along with Yahoo’s president, Sue Decker, and will know Mr Yang from Cisco meetings. Like Yahoo’s share price, expectations for 2009 earnings have also plummeted in the past year, indicating that more of the same is insufficient. Yahoo is structurally disadvantaged in internet search compared with its competitor Google (while Microsoft arguably has better technology). Yahoo’s display advertising business needs both restructuring and a clear vision for its future.Still, the potential for visionary leadership to make a difference at a struggling company should not be overstated. AOL, the internet millstone around Time Warner’s neck, has defeated a succession of different executives. Mr Yang’s biggest failure at Yahoo was an inability to make decisions, set targets and hold people’s feet to the fire. If Microsoft intends to return to cherry-pick the best of Yahoo’s assets, an ability to bash what’s left into shape is exactly what Yahoo needs.To e-mail the Lex team confidentially click here
OR
To post public comments click here"
40;ADSK;Autodesk Inc;2009-01-14T00:35:22Z;Wall St lukewarm as Yahoo hails new chief;;Yahoo appointed software veteran Carol Bartz as its new chief executive on Tuesday, an appointment viewed by Wall Street as safe but unspectacular.Ms Bartz, 60, takes up the position immediately. She was previously executive chairwoman of Autodesk, a design software company that she led as chief executive for 14 years, and is a board member of Intel and Cisco Systems.Reports of her appointment sent Yahoo shares 1 per cent lower by the close in New York at $12.10.The software company also announced that Sue Decker, its president and the chief internal candidate for the job, would resign after a transitional period to pursue other challenges.Roy Bostock, Yahoo chairman, said Ms Bartz would lead Yahoo into its next era of growth.“She is the exact combination of seasoned technology executive and savvy leader that the board was looking for,” he said. “She is admired in the Valley as well as on Wall Street for her deep management expertise, strong customer orientation, excellent people skills, and firm understanding of the challenges facing our industry.”Wall Street analysts were more circumspect. “We think she would be a solid choice as Yahoo’s new chief executive, but we are concerned about her apparent lack of professional experience with internet companies and online advertising,” said Scott Kessler, analyst at S&P’s equity research.Mark Mahaney, Citigroup internet analyst, said she had been a highly effective chief at Autodesk, helping it to grow into a $4bn (£2.7bn) company. He said she would bring organisational skills and “substantial technology industry experience”, but added that she lacked media industry experience.That was something that the previous outsider to be appointed chief executive – Terry Semel – possessed in abundance, but Yahoo is seen to have fallen behind operationally during his tenure as it lost market share in the search arena to Google.Jerry Yang, Yahoo’s co-founder, replaced Mr Sempel as chief executive in 2007. Ms Bartz will take over with the company facing low single-digit growth in internet advertising in 2009 and its rival Microsoft still interested in picking up its search business after it walked away from a full takeover bid last year.
41;ADSK;Autodesk Inc;2009-01-09T22:29:43Z;Yahoo closer to new CEO;;Yahoo has moved a little closer to naming its new chief executive, with at least two of the three candidates on the shortlist being women, according to reports.People close to the situation had been guiding us to expect an announcement around the end of January on who will succeed Jerry Yang, but they now say it may come just ahead of Yahoo’s fourth-quarter results, scheduled for January 27.Bloomberg reported today that Carol Bartz, (pictured) former chief executive of the design software company Autodesk, was one candidate, along with Sue Decker, Yahoo president, and another executive, whose identity has yet to emerge.Arun Sarin, former Vodafone chief, withdrew from the running last month.Steve Ballmer, Microsoft chief executive, told us at CES this week that the current management transition represented a good opportunity for a search deal to be struck with Yahoo.
42;ADSK;Autodesk Inc;2008-09-17T21:47:06Z;Oracle earnings stress sector’s dollar woes;;When Oracle, the world’s second biggest software company, reports its latest earnings on Thursday, it will highlight an inconvenient truth for the US technology industry: the big lift the sector has had in recent years from the weakening US dollar is over, at least for now.In its fiscal year to the end of May, roughly a quarter of Oracle’s reported revenue growth came from foreign currency translation effects, as the falling dollar increased the value of its overseas sales. Given their strong position in large parts of the global technology market, many other US tech companies have seen similar lifts from their big overseas positions.Currency adjustments have contributed nearly half of the revenue growth at software makers Symantec and Autodesk in the first half of this year, according to an analysis by Citigroup.A bounce in the dollar since July, particularly against the euro, has put at least a temporary end to that benefit, just as tech companies are bracing for a downturn in demand due to the weakening economy.Adobe, another big software concern, said this week that, in its most recent quarter, foreign currency adjustments had actually depressed its reported revenue slightly compared with the preceding three months, the first time for several years currencies have not provided a tailwind.Since Wall Street generally looks at year-to-year growth rates rather than quarter-to-quarter, the full impact of the stronger dollar, if it holds, will not be felt until next year. However, the dollar bounce will also have an immediate impact in at least two ways.For fast-growing companies whose growth is judged on a quarter-to-quarter basis, the currency tailwind of recent quarters will turn into an immediate headwind. That is still the case with Google, at least when it comes to the “whisper number” that Wall Street uses each quarter to assess the company’s earnings, said Sandeep Aggarwal, an analyst at Collins Stewart.“It is significant for Google,” Mr Aggarwal added. “It is a trend reversal, after 10 quarters of positive impact.” Foreign currency earnings have helped to support Google’s growth rate as it has hit the inevitable slowdown that comes with reaching massive size.Revenue growth in the second quarter fell to 43 per cent from 63 per cent a year before, but would have slumped to 36 per cent had it not been for a weaker dollar.A second immediate effect will come as Wall Street analysts start to revise their earnings forecasts for next year to reflect the new exchange rates.
43;ADSK;Autodesk Inc;2008-06-25T03:43:09Z;Mentor stumbles in Flomerics bid;;Mentor Graphics, the US electronic design specialist listed on Nasdaq, has reported a fall in the level of acceptances for its hostile bid for Flomerics.At the second closing date on Tuesday it had received acceptances for a further 2.19 per cent of the shares in the Aim-listed engineering software company. On the first closing date on June 9 it had acceptances for 2.44 per cent of the shares.Earlier this month, Flomerics identified a potential rival bidder in Autodesk, another design software group listed on Nasdaq. Autodesk, which has a market capitalisation of about $9.3bn (£4.7bn) and annual sales of $2.2bn, has been in preliminary discussions with Flomerics for several weeks.The closing date for Mentor’s bid, which values Flomerics at £25.5m, is July 2. The group is offering 104p in cash plus the final dividend of 1.6p. It started building a stake in early March, buying a 20.1 per cent holding from Pricap, the largest shareholder, at 50½p a share.Flomerics shares closed unchanged at 105½p.● Meanwhile, Mentor is facing a bid from Cadence Design Systems, a bigger Nasdaq-listed rival. Last week Cadence, which has a market capitalisation of $2.7bn, offered $16 a share in cash for Mentor, a 30 per cent premium that valued the target at $1.6bn.Flomerics said Cadence’s unsolicited proposal valued Mentor at about 1.8 times historic revenues, and had been dismissed by Mentor as “insufficient to support a transaction”.The board said shareholders should reject the Mentor approach for the same reason, as its offer valued it at 1.2 times historic revenues.Mentor said that it deserved a healthy premium as it was profitable and had a good track record.In contrast, Flomerics was making losses on turnover from continuing operations of £14.6m. Mentor also pointed out that, before it appeared on the scene, Flomerics was worth just £11.6m.
44;ADSK;Autodesk Inc;2008-06-06T18:05:21Z;Flomerics holds talks with new suitor;;Flomerics, the Aim-listed engineering software company facing a hostile bid from Mentor Graphics of the US, has identified a rival potential bidder in Autodesk.The company has been in preliminary discussions for four weeks with Autodesk, a design software group listed on Nasdaq. It has a market capitalisation of $9.3bn (£4.7bn) and annual sales of $2.2bn.The news added 5½p to shares in Flomerics, which closed yesterday at 112½p.Mentor, also a Nasdaq-listed electronic design specialist, is offering 104p in cash plus the final dividend of 1.6p. The company is much smaller than Autodesk, with a market capitalisation of about $1.1bn.The first closing date for its bid is on Monday. Mentor said its offer remained the only one available. “It is in cash and offers good value. Shareholders should not be distracted by the unconfirmed possibility of other bidders who may or may not table a rival offer.”Mentor’s bid values the equity in Flomerics at £25.5m. It started building a stake in early March, buying a 20.1 per cent holding from Pricap, the largest shareholder, at 50½p a share. It now has just under 30 per cent.Flomerics, which recently celebrated its 20th anniversary as an independent company, has consistently urged shareholders to reject the offer.
