;Ticker;Nombre_Completo;Date_Time;Titular;Subtitular;Texto
0;ADSK;Autodesk Inc;2018-06-17T09:00:25Z;The digital future is female — but not in a good way;Gorgeous, subservient fembots are on the march;"Last week I got a glimpse of the very near future that I did not like at all.It was London Tech Week, an event blurbed as a “festival of tech and innovation” that lured thousands of people to an exhausting slew of conferences, dinners and parties across the city.First, I went to a talk on Monday at Trainline, an online rail booking company I am partial to because it has a website that is remarkably easy to use and a boss named Clare Gilmartin who was the first chief executive I ever came across who had taken on the job when six months pregnant.The event was billed as a chance to hear “the real reason there aren’t enough women in tech”. I expected the usual gripes about the dearth of female science students, too few female role models and too many female-unfriendly tech companies.What I did not expect was the news that some things are getting worse. Women had just 12 per cent of the programming and software development jobs held by IT and telecoms professionals in the UK last year, down from 15 per cent in 2007, said Amali de Alwis, head of an outfit trying to get more women into tech jobs. In the US, the share of women in computing jobs slid from 36 per cent in 1991 to around 25 per cent in 2016.It is not entirely clear why this is so, but those numbers were on my mind the next day when I went to CogX, a tech fest devoted to artificial intelligence and other advancing technologies.That is where I came across Ava, a “digital human” who takes the idea of the virtual assistant or chatbot to a new and unsettling level.Unlike Apple’s Siri or Amazon’s Alexa, who can bark at you from a speaker but are otherwise faceless nobodies, Ava looks and more or less talks like a person on your computer screen. She has just been rolled out by Autodesk, a US design software company, where she is the face of customer support for the thousands of architects and engineers who use the firm’s products worldwide.She has sisters on the way. This year, the Daimler car company and NatWest bank said they were working with the same company behind Ava (New Zealand’s Soul Machines) to deliver their own lifelike digital female helpers. All are polite, helpful and in Ava’s case, strikingly gorgeous. In other words, they are precisely the sort of bots one might expect from a tech industry dominated by men.At CogX, however, I discovered the person who had ushered Ava into the world at Autodesk was a 30-year-old woman named Rachael Rekart, director of machine assistance.She told me nine of the 13 people on her team were also women and one of the first things she did when she took on the job of delivering Ava in 2016 was to make her a female too. (An earlier version was a digital man called Otto.)Ms Rekart had heard all the arguments about servile female bots perpetuating dodgy stereotypes in an industry where women are already marginalised. She knew about the survey this year showing only 8 per cent of Americans could name a single female tech leader, and a quarter of those that could named Siri or Alexa.Yet for her, the new breed of artificially intelligent women such as Ava embody female empowerment.“This is the next new revolution in technology,” she said. “They can think faster than us and learn faster than us. Why should they be male?”Ava can solve 2,300 cases a day compared with a human’s paltry 25, and she can do each one in under five minutes while the human workforce takes an average of 1.5 days. She is so good that Autodesk’s human customer support staff are using her to help speed up their own work. And she is, by the way, non-white even though research suggested the company’s typically white male customers would have preferred a Caucasian.I can see all this but I still find the looming army of digital female aides depressing. As Ms Rekart says, research shows people find female voices more “helpful and collaborative”. So Ava and her subservient ilk may well be the face of much of our artificially intelligent future. But if I had a daughter, that is not the sort of future I would ever want to see her joining.pilita.clark@ft.com
Twitter: @pilitaclark"
1;ADSK;Autodesk Inc;2018-05-25T00:28:23Z;Autodesk: celestial being;Software company’s high valuation rests on a smooth transition to the cloud;Praise the cloud. Autodesk, a US software company which used to make profits and now does not, has seen its market value triple in just over two years to $30bn. A venerable computer-aided design company, Autodesk had been profitable for 30 years until 2016. Then it stopped making money, revenues fell, too — and it was rewarded with a jump in valuation.First-quarter results show more losses. Revenues are now back to growth — up 18 per cent year-on-year to $531m — though hardly great shakes for the sector and still lower than they were in 2015. The shares dipped on a slightly disappointing outlook, but put that in context: since Autodesk started making losses, its enterprise value has gone from five to 15 times sales.The reason is “The Transition”, a phrase uttered a dozen times on the conference call. The switch in business model from licensed software to subscriptions sold and delivered via the cloud has helped Microsoft regain its poise as one of the world’s most valuable technology companies and allowed Adobe Systems’ market value to rise 400 per cent in four years.Yet Autodesk is perhaps more remarkable. Neither Adobe nor Microsoft saw steep revenue declines. Investors in Autodesk, backed by positive analyst ratings, have placed a lot of faith in the idea that customers will, over time, pay more for subscriptions than licences.There are specific secular trends that help: manufacturing and construction industries are turning to design software. Autodesk was also vulnerable to piracy, given the high price of its software. Once it moves to subscriptions, that should be eliminated.Subscription growth, though, is decent rather than spectacular at 16 per cent year-on-year. Anyone who wants firm reassurance should look to the annualised recurring revenue number. ARR for subscriptions doubled to $1.4bn in the quarter. The pace had better continue. A sky-high valuation rests on faultless transition to the cloud.Lex recommends the FT’s Due Diligence newsletter, a curated briefing on the world of mergers and acquisitions. Sign up at ft.com/newsletters.
2;ADSK;Autodesk Inc;2016-02-23T10:17:55Z;Mattel’s updated ThingMaker aims to mould future manufacturers;How a toy could make 3D printing easy for children and parents;Toymaker Mattel is not normally at the forefront of bringing new technologies into everyday use. But by updating its 1960s manufacturing kit ThingMaker, scheduled for release in the autumn, it has hit on a use for 3D printing that may make the technology approachable and stimulate a generation of young makers.The retro-styled ThingMaker looks like an Easy-Bake Oven — a clever piece of design encapsulating sci-fi and home life.The ThingMaker is being sold as a home device for printing plastic toys, with action figures and jewellery the first items that can be made by snapping the parts together. With an app from Autodesk, whose software is used widely in industrial design, users will be able to download templates, or design their own.To increase the chances that more designs will be available in future and the ThingMaker won’t end up gathering dust, Mattel and Autodesk have used open technologies that make it possible to print objects created by other software, or send designs to other printers.Success will depend on whether the technology of 3D printing has been tamed. Besides making the design software intuitive, that will mean creating a reliable 3D printer that can consistently produce high-quality parts.Some of the questions on Mattel’s FAQ page certainly sound daunting and suggest that patient parental assistance will be required. They include: “Why are the printed parts droopy in some places?”But if Mattel is right and a $300 kit is reliable enough for home use, then it might catch a rising wave of interest in the technology — if not among children themselves, then among parents looking for toys that promise to stimulate a higher level of creativity.
3;ADSK;Autodesk Inc;2015-06-17T05:18:02Z;3D printing of complex organs is far off;Technology is cutting patient waiting times;Three baby boys born with the life-threatening condition tracheobronchomalacia, which causes a child’s windpipe periodically to collapse, preventing breathing, owe their lives to 3D printing.They received 3D-printed bronchial-splint implants at the University of Michigan CS Mott Children’s Hospital in the US. None had complications after surgery and all three have thrived, says a study published in April in the journal Science Translational Medicine.The number of life-saving applications of 3D printing in healthcare is growing rapidly.According to recent estimates from Transparency Market Research, the market for 3D printing in medical applications across the globe stood at $354.5m in 2012 and could reach $965.5m by 2019.The most common applications currently involve the creation of implants used in surgery on the face and jaw, particularly when reconstruction is needed due to congenital conditions or trauma, and in cardiac and orthopaedic procedures, says Kevin McAlea, chief operating officer in the healthcare products division of 3D Systems, a printer maker.Surgeons also use 3D-printed models of patients’ organs to prepare for complex surgeries, he says. This gives them a better understanding of what they will encounter in theatre and time to refine their approach ahead of surgery, leading to “enhanced surgeon confidence, surgical time savings and improved accuracy and outcomes”.The technique can also shorten implant surgery waiting times, says Shane Fox, a business development specialist at Within Technologies, a UK arm of US design software company Autodesk.Using 3D printers to create implants in-house, rather than ordering them from external manufacturers, means biomedical engineers can create surgery-ready implants in two to four weeks instead of two to three months. These implants are also patient-specific.Mr Fox says: “Medical implants [from manufacturers] traditionally come in set sizes and are then cut down to fit the patient. Now, we can CT scan areas of the patient’s body and use 3D printing to create an implant that replicates the exact shape needed.”But the most common materials that are produced by 3D printers are still titanium, ceramic and medical-grade polymers, not living human cells. Many experts think that could change, with live human cells becoming the “ink” in 3D printers in a process referred to as “ bioprinting”.In May, French cosmetics company L’Oréal announced a research tie-up with San Diego-based bioprinting start-up Organovo focused on 3D printing human skin for cosmetics testing. Though not a medical application, it is easy to see how 3D-produced skin could help burns victims, for example.The prospect of a 3D-printed kidney, liver or heart remains years off, as creating entire organs will involve work that, for the most part, is impossible today. But the good news is that 3D printing, even in its current form, has the potential to help millions.JawboneIn late 2014, a 23-year-old Syrian man was admitted to Ramban hospital in Haifa, northern Israel, in a critical condition. Caught up in his country’s civil war, a bullet had destroyed his lower jaw. A titanium jawbone was 3D printed by Ramban’s technicians and implanted by professor Adi Rachmiel, director of the hospital’s department of oral and maxillofacial surgery, assisted by Dr Yoav Leiser, who had training in Germany on patient specific implants. A day after surgery, the hospital says, the patient was eating and speaking again.FaceTwo-year-old Violet Pietrok, of Salem, Oregon, was born with frontonasal dysplasia, a rare facial deformity in which the bones that normally fuse to form the foetal face fail to connect, leaving her with a large gap in the centre of her face. Her parents’ search to get help for their daughter took them to Boston Children’s Hospital, where plastic surgeon Dr John Meara used 3D-printed models of Violet’s skull based on magnetic resonance imaging scans, to formulate and test a treatment plan. Six weeks after surgery, Violet was ready to return home to Oregon.HeartCalifornian toddler Esther Perez was born with a ventricular septal defect, a life-threatening congenital heart condition. In most cases, surgeons do not know how to proceed until they have opened the child’s chest in the operating room. In Esther’s case, cardiac surgeon Dr Richard Kim used a 3D-printed model of her heart to plan in advance, “which meant Esther spent less time in surgery and received less anaesthesia, making the procedure safer”, he says. The successful surgery allowed Esther to avoid further multiple operations, a hospital statement said.SkullIn 2014, a 22-year-old Dutch woman was given a new 3D-printed skull in an operation at the University Medical Center Utrecht in the Netherlands. She had a condition in which the skull’s bone thickens, leading to headaches, vision loss, reduced motor co-ordination and death. Brain surgeon Dr Bon Verweij, who performed the operation, says 3D printing means “patients often have better brain function [post-surgery], compared with [older] methods”. Three months after the operation the patient had regained her sight and was back at work.SpineFor the first time, a patient with a degenerative spine condition has been treated using a 3D printed titanium cervical implant. The surgery on the 66-year-old German woman was carried out by Uwe Spetzger, professor of neurosurgery at the Klinikum Karlsruhe, using an implant by German 3D medical implants company EIT Emerging Implant Technologies. The implant does away with the need for additional bone-graft treatment. The patient was able to go home three days after surgery and “is doing very well”, Prof Spetzger says.
4;ADSK;Autodesk Inc;2015-04-09T12:09:32Z;3D printing pioneer Carbon3D secures Autodesk investment;Carbon3D gains $10m backing for technique that could be up to 100 times faster;A 3D printing technique that could be up to 100 times faster than current technologies has received backing from Autodesk, the US-listed software company, in a move that will help speed up its commercialisation.The company on Thursday announced a $10m investment in Carbon3D, a Silicon Valley start-up that is pioneering a manufacturing technique that pulls a three-dimensional object out of liquid resin.The technology, known as “continuous liquid interface production”, or Clip, could help accelerate the uptake of 3D printing in the manufacturing industry by making the process of forming complex objects significantly faster and producing better quality parts.The investment is part of Autodesk’s Spark Investment Fund, which it launched last October with the aim of investing up to $100m in 3D printing start-ups. Carbon3D is the fund’s first announced investment, which has seen more than 600 companies apply.“The 3D printing industry needs to deliver on its promise to drive the next industrial revolution and [the fund] enables us to identify and support new technologies and teams that will fundamentally change how products are manufactured,” said Carl Bass, chief executive at Autodesk.Although 3D printing, or additive manufacturing, has been around since the 1980s, it is only in recent years that advances in the technology have helped it play a bigger role in both industry and consumer markets. Companies ranging from Boeing, General Electric and Siemens are already using 3D printing methods to make end products.The global products and services market for 3D printing rose 35.2 per cent from 2013 to $4.1bn in 2014, according to a report published this week by Wohlers Associates, a 3D printing consultancy.However, wider adoption of the technology has been limited by the time it takes to print, the cost of the machines and the quality of the materials.From a red puddle of liquid plastic, a three-dimensional sphere of connected hexagons and pentagons begins to rise, taking only six minutes to be lifted by mechanical arm into its final geometric form.Continue readingCarbon3D, which is backed by technology investment groups Sequoia Capital and Silver Lake Kraftwerk, claims its technique can print objects in a matter of minutes, compared with hours in conventional 3D printing.Rather than printing objects layer by layer such as current 3D printing, Carbon3D’s technology works by harnessing light and oxygen to grow objects from a pool of resin. Different shapes can be created by balancing the interaction of light, to solidify the resin, and oxygen, to prevent the resin from solidifying.Joseph DeSimone, chief executive and co-founder of Carbon3D, said: “By working at the intersection of hardware, software and molecular science, we are aiming to fundamentally address the issues that have held 3D printing back from becoming a manufacturing process.” The group plans to launch its first 3D printer and a range of materials in the next year.“It certainly appears that they have the ability to make parts very quickly with the printer,” said Pete Basiliere, an analyst at consultancy Gartner.However, he cautioned about comparing speeds to other 3D printers. “Some of the slowest technologies may not have the same capabilities as Carbon 3D — but they are purposely designed to process other materials than polymer.”Carbon3D was founded in 2013 by researchers at the University of North Carolina and North Carolina State University and has raised more than $41m in funding.Letter in response to this report:Let’s gallop lightly over to additive manufacturing / From Antoon Houvenaghel
5;ADSK;Autodesk Inc;2015-04-09T10:55:01Z;Rise of the 3D printing machines;‘Terminator’ technology threatens manufacturing pioneers;From a red puddle of liquid plastic, a three-dimensional sphere of connected hexagons and pentagons begins to rise, taking only six minutes to be lifted by mechanical arm into its final geometric form.It is a phenomenon known as “continuous liquid interface production”, and has been developed by Carbon3D — a Silicon Valley start-up backed by technology investment group Sequoia Capital. But while it was inspired by a scene from the science fiction film Terminator 2, when the T-1000 android rises from a small pool of metallic liquid, the new technique is very much a reality — and set to shake up the 3D printing industry by making the process of forming plastic objects up to 100 times faster.Since 3D printing, or additive manufacturing, was pioneered in the 1980s, it has been widely expected to revolutionise the manufacturing of complex components, from medical implants to jet engine parts. But growing competition from start-ups, such as Carbon3D, and household names such as HP, is now putting pressure on the tech companies that developed the fledgling industry.Two of the largest 3D printing companies, US-based 3D Systems and Israel’s Stratasys, are already finding that investors are questioning their continued dominance. 3D Systems shares have fallen 71 per cent, from a high of $96 at the start of 2014 to $28 today. Similarly, Stratasys’s Nasdaq-traded shares are down 61 per cent over the same period, from a high of $136 to $56.“There’s a possibility that you look at the current crop of public 3D printing companies and they will be like the computer companies of the 1980s — brands that are footnotes in computer history,” warns Carl Bass, chief executive officer at Autodesk, the US-listed software company.“It’s not obvious that being first to market really means you lead forever.”Both 3D Systems and Stratasys, as well as their smaller rivals ExOne, Arcam and Voxeljet, have endured a tough 15 months, in which their revenue growth has failed to live up to the hype.Pieter Busscher, manager of the RobecoSAM Smart Materials fund, says they failed to live up to their stock market valuations. “Essentially, what we saw up until 2014 was a bit of a bubble in the works. Multiples at the end of 2013 were anywhere between 60-100 times earnings.”Slower than expected revenue growth also coincided with a need to spend more to sustain their competitive positions, notes Scott Schmitz, an analyst at Morgan Stanley.Over the past three quarters, organic revenue growth at 3D Systems has been between 7-12 per cent, well below guidance of 30 per cent. Stratasys achieved a better organic growth rate of 31 per cent in 2014.However, it unveiled an accelerated investment plan that is likely to keep operating margins in the 10-14 per cent range for the next couple of years, compared with its own long-term guidance of 18-23 per cent, Mr Schmitz points out.Nevertheless, these margins and growth rates have still been enough to attract the attention of conventional printing groups. Hewlett-Packard has revealed plans to enter the sector in 2016, with a 3D printer that it claims will be faster and cheaper than existing machines.Pete Basiliere, an analyst at consultancy Gartner, believes HP is not the only household name eyeing up the space. “By the end of 2016 we’ll see at least three of the big printer makers in the market with their own branded 3D printer,” he predicts.But with at least a year until these rival products appear, competitors have time to respond, Mr Schmitz says. “HP needs to develop new go-to-market channels as 3D printers target a different audience than PCs and office printers.”3D Systems and Stratasys have so far tried to maintain their competitive position by buying up other companies, making about 60 acquisitions between them in the past five years — including providers of 3D printing materials, hardware and software. In 2013, Stratasys bought MakerBot, a New York start-up that produces cheap, easy-to-use 3D printers, for about $403m, although it has since booked a $100m impairment charge following disappointing performance.Both companies require the use of their own materials with their printers, but Weston Twigg, an analyst at Pacific Crest Securities, suggests that in future there will be separate specialists selling printers, software and materials.He points to Germany’s SLM Solutions, which focuses on making metal printers and partners with various materials companies. It increased its unit orders by 138 per cent in 2014, and its revenue by 56 per cent. Conversely, software provider Autodesk is adopting an open approach by teaming up with materials and printer companies.Terry Wohlers of Wohlers Associates, a 3D printing consultancy, agrees that it will become increasingly difficult for companies to compete with products that are “closed and locked to prevent third-party products and solutions”.However, the big incumbents will be reluctant to open up their business models while they can achieve such high profit margins on materials sales. In 2014, 3D Systems achieved a margin of 73 per cent on materials, compared with 36 per cent for its printers.And demand for 3D printing materials is only going to rise. Gartner expects worldwide shipments of 3D printers to reach 217,350 units in 2015, and then take off to 2.3m by 2018.Conventional 3D printing is under threat — and the enemy is a technique that has been inspired by Hollywood science fiction, writes Tanya Powley.Technology company Carbon3D is pioneering a manufacturing technique that pulls a three-dimensional object out of liquid resin — similar to the way the T-1000 cyborg emerges from a pool of liquid metal in the Terminator 2 film.While conventional 3D printing builds up an object layer by layer, “continuous liquid interface production”, known as Clip, works by projecting light and the object image through an oxygen-permeable window into a reservoir of UV curable resin.Areas of resin that are exposed to oxygen do not harden, but those that are not exposed solidify to form the object shape. A build platform lifts the object continuously as its “grows” out of the resin pool.Different shapes can therefore be created by balancing the interaction of light, to solidify the resin, and oxygen, to prevent the resin from solidifying.Joseph DeSimone, chief executive officer and co-founder of Carbon3D, says the technology offers game-changing manufacturing speeds — between 25 and 100 times faster than conventional 3D printing — as well as higher quality products.“We brought our expertise in chemistry and physics to an industry that relies on mechanical processes,” says Mr DeSimone, who has spent the past two years working on the technology.Carbon3D plans to launch a 3D printer in the next 12 months, which will be targeted at businesses rather than the consumer market.If the technology proves commercially successful, it could rapidly increase the use of 3D printing in manufacturing, which has so far been held back by slow speeds, product quality and the cost of machines and materials.Back to the top of the page
