;Ticker;Nombre_Completo;Date_Time;Titular;Subtitular;Texto
23;ADSK;Autodesk Inc;2020-04-25T03:00:02+0000;US stocks fall on Bernanke’s outlook;;Industrial transportations stocks climbed after FedEx reported strong fourth-quarter earnings and gave a positive outlook for the year, but the wider markets fell into negative territory after Ben Bernanke gave a cautious assessment of the US economy in a news conference.The package delivery group, considered a bellwether for the wider economy as it transports goods for such a wide range of industries, reported a 33 per cent jump in earnings, sending shares up 2.6 per cent to $91.44.The company gave a stronger-than-expected full-year earnings outlook.This caused a sigh of relief for investors as, due to a run of weak economic data in the US, many had been worried that forecasts would be sluggish.The outlook was “better than feared”, said analysts at Jefferies.Rival package delivery company UPS added 0.7 per cent to $71.11 on the news while Expeditors International of Washington put on 0.4 per cent to $48.45.But in the wider markets the S&P 500 index closed down 0.7 per cent to 1,287.14, breaking a four-session winning streak. The index dipped from positive to negative territory late in the afternoon after the Federal Reserve cut US growth forecasts and offered no hope that there would be another round of monetary stimulus.The Dow Jones Industrial Average was down 0.7 per cent to 12,109.67 while the Nasdaq Composite fell 0.7 per cent to 2,669.19.According to Investment Company Institute, the last two week were the worst fortnight for equity outflow since May 2010, the week of the flash crash. This did not help the mood in the markets.Wall Street was hurt by a move in the dollar, which edged higher after the Bernanke press conference. This weighed on the industrial, energy and material sectors.The S&P industrial index was down 0.6 per cent, although these losses were pared somewhat by L-3 Communications, which spiked 4.6 per cent to $86.21 after reports that investors were pushing the defence company to spin off some units.The S&P energy and material sectors were both down 0.4 per cent.In the materials sector, CF Industries was down 2.8 per cent to $142.25 while Allegheny fell 2.5 per cent to $59.91.In the energy sector, ExxonMobil fell 0.9 per cent to $142.25 while EOG Resources lost 0.8 per cent to $101.34.But the technology sector was the worst performing in the session, led lower by Adobe Systems, the worst-performing stock on the S&P 500.The software company that makes the Photoshop and Illustrator programs for media and internet professionals gave a disappointing earnings forecast, which dragged the stock down 6.3 per cent to $30.01.These losses came despite the fact that the company reported a 54 per cent rise in second-quarter earnings.Many analysts were still upbeat about the software maker in the long term.Analysts at Citigroup said that there were “lots of small things to quibble about” but that the “big picture [was] still bright”.Elsewhere in the technology sector, Autodesk was down 1.5 per cent to $36.47 while Juniper Networks lost 2.4 per cent to $29.53.The S&P technology index was down 0.8 per cent, although losses were pared by strong gains from Jabil Circuit. The electronics contractor was up 3.2 per cent to $19.45 after reporting powerful earnings and a share buy-back.Homebuilders also saw gains after home prices as tracked by the Federal Housing Finance Agency rose 0.8 per cent in April from the previous month, which was better than the 0.3 per cent fall that had been expected. PulteGroup was up 0.4 per cent to $7.49 while DR Horton added 1.4 per cent to $11.54.Consumer staples stocks also suffered, led by Lorillard Tobacco, which was down 1.7 per cent to $110.01.In the previous session, the US Food and Drug Administration released nine warnings on the ill-effects of smoking – combining graphic images and text – that must appear on cigarette packets as well as in advertisements no later than September 2012.The S&P consumer staples index was down, 0.7 per cent.CarMax, the used-car dealer, enjoyed the strongest gains on the S&P 500 after reporting first-quarter earnings up 25 per cent, beating analysts’ expectations. Its shares were up 7 per cent to $32.66 as earnings came in at $126.3m, or 55 cents a share, which was ahead of the 47 cents expected.AeroVironment’s fourth-quarter earnings rose 20.6 per cent on a jump in contract-services, leaving shares in the maker of unmanned aircraft up 19.6 per cent to $34.51.
24;ADSK;Autodesk Inc;2011-03-23T20:29:39Z;Tech groups to count quake sales loss;;IT hardware and software companies will in the next few weeks unveil the estimated hit to revenues of the devastating earthquake and tsunami in Japan, which came as local sales teams were preparing for the most important push of the year.The first indication of the impact on tech companies that sell to Japanese companies or government agencies came late on Tuesday, as US software company Adobe slashed its forecast of overall revenue growth for its current quarter by nearly half to reflect the effects of the disaster in Japan.According to analysts, sales to Japan have a disproportionately large effect on tech companies in the current quarter, given the timing of the country’s fiscal year, which closes at the end of March.The effect on local sales is a further blow alongside the supply-chain problems caused by the disruption to component suppliers affected by the disaster.Buyers of IT hardware and software tend to spend more heavily at the close of their fiscal year, as they use up the remains of their IT budgets for the year rather than lose them. The expected loss of this so-called “budget flush” was one reason listed by Adobe for its caution about the outlook in the coming weeks.The US company, which makes desktop programs for creative professionals as well as the Acrobat document software, said it expected to lose $50m in sales, or a third of what it had expected from Japan this quarter. That would leave it with revenues of $995m at the midpoint of its forecast range, sharply cutting its overall growth rate from an expected 10 per cent for the quarter.Adobe executives said it was too early to tell whether the lost sales would be recovered in coming months or whether the effect of the downturn would be longer lasting.Overall, software companies that rely on sales to businesses and government customers generate 5 per cent of their sales from Japan, according to analysts at Barclays Capital, though for some, such as Adobe and Autodesk, the figure is 10 per cent or higher.Japan also consumes about 15 per cent of the world’s semiconductors, Morgan Stanley analysts said, while tech research firm IDC had earlier forecast that the country would account for about 12 per cent of the $12.5bn global server market this quarter.With buyers distracted by the need to deal with the crisis, earlier indications suggested a dent to server sales this quarter, though the real extent of the disaster would not become apparent until the following quarter, said Jed Scaramella, an analyst at IDC.
25;ADSK;Autodesk Inc;2011-03-15T11:23:06Z;Carlyle buys The Foundry;;Carlyle, the US private equity group, has agreed to take control of a London-based company whose software helped to create special effects in films such as Avatar, The Twilight Saga and Tim Burton’s Alice in Wonderland.The Foundry, which was set up by Simon Robinson and Bruno Nicoletti in 1996, offers post production software services to Hollywood clients and multinationals such as Sony and Warner Bros.Carlyle is buying a majority stake from Advent Venture Partners and other shareholders for an undisclosed sum. The US private equity group already owns a number of assets in related sectors including The Mill, a digital visual effects company.It is the third time that The Foundry, which competes with larger companies such as Autodesk of the US and is estimated to be worth more than £75m, has changed hands in the past four years.The founders originally sold the business in 2007 to Digital Domain, a Los Angeles-based special effects company. But in 2009 Bill Collis, chief executive, and the company’s co-founders initiated a management buy-out backed by Advent, which took a majority stake.The Foundry, which employs move than 100 staff in its offices in London and Los Angeles, in 2009 reported pre-tax profits of £624,117 on sales of £6.8m but has grown rapidly since Advent tooks over. Revenues in 2010 hit £14.9m thanks in part to the success of its Nuke compositor software, which layers different images over each other to create one shot.Mr Collis said that the acquisition by Carlyle would help The Foundry widen its product portfolio and enter new markets. The Foundry is looking to expand further into the US, and tap into the large movie hubs of China and India. The company is also eyeing a move into adjacent sectors such as television commercials and possibly games.As well as Carlyle, a number of other private equity and trade buyers are also understood to have looked at The Foundry.Film companies are increasingly outsourcing to low-cost centres such as India and using software to create special effects, spurred on by a drive to reduce costs and the push to create ever more dynamic blockbusters. Even period dramas now use post production software to help remove unwanted objects such as buildings.Mr Collis, who will remain chief executive following the acquisition, is well known in the industry for designing the computer programming behind the sequence in The Matrix movie where Neo, played by Keanu Reaves, dodges bullets in slow motion.Mr Robinson, chief scientist, and Mr Nicoletti, chief technology officer, will stay in their current roles following the deal. The founders and management will continue to retain a significant minority stake.Arma Partners acted as financial adviser to The Foundry’s shareholders. Carlyle was advised by Travers Smith.
26;ADSK;Autodesk Inc;2020-04-25T03:00:02+0000;Fired, re-hired – and now chief executive;;"Autodesk chief executive Carl Bass is wandering through the software company’s gallery, an airy space overlooking the San Francisco Bay Bridge that features products designed using Autodesk’s computer programs.Mr Bass dreamed up the gallery two years ago, wanting to build a “museum to show off work by the customer”.Today, it houses an eclectic assortment of consumer products, and architectural models, a trophy case of high-end industrial design. To his right is a three-metre tall dinosaur built of Lego; to his left, one of two prototypes for the all-electric Tesla Model S sedan. Outside the window, cranes are assembling the new eastern span of the Bay Bridge, which Autodesk software also designed.“Everything around you is designed and engineered,” says Mr Bass, a designer himself who has risen through the ranks to run this $9bn (by market capitalisation) company. Although he doesn’t say it outright, his point is hard to miss – just about everything manufactured is designed and engineered, at least in part, by Autodesk software.Autodesk offers a catalogue of more than 40 programs that allow architects, designers, engineers and digital artists to turn their wildest imaginings into realities, from Zaha Hadid’s futuristic architecture to the aliens in James Cameron’s Avatar movie.The company’s flagship product, AutoCad (computer assisted design), has been the industry standard at architectural firms for a generation. Another program, Maya, is the de facto tool for computer animation, and is used extensively throughout the film industry. Autodesk itself has won five Academy Awards for technical achievement.Like many a chief executive, Mr Bass towers above his employees. His tall frame is softened by an easy smile and unpretentious demeanor. He wears a poplin work shirt and black Levi jeans.His eyes are ringed with dark circles and his hair receding, but he is cheerful and speaks without the deliberate message management of many of his peers.This laid-back demeanour hasn’t always sat comfortably with Autodesk’s sometimes rigid corporate culture. Mr Bass joined the company in 1993, when it bought Ithaca Software, which he had founded.At the time, he tended to wear Birkenstock sandals to work. Carol Bartz, who is today chief executive of Yahoo but was then CEO at Autodesk, insisted Mr Bass wear a suit.“I had never worked in a large company,” says Mr Bass, explaining the tensions. “Small companies are like a tiny hammer, you can move it really quickly, but it only makes a little dent. Bigger companies are more like a sledge hammer – harder to move, but you can make a real impact.”Shortly after he joined, he challenged Ms Bartz on the timing of a major product launch at a meeting of senior executives. The public showdown did not sit well with Ms Bartz, and marked the start of a contentious relationship between the two. In 1995 their polar personalities led Ms Bartz to fire Mr Bass.“The universal truth in that story is that for people who come from entrepreneurial companies and into big companies, there’s a misunderstanding from both sides,” he says. “The bigger company doesn’t understand what it takes to be successful, and the smaller company thinks the bigger company is lethargic.”He was re-hired a few months later, after other senior employees insisted he be reinstated. From there, he rose through the ranks, and in 1999 Mr Bass left Autodesk to head Buzzsaw, a spin-off company. Two years later, Autodesk re-acquired Buzzsaw and Mr Bass was hired by Autodesk for the third time.Buzzsaw was an appropriate name for the spin-off. After graduating from Cornell University with a degree in maths, Mr Bass spent a few years learning to use his hands. He did odd jobs, building boats and furniture.Today, Mr Bass continues his woodworking in a large workshop in West Berkeley, the left-wing enclave across the Bay from San Francisco. Employees say that he often fires off e-mails at 10pm from his workshop with complaints about a feature in one of Autodesk’s programs he is using.Mr Bass took over as chief executive in 2006, when Ms Bartz became chairman. During his tenure at Autodesk, he has helped build the company’s subscriptions and services business, which now accounts for $800m of its $2bn or so in annual revenue. He has also helped introduce the company’s software to new markets, such as the film industry, and to diversify its revenue stream.“What we want to do is find the customers who are doing the most interesting stuff, and help them do it better,” says Mr Bass. “That’s the stuff that they’re doing today that others in the industry will want in a few years.”This approach led Autodesk to work closely with James Cameron, the Avatar director whose company, Lightstorm, has pioneered a new breed of 3-D film-making and animation.On the day I met him, Mr Bass was just off a flight from Los Angeles, where he had spent the day with Mr Cameron, working on the sequel to Avatar. “We were talking about the tools he used on his last movie, what worked and what didn’t work, and what they need to make it better the next time,” he says.As Mr Bass relates this story, he strolls past an unusual artefact in the Autodesk museum. It is a bench carved from a single piece of granite. Inspired by African designs, it was drawn on a computer, then built as a model with a 3-D printer. The model was sent to the DingLi Stone Carving company in China’s Fujian province, where master masons crafted it from a solid piece of granite and polished it to a shine.The artist was Mr Bass. He designed it in his West Berkeley studio, using, of course, Autodesk software.●My big break?
I never really think about big breaks. I’ve just done the things that I like and think are important to do.

●Person who made a difference?
No one mentor but I’ve tried to learn from everyone – people at work and people in the community. Corporations don’t have a monopoly on people with intelligence, creativity, courage or passion. And you often learn as much from someone’s weaknesses or shortcomings as you do from their strengths.

●Would you rather have done something else?
A star in the National Basketball Association or musician, except I don’t have the talent for either.

●Best career advice to others?
Do what you really love doing."
27;ADSK;Autodesk Inc;2010-11-16T20:48:20Z;20. Carol Bartz;;This profile is part of the FT’s 2010 Women at the Top ranking of 50 prominent businesswomen around the world.20. Carol Bartz, 62Nationality: AmericanCompany: YahooSector: Online mediaLocation: USThree-year TSR: 29%It is not often you find a top-flight corporate leader whose roots are deep in rural life, but Carol Bartz is one. “I’m really proud of my Midwestern roots,” she says of her childhood on a Wisconsin farm.Brought up by her grandparents after her mother died when she was eight, Bartz recalls her grandmother taught her the importance of hard work. “Animals had to be fed. No excuses. You just got on and did it. I expect people to try their best.”She has been chief executive of Yahoo for 18 months, succeeding founder Jerry Yang after a stellar career at Autodesk, where she was chairwoman, president and chief executive. During her 14-year tenure, revenues increased from $285m to $1.5bn.Her career has been built on a BSc in computer science from the University of Wisconsin, with roles at 3M and Digital Equipment Corporation before she joined Sun Microsystems, working her way up to executive vice-president of worldwide field operations. She also advised on George Bush’s Council of Advisers on Science and Technology, setting the US government’s high-tech agenda.Her role at an internet group has placed her every move and word under scrutiny: a clip of her use of the F-word in an interview has been viewed more than 220,000 times on YouTube. “I don’t regularly use salty language,” she says, “but [I will] if I get really impassioned about something, and I am passionate about Yahoo … But I think it attracts a lot more news than if I was a guy.”There are volumes of blogs, tweets and Flip videos about Bartz. “We live in a world where any individual can be a journalist,” she says. “The world needs to learn to distinguish between unverified opinion and real journalism. Ninety per cent of what’s out there simply isn’t true.”Bartz has made bold moves in her time at the top, partnering Microsoft to power the back office of Yahoo’s search capability while “concentrating on what we do well – developing content and communication products”, she says. “I don’t care how a user comes to us, whether by e-mail or Yahoo Finance, we control the experience.” Yahoo reaches 83 per cent of the US online community and covers “all demographics”, she says.Bartz is confident she has set a sustainable direction for Yahoo. “We’ve got a great strategy. We’re right on track, but I always said it would take two years to get some things done. We aren’t there yet. You can’t have a baby in a month. But I have the confidence and patience to carry out the plan.”
28;ADSK;Autodesk Inc;2010-08-31T00:56:51Z;Autodesk brings flagship software to Apple;;Autodesk, the computer-assisted design company, is bringing its flagship product software to Apple’s computers after a 16-year absence, giving another boost to the Silicon Valley device maker’s prospects for business sales.Autodesk’s $4,000 AutoCAD has been available only on computers running Microsoft’s Windows since the mid-1990s.However, fans of Apple’s Mac had to install Windows and other software first before they could use AutoCAD.Autodesk’s move comes as Apple is making headway with sales inside corporations with both the Mac and iPad.Macs made up less than 4 per cent of the world PC market in June, according to IDC. But Needham & Co analyst Charles Wolf said last week that the number of Macs shipped to companies grew by 50 per cent in the last quarter, more than triple the growth rate for PCs.The increase is even more pronounced in the largest businesses, where Mac sales doubled from a year earlier.The shift to run directly on Apple is part of Autodesk’s strategy to end its dependence on Windows in recognition that more large companies are welcoming a greater variety of devices and software, Amar Hanspal, Autodesk senior vice-president, told the Financial Times.Autodesk will also introduce a free application for the iPad, iPhone and iPod Touch that allows users to view AutoCAD designs and make minor modifications, he said.Autodesk is also looking at other tablet-shaped computers that rival the iPad.“The tablet is becoming an interesting form factor. There are multiple operating systems people are looking at,” Mr Hanspal said.That makes Google’s Android a potential candidate. And a less functional AutoCAD will also be available through any web browser.The full AutoCAD will reach the Mac OS X, the current version of Apple’s operating system for the Mac, by the end of October, Mr Hanspal said. The company plans to market the software at the same price as its Windows version.AutoCAD has more than 10m users, many of whom had asked for a version to be available on the Mac, he said.While Autodesk has already put many less-intensive programs for creating entertainment on the Mac and iPad, more than a third of Autodesk’s $473m in revenue in the last quarter came from the engineering-oriented AutoCAD.
