;Ticker;Nombre_Completo;Date_Time;Titular;Subtitular;Texto
11;ADSK;Autodesk Inc;2013-05-14T04:02:02Z;Hardware startups get hardcore at Haxlr8r;;This week seems to be maker week in Silicon Valley. In the run-up to Saturday’s Maker Faire in San Mateo are a string of events and conferences for hardware startups and the folk building them.Kickstarting the week, Haxlr8r – a hardware-hacker accelerator programme that takes ten startups to Shenzhen for three months – held its demo day at the Autodesk Gallery in downtown San Francisco on Monday afternoon. Ten startups pitched their ideas, fresh from the factory floor in China, to a group of early stage investors.“Manufacturing is changing,” said Cyril Ebersweiler, Haxlr8r’s founder, in his introduction. “It’s not about outsourcing anymore to another country – it’s about leveraging the knowledge base and integrating the ecosystems which are completely worldwide. Everything you see today started from zero. The only benefit that a startup has is time so getting onto the market as quickly as possible with a product that can sell is critical.”Being based in Shenzhen helps with rapid prototyping, added Zach Hoeken Smith, programme director at the group and a co-founder of Makerbot. “You can find small runs and factory prototypes, and work through all the problems that would take you weeks over email,” he said. “This just gives you crazy fast iteration… You should not wait until you launch your Kickstarter and raise a million bucks before you talk to your manufacturer.”But despite the presence of traditional investors, almost every company presenting was or soon planned to list its connected device on Kickstarter, too, to cover the costs of the first run or test demand. Clyde, a “smart” lamp, has already raised $11,300 on its first day, after being selected as a staff pick by the crowdfunding site.Clyde’s makers, Fabule, were among the standouts from a largely impressive group of startups, considering few were little more than an idea just 15 weeks ago. By providing downloadable “personality modules” – such as being “scared of the dark”, or lighting up when the sun goes down – Fabule’s Amanda Williams said that she wanted to create an object that was “not just smart but expressive and delightful”. It’s a nice contrast to the more staid, robotic spins on the smart home.I was also impressed by Helios Biking, a pair of handlebars embedded with Bluetooth and bright, programmable LEDs. The $199 kit, which will launch on Kickstarter on Saturday, is controlled with an iPhone app and can change colour according to cycling speed or to aid navigation by indicating where and when you should turn. It also comes with an inbuilt GPS and GSM connection that can broadcast its location to the app if the bike is stolen.“We’re changing the way you interact with your bike,” said founder Kenny Gibbs, who hoped to raise $500,000 to work on a completely integrated smart bike for launch next year.Finally – and perhaps inevitably – comes Vibease: a “smart vibrator”. The sex toy connects to an Android phone via Bluetooth which syncs its movements to an audio “fantasy”.The San Francisco- and Singapore-based company hopes to create the “iTunes for erotica” by offering an array of 99 cent downloads.“Hardware alone is not enough,” said founder Dema Tio.
12;ADSK;Autodesk Inc;2013-02-27T13:00:49Z;Leap Motion announces pricing, launch date;;Leap Motion has announced a ship date and retail price for its eagerly anticipated motion controller for PCs and Macs.The sensor, the size of a pack of chewing gum, is shipping later than planned and at a higher price. It ships on May 13, when the previous launch date had been “early 2013”. It will cost $80 – $10 more than the previous pre-order price.“We think it’s a steal, very affordable, it’s the price of an expensive mouse,” said Andy Miller, chief operating officer, in an FT interview.The launch delay was mainly due to co-ordinating the efforts of Leap Motion’s developer community rather than any technical problems with the device, he added.The company announced it would be launched with an app store called Airspace, which would feature dozens of apps optimised for the device.Out of the box, users would plug the Leap Motion Controller into a USB port, receive an on-screen tutorial and download software to enable use of gestures for computing such as scrolling in a browser and manipulating objects..Airspace apps at launch will include a number of games such as Disney’s Wreck-it Ralph:Sugar Rush Speedway, Double Fine’s Dischord music-based game and ZeptoLab’s Cut the Rope. There will be 3D design apps and tools from Autodesk and Corel, as well as more general apps such as The Weather Channel and the Clear to-do app.The apps will follow common gestures developed for the controller, with some featuring special actions – a punching action in the Wreck-It Ralph racing game gives a boost to the car being driven, for example.Leap Motion said the controller would begin shipping to more than 100 countries where consumers had pre-ordered the device on May 13 and would go on sale at Best Buy stores in the US on May 19, in an exclusive retail deal. For now, the only other place the device can be obtained will be on Leap Motion’s website.The San Francisco-based company, which claims its technology is over a hundred times more precise and sensitive than rivals’ offerings, announced a $30m funding round and a deal with Asus in January.The Taiwanese PC maker is to include the controller in the box with new high-end notebooks and premium All-in-One PCs introduced worldwide later this year.Leap Motion’s technology can track movements to within a hundredth of a millimetre, without noticeable lag. The bar has a 150-degree field of view, and tracks individual hands and all 10 fingers at 290 frames per second, allowing very detailed manipulations and the 3D-effect of moving forwards and backwards or at an angle in a computer screen.
13;ADSK;Autodesk Inc;2012-08-20T15:37:50Z;OnLive to shed staff in restructuring;;OnLive, the provider of a revolutionary service for streaming and playing console-quality games over the internet, has announced a restructuring of the company that avoids bankruptcy but has led to the laying off of about half its 200-strong workforce.Privately held OnLive has been the leading exponent of “cloud gaming”, proving wrong those who doubted its technology – with video games from leading publishers playable in high quality without noticeable lag over its network. The two-year-old service has an active base of more than 1.5m subscribers, according to the company.The Silicon Valley group gave no reason for the restructuring, other than that its board was “faced with difficult financial decisions”. It used an “assignment for the benefit of creditors”, or ABC, a legal manoeuvre sometimes utilised by insolvent companies as an alternative to bankruptcy proceedings.OnLive has kept confidential its level of funding and critics have questioned whether a start-up could afford the infrastructure costs for servicing a broad range of devices from televisions to tablets, phones and computers, as its platform has rapidly expanded.In a statement on Sunday, OnLive admitted it was “rare among start-ups” in trying to do this.“Only a few major corporations have ever developed and deployed products and services across such a broad spectrum,” it said.OnLive’s main rival, Gaikai, was bought by Sony for $380m last month. OnLive’s last big round of funding was announced in September 2009, involving AT&T Media Holdings and Lauder Partners alongside previous investors Warner Bros, Autodesk and Maverick Capital.Under the ABC, OnLive said Lauder Partners became the first investor in a newly formed company that had acquired all of OnLive’s assets on Friday. As a result, the service was expected to continue without disruption, with customers unaffected, although OnLive shareholders have been wiped out by the transaction.Among the shareholders wiped out in the restructure was HTC, the Taiwanese smartphone company. Last year, HTC had invested $40m in OnLive to expand its access to mobile gaming technology. At the time, the investment was seen as a promising sign of OnLive’s ability to achieve its goal of providing games for a range of platforms, not just desk-bound PCs.OnLive said big announcements of new products and services were still planned.Almost half of OnLive’s staff have been offered jobs with the new company, whose founder Steve Perlman is understood to be still at the helm. OnLive said more would be offered jobs once additional funding was secured.Additional reporting by Sarah Mishkin in Taipei
14;ADSK;Autodesk Inc;2012-07-18T18:09:54Z;An education in tech reunions;Will experience pay off for the ex-AOL team that has re-formed for a new venture?;"The three letters AOL have become for many a shorthand for hubris. At the height of the dotcom boom, the company that got America online bought Time Warner’s venerable magazine and movie studio brands for stock. Soon after, it was unravelling in a spectacular clash of cultures.“In certain respects, this is AOL Time Warner done right,” says Miles Gilburne, as the professorial venture capitalist embarks on an animated explanation of ePals, his online education company.Mr Gilburne should know. After selling a company called NaviSoft to AOL in 1994, he became the group’s head of corporate development, leading its acquisitions of CompuServe and Netscape. He sat on the boards of AOL and AOL Time Warner, before stepping down in 2006 after the departure of Steve Case, AOL’s founder.AOL has since been spun off by Time Warner, and few senior members of its founding generation are left. But at ePals, Mr Gilburne has brought many of the old team back together for what has become a test case of how a team can apply the lessons learnt from the rise and fall of an earlier venture.“Everybody who’s sitting at the table understands how to build disruptive start-up companies,” Mr Gilburne says. “You need business experience to do what we’re trying to do [around] the world, and you need to have people who like each other.”Ed Fish, ePals’ president, once ran AOL’s subscription services and products such as AOL Instant Messenger. Eduardo Hauser, who leads ePals’ media division, started AOL’s Latin American operations. Other executives worked in AOL’s business affairs unit, led its internet services technology platform, and ran operations for its flagship America Online service.The fast-changing nature of the technology sector, with its proliferation of start-ups and constant dealmaking, has allowed a number of former business teams to benefit from being reincarnated in a new venture (see below).“You develop a common frame of reference so you don’t have to start fresh every time,” explains Carl Bass, the chief executive of software company Autodesk, who has found himself working alongside former teammates from Ithaca Software, which Autodesk bought in 1993.Sean Knapp, who left Google in 2007 to set up an online video company called Ooyala with two of his colleagues, notes that, with start-ups, “your early investors are backing the team and their ability to navigate a huge amount of adversity and uncertainty”.At ePals, the AOL reunion extends to the company’s investor register, which is studded with familiar names. Mr Case and his wife Jean were early backers. Ted Leonsis, once AOL’s vice-chairman, William Raduchel, a former AOL chief technology officer, and Yossi Vardi, the Israeli internet entrepreneur who sold ICQ to AOL, are also investors.Jimdo
Co-founders Christian Springub, Fridtjof Detzner and Matthias Henze previously worked together at NorthClick, a German-based web design service, before setting up Jimdo, a website-building tool that has been used to build more than 6m sites. “Our prior friendship allowed us to step on the gas from day one and fully concentrate on building the business,” says Mr Springub. “Our chemistry gave us confidence in each other.”Ooyala
Co-founders, brothers Bismarck and Belsasar Lepe and friend Sean Knapp, left Google to start Ooyala, an online video company, in 2007. “Knowing each other and having similar values helps us avoid arguing over mundane topics for weeks on end,” says Bismarck Lepe.Autodesk
Carl Bass, chief executive of software company Autodesk, joined with its acquisition of Ithaca Software in 1993, which he founded. He says working with colleagues who also joined from Ithaca helped him with the transition to a larger company. “It was great to have a core group of people who had that shared experience so we could go through this adjustment together.”“Miles has built a management team and board that understands the disruptive potential that technology can play in an existing market,” Mr Case says when asked what the shared AOL experience brings to ePals.Mr Gilburne also brought in Thomas Middelhoff to chair ePals Europe. The former chief executive of media group Bertelsmann turned an early $50m investment in AOL into a stake worth billions of dollars before the two groups split after the Time Warner deal and Mr Middelhoff fell out with Bertelsmann’s controlling family. Mr Middelhoff says the shared history of those involved in ePals “means we have a whole lot of business experience together, a lot of trust and even, at the end, friendship”.EPals describes itself as “the safe social learning network”. At its most basic, it is a network for digital penpals; a way to connect a classroom in Washington to one in San Francisco, Moscow or Shanghai. Layered on top of the network that now connects more than 27m students in 700,000 classrooms across 200 countries, however, are content and products aimed at encouraging collaborative learning, rather than just idle chat.As veterans of AOL’s anything-goes message board era, one lesson ePals’ founders learnt from the team’s previous incarnation was the importance of allaying parental concerns about what might happen on an unscreened forum. As a result, everything is monitored and schools can apply their own policies to the platform – a critical provision for markets such as China, which are suspicious of unchecked online networks.The new ePals business model is a broader mix of revenue streams than AOL had, bringing in subscriptions, licensing, sponsorship and e-commerce. Customers include the New York City department of education and the International Baccalaureate; sponsors include National Geographic and the Smithsonian; and third party developers can offer their applications over ePals’ platform.The business is a fraction of the size of traditional suppliers to the education market such as McGraw-Hill, Houghton Mifflin Harcourt or Pearson, which owns the Financial Times. Cormark Securities estimates that revenues will grow from under $3m in 2011 to $17.5m in 2013, and ePals has told investors it should pass $100m in sales by 2015.In contrast to AOL, the ePals team is aiming from the start at a global audience.It has struck a joint venture in China with Jiren Liu, founder, chairman and chief executive of Neusoft Corporation, a large Chinese technology company with education interests through its IT training institutes. “Before, education was very much country-oriented,” he says. “We can localise their platform, their business model and their content.”About 40 per cent of ePals’ users are now outside the US.The AOL veterans involved with ePals see similarities between the two companies. “We were here at the birth of the PC; we were here at the birth of the internet; and now we’re watching this reverberation go through media,” Mr Leonsis says.“This is maybe the second time in my life I’m saying this will be something big,” adds Mr Middelhoff.They may yet be proven wrong. As Mr Gilburne notes calmly: “I had to learn about failure early on in business. If you were not failing you were not trying. The nice thing about doing this so many times is we fail not infrequently, and we may fail with this. This is as difficult as anything I’ve ever done.”Additional reporting by Vinjeru Mkandawire"
15;ADSK;Autodesk Inc;2012-06-14T15:54:28Z;Programmed for personalisation;;3D printing is among a spectrum of technologies being developed as a way of making it easier and more cost efficient to create parts and products in a “personalised” way. Key to this are software techniques aimed at helping designers create shapes of parts in three dimensions on computer screens and then transfer the instructions for making them to production machines.Software of this type is made by companies such as Dassault Systèmes of France or Autodesk of the US. Increasingly, such businesses are trying to simplify the process of using their software so that it can be applied to the task of making items in small batches – or perhaps one unique part – rather than long production runs. Such software is being used to make products on this basis in a range of industries from aerospace engines to jewellery.Laser scanning systems – made by companies such as Faro Technologies of the US – can be used to measure the dimensions of items that need to be replicated or modified. Such items could be anything from products or parts made by competitors – in “reverse engineering” – to parts of the human body. The information can then be converted into computer codes and sent to a production machine for turning into a solid object.Profiles of the leading players in the sectorAn example of where such processes are useful in personalising manufacturing is hearing aids. Here the manufacturer uses laser scanning to formulate a digital description of a person’s inner ear, with the information then used to create a shape that will fit the individual’s unique physiological features.A third area of technology where developments are moving quickly is conventional machine tools – “subtractive” manufacturing systems – that have been used to make parts normally on the basis of large production batches.Increasingly, the programs used to run such machines are being designed so that the tools can be used to create items in small batches rather than large ones, so as to allow for “personalised” forms of production. ProtoLabs is a US group that uses such conventional machine tools – made by Haas, another US business – to make parts and products in this way.
16;ADSK;Autodesk Inc;2011-11-16T22:03:17Z;Eurozone contagion fears drive US bank sell off;Midwestern refiners hit by narrowing Brent-WTI spread;A warning from Fitch Ratings that US banks are vulnerable to contagion from the eurozone debt crisis trigerred a late sell-off on Wall Street.“Unless the eurozone debt crisis is resolved in a timely and orderly manner, the broad outlook for US banks will darken,” Fitch analyst Joseph Scott wrote.The financial sector of the S&P 500 tumbled 2.5 per cent, led down by Morgan Stanley, which fell 8 per cent to $14.66.Goldman Sachs fell 4.2 per cent to $95.60, Citigroup was off 4.1 per cent to $26.86, Bank of America fell 3.8 per cent to $5.90, and JPMorgan fell 3.8 per cent to $31.47.In another sign of rising financial contagion, the two year interest rate swap spread over Treasuries, which is seen as a proxy for US bank counterparty risk, rose above 50 basis points for the first time since May 2010.Earlier, the S&P 500 had moved slightly positive, as soild industrial production and housing market data added to a sense that US markets were shaking off eurozone shackles. But the benchmark US index eventually closed down 1.7 per cent to 1,236.92.“Its very frustrating. We’re trying to shift back to a US-centric analysis, but this Fitch report has brought the eurozone back into focus,” said Phil Orlando, chief investment officer at Federated Investors.The Dow Jones Industrial Average was off 1.6 per cent to 11,905.97, and the Nasdaq Composite index fell 1.7 per cent to 2,639.61.Elsewhere on Wednesday, companies along the hard drive supply chain were given a boost, after Western Digital Corp, the single largest manufacturer, said it had reached a deal with Japanese electronics manufacturer TDK to buy “heads” – a crucial component in hard drives, which Western Digital has had trouble manufacturing since it closed factories due to flooding in Thailand last month.Western Digital shares closed up 7.1 per cent to $26.82, also boosted by a report that the European Commission will clear the company’s bid to acquire Hitachi’s hard drive unit.“This is a big deal as heads were the biggest challenge to restarting production,” said Jayson Noland, a tech analyst at Robert W Baird, “but it’s impossible to quantify the impact until we get details on the deal from Western,” he cautioned.Quarterly results from Dell were more sobering for the sector, with revenue from sales of personal computers, still the single largest source of demand for hard drives, falling 4 per cent year-on-year.Dell shares were off 3.2 per cent to $15.13, although some analysts were encouraged by signs of strong growth in storage and enterprise services.“The company seems to be executing its plan to transform into higher value and higher margin areas,” said Jeffrey Fidacaro at Susquehanna.Semiconductor manufacturer Micron Technology surged 23.4 per cent to $6.74, after a jury dismissed claims that the company had colluded with Korean firm Hynix Semiconductor to fix the prices of computer memory chips.The case had been brought by Rambus, a tech innovation company, which had been seeking more than $4bn in damages.The market capitalisation of Rambus, which relies on aggressive litigation to protect its patent rights, collapsed, falling more than 60 per cent to $7.11.“Following two key legal losses, which we believed were the cornerstone to our investment thesis in Rambus, we are now recommending investors exit positions,” Jeff Schreiner, an analyst at Capstone investments, told clients as he dropped coverage of Rambus after the decision.Midwestern oil refiners took a hit, as the discount of WTI crude oil to Brent crude shrunk to its lowest in more than six months.Western Refining Inc fell 13.5 per cent to $13.42, and CVR Energy tumbled 16.3 per cent to $18.38. Both companies are almost exclusively dependent on WTI, which has sold at a steep discount to Brent for most of the year, as transport constraints created a supply glut at the WTI terminal in Cushing, Oklahoma.News that Canadian firm Enbridge will allow WTI crude to flow to the Gulf Coast from Cushing through a newly acquired pipeline next year erased much of that discount.Even refiners with a small exposure to WTI were significantly affected.Shares in Tesoro fell 6.9 per cent to $25.00. WTI only accounts for 20 per cent of Tesoro’s crude, but Citigroup had expected that output to produce 60 per cent of 2012 earnings because of the lower input costs.The share prices of refiners with as little as 15 per cent exposure to WTI crude, such as Valero Energy, have seen strong correlation with the Brent-WTI spread this year, at least until August, when they were caught up in the wider market sell off. Valero fell 9.3 per cent to $22.56 on Wednesday.Abercrombie & Fitch plunged 13.6 per cent to $48.10, after third-quarter results badly disappointed analysts. Earnings per share of 56 cents were a full 15 cents lower than the average analyst expectation in a Bloomberg poll.Autodesk rose 4.5 per cent to $35.58, after the design software maker reported third-quarter profit of 44 cents a share, exceeding analyst estimates, despite worries about that business would cut back on spending given global growth concerns.
