;Ticker;Nombre_Completo;Date_Time;Titular;Subtitular;Texto
15;CTXS;Citrix Systems Inc;2011-12-21T21:49:49Z;Oracle earnings miss spurs sector sell-off;;"An earnings miss by Oracle sent software stocks tumbling on fears that large business customers are taking longer to close orders.Oracle fell 11.6 per cent to $25.77 after revenues grew just 2 per cent to $8.8bn in the three months to the end of November compared with the 7 per cent growth that had been forecast.Richard Davis, of Canaccord Genuity, stripped Oracle of its “buy” rating, saying: “Oracle will have to rebuild confidence that the firm is not headed to Microsoft’s valuation level [seven times earnings] over the next few years.”But other analysts blamed the miss on delayed purchases by corporate customers, which would affect software stocks more widely.“Management noted that IT budgets were not reduced, rather the sales cycle increased as additional levels of approval were required, which is typical of a macro slowdown,” said Nomura analyst Rick Sherlund, who maintained a “buy” rating on Oracle.“Cloud” software company Red Hat, which had lowered 2012 guidance earlier in the week, fell 4.9 per cent to $39.90, now down 16.2 per cent for the week.Salesforce.com, a fast-growing software company, whose contract growth has slowed markedly in the past month, fell 5.1 per cent to $99.03.Citrix systems fell 7.8 per cent to $58.46 as Citigroup analysts said it was among the most exposed to the possibility of “non-recurring software orders” from businesses.That left the Nasdaq Composite index reeling. The technology-heavy index fell 1 per cent to 2,577.97.Research In Motion was one of the few bright spots, climbing 10.1 per cent to $13.78 on hopes that it could be an acquisition target after reports that Yahoo had considered a bid for the BlackBerry handset manufacturer.RIM’s market capitalisation has fallen 75 per cent this year due to poor sales of its PlayBook tablet
and a failure of its BlackBerry network but analysts said the share price may fall further before a buy-out.“We expect to see further pressure on RIM’s share price,” said Stuart Jeffrey at Nomura. “While we believe that RIM shares could be worth $15 in a gradual wind-down scenario, we don’t see financial buyers bidding until the stock falls below $10.”Shares in Yahoo itself were on the move too, climbing 5.9 per cent to $15.99 late in the day on reports the internet portal will sell Alibaba Group and its Japanese affiliate back to their majority holders in a deal that could be worth $17bn.Tech stocks also weighed on the Dow Jones Industrial Average, which ended the day flat at 12,107.74, with IBM off 3.1 per cent to $181.47 and Cisco Systems down 2.7 per cent to $17.92.The S&P 500 edged up 0.2 per cent to 1,243.72, turning positive late in the day, despite Moody’s warning of a possible downgrade to US sovereign debt in 2012.The S&P 500 had opened lower as European nerves returned, after strong demand from the continent’s banks for three-year loans from the European Central Bank.US bank stocks also reversed early losses to close in positive territory, with Bank of America up 1.2 per cent to $5.23.Oil producers showed firmness as the price of crude oil edged up for a second day, nearing $100 a barrel, after falling as low as $94 last week. Among the smaller explorers, Noble Energy was up 1.9 per cent to $94.56 while, among the majors, ExxonMobil rose 1.4 per cent to $83.12.Cintas Corp rose 9.3 per cent to $34.19 for the best performance in the S&P 500. The provider of bathroom supplies and entrance mats raised its fiscal year 2012 profit forecast to at least $2.16 a share, 13 cents higher than expected.Nike climbed 2.9 per cent to $96.35 after the world’s largest sports goods company reported second-quarter profit that topped analysts’ estimates by 12 per cent on strong North American sales.Walgreen shares tumbled more than 5 per cent in early trading after the pharmacy missed earnings estimates on declining market share, but shares recovered to close down just 0.4 per cent to $33.37.Rival CVS Caremark ticked up another 1.7 per cent to $40.46 after surging 9 per cent on Tuesday, as it raised its dividend.The CBOE’s Vix index of implied volatility in the S&P 500 fell to its lowest level since the start of August, closing at 21.63. It had consistently traded above 30 from August through November."
16;CTXS;Citrix Systems Inc;2011-10-27T20:52:18Z;S&P 500 set for best month since 1974;US GDP growth and Europe debt deal inspire markets;Bank stocks led a strong advance for Wall Street as Europe’s deal on sovereign debt and strong US growth data put the S&P 500 on track for its best month since October 1974.The S&P financials index surged 6.2 per cent, led by big commercial banks Citigroup, up 9.7 per cent to $34.17, JPMorgan Chase, up 8.3 per cent to $37.02, and Bank of America, up 9.6 per cent to $7.22. Investment bank Morgan Stanley jumped 17 per cent to $19.41.US banks were following their European counterparts up after Europe’s debt deal – which will impose 50 per cent losses on Greek bondholders, set recapitalisation targets, and raise the firepower of the eurozone rescue fund – at least gave investors more information.But the European deal did nothing to help MF Global, the broker-dealer which has been fighting for its life amid fears of heavy exposure to European debt.It fell a further 15.9 per cent to $1.43 on Thursday after Fitch downgraded the company’s debt to junk status, leaving the stock down more than 50 per cent since the start of the week.Insurance company Genworth Financial rose 11.2 per cent to $6.84. Europe’s faltering economy has weighed particularly heavily on Genworth as it sells a consumer debt insurance product on the continent.Meanwhile, US economic growth accelerated to an annualised 2.5 per cent in the third quarter, a strong improvement on the 1.3 per cent annualised growth posted in the second quarter – suggesting that the summer’s stock market woes had not been immediately transmitted to the real economy.The S&P 500 surged 3.4 per cent to 1,285.59, to close in positive territory for the year for the first time since August, after its best day in two months.The benchmark index has risen 13.5 per cent since the start of October, a month that started badly with the S&P 500 briefly dipping into bear market territory on October 4.The sustained rally has driven down the Vix index of 30-day implied volatility in the S&P 500 to levels not seen since early August. On Thursday Wall Street’s “fear gauge” dropped 12.9 per cent to 26.Although Europe’s deal was far from the finished article, analysts said, even cautious investors were worried about missing out on a strong rally.“Forward looking markets have clearly decided that things have progressed enough in the right direction and not to wait for all the i’s to be dotted and t’s to be crossed,” said Colin Cieszynski, chief market strategist at CMC Markets.But Birinyi Associates said the S&P 500 had reached “its most overbought level in the past 12 months,” based on deviation from its 50-day average. “The market has reached an absolute sell price,” Jeffrey Rubin at Birinyi said.The Dow Jones Industrial Average was up 2.9 per cent to 12,209.55, with all 30 members closing up.Even consumer giant Procter & Gamble was up 0.5 per cent to $65.26, despite seeing third-quarter profits fall to $3.02bn, or $1.03 a share, from $3.08bn a year ago. High commodity prices pushed the company’s operating margin down 2.6 percentage points to 19.8 per cent.Oil major ExxonMobil, the largest US company by market capitalisation, was another laggard in the Dow – up just 1 per cent to $81.88, despite a 41 per cent increase in profits for the third quarter compared with the same period last year. Exxon also reported a 4 per cent drop in oil-equivalent production.The technology-heavy Nasdaq Composite index, meanwhile, was up 3.3 per cent to 2,738.63.BMC Software, the corporate IT supplier, lost 12.3 per cent to $33.88 after quarterly net income fell 13 per cent against the same period last year. Total bookings from corporate customers fell 16 per cent compared to the year-ago quarter.Cloud software company Citrix Systems was up 17.3 per cent to $75.35 after quarterly earnings of $92m or 49 cents a share easily beat expectations. The company landed 40 deals worth more than $1m each during the third quarter.Avon Products fell 18.3 per cent to $18.81 after the beauty product retailer revealed that the Securities and Exchange Commission was probing Avon’s dealings with financial analysts under Fair Disclosure.Cabot Oil and Gas was up 15.9 per cent to $77.43 after reporting a 39 per cent jump in third-quarter oil and natural-gas production, after hitting a sweet spot in Pennsylvania’s Marcellus Shale formation.Retirement planning company Ameriprise Financial was up 13.2 per cent to $48.53 on the back of an increase in operating net revenue to $2.46bn, from $2.33bn a year ago, driven by double-digit growth in management and distribution fees. The company also said it had more than $2bn in cash, despite spending nearly $500m on a share repurchase programme.
17;CTXS;Citrix Systems Inc;2011-08-22T20:35:55Z;The latest tech news for business;;New ERP package allows customers to chose their own ‘flavour’Acumatica has released the latest version of its cloud-based suite of enterprise resource planning (ERP) software. New features in Acumatica 2.2 include automated bank reconciliation, inventory allocation by sales order and flexible payment remittance. While many in the ERP industry argue that the future of ERP software lies increasingly in the cloud, US-based Acumatica is hedging its bets. For cloud enthusiasts, Acumatica 2.2 is offered as a software-as-a-service product and the only financial commitment is a monthly rental fee – unusually, this SaaS option has no limitation on the number of users. But Acumatica also enables traditionalists to licence the software and install it either on their own IT systems or on a third party’s cloud infrastructure.Tailored cloud service targets US government agenciesAmazon Web Services has created a specialised cloud computing service for sensitive data in a bid to turn more government agencies on to cloud computing. The GovCloud service is specifically aimed at US agencies obliged to comply with arms trafficking and similar legislation requiring that sensitive data are only accessible to US persons. Any cloud service used by organisations that are covered by these regulations therefore needs to ensure that their data stays on data centres located in the US and that the users are legally allowed to access the data. Like rival cloud computing platforms, AWS already offers services that comply with more mainstream security certifications, such as Fisma for federal customers or Hipaa for healthcare sector. The GovCloud offering provides an example of how the cloud computing industry is rolling out tailored services to address the specialist requirements and data security concerns of commercial and government customers.iPad app for tech supportCan you never find your IT support people when you need them? Help is at hand with the Citrix GoToManage App for the iPad. This free app from Citrix allows peripatetic tech support people to troubleshoot misbehaving computers while they are on the road, at home or, ahem, down at the beach. The iPad app allows them to view and control a user’s PC or Mac as if they were sitting in front of it. It works over 3G/4G cellular networks or Wi-Fi. The GoToManage app for iPad is the latest in the line of Citrix products for the iPad including GoToMeeting, GoToMyPC and Citrix Receiver. Citrix clearly believes the iPad is poised to make big inroads into mobility applications that have traditionally been handled by notebook PCs.Making software ‘rules’ easier to changeDecisions, decisions, decisions. According to a survey by Corticon, a US specialist in business rules management systems, over a third of respondents plan to use a business rules engine to automate the business logic behind decisions. Most organisations use business rules to manage their interactions with employees, customers and suppliers - for example, employees with more than five years service get an extra vacation day, orders over $150 get free shipping, and so on. However, these rules are often programmed into the applications with the disadvantage that changes have to be made by the IT department. With a business rules engine, the business rules are separated from the application logic - the core of a software application. That allows business users with no IT knowledge to change the rules themselves and they can make the changes faster and more frequently than if the rules had to be reprogrammed by the IT department. Corticon argues rules engines are particularly relevant to health and government agencies, which have complex, changing rules governing entitlement to service and payments. Over a quarter of US state governments use its software.Fujitsu offers secure mobile browserJapanese IT giant Fujitsu has launched a service to protect corporate data when users connect to the firm’s intranet from mobile devices. The service requires the installation of a special mobile browser, called Fenics, which can be downloaded free from Android-based smartphone application stores and, soon, from Apple’s App Store. Unlike standard mobile browsers, which simply reformat website data to look good on mobile devices, Fujitsu’s browser has additional security features to prevent sensitive corporate data from being left on the device.
18;CTXS;Citrix Systems Inc;2011-07-13T03:06:46Z;Citrix Systems in deal to buy Cloud.com;;Citrix Systems, the networking and remote access technology company, on Tuesday announced a deal to buy Cloud.com, a three-year-old cloud computing start-up, in a deal worth between $200m and $250m.It is the latest deal indicating the elevated prices that businesses are willing to pay for companies in high-growth areas such as cloud computing and social networking.Cupertino-based Cloud.com, had about 70 employees and had raised just $17.6m in two funding rounds with venture capitalists Index Ventures, Redpoint Ventures and Nexus Venture Partners. It had yet to make a profit.However, the company supplies technology to big customers such as Apple, Zynga, the Facebook games maker, GoDaddy, the internet domain name company, and Korea Telecom. It allows individual companies to manage their own remote data centres better, and provides tools for companies, which want to set themselves up as cloud computing providers, in competition with companies such as Amazon and Microsoft.Analysts expect the cloud computing market to be worth more than $11bn by the end of 2013, as more and more companies opt to have their computer networks hosted remotely by specialist companies.Citrix already provides cloud computing services and technologies that allow workers to access corporate networks remotely, but is continuing to build up its capabilities. In 2007, the company bought Xensource, a data centre virtualisation company, for $500m.Qatalyst Partners advised Citrix, while Goldman Sachs advised Cloud.com.
19;CTXS;Citrix Systems Inc;2011-05-31T17:21:36Z;News Briefs;;Week beginning August 22
20;CTXS;Citrix Systems Inc;2011-04-15T18:15:43Z;Earnings leave Wall Street stocks flat;;Disappointing results from Bank of America and Google weighed on the financial and technology sectors, but strong manufacturing and consumer sentiment data left the wider markets higher in the final session of a lacklustre week for US equities.Bank of America reported a 36 per cent decline in first-quarter profit as the foreclosures crisis continued to squeeze its home loan business.Earnings came in at $2bn, or $0.17 per share, falling short of the $0.26 per share expected by analysts.This left the stock down 2.3 per cent to $12.83, with news that the bank had made a deal with Assured Guaranty to resolve all its mortgage repurchase claims serving to limit further losses on the stock.Bank of America shares have fallen 33.9 per cent in the past year, the worst-performing stock in the 24-company BKX banking index, thanks partly to worries over its mortgage liabilities.The results weighed slightly on the financial sector, with Capital One losing 0.4 per cent to $50.03 and Regions Financial falling 1 per cent to $7.17. The BKX banking index was down 0.2 per cent.Elsewhere on Wall Street, shares in Google dropped 8.3 per cent to $530.70 after the internet search group reported a 54 per cent jump in first-quarter operating costs.The news raised fears that Google was facing a deterioration in its underlying cost structure as it tried to maintain growth. The higher costs left profits below expectations, with pro forma earnings per share reaching $8.08, against the $8.13 analysts had forecast.These results dragged on the wider technology sector. Shares in Cognizant Technology Solutions were down 2.6 per cent to $78.72 while Yahoo lost 0.4 per cent to $16.62. The S&P technology index was down 0.4 per cent, the worst performing S&P sub-index.In spite of this, the benchmark S&P 500 index closed up 0.4 per cent to 1,319.68 – down 0.6 per cent over the week – after the Empire State manufacturing survey showed that economic activity was expanding faster than expected in the New York area.The Federal Reserve Bank of New York announced that its manufacturing index rose to 21.7 in April, ahead of the 17 point reading expected by economists. A figure greater than zero signals expansion.The Empire State index is the first of several regional manufacturing gauges to be released each month, although that from the Philadelphia Federal Reserve is seen as the most significant as a gauge of the strength of the wider economy.The University of Michigan Consumer Sentiment Index also came in slightly better than expected at 69.6. In other economic data, US prices rose 0.5 per cent in March according to the Labor Department. This was the ninth straight month of increases in the consumer price index, but it was in line with forecasts, and so did little to sway the markets.Overall, the Dow Jones Industrial Average was up 0.5 per cent at 12,341.98 while the Nasdaq Composite added 0.2 per cent to 2,764.65. The indices have lost 0.3 per cent and 0.6 per cent respectively in the past five days.The disappointing week on Wall Street began with sharp losses in energy and material stocks as commodity prices softened. This was partly due to Goldman Sachs advising clients to lock in profits on oil and other commodities.Lower than expected quarterly revenue from Alcoa, the first S&P company to report results, compounded negative sentiment in the material sector. Alcoa was down 7.8 per cent to $16.52 over the week while Freeport-McMoRan, the copper miner, lost 10.6 per cent to $51.17.The S&P material sector fell 2.3 per cent over the week while the energy sector lost 3.1 per cent.Towards the end of the week, financial stocks were in focus after the Senate permanent subcommittee on investigations found that banks, including Goldman Sachs, had mis-sold mortgage-backed securities and misled investors and lawmakers. Shares in Goldman were down 3.6 per cent to $155.13 over the week while the S&P financial sector lost 2 per cent.JPMorgan Chase was down 4.2 per cent to $44.89, despite releasing quarterly results on Wednesday that beat forecasts.Arcos Dorados, the world’s largest McDonald’s franchisee, saw a strong opening week of trading, rising 25.5 per cent to $21.36. Zipcar, the web-based hourly car rental group, was similarly successful, trading at $27.16 – 52.6 per cent above where the IPO originally priced.
21;CTXS;Citrix Systems Inc;2011-03-30T21:00:57Z;Wall Street stocks boosted by jobs data;;Deal news helped to lift the pharmaceutical sector on Wall Street while the wider markets were buoyed by promising employment data ahead of the big monthly payroll report on Friday.Valeant, an acquisitive speciality pharmaceutical company, said it was making a $5.7bn hostile offer for Cephalon, another drugmaker.The news sent shares in Valeant up 12.8 per cent to $50.08, while Cephalon jumped 28.4 per cent to $75.44, the biggest gainer on the S&P 500 index. The $73-a-share cash proposal, which represents a 29 per cent premium to where the shares have traded over the past month, comes after Valeant tried and failed to engage Cephalon’s management and board in takeover discussions.Elsewhere in the sector Merck was up 1.6 per cent to $33.30 while Forest Laboratories rose 4.3 per cent to $32.48. The S&P healthcare index was up 0.7 per cent.In the wider markets the S&P 500 was up 0.7 per cent to 1,328.26 after the ADP National Employment Report estimated that private non-farm employment had risen by 201,000 in March.The figure was broadly in line with expectations, but kept traders’ hopes alive for a strong official employment number on Friday. This was the fourth month where the ADP figure showed about 200,000 jobs being added, compared with the previous four months where the average was 74,000.“In short, there has been a clear and sustained acceleration in private payroll gains,” said Ian Shepherdson, chief US economist at High Frequency Economics.The S&P 500 has bounced back 5.7 per cent in the past two weeks as traders have turned their attention to the US domestic economic recovery and away from global tensions.The Vix index, a measure of expected volatility in the marketplace, fell 3.2 per cent in the session to 17.6, falling below 18 points for the first time since the tensions began in Middle East and north Africa in the middle of February.The Dow Jones Industrial Average was up 0.5 per cent to 12,350.23 while the Nasdaq Composite rose 0.7 per cent to 2,776.79.Financial stocks gained ground in the session, led by Visa and MasterCard, following speculation that US curbs on debit card fees will be delayed or modified.Visa was up 2.8 per cent to $74.23 while MasterCard added 0.8 per cent to $253.66 in reaction to comments from Ben Bernanke, chairman of the Federal Reserve, in the previous session that the central bank would not meet an April 21 deadline to come up with a final rule on debit card transaction fees.Jon Tester, Democratic senator, is also pushing for a chamber vote on a bill that could delay the cap by two years.Elsewhere in financials, Goldman Sachs was up 0.4 per cent to $159.07 while JPMorgan Chase added 0.9 per cent to $46.45. The S&P financial sector put on 0.7 per cent.Among telecoms, AT&T rose 2.2 per cent to $30.71 after Randall Stephenson, the chief executive officer, struck an upbeat note, saying that the company’s takeover of T-Mobile USA would boost network capacity and improve service for devices such as the iPhone. He also said that he expected some divestiture before the deal was allowed to go ahead by the regulators.Shares in AT&T are up 9.9 per cent since the $39bn deal, which would create the largest wireless carrier in the US, was announced early last week.These gains helped lift the S&P telecoms index 1.4 per cent in the session with Verizon Communications also gaining ground, up 0.4 per cent to $38.46.Among the individual stocks in focus BlackRock, the world’s largest listed investment manager by assets, gained 6.7 per cent to $198.98 on news that the company was replacing Genzyme, the biotech group, in the S&P 500 index.The stock rallied on the expectation that mutual funds and other investment vehicles that track the S&P 500 index will now buy its shares.Qihoo Technology, China’s largest provider of free antivirus software, traded on the New York Stock Exchange for the first time after an initial public offering. The stock rose 135 per cent on its opening day, to $34, more than double its IPO price of $14.50.Oxford Industries, an apparel maker, climbed 33.4 per cent to $33.37 after reporting an 18 per cent rise in its dividend and strong fourth-quarter earnings.Citrix Systems, the software maker, was up 3.1 per cent to $72.24 after Morgan Keegan & Co initiated its coverage of the stock with an “outperform” rating.
