;Ticker;Nombre_Completo;Date_Time;Titular;Subtitular;Texto
29;CTXS;Citrix Systems Inc;2009-07-07T11:56:52Z;HP forecasts cloud;;"Hewlett-Packard has ambitions in the increasingly crowded market for cloud consulting services.The HP Cloud Discovery Workshop is designed to educate enterprise customers about the benefits, risks and implementation challenges surrounding cloud computing. In addition, the IT giant is offering a Cloud Roadmap Service to help customers plan and adopt the cloud.Citrix tackles latency
Also on the cloud front: Citrix Systems, the pioneer of thin-client computing has teamed with networking specialist Arista Networks to develop a cloud networking solution. Arista makes 10-gigabit Ethernet switches designed to address the Achilles’ Heel of cloud models, namely high network latencies which make it difficult to run mission-critical applications in the cloud without employing redundant hardware and hence adding cost.Hosted version of IBM’s LotusLive
LotusLive Connections is the latest offering in IBM’s fledgling LotusLive cloud services portfolio. Based on the existing on-premise Lotus Connections software, this hosted version enables a team of users working on a project to create an online group around that project. As well as colleagues and partners, external suppliers and customers can be brought into the group.Risk update from SAP
German software giant SAP has updated SAP BusinessObjects Risk Management and SAP BusinessObjects Process Control, two applications in its governance, risk and compliance portfolio. The latest releases allow continuous monitoring of risk indicators and controls so that potential problems can be spotted sooner. They also embed the BusinessObjects business intelligence product to simplify reporting and analytics.Talend real-time integration
Talend, a French start-up specialising in open source data integration, has released Talend Integration Suite RTx, a real-time data integration platform for high-end enterprise applications. It employs service-oriented architecture concepts to automate the deployment of integration processes that link to real-time event-based systems. Talend is making waves in the industry as its open source approach challenges the proprietary technologies traditionally used for data integration.New virtualisation package from Sun
Sun Microsystems has unveiled VirtualBox 3.0, the latest release of its virtualisation software. Its major innovation is support for virtual symmetric multiple processing (SMP) systems which means that VirtualBox can run not only desktop workloads but demanding server workloads, which typically run on servers with SMP architecture. Up to 32 virtual processors are supported. VirtualBox is free for personal users, while enterprises pay an annual fee from $30 a user.Greenplum enhances database
Greenplum has a new release of its innovative database, called, imaginatively, the Greenplum Database. The database, which runs on Linux or Solaris, uses a massively parallel processing architecture to allow big businesses to build high-end data warehouses on cheap commodity hardware. Release 3.3 allows database administrators to re-size the database while it is still online and has other management enhancements.Free social networking platform from Socialtext
Socialtext has made most of its social networking platform free for businesses with 50 users or less. The Free50 offering includes Twitter-style micro-blogging, social networking, personalised dashboards, blogs and a wiki workspace. SocialCalc, Socialtext’s ”social spreadsheet” application is not included in the free package, however. SocialCalc was developed by Dan Bricklin, who old hands will remember as the man responsible for VisiCalc, the world’s first spreadsheet."
30;CTXS;Citrix Systems Inc;2009-06-17T15:18:38Z;Wireless security: Data fills the airwaves – who is listening ?;;"“Data,” says Howard Schmidt, professor, and president of the international Information Security Forum, “is the gold, the silver and the diamonds of the world we live in, so no matter how someone gets access to your data – whether it’s through a lost piece of media or a wireless network, it’s just as dangerous and troublesome as if someone broke in and stole the entire computer system.”This is why companies worldwide are worrying about the challenge presented by the growth of wireless networking. Richard Levine of Accenture, a consultancy, remembers how at one time the chief information officer mandated how an employee could connect to the network. “Today, they have expectations of how they want to connect and if you don’t give them the hardware and network to do it, they will find their own.”Even the jargon associated with networking security carries a whiff of menace: “evil twins”, the “man-in-the-middle*” and “split tunnelling**” are just some of the dangers facing companies and their employees. “It is an arms race,” says Rob Cotton, chief executive of NCC Group, a company that tests the integrity of corporate networks. “Hackers will break through virtually anything when it becomes advantageous for them to do so.” His own, 100-strong team of “ethical hackers“ claims a 97.8 per cent success rate in hacking into corporate networks in the course of their wholly legitimate activities.The mobility conferred by lightweight, affordable portable devices and ubiquitous wireless networks has been hailed as the next and most important business trend as employees enjoy access to the data they need to do their jobs anyhow, anywhere and anytime.But wireless networks are notoriously vulnerable to hacking – especially public Wi-Fi “hotspots”, which are unlikely to have security or encryption protection – and the experts are unanimous in claiming that constant vigilance is the only answer: “You must never believe you are secure,” Mr Cotton urges. “The only time we have discovered a network that is safe is when it is switched off.”Kurt Roemer, chief security strategist at Citrix, says organisations have spent millions on security measures to little avail: “The ubiquity of wireless coupled with the fact that users will sign up to whichever available network is easiest, means there is no way for an organisation to own and control the end-to-end network.“Investment in outdated wireless security measures such as WEP (Wired Equivalent Privacy) is rendered worthless when an employee opts for an unprotected network – or when a hacker can use a ‘point and hack’ tool to expose the network in less than 60 seconds.”The good news, according to Paul Meakin, portfolio manager for Damovo, the services group, is that the right technology and the right security policies can go a long way to protecting both company and employees: “Remote workers must ensure they are protecting their devices and businesses must ensure they can manage them.“Devices such as laptops, mobile phones and USB sticks should be encrypted; otherwise they will be wide open to data access. Ideally, companies should have a ‘remote device wipe’ enabled so that all data can be destroyed in the case of loss or theft.” Sensitive data should not be stored on local devices, he urges, suggesting that proprietary technologies that enable a virtual encrypted disk to be created on the machine in use should be used. These make it possible to wipe the disk at the end of each session.Some argue, however, that data leaks through less technological loopholes. Bob Tarzey, of the consultancy Quocirca, says: “I could not put an accurate figure on it, but I would venture that 99 per cent of sensitive data being compromised through the use of wireless is through the loss or theft of the access device itself, which could be a laptop, netbook or smartphone, rather than the deliberate interception of wireless network traffic. This is the problem on which IT managers should focus. It requires the encryption of stored data.”Security specialists agree, however, that basic defence measures such as up-to-date firewalls and anti-virus software are critically important for any device that is to be connected to the internet. Dave Hughes, director of wireless broadband for BT Business in the UK warns: “For businesses and individuals that are concerned about their data being intercepted over the internet, we strongly recommend the use of a secure remote access virtual private network using either IPSec or SSL technology. This is an important common practice for both wired and wireless connections.”IPSec is a set of rules that authenticates and encrypts each packet of data across a network using internet technology. SSL or Secure Socket Layer and its successor Transport Layer Security also provide cryptographic protection for messages travelling across a network so as to prevent eavesdropping, tampering and forgery.BT operates a network of Wi-Fi hot spots called BT Openzone that can be vulnerable to the “evil twin” scam where a rogue access point pretends to be a legitimate Openzone point with a view to obtaining names, passwords and credit card numbers. Mr Hughes says customers should check that their browser displays a padlock symbol indicating a secured page, the address www.btopenzone.com and that no certificate error dialogue box pops up during log-in: “If these conditions are met, you can be sure that it’s a genuine BTOpenzone access point you are connecting to.“Remote working using Wi-Fi is perfectly safe provided basic precautions are taken and, as we know, accessing broadband out and about is a really powerful and increasingly essential aid to business,” he says.Dave Hartley, security consultant with the consultancy Activity, adds: “Try to use only a Wi-Fi provider that implements the IEEE standard 802.1x …What this basically means is that the provider’s client software automatically checks the network’s authenticity so a user cannot accidentally connect to an evil twin.”What steps should an organisation take to protect itself and its mobile employees? For a start, Prof Schmidt of the ISF emphasises that a wireless network connected to an enterprise network is not necessarily protected by the enterprise firewall. If an employee buys an off-the-shelf wireless connection, there may be no security at all.Mr Cotton of NCC Group makes four points. “First, do not believe any security vendors’ claims. Certainly, invest in security equipment, but have it tested by an independent expert. Second, don’t believe there is a silver bullet that will meet your security challenge. You must regularly review your arrangements. And if it’s cheap and easy to implement, it will not be secure. That’s just a rule of life.“Third, security policies must be in place and users must be aware of their responsibilities. Do not, for example, allow staff to use personal features on your wireless network. Fourth, keep up to date with the latest technical developments and advances in encryption.”Mr Cotton says the responsibility for observing these conditions lies with the chief executive: “A CEO has to know about security in this day and age.”*active eavesdropping where the attacker persuades the victims they are communicating over a secure connection.**a network allowing a virtual private network user to connect to the internet and a local network simultaneously over the same physical connection."
31;CTXS;Citrix Systems Inc;2009-05-19T14:28:58Z;Citrix adds to its cloud;;Citrix adds to its cloudCitrix has fleshed out its cloud computing offering by adding Citrix XenApp and Citrix XenDesktop to its Citrix Cloud Centre platform. Citrix is targeting service providers that wish to offer hosted Windows applications or desktops to end-users. Citrix also unveiled Dazzle, a self-service application that uses a virtual store metaphor to encourage corporate employees to provision their own applications, desktops and content.SAP launches easy-to-use business intelligenceGermany’s SAP has launched an easy-to-use business intelligence offering, BusinessObjects Explorer. SAP claims the product will expand the market for BI beyond its traditional niche of business analysts, by allowing any corporate user to easily search corporate data using natural-language queries.Improved CRM access from BlackBerrysUsers of BlackBerry smartphones can now access customer information stored in SAP’s Customer Relationship Management software. The BlackBerry Sales Client for SAP CRM product gives mobile workers instant access to customer information stored in the back-end CRM system and uses push-based notifications to send out urgent updates and sales leads.Google loves BB users tooGoogle also wants to make life easer for users of the popular BlackBerry. Google Apps Connector for BlackBerry Enterprise Server lets them access Google Apps like Gmail, Google Calendar and Contacts using the BlackBerry’s built-in applications. Automatic synchronisation ensures meeting invites and event changes in Google Calendar are immediately updated on the BlackBerry’s calendar.Data consolidation from OracleOracle announces Customer Hub 8.1, the latest version of its master data management program for ”cleansing” and consolidating customer data within an organisation. It allows customer data to be quickly incorporated into Oracle applications like Oracle Siebel CRM and Oracle E-Business Suite, while non-Oracle programs can also be integrated using Oracle’s Application Integration Architecture.Sybase teams up with Amazon Web ServicesSybase has teamed with Amazon Web Services to encourage businesses to develop Sybase applications using Amazon’s EC2 cloud computing infrastructure. Sybase will make Amazon Machine Images (AMI), developer guides and developer software for its server products freely available for businesses that want to develop and test Sybase software in public or private clouds. Production versions of the AMIs will follow later in the year.Cisco takes the pain out of home networksHome networking can perplex even experienced PC owners. Cisco hopes to ease the pain with Cisco Network Magic 5.5, the latest version of its network management software aimed at home users. It simplifies common tasks such as sharing files and printers, troubleshooting networks and setting parental controls. The software is included with all new Linksys routers – Cisco acquired home networking specialist Linksys in 2003.Fujitsu lends helping hand to IT departmentsFujitsu’s ServerView Resource Coordinator VE program aims to make it easier for IT departments to monitor today’s increasingly complex IT architecture, such as virtualised and cloud computing environments. It works with Fujitsu’s Primergy hardware and Intel-based servers of other vendors, and supports the leading virtualisation programs.Single sign-on security from Bull EvidianBull Evidian, part of French IT group Bull, has unveiled Ready-To-Go SSO, an entry-level single sign-on security product for Microsoft environments. The Ready-To-Go SSO edition includes the same core features as Bull’s enterprise-class SSO offering and can be installed rapidly on either existing or dedicated servers. It has the advantage that it does not modify the Windows log-in or applications, or require changes to Microsoft’s Active Directory.
32;CTXS;Citrix Systems Inc;2020-04-25T21:12:53+0000;Free virtualisation from Citrix;;Virtually freeCitrix has launched a free version of its virtualisation platform, XenServer. Citrix claims to be breaking new ground with a free version of its high-end ”hypervisor” supporting unlimited virtual machines and servers – most free hypervisors are deliberately limited in power or functionality. The company also announced Citrix Essentials management software in versions for both XenServer and Microsoft’s virtualisation offering, Hyper-V.Baan targets cloudsIt’s been a while since we heard much from Jan Baan, founder of Baan Software, the former Dutch high-flier that was hard hit by financial scandal. But he is back in business with a new company Cordys focuses on the hot area of cloud computing. Its first product, Cordys ECOSystem, uses business process management concepts to help develop business applications in the cloud.BlackBerry fleets trackedAbsolute Software has launched its Computrace asset-tracking software for the BlackBerry mobile device. The software helps IT managers manage growing fleets of smartphones and other mobile devices. It periodically keeps track of each BlackBerry’s location and any changes to their configuration, and if a device gets lost, the data it contains can be remotely erased.SonicWall builds remote securitySonicWall, the US security specialist, unveils the latest release of its virtual private network software, SonicWall SSL VPN 3.5, aimed at small businesses. As more employees work remotely, small companies are waking up to the need to deploy secure remote access technology, SonicWall claims. This latest release supports all Windows Mobile devices as well as remote access for Macintosh users.Touching minuteness from DellDell adds a third model to its Mini line of mini-notebooks. The Mini 10 has a multi-touch gesture touchpad similar to Apple’s iPhone, a 10-inch screen and a keyboard that is 92 percent the size of a full-size keyboard. It weighs in at less than 2.9 pounds and comes in a range of colours. Pricing in the US starts at $399.Oracle presents new budget toolOracle has produced a new release of its Oracle Financial Analytics developed specifically for public-sector managers who need to monitor budgets effectively. It comes with pre-built dashboards and reports for public sector agencies, and has pre-built integration with the Oracle Financials module in Oracle E-Business Suite.SAP offers business clarityGerman software giant SAP has launched BusinessObjects XBRL Publishing, which uses the extensible business reporting language (XBRL) to communicate business and financial information with third parties. The Securities Exchange Commission in the US requires all US-listed companies and funds to file financial reports using XBRL by 2011 and the standard is at the centre of other compliance initiatives.Israel offers combo securityIsrael’s Check Point Software has unveiled a new security appliance for small businesses. The UTM-130 simplifies security by combining in one device a firewall, virtual private network, intrusion detection, anti-virus, anti-spyware and other security programs. It is aimed at businesses with five to 75 users and sells for $3,500.Sun raises Java platformSun Microsystems has enhanced its mobile Java platform with the launch of JavaFX Mobile. Sun’s Java programming language is already widely used on phones to run games, animations and the such. Sun wants to go further with JavaFX Mobile, which allow phone manufacturers to add ”immersive content” and ”expressive features” on top of the basic Java platform.
33;CTXS;Citrix Systems Inc;2008-11-03T23:12:35Z;Laptop plan takes byte out of costs;;"When Tedd Fox, a desktop engineer at the virtualisation software company Citrix, wanted a new laptop for work, instead of contacting his IT department, he went out and bought exactly what he wanted. It was a new Mac Book, with a fast processor and extra memory. “My computer is my digital hub,” he explains, “and has all my pictures and music on it. Previously, I had one computer for work and one for home and it was very confusing.”Shawn Genoway, Citrix director of Americas IT service delivery, went for something rather different – a muscular HP laptop with a 17-inch widescreen, HDTV and Blu-Ray. The graphics and music specification were perfect for watching videos and gaming in his free time: “I have been much more content having a laptop that has all the bells and whistles that I wouldn’t have in a corporate standard.”Both are participants in Citrix’s BYOC (bring your own computer scheme) whereby the company gives employees who sign up a $2,100 stipend to buy whatever they want. There are virtually no restrictions on what they choose. The laptop has to run either Windows or Mac OS (Linux will be available in 2009), it has to have anti-virus software and a three-year manufacturers service agreement, and users need to download several Citrix packages. That’s it: as long as the laptop can be used for work, the company does not care whether you buy the most elegant Mac, the tiniest netbook or a gaming machine that looks like it has overdosed on steroids. Some employees spend more than the $2,100; others spend less and pocket the difference.So far, says Citrix chief information officer Paul Martine, about 300 people (of around 1,250 US-based laptop users) have signed up and feedback has been very positive. “The real difference from our point of view,” he says, “is that someone else does the care and feeding of the devices.” Employees who sign up to the scheme, have to get a three-year service plan from the vendor, so maintaining the machines is no longer Citrix’s problem.“It actually works out somewhat cheaper to do it this way,” Mr Martine adds.Citrix is leading the way by doing something of this scope and scale. However, others have made steps in the same direction. Google has an programme called “Stuff” which enables people to order the technology relevant to their jobs – so, for instance, small, portable laptops for those who travel, wider screens for engineers, Macs for those who prefer them and so on. However, unlike Citrix, these do need to be related to the job.BP also ran a pilot scheme similar to Citrix’s where a small group of employees were allowed to choose their own hardware. However it was decided not to roll it out.Of course, Citrix does have an advantage over many companies. Its employees tend to be of a techie mindset, meaning they have both a greater understanding of and passion for their laptops. It is a little more difficult to imagine the majority of staff who work in a bank or for a consumer goods business, for instance, knowing or caring much about Quad Core processors.Nonetheless, there are good reasons to believe we could see further similar moves in the wider world. One is that people are becoming more technologically savvy, having become used to a number of different devices (phone, laptop, desktop, smartphone, etc). The second is that file transferability between different platforms and operating systems has improved greatly.And the third is that many applications are becoming accessible through online platforms – which means that it really does not matter what you use to access themIndeed, Mr Martine thinks companies could decentralise their laptop buying in the way that many have dismantled their expensive in-house car fleets.Jakob Nielsen, an IT usability expert, says his own business, the Nielsen Norman Group, “just tells employees to get what they want and need in terms of technology to do their jobs”.He says that the growth in personal technology means that people feel these devices are part of their identity, even with respect to the office technology.And if knowledge workers feel held back by their tools, he points out, “the downside for productivity and morale could be immense”.Mr Fox agrees that a more personal laptop makes for a more engaged employee: “The real upside is that you don’t have to get used to several different working environments and that you have everything on one device – it makes me a happier person.”"
