;Ticker;Nombre_Completo;Date_Time;Titular;Subtitular;Texto
69;DUK;Duke Energy Corp;2009-10-18T10:03:30Z;Act now for long term investment;;"Investors are being chastised for their role in the economic crisis through speculative trading and applying pressure to boards and management to focus on short-term earnings.The Aspen Institute Business and Society Program released a statement in September that calls on the US Congress to adopt a number of policies designed to encourage longer-term investing.The organisation has recruited an impressive list of signatories, including legendary investor Warren Buffett, Vanguard Group founder John Bogle, Duke Energy chief executive Jim Rogers and former Goldman Sachs chairman John Whitehead.There are two main problems, according to William Sihler, a business professor at the University of Virginia. One is the problem of vote lending, when an investor borrows shares to vote but has no underlying economic interest in the company. This is an issue Securities and Exchange Commission chairwoman Mary Schapiro is expected to look at as part of an overall review of the US proxy voting system. Mr Sihler’s second concern is short-term hedging.One solution to these problems is to give long-term institutional investors greater voting power, he says. It can also be worth a company’s time and effort to recruit the right kind of shareholders. To encourage long-term stockholders you have to “cultivate institutions that are known to be sympathetic with the idea you can show them what is happening”, he says. Analysts cannot be ignored either. This means sending chief executives and chief financial officers on the road to trade shows and spreading the message of the company’s long-term vision.Another possible solution is to give shareholders more rights in exchange for time-weighted voting, says Lynn Stout, a law professor at the University of California, Los Angeles and a signatory to the Aspen Institute statement. This is a concept that is embedded in a controversial so-called proxy access proposal at the SEC, which the commission is expected to rule on early next year. According to the draft proposal, if shareholders want to nominate corporate directors on the company ballot they have to hold stock for at least one year. While many businesses would like to see an even longer time period, the concept of encouraging longer holding periods is a good one, Ms Stout says.While some observers say short-termism has been a problem for the past decade or longer, it has become more prevalent in recent years due to lower trading costs, the advent of technology and the increased use of derivative products.The Aspen Institute first made waves in this area when it released a set of principles in 2007 that called for an end to quarterly earnings guidance from companies and aligning compensation incentives with an eye toward the long term.The latest advocacy is “taking it a step further,” says Ms Stout. “It’s not enough to simply discourage quarterly earnings guidance,” she says.“This round of work is really saying, ‘OK, we need to look at whatever leverage points exist in policy to shore up this direction’,” says Judy Samuelson, executive director of the Aspen Institute Business and Society Program. “Our focus at this point is Capitol Hill and the administration.” The institute is using the networks of its signatories to spread the word in Washington. Hearings on this issue are anticipated in both the House and Senate, several people involved say.The group wants to revise the capital gains tax provisions or implement an excise tax to reward long-term stock holdings; remove limitations on capital loss deductibility for very long-term holdings; and adopt minimum holding periods or time-based vesting in exchange for more shareholder rights. They are also advocating increased disclosure from investors and applying more enforcement of the fiduciary duties of investor advisers.Other organisations are supporting this cause. A recent report from a task force of the America Bar Association, which was sent to members of Congress and the SEC, recommended that policymakers encourage shareholder interest in the long term through tax incentives and enhanced voting rights.At the heart of the issue is a sense that investors encouraged risk-taking and short-sightedness by companies because many shareholders these days are
speculators.However, Jon Ogg, editor of the financial blog 24/7 Wall Street, says the notion that investors are partly to blame for the financial crisis is “silly”. “If you are an investor that knows the economy is rolling over or that a new development may hit your investments by 40 per cent, are you going to wait blindly for that to smooth out in a few years or are you going to sell and buy back in later?” he asks.Nonetheless the Aspen Institute has a number of backers. The organisation has had previous success in its campaign to discourage short-termism. Many companies have eliminated quarterly earnings guidance since the organisation’s initial call to do so two years ago.Kristin Gribben is associate editor of Agenda, a Financial Times service"
70;DUK;Duke Energy Corp;2009-10-06T09:59:37Z;BNP Paribas in commodities push;;While Goldman Sachs, Morgan Stanley, Barclays Capital and upstart JPMorgan fight for the leadership in commodity derivatives trading, the battle among the banks’ second-tier group is heating up – with BNP Paribas quietly challenging rivals for ascendancy.The French bank is set to multiply its size after it integrates Fortis’ commodities business, particularly the Dutch bank’s former natural gas and power operations.Amine Bel Hadj Soulami, head of commodity derivatives at BNP Paribas, says his objective is “to be at the top of the second-tier commodity derivatives banks”.Fortis Energy Marketing & Trading, based in Houston, was created when the now-defunct bank acquired Cinergy Marketing & Trading from utility Duke Energy in 2006.In addition, the acquisition will add an agriculture book and metals trading.BNP Paribas declined to comment on the specific details of the Fortis purchase but Mr Bel Hadj Soulami told the Financial Times in an interview that his target was “to double commodity derivatives revenues over the next three years”.Bankers estimate that BNP’s commodities revenues are now near $500m a year.The French bank already has 180 staff in commodities, a number that bankers say is set to grow to about 250 by next year with the addition of Fortis’ traders.Mr Bel Hadj Soulami’s 2012 revenue target is, nonetheless, likely to prove tough to meet.As BNP Paribas expands, other banks in the second-tier group, including BofA-Merrill Lynch, Citigroup, Credit Suisse, Deutsche Bank, Macquarie, Société Générale, Standard Chartered and Royal Bank of Scotland are also pushing with aggressive expansion in commodities that, in some cases, are more advanced than the plans of the French bank.The moves reflect the profitability of the business and the belief that dealing in raw materials represents a rare opportunity for continued growth while other sectors, such as securitisation, shrink. Ironically, the financial crisis has boosted second-tier banks “as customers have diversified their banking relationships”, Mr Bel Hadj Soulami says.Second-tier banks have also benefited from less competition as Bear Stearns and Lehman Brothers collapsed and UBS closed the bulk of its commodities business.Greenwich Associates, the financial consultant, says commercial banks such as BNP have been able to use their lending relationship with customers “as an introduction to commodities business”.Hence BNP Paribas was, together with JPMorgan, the financial institution that added “the most new corporate clients in over-the-counter energy derivatives trading last year”.But for the French bank, the strategy of using its credit relationship to expand in commodities has a handicap: it is a powerhouse in European lending but not nearly as strong in the US or Asia.Mr Bel Hadj Soulami says his business “does take risks but we are not taking big proprietary positions”.“It is not only about being big in commodity derivatives, it is also about being sustainable and avoiding becoming a hedge fund,” he concludes.
71;DUK;Duke Energy Corp;2020-04-24T20:32:47+0000;US utilities pledge switch to electric vehicles;;Duke Energy and FPL Group said on Thursday that their vehicle fleets would become entirely plug-in hybrid or all-electric by 2020.The US utility companies announced a $600m investment to convert more than 10,000 cars and trucks at the Clinton Global Initiative summit in New York. The companies said the switch, set to begin in January, could reduce emissions by more than 125,000 metric tonnes over the next ten years.“The opportunity for the transportation sector to transition from gasoline or diesel fuel-powered vehicles and trucks has never been greater,” said Jim Rogers, Duke Energy chief executive, in a statement. “Electric-powered vehicles hold great promise as the means to significantly reduce carbon emissions and reduce the US dependence on foreign oil.”Mr Rogers was not the only CGI participant to see a bright future in electric vehicles. Carlos Ghosn, chief executive of Nissan and Renault, told a panel discussing infrastructure on Thursday that zero-emissions vehicles were the only way to cut greenhouse gas output as the number of cars on the road soars.“Whatever forecast you look at for the next ten years, with China, India, South Africa, the Middle East coming on board…the amount [of vehicles driven] is going to double,” he said.“Are we ready now or should we wait for five more years?” he asked. “We think the time is now.”Nissan is set to start selling an electric car, the Leaf, in the US and Japan late next year, and Mr Ghosn announced earlier this month that Renault would produce four new battery-powered models by 2012.The green fleet initiative was Duke Energy’s second announcement at the four-day philanthropic conference. On Wednesday, the company announced a deal with ENN, the Chinese energy company, to develop clean energy technology, such as solar power, coal gasification and algae that captures carbon.“It seems like we’re natural partners, because we’re one of the largest emitters of CO2 in the US, and so coming up with technological solutions is really key for us as we go forward,” Mr Rogers told the Financial Times in a video interview.
72;DUK;Duke Energy Corp;2009-08-04T21:07:08Z;Wall St extends gains on upbeat economic data;;US stocks extended their recent run of gains on Tuesday as encouraging housing data offset concerns that the market’s rally may run out of steam.After brief selling pressure during the afternoon, stocks rallied back in late trade and the S&P 500 closed at a fresh high for the year. That kept the broad benchmark above the 1,000 threshold, which it finally rose above on Monday for the first time since last November.The S&P closed up 0.3 per cent at 1,005.65, near its intra-day high of 1,007.12.The Dow Jones Industrial Average gained 0.4 per cent to close at 9,320.19, while the Nasdaq Composite index rose 0.1 per cent to 2,011.31.“A pullback would be healthy, there have been lots of positives to take from the earnings we have seen,” said Neil Massa, senior trader at MFC Global Investment Management.Meanwhile, growing momentum by the Securities and Exchange Commission to ban the use of flash trading orders on exchanges sparked volatility in the shares of NYSE Euronext and Nasdaq OMX.Shares in NYSE Euronext surged nearly 4 per cent in early afternoon trade, before easing to stand 2.4 per cent higher at $27.40. Nasdaq OMX, which, unlike NYSE Euronext, allows flash orders, fell 0.3 per cent to $21.39 having plumbed an earlier low of $20.78.Financial stocks fell in early trade, knocked in part by data showing that personal income fell more sharply than analysts expected in June.But figures showing that pending home sales jumped much more than predicted during the month saw them rise into positive territory by midday.John Canally, economist for LPL Financial, said the fifth straight month of rises for pending home sales was very encouraging.“After housing starts and moderating prices, the pending home sales figures are the latest sign that the housing market has stabilised.”Citigroup rose 2.2 per cent to $3.25 while Wells Fargo was up 2.9 per cent at $26.55 and Bank of Americapicked up 2.1 per cent to $15.64.Homebuilders saw mixed fortunes as the data lifted some of the sector’s biggest companies following early losses on the back of some disappointing quarterly results.Pulte Homes fell to a heavier loss than expected, with falling land values and weak sales continuing to take their toll. Its shares dropped 0.7 per cent to $11.68.The negative outlook briefly weighed on Centex, which Pulte has agreed to buy, and after early losses, its shares rose 0.1 per cent to $11.33 as the company made a quarterly profit.Rival DR Horton also suffered as a result of record foreclosures and rising unemployment. Its results were worse than expected.But its shares picked up following early falls and it gained 4.9 per cent to close at $12.32.“People are selling the homebuilders after their recent run-up but I would pay more attention to these economic data,” said Mr Canally.The utilities sector was the heaviest faller on the S&P, led lower by Allegheny Energy, which lost 4.9 per cent to $24.50 after the company reported slightly lower profit than expected.The results exacerbated pre-market falls that came on the back of an announcement on Monday evening that the company had filed a universal shelf register with the SEC, which would enable it to sell fresh stock.Meanwhile, Duke Energy announced second-quarter profit 21 per cent below their level at the same time last year – its shares edged up 0.1 per cent to $15.58.There was weakness in the agricultural sector as Archer Daniels Midland fell 5.2 per cent to $28.81 after it reported falling revenues and profit, with demand for its oilseed and other commodities remaining low. Monsanto lost 2.6 per cent to $84.02.Shares in PepsiCo rose 5.1 per cent to $59.06 after the company agreed the purchase of its two large bottling companies.Pepsi increased its offer to $36.50 a share for Pepsi Bottling and $28.50 a share for Pepsi-Americas. Pepsi Bottling rose 8.5 per cent to $36.49 and PepsiAmericas gained 9 per cent to close at $28.50.
