;Ticker;Nombre_Completo;Date_Time;Titular;Subtitular;Texto
27;DUK;Duke Energy Corp;2012-08-13T16:20:43Z;US bond issuance set for strong week;;"US debt issuance was set for another strong week with companies looking to finalise deals ahead of the slowdown in capital markets activity that typifies the latter half of August.Both investment-grade and junk-rated companies are taking advantage of a sweet spot for issuance as corporate bond yields are near record lows, while there are strong flows from investors into debt fundsThis is resulting in strong demand for bonds as investors seek a higher incremental return than what is available for US Treasuries.Against the backdrop of a sluggish economy and declining corporate earnings, bonds are also seen as a better investment choice than equities.Among a host of deals, JPMorgan sold a $2.5bn five-year issue; there was a $1bn five-year deal from General Motors Financial; and Duke Energy priced a $1.2bn benchmark five- and 10-year issue.“We are anticipating a $20bn week of investment-grade issuance,” Mr Marrinan said.That would follow last week’s strong run of $27bn for investment-grade deals and some $13.5bn for high yield.Utility companies were prominent on Monday, with deals coming from Mississippi Power, Ameren Illinois and Pacific Gas & Electric.The deals came as activity usually shuts down during the last two weeks of August and the first week of September, with much of Wall Street and corporate America taking summer holidays.“It’s a bit unusual to see issuance so high at this time in August, but conditions are really favourable to issuers,” said Michael Collins, senior investment officer at Prudential Fixed Income.“There may be a sense of urgency from their part as US Treasury yields moved higher recently and markets tend to pull back a little in September after Labor Day.”Average yields on the Barclays US investment grade corporate bond index touched a new low of 2.92 per cent at the end of July.Last week, the average yield for the Barclays High Yield Index closed just shy of the all-time low of 6.61 per cent set in May 2011."
28;DUK;Duke Energy Corp;2020-04-24T20:19:31+0000;Wall St flat after Fed minutes released;;The energy sector set the pace for US stocks as oil prices rebounded from the lowest close in more than a week.The S&P energy index closed 1.4 per cent higher, with Chevron adding 0.9 per cent to $104.85 and ExxonMobil rising 1.5 per cent to $84.38.Duke Energy shares rose 0.5 per cent to $66.48 as the planned merger between Duke and Progress Energy was completed and Jim Rogers, chief executive of the enlarged group, shed light into the reasons for the removal of Bill Johnson, the Progress chief who was due to take charge of the merged entity.It was said the board had been concerned about Mr Johnson’s management style and his ability to bring together the different cultures of the two power companies.The board had also been concerned about his ability to manage the safety of the combined company’s seven nuclear power plants.Elsewhere, Abercrombie & Fitch shares rose sharply after the New York Post reported that the US clothing retailer plans a share buyback and is set to scale down its European expansion plans. Its stock climbed 4.1 per cent to $34.12.JPMorgan Chase rose 1 per cent to $34.59 after The Wall Street Journal reported that the largest US bank is planning to claw back millions of dollars in stock from executives linked to the London chief investment office trading loss.The S&P financials index rose 0.8 per cent as other bank stocks joined the rally. Morgan Stanley rose 0.7 per cent to $13.81 and Bank of America increased 2 per cent to $7.63 but Citigroup erased earlier gains to close at $25.87, the same level it started the session.In broader markets, US stocks recovered losses in a volatile session in which the S&P 500 index fell as much as 0.6 per cent immediately after the release of the minutes from the Federal Open Market Committee’s June meeting.The S&P 500 closed flat at 1,341.45 points. The Dow Jones Industrial Average slipped 0.4 per cent to 12,604.53, while the Nasdaq Composite fell 0.5 per cent to 2,887.98.The Fed minutes revealed that there was a strong bias on the FOMC towards stimulating the US economy more if economic data warranted it. A “few” of the 12 voting members thought that “further policy stimulus likely would be necessary, while “several others” said it might be needed if the economy lost momentum, risks to growth were worse or inflation looked set to remain below target.The Federal Reserve decided to extend “Operation Twist”– its programme of selling short-term securities and buying those with longer to run until maturity – at its June meeting, after the economy added 69,000 jobs in May, a pace too slow to keep up with population growth, and therefore bring down the unemployment rate.As the earnings season began in earnest, with Alcoa reporting results on Monday, investors remain worried about corporate profits after several large companies issued warnings citing the unfavourable business environment in Europe and Asia.“It is likely that the earnings season is not going to be robust and markets have already pulled back in anticipation of softer earnings,” said Gary Thayer, chief macro strategist at Citi Investment Research.“The expectations are already pretty low and if earnings start coming in below that, we might see a sharper pullback.“However, we still see an upside in the markets because of the positive fundamentals, including central bank stimulus in Europe and Asia. And today’s Fed minutes will tell us more about the possibility of further quantitative easing, given that the most recent jobs report indicated the growth is very slow while inflation remains low.”Viacom shares fell 1.5 per cent to $48.98 after reports that DirecTV cut access to the network’s television channels in a dispute over fees.The failure by the satellite broadcaster and Viacom to forge a new deal over carriage fees meant almost 20m subscribers lost access to 17 Viacom networks.Nomura analysts, however, maintained a “buy” rating for Viacom. “We continue to think the stock, valued at nine times of 2013 estimated earnings, is attractive for patient investors,” the investment bank said.The battle between pay-TV companies benefited the internet content provider Netflix. The company’s shares paired some of their earlier gains to close 1.7 per cent higher at $81.64.Best Buy, the electronics retailer, was the worst performing stock among S&P 500 companies, dropping 8.37 per cent to $19.37. The company’s shares fell after Hhgregg, a rival, cut its full-year profits forecast amid sinking TV sales. Hhgregg shares plummeted 36.4 per cent to $7.34.Dean Foods dropped 6.6 per cent to $14.99 as investors took profits after the food and beverage company reached a two-year high during the previous session.JC Penney fell 2.2 per cent after S&P cut its credit rating one notch to B plus from double B minus, citing weak performance.Cummins shares fell a further 3.9 per cent to $83.53 after the diesel engine maker lowered its full-year revenue forecast.Advanced Micro Devices also fell 2 per cent to $4.89 after the microchip maker warned that its second-quarter results would be lower due to weak sales in China and Europe.
29;DUK;Duke Energy Corp;2020-04-24T21:00:03+0000;Board doubts fail to stop Duke merger;;The boards of Duke Energy and Progress Energy pressed on with their planned merger in spite of concerns over their chosen chief executive’s suitability, the new chief executive of the enlarged group has told regulators.Jim Rogers was testifying before North Carolina’s energy utilities commission after it decided earlier this week to investigate why it had not been informed of the impending change of chief executive.The two companies had said throughout a regulatory approval process dating back to January 2011 that Bill Johnson, Progress Energy’s chief executive, would take the same role at the enlarged group after the deal completed. However, the merged company announced on the morning of July 3, hours after completion, that Mr Johnson had left “by mutual consent” and that Mr Rogers, who had been chief executive of Duke Energy, would instead take over.“We felt that completion of the merger was in the best interests of both companies, the shareholders and the communities,” Mr Rogers said.He said there had been discussion about how regulators would react to the change of chief executive, but a decision had been made that there was “nothing, really, to say”.“Almost regardless of who was the CEO, the over 200 commitments that we committed to would be fulfilled,” Mr Rogers said.No final decision on Mr Johnson’s replacement had been made until an executive session of a meeting of the new, merged company’s board on July 2 after the deal’s official closing at 4.02pm. Mr Rogers did not attend that session, he added.However, he said: “There were a series of things that had happened that led to our board, consistent with their fiduciary duty, changing their minds about the best way forward.” There had been no single event that had led the board to a “loss of confidence” in Mr Johnson’s ability to lead the combined group, Mr Rogers said, but “an accumulation of many factors”.Among the concerns were Mr Johnson’s management style and his ability to bring together the different cultures of the two power companies. The board had also been concerned about his ability to manage the safety of the combined company’s seven nuclear power plants.The all-share takeover turned the new, expanded Duke into the US’s largest electricity generator by installed capacity, covering large parts of the south-eastern US.The utilities commission started an investigation into the circumstances of Mr Johnson’s departure on July 6, saying it had been part of the two companies’ submissions when seeking merger approval that Mr Johnson would be chief executive. 
30;DUK;Duke Energy Corp;2020-04-24T18:07:40+0000;Duke declines to explain chief’s exit;;Duke Energy, which this week acquired Progress Energy to form the US’s largest energy utility by revenues, has declined to explain the circumstances around the departure of the combined group’s chief executive hours after the deal was completed.Shares in Duke Energy fell 3.45 per cent on Friday, apparently as a result of investor confusion about the departure of Bill Johnson.The company said Mr Johnson, whom the two companies had designated as chief executive when the deal was announced in January last year, was leaving “by mutual consent”.It declined on Friday to elaborate on Tuesday’s statement about his departure and said: “We are not commenting on the board’s deliberations.”Mr Johnson had been Progress’s chief executive. Jim Rogers, who had been Duke Energy’s chief executive before the acquisition and became executive chairman of the combined group, will also serve as chief executive.News of Mr Johnson’s departure was included in the same press release in which the companies announced the successful conclusion of the long-running takeover process at just after midnight the previous night.Duke said then that the all-share acquisition, which had valued Progress at $26bn when the deal was first agreed, now valued the company at $32bn.Duke reiterated that its earnings guidance for 2012 – which stood at $4.20 to $4.35 per share after a three-for-one reverse stock split during the takeover – was unchanged.
31;DUK;Duke Energy Corp;2012-03-04T17:00:48Z;High-yield stocks trail Wall St bull run;;The bull-run that has propelled Wall Street to its best start in 21 years has left one popular group of shares behind – dividend-paying stocks.In recent years shares in companies that pay high dividends, such as telecoms group AT&T and power operator Duke Energy, have became an alternative to low yielding US Treasuries, in particular among ageing investors who generally prefer income-producing assets.But the tide has shifted with investors moving away from defensive stocks, buoyed in part by better US jobs data this year, while contagion fears from the eurozone sovereign debt crisis have subsided.Both the S&P 500 and the Nasdaq Composite benchmarks have gained over 25 per cent since October, while the S&P Aristocrats Index – which tracks companies that have increased pay-outs every year for at least a quarter century – has lagged after two years of strong outperformance.The gap is widening this year, with non-dividend paying S&P stocks higher on average by 17.2 per cent, while dividend-yielding stocks are only up 7.9 per cent, according to data compiled by Factset.“High-dividend companies were at the forefront of investors’ strategy when markets were sloppy and people rushed to more defensive sectors,” said Michael Mullaney, a fund manager at Fiduciary Trust Co. “The strategy now is more risk-on, which doesn’t favour those stocks.”The five S&P stocks with the highest dividend yields have all seen their share prices fall this year. Frontier Communications, for example, the highest dividend paying stock in the rank, is down 12.3 per cent year-to-date.Also weighing on companies that pay solid dividends have been questions about whether they can expand their profits in the coming quarters.“Companies have to generate the earnings to pay for them and the outlook hasn’t been so great for some of the more defensive names this year,” said Paul Hickey, co-founder of Bespoke Investment Group.He said investors should not completely shun dividend-paying stocks in defensive sectors at a time when high oil prices may slow down the economy.Further spikes in crude could also spark volatility across equity markets and boost the appeal of defensive stocks.“We believe there will be a return of volatility by late spring or early summer that is likely to put defensive names back into favour,” said Oliver Pursche, a fund manager at Gary Goldberg Financial Services.More than 200 S&P companies currently offer a better return than the 10-year Treasury note yield of 2 per cent. Moreover, 58 S&P companies pay a dividend yield in excess of 4 per cent.“There’s no such thing as a risk-free stock. You can always loose capital,” said Mr Mullaney at Fiduciary. “But bring me Verizon and A&T, with a combined 5 or 6 per cent yield, and I would much rather buy them as a long-term investment, than buy a 10-year Treasury note.”
32;DUK;Duke Energy Corp;2020-04-24T17:16:07+0000;Verizon and AT&T: it’s not just the yields;Two big high-yielding US telecoms groups may hold risks after good dividend run;The past year has been good for big companies that pay big dividends. There are 27 US companies with enterprise values greater than $40bn paying dividends over 3 per cent, according to Capital IQ. Over the past 12 months these have returned 16 per cent to shareholders, on average, compared with the S&P 500’s 5 per cent. Stocks as diverse as Philip Morris, Bristol-Myers Squibb, Duke Energy, Intel and Chevron have all delivered great performances.After such a good run, however, the big-cap yield trade may be concealing risks. Consider two examples: Verizon and AT&T, the big, high-yielding US telecoms groups. They have followed the larger trend, returning 19 and 14 per cent, respectively, for investors over the last year.The biggest flag would be if these two companies’ free cash flows did not comfortably cover their payouts. On first blush, they appear to do just this. In recent years, AT&T’s dividend has absorbed about two thirds of free cash flow. At Verizon, only about a third of reported free cash flow has gone in dividends historically, but there is a catch: Verizon owns only 55 per cent of its wireless business (Vodafone owns the rest) which account for most of the cash. Bernstein Research estimates that once the minority stake is backed out, Verizon’s free cash flow only just covered its dividend payments in 2011 (though the cash flow picture will improve in 2012).That leaves little room for error at Verizon (which reports on Tuesday). And there is reason to wonder if dividend growth may be limited at both companies, because revenue growth is threatened. Wireless data growth has accounted for essentially all the sales growth in recent years, and it is now decelerating. The failure of the T-Mobile/AT&T merger could keep price competition humming, too. Investors must keep industry fundamentals, not just yields, in mind.E-mail the Lex team in confidence at lex@ft.com
33;DUK;Duke Energy Corp;2011-12-13T22:59:12Z;US retailers weighed down by Best Buy;;"US markets turned sharply lower after the Federal Open Market Committee left monetary policy unchanged.The S&P 500 closed 0.9 per cent lower at 1,225.73, falling one percentage point in the last hour of trading after the Fed announcement.“They really didn’t say much did they?” said Randy Warren, principal of Warren Financial. “The market is hoping that the Fed will lean towards more quantitative easing if the ECB continues to do nothing, but there was no indication of that whatsoever.""Poor results from Best Buy and retail sales data that missed expectations had knocked consumer discretionary stocks in the morning session.Shares in Best Buy fell 15.5 per cent to $23.73 after the electronics retailer reported quarterly earnings per share of 47 cents, 4 cents lower than most analysts’ expectations.Before Tuesday, Best Buy’s market capitalisation had grown by a fifth since October on strong sales growth. But in the three months to November 26, gross margin declined 76 basis points to 24.3 per cent, as Thanksgiving promotions and the cost of free shipping for online shoppers took their toll.“This lower gross margin, we believe, will be a trend in both consumer electronics and across retail as the cost of sales increases, as the internet, a lower margin sales channel, continues to hurt margins,” said David Strasser, retail analyst at Janney.Consumer discretionary stocks in the S&P 500 fell 2 per cent, falling more than any other sector, as nationwide retail sales increased just 0.2 per cent in November, 0.4 percentage points lower than forecast in a Reuters poll of economists.Urban Outfitters was a rare bright spot. It climbed 5.3 per cent to $28.11, as the company said same-store sales in the fourth quarter would show “mid single-digit” growth compared with the same period in 2010, higher than analysts were projecting.Christian Buss, a Credit Suisse retail analyst, warned the group may face margin compression. “Our visits to stores highlight a highly promotional environment, particularly at Anthropologie,” he told clients.“We believe earnings flow through from the improved comparative same store sales may fall short of expectations. Our model is for gross margin of 34.8 per cent, down 480bp year on year.”The Dow Jones fared better than the S&P 500 falling just 0.6 per cent to 11,954.94. Boeing bucked the market to close flat at $70.90, after the company won a $19bn order to build 208 aircraft for Southwest Airlines. Southwest Airlines fell 3.2 per cent to $8.16.The Nasdaq Composite index fell 1.3 per cent to 2,579.25.Research In Motion slumped 4.5 per cent to $15.48. Rod Hall, an analyst at JPMorgan said the mobile phone handset manufacturer was “increasingly likely” to delay the launch of its BlackBerry 10 handsets into the second half of 2012 after the recent delay of the Playbook OS.Marathon Oil climbed 1.2 per cent to $27.64 and Murphy Oil was up 0.5 per cent to $53.28, as Paul Sankey, oil analyst at Deutsche Bank, urged clients to buy both stocks to increase exposure to “leveraged big-cap names”.Mr Sankey predicted oil price rises “over the next year and beyond”.Utilities Duke Energy and Progress Energy rose 1.3 per cent to $20.87 and 1.1 per cent to $54.31, after they agreed to close old coal-fired power plants and commit to energy-efficiency targets in North and South Carolina to overcome opposition to a planned merger.Morgan Stanley fell 1.4 per cent to $15.17, outperforming its big bank peers, after it reached a settlement with MBIA that terminates credit default swap deals and resolves pending lawsuits.Morgan Stanley said it would take a $1.8bn pre-tax loss this quarter, or about $1.2bn after taxes, but that the deal would result in a 75bp increase in its core tier one capital ratio.NYSE Euronext, parent company of the New York Stock Exchange, fell 0.9 per cent to $26.71 after the company offered to divest all its lucrative single name equity derivatives businesses operated by NYSE Liffe in Amsterdam, Paris, Brussels and Lisbon.Further delays to AT&T’s attempt to buy T-Mobile was good news for smaller mobile phone networks. MetroPCS rose 1.9 per cent to $8.53 and Sprint Nextel was up 0.8 per cent to $2.39.Shares in MetroPCS climbed 1.9 per cent to $8.53 and Sprint Nextel was up 0.8 per cent to $2.39.Sprint’s wireless network provider Clearwire climbed 0.9 per cent to $2.15 after Bank of America Merril Lynch analysts told clients to buy the stock, citing the increasing scarcity value of spectrum assets.Synovis Life Technologies popped 50.7 per cent to $27.78 after healthcare company Baxter International offered $28 a share for the maker of medical devices.Shares in Baxter fell 0.9 per cent to $49.30."
