;Ticker;Nombre_Completo;Date_Time;Titular;Subtitular;Texto
0;DUK;Duke Energy Corp;2018-03-24T11:00:24Z;The week in energy: Fair winds blow offshore;Prospects for offshore projects seem to be improving all the time;The French word for a wind turbine is “éolienne”, from Aeolus, the mythological keeper of the winds in Homer’s Odyssey, who first tries to help and then turns against Odysseus. The word was coined by Ernest Sylvain Bollée, a French inventor who designed an innovative wind turbine, patented in 1868. The turbines used wind energy to pump water rather than to generate electricity — the first person to do that was James Blyth in Scotland in 1887 — but they still fascinate enthusiasts for the history of technology.It is appropriate, then, that France is still in the vanguard of innovation in wind power. General Electric’s offshore wind joint venture with Alstom is developing a huge new turbine, the world’s tallest, which will be built at plants in St Nazaire and Cherbourg on France’s Atlantic coast. It is an important product for GE, which needs to develop other sources of earnings with its traditional gas-fired power generation business in decline. Forecasts from its rival Siemens of the outlook for worldwide sales of large gas turbines make a grim picture for the companies that make them.Prospects for offshore wind, however, seem to be improving all the time. The Netherlands this week awarded a contract to Vattenfall of Sweden for two 350 megawatt offshore wind farms, described as the world’s first to be built without subsidies. Germany awarded “subsidy free” offshore wind contracts last year, but the Dutch projects are expected to be in service first. For the developers, these contracts are predicated on continued technological progress in offshore wind, thanks to products like GE’s new turbine, which they hope will bring down the cost of generation significantly. Describing the contracts as “subsidy free” is also bending the truth a bit: in the Netherlands, as in Germany, the government is covering some of the cost of the projects, including grid connection. The Dutch government has also committed to creating a carbon price floor, similar to the UK system, which will help underpin the revenues of the new wind farms. Even so, the steep decline in the cost of offshore wind has been remarkable. One estimate last year suggested the new German offshore projects were aiming to produce power for about €31 or $38 per megawatt hour, which compares to a forecast from the US Energy Information Administration of an unsubsidised cost of about $157 per MWh.In the US, offshore wind development has lagged well behind Europe, partly because of those cost concerns and partly because of some stiff opposition from coastal property owners. If you have the wide open spaces of Texas, Oklahoma and Iowa available for onshore wind development, there is anyway less need to head out to sea. Offshore wind in the US is starting to pick up, however, particularly for the more crowded northeast of the country. A report this week from Environment America, titled Wind power to spare: The enormous energy potential of Atlantic offshore wind, argued that turbines off the US Atlantic coast could produce enough electricity to supply the needs of the coastal states four times over.Meanwhile, another use of US offshore resources is attracting only limited interest. The latest auction of drilling rights in the Gulf of Mexico, the largest ever in terms of the area offered, had been hyped up by the interior secretary Ryan Zinke as a “bellwether” for US offshore producers, although industry groups had attempted to play down those expectations. When the auction was held on Wednesday, their caution was vindicated. The sale was not a complete flop, but its results showed only a modest level of enthusiasm for new acreage. Of 14,474 lease tracts available, bids were received on just 148. When oil companies are thinking about where to deploy their investment dollars, the Gulf of Mexico or any other region has to make a very compelling case to seem competitive against onshore shale reserves. The Sierra Club declared the offshore lease sale a “massive dud”. Oil output from the Gulf of Mexico has grown strongly in recent years, and the US administration expects that to continue into the early 2020s, but to level off after that. Sam Ori of the Energy Policy Institute at the University of Chicago produced this nice chart showing how bidding for Gulf of Mexico leases has varied with the oil price in recent years.Crown Prince Mohammed bin Salman of Saudi Arabia has been visiting the US this week, following his trip to Britain earlier in the month. One of the crown prince’s principal objectives was to push President Donald Trump to take a harder line on Iran, and subsequent events suggested he might see some progress on that front. On Thursday Mr Trump appointed as his new national security adviser the outspoken hawk John Bolton, who in 2015 urged the US to bomb Iranian nuclear facilities, and last year argued that withdrawing from the agreement over Iran’s nuclear programme “should be the administration’s highest diplomatic priority”. The prospect of a resumption of US sanctions on Iran, and generally heightened international tensions, helped drive up oil prices, with Brent crude rising above $70 a barrel on Friday.A countervailing factor working to depress oil prices is the prospect of a trade war, stoked by Mr Trump’s planned new tariffs on US imports from China. His announcement of his plans on Thursday alarmed US businesses and rattled the markets. However, that same morning, the administration also revealed that it was opening some huge loopholes in its planned tariffs on imports of steel and aluminium. At least for the time being, imports from the four largest steel suppliers to the US last year — Canada, Brazil, Mexico, and South Korea — will be exempt from the new tariffs, as will the EU. There was bad news for the US steel industry in China’s threats of possible retaliation: steel pipes for the oil and gas industry are among the products listed by the Chinese government as potential targets. The tariffs and the threatened trade war are also a concern for companies seeking to export LNG from the US. Wilbur Ross, the commerce secretary, has meanwhile been urging China to buy more US LNG.It was not quite the climate science equivalent of the Scopes trial over teaching evolution, but a US federal judge did hold an interesting hearing on global warming in the district court in San Francisco this week. Hearing a case for climate-related damages brought by the cities of San Francisco and Oakland against the largest western oil companies, Judge William Alsup ordered a “tutorial” on the science. Chevron, which is itself based in California, was conspicuous as the only large oil company that turned up to give evidence, concluding its remarks with: “It is extremely likely that human influence has been the dominant cause of the observed warming since the mid-20th century.” Its evidence leaned on the company’s report on climate change resilience, which I discussed in an earlier Energy Source. The judge pointed out that Chevron and the scientists called by the plaintiff cities largely agreed with each other.Duke Energy, one of the largest US utilities, published its report on climate change this week, observing that the electricity industry “is undergoing extraordinary transformation”. The report concludes that reducing greenhouse gas emissions to limit the rise in global temperatures to 2C would require “sustained financial support for research, development and scaling of low-carbon technologies”, including the “smart grid”, energy efficiency, renewables, nuclear power, carbon capture and energy storage.Another controversy has blown up over Tesla’s battery installation used for grid support in South Australia. The company says it has not been paid for 30-40 per cent of the power drawn from the battery, because it has been used for frequency regulation, balancing supply and demand over very short intervals, and any use for less than six seconds is not registered by the system operator. The Labor party, which had been in government in South Australia and had been enthusiastic about Tesla, planning further co-operation, was defeated in the state election last weekend. The result could also have implications for Australia’s federal energy policy, smoothing the path for the “national energy guarantee”, which has been backed by businesses but opposed by environmental groups. Moving on after the setback in South Australia, Tesla is working on two more battery installations for grid support in Victoria.Mr Trump sought to cut or abolish energy research and environmental programmes, but in the end the spending bill passed by Congress mostly maintained or increased spending in those areas. He signed the bill on Friday, despite his misgivings.And finally: Vaclav Smil is often described as the energy wonk’s energy wonk, and is championed by Bill Gates. Science Magazine carried a great interview with him, talking about his life and his ideas.Nick Butler — Why I don’t have an electric carJamie Powell — Eighteen years, five wells, output zero: Zion's long quest for oil in IsraelJohn Dizard — A Venezuelan oil embargo would wipe out Maduro & CoRichard Black — The gas 'crisis': A case for state intervention?Bina Hussein — Go Big or Go Home: The Right Diversification Strategy for Saudi Arabia?Joern Huenteler, Tian Tang, Gabriel Chan and Laura Diaz Anadon — Why is China's wind power generation not living up to its potential?Joseph Norman, Rupert Read, Yaneer Bar-Yam and Nassim Nicholas Taleb — Climate models and precautionary measuresMichael O’Boyle and Silvio Marcacci — Wind and solar costs continue to drop below fossil fuels. What barriers remain for a low-carbon grid?Reviewed by me in the FT this week, Varun Sivaram’s Taming the Sun is a well-argued assessment of solar power, warning that the industry will eventually face big problems if its technology is not radically improved.“If you want dividends, you should buy Exxon stock.” — Stephen Chazen, the former chief executive of Occidental Petroleum, rejecting the idea that smaller US oil companies should be paying dividends. He retired in 2016, but is now getting back into the game with a $2.7bn deal to buy drilling rights on 14,000 acres of the Eagle Ford shale in south Texas. He told the Houston Chronicle that when investors asked for dividends from smaller oil companies, their real point was “we don't trust you to hold the money because you'll waste it, so we want it back”.The International Energy Agency this week published its Global Energy and CO2 Status Report 2017, showing that world energy consumption rose by 2.1 per cent last year, while energy-related carbon dioxide emissions rose by 1.4 per cent, after having been flat for three consecutive years. Energy use and carbon dioxide emissions, the yellow and blue lines respectively, have been growing slower than global gross domestic product, the green line, but they are still growing. The IEA said the rise in emissions last year was “a strong warning for global efforts to combat climate change, and demonstrates that current efforts are insufficient to meet the objectives of the Paris Agreement.”
1;DUK;Duke Energy Corp;2020-04-24T18:07:40+0000;Rising interest rates punish US power sector;Heavily indebted utilities shore up balance sheets as financing costs increase;US utilities, sustained for years in a warm bath of favourable financial conditions, are facing a cold shower.An expected rise in interest rates and the shake-up of the tax system passed into law at the end of last year are threatening to squeeze utilities’ finances. Already, the S&P 500 utility sector index has dropped 13 per cent from its peak in November.Duke Energy, one of the largest US utility groups by market capitalisation, on Tuesday gave an indication of the changing times, saying it planned to raise $2bn from selling shares this year and would cut its five-year capital spending plan by $1bn. Lynn Good, chief executive, said the share sale was needed “to maintain the strength of our balance sheet”.FirstEnergy, another large utility, last month announced a $2.5bn investment in shares and convertible preferred shares, backed by investors including Elliott Management and GIC, to pay off debt, contribute to its pension fund, and “strengthen the company’s investment-grade balance sheet”. The colder financial climate is expected to prompt other utilities to rethink their capital allocation, pushing some of them towards disposals or acquisitions.An immediate impact from expectations of rising interest rates has been to make utilities less attractive investment propositions. Listed utility groups generally make most of their income from regulated assets, which means that their earnings and dividend payments are steadier and more reliable. That makes their shares behave more like bonds.In a note on Wednesday, strategists at JPMorgan listed 50 “bond proxies” that were “stocks to avoid in a rising rate environment”. More than half of them were utilities, including Duke, Exelon, NextEra Energy and American Electric Power.Beyond the “bond proxy” effect, higher interest rates also threaten to disturb the cosy financial equilibrium that has supported US utility companies through a turbulent time for their industry. Demand for electricity in the US is stagnating: total power consumption was slightly lower last year than in 2010, according to the Energy Information Administration. Meanwhile, there has been a dramatic shift in the fuel mix. Since 2010 the proportion of US electricity generated by coal-fired plants has dropped from 45 per cent to 30 per cent, while the proportion from gas rose from 24 per cent to 32 per cent and the proportion from renewables rose from 4 per cent to 10 per cent.But through all that, the US utility industry has been able to prosper. The sector index rose 82 per cent from the start of 2010 to November 2017. The relatively comfortable position of US utilities has been in sharp contrast to their European peers, which have undergone a gruelling decade of financial pressures and forced restructuring.A key reason for that has been the low cost of two of the US industry’s principal inputs: natural gas, and money. Utilities have been able to keep regulators happy with modest increases in rates, while increasing their earnings and dividends. Gas seems set to stay cheap but the cost of money is rising.Although many US utilities are heavily indebted, there is no imminent financing crisis looming. The utilities in the S&P 500 have debt with an average maturity of 14.5 years, JPMorgan calculates, and only 19 per cent of their debt matures by 2020. Over time, however, rising interest rates will put upward pressure on their costs. In their regulated businesses, the utilities should be able to recover those increased costs from their customers. But the more companies try to raise rates, the greater the risk that they will face challenges from regulators.The problem is compounded by the impact of the new corporate tax system. The changes are complex and will affect different companies in different ways, but one common effect of the system is that it squeezes the utilities’ cash flows.The main rate of corporate tax has been cut from 35 per cent to 21 per cent, and regulators are expected to insist that customers benefit from that reduction with lower bills. In the long run, companies will be able to recoup the lost income, according to Todd Shipman of S&P Global Ratings. “Rates will be lower today and then higher in the future,” he says. In the short run, however, the loss of revenue means that cash flows will be squeezed. The result is likely to be that some utilities’ credit ratings will be cut, Mr Shipman says. “I don’t expect a lot, but there almost inevitably will be some.”Merger and acquisition activity in US utilities slowed sharply last year after a hectic 2016. This year, rising interest rates could help spur a revival in dealmaking, according to Kenyon Willhoit of PwC, the professional services group. Some companies will be prompted to sell assets to reinforce their balance sheets, while others will see opportunities to buy.“It provides another reason for utilities to look to the merger and acquisition market to supply additional growth,” Mr Willhoit says.
2;DUK;Duke Energy Corp;2017-08-18T04:01:55Z;Approaching eclipse sheds light on US solar energy expansion;Need for replacement power sources as skies darken highlights the sector’s growth;A rare eclipse set to traverse the US on Monday has sparked a tourism bonanza, as people flock to towns in its path to see the sun’s corona encircle the moon.The control rooms of the nation’s electric utilities will also be watching.That is because thousands of megawatts of solar energy will disappear as skies darken.In California, the grid operator is lining up additional supply from natural gas power plants and hydroelectric dams to accommodate the drop. PJM Interconnection, the grid spanning from Illinois to New Jersey, expects up to 2,500MW of solar power to be lost and will rely on replacement generation.The contingency plans reflect the expansion of solar energy in the US in the years since 1979, the last time a total solar eclipse awed the country. The rise has been especially dramatic in California, which aims to get half its power from renewable sources by 2030 in a bid to cut greenhouse gas emissions.California lies south of the “path of totality”, where day briefly turns to night, but more than half its sunlight would be obscured between roughly 9am and noon on Monday, the California Independent System Operator (ISO) said.As people flip on lights and solar plants and rooftop photo-voltaic systems lose their fuel source, the California grid operator said it would have to fill a gap of 6,000MW — enough power for 6m homes.“We’ve told the market that we’re going to need extra generation on that morning,” said Steven Greenlee, an ISO spokesman.The grid managed by ISO has added about 2,000MW of solar generation in each of the past four years, bringing installed solar capacity to almost 10,000MW. Solar plants around the state can now meet as much as 30-40 per cent of demand.Solar energy drops off daily when night falls, and unexpectedly when clouds form. “But this is greater in magnitude, and it’s faster,” Mr Greenlee said. Grid managers are drawing lessons from Europe, which in 2015 underwent its first total eclipse of the solar power era without incident.California’s public utilities commission is using the eclipse as a teachable moment. The agency has invited residents to pledge to unplug toasters and phone chargers to diminish the need for fossil fuel power during the solar shortfall. “When you Take the Pledge, you are joining a movement of Californians who are taking action during the eclipse to give the sun a break by saving energy and reducing GHG emissions,” it said on a special eclipse website.In the absence of affordable electricity storage, the use of gas and hydro plants as back-up power sources highlights dependence on a diverse portfolio of energy sources. The challenge of intermittent output from solar and wind power plants could intensify if the California legislature passes a bill requiring 100 per cent of electricity to come from renewable sources by 2045.Elsewhere, carbon emissions will receive a bump from the tailpipes of millions of eclipse enthusiasts driving towards the path of totality, which cuts eastward through 14 states from Oregon to South Carolina. Highway patrols have warned of traffic jams on back roads, motels in obscure hamlets are booked solid and online vendors have exhausted supplies of safety eyewear.Hopkinsville, Kentucky branded itself “Eclipseville” and expects an influx of 100,000 people. It has planned a three-day festival around a celestial event that lasts less than three hours.“We have people coming from 45 different states and 19 different countries. This is definitely going to be the largest event our community has ever hosted,” said Brooke Jung, a consultant to the town.The eclipse will exit the US south-east by late afternoon. Duke Energy, a utility there, plans to host eclipse watchers at a South Carolina nuclear power plant on Monday, serving hot dogs and ice cream and playing songs such as “Blue Moon” and “Here Comes the Sun”.“It’s like a solar eclipse craze,” said Randy Wheeless, Duke spokesman.Duke also manages solar farms in North Carolina, the state with the second-most solar capacity after California. Mr Wheeless said about 2,000MW of solar output may be lost as the eclipse passes.He compared the effects of the eclipse to a thunderstorm, though one that was long predicted and darkens a whole region at once. “It presents a unique challenge because it’s right in the middle of the afternoon, when you could possibly lose a large amount of solar,” he said.
3;DUK;Duke Energy Corp;2020-04-24T21:00:03+0000;Norwegian oil fund sells shares in Duke Energy;Fund places US utility on list of groups it will not invest in, due to risk of environmental damage;Norway’s $900bn oil fund has underlined its ethical credentials by adding US utility Duke Energy to a list of companies it is barred from investing in due to the risk of “severe environmental damage”. The world’s largest sovereign wealth fund put Duke on its list of more than 110 companies that it will not buy shares in, which includes Airbus, Boeing, Philip Morris, Rio Tinto and Wal Mart. The oil fund backed a recommendation from Norway’s council of ethics — an independent body that reviews corporate behaviour — that Duke had “repeatedly discharged harmful substances from a large number of ash basins at coal-fired power plants in North Carolina”. The Norwegian fund is one of the most influential investors in the world, owning on average 1.3 per cent of every listed company globally, and its decisions on which businesses to exclude are often followed by other shareholders. The fund owned a 0.62 per cent stake in Duke — worth $304m — at the end of last year but sold all its shares before announcing the utility’s exclusion from its investment universe, as it typically does. Duke had been lobbying the fund to avoid being banned under Norway’s attempts to exclude any company deriving more than 30 per cent of its business from coal, according to local press reports from the US. But the council of ethics instead centred in on the ash basins.It said in April it was recommending the fund exclude Duke Energy and three subsidiaries “due to the unacceptable risk of these companies being responsible for severe environmental damage”.“For many years, these companies have among other things repeatedly discharged environmentally harmful substances from a large number of ash basins at coal-fired power plants in North Carolina,” it added.Several court rulings have ordered Duke and the subsidiaries to remove or seal the ash basins, but the measures would not be completely carried out for 10 to 15 years, said the council.Norway’s oil fund was among the first state-backed investors to name publicly the companies it was excluding.It started more than a decade ago, focusing initially on the makers of arms such as anti-personnel landmines, cluster munitions and nuclear weapons.The oil fund added tobacco producers in 2009 and coal companies this year. Duke said: “It is unfortunate that [the oil fund] did not consider Duke Energy’s proactive actions to enhance our environmental stewardship and close ash basins across our jurisdictions.”
4;DUK;Duke Energy Corp;2016-09-07T13:11:59Z;Norway oil fund excludes Duke Energy over environmental fears;;Another company bites the dust at Norway’s gargantuan $900bn oil fund.The world’s largest sovereign wealth fund said on Wednesday that it would exclude Duke Energy, the US utility, and three subsidiaries from its portfolios due to the risk of severe environmental damage, writes Richard Milne, Nordic Correspondent.Duke had already been lobbying the oil fund to avoid being banned due to its coal-fired power plants, according to local press reports.Instead, the Norwegian fund backed a recommendation from the country’s council of ethics – an independent body that reviews corporate behaviour – that Duke had “repeatedly discharged environmentally harmful substances from a large number of ash basins at coal-fired power plants in North Carolina”.The council added that, despite several court decisions ordering Duke and its subsidiaries to remove or seal the ash basins, the measures would not be completely implemented for 10-15 years.The oil fund owned 0.62 per cent of Duke at the end of last year, equivalent to $304m. It typically sells its stake before announcing the exclusion decision.Duke joins more than 110 companies that are excluded from the oil fund’s portfolios including producers of tobacco and nuclear weapons as well as companies deriving more than 30 per cent of their business from coal. The companies include Airbus, Boeing, Philip Morris, Rio Tinto and Wal Mart.Duke did not immediately respond to a request for comment.
