;Ticker;Nombre_Completo;Date_Time;Titular;Subtitular;Texto
45;DUK;Duke Energy Corp;2011-04-28T21:35:45Z;US GDP data weigh on markets;;Wall Street continued to trend upwards following the multiyear highs reached in the previous session, but sentiment was held back slightly by mixed earnings reports from industry bellwethers ExxonMobil and Procter & Gamble and disappointing data on US economic growth.ExxonMobil, the world’s largest oil company by market capitalisation, reported a 69 per cent rise in first-quarter earnings to $10.7bn, largely on the back of high oil prices. A record performance in Exxon’s chemicals division also helped, and earnings came in at $2.14 per share, ahead of the $2.07 expected by analysts.But the recent jump in energy prices had left the markets with extremely high expectations for the oil giant, and so the stock was down 0.5 per cent at $87.34 following the results. The stock has still gained 19.3 per cent, however, since the start of the year.Elsewhere on Wall Street, Procter & Gamble reported weak sales growth of less than 1 per cent in developed markets and said it had underestimated commodity inflation in “a very difficult operating environment”.But thanks to emerging market growth, overall net sales increased by 4.5 per cent, which helped to negate any negative impact on the stock from slower domestic growth. The stock was mostly flat throughout the day, but was up 0.8 per cent at $64.50 at the close.These mixed results left the wider markets struggling for direction for much of the session, but in late trading the overwhelming optimism in the markets thanks to the surprising good earnings season so far won out.The S&P 500 index closed up 0.4 per cent to 1,360.48, its highest point since June 2008. The S&P has risen 1.8 per cent this week as first-quarter earnings have largely beaten forecasts. So far, 78 per cent of the S&P 500 companies that have reported earnings so far have beaten analysts’ expectations, ahead of the 73 per cent beat-rate in the last quarter.The Dow Jones Industrial Average was up 0.6 per cent to 12,763.31 while the Nasdaq Composite added 0.1 per cent to 2,872.53.Sentiment was not helped by news that the rate of growth in the US economy had slowed to 1.8 per cent in the first three months of 2011 from the 3.1 per cent rate in the same period a year ago. This was below the 2 per cent growth rate expected by economists.“We can see that headwinds like commodity price inflation and the slow rate of job creation are dragging on the US economy,” said Kevin Mahn, chief investment officer of Hennion & Walsh. “This raises concerns about the sustainability of the US economy when the government stimulus comes to an end,” he said.Starbucks also reported mixed results, leaving the coffee chain 0.8 per cent lower at $36.88. The company reported worldwide net earnings up 20 per cent to $261m as well as a 20 per cent rise in sales growth in China, but margins were hit by higher coffee prices.In deal news, Constellation Energy rose 5.7 per cent to $36.26 after Exelon agreed to buy the electricity generator and utility operator. Exelon shares were up 1.7 per cent to $42.18.The all-stock deal valued at $7.9bn would create a US utility to rival Duke Energy and Progress Energy as the country’s largest power group. Duke was up 0.8 per cent to $18.68 while Progress added 0.8 per cent to $47.32.Sprint Nextel added 6.7 per cent to $5.11 after reporting that its loss had narrowed by nearly half as the wireless carrier continued to add customers.Aetna results were another bright spot, with the stock rising 4.1 per cent to $41.45 after the health insurer raised its 2011 profit target and reported first-quarter earnings that topped estimates.Elsewhere on Wall Street, Ebayreported steady earnings growth for the first quarter of 2011, driven mainly by its payment arm. But investors were disappointed, and the stock was down 0.1 per cent to $34.Eastman Kodak, the troubled photography group, sank 10.1 per cent to $2.85 after swinging to a first-quarter loss of 92 cents a share. The company also reported that revenues fell 31 per cent amid continuing declines in its film segment.Evergreen Solar slumped after the company said it may need to raise cash to continue operations after first-quarter sales fell short of expectations. The stock tumbled 31.7 per cent to $1.42.Skechers lost 7.5 per cent to $19.02 after the maker of Shape-ups toning shoes reported first-quarter profit of 24 cents a share, missing the average analyst estimate by 20 per cent.
46;DUK;Duke Energy Corp;2011-04-20T15:22:38Z;AES to buy DPL for $3.5bn in consolidation bid;;"AES, the Virginia-based global power producer, has agreed to buy DPL, a regional energy company, in a transaction valued, on an enterprise basis, at $4.7bn.Under the terms of the deal, announced on Wednesday, AES will pay $30 per share in cash to DPL shareholders, for a total of $3.5bn for the equity, and assume $1.2bn in net debt. The purchase price represents close to a 9 per cent premium to DPL’s closing stock price of $27.59 on Tuesday.The deal follows a string of moves in recent months as the sprawling US power sector, of some 250 midsize and large utilities and distribution companies, attempts to consolidate.The process has been difficult; regulators have scuppered previous merger attempts by utilities, making companies uncomfortable about their own prospects.FPL, which owns Florida’s largest utility, abandoned a $11.4bn takeover attempt of Constellation Energy group in 2006 after a face-off with regulators in Maryland, where Constellation is based. Exelon, a utility based in Chicago, dropped its plan in 2006 to buy Public Service Enterprise Group of New Jersey amid concerns by regulators in that state.In both cases, legislators raised concerns that the combined utility groups could lead to higher power rates.Activity picked up again this past year, however, when Duke Energy announced its $13.8bn takeover of Progress Energy and Northeast Utilities announced its acquisition of Nstar for $4.1bn in shares.Paul Hanrahan, AES president and chief executive, said: “We are concentrating our growth efforts in a few key markets, including the US utility sector, where we see opportunities to leverage our global platform of 40,500MW and 11.5m utility customers’’.He expects the acquisition of DPL to benefit from the regional scale provided by its nearby utility business at Indianapolis Power & Light. DPL serves more than 500,000 customers in West Central Ohio.DPL will remain a standalone business, with local management and corporate functions, but it will be able to leverage the expertise and resources of AES’ global portfolio. DPL headquarters will remain in Dayton, and the company will continue to use the local name.The deal remains subject to approval of DPL shareholders and state and federal regulators. AES expects approvals within six to nine months.AES has committed bridge financing in place from Bank of America Merrill Lynch. Financing will include a combination of non-recourse debt, the re-issuance of corporate debt at AES that was temporarily paid down in 2010, and cash on hand.AES shares rose more than 2 per cent, to $12.75, before the market opened. Shares of DPL soared 8 per cent to $29.92.Bank of America Merrill Lynch acted as financial adviser, and Skadden, Arps, Slate, Meagher & Flom served as legal counsel to AES. DPL’s financial adviser on the transaction was UBS Investment Bank, and its legal adviser was Cadwalader, Wickersham & Taft."
47;DUK;Duke Energy Corp;2020-04-24T20:19:31+0000;US rediscovers appetite for M&A;;US companies have returned to large strategic deal-making, helping to boost global mergers and acquisitions activity by 26 per cent in the first quarter.Thanks to a flurry of big deals, US M&A activity jumped 84 per cent to $267bn in the first three months of the year, compared to the same period in 2010. The US now accounts for almost half of global activity, up from about a third last year.Nine of the 10 biggest deals this year have been struck in the US, suggesting confidence among American chief executives and boards has bounced back faster than elsewhere.According to a survey released by the Business Roundtable on Wednesday, US executives believe the economic recovery is gaining momentum. “Companies have given strong signals about their willingness to expand,” said Ivan Seidenberg, chairman of the Business Roundtable and CEO of Verizon, with record numbers forecasting higher sales, hiring and capital spending.Jim Rogers, chief executive of Duke Energy, has said he is interested in more deals in the fragmented US power market. The company’s planned $26bn tie-up with Progress Energy would create the country’s largest utility. Warren Buffett has also signalled that his investment company, Berkshire Hathaway, is seeking bigger targets to generate growth. In March, Berkshire Hathaway agreed to buy chemicals company Lubrizol for $9bn.Deals involving companies from Brazil, Russia, India and China accounted for 12.6 per cent of global activity, their highest contribution since Mergermarket records began in 2001. “Five years ago, we started to see Asian companies begin to get involved in looking at cross- border deals and gradually building their transaction skills,” said Hernan Cristerna, JPMorgan’s head of M&A for Europe, the Middle East and Africa. “Today, there has been a shift of dealmaking inbound into Europe from China, India and Brazil.”Overall, however, emerging market activity fell about 14 per cent, although last year’s figures were boosted by Carlos Slim’s $34bn restructuring of his Mexican telecoms empire. Advisers said they did not see a tailing off in underlying interest in the emerging markets.Europe had a quieter quarter in M&A, with activity up about 27 per cent to $162bn.“Europe remains a hard market to call,” said Matthew Ponsonby, co-head of Emea M&A at Barclays Capital. “We are up versus the same period last year but it doesn’t feel like an exuberant market. Transactions have to be very measured and make strategic sense.”JPMorgan is poised to finish the quarter at the top of the global league tables for the first time since 2004.
48;DUK;Duke Energy Corp;2011-03-30T20:00:07Z;Advisers big and small jockey for position;;The standard backbiting between advisers looking for league table credit this quarter revolves around one question.Has dealmaking’s balance of power shifted away from institutions with big balance sheets towards independent advisers, or boutiques?JPMorgan’s place at the top of the league tables, in the US and globally, would suggest not.The bank has worked on seven of the 10 largest deals worldwide so far this year, notably utilising its size in writing a $20bn bridge loan to AT&T for the $39bn acquisition of T-Mobile USA, something credit rating agency Moody’s called a “credit negative” that could encourage other banks to take on outsized risks.Spots advising Duke Energy on its $26bn stock deal with Progress Energy and AMB on its $14bn merger with ProLogis, helped JPMorgan pull ahead, even when deals it financed are excluded from the rankings.Yet the ability of independent firms, who do not lend, to execute big deals has also been noteworthy. Perella Weinberg Partners blind-sided Wall Street’s bulge bracket with its role advising NYSE Euronext on its tie-up with Deutsche Börse .Independent advisory outfit Greenhill was lead adviser on the AT&T deal, ahead of JPMorgan and Evercore.For Evercore, AT&T capped a good run, after it also advised Lubrizol on its $9bn acquisition by Warren Buffett.Boutiques argue that providing advice alongside funding creates conflicts of interest.This issue is back in the spotlight after a US court in February criticised Barclays Capital for its conduct in the Del Monte buy-out, where the bank was advising the selling company and financing the buyer Kohlberg Kravis Roberts.The enduring presence of Goldman Sachs and Morgan Stanley in dealmaking’s upper echelons proves a vast balance sheet is not needed to compete in the M&A business, argue bankers.Moreover, add some, advisers have ample reason to root for deals to happen, whether or not they are providing lucrative funding arrangements.Evercore’s share price jumped 12 per cent on the announcement of the AT&T deal.Thomson Reuters data suggests M&A accounted for 35 per cent of overall investment banking fees in the first quarter.So while lobbying for a name-check on deals muddies the league tables, the long-awaited pick-up in a low capital-intensive, high-margin business is nevertheless good news for all.
49;DUK;Duke Energy Corp;2020-04-24T18:21:11+0000;Duke Energy seeks fresh merger prospects;;Duke Energy, the North Carolina-based power company, will be looking for more acquisitions once it has completed its $13.8bn takeover of its neighbour Progress Energy, its chairman has said.Duke will become the largest energy utility in the US, with a market capitalisation of about $38bn, when the deal closes, which is scheduled for the end of the year.Jim Rogers, who will be executive chairman of the merged company, told the Financial Times that Duke would be “in a stronger position to continue the consolidation which I think is inevitable in a very fragmented market in the US”.He added that it was “almost premature” to think about further targets before the Progress deal was done, but added: “As you think about how this industry has consolidated over the last 20 years, it continues.”Merger and acquisition activity in the US power sector picked up strongly last year, but the industry remains much less concentrated than in the European Union, where a few regional giants such as EDF of France and Eon of Germany are dominant. Their market capitalisations are about $82bn and $65bn, respectively.Several attempted US power utility deals were blocked by regulators in the past decade, and Duke still needs to secure approvals from state and federal authorities. However, regulators recently appear to have been more willing to give a green light to deals.Mr Rogers said he expected Duke to become a “must-own utility” for investors, boosting the share’s price/earnings ratio and strengthening its ability to make acquisitions.He added that the group was likely to look for further deals with utilities that operated under regulation, rather than selling power into a free market.Duke’s shares pay a relatively high yield of about 5.4 per cent, based on last year’s dividends, and regulated returns, which will provide about 85 per cent of the operating profits of the merged group, offer greater stability of cash flows.Mr Rogers’ role will include providing advice on “strategic matters” to Bill Johnson, the chairman and chief executive of Progress who will become chief executive of the merged company.John McConomy, a partner at PwC, said the barriers that had stood in the way of M&A in the US energy industry, including commodity price volatility, uncertainty over regulation of carbon dioxide emissions, and the economic downturn were falling away.“We have considerably more companies generating power in the US than makes sense from an economic point of view,” he said. “I think the conditions remain ripe for further deals.”Mr Rogers, who has been a strong supporter of a cap-and-trade system to curb carbon dioxide emissions, said the proposal had “hit a roadblock” following the midterm elections, which gave the Republican party control of the House of Representatives.
50;DUK;Duke Energy Corp;2011-03-02T02:42:56Z;PPL buys Eon’s UK electricity network for $5.6bn;;PPL, the US utility, has reached a deal to buy Central Networks, the UK electricity networks business of Eon, Germany’s largest utility, for more than $5.6bn (£3.5bn) in cash and $800m of existing public debt to be assumed through consolidation.The Pennsylvania-based power company is snapping up the UK’s second-biggest electricity network, which provides power to more than 5m customers in the Midlands. PPL and Eon expect to close the transaction in early April.“This acquisition expands our UK business into a very strategic and core element of our overall regulated utility business platform,” said James Miller, PPL’s chairman, president and chief executive officer.Eon, which is being advised by JPMorgan and Barclays Capital, could not immediately be reached.The deal marks PPL’s second large purchase from Eon in the past year. The company last April beat Duke Energy and others to buy the German group’s US supply companies for more than $6.7bn in cash – the US utility’s largest deal to date.PPL’s shares sank 2.1 per cent to $24.90 as investors absorbed the prospect of another large deal.Last year’s purchase of Louisville Gas and Electric and Kentucky Utilities, Eon’s two regulated US utilities, was financed in part through a $2.5bn sale of equity, as well as through new debt and existing cash balances.PPL’s regulated status makes it important for the company to maintain its investment-grade credit rating.Eon began considering new approaches after talks last year to sell the business to a group of buyers led by Canada Pension Plan stalled over price.PPL edged out Cheung Kong Infrastructure, the investment vehicle of Hong Kong billionaire Li Ka-shing, which was also bidding. MidAmerican Energy Holdings, owned by Warren Buffett’s Berkshire Hathaway, was also among the interested parties.The sale of the electricity business is part of Eon’s plan to raise €15bn (£12.7bn) by the end of 2013 from asset sales, as it seeks to cut debt and expand in growth regions outside Europe, such as Latin America.The company expects its businesses outside Europe to deliver one quarter of its total earnings by 2015.Last July, EDF of France sold its UK electricity networks business to CKI for £5.8bn, underlining the prices such distribution systems can fetch in today’s market.At the time, analysts said the sale suggested the market for energy companies was improving and that others with similar network assets in Britain, including Eon and Iberdrola of Spain, might put the businesses up for sale.PPL already owns two companies in the UK, known collectively as Western Power Distribution. One delivers electricity to 1.5m customers in an area stretching from Bristol to Bath, while the other serves 1.1m people in south Wales.
51;DUK;Duke Energy Corp;2011-02-20T15:21:47Z;Activist investors set for busy US season;Environmental issues still in favour;"This year’s proxy voting season in the US is shaping up to be just as frenzied as last year’s, with activist shareholders already lodging a total of 359 resolutions, and environmental causes still in favour, a new survey entitled Proxy Preview 2011 suggests.The pet causes of share owners such as pension funds and labour unions include calls for new money laundering restrictions at Bank of America.However, investors have filed more shareholder proposals on environmental issues than any other topic, with 24 resolutions involving coal production and hydraulic fracturing – a shale gas extraction method – targeting companies such as Chevron, El Paso, ExxonMobil and Duke Energy.The Teamsters, a powerful US labour union, is asking Chevron to stop doing business in Burma. Shareholders interested in campaign finance reform are focusing their efforts on alleged abuses involving companies’ political donations.About 26 per cent of the proposals filed in 2011 involve the environment; another 12 per cent focus on labour and human rights; 23 per cent on diversity initiatives; 10 per cent on sustainability; and 23 per cent on political spending.About half of the resolutions filed will be voted on at companies’ annual meetings in the spring, according toAs You Sow, the US non-profit group that compiled the survey."
52;DUK;Duke Energy Corp;2011-02-18T22:44:46Z;Wall Street gains led by energy stocks;;Shares in Progress Energy lost ground after the company reported weak fourth-quarter earnings, but the wider market edged up to fresh two-and-a-half-year highs led by oil stocks.The power generation company reported a 19 per cent drop in fourth-quarter profits as interest charges and taxes increased, although revenue edged up and lower operating costs buoyed margins. The stock was down 0.5 per cent to $45.70.Progress is in the midst of being acquired by rival Duke Energy in a $13.7bn deal that would create the largest power utility in the US. Duke was down 1 per cent to $17.94.The S&P 500 closed up 0.2 per cent to 1,343.01, a gain of 1 per cent over the week, led by oil and gas stocks. On Wednesday, the index reached the point where it had doubled from its recession low.The Dow Jones Industrial Average gained 0.6 per cent to 12,391.25, up 1 per cent over the week, while the Nasdaq Composite rose 0.9 per cent to 2,833.95, adding 0.9 per cent over the five-day period.Energy stocks saw the strongest gains as oil prices edged higher on political uncertainty in north Africa and the Middle East. Murphy Oil was up 1.7 per cent to $73.88 while Chevron added 1.6 per cent to $98.72. The S&P oil and gas index was up 0.8 per cent.Material stocks gave up ground, however, on news China had raised its reserve ratio requirement by 50 basis points in a further move to combat inflation.Freeport-McMoRan, the world’s biggest copper miner by market capitalisation, was down 4.2 per cent to $52.95 while the S&P basic materials index was 2.4 per cent lower.Traders also had one eye on Europe amid concerns about Portugal’s ability to raise funds in the capital markets, ahead of this weekend’s meeting of G20 finance ministers in Paris.In earnings news, Newpark Resources, a provider of drilling fluids, reported fourth-quarter earnings of 15 cents a share, beating the average analyst estimate of 10 cents, and sending the stock up 4.8 per cent to $6.81.Elsewhere in the wider energy sector, SunPower, the second-largest supplier of solar cells in the US, forecast 2011 earnings of as much as $2.20 a share, far surpassing the $1.74 cents a share estimated by analysts. The shares were up 3.5 per cent to $18.04.Campbell Soup was down 3.9 per cent to $33.58 after the food company reported second-quarter earnings down 7.7 per cent and lowered its 2011 outlook.Mergers and acquisitions activity dominated the week on Wall Street.Monday kicked off with a $2.8bn acquisition by General Electric. The biggest US industrial group by market capitalisation said it was buying the well support arm of John Wood Group, the UK oil services company. GE was up 0.5 per cent to $21.44 over the week.Along with high oil prices amid tensions in the Middle East and north Africa, this helped energy stocks see some of the strongest gains over the week. Among the leaders was Noble, the offshore driller, which was up 8.1 per cent to $42.07 while Schlumberger added 5.1 per cent to $95.04.Elsewhere, NYSE Euronext unveiled formal plans to merge with Deutsche Börse, the main German exchange.NYSE was down 1.4 per cent to $37.79 on the week, however, after investors reacted negatively to the specifics of the deal which will see the German exchange own 60 per cent of the new company and have the majority of directors on the board. NYSE is still up 13 per cent since rumours of merger talks emerged.Sanofi-Aventis, the French pharmaceutical group, finally agreed its deal with Genzyme for $20.1bn in the biggest takeover in the pharmaceutical sector since 2009. This led Genzyme up 3.9 per cent over the week to $75.38.In the retail sector, an investment group made an offer for Family Dollar Stores, sending shares in the discount retailer up 19 per cent to $52.55 over the week.Shares in Green Mountain Coffee Roasters, the US market leader in one-cup coffee brewing, lost ground after Starbucks said it was partnering with a rival single-serving coffee company.The stock had jumped more than 40 per cent in the previous two weeks on rumours it was in talks with Starbucks.Analysts at Roth Capital argued, however, that this might all be a negotiation tactic by Starbucks and that there was still a “fair chance” an alliance would be reached. Still, shares in Green Mountain were down 3.8 per cent to $41.81 over the week.A raft of economic data also helped to move the markets higher. The most promising piece of data was from the Philadelphia Fed showing that US manufacturing had risen strongly in February, surging unexpectedly from 19.3 in January to 35.9 in February.However, data also showed that the number of people claiming for unemployment had risen by 10,000 more than expected, to 410,000.In other data, US home construction was strong and consumer price index inflation was higher than expected. The Federal Open Market Committee revised the US gross domestic product outlook up and unemployment down.
