;Ticker;Nombre_Completo;Date_Time;Titular;Subtitular;Texto
59;HUM;Humana Inc;2020-04-24T22:03:09+0000;US health insurance reform;;The more muddled Barack Obama’s crusade to remake US healthcare has become, the higher share prices of big insurers such as UnitedHealth, Aetna and Humana have risen. They faltered this week as plans emerged from the Senate to directly tax the industry to help pay for coverage to nearly 50m uninsured Americans.The main distinction between soaking insurers directly and eliminating the tax-free nature of employer health benefits is that the latter proved wildly unpopular, particularly among Democrats’ union allies, while the former is palatable to all but insurers’ shareholders. But the distinction would rob Peter to pay Paul as both would result in higher customer outlays or more limited coverage for those already insured.Healthcare companies, including drugmakers, would pay a direct levy and people with high-priced health insurance would also pay. Taxing what politicians dub “Cadillac” health plans has other flaws though. It would not distinguish between typical private sector employees who pay nearly a third of premiums out of pocket and those of civil servants who often pay next to nothing. It would also disproportionately hit policies in high-cost states that bar insurers from denying coverage to riskier customers, thus discouraging a key goal of healthcare reform.As passing Obamacare has grown from a policy initiative into a litmus test of the new administration’s power, political expediency has overshadowed many of its original goals. Chief among these is controlling costs without affecting quality of care. Incentivising a better match between medical cost and benefit is key to this. Without such changes in medical decision-making or a workable public plan, insurance reform simply becomes an exercise in redistributing unacceptably high costs. Creating the illusion that the healthcare industry itself will foot the bill is a convenient fiction.E-mail the Lex team confidentiallyORPost public commentsThe Lex column is on Twitter
60;HUM;Humana Inc;2009-08-26T20:23:16Z;Wall Street shrugs off mixed data;;"US stocks closed a whisker higher after a choppy day of trade on Wednesday as investors digested a mixed set of economic data.A disappointing reading on durable goods orders for July weighed on industrial stocks, which were the day’s weakest sector.Although the headline figure was encouraging, analysts focused on the number that excluded transportation, discounting the temporary effect of the government’s cash-for-clunkers programme.That data was worse than expected, which triggered widespread selling in the industrial sector.Caterpillar, the machinery maker, dropped 1.2 per cent to $47.25, while
Honeywell, the manufacturing conglomerate, lost 1.1 per cent to $37.12.General Electric was also caught up in the selling, in spite a new $2.7bn contract to build a power plant in Kuwait and reports of a possible $2bn sale of its security unit. The shares fell 1.3 per cent to $14.11.The early falls were mitigated by a sharp rise in monthly sales of new homes , which boosted the homebuilding sector.Lennar gained 4.1 per cent to $15.58 and DR Horton climbed 5.7 per cent to $13.79.The benchmark S&P 500 index, the Dow Jones Industrial Average and the Nasdaq Composite index all closed a fraction higher at 1,028.12, 9,543.52 and 2,024.43, respectively.That constituted the seventh successive positive session for the Dow.“Until it becomes clear that there is a sustainable economic trend you are going to see this kind of mixed data,” said Quincy Krosby, chief investment strategist at Prudential.“More worrying is the fact that the markets have sold off towards the close recently.”Metals producers came off their recent highs as commodity prices dipped. Freeport-McMoRan, the gold and copper miner, lost 1.5 per cent to $63.13, while Nucor, which makes steel, fell 2.4 per cent to $45.28.“Commodity shares could find a headwind with Chinese stocks soft and crude oil finding resistance at $75,” wrote Nick Kalivas, an analyst at MF Global.Financial stocks were also lower in spite of the housing data as well as figures showing that mortgage applications rose last week, defying a rise in mortgage rates.Signs of stabilisation in the housing market have lifted banks to the forefront of the recent rally, but they slipped on Wednesday as investors took an opportunity to take profits off the table.Citigroup declined 2.5 per cent to $4.63 and JPMorgan lost 0.6 per cent to $43.30.Morgan Stanley drifted 2.2 per cent to $29.53, even as rumours intensified
surrounding the sale of its Van Kampen investment unit, with Bloomberg reporting that the bank has approached at least three other asset managers with offers of a possible partnership or sale.Retailers were higher during the day, building on the gains made during Tuesday on the back of an unexpectedly sharp rise in consumer confidence.Budget retailers were especially strong, carried by the momentum from the previous session, when Big Lots reported better earnings than expected.The company was one of Tuesday’s strongest performers and rose again on Wednesday morning, picking up 3 per cent to $26.37.Rival Family Dollar climbed 3.5 per cent to $30.82.Williams-Sonoma, the kitchenware retailer, jumped after it reported a surprise profit and said that tight inventory control would see it earn more over the year than previously forecast.The sharp cost cuts mitigated slumping sales at the company, which also owns the Pottery Barn furnishings chain, and the shares rose 11.3 per cent to $17.21.Health insurers suffered however, as analysts predicted that the death of Senator Edward Kennedy could provide further impetus to government plans to reform healthcare.They said the Democrats may want to honour the memory of one of the strongest advocates for such reform.With the current plan proposing cuts in government subsidies to large health insurers, Humana lost 2.7 per cent to $36.15, while UnitedHealth fell 3.3 per cent to $28.93."
61;HUM;Humana Inc;2009-08-18T20:33:56Z;Wall Street stages modest rebound;;"US stocks rebounded on Tuesday after the steepest decline in more than a month during the previous session.Financial stocks, retailers and materials companies, which led the market lower on Monday, all did well as buyers were tempted back into the market.The benchmark S&P 500 index closed up 1 per cent at 989.67. The Dow Jones Industrial Average advanced 0.9 per cent to 9,217.94 and the Nasdaq Composite index gained 1.3 per cent to 1,955.92.“A lot of people missed the rally in March and again in July,” said Chris Verrone, investment strategist at Strategas Partners. “Therefore any pull-back will be viewed as a buying opportunity.”Investors continued to focus on retailers as earnings season for the sector kicked up a gear with results from Home Depot, Target and Saks. For all three the pattern during the quarter was similar, with strict cost controls mitigating ongoing sales weakness.Home Depot recovered all of Monday’s losses, which were triggered by disappointing results from rival Lowe’s, after lower costs than expected helped it raise its full-year outlook. Its shares picked up 3.1 per cent to $26.93.Budget retailer Target also beat analysts’ estimates with revenues in line with expectations but profit margins improving. The stock climbed 7.6 per cent to $44.32.Upmarket chain Saks reported a similar story as carefully managed expenses kept costs low and helped it beat earnings estimates. Its shares gained 6.9 per cent to $5.72.“Only 43 per cent of companies that have reported their earnings have beat expectations on both the top and the bottom line,” said Quincy Krosby, chief market strategist at Prudential. “We need to see revenue growth in the next quarter,”Financial stocks led the way, however, helped in part by improving credit card losses. Citigroup climbed 3.5 per cent to $4.14 and Bank of America gained 2.1 per cent to $16.90.Goldman Sachs was upgraded to “buy” at Pali Research, which predicted continued strength in its fixed-income business, and the stock rose 2.1 per cent to $160.48.American Express, meanwhile, was upgraded by KBW after credit losses improved last month. Its shares picked up 4.3 per cent to $31.69.CIT was one of the strongest financial companies, up 2.9 per cent to $1.40 after the commercial lender announced a narrower loss than in the same quarter last year.On Monday the group announced that it had bought more time to fight off bankruptcy by completing a $1bn debt tender.But the rally in financial stocks was not replicated everywhere and economic data limited the bullish mood. Figures showed that deflation continued to
hamper producer prices.There was weakness among health insurers, which bucked Monday’s
losing trend on signs that the Obama administration could abandon the public insurer element of its healthcare reforms.Such a plan has been
criticised as undermining the private sector and, after campaigners hit back at suggestions that it might
be dropped, insurers gave back much of the previous session’s gains.Humana lost 1.5 per cent to $35 and Coventry Health Care fell 2.6 per cent to $22.98.Homebuilders recovered from early losses, which were triggered by data showing that builders started work on fewer homes last month than expected. But economists said the rise in the number of new single-family homes was good for the sector. Lennar and DR Horton both finished the day 2.8 per cent higher, at $13.19 and $12.22, respectively.Technology stocks also showed strength after a bruising previous session. Smartphone makers were particularly strong after RBC described the market as “the next wave of
computing” and raised its price targets on the three leaders in the sector.Apple, which makes the iPhone, climbed 2.8 per cent to $164. Research in Motion, maker of the BlackBerry, picked up 4.6 per cent to $73.99. Palm, which recently launched the Pre, gained 4.9 per cent to $13.88."
62;HUM;Humana Inc;2020-04-24T21:00:03+0000;Wall Street fluctuates on swine flu concerns;;US equities fell on Monday as investors worried about the effects of a potential swine flu pandemic.Many companies fluctuated during the session as Wall Street moved to reflect which sectors could lose and which could benefit from an outbreak after the virus reached New York.AMR, the parent company of American Airlines, slumped 13.3 per cent to $4.70, while Delta Air Lines fell 14.3 per cent to $6.75. Investors were worried that travel would be the first industry to suffer if the flu continued to spread, and the Bloomberg US Airlines index suffered its heaviest intra-day fall since the session after the September 11 attacks.Tourism companies also suffered. Marriott, the hotel chain, dropped 5.1 per cent to $21.17 and Expedia, the online travel agency, fell 6.3 per cent to $10.53. Carnival, the cruise operator, lost 13.5 per cent to $24.59.Du Pont, which manufactures chemicals for the agricultural industry, led the materials sector lower amid worries about how the outbreak could affect farming. Its shares dropped 4.5 per cent to $27.50.Even credit card companies suffered because of the flu scare, as JPMorgan warned “cross-border fees may suffer from reduced cross-border travel related to the virus”. Visa lost 2.5 per cent to $58.87 and Mastercard retreated 4.4 per cent to $165.55.But Gilead Sciences, the drug company that developed the flu drug Tamiflu, and continues to receive royalties for its sales from Roche, the European company to whom it sold the licence, gained 3.8 per cent to $47.53.The benchmark S&P 500 index closed 1 per cent down at 857.51 points, while the Dow Jones Industrial Average ended 0.6 per cent lower at 8,025 points and the Nasdaq Composite index fell 0.9 per cent to 1,679.41 points.The market briefly rallied during the morning, but later fell back, despite some analysts saying the selling was overdone. Phil Orlando, chief equity market strategist at Federated Investors, said: “Investors overreacted during the outbreaks of Sars and bird flu, and we saw that again this morning, as traders shot first and asked questions later.”Lawrence Summers, the chief White House economics adviser, also dented confidence when he told Fox News on Sunday that the US economy would experience “sharp declines in employment for quite some time this year”.Fears that global demand could still be some way from returning hit metals prices, and industrial companies suffered as a result. Freeport McMoRan the copper miner, lost 3.1 per cent to $39.68, while Alcoa, which produces aluminium, gave up 3.8 per cent to $8.79.The macro-economic news overshadowed earnings announcements from several leading companies, including Verizon the second-largest US telecoms company by market value, which beat analysts’ expectations, as it attracted more new customers than expected. But with revenues from business customers continuing to fall, the company’s shares lost 1.5 per cent to $30.54.Elsewhere in the sector, Qualcomm, which makes microchips for mobile phones, disappointed with its first-quarter earnings, but the company gained ground after raising its full-year revenue targets on signs that the market could be improving. Its shares picked up 4.4 per cent to $43.17.Humana, the health insurer, jumped 6.9 per cent to $29.25 after reporting a surge in first-quarter profits, easily exceeding Wall Street’s expectations and allowing it to raise its outlook for full-year profits.Corning, which makes glass for televisions, also beat analysts’ predictions, as the company said demand for its products was improving. Its shares gained 3.3 per cent to $15.84.General Motors was the strongest performer of the morning after it said it would make deep cuts to its plants and workforce and eliminate the Pontiac brand. The company also asked its bondholders to swap $27bn of debt for equity. Its shares surged 20.7 per cent to $2.04.“We didn’t see the sell-off that the pre-market session indicated,” said Andrew Wilkinson, senior market analyst at Interactive Brokers. “We’ve lived through 18 months of intense pressure after the financial collapse and we realised this flue outbreak does feel like the next wave.”
63;HUM;Humana Inc;2020-04-24T23:05:53+0000;Cash incentives helping nation’s health;;Financial incentives from the taxpayer for people to quit smoking, lose weight or eat better may be an important means of improving the population’s health, leading academics have claimed.Their verdict comes as advisers to the Department of Health are promoting such schemes and as private health insurers are offering discounts to subscribers who go to the gym, eat more fruit and take other steps towards a healthier lifestyle.In Dundee, smokers are being offered £12.50 a week by the NHS if carbon monoxide testing shows they have quit. In Essex, pregnant women can claim a £20 food voucher from the NHS after stopping smoking for one week, £40 after four weeks and another £40 at the end of a year if they have still quit.Brighton offers children £15 for quitting smoking for 28 days, while overweight patients in Kent are also being offered incentives for losing weight. In the US and other countries incentives have been offered for weight loss, complying with diabetes treatment, or regularly testing negative for sexually transmitted diseases.Such schemes are controversial with the public and professionals, say Theresa Marteau and Richard Ashcroft, professors of health psychology and bioethics at King’s College and Queen Mary universities in London.Writing in the British Medical Journal, they say the programmes are attacked as “a form of bribery” and “rewarding people for unhealthy behaviour”, while others believe they undermine the doctor patient relationship and remove patients’ autonomy.But they say evidence is emerging some programmes may work, although research is needed to establish “the conditions under which change is achieved and sustained, and for whom”, as well as to identify unintended consequences.“Using payments may be more powerful than providing information, and less restrictive than legislation [which attempts to ban or punish activities],” they say. “Ultimately, if incentives prove to be effective in only a few contexts, they may still offer an important means to improve health.”Julian Le Grand, chairman of Health England, said the difficulty with prevention programmes was that the costs of unhealthy lifestyles could be far off in the future when the pleasures from them were felt now. Policies were needed that provided some of the benefits of changing lifestyle in the present, he said.
64;HUM;Humana Inc;2009-04-07T20:55:53Z;Wall Street falls on earnings fears;;US stocks fell on Tuesday as investors waited cautiously for Alcoa, the aluminium manufacturer, to kick off the earnings season after the close of the market.Alcoa dropped 1.5 per cent to $7.79 as analysts predicted that the company would make a first-quarter loss of $0.56 per share, with falling global demand taking its toll on profits. Its shares slipped further after the market closed when it reported a net loss of $0.61 a share, or $497m, on revenue of $4.1bn.Worries over earnings also weighed on Caterpillar, the machinery maker, which dropped 5.9 per cent to $29.45 after Andrew Obin, a Bank of America analyst, said the company was likely to make a wider first quarter loss than expected.“Investors are taking a little bit of profit off the table ahead of earnings,” said Bill Stone, chief investment strategist at PNC Wealth Management. “The financials have managed to rally over 60 per cent in the last few weeks. But I do not think anyone knows what their earnings are going to be like, so some of that money is coming back out.”This followed a subdued session on Monday, during which volumes were low and the market adjusted to the views of Mike Mayo, one of the first analysts to turn bearish on the banking sector, that banks might suffer the worst loan losses since the Great Depression.Those fears were exacerbated on Tuesday after it was reported that the International Monetary Fund is set to forecast global losses on toxic assets of up to $4,000bn.Citi added to the gloom when its analysts cut the US equities market as a whole to “underweight”, saying valuations did not look “particularly attractive”.The benchmark S&P 500 index ended 2.4 per cent down at 815.55 while the Dow Jones Industrial Average lost 2.3 per cent to 7,789.56 and the Nasdaq Composite fell 2.8 per cent to 1,561.61.“The market overextended on the way up and we’re seeing it correct itself a bit now,” said Randy Frederick, director of trading and derivatives at Charles Schwab. “Equities have a tendency to overshoot in both directions.”But Lincoln National provided a bright spot amid a falling financial sector after the life insurer said it was considering selling assets to build capital as it pays down $700m in debt. Its shares gained 8.2 per cent to $6.89.Health insurers also performed well after Centers for Medicare & Medicaid Services, a government agency, said that it would increase its basline payments to those companies by 0.8 per cent, higher than originally proposed.Humana gained 6.1 per cent to $27.92, while UniteHealth picked up 6.9 per cent to $23.45 and Coventry Health lifted 3.5 per cent to $14.26.General Motors fell, giving up all of the gains made during the previous session, after Bloomberg reported that the company was speeding up preparations for bankruptcy. Its shares lost 11.9 per cent to $2.Ford fell 7.4 per cent, meanwhile, to $3.49 as investors took profits after its shares jumped 16 per cent during the previous session on the news that it had swapped $9.9bn worth of debt for cash and shares.Sun Microsystems, the previous session’s heaviest faller, continued to lose ground as analysts predicted the technology company would find it difficult to find another suitor after IBM withdrew its offer for the company over the weekend. Sun’s shares fell 4.3 per cent to $6.28.Elsewhere in the technology sector, Applied Materials shed 8.7 per cent to $10.55 after the computer chipmaker said a $1.9bn solar power contract had been cut to $250m.In oil, Exxon Mobil retreated 1.9 per cent to $68.71 after Barclays cut its 2009 and 2010 earnings estimates for the energy company, having lowered its estimates for natural gas prices.Archer-Daniels-Midland, the agricultural conglomerate, lost 10.6 per cent to $25.66 after Citi recommended selling the shares, saying the decline in its agricultural services business had been extremely fast.Utilities was the only sector briefly to find gains during the day, pulled upwards in part by PG&E, the Californian energy provider, which was upgraded by Credit Suisse. Analysts at the Swiss bank said the Californian regulatory environment would help the company maximise its earnings. PG&E shares rose 2.8 per cent to $37.83.
65;HUM;Humana Inc;2009-04-06T20:41:54Z;Bank stocks drag Wall Street lower;;"Sun Microsystems tumbled on Monday, as its planned takeover bid by IBM ran into trouble.IBM withdrew its offer for Sun, leaving the talks suspended, but insiders say it remains to be determined whether the talks have fully collapsed or whether they’ll restart. This triggered a 22.7 per cent fall in Sun’s shares to $6.56.Banking stocks also suffered after Mike Mayo, an analyst at Calyon Securities, began coverage on 11 leading banks, giving them all an “underperform” or “sell” rating. Mr Mayo, one of the earliest analysts to turn bearish on banks, warned loan losses might exceed those seen during the great depression.Billionaire investor George Soros added his doubts about banks’ health later in the day, saying: “The banking system as a whole is basically insolvent.”Wells Fargo fell 6.7 per cent to $15.25, while Citigrouplost 4.6 per cent to $2.72 and JPMorgan dropped 3.7 per cent to $28.20.Investors are relying on banks to pull markets out of their slump more than any time in the past 60 years, according to figures compiled by Bloomberg, and worries over their profitability weighed heavily on the markets as a whole.After a very late rally, the benchmark S&P 500 index closed 0.8 per cent down at 835.48 points, while the Dow Jones Industrial Average lost 0.5 per cent to 7,975.85 points and the Nasdaq Composite index dropped 0.9 per cent to 1,606.71 points.“This was a dramatic run up and as we approach earnings season investors are being cautious and taking profits off the table at any opportunity,” said Quincy Krosby, chief investment strategist at the Hartford,But George Feiger, chief executive of Contango Capital Advisers warned the slide is a sign of more fundamental problems. “The big problems with the economy are still there,” he said. “We are still only at the beginning of this problem.”Commodities companies also declined on the back of falling materials prices. Steel makers suffered particularly badly after Deutsche Bank warned demand for steel in North America could fall 25 per cent this year. US Steel fell 2.7 per cent to $25.16 and AK Steel dropped 4.7 per cent to $8.82.The defence sector received a late shot in the arm as Robert Gates,
the defence secretary, announced an overhaul of government spending. Lockheed Martin gained 8.9 per cent to $73.28 after Mr Gates said the government would double the budget for Lockheed’s F-35 fighter plane.Northrop Grumman also stood to benefit from increased spending, and its shares lifted 9 per cent to $47.94.Lockheed was also involved in another of the day’s big stories, as speculation mounted that it might look at acquiring Textron, the maker of Cessna aircraft. Textron’s share rose 11.3 to a two-month high of $8.26.Cisco added to the pressure already weighing on the technology sector because of the withdrawal of IBM’s offer for Sun. Cisco was downgraded by Goldman Sachs from “conviction buy” right back to “neutral”, with the bank saying recent gains in the company’s stock meant future growth was now priced in. The technology company fell 3.5 per cent to $17.53.Credit Suisse meanwhile said: “We believe Cisco has seen further incremental weakness in its enterprise business, which accounts for approximately two-thirds of total revenues.”General Motors was one of the session’s few risers, lifting 8.1 per cent to $2.27 after Fritz Henderson, its new chief executive, said bankruptcy was not inevitable for the company.Ford also gained ground after it was able to reduce its debt by $9.9bn after swapping much of it for cash and equity. Shares in the carmaker advanced 16 per cent to $3.77.Bristol-Myers Squibb, the pharmaceutical company, performed well after it renegotiated a licensing agreement with Japan’s Otsuka Pharmaceutical to sell the Abilify schizophrenia drug for an extra 29 months. It s shares rose 1.7 per cent to $20.51. The healthcare sector was also bolstered by insurers, which rebounded after falling on Wachovia’s prediction that government proposals to cut their subsidies could cost them as much as 20 per cent of their earnings.Humana gained 3.3 per cent to $26.31 and UnitedHealth picked up 6.8 per cent to $21.93."
