;Ticker;Nombre_Completo;Date_Time;Titular;Subtitular;Texto
86;HUM;Humana Inc;2008-02-04T22:04:06Z;US stocks retreat as investors lock in profits;;US shares retreated on Monday when investors sought to lock in recent profits amid fears that a weak jobs market would lead to mounting losses in the consumer credit sector.Financial companies and homebuilders were particularly hard hit as traders bet that rising loan delinquencies and falling house prices would hit corporate earnings.Investors also looked to offload retail stocks after last week’s disappointing jobs report persuaded analysts that a recession was more likely.The S&P 500 closed 1.1 per cent lower at 1,380.82, with the homebuilder sector down 6 per cent and the financial sector losing 2.5 per cent. The Nasdaq Composite fell 1.3 per cent to 2,382.85 and the Dow Jones Industrial Average shed 0.9 per cent to 12,635.16.Wachovia and Wells Fargo were among the biggest fallers after Merrill Lynch told investors to sell the banking stocks because of their vulnerability to a worsening housing market. The shares lost 8.3 per cent to $35.53 and 6.7 per cent to $31.39, respectively. Washington Mutual, the savings and loan company, slumped 12.2 per cent to $19.16.“Trying to put a valuation on some of these financials is just really difficult when they keep coming out with these horrible earnings numbers,” said Thomas Nyheim, vice-president at Christiana Bank & Trust.Separately, UBS told investors to sell shares in credit card issuers American Express, Capital One Financial and Discover Financial Services, citing expectations of rising credit losses in the consumer finance sector. UBS cut its price target on AmEx from $67 to $45, prompting the stock to fall 3.9 per cent to $47.66. Capital One fell 7.6 per cent to $52.65, and Discover lost 9 per cent to $16.34.Wall Street analysts fear that job losses could lead to rising delinquencies with problems spreading beyond the subprime mortgage market. As a result US banks are tightening lending amid a reduced tolerance for risk, a Federal Reserve loan officer survey showed on Monday.Economists received a shock on Friday after the US economy shed jobs for the first time in 4½ years but in spite of the downbeat report equities chalked up their best weekly performance in almost five years, with the S&P financial sector gaining 8.5 per cent for the week. Traders were left wondering, however, if the gain was a temporary fillip or the start of a meaningful move higher.Among the factors driving the rally were hopes for a rescue of bond insurers which have been threatened with credit downgrades. Ambac Financial and MBIA fell 13.7 per cent to $11.39 and 5.9 per cent to $15.39, respectively, on Monday after the Financial Times reported that any rescue was unlikely to involve private equity firms as they believed the risks were too great.Traders also took profits in the technology sector after last week’s bounce triggered by Microsoft’s $44.6bn bid for Yahoo. The potential mega-merger may come in for close scrutiny after Google said the takeover could open the way for Microsoft to extend its PC monopoly to the internet.The drama probably has more acts to unfold with Yahoo insiders seeing an alliance with Google as one of their best options for fighting off Microsoft. Yahoo rose 3.4 per cent to $29.33, but Microsoft slipped 0.9 per cent to $30.19.Shares in Google closed below $500 for the first time since August, falling 4 per cent to $495.43, after Goldman Sachs removed the online search giant from a conviction “buy” list.In earnings news, Archer Daniels Midland, 2.9 per cent weaker at $44.20, increased quarterly profits to $473m from $441m, but the agricultural producer’s results narrowly missed some analysts’ estimates.Humana, the health in-surer, increased fourth-quarter profits by 57 per cent to $243.2m, beating Wall Street estimates. But the stock fell 3.5 per cent to $78.98.With more than half of S&P 500 companies having reported for the fourth quarter, corporate earnings are on track for a 20.7 per cent fall in the last three months of 2007, according to Thomson Financial, with financials the source of most of the weakness. Technology and energy earnings continue to hold up, increasing an expected 26 per cent and 19 per cent, respectively. Profits are forecast to grow by less than 2 per cent in the first and second quarters, before rebounding strongly later in the year.Many analysts see US manufacturers coping well, as exports are helped by a weak dollar. Factory orders rose 2.3 per cent in December, roughly in line with expectations – the biggest increase since July. Last week, US durable goods orders rose more than expected and the ISM manufacturing index expanded.
87;HUM;Humana Inc;2008-01-20T22:13:03Z;Safeway’s premium plan for healthy workers;;US shop workers could find their health insurance premiums being linked to their food-buying habits, if a supermarket initiative wins acceptance.Safeway, which operates more than 1,700 supermarkets across the the country, says it plans to offer its employees discounts on their health insurance if they participate in a service that tracks the nutritional quality of the food they buy at its stores.The move is part of a wider push by leading employers – including Kellogg, Humana and Pitney Bowes to offer lower health premiums to employees who pursue healthy lifestyles.Safeway’s proposals would be linked to the retailer’s online FoodFlex service, launched in November as an offshoot of its loyalty card programme.Participating customers are invited to provide details of their family members, how active their lifestyles are, and whether they have specific health issues.The system uses the information on their Safeway card to deliver a nutritional analysis of their purchases at the store, rated against USDA recommended consumption levels of 25 nutrients and vitamins.It also allows customers to see the relative nutritional benefits of different products and brands. If prompted, it proposes other products, such as a soup brand with lower sodium levels.Steve Burd, Safeway’s chief executive, said the company hoped to tie the Foodflex system into its health plan in 2009.“If someone wants to opt in to demonstrate a nutritious lifestyle, I think we’ll be the first company to grant premium reductions for that. I think other companies will follow.”In 2006, Safeway launched a healthcare plan for its non-union workers that offered discounts to encourage behavioural changes linked to regular company- funded medical check-ups. Staff at its headquarters can also participate in a programme at a gym – similar to a scheme offered in the UK by Pru Health.Safeway said the plan had resulted in a 13 per cent annual reduction in its medical costs per head , and a 30-35 per cent reduction in payments by the workers over its first two years.Mr Burd said that while some of the initiatives could be considered intrusive, the retailer was following the principles established in motor insurance. “If you have a lot of accidents, you pay more for your insurance . . . Healthy behaviour gets rewarded, less healthy behaviours should bear their fair share.”
88;HUM;Humana Inc;2007-12-30T17:00:11Z;Rewards of a virtuous life;;"James Baddeley may succumb to a little festive over-eating this week, but he is determined to compensate by doubling the exercise he does afterwards to burn off the extra calories. And he has a financial incentive to do so.By walking at least 12,500 steps four times a week, measured on a pedometer that he plugs into his computer, he has helped sharply reduce the premiums he pays on a pioneering private healthcare plan.“Saving money ticks most peoples’ boxes,” says Mr Baddeley, who had been afraid of the high premiums on private insurance when he switched employers and had to pay for his own cover. “I think it’s revolutionary. It’s a model that could have a lot more mileage.”Frequent walking is one of the ways that Pru Health, a UK-based insurance company, encourages clients to improve their fitness; another is subsidised gym membership. Mr Baddeley’s coverage costs are greatly reduced while his insurer reduces its medical claims.The model – first developed in Africa – is attracting new clients and sparking corporate imitators. But it could have much wider applications for governments around the world that are struggling to boost prevention programmes to tackle the spiralling costs of obesity.Shaun Matisonn, an actuary who runs Pru Health, a joint venture between Discovery Healthcare of South Africa and Prudential of the UK, says the concept began in the early 1990s when Discovery tried expanding its client base from rich white locals to the less well-off black majority.“We were trying to shift to paying for wellness instead of the way that people currently pay for sickness,” he says. “And we wanted to subsidise [the healthcare costs of] poorer people with the premiums of the rich.”But tough South African anti-discrimination laws provided an extra hurdle to private health insurers: they were not allowed either to refuse clients such as those who were HIV positive or had other higher healthcare costs, nor to charge differential premiums to compensate.The result was Discovery’s Vitality programme, which offers incentives to clients willing to help themselves by changing their eating and exercise patterns or quitting smoking – and reducing their insurer’s healthcare bills in the process.South African customers who agree to a check-up and follow the advice they receive on healthier lifestyles win health points similar to airlines’ frequent flyer programmes, exchangeable for air travel, hotels, discounts on consumer goods and even cinema tickets.The system created other difficulties. Discovery had to repatriate 200 clients after those who had cashed points to travel on Swissair were stranded when the airline went into administration. Children persuaded their parents to switch to the insurer so they could use the points to see the same Harry Potter movie up to 12 times, creating unexpected imbalances in the rewards portfolio.But a recent analysis of half of Discovery’s 2m South African clients suggested that two-thirds had enrolled in Vitality since its launch in 1998. The 15 per cent of these that the company categorised as highly engaged in prevention programmes incurred significantly lower costs per patient, with fewer and less costly prescriptions, lower hospital admission rates and shorter stays.Mr Matisonn concedes that there is a risk of “cherry picking” clients who were already in better shape and committed to a healthy lifestyle, but he estimates that half have changed their behaviour because of the incentives. His company is able to reduce its overall healthcare bill even after allowing for the cost of its points.Others agree. Virgin, which was active in South Africa, has created “Life Care”, a programme linked to its gyms in the US, in partnership with the healthcare company Humana. It estimates 12 per cent of clients have shifted down a body mass index category, from obese to overweight, or from overweight to healthy.Jack Lord, senior vice-president at Humana, says: “Fighting obesity from a public health perspective is boring. It comes from the land of ‘no’. We’re trying to find different pathways. Building rewards and incentives is natural for people. They need something they can measure.”His programme, with 80,000 clients in the US, includes the provision of bicycles, pedometers and even computer-based “exergames” encouraging people to dance. There are “mind games” on mobile phones for older clients designed to defer senility; and it is experimenting with computer simulations to show customers visually the effects of healthier living on their appearance and psychological well-being.Discovery was less successful in the US, struggling in 2000 to enter what Mr Matisonn calls “a fiercely competitive marketplace” where, without the critical mass of clients needed to negotiate bulk medical discounts, it was squeezed out as rival insurers cut their premiums to drive it out of business.But in the UK, Mr Matisonn says appetite has been strong, with 140,000 customers recruited in the past three years. Pru Health offers cholesterol and blood pressure screening, assistance for those trying to stop smoking, and even points for buying fruit and vegetables at J Sainsbury, the supermarket chain.Some individuals like Mr Baddeley are motivated by reducing their premiums. He estimates that the annual charge for his family, if he did no fitness activities, would have been £1,980 – in line with other private health insurers. By carrying out all the healthy activities to achieve “platinum” status, he gets discounts and reimbursements on all his premiums net of any claim that have reduced the cost to just £400 this year.For employers, the rationale may be different. Claire Morrison, human resources manager at Reed Smith Richard Butler, a law firm, says she hopes premiums with Pru Health will at least remain stable while those offered by rival insurers continue to rise.But for most employees, the main attraction has been the healthy perks such as the generous discounts on gym membership and health spas, as well as “activity days”. “It’s about giving something back,” she says. “Associates work very hard, and we take the work-life balance very seriously.”One issue for all such prevention programmes is which activities should be promoted. Mr Matisonn says Pru Health has steered clear of providing incentives or programmes to reduce drinking. “It’s sensitive, and we are not sure how to measure success,” he says. Some important prevention measures – such as MRI scans or mammography – remain too costly for insurers to offer for free.One risk is clients “gaming” the system. He is suspicious of those who clock into their gym several times in a day towards the end of each accounting period in order to win points. Mr Lord says he knows that customers have attached their pedometers to dog collars or put them in the spin drier to clock up miles falsely.Customers may also switch health plans, so rival companies would benefit from the reduced treatment charges that may only pay back after several years.Mr Baddeley says that reimbursement of his premiums means he now has an incentive not to visit a specialist unless he really feels the need, even where that could be imprudent in the long run. “The system works best if you don’t claim, are healthy and are quite lucky,” he says.A final threat for Discovery is that, while it has tried to patent its system and lock in gyms and other partners accepting its reward points, it is difficult to prevent other insurers launching similar programmesBut in the fight against obesity, every little helps. And as private healthcare providers struggle to overcome the challenges of health incentive schemes, the biggest beneficiaries – besides individuals like Mr Baddeley – may ultimately be the world’s public health systems."
89;HUM;Humana Inc;2007-10-29T21:13:27Z;Wall St higher on rate cut hopes;;Wall Street shares were higher on Monday as traders focused on expectations of an interest rate cut from the Federal Reserve this week.Energy stocks surged as crude oil futures hit $93 for the first time. Materials stocks also attracted buyers, buoyed by rising commodity prices. Some positive earnings news also cheered the market.The S&P 500 closed up 0.4 per cent at 1,540.98, the Nasdaq Composite was up 0.5 per cent at 2,817.44 and the Dow Jones Industrial Average was also up 0.5 per cent at 13,870.26. However the Russell 2000 index of small-cap stocks was flat at 821.72.A two-day meeting of the Federal Open Market Committee, which starts on Tuesday, was at the front of investors’ minds on Monday.Interest rate futures fully priced in a one-quarter-percentage point cut in the Fed Funds rate to 4.50 per cent on Wednesday, with a small chance of a reduction to 4.25 per cent.“We do not think the Fed will risk disappointing the markets at this week’s FOMC. Although inflation concerns linger, these will likely have to take a backseat to more immediate concerns,” analysts at Credit Suisse said.Chastened by concerns about the health of the US economy, investors have continued to buy large-cap stocks which generate a large proportion of their sales overseas. McDonald’s, up 1.2 per cent at $59.18, and IBM up 0.9 per cent at $114.80, were among the biggest risers on the Dow on Monday.“Large-cap companies with higher international exposure and secular growth drivers should continue to lead [earnings per share] growth and outperform,” analysts at UBS Investment Research said.But Tobias Levkovich, chief US equity strategist at Citi Investment Research, had some cautionary words.“In theory, this [strategy] takes advantage of faster economic growth outside the US, with additional translation gains from a weaker dollar,” he said. “Yet, the ‘bite’ of higher interest rates in Europe and a strong currency may be causing leading indicators to roll over across the pond, increasing the potential for 2008 earnings misses.”In earnings news, third-quarter profit at Verizon Communications declined compared with a year ago, but beat expectations. Revenues increased 5.8 per cent to $23.8bn. The stock gained 0.9 per cent at $45.99.Humana, the health insurer, reported a 90 per cent jump in quarterly earnings to $302.4m and boosted its 2007 and 2008 earnings guidance. But the stock was off 2.4 per cent at $73.75.RadioShack was up 4.1 per cent at $20.42 after it swung to a third-quarter profit. Hertz increased third-quarter profit by 51 per cent, helped by rising car rental revenues. Its shares slipped 1.6 per cent to $22.98 on concerns about the outlook for equipment rentals.Office Depot fell 14.1 per cent to $17.43 after it delayed the release of third-quarter earnings due to an independent review of its vendor program funds. JPMorgan cut its rating from “overweight” to “neutral”.US crude’s new high of $93.80 a barrel lifted energy stocks. Exxon Mobil gained 1.5 per cent to $93.61 after the Supreme Court said it would hear an appeal against a demand for $2.5bn in punitive damages for the 1989 Exxon Valdez oil spill.Chevron gained 1.3 per cent at $92.88 while National Oilwell Varco rose 2.7 per cent to $74.48.However, oil prices again hit transport stocks. The Dow transport index fell 0.5 per cent at 4,844.27.The materials sector saw big gains. Alcoa rose 2.7 per cent to $40.43.Weyerhaeuser, the timber company, jumped 8.1 per cent to $73.85, after a shareholder said that the shares could hit $100 if it became a Reit and sold assets. Merrill Lynch gained 2 per cent to $67.42 as expectations mounted that Stan O’Neal would announce that he is stepping down as chief executive.The S&P investment bank index closed up 2.6 per cent at 210.41 after Goldman Sachs, up 3.3 per cent at $243.81, hit an all-time high.The financials index was 0.1 per cent weaker at 451.11. Countrywide Financial fell 2.7 per cent to $16.83 after closing up 32.4 per cent last week on expectations of a swift return to profitability.Boeing gained 1 per cent at $96.99 after its board approved up to $7bn worth of share buybacks.
90;HUM;Humana Inc;2007-10-04T22:07:46Z;Backing for private sector’s NHS role;;"The private sector has a role in the National Health Service, Alan Johnson, the health secretary, said on Thursday as the government offered the clearest indication yet that it remained committed to at least a degree of choice and competition to improve care.After months of mixed signals to both the private sector and the NHS itself, the health secretary said the independent sector would have a role in providing 150 new health centres and 100 new GP practices that were announced on Thursday.Their introduction, along with a pledge that all patients needing non-emergency operations would be screened for the MRSA superbug next year, followed recommendations by Lord Darzi in his interim report on his “next stage” NHS review.With his report launched by the prime minister, Lord Darzi called for the introduction of new providers to help develop more flexible GP opening hours, while adding that “patient choice should be embedded within the full spectrum of NHS funded care”, covering primary care and long-term conditions as well as elective operations.Asked if he was committed to that, Mr Johnson said: “Yes, there is a role for the private sector here, and there is a role for it in the rest of the NHS. But it is about patient care first.”Evidence of that will come today when the Department of Health finally announces the winners of a framework contract intended to make it easier for primary care trusts to buy in private sector help with the commissioning of care.The 14 contractors include four big US health insurers and care managers, Aetna, Humana, Health Dialog Services and UnitedHealth, as well as UK health specialists such as Bupa, Axa PPP and Tribal and the consulting firms KPMG and McKinsey.The department is also to advertise for additional private suppliers for NHS operations and diagnostics ahead of the introduction of “free choice” for waiting list operations from April.Under that patients will be able to choose any approved hospital in the country prepared to treat them at NHS prices.How big a role all that will mean for the private sector will depend on patient choice; on how far primary care trusts take advantage of the new commissioning contract; and on how energetically they seek out private providers to challenge existing GP services. But after months of uncertainty there appears to be at least greater clarity on the independent sector’s role, even if Gordon Brown and Mr Johnson avoided any public reference to it in their launch of Lord Darzi’s report.The costing of initiatives to tackle healthcare infections and to create the new health centres, along with 100 new practices in under-doctored areas – likely to add up to tens of millions of pounds a year – would have to await the announcement of the comprehensive spending review next week, Mr Johnson said.The Conservatives claimed the real aim of Lord Darzi’s report was to downgrade local services, arguing that he was “a trusted clinician who is being used by Gordon Brown”."
