;Ticker;Nombre_Completo;Date_Time;Titular;Subtitular;Texto
32;HUM;Humana Inc;2014-02-24T22:12:30Z;Humana surges as health insurers avoid worst of government cuts;;Humana shares surged to a record high on Monday after the health insurance provider said US government funding cuts to the Medicare programme through the private market would be less than had been expected.US government payments into the Medicare Advantage plan would fall 3.5 to 4 per cent in 2015, the company said in a filing with US securities regulators. Executives had previously warned analysts and investors the drop could be as high as 7 per cent.The change in tone follows new payment guidelines from the US Department of Health and Human Services issued last Friday, stating that proposed changes would be “ smaller than those implemented in 2014”.The advance notice from the government estimates a 1.9 per cent drop in healthcare spending for Medicare Advantage policy holders.The Medicare Advantage programme generated nearly two-thirds of Humana’s $41.3bn of sales in 2013. The company expects to add between 370,000 and 410,000 subscribers to the programme over the current year.“The company is continuing to evaluate the changes detailed in the Advance Notice and the related impact company-wide and by geography,” Humana said.Shares in Humana rose 10.6 per cent to $113.69, while rivals UnitedHealth Group advanced 2.9 per cent to $76.01, Aetna added 1.9 per cent to $71.80, WellPoint climbed 2.7 per cent to $90.93, and Tenet Healthcare rose 3.1 per cent to $48.33.Verizon was having trouble finding its feet on its first trading day since it completed the purchase of Vodafone’s minority stake in its US wireless venture.Shares in the largest US wireless operator fell 2.2 per cent on Monday, following a trading update in which management said it expected consolidated revenues to grow 4 per cent in 2014 to about $125bn.This was a little slower than the 4.1 per cent advance a year earlier but in line with Wall Street forecasts.Verizon management also said it was targeting an increase in margins for both its wireless and wireline businesses as they continued to add subscribers.Lowell McAdam, chief executive, said the completed merger marked a “major milestone” for Verizon.Barclays analyst Amir Rozwadowski noted that volatility in Verizon shares would probably continue over the next three months as index buyers absorb shares.BlackBerry shares rose 7.5 per cent to $9.83 after the mobile device maker said it would make its messaging service, BBM, available to Microsoft’s Windows Phone and the upcoming Nokia X platforms.Deal activity saw shares in RF Micro Devices, a manufacturer of radio frequency equipment, surge 21 per cent to $7.03. It agreed to merge with TriQuint Semiconductor in an all-stock deal that will create a new company with $2bn in annual revenues. TriQuint shares jumped 26.1 per cent to $11.64.Shareholders in RF Micro and TriQuint, a parts supplier in the radio frequency sector, will receive an equal stake in the combined venture. Under the terms of the deal, TriQuint shareholders will receive 1.675 shares of the new company and RF Micro shareholders will receive one share, for each TriQuint or RF Micro share held.“The world’s demand for mobile data is growing exponentially,” RF chief executive Bob Bruggeworth said. “The combination of TriQuint and RFMD creates a new leader in RF solutions with expertise in mobile devices and complex infrastructure and global defence applications.Mr Bruggeworth will lead the combined company as chief executive, while TriQuint’s current chief executive Ralph Quinsey will serve as non-executive chairman.The Standard & Poor’s 500 Index broke into record territory, up 21.4 points, or 1.1 per cent, at 1,857.66, earlier in the day. It closed up 0.6 per cent at 1,847.61.The Dow Jones Industrial Average was up 103.84 points, or 0.6 per cent, at 16,207.14. The Nasdaq Composite Index was up 29.56 points, or 0.7 per cent, at 4,292.97.
33;HUM;Humana Inc;2020-04-09T15:05:26Z;Lockdown life puts a strain on lawyers’ mental health;Homeworkers look to video apps and virtual tools to replace human interaction with colleagues and clients;Lawyers’ mental health is taking a hit as a result of the coronavirus pandemic, with studies finding partners and associates feeling stressed and isolated.Covid-19 has triggered global lockdowns and forced the legal industry to adapt to suddenly ubiquitous technologies such as videoconferencing platforms Zoom and Google Hangouts.Use of these tools has ensured the smooth running of much of the lawyers’ output but they have reported a toll on their mental health, which they blame on the lack of face-to-face interaction with colleagues and others.According to LawCare, a UK legal mental health charity, calls about the effects of coronavirus accounted for half of its helpline traffic since March 10. Lawyers reported feeling lonely and anxious about their health and job security.“The main thing people are calling about is pressure to go into work and not being allowed to work from home,” says Elizabeth Rimmer, LawCare chief executive. “We had one call very recently from someone with a family member with [Covid-19] symptoms who was not allowed to work from home.”Others are dealing with anxiety connected to homeworking, she says. “Particularly younger lawyers are feeling that they are on their own and haven’t got someone they can easily ask about things.”Firms are instigating virtual hang-outs including Friday night videocon drinks as a way of retaining a sense of team bonding, or offering courses such as meditation onlineA worldwide survey of 108 lawyers and law firm staff at all levels of seniority by RSG Consulting, the FT’s Innovative Lawyers research partner, also found isolation and lack of interaction constituted one of the main challenges of remote working, Women were twice as likely as men to report being affected by this.Most solicitors — and particularly more junior lawyers — are used to working closely within a team, often under high-pressure and close knit conditions that can be difficult to replicate in a virtual world.According to RSG, some 14 per cent of associates surveyed cited isolation and lack of personal interaction as the main challenge of working from home, compared to just 6 per cent of equity partners.“We are trying to keep morale up but it’s worse for the younger lawyers who are often alone in flats in London and feel more alone than the lawyers with families,” says one senior lawyer at a US firm based in the capital.Firms are instigating virtual hang-outs including Friday night videoconference drinks as a way of boosting morale and retaining a sense of team bonding. Other offerings include online courses in mindfulness and meditation.Some firms have devised similar systems to mirror human interaction via a screen. Linklaters’ corporate team, for example, has set up a “virtual coffee room” that remains open 24 hours a day.“The idea is that if people want to go and have a cup of coffee and a chat they can go in and see who’s around. I got five associates the other day and we had a coffee together on the videocon line,” says James Inglis, corporate partner at Linklaters.Meanwhile teams are having to grapple with new ways of communicating, via Zoom, Google Hangouts, Microsoft Teams or WhatsApp, which brings unique challenges.“We did have someone message our team WhatsApp group accidentally, inviting their friends round for dinner. Someone in our team responded asking if their friends could bring round some loo roll,” says one corporate partner.Some law firms, such as Mayer Brown, already had the infrastructure in place for employees to work from home, making the move to doing so full time during the pandemic more straightforward. Sally Davies, the senior partner in the London office of the international firm, says communication is critical, both internally and with clients.“We asked partners to set up regular calls with teams to listen and assess how people were coping,” she says.Often, the best technology is developed in times of crisisThe firm created an internal communications portal and a global messaging tool, and encouraged one-to-one virtual coffees particularly with new starters and trainees. It also set up response teams to act as central co-ordinators for client communications, though there is an expectation that every lawyer will reach out to their clients.Long-term positive changes may come from this: “We introduced [the online conferencing tool] Webex for all in a matter of a couple of weeks,” says Ms Davies. “Use the opportunity to develop new ways of working, a bit like [how] often the best technology is developed in times of crisis.”The fact that lawyers are used to working on deals and cases that cross jurisdictions and time zones means that most are used to handling matters remotely.“I have been practising law for 30 years in the City and in that time it has changed dramatically from requiring a physical presence for huge numbers of hours in the office, towards things like electronic data rooms where you don’t have to go anywhere to inspect documents,” says Simon Beddow, corporate partner at Bryan Cave Leighton Paisner.Transactional lawyers use “virtual deal rooms” in which document drafts are exchanged and questions answered in an entirely virtual world, sometimes without parties ever having to meet.However, not everything can be done in a virtual world. Site visits for due diligence purposes have been put on hold, which means that deals are paused, while company meetings that must take place in a certain physical location for tax reasons are kiboshed.Remote working has been quite good for team morale so far because we’ve been having a bit of a laugh with itCriminal lawyers are hampered too, in their inability to attend court. Jury trials were suspended in the UK last month in an attempt to safeguard those attending court, though some hearings can take place remotely.For others, however, the biggest change has been working-from-home attire and glimpses of each other’s home life.Charles Thomson, a litigator at global firm Baker McKenzie, says his team have been bringing pets to team Skype sessions and even showing up in their nightclothes to morning video calls.“We have been having daily videoconference catch-ups where some people are still in their pyjamas,” he says. “[Remote working] has been quite good for team morale so far because we’ve been having a bit of a laugh with it.”
34;HUM;Humana Inc;2013-04-02T20:31:40Z;US health insurers lifted by Medicare deal;;Health insurers were in focus on Tuesday after the US government announced that it would not cut a key Medicare payment rate, but increase it instead, reversing its previous decision.Insurers jumped during the previous session before the official announcement, prompting speculation that some traders learnt of the decision before it was made public. It is also plausible that traders anticipated such an outcome and bet accordingly.Humana shares rose 5.4 per cent to $79.11 amid high volumes.Shares in UnitedHealth Group, which were upgraded by analysts at Raymond James to “strong buy”, also rallied, adding 4.7 per cent to $61.74. Aetna and Cigna Corporation rose 3.7 per cent to $54.30 and 2.9 per cent to $64.75 respectively.The wider US stock market moved higher and the S&P 500 surpassed its previous record closing high reached last week, with sentiment boosted by better than expected factory orders data.The benchmark index advanced 0.5 per cent to 1,570.25 on Tuesday, hitting a new record high and only 6 points shy of the all-time intraday high reached in October 2007. Seven of ten main sectors were in positive territory, with gains led by healthcare stocks.“The way the stock markets treated today’s poor eurozone economic data indicates that they were pricing in a much worse outcome,” said John Canally, investment strategist at LPL Financial.“It is slightly worrying that markets are not more concerned, given the importance of the region to trade,” he added.The Dow Jones Industrial Average, which tracks 30 blue-chip stocks and is a price-weighted index, added 0.6 per cent to 14,662.01.Among consumer discretionary stocks, Urban Outfitters jumped 3.8 per cent to $39.87 after the company revealed in a 10-K filing that first-quarter comparable net sales were up in the high single-digits.Shares in Garmin, manufacturer of GPS devices, rose 5.1 per cent to $34.25 after it announced it would provide in-dash navigation for future Mercedes-Benz models.Housebuilders initially attracted buyers, with the S&P 500 homebuilder index up as much as 1 per cent in early trading. As the housing market has been slowly returning to health, boosted by record-low borrowing rates, homebuilders benefited, with the subgroup more than tripling since October 2011.Tobias Levkovich, US equity strategist at Citigroup, is optimistic about further growth in the housing market, saying the turn in housing is being misperceived as almost over. “Given protracted stagnation in housing starts at historically low levels of activity, it would seem as if the recovery could last several years and gain strength,” he wrote in a research note.PulteGroup erased gains and was 1.3 per cent lower at $19.86, while DR Horton fell 1.8 per cent to $23.41.The technology-heavy Nasdaq Composite paired some of the earlier gains and closed up 0.5 per cent at 3,254.86, as its largest member Apple retreated from earlier advances to finish 0.2 per cent higher at $429.90.Shares in the iPhone maker sold off during the previous session as it bowed to Chinese pressure and issued a formal apology to consumers in its second-largest market. The stock has been declining since peaking at $702 in September 2012 and has lost more than 17 per cent since the start of the year.Nasdaq OMX shares tumbled 12.8 per cent to $27.91 as Moody’s put the exchange operator on review for downgrade. Nasdaq’s current credit rating is one notch above junk. The decision by Moody’s followed the announcement that Nasdaq OMX agreed to buy a US Treasury trading platform from BGC Partners in a $1.2bn cash and deferred stock deal.BGC Partners shares soared 48.6 per cent to $5.72.Hewlett-Packard shares suffered after analysts at Goldman Sachs downgraded the stock to “sell”, saying that “consensus is attributing unreasonably high probability to HP turnround success and incorrectly assuming fundamentals have already bottomed”. Shares dropped 5.2 per cent to $22.10.
35;HUM;Humana Inc;2012-12-05T23:07:20Z;Companies in last-minute bond flurry;;Global corporations are attempting to raise this year’s final batch of funds at rock-bottom borrowing rates this week, taking no chances with the possible impact on US markets from the looming fiscal cliff.Investment-grade global borrowers such as chipmaker Intel and ConocoPhillips, the oil and gas group, tapped the US debt markets on Monday and Tuesday to sell a combined $13bn in new bonds at yields near historical lows, according to RBS and Standard & Poor’s LCD data.More debt sales took place on Wednesday, with Humana, a provider of Medicare benefits and Wisconsin Electric Power among companies which sold combined $2.1bn in debt in trade in New York. RBS estimates this week’s issuance may reach $25bn.The rush of new sales is coming after a strong performance in November. The month became the largest of the year for total corporate issuance, with sales of $135bn.Companies are now trying to squeeze in as many debt sales as possible in coming days ahead of an expected slowdown in activity later this month during the holiday season.Analysts said large corporate borrowers were also trying to beat a potential sell-off in markets at the start of January if US policy makers fail to reach a compromise on budget talks and avert the looming fiscal cliff of tax increases and spending cuts.“There are really only about two good weeks of new issuance left in December,” said Ed Marrinan, head of macro credit strategy at RBS Securities.“Comments on the fiscal cliff are still likely to cause hiccups in risk assets in general, though we do not expect a deal to be reached until later in the year as the deadline approaches.”The combination of record low borrowing costs and strong demand for higher yielding alternatives to top-tier government bonds has pushed corporate debt sales in the US to their highest level on record, according to data tracker Dealogic.Global corporations took advantage of the sweet spot and have sold $1.1tn bonds so far this year.“Why not sell more bonds if you can?” said Adrian Miller, a director of fixed-income strategy at GMP Securities.“With rates at these low levels, the holiday season coming, and lack of definition on the fiscal cliff front . . . many companies just simply don’t want to wait. They will try to lock in funds at the lowest possible cost,” he added.Mr Miller said demand for the bonds was likely to remain high in spite of the flood of new debt sales as returns on the securities far outpaced those of government bonds.Average total returns year-to-date on US investment grade corporate bonds stood at 10 per cent on Wednesday, while those on US Treasuries were at 2.4 per cent, according to Barclays indices.Returns on US high-yield debt were even higher, at 14.3 per cent.
36;HUM;Humana Inc;2012-06-11T22:05:08Z;Insurers to keep key ObamaCare provisions;;The US’s leading health insurers are likely to maintain key parts of President Barack Obama’s healthcare reform law even if the Supreme Court strikes down the legislation later this month, analysts say, following decisions by UnitedHealthcare, Aetna and Humana to institutionalise some of the provisions already in place.The court is expected to rule this month on whether to uphold the controversial law, derided by Republicans as “ObamaCare” but officially known as the Affordable Care Act, or to overturn it in part or in full.But rather than waiting for the decision, UnitedHealthcare, the largest American healthcare insurer with 38m members, said on Monday that it would continue some key benefits regardless of how the court rules.These include covering preventive healthcare services, such as immunisations and screening for high-blood pressure and diabetes, with no out-of-pocket charges, and allow dependants to stay on their parents’ health insurance plan until the age of 26.Other provisions that will be maintained include a ban on lifetime dollar maximums on most benefits and a more streamlined process to appeal claims decisions.“The protections we are voluntarily extending are good for people’s health, promote broader access to quality care and contribute to helping control rising healthcare costs,” said Stephen Hemsley, president and chief executive.Aetna, another big US insurer, quickly followed suit, saying that a number of provisions in the health reform law “have been woven into the fabric of our healthcare system, bring value to customers and consumers and should be maintained”.“We intend to keep provisions such as coverage for dependants to age 26, 100 per cent coverage for certain preventive care and access to appeals through independent third parties in our benefit plans, regardless of how the Supreme Court rules,” said Matthew Wiggin, an Aetna spokesman.Humana also tried to get ahead of the decision with its own promise to keep popular parts of the law.“Regardless of how the US Supreme Court rules on the federal healthcare reform law, Humana is committed to keeping in place important patient protections contained in the law,” the company said.Analysts said the moves made sense.“This is a case where the Affordable Care Act has dragged the horse to water and the horse has decided to drink,” said Drew Altman, president of the Kaiser Family Foundation, a non-partisan health policy group.“I think some others are likely to follow suit because it probably adds to their competitive advantage in the market place, and these provisions are relatively inexpensive and very popular,” he said.Edward Miller, dean of the Johns Hopkins University school of medicine, agreed that “the train has already left the station”.“So many people have moved past this [question of whether the healthcare law should stand] already and we’ve started to see insurance companies bundling payments and employers looking at new innovations,” Dr Miller said.Other leading insurers including WellPoint and Blue Cross Blue Shield did not comment on Monday.Ana Gupte, a healthcare analyst at Bernstein Research, said that UnitedHealthcare was showing leadership and also currying favour with the US government and its customers by keeping the provisions. She suggested that the costs of rolling back features that have been put in place might be higher than retaining them.Mr Obama’s signature healthcare law, passed by Congress with the narrowest of margins two years ago, has been controversial, with Republicans criticising it as an over-reach of government power.The 2010 law introduced the “individual mandate,” a requirement for everyone but the very poor or those with religious objections to buy some kind of health insurance. It also banned insurers from declining coverage to people with pre-existing medical conditions.The Supreme Court could repeal the whole law or just part of it – most likely the mandate – or let the entire act stand.The move by UnitedHealthcare presupposes the court overturning the entire law.However, insurers are bracing for the possibility that the mandate is struck down but the rest of the law is upheld, forcing them to offer coverage to sick people without the additional healthy customers to help defray the costs.“If that happens, the bill in the long term is not workable,” Mike McCallister, chief executive of Humana, told the FT last week. “Without the mandate, guaranteed issuance falls apart. You have to eliminate gaming of the system where people buy coverage after they get sick.”UnitedHealthcare, Aetna and Humana signalled they would stop offering coverage to children under the age of 20 with pre-existing medical conditions, with the former explaining that “one company acting alone” cannot shoulder this burden.Nor did they address another key component of the law that is already in effect: the requirement that health insurers spend at least 80 per cent of premium dollars on health-related costs, not on administration.Mr Altman of Kaiser said that the companies could hardly be blamed for this. “I don't expect them to voluntarily do things which are painful for them or would hurt their bottom line without regulatory relief,” he said.
37;HUM;Humana Inc;2020-04-24T23:51:20+0000;Obamacare: an unhealthy focus;Insurance investors must be careful not to focus too much on the individual mandate;If Congress required every American to own a garden gnome, you would not expect the kitsch industry to rally if the Supreme Court expressed hostility to that law. But on Thursday, following arguments in which judges hit defenders of the Affordable Care Act with pointed questions, the biggest US health insurers got a boost: UnitedHealth, Aetna, Cigna, and Humana were all up between 3 per cent and 6 per cent.That is because from the point of the insurers, the law is double-edged. The requirement that everyone buys insurance (the so-called individual mandate) is accompanied by consumer-protection rules, most notably that insurers neither reject customers, nor charge them differently, depending on their health – only according to age, family size, location and tobacco use. The market was celebrating the judges’ apparent disinclination to toss the individual mandate but not the rules. That would have killed the potential for new customers while retaining a threat to margins.But take a step back. According to the Census Bureau, 56 per cent of non-elderly Americans – those not covered by Medicare – have employer-provided insurance. They are already protected by rules like the ones the Act would apply to everyone. Another 19 per cent have Medicaid (government insurance for the poor) or other government insurance. It is only the remaining quarter of the population, individual buyers of insurance and the uninsured, who are the primary targets of the law. And many of those would be covered by the law’s expansion of Medicaid, not by private plans. The reality is that insurance profits come mostly from employer-provided insurance (and managing government plans), and this will continue regardless.Insurance investors must be careful not to focus too much on the individual mandate.Email the Lex team in confidence at lex@ft.com
