;Ticker;Nombre_Completo;Date_Time;Titular;Subtitular;Texto
34;ILMN;Illumina Inc;2020-04-09T15:05:26Z;The top FT stories read by the legal world in the coronavirus lockdown;Professionals are hungry for reporting on how peers are responding to the crisis;How is the legal sector responding to the coronavirus crisis? Since the pandemic hit, the FT has been covering the impact on law firms — from the sudden widespread adjustment to remote working and the disruption to courts, to an influx of client questions about keeping deals alive and managing legal issues emerging from the outbreak.The following stories are taken from our Full Disclosure newsletter, sent to FT subscribers in the industry each week, sharing what has been most popular with legal readers on FT.com.As with most sectors, shouldering the financial blow to business is an urgent priority: readers have zeroed in on our reporting about how law firms are coping, while finding opportunities in growth areas.This week law firms made moves to ease the burden of coronavirus on their bottom lines.None has been so unusual as Norton Rose Fulbright, which is resurrecting a four-day week scheme it enacted during the financial crisis in a bid to save jobs.Staff at the firm earning more than £45,000 have been asked to volunteer to work four days a week when they are less busy and take a 20 per cent cut. Those on lower salaries will take a 5-20 per cent pay cut for the same reduction in hours.Elsewhere the legal world continues to adapt to remote technology. This week the Solicitors’ Disciplinary Tribunal went virtual, with Baker McKenzie’s ex-London boss Gary Senior facing a hearing via Zoom over alleged sexual misconduct. He denies the allegations against him.The move to homeworking has been a big change for lawyers, who are used to face-to-face meetings and close teamwork. But online tools including electronic data rooms for checking documents and video conferencing platforms are making it easier to adapt.Tech tools are also helping from a social perspective — whether it is Friday night drinks on Zoom to “virtual coffee rooms”, lawyers are finding ways to connect with colleagues and bond with teams in the digital realm.Here is our selection of what FT subscribers in the legal sector having been reading in the past week:Lawyers re-tool to take on restructuring boomLaw firms are retraining junior lawyers to become experts in restructuring and insolvency during the pandemic and borrowing partners from quieter departments to work on large deals at firms including Latham & Watkins and Hogan Lovells. As one senior private equity lawyer put it:“Firms expect three or four times the number of core restructuring lawyers to be subsumed into stressed and distressed related work during the Covid-19 crisis.”Norton Rose calls on staff to take on four-day weekNorton Rose Fulbright became the first large law firm in the UK to ask staff to accept a pay cut and reduced hours last week. It will also be delaying the payout of partner profits as well as salary rises and bonus payments.“Norton Rose took similar action during the financial crisis. Other big firms are also making moves to conserve cash and protect jobs in the face of big predicted falls in fee income.”LSE rejects Burford’s claim of stock manipulationThe latest salvo was fired last week in a bitter court row between litigation funder Burford Capital and the London Stock Exchange. Burford believes its share price was manipulated and wants the court to force the LSE to reveal the traders who did it. The LSE called Burford’s claims “completely detached from reality”.“The LSE said it had thoroughly investigated the claim along with the FCA and found no evidence of wrongdoing. For both the LSE and FCA to be wrong, it said, ‘there must have been a catastrophic and incredibly surprising independent failure of their systems and analysis, both automated and manual’, for which there was no evidence.”Neighbourly love in a cold climateThis week the FT’s Jo Ellison looks at what enforced social coldness means for body language. Handshakes are long gone and the elbow bump too — how do we express affection in the age of coronavirus?“Maybe it’s time to introduce my grandmother’s old favourite — when you do something she approves of, you get a little wink. It’s friendly, informal, cheeky, and it shows solidarity. Plus, you can read it from a distance.”Home working leaves UK vulnerable to fraudMass home working as a result of coronavirus has opened up opportunities for fraudsters to target companies and fuelled a sharp rise in attempted scams in recent weeks.“While regulators have been quick to warn about schemes aimed at individuals amid the pandemic — such as financial data ‘phishing’ attempts, or bank payment frauds — the danger to businesses and their investors is equally heightened, say advisers.”Closing argumentThose of us feeling smug about our lockdown exercise efforts will be put to shame this week by 73-year old Rosie Swale-Pope (top picture). The adventurer is currently holed up in a Turkish hotel, but since July 2018 she has spent nine nights in every 10 sleeping inside a three-wheeled trailer she is hauling from Brighton to Kathmandu, Nepal, in a 5,300-mile run through 18 countries.“From 2002 to 2007, Swale-Pope ran almost 20,000 miles from her then home in Tenby, Wales, through northern Europe, Russia, Alaska, Canada and the US, returning to the UK via Greenland and Iceland. She endured broken bones, frostbite and encounters with hungry wolves — and turned 60 on the road.”
35;ILMN;Illumina Inc;2012-01-25T20:34:20Z;Roche: bid battle is a gutsy move;The offer is 43 per cent above Illumina’s three-month average share price;“Screw it, let’s go hostile.” That thought is probably what went through Severin Schwan’s mind last week. The chief executive of Roche, the Swiss pharmaceuticals company, has been frustrated by the board of Illumina, the US maker of genome diagnostic equipment, which has refused his offer to buy the company. So now he has decided to take his $5.7bn offer straight to Illumina’s shareholders.At a time when any acquisition is rare, Roche’s hostile move is gutsy. But it is also smart. Funding the deal is easy. The company’s net debt should be a comfortable 13 per cent of its assets at the end of this year, and fall to zero by 2015, according to UBS calculations. And the strategic rationale is clear. Although Illumina will only add about 3 per cent to Roche’s revenues, it will boost the latter’s growing diagnostics unit and test for conditions for which Roche is researching treatment.The price is also fair. The $44.50 a share offered is about 30 times this year’s expected earnings. That is two-fifths below the level at which the shares traded last July but that was at a time when growth expectations were overblown. Increased competition among makers of genetic sequencing machines has squeezed the price Illumina can charge customers. In the company’s third quarter, it revealed a small drop in revenues and a one-third drop in earnings per share. Since then, and until rumours of a takeover surfaced, Illumina’s shares had lost two-thirds of their value.Accepting the offer has proved a pill too hard for Illumina’s management to swallow but the reality is its prospects have waned. In 2010, its earnings increased 32 per cent. However, next year, growth will be about half that, estimates Deutsche Bank. Given Roche’s offer is 43 per cent above the company’s three-month average share price, shareholders should accept the deal.Email the Lex team in confidence at lex@ft.com
36;ILMN;Illumina Inc;2012-01-25T18:33:37Z;DNA technology to move into mainstream;;DNA has been at the heart of Roche’s diagnostics business for 20 years. In 1991 the Swiss pharmaceutical group bought worldwide rights to polymerase chain reaction, the key technology for manipulating and amplifying genetic material.Since then, Roche has developed and acquired a wide range of tests for detecting and decoding DNA, ranging from individual genes in viruses and bacteria to the whole human genome – the 3bn biochemical “letters” that make up our genetic code.In 2007 Roche bought 454 Life Sciences, based in Connecticut, a leading producer of “high throughput” DNA sequencers. Although 454 still has a loyal following of customers, it is regarded in today’s fast-moving gene reading industry as a niche player.The current leaders in large-scale DNA sequencing are Illumina, for which Roche has bid $5.7bn, and Life Technologies, another US company.Although Illumina probably has the largest market share, Life Technologies laid down a big challenge earlier this month when it announced a new sequencer that can read a whole human genome in less than a day for $1,000.Other innovative companies such as Oxford Nanopore of the UK are also poised to launch fast new gene sequencers.As the cost of DNA sequencing plummets, the technology will move from biomedical research labs – the main users today – into mainstream clinical practice, a huge new market.On Wednesday, for example, a UK government committee urged the National Health Service to embrace genomics, as a way to tailor patients’ treatments to their individual genetic make-up.
37;ILMN;Illumina Inc;2020-04-24T23:51:20+0000;Pharma groups target specialised deals;;"Roche sought to strengthen its position in personalised medicine with a $5.7bn hostile bid early on Wednesday for Illumina of the US, signalling continued appetite in the healthcare sector for targeted acquisitions.The proposed takeover reflects the Swiss drug company’s desire to develop treatments in combination with accompanying diagnostics that ensure its high-priced drugs are given only to those patients in whom they are most effective.For Severin Schwan, Roche’s lawyer-turned-chief executive, the acquisition mirrors his decision in his previous role as head of the diagnostic division to launch a similar initially hostile and protracted takeover of Ventana of the US in 2007.Together with Frans Humer, then chief executive who is now Roche’s chairman, he went on to co-ordinate a tense $47bn buy-out of minority investors in 2009 of its partner Genentech of the US, which has provided the company with many of its top-selling drugs in recent years.The Genentech deal, combined with the “megamergers” in the same year of Pfizer’s $68bn purchase of Wyeth and Merck’s of Schering-Plough for $41bn, was a recent high water mark in dealmaking in the healthcare sector.Figures compiled by Dealogic for the FT show that while the volume of deals has continued to be significant since then, healthcare has dropped back from 12 per cent of all acquisitions in 2009 to below 8 per cent, more in line with the average over the past decade.While the scale of the Genentech takeover was large, that deal reflected Roche’s continued focus on prescription medicines, notably for cancer, spurning a broader trend for diversification championed by others including Pfizer, Merck and its Basel neighbour Novartis, which paid $28bn for the eyecare business Alcon in 2010.Leading investment bankers maintain that megamergers can create value. But a growing chorus of senior industry executives as well as investors believe they have merely deferred the pain of growing patent expiries, and distracted from efforts to boost innovation to develop replacement products.Most subsequent deals have been more targeted on particular products or regions, such as Sanofi’s purchase of Genzyme in 2011, which specialises in “orphan diseases”; Johnson & Johnson’s purchase of Synthes in medical devices; and Takeda’s purchase of Nycomed, to expand into off-patent generic medicines and emerging markets.There is still potential, with large pharmaceutical companies seeking to generate new and more reliable sources of income. Many companies are cash rich, often with money held offshore that is more efficiently used in foreign acquisitions.But much recent activity has instead focused on divestments, including spinoffs by Pfizer in the wake of its Wyeth purchase and by GlaxoSmithKline of some consumer products. Among large-scale deals, the “pure” research and development companies led by AstraZeneca and Eli Lilly appear among the most vulnerable.Fintan Walton, head of PharmaVentures, a life sciences advisory firm, says: “The industry has this huge dilemma over innovation. Acquisitions are part of solving it. But every time they do a big deal, there’s a lot of criticism and cost. The future is these specialised deals.”The Illumina deal itself marks a renewed determination by Roche to provide medicines that can demonstrate value for money and safety in patients. The need was reinforced by investor concern after the US Food and Drug Administration’s decision to withdraw Roche’s drug Avastin for breast cancer in 2010 in the absence of any clear “biomarker” to better target its use.Based on the Ventana experience, analysts were anticipating a long drawn out battle for the company. One argued that Roche’s bid was likely to scare off alternative offers from Abbott and J&J, but the relatively high price at which some investors bought in to Illumina meant a successful bid would require a higher offer.The ultimate value of the deal is less certain. In a research note, Bernstein cautioned of “persistent over-optimism” in genomics, Illumina’s area of expertise, which has only proved to have limited use in many genetically complex common diseases. But it viewed Roche’s interest as an “option” in its success, with the company “probably in a better position than most to take a view”."
38;ILMN;Illumina Inc;2012-01-25T16:02:17Z;Roche launches $5.7bn bid for US group;;Roche, the Swiss drugmaker, on Wednesday described its $5.7bn hostile offer for Illumina as “full and fair” and said it had no plans to raise its bid for the US diagnostics company.But investors and analysts, while broadly supportive, pushed Roche’s shares down amid fears the group would be embroiled in a lengthy bid battle and ultimately overpay. On Tuesday, Illumina shares closed 3.79 per cent higher at $37.69 and by Wednesday morning in New York they were up 43.3 per cent to $54 a share.Roche has offered $44.50 a share in cash for Illumina, about a 64 per cent premium to the company’s share price in mid-December. Illumina’s shares had already risen by about 40 per cent since early December, partly on takeover rumours.Illumina rejected an initial $40 a share offer from Roche earlier this month.Severin Schwan, chief executive and a former head of diagnostics, the second of Roche’s two divisions alongside pharmaceuticals, likened the offer to his 2007 bid for Ventana, another highly entrepreneurial and fast-growing US diagnostics company.Although now successfully integrated into Roche, negotiations over Ventana dragged on for months, with the Swiss group ultimately raising its already high offer.In a conference call, Mr Schwan said he still hoped for a recommended offer. But he added Roche would, if necessary, table proposals at Illumina’s shareholders’ meeting, expected in May, to address shareholders directly, including proposing alternative directors. So far, Roche, which initiated contacts with Illumina in December, has built only a minimal stake in the US company. Illumina, founded in 1998, is not believed to have any dominant shareholders.Buying Illumina will accelerate Roche’s efforts to strengthen its presence in genetics and gene sequencing. A number of companies including Roche are seeking to offer “personalised medicine”, selling both drugs and “companion” diagnostics to ensure they are accurately “targeted” to subgroups of patients who will benefit.But many have struggled to develop both the treatment and the accompanying diagnostic in-house.“Just take cancer, which is a very heterogeneous disease,” said Mr Schwan. “The more we understand about the mutational aspects of a gene that cause a cell to mutate uncontrollably, the more we can target treatments.”Illumina is among the companies attempting to develop ways to read a person’s DNA cheaply and quickly, enabling drug companies to more easily tailor medicines to specific patients. Life Technologies, a US biotechnology company, earlier this month announced the first machine that can read an individual’s DNA in one day for as little as $1,000 – something that on other available instruments costs up to $10,000 and can take a week.Daniel O’Day, Roche’s head of diagnostics, said in the conference call that scientific advances meant the equipment made by Illumina and its peers, once restricted to top research laboratories, would increasingly be sold much more widely.Illumina, which is based in San Diego and has 2,100 employees, has expanded rapidly, with sharply growing sales and profits. Sales in 2010, the most recent available, amounted to $903m, with a 23 per cent operating margin. However, its business is focused largely on the US.Greenhill and Citigroup are advising Roche on the deal, which the company said would be financed from its existing cash and credit facilities.Roche’s unsolicited offer comes as deal advisers point to an increasing willingness on the part of would-be buyers to press their case in public, where targets prove reluctant to engage.Additional reporting by Alan Rappeport in New York
39;ILMN;Illumina Inc;2020-04-25T00:30:02+0000;Machine to read individual’s DNA for $1,000;;A US biotechnology company will on Tuesday announce the first machine that can read all 3bn letters of an individual’s DNA for as little as $1,000 – a development that will greatly accelerate medical treatment tailored to a patient’s genes but also raises ethical questions.Life Technologies says its new Ion Proton sequencer – a $149,000 instrument about the size of a laser printer – can read a whole human genome in less than a day for $1,000 including all chemicals, running costs and preliminary data analysis.The landmark development, expected to be matched by other companies soon, will greatly increase knowledge about the links between genes and disease, while guiding patients – particularly those with cancer – to receive the treatments most likely to work with their individual genetic profile.However, some fear that scientific enthusiasm for mass decoding of personal genomes could lead into an ethical minefield, raising problems such as access to DNA data by insurers – especially if most babies have their genome read at birth – and by employers.For a decade since the completion of the $3bn international research project to decode the first human genome, the cost of DNA sequencing has been falling faster than almost any other field of technology, as new methods are introduced to read the genetic code shared by all life on Earth.“A genome sequence for $1,000 was a pipedream just a few years ago,” said Richard Gibbs, director of the human genome sequencing centre at Baylor College of Medicine in Houston. “[It] will transform the clinical applications of sequencing.”Baylor is one of three large US medical centres, along with Yale School of Medicine and the Broad Institute, that will receive the first Ion Proton sequencers at the end of January, said Jonathan Rothberg of Life Technologies, who invented the technology used. Deliveries to other academic and commercial customers will follow over the next few months.Sequencing a human genome on most of the instruments working today costs $5,000 to $10,000 and takes up to a week, using optical technology to read the individual letters of DNA that are tagged with fluorescent marker. The Ion Proton machine cuts that substantially, by using semiconductor technology to read DNA directly through its chemistry.Life Technologies will not have the $1,000 genome field to itself for long. Other gene sequencing companies, such as Illumina of the US and Oxford Nanopore of the UK, are rapidly developing competing systems – and the cost is expected to plummet further, leading some to speculate that it will become routine for every baby to have its genome read at birth.Mr Rothberg estimates that between 5,000 and 10,000 people have had their full genome sequenced so far, almost all for research rather than medical treatment. “I believe millions or even tens of millions of people will have their personal genome read over the next decade,” he said.
40;ILMN;Illumina Inc;2009-07-02T20:44:48Z;Wall Street slides on jobs report;;"US stocks took a pounding on Thursday, with the benchmark S&P 500 index turning negative for the year as investors reacted to data showing many more people lost their jobs in June than expected.Analysts had far underestimated the number of new non-farm employees who would lose their jobs during the month, and even though the unemployment rate and the number of people claiming jobless benefits on a weekly basis were both better than expected, the market sold off heavily.Consumer stocks were directly hit by concerns over joblessness, and retailers felt some of the worst effects. Macy’s gave up 6.3 per cent to $11, while Best Buy dropped 5.3 per cent to $32.08 and Nordstrom, the clothing retailer, declined 7.1 per cent to $18.63.“The jobless figures were abysmal,” said John Brady, senior vice-president at MF Global.“We’re now in a malevolent cycle and the risk is that the government will have to issue even more debt. This could lead to higher interest rates, which would undermine the whole V-shaped recovery.”But Burt White, chief investment officer for LPL Financial, disagreed. “The market is over-reacting,” he said. “The combined loss of jobs for the last two months is only just more than that seen in January. These are the beginning stages of the stabilisation of the unemployment rate.”The S&P 500 closed 2.9 per cent down at 896.42 while the Dow Jones was 2.6 per cent per cent lower at 8,280.74. This was after trading on the New York Stock Exchange was extended for 15 minutes after a technical glitch.The Nasdaq Composite index fell 2.7 per cent to 1,796.52.That left the markets between 1.8 and 2.5 per cent lower for the week, which was cut short because of the Independence Day
holiday.Thursday’s selling knocked the markets out of the narrow trading range they had been in all week, which saw the close of the best quarter for the S&P since December 1998.Equities rose and fell with the price of commodities throughout the week, with oil climbing above $72 a barrel only to fall back below $68.But in a week which saw the release of several important pieces of economic data, trading volumes remained thin, with much of Wall Street taking an early break ahead of the long weekend.There was further volatility in commodities on Thursday, and energy producers fell as the price of oil continued the previous sessions’ declines.Schlumberger gave up 3.2 per cent to $52.55 and ConocoPhillips lost 2.6 per cent to $40.96.Elsewhere in the sector, NRG gave up its pre-market gains, which had been made on an increased bid from Exelon after a fall in Exelon’s share price meant there would be less of a premium attached for NRG shareholders.The bid is now $7.45bn, but NRG’s shares fell with the price of oil, dropping 4.8 per cent to $24.80. Exelon lost 4.3 per cent to $49.37.Materials companies also suffered and Freeport McMoRan the copper and gold miner, gave up 1.7 per cent to $49.72. Newmont Mining dropped 4.6 per cent to $40.26.Airlines fluctuated as Morgan Stanley reviewed its ratings on some of the biggest US carriers. The bank started coverage on Delta Air Lines, the world’s largest, recommending a price target of $9 after recent selling pressure.The shares climbed 0.5 per cent to $5.88.Morgan Stanley also upgraded shares in Continental Airlines, saying it was a likely survivor from the fall-out in the industry.There was some pressure on the stock from news on Wednesday evening that its revenue per seat may have fallen more than 20 per cent in June compared with a year earlier. But the shares still managed to gain 6.2 per cent to $9.79.Southwest Airlines fell 4.4 per cent to $6.50, however, after the bank downgraded its shares, saying higher oil prices would take a toll on profit margins.Meanwhile Illumina, which makes equipment to analyse DNA, dropped after reporting lower revenues than expected as cash-strapped researchers delayed orders. The shares lost 12.3 per cent to $33.46."
