;Ticker;Nombre_Completo;Date_Time;Titular;Subtitular;Texto
17;ILMN;Illumina Inc;2012-04-07T00:10:47Z;Roche looks at raising bid for Illumina;;Roche, the Swiss drug company, said on Friday it might consider raising its bid to acquire Illumina, the US genetic sequencing company that has rebuffed its previous takeover offers.Severin Schwan, Roche chief executive, said the group would “remain willing to consider additional value if given the opportunity to enter discussions and perform due diligence”.The statement came in response to a report from Institutional Shareholder Services on Friday that said Roche’s current bid of $51 a share, or $6.7bn, “does not provide meaningful compensation for the potentially enormous long-term opportunity shareholders would forgo by selling at this point”.Roche in January made an unsolicited $5.7bn bid for Illumina that was rejected as insufficient.On Monday Roche stepped up its offer for Illumina with a bid that it said represented an 88 per cent premium above Illumina’s closing stock price on December 21 2011. Illumina quickly rejected the offer, calling it “opportunistic” and not reflective of its strength or future prospects.ISS, a proxy advisory group, agreed with Illumina, pointing to the “vast” potential for genetic sequencing and the lack of competition.It also said Illumina should be concerned about “unnecessary truncation of value by selling the company at too low a valuation of its future”.Roche has put forward candidates for Illumina’s board ahead of its April 18 shareholder meeting.The Swiss suitor said it was disappointed in the ISS recommendation that Illumina shareholders vote against its board nominees, and challenged the group’s assertion that the bid was not a fair starting point for negotiations.
18;ILMN;Illumina Inc;2012-04-02T20:42:29Z;Illumina rejects latest Roche offer;;Roche has reacted angrily to Illumina’s rejection of its improved takeover offer as the rhetoric between the US gene sequencing group and its Swiss suitor escalated ahead of Illumina’s annual shareholders meeting on April 18.Expressing “disappointment” at Monday night’s unanimous rejection by Illumina’s board of directors, Roche said that “by not engaging with Roche, Illumina reinforces the notion” of an entrenched board.“We are disappointed that Illumina’s board of directors has rejected Roche’s increased $51 cash offer and continues to rebuff our attempts to engage in substantive discussions,” said Severin Schwan, Roche’s chief executive.“Roche’s increased offer is highly attractive. By not engaging with Roche, Illumina reinforces the notion that its board and management are determined to preserve their positions rather than maximise shareholder value.”Pointing to Illumina’s forthcoming shareholders’ meeting, Mr Schwan said: “We expect that Illumina shareholders will see the substantial value in our increased offer, conclude that there is absolutely no justification for Illumina’s current directors’ refusal to begin discussions with Roche and vote their shares for the Roche director nominees.”Roche’s position remains weakened, however, because so far very few Illumina shareholders have accepted its tender offer, leaving the Swiss group with only a minimal amount of the US group’s stock ahead of the April 18 meeting, at which Roche has put forward new candidates for the board.Roche’s reaction followed Monday’s night’s description by Illumina’s board of its latest offer as “opportunistic”. The US group added that “even the revised offer does not reflect the intrinsic strength or future prospects of Illumina”.In a letter to Franz Humer, Roche’s chairman, Jay Flatley, Illumina’s president and chief executive, said the offer, valuing the US diagnostics group at about $6.7bn, “dramatically undervalues Illumina and does not adequately reflect Illumina’s singular position in an industry poised for extraordinary growth”.Mr Flatley, drawing from Roche’s own remarks, pointed to his company’s strong generation of revenues, profit and cash and a record of delivering continual upgrades in technology to the market.Analysts in Switzerland said they were not surprised by Illumina’s rejection, which they took as an attempt to squeeze still better terms out of Roche after last week’s increased offer. Roche has argued the offer is already fully priced and warned of the risks to Illumina of rejection.Referring to extensive contacts with Illumina’s biggest shareholders in a letter accompanying Roche’s improved offer, Mr Humer said his group had detected a strong wish among Illumina shareholders to accelerate the takeover process after “a number of productive discussions” with Illumina shareholders in recent weeks.“Our revised offer represents a 15 per cent premium to our offer on January 25 2012 and a substantial premium of 88 per cent over Illumina’s closing stock price on December 21 2011, the day before market rumours about a potential transaction between Roche and Illumina drove Illumina’s stock price significantly higher,” he added.Earlier in March, Severin Schwan, Roche’s chief executive, warned Illumina shareholders their company’s growth prospects had diminished over the past year at a time of slowing demand reflected in lower earnings guidance. He said its shares had only held up because of stock market speculation over Roche’s bid.He warned that Illumina alone did not have the scale and infrastructure to expand successfully in diagnostics and had little experience in regulated areas.
19;ILMN;Illumina Inc;2020-04-24T22:03:09+0000;Letter from Lex: First quarter break;Some companies would prefer if people stayed indoors more;Some people have been out enjoying early Springtime sunshine, but Microsoft and others would prefer if they stayed indoors. Its aim is to “own the living room” through its Xbox home entertainment hub, but it has tough competition. For one there is the much-touted Apple iTV, which Taiwan’s Hon Hai is well-positioned to take advantage of if it ever arrives after buying a 10 per cent stake in flagging Japanese television maker Sharp. US studio Lions Gate would also like people to stay inside watching Mad Men and The Hunger Games, which made $155m in its opening weekend in the US, so it can pay down its $900m debt.Meanwhile, after a slow first quarter, the M&A market showed signs of life. Swiss pharma group Roche upped its offer for US diagnostics company Illumina to $6.7bn while the world’s largest power utility – GDF Suez – made a £6bn offer for the 30 per cent of International Power it does not already own. In China the first hostile bid by a state-owned enterprise for a domestic company tested new boundaries while India’s Tata group considered increasing its debt even more with a bid for the UK’s Cable & Wireless Worldwide. Elsewhere Rio Tinto joined BHP Billiton by putting its diamond business up for sale while London-listed Indonesian coalminer Bumi sidelined its co-founder in an effort to prove it is more than a shambolic get-rich-quick scheme.And finally, who can forget the banks? Due to regulation following the financial crisis, banks are being forced to concentrate on areas of real prowess and scale, and cut back on areas where they lack expertise. As European banks adjust – the latest example being Caixabank’s €980m takeover of Banca Cívica to create Spain’s largest domestic bank – foreign competitors can smell blood. Eurozone policy makers are hoping that the €700bn firewall they have agreed to will give the region’s economies and banks time to stabilise and recover.John Casey, Lex Publisher
20;ILMN;Illumina Inc;2012-03-29T19:11:45Z;M&A activity picks up in Europe;;Europe last year was the whipping boy of the global economy and the dealmaking world.The continent’s sovereign debt crisis rattled markets across the world leading to a sharp drop-off in mergers and acquisitions activity in the second half of the year.And the slump has continued into 2012. Dealmaking fell almost 15 per cent from the final quarter of last year, the fifth consecutive quarterly decline.But the moribund European market is twitching. From an abysmally low base at the end of last year, M&A volumes rose about 14 per cent in the first quarter. True, Glencore’s proposed $53bn tie-up with Xstrata helped boost Europe’s numbers.But elsewhere there are signs of life, with Sumitomo spending $7.3bn to snap up the aviation finance business of Royal Bank of Scotland and UPS agreeing a $6.8bn deal with TNT Express of the Netherlands.Advisers argue that the indiscriminate sell-off in European equities created opportunities for those eyeing the market. “Inbound European deals are being driven largely by attractive valuations, reduced levels of uncertainty, and the perception that one has not yet caught up with the other,” says Steve Baronoff, chairman of global M&A at Bank of America Merrill Lynch.Other buyers, such as Cisco in its $5bn deal for video software company NDS, are looking for opportunities to deploy overseas cash, which would be taxed if repatriated to the US.“There are US companies who have a lot of cash sitting in Europe, which enables them to tax-efficiently acquire companies that are consistent with their strategic objectives,” says Jacques Brand, co-head of investment-banking coverage and advisory at Deutsche Bank. “There are also European companies that have significant operations in Asia or the emerging markets that are of interest.”Despite a revival in debt markets which has allowed private equity funds to increase the amount of leverage they can use, buyout volumes dropped 36.2 per cent year on year in the first quarter to $41.3bn, writes Anousha Sakoui.“Public to private deals in Europe remain difficult for private equity because of continued differences between buyer and seller price expectations,” says Karen Simon, global co-head of private equity for JPMorgan. “Funds are more focused on the US where it is easier to do public-to-private deals.”The reopening of the IPO market in Europe is giving some funds hope that they will soon be able to float some portfolio companies.“We have started to see an increase in seller-driven activity, as a result of companies reassessing their portfolios, including the potential sale of divisions [and] sponsors considering exits,” says Giuseppe Monarchi, head of Emea M&A at Credit Suisse.But the agreement by Switzerland’s ABB to buy Thomas & Betts in the US for $3.9bn and Roche’s $6bn hostile bid for US diagnostics company Illumina also showed renewed interest from European companies in overseas deals.“We are seeing more Asian and European buyers looking into North America as a platform for growth,” says Chris Ventresca, co-head of North American M&A at JPMorgan. “From more developed overseas markets, growth in North America may look relatively attractive.”The tick-up in Europe is highlighted by a stony silence stateside. The US dominated the first three months of 2011, with seven of the quarter’s top 10 deals an all-American affair. This year, however, only 28 per cent of activity involves the US, down from almost half last year.Some advisers point to a time-lag, arguing the dearth of announcements reflects last year’s European woes. Others suggest that with more businesses coming to the market, a buoyant leveraged finance market and the fading threat of a eurozone meltdown the second half looks promising.“This should be a market in which we see much more robust M&A activity,” says Mr Brand at Deutsche Bank. “Volatility is down, corporates are cash rich, top line growth is slow, therefore mergers that result in expense synergies and opportunities to access new markets inorganically make a lot of sense.”“As confidence broadens, we should see levels picking up further,” says Hermann Prelle, chairman of M&A at UBS. “The M&A market is benefiting from being global. Asian buyers have kept the market going last year and US buyers are increasingly becoming active.”
21;ILMN;Illumina Inc;2012-03-29T11:39:58Z;Roche / Illumina: time to talk;Swiss pharmaceuticals group raises offer for US diagnostics company;"Severin Schwan is a determined man. The chief executive of Roche Holding will simply not give up on Illumina. Thursday’s revised terms raised the Swiss pharmaceuticals group’s cash offer for its US target by 15 per cent, valuing the genetics company at $6.7bn. But Illumina chief executive Jay Flatley is also playing tough: his studied disdain for Roche’s offer, in the near certainty that it would have to table a better one, is obviously working.Valuing the potential of genomic research is all but impossible, but Roche will not keep raising its offer forever. So Illumina is close to having to recommend the bid before its suitor walks. That said, the Swiss group is still well within its means: free cash flow was nearly SFr14bn in 2011; Goldman Sachs estimates that the company will generate SFr37bn of free cash flow net of dividends and capital expenditure over the next five years. It has little debt, and deep pockets. And Illumina is a good fit: although it would add only 2 per cent to Roche’s revenues, its gene sequencing technology could help to develop new cancer drugs.Even so, the riskier of the two balancing acts probably is Mr Flatley’s. Roche’s revised offer represents an 88 per cent premium to Illumina’s share price before speculation about the Roche deal leaked into the market in late November (although it is still a third below the equally bid-inflated level at which the shares were trading last July). Roche’s offer equates to a tempting forward earnings multiple for Illumina of 34 times, compared with 12 to 14 times for such peers as Life Technologies and Agilent. Some Illumina shareholders are already backing Roche. If Mr Flatley and the board are too intractable, Illumina’s share price has a long way to fall.Illumina says its shareholders should take no action on the revised Roche offer. But the US company’s board should give the terms a thorough hearing. The time for talking is approaching.E-mail the Lex team in confidence at lex@ft.com"
22;ILMN;Illumina Inc;2012-03-29T08:30:37Z;Roche improves offer for Illumina;;Roche on Thursday made its long-expected improved cash offer for Illumina with a 15 per cent increase to $51 a share, valuing the US diagnostics group at about $6.7bn .“Based on our discussions with Illumina shareholders we have seen interest to accelerate the takeover process,” claimed Severin Schwan, Roche’s chief executive.“Roche’s preference continues to be a negotiated transaction. We look forward to the possibility of a swift completion that offers immediate value to Illumina’s shareholders,” he added.The offer came alongside release of a new letter from Franz Humer, Roche’s chairman, to Jay Flatley, US-based Illumina’s president and chief executive, in which he argued the Swiss group’s move had been prompted by “a number of productive discussions” with Illumina shareholders in recent weeks.“Our revised offer represents a 15 per cent premium to our offer on January 25 2012 and a substantial premium of 88 per cent over Illumina’s closing stock price on December 21 2011, the day before market rumours about a potential transaction between Roche and Illumina drove Illumina’s stock price significantly higher,” he addedRoche expressed confidence the improved terms would bring round Illumina’s board, which has so far strongly resisted the takeover, triggering a proxy battle ahead of a shareholders’ meeting at the US group on April 18.“I strongly hope that you will either agree to commence discussions with us now or remove all obstacles so that your shareholders can make their own determinations about the adequacy of our increased offer,” concluded Mr Humer.Illumina responded by saying it was advising shareholders to “defer taking any action”. It added that its board would review the revised proposal and make a recommendation “in due course”.The Swiss pharmaceutical group’s tactics closely follow its earlier takeover of Ventana, another cutting edge US healthcare group that also strongly resisted acquisition at the outset.In the Illumina case, Roche had previously argued its $44.50 a share cash offer represented “full and fair value”, upping the pressure by sending assorted letters to Illumina investors expressing “disappointment” at the US group’s resistance.Earlier this month, Mr Schwan told Illumina shareholders their company’s growth prospects had diminished over the past year at a time of slowing demand reflected in lower earnings guidance and its shares had only held up because of stock market speculation over Roche’s bid.He warned that Illumina alone did not have the scale and infrastructure to expand successfully in diagnostics and had little experience in regulated areas.Illumina’s own letter to shareholders noted: “Roche Holding Ltd – an Illumina competitor with a record of pursuing hostile acquisitions – is trying to buy Illumina at a lowball price and capture our future growth and value potential for its own stockholders.”
23;ILMN;Illumina Inc;2012-03-27T23:13:27Z;Investment banking: David versus Goliath;Boutique banks are closing the gap on their bulge-bracket rivals in a difficult market – and squeezing those in the middle;In the past year, the long-predicted shakeout in the investment banking sector has begun in earnest.Bulge-bracket banks in particular have slashed costs, cut jobs and disposed of businesses amid a sharp drop in revenues, tighter regulatory pressure and the need to shore up their capital cushions.But behind this frenzy of cuts and business-model adjustments, a long-term and fundamental trend is coming back to the fore: the perennial fight between smaller boutique advisers and their bulge-bracket rivals has picked up pace.While it is far from clear which group will eventually emerge as the winner, it does seem that investment banking’s Davids are gaining ground against the Goliaths.The trend is apparent in a number of business segments, from mergers and acquisitions to brokerage and fixed-income trading.Take M&A: in January this year, the takeover and merger market saw a brutal drop in revenues and fees, with global announced deal value falling to the lowest level seen for nearly a decade.But for some independent advisory firms such as Greenhill and Moelis, the start of the year shaped up to be a fairly good one. Both boutiques managed to crack the top-10 league table in January, pushing some of their much larger rivals to lower ranks. Greenhill’s advisory of Swiss drugmaker Roche’s $5.7bn takeover of Illumina, the US genetic diagnostic company, catapulted it into the top 10 after ranking only 122nd globally in the same period of the year before.Other smaller, independent advisory firms have achieved similar successes in the past year. Perella Weinberg last year blindsided US bulge-bracket banks with its role advising NYSE Euronext on the exchange operator’s attempted tie-up with Deutsche Börse, which ultimately failed due to antitrust issues.And Evercore has grown so fast in the past few years that the US firm’s founder, Roger Altman, a former deputy US Treasury secretary, refuses to label it a “boutique” any longer. In the past year, its revenues surpassed $500m for the first time in its 16-year history, boosted by its advisory role on high-profile deals such as Kinder Morgan’s $37.6bn takeover of rival energy group El Paso.A 2009 presentation from Evercore highlighted the long-term trend: in the US, those firms labelled by the firm as boutiques have increased their M&A advisory market share against Wall Street’s bulge bracket from 3 per cent in 2000 to 16 per cent in 2008 and 2009.Boutique firms argue that the larger banks’ model of providing debt finance alongside M&A advice is prone to conflicts of interest. They also say they are more attractive to work for at a time when large banks are firing staff and sharply reducing bonuses. The bulge-bracket firms are seen as less “fun”, given intense public scrutiny and added layers of bureaucracy in the wake of regulatory pressure on their compliance and risk models.By contrast, boutique firms see themselves as more entrepreneurial, with the individual banker participating directly in the success of the firm and not feeling like a small cog in a big machine.But from a customer perspective, big investment banks often have the advantage of being one-stop shops where clients can get finance, advice and other services in the same place.Some observers say that in reality the fight will once again end with an impasse. A number of both small and larger firms could come out of the crisis stronger, while medium-sized groups might turn out to be the real losers.Analysts say the fixed-income business, one of the big revenue drivers for investment banks since the financial crisis, could see such a bifurcation between the large bulge-bracket companies such as Barclays, Deutsche Bank and JPMorgan, and a string of new and old smaller firms.Kian Abouhossein, an analyst at JPMorgan, says the trend would mirror what has already happened in equity trading businesses. “There are large global equity houses that provide a whole range of services such as prime brokerage, cash equities [and] equity derivatives with bulge bracket compensation, and then there are small boutiques that are focused and are highly profitable such as Autonomous and Redburn Partners, with high revenue per head,” he wrote in a recent note.“We also note fixed cost is low – as illustrated by the low compensation ratios for Autonomous and Redburn, with profit being paid out to members purely dependent on profit performance. This business model is highly profitable [up] to a certain size of 100-150 people in our view.”With competition increasing and revenues going down, the ones that lose out are the medium-sized banks that have the same pay structures and technological platforms to support as their larger peers, but lack economies of scale.Bill Michael, UK head of financial services at KPMG, the professional services group, says: “The big question for the industry is how it will consistently generate a return on equity above the average cost of capital. This is a very tough ask in the current environment and the challenge for management will be to continue driving down costs to match reduced revenue levels.”Some medium-sized investment banks, such as Japanese Nomura, which took over Lehman Brothers’ European and Asian operations a few years ago, are already cutting costs. Royal Bank of Scotland is scaling back its investment banking by shedding thousands of jobs. A few months ago, it sold Hoare Govett, its brokerage arm, to Jefferies, the US investment bank that has been one of the few global financial institutions to expand rapidly during the financial crisis.
24;ILMN;Illumina Inc;2012-03-20T19:37:14Z;Roche in appeal to Illumina investors;;"By Andrew Jack in London and Alan Rappeport in New YorkRoche has stepped up the pressure on Illumina, the US diagnostics business, making a direct appeal to shareholders that criticised incumbent management while not raising its $5.7bn hostile offer for the
company.The Swiss pharmaceutical group filed its definitive proxy statement and proposed an alternative board of directors, arguing that its $44.50 a share cash offer for Illumina represented “full and fair value”.In a letter to investors, Severin Schwan, Roche’s chief executive, expressed “disappointment” that Illumina’s directors rejected his bid last month, stressing that it represented a 64 per cent premium to the share price ahead of the bid last December.He criticised management’s reluctance to embark on share buybacks, saying its “inaction” had cost the company $390m at the current share price under the terms of 2014 convertible notes, which allowed Illumina’s counterparty banks to buy shares at $31.44 each.Mr Schwan also said Illumina’s growth prospects had diminished over the past year at a time of slowing demand reflected in lower earnings guidance and its shares had only held up because of stock market speculation over Roche’s bid.He warned that Illumina alone did not have the scale and infrastructure to expand successfully in diagnostics and had little experience in regulated areas.In its own letter to shareholders on Monday, Illumina said: “Roche Holding Ltd – an Illumina competitor with a record of pursuing hostile acquisitions – is trying to buy Illumina at a lowball price and capture our future growth and value potential for its own stockholders.”Mr Schwan left open the possibility of more talks with Illumina, stressing that Roche still preferred “voluntary and meaningful discussions” with the board, and hoped Jay Flatley would remain chief executive. “Do not let Illumina silence your voice,” he wrote.
● AstraZeneca has taken a further $50m charge to write off its remaining investment in TC-5214, an experimental anti-depressant, following the failure of late-stage clinical trials with its US partner
Targacept.The move increases pressure to the Anglo-Swedish pharmaceutical group, adding to speculation that the company will need to launch a major acquisition or itself be bought.The company faces the threat of generic competition on existing drugs, and has suffered late-stage failures. In December, Deutsche Bank said in a research note that 2012 would be a “crunch year” for the company “that could well prompt a change in group strategy”."
