;Ticker;Nombre_Completo;Date_Time;Titular;Subtitular;Texto
9;ILMN;Illumina Inc;2016-04-01T05:03:18Z;Whole-genome breakthrough promises tonic for healthcare;Accurately sequencing an individual’s DNA for less than $1,000 is now possible;Commentators have long looked forward to the “thousand-dollar human genome” — the ability to sequence accurately all 3bn letters of an individual’s DNA for less than $1,000. In 2016 it seems likely to happen, 15 years after the completion of the first whole human genome in a decade-long $3bn research programme. The consequences for personalised healthcare could be profound.Veritas Genetics, a Boston start-up company, announced in March the availability of whole genome sequencing together with interpretation and genetic counselling for $999 — the first time the price of a consumer genomics product has fallen below the thousand dollar barrier.George Church, Harvard University genetics professor and co-founder of Veritas, predicts that whole genome sequencing will soon replace the partial DNA sequencing that, at present, dominates genetic testing.“Now that the whole genome is this accessible, it will replace all genetic tests,” he says, “because it is all genetic tests and much, much more.”The tests commercially available today read only a small fraction of the patient’s DNA. They may focus on specific genes known to be involved in a disease, on mutations scattered through the genome or on the “exome”, the part of the human genome containing active genes but not the DNA that controls their activity.These partial DNA testing techniques are still considerably cheaper than whole genome sequencing. In September, for instance, Human Longevity, a San Diego company founded by genomics pioneer Craig Venter, announced a $250 exome sequencing service in collaboration with Discovery, the South African health insurer.Veritas claims, however, that whole genome sequencing catches many clinically important DNA variants that lie outside genes. “The whole genome is the foundation of precision medicine and a lifetime resource to maximise quality of life and longevity,” says Mirza Cifric, the company’s chief executive.While a host of companies such as Veritas and Human Longevity offer genomic services, backed by deep scientific and clinical knowledge about the relationship between genes and health, the instruments they use to read DNA come almost entirely from one source: Illumina. This Californian company’s machines are generating an estimated 90 per cent of the world’s DNA sequence data — thanks to technology acquired in 2007 when Illumina bought Solexa, a spinout from Cambridge university in the UK, for $650m.MinIon is no larger than a mobile phone, fits into the USB port of a laptop computer and costs no more than $1,000Francis deSouza, Illumina’s president who will take over as chief executive in July from the long-serving Jay Flatley, points out that the DNA sequencing market is still in its infancy. “Until now it has been used largely for research,” he says. “The overarching story for the future will be the march of sequencing into the clinic.”The first medical fields likely to be transformed by large-scale genomic diagnosis are prenatal screening for genetic defects in the embryo — and oncology. The concept of the “liquid biopsy”, diagnosing cancer from DNA that has leaked from the tumour into the bloodstream, is one of the hottest topics in oncology and Illumina has set up a subsidiary company, Grail, to exploit the market. Many others are in the field, too.Although the cost of DNA sequencing per genome has fallen sharply, the machines are still big and expensive. This year Illumina launches its smallest and cheapest sequencer so far, the $49,500 MiniSeq, and it has promised a new machine called Firefly for late next year at a price below $30,000.For a radically smaller, cheaper and more portable DNA reader, researchers can turn to the recently introduced MinIon from Oxford Nanopore, a start-up from Oxford university that focuses on a quite different technology: nanopore sequencing. MinIon is no larger than a mobile phone, fits into the USB port of a laptop computer and costs no more than $1,000 (though consumable reagents add to the running expenses).The technology employs a microscopic hole within bacterial proteins — the nanopore — to act as a biosensor. A voltage is applied across the pore and, as DNA moves through it, the electric current changes in a way that distinguishes between the four biochemical “letters” of the genetic code: G, A, T and C. This direct electronic reading is quite different from the “sequencing by synthesis” technology developed by Illumina, which attaches fluorescent molecular tags to the DNA and uses a computerised camera to read the results.MinIon has the advantage over its competitors of portability, which has enabled many scientists to use it in the field for identifying viruses and bacteria, plants and animals, from their genomes. It cannot come close to the larger Illumina machines for sequencing capacity.Oxford Nanopore’s next offering, the desktop PromethIon being introduced this summer, is a more direct competitor for Illumina. Clive Brown, chief technologist at Oxford Nanopore, says the instrument will begin sequencing human genomes later this year.A court case, however, is currently commanding Oxford Nanopore’s attention. In February Illumina sued the company in the US for allegedly infringing Illumina patents. Although it has no nanopore machines close to commercialisation, Illumina said it “has made substantial investments to obtain licenses and develop the nanopore sequencing technology invented by researchers at the University of Alabama and University of Washington.”Oxford Nanopore, which has an extensive portfolio of nanopore patents from other universities, has issued a robust defence. It accuses Illumina of using the lawsuit “as yet another weapon in its long-running campaign to thwart Oxford Nanopore’s research and commercialisation efforts . . . with the ultimate intent of expanding its already overwhelming monopoly power into the nanopore space, which would be extremely detrimental to competition in the DNA sequencing market”.
10;ILMN;Illumina Inc;2016-03-13T18:04:37Z;Cambridge Epigenetix secures $29m financing;Google among backers for group aiming to commercialise epigenome;"The Cambridge university professor who invented the world’s most successful technology for reading DNA has secured $29m in financing for his latest venture, which is seeking to exploit epigenetics — nature’s instructions for switching genes on and off, which are similar to a second genetic code.Shankar Balasubramanian will be aiming to mimic the success of his first company, Solexa, founded in 1998 as a university spinout to commercialise a new superfast way to sequence DNA. Solexa was acquired for $650m in 2007 by Illumina, based in California, which used its technology to become the world’s market leader for reading genes.His new company Cambridge Epigenetix has raised the financing from a number of venture funds including Google’s GV, Wellcome Trust’s Syncona, Sequoia Capital, New Science Ventures and Cambridge Enterprise. Bobby Yerramilli-Rao, a technology entrepreneur, is co-founder and chairman.Cambridge Epigenetix will use Prof Balasubramanian’s recent discovery of techniques for identifying the chemical tags that determine whether or not genes are active in specific cells.“I realised when founding the company that epigenetics was going to be hugely important in medicine,” he says. “I realised too how underprovided the epigenetics research community was with good tools and reagents.”Tom Hulme, GV general partner who has joined the Cambridge Epigenetix board, said: “We’ve seen how the commercialisation of genome sequencing has created incredible opportunities to improve human health, and now the epigenome [the chemical tags that control the genome] holds similar potential. Cambridge Epigenetix is one of the few teams on the planet with the skills and experience to break new ground here.”Scientists have long recognised that the genome, the DNA blueprint for an individual, must be controlled by chemical tags or markers, which determine the activity of genes in different cells in varying circumstances from embryonic development to old age.But only now are researchers such as Prof Balasubramanian beginning to identify these epigenetic tags, which attach to the four chemical letters of the genetic code: G, A, T and C. The three most important tags go by the chemical names of methyl, hydroxymethyl and formyl; they can switch genes on or off in different circumstances.Epigenetic markers may be shortlived or long-lasting — sometimes even passed on to future generations. This heritability has been demonstrated in animal experiments and occasionally in human observations; for example grandchildren of women who were pregnant during great famines such as the Dutch “hunger winter” of 1944-45 show metabolic effects two generations later.Many human diseases, including cancer, and autoimmune and neurological disorders, reflect aberrant epigenetic activity. Some drugs with an epigenetic mechanism — turning off cancer-related genes — are already on the market, including Vidaza and Istodax from Celgene of the US, Zolinza from Merck of the US and Dacogen from Otsuka of Japan. A recent report by Citigroup pharmaceuticals analyst Andrew Baum estimated that the epigenetic oncology market would be worth $10bn a year by 2025.Such projections suggest a large potential market for a company that produces accurate diagnostic tools and technology to accelerate the translation of epigenetics from lab to clinic, according to Geoff Smith, newly appointed chief executive of Cambridge Epigenetix.“Cambridge Epigenetix is ideally positioned to catalyse the market for epigenetics, just as Solexa and Illumina did for genomics a decade ago,” adds Dr Smith, who joined the company from Illumina where he was vice-president for product development."
11;ILMN;Illumina Inc;2015-12-16T18:36:43Z;Fed rate rise: a reminder of the world in 2006;;The Federal Reserve has raised its key interest rate for the first time since 2006, a year when sub-prime had yet to become a toxic word and Lehman Brothers was valued at a cool $41bn. Here’s a look back at some key events of that year.FinancialFinancial data source: BloombergPoliticsSportsPop culture
12;ILMN;Illumina Inc;2020-04-24T21:11:09+0000;DuPont boosted as chief bows out;Chemical company under pressure from activist investor Nelson Peltz;DuPont shares surged higher on Tuesday after the company’s chief executive abruptly outlined plans to retire.Ellen Kullman, who has been at the helm of the company since 2009, will exit on October 16. Wilmington, Delaware-based DuPont has been under pressure from Nelson Peltz, the leader of activist hedge fund Trian Fund Management, to turn round its performance. Mr Peltz failed in a push earlier this year to secure a seat on the company’s board of directors.The blue-chip chemical company also cut its full-year earnings guidance as a result of a stronger dollar and tougher conditions in its agriculture unit. DuPont now expects full-year earnings of $2.75 a share, down from a previous outlook of $3.10.DuPont’s revenues fell 11 per cent in the second quarter from the year before, while operating earnings per-share ticked up 1 per cent on the same basis.The shares climbed 7.7 per cent to $55.23, cutting the year-to-date loss to about 25 per cent.Elsewhere, Freeport-McMoRan shares rallied 6 per cent to $11.85 after the company revealed plans to explore strategic alternatives for its oil and gas business. The company, which also cut the size of its board of directors, said it was considering a potential spin-off, joint venture or more cost cuts. A previously announced strategy to sell a minority stake in the oil and gas segment in a public offering also remains on the table.Phoenix, Arizona-based Freeport-McMoRan is one of the world’s biggest copper producers, but generated about 20 per cent of its overall revenue from its oil and gas business in 2014. Its shares have collapsed by half this year amid the swoon in commodity prices.Skyworks Solutions saw its shares dip 1.4 per cent to $80.71. The semiconductor company, which makes chips for Apple, said late Monday it would buy PMC-Sierra for roughly $2bn in cash. The transaction valued PMC at $10.50 a share, a 36.5 per cent premium to the company’s closing price before the deal was announced.Microsoft shares ticked up by 12 cents to $46.75 after the software group took the wraps off a duo of new smartphones. The company also updated its Surface tablet and Band fitness tracker.The healthcare segment was the biggest laggard of the major S&P 500 sectors. The losses were led by a sell-off in the biotechnology segment.Illumina faced some of the steepest losses on the closely tracked Nasdaq biotechnology index, tumbling 10.6 per cent to $145.81. The pharmaceutical company disclosed after the bell on Monday a full-year sales outlook that missed Wall Street forecasts.On the other side of the spectrum, energy shares were lifted by a rally in the price of brent crude oil. Transocean, one of the biggest offshore drilling contractors, jumped 7.3 per cent to $15.76. Oil majors advanced as well: ExxonMobil rose 1.4 per cent to $77.89, while Chevron jumped 3.5 per cent to $87.By close, the S&P 500 fell 0.4 per cent to 1,979.92. The Dow Jones Industrial Average climbed 0.1 per cent to 16,790.19 and the Nasdaq Composite slumped 0.7 per cent to 4,748.36.
13;ILMN;Illumina Inc;2014-06-05T17:03:16Z;Amazon gains in Nasdaq 100 advance;;The Nasdaq 100, a compilation of the largest companies on the broader Nasdaq index, extended a nearly two-month long ascent, leading US equity markets and returning the index to highs not seen since 2000.Previously hampered by an investor rotation into haven equities, as well as a shift into companies with more economical price-to-earnings valuations, the index has largely recovered since April lows.Amazon, TripAdvisor and Whole Foods, advanced more than 3 per cent on Thursday.Darren Wolfberg, head of US cash equity trading at BNP Paribas, said he expected equity markets to shift higher by the end of the year, although they may do so in fits and starts.Institutional traders have begun to digest the improving economic data in the US, he says, and will eventually have to shift funds out of bonds purchased over the past few years and into other asset classes, including equities.“Investors are still reticent to put money into equities, which indicates to me we are not at a top,” Mr Wolfberg said.The Nasdaq 100 advanced 0.9 per cent to 3,776.95.Many large-cap stocks have also been lifted by corporate buybacks as companies buy on dips, Mr Wolfberg added.The S&P 500 Buyback Index, which measures the top 100 stocks with the highest buyback ratio, touched a record high on Thursday, rising 0.5 per cent to 11,702.89.By close of trading,TripAdvisor gained nearly 4 per cent to $103.03, Amazon climbed 5 per cent to $323.57 and Whole Foods rose 4 per cent to $40.08.The grocer was also buoyed by unconfirmed talk that competitor Publix was eyeing the chain.Rite Aid was among the laggards on the Russell 2000, the small-cap index that remains 6 per cent below its March peak, declining 7 per cent to $7.87.The third-largest US drugstore was under pressure after forecasting first-quarter earnings below Wall Street expectations.The company said it expected to earn between $35m and $45m, or roughly 4 cents per share. Analysts had forecast earnings per share of 8 cents in the first quarter.The company also lowered its full-year earnings guidance to between 30 and 40 cents from as much as 42 cents earlier.PVH, the owner of Calvin Klein and Tommy Hilfiger, dipped 8 per cent to $120.09 after the company lowered its full-year earnings forecast due to “heightened” discounting.The company said it expected to earn between $7.30 and $7.40 per share, below Wall Street expectations for $7.50.Analysts with Citigroup said store checks and conversations with industry experts indicated “department store traffic was difficult for the majority of PVH’s first quarter, only picking up near the end”.Barnes & Noble rallied after the book retailer said it would partner with Samsung on a co-branded tablet in an effort to revive its flailing Nook e-reader business.The company said it expected to launch the Samsung Galaxy Tab 4 Nook tablet in August, ahead of the key holiday sales period.“This will drive cutting edge designs as well as dramatically cut losses in this division,” Janney Capital Markets analyst David Strasser said.Barnes & Noble shares increased 4 per cent to $19.57.Overall, US equity markets advanced as data on jobless claims were indicative of a firming economy and a lack of large-scale lay-offs.Chris Rupkey, chief financial economist with Bank of Tokyo-Mitsubishi UFJ, noted “current conditions could not be any better”.“Good news this morning on the labour market, current conditions. We don’t see the slack economic conditions that Fed officials see, and unemployment claims don’t either,” Mr Rupkey said.“These are levels we tend to see during robust economic expansions, where any job losses are modest frictional ones in a normal, growing $17tn economy.”The S&P 500 advanced 0.7 per cent to 1,940.46, a record intraday high, while the Dow Jones Industrial Average rose 0.6 per cent to 16,836.11. The technology-heavy Nasdaq Composite climbed 1 per cent to 4,296.23.eric.platt@ft.comTwitter: @ericgplatt
14;ILMN;Illumina Inc;2020-04-25T00:30:02+0000;Global pharma: check that pulse;Patent cliff has been the industry’s excuse for a decade of underperformance;"The patent has expired – please do not resuscitate. That has been the pharmaceutical industry’s excuse for a decade of underperformance in the face of a wave of patent expiries. Trailing the market is quite an effort given the collapse in bank shares, although in fairness pharma has held its own in the past year and a half. Is that a buy signal for a global sector that makes lots of cash and has a fair number of defensive qualities? That depends on whether its problems are outweighed by a couple of notable industry positives.The patent cliff aside, the two biggest issues facing global pharma companies are shrinking health budgets and unproductive research and development spending. Neither is new, but the industry response has been patchy. The push into emerging markets is starting to produce results.A feature of Big Pharma’s 2012 quarterly numbers was the pace of revenue growth in emerging against mature markets. But emerging nations account for a fifth of the global pharmaceuticals market – almost as much as Europe. That is not yet reflected in the sector’s global sales.R&D is proving a tougher issue to address, though in fairness things are getting better. Each of the past two years has seen the highest number of drug approvals in the US since 2004. Deutsche Bank estimates that European pharma companies have nearly 60 drugs in the launch pipeline from 2013 to 2015, with peak sales potential of $64bn. That will easily outweigh the estimated $27bn of patent expiry revenue losses those companies face in that period.A less risk-averse regulatory environment helps, as does the fact that pharma companies may just be making better drugs than a decade ago. And do not forget M&A in innovative areas such as biotech and genetics (see Roche’s on-off pursuit of Illumina), which should help to cut R&D costs.Large-cap US pharma stocks trade in line with the market; their peers in Europe enjoy a small premium. Investors have good reason to recall past underperformance, but it is time to look beyond the patent cliff.Email the Lex team in confidence at lex@ft.com"
15;ILMN;Illumina Inc;2012-04-12T08:52:56Z;Roche persists with Illumina chase;;Roche on Thursday sent its third letter to Illumina shareholders, repeating its readiness to improve its takeover offer, as strong diagnostic sales in the first quarter reflected the Swiss pharmaceuticals group’s growth potential.Severin Schwan, chief executive, repeated Roche’s $51 a share offer, valuing the US gene sequencing group at $6.7bn, saying the price was “more than adequate”. But he confirmed Roche might go higher if allowed due diligence and claimed not to be perturbed that the company had so far been tendered only a minimum number of Illumina shares.“It is typical that shares are tendered only at a very late stage,” he said in a conference call, noting that a large proportion of Illumina’s stock was held by a relatively small number of investors, and that Roche had conducted “several discussions” with relevant owners.“Illumina has to date not provided any quantitative support for their aggressive growth assumptions. We believe that their long-term growth expectations are unrealistic,” he said in a statement.“If Illumina were to engage with us, we would consider any information supporting Illumina`s contention that our offer undervalues the company and its prospects.”Illumina has consistently rejected Roche’s offers as too low and, most recently, cited reports by three US proxy advisory groups supporting its stance.Mr Schwan declined to discuss how Roche might react if its alternative slate of directors, proposed for Illumina’s shareholders’ meeting next week, were not approved. Illumina’s general meeting is due in New York on April 18, and analysts remain mixed on whether the Swiss group might come out with a surprise or walk away if unsuccessful.The comments came as Roche reported that first-quarter sales fell 1 per cent to SFr11bn ($12bn), hit by restricted health spending and the strength of the Swiss franc. In constant currency terms sales rose 2 per cent in the period, in line with market expectations.But while sales in the core pharmaceuticals division declined 1 per cent to SFr8.6bn (and rose 2 per cent in constant currency terms), sales in diagnostics, Roche’s smaller second division into which Illumina would be integrated, remained stable at SFr2.4bn, climbing 4 per cent at constant exchange rates.The respectable first quarter prompted Mr Schwan to reaffirm the group’s financial targets for 2012, with the prospect of low to mid single-digit sales growth at constant exchange rates for both the group and the pharmaceuticals division.Roche’s drug sales remained resilient thanks to the group’s focus on cancer treatments, where its Avastin and Herceptin products have gained significant market share.Avastin sales rose 1 per cent to SFr1.4bn in the first quarter, a turnround from a recent slip caused by regulatory restrictions in certain indications.
16;ILMN;Illumina Inc;2012-04-10T16:11:34Z;Roche and Illumina remain at loggerheads;;Roche and Illumina remained at loggerheads on Tuesday, as the $6.7bn battle for control of the US gene sequencing group entered a potentially decisive week.Illumina, which is fighting a hostile bid from Roche, ignored the Swiss pharmaceuticals group’s hint last week that it might improve terms if allowed due diligence, and instead highlighted backing from a further US proxy advisory group.Illumina said Glass Lewis had added its voice to that of two other leading proxy advisory companies supporting the board’s recommendation that shareholders reject Roche’s proposals.Roche declined to comment on the latest twist. A company official said the group stood by its statement of last week, when it hinted its improved $51-a-share offer might be further sweetened if it were allowed access to Illumina’s books.Roche has called on Illumina investors to support an alternative slate of directors for the board, with the two sides set for a showdown at Illumina’s shareholders’ meeting on April 18.Jay Flatley, Illumina’s chief executive, highlighted the latest backing for his position.“We are very pleased that all three of the leading proxy advisers – Institutional Shareholder Services, Glass Lewis and Egan-Jones – have now recommended that their clients support the re-election of Illumina’s slate of directors and vote against all of Roche’s proposals at Illumina’s upcoming Annual Meeting,” he said.“The simple fact remains that Roche’s unsolicited offer clearly undervalues Illumina and that our highly qualified and experienced directors are best positioned to create value for Illumina’s stockholders,” he added.The latest rejection comes in spite of suggestions by European equity analysts that Roche’s hint of an additional improvement in its offer might finally unlock the door to a negotiated deal.However, based on the last published figures, Roche’s bargaining position remains weakened by the fact that it has so far amassed only a minimal number of Illumina shares in its tender offer.Glass Lewis’s comments echo the report last week from Institutional Shareholder Services, which said Roche’s current bid “does not provide meaningful compensation for the potentially enormous long-term opportunity shareholders would forgo by selling at this point.”Roche shares were down 0.63 per cent at SFr156.50 in late afternoon trading.
