;Ticker;Nombre_Completo;Date_Time;Titular;Subtitular;Texto
70;NBL;Noble Energy Inc;2011-09-20T10:57:26Z;New York headlines;;"* Brazil to seek new arms for currency battle* Turkish gunship threat over gas drilling* Venezuela bans gold exports* Abbas confirms plan to seek UN membership* EM currencies plunge* India may nearly double ONGC’s fuel subsidy bill* Court allows pursuit of Chevron in Amazon case* Major Indian telecom companies plan tower holding company* Hong Kong developers set to accelerate sales* China growth fears boost Hendry’s fund* Tata unveils bling Nano* Libyan fighters say they have surrounded Bani Walid* Markets, downBrazil to seek new arms for currency battle
Brazil is set to propose an “exchange rate anti-dumping” measure to the World Trade Organisation that would allow countries to retaliate against trading partners that undertake competitive devaluations of their currencies, the FT reports. The plan would mark an escalation of what Latin America’s largest economy has dubbed the “currency war” – the battle against what it sees as the use of loose monetary policies by reserve-currency issuers such as the US to boost their exports.Turkish gunship threat over gas drilling
Turkey is threatening to dispatch gunships to the waters off Cyprus in an energy dispute some diplomats fear could further damage Ankara’s troubled bid to join the European Union and increase tensions in the Mediterranean, the FT reports. Recep Tayyip Erdogan, prime minister, said Turkey would send gunships and the air force to monitor the area, in response to reports that Noble Energy, a US-based company, was beginning exploratory drilling for natural gas as part of a deal with the Cypriot government.Venezuela bans gold exports
Venezuela will ban the export of gold out of the country as part of a nationalization campaign spearheaded by President Hugo Chávez last month, the WSJ reports. Under guidelines published in the Official Gazette on Monday, the government said “all gold that is obtained through mining activity within national territory will be handed over to the Bolivarian Republic of Venezuela.” The decree also gives companies 90 days to form joint ventures for gold mining, in which the government will hold a 55 per cent stake.Abbas confirms plan to seek UN membership
Palestinian President Mahmoud Abbas has told the United Nations secretary-general that he intends to submit an application for membership on Friday and vowed not to be deterred by the storm of international pressure gathering around him, the FT reports.EM currencies plunge
This summer, emerging market currencies seemed something of a safe haven in the latest global financial storm. While EM equities plunged, currencies held firm. Now, the latest blasts of bad news from the eurozone appear to have blown away EM currency confidence – and sent investors running for the traditional fastnesses of the US dollar, the Swiss franc and gold, beyondbrics reports.India may nearly double ONGC’s fuel subsidy bill
India’s government is considering almost doubling Oil & Natural Gas Corp.’s share of fuel subsidy to cut expenditure and reduce the fiscal deficit, Bloomberg reports. The country’s biggest energy explorer may pay about 470bn rupees ($9.8bn) as the government-mandated subsidy in this financial year, one of the people said, asking not to be identified because the details are private.Court allows pursuit of Chevron in Amazon case
A US appeals court has thrown out an order blocking the enforcement of amultibillion dollar ruling against Chevron outside of Ecuador, cancelling out a previous victory for the company in its long-running legal battle over environmental damage in the Amazon. In February, an Ecuadorean court issued the award against Chevron following allegations of oil pollution in the Amazon by Texaco, which Chevron took over in 2001. Chevron has not paid the damages as it is appealing the verdict, the FT reports.Major Indian telecom players plan tower holding company
Three of the biggest Indian telecom players – Bharti Airtel, Idea Cellular and Vodafone – plan to collectively monetise their tower assets, creating a holding company structure that is likely to house all the passive infrastructure owned by the companies, the Economic Times reports. An industry source said that the proposed holding company structure, which will see a consolidation of the tower assets of the three companies, is a step towards a possible listing of the new entity.Hong Kong developers set to accelerate sales
Hong Kong developers may have to accelerate sales of new housing projects even as buying sentiment wanes amid the global equity rout and as the city intensifies efforts to curb property prices, Bloomberg reports. Builders including Cheung Kong and Sun Hung Kai Properties may begin selling new projects. The developers, along with others in the city, are expected to offer as many as 2,700 apartments this month, he said.China growth fears boost Hendry’s fund
A hedge fund designed to profit from a slowdown in the Chinese economy, run by the London hedge fund manager Hugh Hendry, has soared in value over the past two months as global markets have plummeted and industry peers have suffered damaging losses. Hendry – a former Odey Asset Management trader – is one of only a handful of hedge fund managers positioned against Chinese growth and therefore pitted against heavyweight investors such as Anthony Bolton, the FT reports.Tata unveils bling Nano
Three years after launching the Nano as “the world’s cheapest car”, Ratan Tata, chairman of India’s second largest industrial group, presented what may be the world’s most expensive automobile: the jewel encrusted GoldPlus Nano, the FT reports. The car is covered in 80kg of 22 carat gold and 15kg of silver, and inlaid with 10,000 semi-precious stones and gems.Libyan fighters say they have surrounded Bani Walid
Fighters from the Libyan National Transitional Council said they surround the town of Bani Walid, amid a fifth day of battle for control of Sirte, the hometown of Muammar Qaddafi, Bloomberg reports.Emerging Markets
MSCI Emerging Market Index up +0.29% at 952.10Europe
FTSE down +1.33% at 5,329
RTF up +0.59% at 1,535
Wig Index up +0.59% at 38,970
FTSE 300 Eurotop up +1.46% at 929.40Americas
DJIA down -0.94% at 11,401
S&P 500 down -0.98% at 1,204
Bovespa down -0.19% at 57,103Asia
Nikkei 225 down -1.61% at 8,721
Topix down -1.70% at 755.04
Hang Seng up +0.51% at 19,015
Shanghai Composite up +0.41% at 2,448
MSCI Asia ex-Japan up +0.39% at 476.54
S&P CNX Nifty Index up +2.15% at 5,140Currencies
€/$ 1.37 (1.37)
$/¥ 76.41 (76.56)Commodities
Brent Crude (ICE) up +1.59 at 110.73
Light Crude (Nymex) up +1.01 at 86.71
100 Oz Gold (Comex) up +12.50 at 1,789"
71;NBL;Noble Energy Inc;2011-09-20T04:29:07Z;London headlines;;"*Brazil to seek new arms for currency battle* Turkish gunship threat over gas drilling* Venezuela bans gold exports* Abbas confirms plan to seek UN membership* India may nearly double ONGC’s fuel subsidy bill* Major Indian telecom companies plan tower holding company* US to announce Taiwan arms deal* Hong Kong developers set to accelerate sales* Tata unveils bling bling Nano* Libyan fighters say they have surrounded Bani Walid* Markets, downBrazil to seek new arms for currency battle
Brazil is set to propose an “exchange rate anti-dumping” measure to the World Trade Organisation that would allow countries to retaliate against trading partners that undertake competitive devaluations of their currencies, the FT reports. The plan would mark an escalation of what Latin America’s largest economy has dubbed the “currency war” – the battle against what it sees as the use of loose monetary policies by reserve-currency issuers such as the US to boost their exports.Turkish gunship threat over gas drilling
Turkey is threatening to dispatch gunships to the waters off Cyprus in an energy dispute some diplomats fear could further damage Ankara’s troubled bid to join the European Union and increase tensions in the Mediterranean, the FT reports. Recep Tayyip Erdogan, prime minister, said Turkey would send gunships and the air force to monitor the area, in response to reports that Noble Energy, a US-based company, was beginning exploratory drilling for natural gas as part of a deal with the Cypriot government.Venezuela bans gold exports
Venezuela will ban the export of gold out of the country as part of a nationalization campaign spearheaded by President Hugo Chávez last month, the WSJ reports. Under guidelines published in the Official Gazette on Monday, the government said “all gold that is obtained through mining activity within national territory will be handed over to the Bolivarian Republic of Venezuela.” The decree also gives companies 90 days to form joint ventures for gold mining, in which the government will hold a 55 per cent stake.Abbas confirms plan to seek UN membership
Palestinian President Mahmoud Abbas has told the United Nations secretary-general that he intends to submit an application for membership on Friday and vowed not to be deterred by the storm of international pressure gathering around him, the FT reports.India may nearly double ONGC’s fuel subsidy bill
India’s government is considering almost doubling Oil & Natural Gas Corp.’s share of fuel subsidy to cut expenditure and reduce the fiscal deficit, Bloomberg reports. The country’s biggest energy explorer may pay about 470bn rupees ($9.8bn) as the government-mandated subsidy in this financial year, one of the people said, asking not to be identified because the details are private.Major Indian telecom players plan tower holding company
Three of the biggest Indian telecom players – Bharti Airtel, Idea Cellular and Vodafone – plan to collectively monetise their tower assets, creating a holding company structure that is likely to house all the passive infrastructure owned by the companies, the Economic Times reports. An industry source said that the proposed holding company structure, which will see a consolidation of the tower assets of the three companies, is a step towards a possible listing of the new entity.US to announce Taiwan arms deal
The US is expected to announce within days a new arms deal for Taiwan, carefully timing the release of the long-expected decision to minimise damage to Washington’s delicately balanced ties with Beijing, the FT reports.Hong Kong developers set to accelerate sales
Hong Kong developers may have to accelerate sales of new housing projects even as buying sentiment wanes amid the global equity rout and as the city intensifies efforts to curb property prices, Bloomberg reports. Builders including Cheung Kong and Sun Hung Kai Properties may begin selling new projects. The developers, along with others in the city, are expected to offer as many as 2,700 apartments this month, he said.Tata unveils bling bling Nano
Three years after launching the Nano as “the world’s cheapest car”, Ratan Tata, chairman of India’s second largest industrial group, presented what may be the world’s most expensive automobile: the jewel encrusted GoldPlus Nano, the FT reports. The car is covered in 80kg of 22 carat gold and 15kg of silver, and inlaid with 10,000 semi-precious stones and gems.Libyan fighters say they have surrounded Bani Walid
Fighters from the Libyan National Transitional Council said they surround the town of Bani Walid, amid a fifth day of battle for control of Sirte, the hometown of Muammar Qaddafi, Bloomberg reports.Emerging Markets
MSCI Emerging Market Index down -0.71% at 942.69Americas
DJIA down -0.94% at 11,401
S&P 500 down -0.98% at 1,204
Bovespa down -0.19% at 57,103Asia
Nikkei 225 down -1.40% at 8,740
Topix down -1.48% at 756.80
Hang Seng down -0.10% at 18,899
Shanghai Composite down -0.11% at 2,435
MSCI Asia ex-Japan down -0.91% at 470.33
S&P CNX Nifty Index unchanged 0.00% at 5,032Currencies
€/$ 1.36 (1.37)
$/¥ 76.47 (76.56)Commodities
Brent Crude (ICE) up +0.18 at 109.32
Light Crude (Nymex) down -0.16 at 85.54
100 Oz Gold (Comex) unchanged 0.00 at 1,776"
72;NBL;Noble Energy Inc;2020-04-25T23:17:40+0000;Turkish gunship threat over gas drilling;;Turkey is threatening to dispatch gunships to the waters off Cyprus in an energy dispute some diplomats fear could further damage Ankara’s troubled bid to join the European Union and increase tensions in the Mediterranean.Recep Tayyip Erdogan, prime minister, said Turkey would send gunships and the air force to monitor the area, in response to reports that Noble Energy, a US-based company, was beginning exploratory drilling for natural gas as part of a deal with the Cypriot government.Turkey does not have diplomatic relations with Cyprus, an EU member state, and recently threatened to freeze relations with the bloc as a whole when Nicosia assumes the EU’s revolving presidency in the second half of next year.Some western diplomats say a confrontation could spell disaster for hopes of keeping Turkey’s EU bid alive, at a time when the membership negotiations are already largely stalled because of tensions with Cyprus. France is also opposed to Ankara joining the bloc.The European Commission, the EU’s executive arm, called on Monday for both sides to exercise restraint. “You have an escalating situation,” said an EU official, noting that Turkey had announced rival drilling plans to explore for gas in the area.The official added that the tension complicated talks planned for coming weeks to discuss a permanent settlement for Cyprus, which is divided between the internationally recognised Greek Cypriot south and the Turkish Cypriot north.Turkey argues Cyprus should not begin gas exploration work at a time when the final settlement of the island’s dispute – which could affect maritime territorial rights – has not yet been reached.“This exclusive economic zone is disputed and we have told them it is not right for them to take a step like this,’’ Mr Erdogan said at a press conference on Monday.But many diplomats say Ankara’s legal case is weak. Rather than opposing Cyprus’s plans, as Turkey wants, the US has declared its support for the attempts to develop the eastern Mediterranean’s energy resources.Washington and other allies of Turkey have also sought to persuade Mr Erdogan not to dispatch warships. “We are sending this signal privately and publicly that we do not want to see either side engage in provocative action or action that raises tension,” said a state department official last week.The tension is all the greater because Cyprus agreed a deal on maritime territory with Israel last year as part of establishing its claim to the gas deposits. Turkish-Israeli relations are currently in crisis because of the deaths at the hands of Israeli forces of nine Turkish-based activists in 2010. Mr Erdogan has promised to beef up Turkey’s presence in the eastern Mediterranean as a result.
73;NBL;Noble Energy Inc;2011-07-15T17:01:39Z;BP vows tougher Gulf drilling standards;;BP has tried to reassure the US authorities about its reputation as a safe operator by promising tougher drilling standards in the Gulf of Mexico, going beyond the minimum legal requirements.The British oil group, scarred by the aftermath of the Deepwater Horizon disaster, wants permission to resume drilling in the gulf. To this end, it pledged on Friday to introduce four additional “voluntary performance standards”, designed to address the weaknesses exposed by last year’s devastating spill from the Macondo well.In future, BP will insist that all contractors use better subsea blow-out preventers, which stop the uncontrolled release of oil and gas from a well. The failure of a blow-out preventer was a central cause of the Deepwater Horizon accident.In addition, whenever a contractor brings a blow-out preventer to the surface for testing, an independent assessment of the device will be conducted by a third party. When other drilling materials are tested by outside contractors, BP experts will have to review their work. Finally, the company will compile an enhanced oil spill response plan.Bob Dudley, chief executive of BP, said these new commitments “will promote greater levels of safety and preparedness in deepwater drilling”. The aim was to apply the lessons of last year’s disaster to “improve the way we operate”, he added.The pledge came in a letter from James Dupree, BP’s regional president for the Gulf of Mexico, to the Bureau of Ocean Energy Management (BOEM) in Washington. The new commitments go beyond the operating standards of other oil companies with assets in the gulf.During a Congressional hearing, Ed Markey, a Democrat member of the House of Representatives, said: “BP’s new voluntary safety standards demonstrate that other oil companies can adopt similarly stringent standards…..If BP can do this, so can everyone else.”Mr Markey wants to make tougher standards mandatory, but Congressional Republicans oppose this proposal.BP has applied for permission to resume drilling in the deepwater of the gulf, although it aims to start with development wells in existing oilfields, not new exploration.So far, the accident has directly cost BP $41.3bn, while the moratorium on gulf drilling has deprived the company of access to some of its most important acreage.The BOEM started re-issuing deepwater drilling permits in the gulf earlier this year.BP was the largest shareholder – but not the operator – in the first deepwater exploration well to be approved since the Macondo disaster. However, BP has yet to secure the regulator’s approval to be the operator for a new deepwater drilling project.The first permit approved after the spill was for a project led by Noble Energy, a Houston-based company, which resumed work on the Santiago well.
74;NBL;Noble Energy Inc;2011-05-03T20:51:55Z;Energy and materials lead Wall St lower;;Shares in Pfizer slipped back after its first-quarter revenues fell short of expectations, weighing on the healthcare sector and helping to lead the wider markets lower for the second consecutive session.The world’s largest drugmaker by revenue reported that sales had fallen slightly in the quarter to $16.5bn, which was short of the $16.6bn expected by analysts.This left shares in the company down 2.8 per cent at $20.44 as investors chose to focus on this revenue miss rather than the company’s 10 per cent increase in net income, which was ahead of what analysts had expected.The market’s disappointment over the results weighed on the healthcare sector with Watson Pharmaceuticals falling 1.2 per cent to $62.63 and Mylan losing 2.5 per cent to $24.23.The S&P healthcare index was down 0.3 per cent, although it is still up 12.3 per cent this year and one of the best-performing sectors on Wall Street.These losses helped pull the wider markets lower, with the S&P 500 index closing 0.3 per cent softer to 1,356.62.But the biggest drags on the index were energy and material stocks as many commodity prices lost ground.Within the energy sector, Halliburton, the oilfield services company, was down 2.1 per cent to $47.89 while Noble Energy fell 2.9 per cent to $90.60.Disappointing results from Chesapeake Energy also helped to weigh on the sector, with shares in the energy group falling 5.7 per cent to $31.33 after it reported a drop in first-quarter earnings.The S&P energy index fell 2.4 per cent, by far the worst performance of an S&P sector.The materials sector also lost ground, although not by as much, edging back 1 per cent. Massey Energy, the coal miner, fell 3.6 per cent to $65.25 while Consol Energy lost 3.5 per cent to $52.26.The Dow Jones Industrial Average was broadly flat at 12,807.36 while the Nasdaq Composite fell 0.8 per cent to 2,841.62.In the previous session, the markets were given an early boost following news on Sunday night that Osama bin Laden had been killed by US forces in Pakistan. But the benchmark indices still closed the day slightly lower as investors began to worry about where the market was now heading following the lofty technical highs reached in previous few sessions.Last week, the S&P achieved a 35-month high, the Nasdaq rose to a 10-year high and the Russell 2000 hit at an all-time high.“A lot of technicians are saying we are overbought here and we should move back for a while,” said Linda Duessel, senior portfolio manager at Federated Investors.JPMorgan released a downbeat note on Tuesday saying they expected “turbulence” in the equity markets during the coming months because of the turmoil in the Middle East, fallout from the Japan earthquake, US budget deficit concerns and growing inflationary pressures.However, a survey from Charles Schwab, the retail brokerage, found that investor sentiment was at its highest point since late 2009 with 47 per cent of traders surveyed saying that they were feeling optimistic about the market compared with 28 per cent a year ago.In another positive sign on Tuesday, US factory orders rose in March for the fifth consecutive month, in the latest sign of strength in US manufacturing.Elsewhere on Wall Street, shares in MetroPCS Communications jumped 10.1 per cent to $18.14, the best-performing stock in the S&P 500, after the wireless provider reported a doubling in its first-quarter earningsThis helped to lift the telecoms sector. American Tower advanced 1.9 per cent to $52.52 while AT&T added 2.1 per cent to $31.86. The S&P telecommunications index was up 1.5 per cent.In the utility sector, FirstEnergy put on 6.1 per cent to $42.02 after the power company gave an earnings outlook that surpassed expectations.The gains came despite the fact that the company’s reporting a fall in profits as it booked costs related to its $4.7bn purchase of Allegheny Energy in February.Anadarko Petroleum, the US oil and gas company with a minority stake in BP’s disaster-hit Macondo well, reported a 12 per cent fall in underlying earnings for the first quarter because of a decline in natural gas prices and a rise in costs. The stock declined 2.3 per cent to $78.51.
