;Ticker;Nombre_Completo;Date_Time;Titular;Subtitular;Texto
27;NBL;Noble Energy Inc;2020-04-25T23:17:40+0000;Israel near Leviathan gasfield deal after antitrust chief quits;David Gilo resigns in protest over $6.5bn development project;Israel is near a deal to pave the way for the development of the huge Leviathan offshore gasfield, after the resignation of the antitrust chief who declared the project a cartel.David Gilo quit his post on Monday after disagreeing with a compromise between the government of Prime Minister Benjamin Netanyahu and investors in the $6.5bn project. The deal, when signed, will end the antitrust challenge from his office which delayed the field’s development.Mr Netanyahu told cabinet colleagues on Tuesday: “We will extract this gas from the depths of the sea, we will bring it to the citizens of Israel, and we will make society as a whole better off.“We will not repeat the mistake other countries made when they sought ideal solutions for their gas and . . . oil, as a result of which both the gas and the oil remained below the seabed or underground.”Development of Leviathan — one of the world’s biggest recent offshore gas finds with an estimated 22tn cubic feet of reserves — was put on hold in December after Mr Gilo said he would recommend the partnership developing the project, led by Noble Energy of the US and Israel’s Delek, should be broken up.Noble and Delek already control Tamar, Israel’s biggest exploited offshore gasfield, and Mr Gilo ruled that Leviathan would give them excessive control over gas supplies and prices.However, his decision angered energy groups already frustrated over tax and regulatory changes by successive Israeli governments. Exploratory drilling for gas off Israel’s coast has come to a halt over the past year because of investors’ misgivings over what they see as a volatile investment climate.Gideon Tadmor, chief executive of Delek Drilling, said on Tuesday: “This change of heart, this flip-flopping by the antitrust commissioner, has already cost us one year delay in the development time [for Leviathan]. “The Israeli gas industry is frozen because of the regulatory environment.”The antitrust move also threw into doubt preliminary deals agreed last year between Noble and Delek to supply gas to BG Group in Egypt and to Jordan’s electric power company.Under the compromise reached between Mr Netanyahu’s government and the gas companies, Delek will sell all its shares in Tamar within six years of signing the agreement. Noble, currently Tamar’s biggest shareholder, will reduce its stake from 36 per cent to 25 per cent.The two companies have also agreed to sell the smaller Karish and Tanin fields to other companies, a person briefed on details of the deal said. The companies hope to close the deal in the coming months and bring the first gas from Leviathan to the market by 2019.However, the compromise that led to Mr Gilo’s resignation brought angry reaction from some opposition leftwing MPs and could have more political repercussions.Moshe Kahlon, the new centre-right finance minister, has told Mr Netanyahu he cannot make decisions on gas-related matters because of his friendship with Koby Maimon, whose company, Isramco, is a shareholder in the Tamar field. News of the move this week alarmed and angered some Israelis, as Mr Kahlon voiced support for Mr Gilo during his campaign.
28;NBL;Noble Energy Inc;2015-05-11T19:44:05Z;Noble Energy to buy Rosetta Resources in $3.7bn shale deal;Analysts say oil explorers are poised to start on a round of dealmaking that could reshape industry;Noble Energy, the US oil and gas group, is to buy Rosetta Resources for about $3.7bn including debt, in the first acquisition of a significant US shale oil producer since the fall in crude prices in the second half of last year.The agreed deal is a sign of how financially weaker shale oil producers unwilling or unable to finance enough drilling to keep their production from falling can be compelled to accept a bid as the best option for investors.The all-share deal gives Noble — which operates offshore, and onshore fields in Colorado and Pennsylvania — its first shale positions in the Eagle Ford and the Permian Basin, both in Texas and two of the heartlands of the US oil boom.Dave Stover, chief executive of Noble, said it was buying into shale regions that were among “two of the most economic in the US, which will expand our resource base and development inventory and further diversify our portfolio”.Mr Stover said Rosetta’s assets would be able to generate enough cash to finance the drilling needed to increase production by 15 per cent per year for several years.Noble’s strong financial position meant it had more freedom to drill when it needed to, he added.“The combination of scale and financial strength means we are set up to take full advantage of the assets,” he said.Analysts said the world’s oil and gas producers were poised to embark on a round of dealmaking that could reshape the energy industry, reacting to the recent collapse in prices by targeting rivals to replenish falling reserves.Figures from Morgan Stanley analysts show the number of deals announced, including asset sales, standing at 38 so far this year, with a total value of $93bn, after a near moribund first quarter in which just 30 transactions worth about $4bn were done — a 20-year low.Signs of a recovery in deal volumes, albeit tentative, owe much to a slide in companies’ stock market valuations, which have yet to track higher after a strong rebound in the price of Brent crude to $65 a barrel.While the total value of deals announced in the second quarter will be skewed by Royal Dutch Shell’s £55bn agreed offer for BG Group, analysts point to evidence that activity is picking up.Martijn Rats of Morgan Stanley said deals were “arguably cheaper and safer” than capital spending for oil and gas producers. “With depressed exploration and production valuations . . . the opportunity for the majors to cheaply replenish portfolios at below organic finding and development costs increases,” he added.Mr Rats saw a “sweet spot” of rising oil prices and falling costs, the result of companies’ efforts to slash expenses, leading to a recovery in free cash flow and increased transactions.Big oil groups were likely to turn to acquisitions, following the Shell-BG deal, having replaced just 88 per cent of their production in 2014, versus 111 per cent the previous year, he added.Noble’s Mr Stover added that the company was not yet planning to step up drilling on its existing assets.“I think folks are going to be feeling comfortable with that if we’re heading back towards $70,” he said. “I would not expect to see a big change in activity unless we get back to that area.”The Noble-Rosetta deal received an initially negative response from investors, with Noble’s shares being marked down about 5 per cent in early trading in New York.The deal offers 0.542 shares in Noble for every Rosetta share, valuing the target’s equity at $1.9bn based on the buyer’s share price of about $46.60 on Monday morning. Noble is also taking on about $1.8bn in debt.At that valuation, the offer is worth $25.26 per Rosetta share, a premium of 31 per cent to its closing price on Friday.Noble was down 6.21 per cent to $46.07 by the close, while Rosetta had advanced 27.19 per cent to $24.58.The offer is still worth less than half Rosetta’s share price at its peak of over $60 in 2013. The company reported disappointing results earlier this month.The price Noble is paying for Rosetta represents about $13.12 per barrel of oil equivalent in the target’s proved reserves, 61 per cent of which are in oil and other liquids, and about $3.50 per barrel equivalent including unproved resources.
29;NBL;Noble Energy Inc;2015-05-05T18:39:28Z;Shale groups rise to oil price challenge;EOG raises prospect of production growth before the end of the year;EOG Resources, the largest shale oil producer in the US, on Tuesday raised the prospect of its crude production returning to growth before the end of the year.US shale oil companies have been detailing in their first-quarter results how they are cutting costs and increasing productivity as they grapple with sharply lower crude prices since last summer.Companies including EOG, Anadarko Petroleum, Concho Resources and Noble Energy reported steep cuts in both capital and operating costs, while their production is either growing or roughly flat.EOG said that if benchmark US West Texas Intermediate crude rose to $65 per barrel or higher — compared with its price of about $60 on Tuesday — then the company could resume “double-digit” production growth, while covering its capital spending from its operating cash flows.EOG reported a loss of $170m for the first quarter, and an $843m cash outflow, and reiterated its guidance that it expected its average production for 2015 to be roughly unchanged compared with last year.However, William Thomas, EOG’s chief executive, said on a call with analysts on Tuesday morning that the company had been building up a backlog of wells that had been drilled but not yet completed, and planned to start bringing some of these on stream in the third quarter.“We expect our oil production to return to growth in the fourth quarter, building momentum as we head into 2016,” he added.EOG’s statement came after David Einhorn, the hedge fund manager who made his name betting against Lehman Brothers before the bank collapsed, on Monday argued that shale oil producers were overvalued, labelling them “frack addicts” that failed to create value from their investments even when crude was over $100 per barrel.New extraction techniques and oil prices boost US oil production“A business that burns cash and doesn’t grow isn’t worth anything,” he said.However, US shale oil companies, while reporting losses or very small profits for the first three months of this year, are arguing that cost cuts put them on a course for renewed financial health once crude prices recover.Noble reported a $22m loss for the first quarter, but said it had greatly improved the efficiency of its drilling.Concho, which operates in the Permian Basin of west Texas, reported a profit of just $7.5m for the first quarter and said it had cut the number of rigs it was using from 36 at the start of the year to 18 today.However, it raised the midpoint of the range of its guidance for 2015 production growth from 18 per cent to 20 per cent.Timothy Leach, Concho’s chief executive, said: “We expect to deliver higher production growth on a lower capital spend and with fewer rigs.”Anadarko, which has offshore operations in Africa and in the Gulf of Mexico, as well as its US shale business, said it expected average production for 2015 to be slightly lower than in 2014, as it reported a $3.3bn loss for the first quarter, including a writedown of $2.9bn.The company said it had cut the average cost of drilling a well in the Eagle Ford shale of south Texas by 14 per cent since the last three months of 2014.Al Walker, Anadarko’s chief executive, struck a cautionary note on the company’s call with analysts, saying it would be careful about stepping up spending and production growth in response to a recovery in oil prices.“As we achieve higher prices, we could see activity increase and prices, unfortunately, could suffer as a result of higher production than people are anticipating,” he said.“So we’re going to be a little careful in terms of adding to that production number.”
30;NBL;Noble Energy Inc;2015-03-29T17:22:28Z;US oil independents share sales boom despite crude price fall;Equity issuance of $10.8bn hits new quarterly high;"US independent oil and gas companies have raised a record amount from share sales in the first three months of the year, as they seek to shore up their balance sheets following the plunge in oil prices since last summer.The small and midsized exploration and production companies that include the pioneers of the US shale revolution have sold shares worth $10.8bn this year, making this quarter the most active on record for equity issuance in the sector, according to data provider Dealogic.Noble Energy, Newfield Exploration, Southwestern Energy and Laredo Petroleum are among 22 exploration and production companies that have sold shares this year.By contrast, merger and acquisition activity for oil and gas independents has slowed to its lowest value since at least 2007.Bankers said the ability to raise equity capital this year signals continued investor interest in the sector in spite of the oil price slump.Osmar Abib, the global head of oil and gas at Credit Suisse, said: “The capital markets are open, in a way that many people hadn’t predicted at the start of the year.”While large oil and gas groups have generally been using debt to raise funds, with ExxonMobil selling $8bn of bonds this month, and Chevron $6bn in February, the smaller companies with typically lower credit ratings are relying more heavily on equity.Exploration and production companies raised $9.08bn from bond sales this quarter, but only 11 companies issued debt, half the number that sold shares.Syndicated loans to the sector have also been robust at $12.7bn, although that is still well below the quarterly record of $40bn reached in 2012.Bank lending to US exploration and production companies is generally tied to the value of their assets, which are assessed twice a year. The current round of revaluations will reflect lower oil prices, lowering the funds available to borrowers.Companies that issue equity will help reduce the risk of coming under financial strain, particularly if oil prices remain at present levels of about $48 per barrel for US crude for a protracted period.Poppy Allonby, of asset manager BlackRock, said on average companies that issued equity this year had subsequently outperformed the sector average.She added that energy sector valuations relative to the broader US equity market looked “extremely attractive”, and were even lower than after the oil prices collapses of the 1980s and 1990s.“If you had invested in the energy sector at those times, you would have been rewarded,” she said.Latest news and comment on the global economic and political consequences of tumbling oil prices

Further readingAnalysts at Barclays argued in a note last week that US exploration and production shares appeared to reflect expectations of a rebound in US crude prices to about $85 per barrel.In the futures market the price of crude for December 2020 is only about $66.Industry advisers said the willingness by investors to support companies that want to issue equity is one reason for the slower pace of dealmaking.Whiting Petroleum, the largest producer in the Bakken formation of North Dakota, looked for a possible buyer in the past few weeks but instead opted to raise about $1bn from issuing new shares and $2bn from selling debt."
31;NBL;Noble Energy Inc;2015-03-19T11:10:45Z;Explorers hold high hopes for oil prospects off Falkland Islands;Oil-related tax revenue could transform the remote islands in the South Atlantic;"Argentina began issuing 50 peso notes this month featuring a map of the Falkland Islands. Through mass circulation, they are designed to remind citizens of the continued claim by Argentina over the UK dependent territory it unsuccessfully invaded in 1982 and calls the Malvinas.But the longstanding diplomatic dispute between the UK and Argentina has not deterred several smaller oil companies from persisting with ambitions to pump oil and gas from the remote waters around the Falklands.Most of the money being spent over the coming months — to drill six wells at a cost of $400m — is being committed by London-listed Premier Oil and Noble Energy of the US. Junior partners include UK-based Rockhopper Exploration and Falkland Oil & Gas.Oil was first found off the Falklands in 2010 by Rockhopper in a field named Sea Lion that is located north of the islands. The discovery was too modest in size to secure interest from large energy groups, but the tax revenues associated with the crude could yet be transformational for the scarcely populated Falklands.There were hopes that production in the Sea Lion field could start by 2017, but concerns over the engineering challenges of operating in the South Atlantic ocean, and delays in securing financial support, have pushed that timetable back. The 50 per cent fall in oil prices since last summer risks further delays.However, Sam Moody, chief executive of Rockhopper, insists that a scaled-down plan for the Sea Lion field, involving initial capital expenditure of $1.8bn or less, could still secure a start to production before 2020.“We are confident it [Sea Lion] will still get [approved],” says Mr Moody.Mr Moody also insists the Sea Lion field will be developed whether or not this year’s exploration campaign in other areas around the Falklands succeeds. “We are talking about 400m barrels of recoverable oil. I can’t remember the last time that amount was discovered in the UK’s North Sea.”A decision over the final go-ahead for the Sea Lion field rests with Premier Oil, the FTSE 250 company which bought a majority stake in the project, and took over as operator in 2012.In January, Tony Durrant, Premier’s chief executive, conceded that the company could only back the field if there was a significant recovery in Brent crude prices to more than $50 per barrel. On Wednesday, Brent was trading at $53.05.Any firm commitment by Premier to the field’s development will also depend on balancing realistic assumptions about future oil prices against the fiscal terms offered by the Falklands government.Latest news and comment on the global economic and political consequences of tumbling oil prices

Further readingThe authorities in Stanley expect to receive a 9 per cent share of production revenues through a longstanding framework offered to oil explorers, while successful developers will also pay a tax of 26 per cent on company profits to the Falklands government.Stephen Luxton, director of mineral resources for the Falklands government, defends the terms on offer to successful developers — seen as being among the most generous in the world.“It’s an important principle to maintain fiscal stability for companies considering investing in projects over 15 to 25 years,” he says. “Companies need a good return to work here as it’s such a remote area.”Mr Luxton is reluctant to be drawn on just how much money could flow into the coffers of the Falklands government should the Sea Lion field proceed to development — although he agrees it could be transformational.The islands, which have fewer than 3,000 inhabitants, generate an annual gross domestic product of £100m — or less than £30,000 a head.It’s an important principle to maintain fiscal stability for companies considering investing in projects over 15 to 25 years. Companies need a good return to work here as it’s such a remote areaThe islands’ economy has traditionally been based on sheep farming, although much of the Falklands government’s revenues are now derived from exports of frozen squid, fished by foreign vessels whose crews are recruited in Korea, Vietnam and other Asian countries.All that will change if the Sea Lion field proceeds. The first stage of the field’s development would deliver 60,000 barrels of crude a day, and the Falklands government could feasibly receive $2.5bn in oil-related tax over 15 years. That equates to close to $1m of tax per head of population from the first stage of the project alone.Another $2.5bn of tax could be obtained from a potential second phase of the Sea Lion field’s development. If there is further exploration success in the waters off the Falklands, the islands could secure billions of dollars more in tax over the coming decades.Mr Luxton and other Falklands officials have visited Norway and discussed how to apply the lessons learned by the Nordic country in managing its vast hydrocarbon wealth accrued since the 1970s.“It’s an issue that has been firmly on our radar for a number of years,” says Mr Luxton. “We have to look after this resource responsibly and look to stretch the benefit over several generations.”"
32;NBL;Noble Energy Inc;2015-03-05T08:17:19Z;US oil industry needs capital to keep flowing;As access to capital narrows, bid activity will rise;The world may run on oil, but the oil industry runs on money. The US shale boom would not have been possible without a huge inflow of capital: the small to midsized companies that led the revolution raised $875bn from syndicated loans, bonds and equities in 2007-14, 83 per cent of it in debt, according to Dealogic.The critical question for the industry, and for the future of US oil production, is whether that financial lifeblood will continue to flow.It is clear that some sources are drying up. E&P companies are still raising funds through equity issues: Noble Energy announced a $1bn-plus share sale last week, and Goodrich Petroleum a $49m issue on Monday. But equity is a more expensive source of capital now than it was in August, after a 35 per cent-plus drop in the S&P 500 E&P sector index.Bond issuance by smaller independent companies has slowed to a trickle, with only two sales in January and February, according to Dealogic. At the same time, bank lending is also facing constraints.Smaller US independents generally use reserve-based lending, with their borrowing secured against valuations of their oil and gas assets, which are linked to market prices. The borrowing bases are typically calculated twice a year, with one round of valuations going on about now. The plunge in both crude and US natural gas in the past six months will curb the amount that companies can borrow.So given those constraints, where will the industry find the capital it needs? One answer is through larger companies, including ExxonMobil and Chevron, swallowing up the smaller, buying both assets and entire businesses. With its triple A credit rating — better than the US government’s — Exxon has ample access to cheap capital, as its $7bn bond sale on Tuesday showed.Even Exxon, though, will want to be selective about its acquisitions. Management capacity is finite, and it cannot buy everything. Market valuations are also a disincentive to making acquisitions for shares. Anadarko Petroleum, for example, is often talked about as a takeover target, but its shares are trading at about 40 times 2016 earnings, while Exxon’s are at 16 times.$4.5bnAmount raised by Blackstone to invest in energyA takeover would dilute Exxon’s earnings unless it can improve Anadarko’s performance dramatically. The best value deals will be available only from companies that are forced sellers.The other increasingly important source of capital is going to be private equity and hedge funds. Blackstone has raised $4.5bn to invest in energy, while Apollo Global Management, Goldman Sachs and others have also been raising funds. If these funds still have a positive long-term view on energy, it is a much better time to buy in now than a year ago.Already a few deals have been done. Linn Energy, a heavily-indebted E&P company structured as a partnership, in January announced an investment of up to $500m from GSO, Blackstone’s debt unit. Resolute Energy at the end of last year raised a $150m loan from Highbridge Capital Management, a hedge fund owned by JPMorgan.But this source of capital does not look like cheap money, though. Resolute is paying Highbridge an interest rate of 10 percentage points over Libor, with a minimum of 11 per cent.Companies seeking financing will have to show that they are investable propositions, and for the most part that is likely to mean planning for significantly higher returns on capital than in the past, even at significantly lower commodity prices.That means that cutting costs will be vital. If costs cannot be brought down fast, both by increasing efficiency and by squeezing lower rates out of service companies, then the outlook for investment in US E&P companies will continue to deteriorate.For anyone wanting to understand the outlook for US production and world oil markets, costs in the shale industry will be a critical indicator to watch.The Commodities Note is online commentary on the industry from the Financial Times
