;Ticker;Nombre_Completo;Date_Time;Titular;Subtitular;Texto
50;NBL;Noble Energy Inc;2013-03-11T16:40:16Z;Producers eye export routes for Israeli gas;New cabinet to decide on level of natural gas exports;When Benjamin Netanyahu forms a new government in Israel in coming days, it will have a full agenda of pressing business, including plans to cut a growing budget deficit and to restart peace talks with the Palestinians.One of the new cabinet’s most highly anticipated policy decisions is how much of its vast offshore natural gas reserves it will export and how much it will reserve for domestic use.With Israel emerging as a regional energy power, the deliberations will be watched beyond its borders. Inside Israel two main investors in the sector are positioning themselves to export gas, possibly via new pipeline projects that could reshape the map of the eastern Mediterranean by deepening ties between Israel, Turkey and other states in the region.At present, the rift between Israel and Turkey remains a daunting obstacle – underscored recently when Turkish Prime Minister Recep Tayyip Erdogan called Zionism a “crime against humanity,” remarks Mr Netanyahu and US secretary of state John Kerry condemned.However, proponents of greater energy ties argue that tensions between the two countries could be overcome by mutual economic interest.Noble Energy and Delek Energy, shareholders in Israel’s two biggest gasfields, have been sounding out potential customers such as energy and chemical companies in Turkey and Jordan, which has seen its gas supplies from Egypt disrupted recently by sabotage attacks in the Sinai.“Gas sales to Israel’s neighbours are a distinct possibility and one we are committed to exploring,” says Noble Energy. However, it adds: “Until the government decides on an export policy and clarifies other regulatory matters, we are unable to mature these discussions.”Last year a committee set up to advise government on the gas reserves – among the largest offshore finds of their kind in the world – recommended that Israel export up to 500bn cubic meters of its gas and save at least 450bcm for domestic needs.Mr Netanyahu’s new government is expected to form its energy policy based on the findings of that report, which was submitted to the prime minister and energy minister late last year.At the same time, Israel’s anti-competition commissioner is examining a restraint of trade case brought against Noble and Delek over their control of the two biggest offshore fields found to date that could – depending on the watchdog’s decision – set back their investment plans.“We need certainty,” says one Israel-based energy executive. “We don’t want to invest then have the government change the rules.”The potential pay-off for Israel’s economy is big. The smaller of Israel’s two big gasfields, Tamar, which is due to begin production in April, will contribute a percentage point to Israel’s projected 3.8 per cent GDP growth this year.Leviathan, which is the industry’s biggest offshore gas discovery of the past decade and nearly twice the size of Tamar, will supply well in excess of the small Israeli market’s domestic needs.Noble and Delek are now exploring possible export routes to justify the big investment they will need to make to bring gas from the field to Israeli customers by 2016.The two companies have argued that as Israel generates more of its energy from gas, it will face a shortage by the middle of the decade if Leviathan is not developed. At the same time, they say they need to export to underwrite the project’s estimated $4bn cost, either in the form of liquefied natural gas or via a pipeline.Leviathan’s backers have mooted producing LNG – which they could sell profitably in Asia – onshore in Cyprus, Israel, or possibly even Jordan’s Aqaba free trade zone.As for pipelines, senior Israeli and Turkish officials have suggested that Turkey is the one market in the region large enough to make the business case for Israeli gas exports.Zorlu Holding, a Turkish company active in the Israeli energy sector, acknowledged recently that the issue of a pipeline with Israel had “come up” in its discussions, although it added that it had taken no formal initiative.But to go ahead, any Israeli-Turkish project would need to overcome two formidable problems: the deep political rift between the two countries and the question of finding a workable pipeline route in a region riven by diplomatic rivalries.Taner Yildiz, Turkey’s energy minister, said last week that before any pipeline project could go ahead, Israel would have to meet Ankara’s demands for redress over the 2010 storming of the Mavi Marmara, a ship trying to break the blockade of the Gaza Strip.Nine Turkish citizens died in the assault by the Israeli Defence Force, which took place on the high seas.While Ankara has set out three conditions – an apology, compensation and an end to the blockade, some Turkish officials suggest that the main sticking point is now the apology, since compensation is relatively straightforward and Israel is taking some steps to reduce Gaza’s isolation after last year’s military confrontation.Turkey says the fundamental decision rests with the Israeli coalition government being formed after last month’s election. Previously, Israel was reluctant to issue more than a statement of regret.In a possible sign of diplomatic movement, Israel this month supplied Turkey with military equipment for the first time since Turkey effectively froze relations over the Mavi Marmara storming, providing electronics for Awacs aircraft. But a Turkish official played down the step’s significance, arguing it was due to contractual obligations.Another question concerns the pipeline’s route, problematic because Israel remains officially at war with Lebanon and Syria, while Turkey has no diplomatic relations with Cyprus, which has discovered big gas reserves of its own.“The two options for running the pipe from Israel to Turkey are among the continental shelves, either of Cyprus or of Lebanon-Syria,” says Matthew Bryza, a former US ambassador to Azerbaijan. “Obviously, neither would be easy from a political perspective. But a pipe to Turkey makes lots more economic sense – including for Cypriot gas – than either liquid natural gas or a pipe to Greece.”
51;NBL;Noble Energy Inc;2012-09-17T16:06:05Z;Falkland Oil’s discovery fails to boost shares;;The discovery of gas in a field to the east of the Falkland Islands has failed to boost shares in the Aim-quoted company paying for test drilling.Falkland Oil & Gas, which raised £48.5m at 43p in January to fund further exploration in blocks to the east and south of the islands in the South Atlantic, said on Monday that a well drilled at its Loligo prospect had encountered gas.But shares edged up just 0.25p to 70.5p as the well failed to discover signs of more lucrative oil or gas condensate.Tim Bushell, chief executive, said the well had demonstrated that Loligo was “a valid trap that contained gas bearings zones”, adding work would continue to assess the “potential and commercial viability of this discovery”.However FOGL, which has a 75 per cent stake in the well alongside minority partner Edison of Italy, has opted to switch the next test well from the Loligo prospect to an alternative geological target in deeper waters further east.The lacklustre results follows disappointment over this year’s drilling campaign by fellow Falkland explorer Borders & Southern, which had co-operated with FOGL in jointly hiring the Leiv Eiriksson rig to work in waters whose sovereignty is disputed with Argentina.Both are exploring blocks in basins to the south of the Sea Lion field where Rockhopper Exploration successfully drilled for oil in its own recent campaign.In April, shares in Borders & Southern Petroleum fell by nearly a third amid disappointment over the results of the first test well drilled at its Darwin prospect in a basin to the south of the Falkland Islands in spite of the detection of a “significant gas condensate discovery”.Shares in Borders & Southern fell sharply again in July after its second well of the year was abandoned amid technical difficulties amid some signs of gas but failure to find any oil.The Loligo well is the first drilled in FOGL’s blocks since 2010. Shares in the company hit a high of 267p in July that year amid high hopes that its Toroa well drilled in a joint venture with mining group BHP Billiton would strike oil. But shares then halved after it emerged it had drilled a dry well and BHP Billiton quit the joint venture in March last year amid persistent complaints from Argentina over drilling in Falklands waters.Since FOGL’s fundraising earlier this year, the company has strengthened its financing through the sale of minority stakes in its blocks to Edison in June and a further “farm out” agreement with Noble Energy agreed in August.In return for a 35 per cent stake in blocks excluding its Loligo and nearby Nimrod-Garrodia prospects, Noble has agreed to contribute up to $230m over the next three years towards further drilling in acreage currently controlled by FOGL.The company said on Monday that it expected its cash balances following completion of this year’s exploration campaign to be $200m or more.“With our partners Noble Energy and Edison, we have the technical resources and funding in place to carry out substantial 3D surveys, followed by further drilling in 2014,” said Mr Bushell.
52;NBL;Noble Energy Inc;2012-09-02T16:16:03Z;Mediterranean playground for oil groups;;Best-known for sun, sea and sand, the Mediterranean has suddenly become a playground for the global oil industry.The Arab Spring, and a series of huge natural gas finds in the so-called Levantine basin have piqued interest in an area that barely made it on to oil companies’ radar a decade ago.Italy’s partial relaxation of a ban on offshore oil and gas drilling introduced in the wake of the 2010 Deepwater Horizon disaster has also stimulated activity, with a clutch of companies now dusting off plans to drill in the Adriatic.Malta is the latest spot in the Mediterranean to debut on the oil map. Last month, Genel Energy, the oil company run by former BP chief executive Tony Hayward, said it had bought a stake in exploration blocks off the coast of Malta from AIM-quoted explorer Mediterranean Oil & Gas.Bill Higgs, MOG’s chief executive, says the revolutions that swept north Africa and the Middle East last year have encouraged companies to take a fresh look at the region. “There are a lot more opportunities than there were before the Arab Spring in places like Egypt, Libya and Tunisia,” he says.That was reflected in Egypt’s recent oil licensing round, which attracted a huge volume of bids. “I’ve seen a significant number of international oil companies looking to consolidate their position in Egypt and Libya and new entrants coming in,” says John Conlin, an energy lawyer at Norton Rose.But it was the big finds in the eastern Mediterranean that fundamentally changed the industry’s view of the region. Since 2009, some 35tn cubic feet of gas – roughly half of Canada’s total reserves – have been discovered in the deep waters off Israel and Cyprus, much of it by the US independent Noble Energy. One of the fields, Israel’s Leviathan, which was discovered in 2010, was the world’s largest deepwater gas find in a decade.The US Geological Survey estimates the Levantine Basin, a subsea area which runs from Egypt north to Turkey, contains 1.7bn barrels of undiscovered, technically recoverable oil and 122tn cubic feet of gas – a massive prize. Leviathan, and the Aphrodite find in Cyprus last year, seemed to confirm the optimism.“Those discoveries really invigorated interest in the Med,” says Brian O’Cathain, chief executive of AIM-quoted explorer Petroceltic, which has interests offshore Italy. “An area that wasn’t considered prospective was found to have huge amounts of gas.”For Genel, the deal with MOG is a bet that offshore Malta will prove as rich in hydrocarbons as nearby Libya. Mr Hayward knows Libya well, having spent months negotiating BP’s famous $900m exploration deal with the Gaddafi regime in 2007. In an interview last month, he said Malta was an extension of Libya’s Sirte basin, one of the world’s great oil-producing areas. Malta’s waters had “significant exploration potential”, he said.While Malta remains a frontier play, other countries like Cyprus are now well-established in the oil and gas universe. The island’s second licensing round this year attracted bids from 15 companies, ranging from supermajors like France’s Total SA to smaller explorers like Cairn Energy, for nine offshore blocks. By contrast, its first licensing round in 2007, barely noted by the industry, resulted in only once licence being issued – to Noble.Meanwhile, prospects have also perked up in Italy, which last month eased its ban on oil drilling in coastal waters. The restrictions still apply for new projects, but all ventures that were up and running before the Gulf of Mexico oil spill can now proceed. Mr O’Cathain of Petroceltic says the company will resume drilling next year, pending the necessary environmental permits.Spain is also attracting interest. Cairn has plans to drill in the Valencia Basin off the eastern Spanish coast in 2014. It will also submit bids for an offshore licensing round in Lebanon next year.Yet the Mediterranean is not a walk in the park. Explorers venturing into its waters risk getting caught up in a complex web of regional squabbles and rivalries. Turkey has repeatedly told oil companies to stay away from Greek Cypriot waters. Last year, Italy protested against Malta’s publication of a tender for oil and gas exploration covering parts of the Ionian Sea claimed by Rome. Malta itself is in dispute with Libya over offshore areas further to the south. And Israel and Lebanon have sparred over Leviathan, which is close to the disputed line separating their territorial waters. Hizbollah, the radical Shia group, has accused Israel of stealing Lebanese gas.However, MOG’s Mr Higgs dismisses the geopolitical dangers. The Mediterranean is “proving to be a place with relatively low political risk, especially on the European side”, he says.
53;NBL;Noble Energy Inc;2012-08-19T16:23:32Z;Sagi’s Genesis Energy set for Aim float;;Teddy Sagi, the Israeli billionaire who founded and owns almost half of online gaming group Playtech, is poised to float his second company in London with an initial public offering of Genesis Energy.The Middle East focused gas explorer, which is 40 per cent owned by Mr Sagi, hopes to raise $90m-$120m through the IPO, valuing the group’s equity at as much as £500m.Genesis Energy has mandated Canaccord Genuity to handle the IPO and a roadshow is expected to be held in the next few weeks. The company hopes to join Aim, London’s junior market, in the third quarter of 2012.The gas explorer declined to comment on the IPO, other than to say that arrangements for the London listing were at a preliminary stage.If successful, the IPO would be the largest on Aim this year, beating the £17m raised in May by Incadea, a German-based provider of software for car dealerships.However, the environment for Aim IPOs has been tough of late, with Alufer Mining recently aborting plans for a $40m fundraising and Rare Earths Global of China only managing to raise $10m, compared with an initial upper target of $50m.Genesis Energy, which is also backed by the Israel Opportunity Fund, the investment group, holds interests in seven offshore licences in the Levantine Basin in the Mediterranean Sea between Cyprus and Israel.The eastern Mediterranean caught the energy world’s attention in 2010 when Noble Energy, a Texan company, announced that the Leviathan field, adjacent to Aphrodite and lying in Israeli waters, contained significant hydrocarbon reserves.According to the US Geological Survey, the natural gas deposits in the Levant Basin – a region adjoining Cyprus, Israel, Lebanon and Syria – may contain as much as 120tn cubic feet of recoverable gas, equivalent to 20bn barrels of oil.However, the discovery of such vast reserves has led to political squabbling between the region’s powers, with Israel and Cyprus already staking their claims in an effort to cut their reliance on gas imports.Mr Sagi, a flamboyant figure in the business world, brought Isle of Man-based Playtech to market in March 2006 when the online gaming group joined Aim at 257p per share, raising about £265m gross.In June, Playtech agreed to pay Mr Sagi nearly £5.6m per year for the licences to use software for online social gaming and traditional gambling activities such as online casino, poker and bingo.Late last year, Mr Sagi raised his shareholding in the online gambling software provider to 43.7 per cent after underwriting a £100m Playtech share placing to fund new acquisitions.
54;NBL;Noble Energy Inc;2012-08-17T12:52:39Z;Sierra Leone marries up oil block bidders;;"When Sierra Leone’s Petroleum Resources Unit (PRU) named provisional winners of eight offshore oil blocks last month, it teamed various bidders together for four of the blocks, telling them to move forward as partners in negotiations. The companies had no say in the matter.“It is like a forced marriage,” said Adekunle King, legal officer for the PRU.The interest in Sierra Leone exploration was sparked by Texas-based Anadarko Petroleum. In 2010 it announced a big find of high quality light, sweet crude off the shores of the west African nation. Russia’s Lukoil opened an office in Sierra Leone in April, and said it would spend $100m on exploration of a previously acquired block.King said the nation’s Petroleum Act of 2011 states the government may grant a petroleum license to two or more companies that offered favorable terms, following a fair and transparent process. That’s why the committee paired up companies bidding on the blocks without their input, he explained.“Companies truly interested in our agenda will find a way to work with each other,” he said.According to the government statement announcing the awards, the blocks to where bidders have been required to team up are as follows:Australia-listed oil explorer African Petroleum and US-listed Kosmos Energy have both been provisionally awarded block 4a.Signet Petroleum, an exploration and production company with offices in Nigeria and Sierra Leone, Minexco Petroleum, an unlisted UK-based junior oil explorer with operations in Africa and South America, and Sierra Leone-based Elinilto (SL) received block 7a.US-listed Noble Energy, Chevron Sahara and UK-based exploration firm Odyewere awarded blocks 8a and 8b.While this kind of “forced” pairing is uncommon, it’s not a barrier to the exploration and development of the blocks, said a Renaissance Capital oil and gas industry analyst. These kinds of pairings can happen when the government wants a major oil company to come in but it has already assigned a block to a smaller company, and officials tend to “suggest” partnerships.In other instances, the government can assign the full block to a company, but then reserve the right to assign a portion of the project to a third party; the main company doesn’t have a say in who the third party would be, the analyst explained.Typically, the operator of the block gets a majority stake, but can always sell or look for farm-in partners. In the Sierra Leone situation, companies are likely to find a way to work together in order to get the deal signed, then look to buy out some of their partners.There could be some legal wrangling over signing fees paid to the government, according to a person involved in the process. Each bidder proposed closing fees based on receiving 100 per cent of the block, so they could potentially argue that the fees be slashed since the block is being shared.It’s unlikely the companies will say anything about the process publicly prior to having a deal finalised by the government, for fear of souring relations. The companies contacted declined to comment or did not return requests for comment.Related reading:
Sierra Leone: one big GDP leap, beyondbrics
Sierra Leone’s war trauma gives way to resource bonanza, FT"
55;NBL;Noble Energy Inc;2012-08-06T17:10:33Z;Falkland Oil in farm-out deal with Noble;;Falkland Oil & Gas, the Aim-traded explorer, has clinched a deal with Noble Energy of the US that it says will strengthen its balance sheet and help fund the next phase of its drilling programme.FOGL is looking for oil and gas off the coast of the Falklands Islands and chief executive Tim Bushell said talks with potential investors started last August. “Given the precarious nature of equity markets we decided we needed an equity partner to help finance our future.”Noble will take 35 per cent stakes in FOGL’s Northern Area Licences and Southern Area Licences, excluding the Loligo and Nimrod-Garrodia prospects, and will become the operator of the drilling programmes during 2013 and 2014.In return Noble will fund 60 per cent of the first two wells and pay $25m in cash to FOGL, a total investment of between $180m and $230m over the next three years.Mr Bushell said Noble’s funding commitment meant FOGL would end the year with $200m on its balance sheet compared with $100m as expected.FOGL signed a similar “farm-out” agreement in March with Edison, the Italian energy group recently taken over by France’s EDF.Keith Morris, oil analyst at Investec, said Noble had more expertise than Edison in frontier oil exploration and was therefore “a more mainstream partner” for FOGL, and that terms of the deal were in line with market expectations.Houston-based Noble’s portfolio includes oil and gas fields in west Africa, the eastern Mediterranean and the deep waters of the Gulf of Mexico. It is the first US company to join the new wave of Falklands oil exploration, after Amerada Hess left the region in the 1990s.Mr Bushell said doubts about the commercial viability of oil production in the Falklands, because of its remote location, were “a red herring” as shipping costs for oil are relatively low. He said the biggest challenge was the cost of extracting oil and gas from such deep waters, and in harsh weather conditions similar to the North Sea.Mr Morris at Investec said much more drilling was needed in the Falklands to determine whether it would be a significant oil producer. “It is a huge area, it requires a lot of exploration to ascertain whether there’s anything there or not.”The companies looking for oil and gas in the region have had mixed fortunes in recent months. Last month Premier Oil, the UK oil group, agreed to buy 60 per cent of the assets of Aim-quoted Rockhopper Exploration, attracted by the potential of its Sea Lion discovery.But shares in Borders & Southern Petroleum fell sharply last month after it failed to find commercial quantities of gas at its Stebbing prospect.Shares in Falkland Oil & Gas rose 12.3 per cent on Monday to 84.25p, while Noble Energy’s shares fell 0.4 per cent to $87.34.
56;NBL;Noble Energy Inc;2012-08-06T13:38:29Z;Falkland oil – drilling for profit;Early-stage investors struggle to reap value;"Every time the oil and gas industry conquers its last frontier, a new one hoves into view. The waters around the Falkland Islands are the latest to attract the sector. Monday’s deal by Noble Energy of the US to invest in Falkland Oil & Gas’s licence to explore 40,000 square kilometres of South Atlantic waters shows that Biggish Oil thinks the area is worth a punt. As Rockhopper’s discovery of the Sea Lion field demonstrates there is oil around the Falklands; how much is anyone’s guess. But investors in the handful of London-listed exploration companies working down there are having a bumpy ride.Noble is taking a 35 per cent stake in Falkland Oil’s exploration licence in the waters to the south and east of the islands and will become the operator. With a market capitalisation of $15bn, it is huge relative to the minnows doing the legwork. Noble’s arrival also follows Premier Oil, which farmed in to the Sea Lion field alongside Rockhopper last month in a deal worth up to $1bn.That is politically risky stuff. Argentina claims that all the activity in Falklands waters is illegal; it has warned explorers and their advisers that it is ready to sue. There are suggestions that the risks may be less in Noble’s case because it is a US company. But Argentina’s expropriation of Repsol’s YPF assets by the government of President Cristina Fernández suggests that view may be too complacent.The more immediate concern for early-stage investors in Falklands exploration, however, is ensuring that they reap the value. Shares of Falkland Oil jumped 13 per cent after the Noble announcement and are at a year-to-date high. But Rockhopper shares have tumbled 20 per cent since the Premier deal; some investors wanted a full takeover. Spare a thought, too, for shareholders in Borders & Southern: its shares are down 70 per cent since disappointing drilling news a month ago.Email the Lex team in confidence at lex@ft.com"
