;Ticker;Nombre_Completo;Date_Time;Titular;Subtitular;Texto
0;RJF;Raymond James Financial;2012-12-16T03:17:31Z;Advisory chief aims to regain public trust in financial world;Chet Helck says transparency will favour Raymond James;"This may be the season of goodwill to all men but, if Chet Helck is correct, it may not prove to be a happy new year for many of the UK’s army of independent financial advisers.Mr Helck, chief executive of the global private client group at Raymond James Financial, a US-headquartered advisory group with $380bn of client assets, foresees some rather testy conversations between IFAs and their clients.From January 1, under the terms of the UK’s Retail Distribution Review, advisers can no longer be remunerated by commission payments from fund providers, and will instead have to charge clients a fee for their services. This new-found transparency will shine a light on a hitherto murky system of payments that involved investors paying over the odds for funds in order to underwrite these commission payments, a fact many clients may have had only a hazy understanding of.“People are waking up to the fact that they were paying fees for 20 years without knowing,” says Mr Helck. “Some may forgive [their advisers], others will say ‘I don’t think that was fair to do that for 20 years without telling me’ and will look for another adviser.”Perhaps unsurprisingly, Mr Helck sees this as a golden opportunity for his employer, which already conducts the “vast majority” of its business on a fee basis, with the fee a proportion of assets under management. “Clients will be re-evaluating their relationship with advisers. Transparency favours us.”Florida-headquartered Raymond James is celebrating its 50th year, but is best known in the UK for a rather more recent spat with Towry, the wealth manager.Earlier this year, Towry lost a High Court case against seven IFAs, which it accused of unlawfully soliciting almost 400 clients when they left Towry to join Raymond James.In many ways this was a clash of business models; while many advisory groups fight tooth-and-nail to stop advisers taking clients with them when they leave, Raymond James is perfectly happy for them to do so. Indeed, it is scathing of restrictive covenants that mean a client is essentially “owned” by an advisory firm, rather than by a specific adviser with whom they may have built up a strong relationship.“If your adviser leaves the firm, you can use anybody you want but the adviser you had before. The retail customer is bound by a contract they are not privy to,” says Peter Moores, chief executive of Raymond James’ UK private client group.Mr Helck sums it up more directly. “It’s not putting customers’ interests first. If you are the only [adviser] who knows my wife has a terrible illness and will die in two years and you have based liquidity around that, I shouldn’t have to tell someone else. You have to remember that the money belongs to the client, not the firm.”He accepts Raymond James’ free agent model carries a degree of commercial risk, given that “our advisers can walk away with all their clients”.But Mr Helck claims an attrition rate of less than 3 per cent in the US, where the majority of Raymond James’ 6,300 advisers and 2m clients are based, which “compares tremendously favourably with anyone in the industry”.He cites two main corporate benefits of this approach. First, it should improve standards by reducing the risk of short- termism by advisers, as they see the benefit of cultivating a potentially career-long relationship. Second, it obviates the need for continual, and costly, legal action.To this end, more than 800 advisory firms in the US have signed up to a protocol designed to facilitate the orderly transfer of advisers between groups and reduce litigation, which is now largely restricted to cases of “raiding”, when one group poaches the bulk of advisers in someone else’s office.Mr Helck would love to see a similar protocol adopted in the UK, and in September such a move was discussed at a meeting of the 120-member strong Tax Incentivised Savings Association. He sees this as an urgent task, given the wave of takeovers likely to ensue from the reshaping of the UK industry by the RDR.“Our case cost Towry £2.3m. That’s for a relatively small portion of business,” he says.Although Wall Street-listed Raymond James Financial is also involved in investment and commercial banking and asset management, Mr Helck’s global private client group is the dominant division, accounting for 63.5 per cent of the company’s $2.8bn of revenues in the nine months to June 30 and 46.1 per cent of its $347m of pre-tax income.Nevertheless, the fact that Raymond James does manufacture its own investment products creates a potential conflict of interest for its advisers.Mr Helck says there are no conflicts in practice, with in-house products not promoted unduly. “They have to earn their entry into clients’ portfolios if they can,” he says, pointing out that proprietary mutual funds account for less than 5 per cent of the portfolios of US clients.He does, however, believe that the use of in-house funds can sometimes be justified. “If a doctor advising you on an injury recommends surgery and carries out that surgery themselves, most people trust that. It’s possible to abuse that trust, but it’s possible to uphold it,” says Mr Helck.Outside the US these potential conflicts melt away. Although Raymond James has asset management joint ventures in France and Latin America, they are aimed purely at institutional investors, and it has no proprietary products in the UK.Mr Helck is himself not frightened of a challenge. He was recently named chairman of Sifma, the Securities Industry and Financial Markets Association, which represents US securities firms, banks and asset managers, where he has set himself a tough task.“The biggest issue the world is facing is a loss of public confidence in financial markets and institutions. My number one objective is to work on regaining public trust and confidence,” he says.……………………………………………………………..Curriculum vitae
Chet HelckBorn 1952Education
1974 West Virginia University Institute of Technology (BA, Industrial Management)Career
1974 Product marketing, territory management, Deere & Co, (John Deere)1983 Investment representative, Edward Jones1989 Vice-president of business development, Raymond James Financial2002 President and chief operating officer, Raymond James Financial2012 Chief executive, global private client group, RJF2012 Chairman of the Securities Industry and Financial Markets Association (SIFMA), board of Financial Markets Association……………………………………………………………..Raymond James FinancialEstablished 1962Client assets $390bnAsset management subsidiaries manage $43bnNumber of employees 10,400, including 6,300 financial advisersOffices More than 2,300 in the US, Canada, UK, Germany, Belgium, Luxembourg, Liechtenstein, Brazil, Uruguay and ArgentinaOwnership Listed on the New York Stock Exchange"
1;RJF;Raymond James Financial;2012-11-13T20:13:10Z;RJF throws in the towel on Brazil;;"Anyone who has ever worked in Brazil, set up a company or in fact tried to do anything in the country will feel their pain. Raymond James Financial said on Tuesday that it was shutting down its equity research unit in Brazil because of tax and regulatory hurdles.This from the US-based brokerage/investment bank:After careful consideration, Raymond James is closing its affiliated Brazilian equity research operation in Sao Paulo, Brazil, and will likely eliminate a small number of supporting Latin American Institutional Sales and Trading positions in New York / London. The firm has concluded that the costs, structural impediments, and complex legal, tax, and regulatory environments are impeding sufficient return on invested capital. This decision is specific to the Brazilian operation and Raymond James continues to maintain its affiliated operations in Argentina and Uruguay, in addition to its global operations in the US, Canada, and Europe. We are deeply grateful for the outstanding work accomplished by our associates.The fact that they have decided it is easier to operate in Argentina than in Brazil is particularly telling.Companies in Brazil frequently complain about the so-called “Brazil cost” – a combination of infrastructure problems, high taxes and red tape – and it’s no surprise.There are now almost 90 different taxes in Brazil, which are changed on a frequent basis and often vary from one town to the next. According to the World Bank, it takes a company in Brazil 2,600 hours a year on average to fill in tax returns.However, it’s not just taxes. Even things that should be simple just aren’t.For example, when the founders of Dafiti, Brazil’s answer to Asos or Zappos, set up the company almost two years ago, one of their first problems was getting the shape of their tables right.After buying standard desks for the whole office at a local furniture store, they were informed by health and safety regulators that the edges were not sufficiently round enough and forced to get rid of them. Equally ridiculous stories are not hard to find.In the case of Raymond James, though, problems in Brazil’s equity market are also likely to have played a role. After all, every company has to deal with tax and regulatory issues in Brazil but very few decide to exit the country altogether.Brazil’s recent economic slowdown, the country’s relatively high interest rates and government intervention in key companies have prompted a mass exodus from the stock market. And fewer investors means fewer people reading research reports.According to Bloomberg, foreign money managers sold a net $2.6bn of equities in the São Paulo exchange over the past two months, the biggest outflow since Lehman Brothers’s collapse in 2008.Related reading:
ABN Amro’s Brazilian come-back, beyondbrics
Can the NYT succeed in Brazil?, beyondbrics
Amazon: set to join Brazil’s e-commerce fray?, beyondbrics
Investing in Brazil 2012, FT Special Report"
2;RJF;Raymond James Financial;2012-06-03T03:41:11Z;Sensible to break the ties that bind;Restrictive covenants that prevent moving money should be banned;"The financial services industry sometimes forgets the “services” part of its description. There should be a sign up in every office reminding people they are there to serve their customers, and nobody owes them a living. The money they look after belongs to the client. And the client does not belong to anyone, much though some advisory firms might like to think otherwise.The concept of client “ownership” was under discussion in the UK last week, with suggestions the UK should introduce a type of agreement that has worked well in the US and prevented expensive legal arguments when advisers switch firms and their clients follow.The very idea that clients may be prevented from moving their money to follow an adviser when he or she changes firms is bizarre. But it is alive and well in some advisory firms.A survey by Faegre Baker Daniels, a law firm, shows widespread use of restrictive covenants in the UK financial services sector, particularly of the non-solicitation type (used by 63 per cent of respondents). Also in use, though, are non-dealing covenants, which seek to prevent clients moving with an adviser who changes firms. Nearly half (46.5 per cent) of respondents reported using such covenants.The firm best known for using non-dealing covenants is Towry, which lost a court case against Raymond James and seven former Edward Jones advisers in February. Edward Jones was taken over by Towry, but a number of advisers resigned while still under the terms of the Edward Jones non-solicitation covenant, including the seven who joined Raymond James. Nearly 400 of the 50,000 customers that Towry took over followed the seven to Raymond James.Towry alleged the customers were solicited and wanted £6m in damages. The judge found no evidence of solicitation and dismissed the case.The case did not test whether non-dealing restrictive covenants could be enforced, but this is a question that deserves consideration.Advisers like Towry argue that their clients benefit from the whole package – brand, infrastructure and team; the individual adviser’s contribution is a relatively minor one. That may be true, and if clients do not have strong relationships with particular advisers, there is unlikely to be an issue when an adviser leaves.But the likelihood of further consolidation in the UK IFA market means disputes of the type seen in the Raymond James case could become increasingly common. Firms look to buy an income stream from renewal commission or asset-based advice fees when they take over books of business. If that business can easily walk out the door, there are implications for the valuation of an IFA firm.The risk is greater when the type of service offered by the business for sale is materially different from that of the buyer.It is easy to see why advisory businesses see non-dealing covenants as essential protection.But they are a travesty: how can clients be bound by contracts they have not signed or even been made aware of?Peter Moores, chief executive of Raymond James (part of a US group) says his firm does not impose any restrictive covenants on advisers. He is an advocate for adoption of a protocol introduced in the US in 2004 and since adopted by 826 advisory firms there.The move away from restrictive covenants in the US began when the regulator for the sector issued a notice in 2002 saying firms could not take legal action to prevent a client moving with their adviser to a new firm. Such action was “inconsistent with just and equitable principles of trade”, it said.Firms continued to sue each other over solicitation issues, and in 2004, three of the biggest (Smith Barney, Merrill Lynch and UBS) came up with the Broker Recruitment Protocol. Mike Alford, deputy general counsel for Raymond James Financial, based in Florida, says the protocol “sets forth a blueprint for the orderly transition of registered advisers from one member firm to another”.The UK regulator has not so far got involved in the issue of restrictive covenants. But according to the Financial Services Authority’s Treating Customers Fairly rules, consumers should “not face unreasonable post-sale barriers imposed by firms” when they want to change product or switch provider.The question is whether a non-dealing covenant constitutes an unreasonable barrier. The US regulator clearly thinks it does. And there is an appetite for change among advisers: most of the attendees at the Tax Incentivised Savings Association event where the protocol was discussed last week believed it could work in the UK. If advisers make any claim to be on the side of the customer, they must abandon restrictive covenants.pauline.skypala@ft.com"
3;RJF;Raymond James Financial;2020-04-25T23:17:40+0000;Greek worries weigh on Wall Street;Disappointing earnings stall rally;Shares in Lazard fell 4.2 per cent to $27.65 after the largest independent US merger adviser posted fourth-quarter earnings per share of just 1 cent.That was a further sign that the slowdown in capital markets is hitting investment banking bottom lines.With January numbers available, analysts are struggling to pick winners and losers from the shake-out that saw the value of announced M&A deals fall by a third from December to January.Data from Goldman Sachs suggests smaller firms have been taking market share.Stifel Nicolaus, Raymond James and Greenhill & Co all saw healthy year-on-year growth in the value of completed M&A deals in January, while large-caps Bank of America, JPMorgan, Citigroup and Morgan Stanley all saw January deal value fall at least 60 per cent compared with 2011.But that is yet to show up in share price performance. Stifel is up 19.3 per cent to $38.25, and Raymond James has gained 14.8 per cent to $35.54 so far this year, but only Greenhill, whose shares have surged 33 per cent to $48.40, is matching the 25 per cent plus returns of BofA, Citi, Morgan Stanley and Goldman.Although banks have been among the leaders in the US equity rally so far this year, other stocks linked directly to capital markets have underperformed. Exchanges are lagging the S&P 500 by 5.5 per cent while trust banks have underperformed by 4.2 per cent.On Monday, Craig Siegenthaler at Credit Suisse also warned clients not to be tempted by shares in asset managers, as the strong equity market rally has not been matched by significant mutual fund inflows.“We see valuations remaining at depressed levels due to continued weak long-term flows in 2012,” he told clients.Money managers Franklin Resources and Federated Investors were both off 0.2 per cent to $116.22 and $18.65, respectively.Elsewhere, US stocks opened sharply lower, following the lead of global indices, which had sold off as a breakdown in negotiations once again raised fears of a Greek default.But, not for the first time this year, US stocks rallied once European markets closed, and the S&P 500 closed off just 0.04 per cent at 1,344.1. The Dow Jones Industrial Average fell 0.1 per cent to 12,845.2, and the blue-chip heavy index remains close to its three-year high hit Friday.While Greece dominated headlines, disappointing earnings continued to weigh on individual stocks.Food wholesaler Sysco fell 3.6 per cent to $29.79. Quarterly profits fell slightly as the company absorbed food cost inflation of 6.3 per cent, almost 2 percentage points higher than in the year-ago period.Humana fell 5.4 per cent to $85.25 after the company, which provides healthcare to seniors under the government’s Medicare scheme, disappointed analysts with its earnings guidance for 2012.With the majority of S&P 500 fourth-quarter results reported, negative guidance for the current quarter has outpaced positive guidance two to one.That has raised concern among analysts for the sustainability of the rally, which has seen the S&P 500 climb 6.9 per cent this year.“Some improvement from the macroeconomic or earnings outlook will be needed to support a continued rally in equities,” Barry Knapp, chief US equity strategist at Barclays Capital, told clients.Shares in Abercrombie & Fitch surged 8.1 per cent to $43.78. But despite the temporary lull in selling pressure, the clothing retailer, which saw a year on year fall in holiday same store sales, remains the weakest performer in the S&P 500’s current bull run. Shares are down 26 per cent since October 3.Pharmacy benefits manager Medco Health Solutions fell 6.3 per cent to $59.62 on reports the company’s acquisition by rival Express Scripts may be blocked. Express Scripts shares also fell 4 per cent to $50.00.Social media stocks, which enjoyed a two-day Facebook filing-fuelled surge on Thursday and Friday, gave back some of their gains.Offers website Groupon fell 3.8 per cent to $23.51 and professional networking website LinkedIn fell 0.2 per cent to $79.76.Zynga, whose online games accounted for 12 per cent of Facebook revenue in 2011, fell 4.6 per cent to $12.77. The stock remains 35 per cent up for the year after a 33 per cent surge last week.The tech-heavy Nasdaq Composite index remained at levels not seen since the dotcom bubble 11 years ago, despite slipping 0.1 per cent to 2,901.99.
4;RJF;Raymond James Financial;2012-01-11T23:09:06Z;Raymond James to buy Morgan Keegan;;Regions Financial will sell Morgan Keegan, its brokerage business, to Raymond James for $930m, ending a protracted sale process that began last summer but faltered amid market turbulence caused by the European sovereign debt crisis.Alabama-based Regions said on Wednesday that Morgan Keegan would also pay its parent a dividend of $250m before the deal closed, lifting the total consideration to $1.18bn.It added the disposal would improve capital ratios, generate additional liquidity and strengthen focus on its core banking business. Regions and Raymond James, which will have more than 6,000 financial advisers following the deal’s close, will maintain a partnership and referral agreement after the sale.When Regions first said it would explore a sale of the business last June, people familiar with the matter said that Morgan Keegan could fetch about $1.5bn. The business, which makes about half its $1.1bn revenues in retail brokerage, has more than 1,000 financial advisers and offices in 20 states.The unit was expected to go to a private equity buyer, people familiar with the process had previously said, after strategic buyers were sidelined. Morgan Keegan’s management team was reluctant to be sold to another bank, they added.However, discussions with two groups of buy-out funds ran aground last autumn, as markets gyrated on concerns about the eurozone. On-off negotiations have since continued with Raymond James, and rival bidder Stifel Financial.Regions shares dropped about 1 per cent in after-market trading following the deal’s announcement, to $4.75. Goldman Sachs advised Regions on the sale, while JPMorgan worked with Raymond James.Analysts at Barclays Capital noted that the deal is expected to only increase Regions’ Tier 1 common capital ratio by 9 basis points. The bank remains among the lowest on that measure among its peers, Barclays added.Regions has yet to repay the US Treasury’s $3.5bn crisis-time investment in the bank through the Troubled Asset Relief Programme.Regions will record a charge of $575m to $745m in its results for the fourth quarter of last year on goodwill held in its investment banking, brokerage and trust segment. The bank now expects to record a net loss for the quarter of between $432m to $633m, or $0.34 to $0.50 per share.Analysts had previously thought that Regions would make a small profit in the quarter, which the bank confirmed it was on track to do before the impairment charge on Wednesday.John Carson, Morgan Keegan’s chief executive, will join Raymond James as president and will oversee fixed income and public finance.
5;RJF;Raymond James Financial;2011-08-30T13:18:12Z;Rapid Addition wins US broker deal;;Rapid Addition, a UK trading technology company, has signed its largest US contract to date in a deal to supply Raymond James, one of the largest independent US broker-dealers, with software to monitor trading.The US group will use it to report over-the-counter secondary market transactions in credit markets to the Financial Industry Regulatory Authority (Finra), the US regulator.It marks another major contract for the UK group after it secured a deal in July to provide technology to Johnson Investment Counsel, a US-based wealth management firm. Last year it also won a mandate to provide part of the technology for Mercado Intergado Latino Americano (Mila), the new Latin American bourse.“We have certainly solidified our expansion into the American marketplace and are committed to building our business wherever the demand takes us,” said Toby Corballis, chief executive at Rapid Addition.The deal also reflects how the US financial services industry has had to adjust to tough new regulations concerning the monitoring of futures and swaps trades. A greater burden of responsibility being pushed on to the industry and many have been unprepared.The first of dozens of new derivatives regulations required by the 2010 Dodd-Frank financial reform act, the anti-fraud provisions broadened the rules to include swaps and made it easier for the commission to win cases by allowing it to punish attempted frauds and reckless behaviour, in addition to wilful, successful price manipulation. Banks, interdealer brokers and retail brokers have been targeted as they are seen as the gateway to order flow.
