;Ticker;Nombre_Completo;Date_Time;Titular;Subtitular;Texto
6;RJF;Raymond James Financial;2011-05-03T09:20:26Z;Nasdaq and ICE to go hostile on NYSE bid;;Nasdaq OMX and IntercontinentalExchange have confirmed they plan to make a hostile bid for NYSE Euronext, as the pair attempts to derail the US exchange’s agreed deal with Deutsche Börse.Nasdaq and ICE said on Monday that they intended to launch an offer for the exchange this month, and that the two boards had approved a plan to take its $11bn cash-and-stock break-up bid directly to NYSE shareholders.In April, the exchanges proposed to split the NYSE’s equities and futures businesses, just weeks after NYSE Euronext had agreed an all-stock merger with Deutsche Börse. NYSE’s board has twice rejected the rival proposal, which offers a higher price than the Deutsche Börse bid, calling it an “empty vessel”.Nasdaq and ICE are offering $14.24 in cash, 0.4069 shares of Nasdaq OMX common stock and 0.1436 shares of ICE common stock for each share in NYSE Euronext.Bob Greifeld, chief executive of Nasdaq OMX, said: “The NYSE Euronext board has continually challenged the seriousness of our proposal and refused to engage us in discussion despite the positive feedback we have received from their stockholders.”The US bourse on Monday noted that the Nasdaq-ICE’s offer would be launched on the same terms as previously proposed, adding that these had been “unanimously rejected” by its board.People close to the NYSE camp played down the significance of their rivals’ move, arguing that shareholders were already aware of the choice they faced in considering the two proposals ahead of a July vote on the Deutsche Börse deal.As a publicly listed exchange, the NYSE has certain limits on ownership and voting rights, which could make it difficult for Nasdaq and ICE to close a hostile offer, the people added.One party cannot own more than 20 per cent of the exchange, or have more than 10 per cent of the outstanding votes. As the limits must be waived by the board, they impose a condition on Nasdaq/ICE’s exchange offer, effectively functioning as a type of poison pill.Analysts at Raymond James noted this and other conditions to the Nasdaq/ICE offer. “We believe the laundry list of conditions attached to the offer virtually guarantee that it will never be executed,” they wrote.Once Nasdaq and ICE start their offer, the NYSE board will be legally obliged to respond, perhaps offering in more detail its reasons for rejecting the counterbid.Launching the offer could also mean Nasdaq and ICE will have to disclose more information about their bid.The pair have not yet made public the details of their financing commitments.People familiar with Nasdaq’s thinking said the formal launch of the offer would take some time to execute, perhaps a week or two.Yet, the company wanted to make clear its intentions ahead of a deadline this week that will determine who can vote in July on the Deutsche Börse deal.
7;RJF;Raymond James Financial;2011-01-20T23:11:21Z;US brokerages rebound on equity rally;;US brokerages on Thursday unveiled further evidence of a rebound after the “flash crash” and fears of a double-dip recession caused an exodus of investors from US markets last year.Volumes dropped in 2010 after the the May 6 flash crash, when the S&P 500 index fell 6 per cent in 20 minutes before rebounding, sparking inquiries by lawmakers into the stability of the US market structure.However, a surge in US stock prices in the most recent quarter, which has begun to draw traders back to the market, has benefited the brokers, some of which reported fourth-quarter earnings on Thursday.At Knight Capital, the largest US electronic trading group, revenues increased 8 per cent from the third quarter to $259m, although they were still down 14.5 per cent from a year ago. The strongest growth in the quarter was in trading revenues, which rose 21 per cent.Raymond James, the US investment bank, also reported an uptick in capital markets activity, led by mergers and acquisitions and retail customer trading. Investment banking revenue added 12 per cent quarter-over-quarter, to $59m, while trading commissions were up 7 per cent, to $534m.Income from private clients, or individual traders, was up 5 per cent in the quarter as retail traders took more aggressive bets and used higher margin, said Douglas Sipkin, analyst at Ticonderoga Securities. Overall net income was up 18 per cent quarter-over-quarter, to $81.7m.Meanwhile, Knight’s trading volumes outpaced the broader market’s, as its platforms increasingly attracted investors who use trading algorithms rather than going directly to exchanges.In the fourth quarter, Knight’s average daily dollar volume of trading increased 4.9 per cent over the third quarter, versus a 4.6 per cent decline in average daily volume for the broader US market, according to figures from Sandler O’Neill.Knight’s aggressive expansion earlier in the financial crisis continued to hurt results, however, following the trading slowdown. Knight’s net income fell 79 per cent year-over-year to $9.23m in the fourth quarter, for earnings of 10 cents per share, below consensus of 20 cents, as compensation costs exceeded estimates.Interactive Brokers Group, a market maker and electronic brokerage, reported after the market close a decline in earnings before income taxes in quarter versus a year ago, from $52.2m to $41.9m, as its market making group struggled to compete with high-frequency traders. However, its brokerage business saw quarterly commissions 10 per cent year-over-year, as trading volumes increased 5 per cent.Knight’s shares were up 7.7 per cent on Thursday, to $14.24, while Raymond James shares added 5.2 per cent to $35.34.Keefe Bruyette & Woods’s Capital Markets index, comprised of US brokerage and trading groups, is up 21.1 per cent over the past six months, while the S&P 500 index is up 17.7 per cent.
8;RJF;Raymond James Financial;2010-06-28T13:41:48Z;Deals, or no deals?;;"The chaotic conditions in global markets the past two years resulted in a sharp decline in merger and acquisition activity. The return of growth in most major economies should result in sufficient stability to propel a return to a more robust deal making environment.But could the recent increase in government supervision of most major economies thwart future deal making? Or will anemic growth and cheap money prove more important in setting the pace.Frederick C. Lane, Vice Chairman, Investment Banking at Raymond James Financial, says clarity of regulation will help M&A grow. Send Frederick your questions on the current outlook for mergers large and small to ask@ft.com, or via the form below. His answers to a selection of the best readers’ questions will be published here shortly.………………………………………………………………………………………………..Morgan Stanley says Russia is the new top tip for investment, replacing China. What do you think about the conditions for exposure to M&A there? Isn’t Russian politics still bit too “dangerous” to deal with?
Benedict Anderson, LondonFred Lane: There’s no question investors have a keen but cautious interest in investing in Russia.Given its natural resources and increasingly Western outlook, Russia is a tempting place for asset allocation. However, Russia has, from an investor’s perspective, the least transparency among the four BRIC countries.If and when it becomes a more cooperative member of the group of global powers, it will have intriguing investment potential.That said, Raymond James already has corporate clients entering the Russian market. In advising our corporate clients about M&A opportunities in Russia, we urge them to structure deals which protect their interests through creating functional and technological co-dependencies.…………………………………………………………………………………………….What is your view onthe UK proposal to raise shareholder approval threshold for deals from 50 per cent to two-thirds?
Andrew Cowell, DerbyFL: A two-thirds shareholder vote requirement generally serves to strengthen shareholder rights in approving mergers or other corporate reorganizations.Ironically, a two-thirds vote can thwart activist investors’ efforts.Several years ago, I advised an activist group in their efforts to gain control of the board of a woefully mismanaged multibillion dollar media company.The impressive 49 per cent of the vote we received in support of our dissident slate fell painfully short of 50 per cent. A two-thirds hurdle would have made our efforts an impossible challenge. (The happy post script to this story: the incumbent directors “listened” and the company was sold 5 months later.)…………………………………………………………………………………..What do you think the effect of more regulation to protect domestic companies will be overall? How far have things changed from the once-established consensus that protectionism is bad?
Helen Scott, LondonFL: Turbulent economic times such as these are fertile ground for protectionist legislation.In most cases, these regulations and the associated economic stimulus, while potentially saving jobs in the short term, may serve to postpone the inevitable and necessary trauma of change and adaptation.No country can provide long-term support for non-competitive industries or inefficient business practices. As unpleasant as it may be, these companies will eventually face the unavoidable task of adapting in order to compete or accepting the adverse consequences of not doing so.……………………………………………………………………………You say clarity of regulation will help M&A levels recover - do you think there will be a form of regulatory arbitrage making deal-making in one region easier than in others, and if so, where are the best places to do deals?
Mark Hughes, YorkshireFL:Clarity of government regulation is a positive factor for merger and acquisition activity (as well as stock prices).Raymond James’ Healthcare Banking practice has seen a significant upswing in activity in the last quarter as the impacts of the just enacted US Healthcare Reform bill can now be evaluated.Similarly, we have been advising on potential mergers involving several clients whose businesses are affected by provisions of the Financial Reform bill. Increasing clarity on the various provisions should enable us to reach agreement on merger terms.…………………………………………………………………………..How big an impact do currency movements have in international deal-making - is it the most important factor? If so, do you think ripples caused by the European sovereign debt crisis will make transatlantic mergers more common when confidence returns?
Alain Beau, BrusselsFL: Currency stability is an important factor in evaluating M & A transactions.Three other related factors that are critical to currency stability are conservative fiscal policies, political stability; and the level of regulatory burden around doing business.In our M&A advisory work, we are often told by U.K. and European companies how much they value the US’ for our political and currency stability; our strong work ethic, and productivity; and relatively low cost nature of our work force.…………………………………………………………………………….Do you think there will come a time when Chinese companies start seeking out targets in the West? Will that test the free market ideology of the US to breaking point?
Richard Hamilton, Sussex, UKFL: We have already seen and will continue to see Chinese corporations acquiring US companies – think Lenovo’s acquistion of IBM’s PC business – Chinese acquisition activity outside of China will focus on sectors where the chinese cannot build it: natural resources, technology, distribution, etc.Alibaba’s acquisition of California based Vendio last week is representative of this buy-versus-build trade off. Vendio immediately provides Alibaba an online distribution platform to serve small businesses seeking to sell through Amazon, eBay, and others, strengthening Alibaba’s leadership position in China.…………………………………………………………………………..Which sectors do you think are ripe for consolidation? In the UK it looks like there will be more dealmaking in the insurance sector, what are your top picks for potential activity elsewhere?
Jonathan Stevens, LondonFL: In the UK, as in the US, the sectors most ripe for consolidation are ones where change, especially disruptive and chaotic change, forces consolidation responsive to overcapacity, unanticipated capital requirements, and technology disruption (think newspapers, music, TV).At Raymond James, our Financial Institutions Group, our Real Estate group, our Technology Group, and of course our Restructuring Group are all experiencing significant upswings in M&A activity due to the challenging economic conditions.Consistently the drivers of strategic M&A activity are industrial logic (compelling strategic rationale as opposed to diversification for its own sake), and relative cost of capital. At present, the large global corporations have unprecedented levels of liquidity, low levels of debt, and ample availability of debt capital. Strategic M&A activity will continue to cut across many sectors as these large corporations bolster their revenue growth through complementary acquisitions.………………………………………………………………………How can the design of M&A deals be improved with the purpose to help all the involved buyers and sellers to capture value from M&A transaction in time of economic downturn?
Viktor O. Ledenyov, UkraineFL: Your question brings to mind the adage, “Deals only get done at the level of buyer’s and seller’s mutual discomfort.”In a steep and prolonged economic downturn, there are many distressed deals where creditors’ demands drive the deal more than the interests of shareholders or management. The dynamic in distressed M&A is all about getting the best price for the asset now.Even in difficult economic conditions, however, most M&A transactions are based upon the same fundamentals as in better times. The buyers see sufficient inherent value to pay a price to satisfy seller’s needs and motivations, which might include, beyond price, some continuing ownership (think stock for stock deals); continuing employment; the satisfaction of seeing the company grow more quickly, and be in trusted hands.M&A deals are not only about getting the top price. At the margin, qualitative factors are important too.What are the possible hidden problems connected with initial valuation of M&A transaction in conditions of weak capital markets?
Viktor O. Ledenyov, UkraineFL: In a weak economy, the financial projections underlying the valuation expectations of buyer and seller can be difficult to reconcile. This poses a special problem where the availability of substantial debt financing is critical to achieving price.Initial valuation expectations can be dashed if there is a contraction in credit markets. The paucity of large going private transactions by large private equity firms is in part the result of lack of debt to finance these deals.We have been advising a potential buyer in a several billion dollar acquisition where the seller’s lofty price expectations were predicated upon a staple-on debt financing commitment from seller’s bankers. The recent retreat in credit markets resulted in the withdrawal of that commitment, reducing the likely achievable valuation._______________________________________________"
9;RJF;Raymond James Financial;2020-04-03T03:00:05Z;Emerging market debt burdens may be sorely understated;Recent paper suggests overseas liabilities of EMs are greater than previously thought;For emerging economies, coronavirus struck first through the financial markets. Long before the numbers of cases and deaths in these countries began to spread alarm, many emerging markets experienced a sudden halt in foreign investment inflows.Overseas investors have taken $95bn out of EM stocks and bonds since late January, according to the Institute of International Finance, dwarfing the withdrawals that followed the onset of the global financial crisis in September 2008.As Covid-19 infections rise and fragile health systems struggle to cope, foreign investors may be low on the list of concerns for EM governments. But these outflows will have a big impact on the fiscal measures policymakers can bring to bear on the crisis.Emerging markets’ overseas liabilities, moreover, may be bigger than previously imagined. A paper published by Matteo Maggiori at Stanford and colleagues at Harvard, Chicago Booth and Columbia Business School suggests the true ownership of EM bonds by overseas investors is much greater than shown in standard data — in some countries, by many multiples.The paper also suggests that foreign holdings of shares issued by Chinese companies may be many times greater than the $160bn that shows up in US national accounts. Should US-China relations sour in the aftermath of the coronavirus crisis, these giant holdings could become a source of significant risk.Mr Maggiori and his colleagues question the normal practice of allocating securities in national accounts on the basis of the residency rather than the nationality of their issuer. It may make sense, for example, for a bond issued by a Brazilian subsidiary of Banco Santander to be added to the debt statistics of Brazil (the residency of its issuer) rather than Spain (the nationality of the issuer’s ultimate owner), because the bond’s proceeds are likely to be put to use in Brazil.But it makes much less sense for a bond issued by Petrobras International Finance Company, a Cayman Island subsidiary of the Brazilian oil group, to be added to the debt statistics of the Cayman Islands. Yet that is what happens in standard, residency-based financial statistics such as the US’s Treasury International Capital data (TIC) and the IMF’s Coordinated Portfolio Investment Survey (CPIS).Mr Maggiori says this results in a vast understatement of the investments by US, European and other international investors in emerging economies. So the academics developed an algorithm to reallocate the securities logged in the TIC and CPIS data according to nationality rather than residency.The results are startling. TIC data show that US ownership of Brazilian bonds at the end of 2017 amounted to $8bn, based on the residency of issuers. But restated by nationality, the total rises to $68bn. For Chinese bonds, the total rises from $3bn to $55bn. Mr Maggiori says the results sound a warning as the coronavirus crisis threatens to tip emerging markets into a debt crisis.“If we are going to see a wave of corporate defaults, it’s a risk worth thinking about that a lot of issuance has taken place offshore,” he said. “[Our work] shows that exposures are quite large.”What is also striking is the role played by tax havens such as the Cayman Islands. In the TIC data, of Brazil’s $59bn in reallocated bonds, $42bn were issued in tax havens. Of China’s $52bn, $44bn were issued in tax havens. The results also shine a light on the role of so-called variable interest equity structures in US investments in Chinese companies. VIEs allow US investors to hold shares in these companies, circumventing Chinese restrictions on foreign ownership of some operating businesses. But in these transactions what investors actually buy are shares in listed companies, generally resident in the Cayman Islands, that give them a claim on the profits of Chinese operating businesses.By reallocating such investments on the basis of nationality rather than residence, the paper shows that US “ownership” of Chinese companies at the end of 2017 was not $160bn, as shown in US national statistics, but $700bn. This puts it closer to the amount of Chinese ownership of US Treasuries, of about $1.1tn. This is significant because Chinese regulators are certainly aware of the smoke-and-mirrors act being carried out by VIEs. They could, should they wish, bring the practice to an end.Mr Maggiori is not suggesting they will. But he thinks the risk is worth noting. “You read a lot about the possibility of China dumping its US Treasuries but very little about the possibility of China imposing its own regulations. If we’re talking about one, we should certainly be talking about the other,” he said.jonathan.wheatley@ft.com
