;Ticker;Nombre_Completo;Date_Time;Titular;Subtitular;Texto
102;CRM;Salesforce.com Inc;2012-02-09T21:48:57Z;Latest deal highlights cloud agenda;;Oracle’s proposed acquisition of Taleo for $1.9bn is the latest in an aggressive and competitive wave of market consolidation in the emerging cloud-based Human Capital Management (HCM) software field, which has also seen SAP acquire Success Factors, and Salesforce.com acquire Rypple.It also underscores the growing importance of cloud-based business software and the scramble among traditional enterprise planning software companies including Oracle and SAP to bolster their cloud offerings.“These acquisitions indicate the increasing enterprise acceptance of the Software-as-a-Service (SaaS) model, with HCM following in the footsteps of Customer Relationship Management (CRM) as the next SaaS battleground,” said Tim Jennings, chief analyst at Ovum, the technology market research firm.“It also emphasises the urgency that the major enterprise application vendors attach to establishing a strong position in cloud-based software,” he said. “Both Oracle and SAP have existing on-premise HCM solutions, but both have been prepared to pay out large sums on cloud-based equivalents, rather than simply transitioning their existing solutions to the cloud.”Taleo will also further advance Oracle’s public cloud strategy, joining the recently closed acquisition of RightNow for customer service management, Oracle’s Social Network for collaboration, and Oracle’s own Fusion applications.Like SAP’s pending $3.4bn acquisition of San Mateo, California-based Success Factors which was announced in December, Oracle’s proposed acquisition reflects the increasing demand from customers for more flexible cloud-based enterprise software that can be accessed on demand.With cloud-based start-ups like Taleo, Success Factors and Rypple making inroads in the human resources area, the giants of the software industry have had to respond, said Paul Hammerman, an analyst at Forrester Research.This trend also reflects easing concerns among major companies about the availability and security of cloud-based software and a growing appreciation that on-demand cloud-based services can provide additional flexibility and agility.“The cloud offers new delivery styles and options that are industrialised in a value chain that renders on-premises IT systems and expertise as only part of the overall delivery of IT capabilities to the company,” noted Darryl Plummer of Gartner in the IT research group’s predictions for this year.Among business users, customer relationship management and human resource management have emerged as some of the first major corporate functions to switch from in-house software packages running on corporate servers to cloud-based services that run over the internet.As a result, tools that allow companies to track and measure employees performance – often called “talent management” suites – have become one of the high-growth areas in the software industry. IDC has estimated that the sector grew by 41 per cent between 2009 and 2010, and both Taleo and Success Factors are considered leaders in the field.This switch also underscores the rapid changes under way in corporate HR departments which once relied heavily on internal systems and costly external agencies, especially for recruitment. “Human resource information systems have altered how HR services are delivered and managed by organisations,” says the Washington-based Society for Human Resources Management.So why has talent management software as a whole fared so well in recent years? In an interview last year Michael Gregoire, chief executive of Taleo, explained that the functions it provides are in tune with board-level concerns in times of economic uncertainty.“When chief executives find themselves unable to invest in hard assets such as new warehouses or manufacturing lines, their attention tends to be drawn to the workforce as a source of competitive advantage,” he said.“That focus often triggers the realisation that they simply don’t have the transparency they need to identify the ‘stars’ in their organisation, the high-performers who make a measurable contribution to business results and who need to be nurtured, motivated and rewarded for their achievements.”
103;CRM;Salesforce.com Inc;2012-02-09T19:33:59Z;Oracle in online shift with Taleo purchase;;Oracle is set to take its biggest leap yet into the fast-growing world of cloud computing, announcing on Thursday that it would pay $1.9bn for Taleo, a US company which provides online human resources management software.The deal echoes SAP’s pending $3.4bn acquisition of a similar company, Success Factors, and reflects an acceleration in the shift of some key aspects of business software to the internet. With companies such as Workday, an internet-based start-up, making inroads in the human resources area, the giants of the software industry have had to respond, said Paul Hamerman, an analyst at Forrester Research.Larry Ellison, chief executive of Oracle, once dismissed cloud computing as “gibberish” and a passing fad, but has recently embarked on a number of acquisitions of companies offering internet-based software. The agreement to buy Taleo tops the $1.5bn that Oracle paid to acquire RightNow, which provides online software for managing customer services.The shift to online delivery of software – known as “software as a service”, or SaaS – threatens to disrupt the traditional software business since customers pay through annual subscriptions, replacing the upfront sales that are central to Oracle and SAP.Mr Hamerman said: “Oracle has been very reticent about SaaS, preferring the revenue recognition associated with its original licensing model.”But he added that in human capital management – the name given to software from companies such as Taleo – and customer-relationship management, “the market has already voted” for online delivery, forcing Oracle to follow suit.Oracle’s latest acquisition will revive an old battle in the software industry. A decade ago, the world’s second-biggest software company triggered consolidation in the industry with an unsolicited bid for PeopleSoft, a company selling traditional human resources software. Dave Duffield, the entrepreneur behind PeopleSoft, and Aneel Bhusri, a long-time ally, went on to found Workday, opening a new front by shifting their focus to online delivery.Oracle, which has bought more than 70 companies in a $40bn buying spree over the past few years, is under pressure to lift sales growth after revealing in December that sales had only grown just 2 per cent in the three months to November.Tim Jennings, chief analyst at Ovum, called Oracle’s move “the latest in an aggressive and competitive wave of market consolidation” in human resources software, following the Success Factors deal and Salesforce.com’s acquisition of Rypple.Tools that allow companies to track and measure employees’ performance has become one of the high-growth areas in the software industry. An IDC study calculated a market growth rate of 41 per cent for the sector between 2009 and 2010. Taleo and Success Factors, both relatively young companies, were the leaders in the field.Shareholders at Redwood City, California-based Taleo will receive $46 a share, an 18 per cent premium over Taleo’s closing price on Wednesday.
104;CRM;Salesforce.com Inc;2012-01-24T14:39:47Z;New customers: Retailers experiment on ways to win loyalty;Jessica Twentyman says shoppers are much more ‘chatty’ than they were and looks at how to listen and respond;"In recent years, it has become fashionable among marketers to talk about “empowered customers”.As Robert Bloom, a former advertising boss, points out in his 2010 book, The New Experts, the internet has handed customers three powerful weapons: instant access to information on products and services; immense choice; and real-time price comparison tools.Brand loyalty is dead, Mr Bloom argues, and customers are now calling the shots.It may be more constructive, however, for marketers to think about today’s customers as “chatty”.The internet has changed advertising and marketing for good and digital media, in particular, have transformed the interactions of brands with target audiences from a one-way street of marketing messages to something more akin to a two-way conversation.To start that “conversation”, however, brands need to find a way to break the ice.At Belron, an international windscreen repair and replacement company, customer service agents are using social media tools from Radian6 (owned by Salesforce.com, a software company) to identify and approach potential customers.David Meliveo, marketing director of Autoglass, Belron’s UK brand, explains: “We monitor social media sites such as Facebook and Twitter for mentions of the Autoglass name.“But at the same time, we also search for people talking online in more general terms about vehicle glass. So if you post on Twitter and your update includes the term ‘broken windscreen’, it’s likely that you’ll get a tweet from us, asking if you need help,” he says.In this way, the company is able to initiate a conversation with customers who may not be familiar with the Autoglass brand but are likely to need its services.From that initial contact, customers are typically directed to the Autoglass call-centre or to its website, says Mr Meliveo.If customers choose the website to complete a transaction, that should not mean the conversation is over, says Ashutosh Roy, chief executive of eGain Communications.In addition to tools used by call-centre agents, the company sells software that enables online shoppers – on sites owned by retailers such as Asos.com, Gymboree and Timberland – to ask for help or advice in completing their purchase.“Shopping cart abandonment is a big problem for online retailers,” says Mr Roy.In fact, he adds, analysts at Forrester Research, an IT market analyst company, believe that as many as 83 per cent of online purchases are abandoned before the transaction is complete.“People get confused by the process itself or they simply get overwhelmed by choice,” he says.“In that situation, it’s vital that the business can jump in and guide them through the sales process – if that’s what they want.”But it is not just the conversations that take place between a brand and prospective customers that help convert browsers to buyers.At BT, the UK telecoms company, Bian Salins, the head of social media innovation, believes the conversations customers have with each other can be just as valuable as those they have with the provider.That is particularly true when it comes to service and support, she says.“Our social media strategy is two-fold. First, we take our conversations to where our customers are, such as Twitter.“Second, we host a community forum on our site, where customers can discuss the service and support they’re receiving.”While this community forum, based on software from Lithium Technologies and launched in January 2010, is primarily aimed at existing customers, she says, it has proved valuable in attracting new ones to BT.“Over time, the more prominent the community has become and the more word-of-mouth has spread, we find that people who aren’t currently BT customers are registering for the community to ask about service quality, pricing, that sort of thing,” she says.In fact, all companies should be thinking of doing more outside the confines of the traditional marketing department in order to engage chatty, empowered customers for whom traditional “push” advertising is increasingly irrelevant, according to a recent report from McKinsey, a management consultancy.“In today’s marketing environment, companies will be better off if they stop viewing customer engagement as a series of discrete interactions and instead think about it as customers do: a set of related interactions that, added together, make up the customer experience,” the report’s authors argue."
105;CRM;Salesforce.com Inc;2012-01-19T22:09:43Z;Tech stocks shine as S&P 500 consolidates gains;BofA climbs on fourth-quarter profit;A strong day for tech stocks helped the S&P 500 consolidate gains to close above 1,300 for a second consecutive day, hitting a five-month high.F5 Networks rose 10.6 per cent to $120, after the computer network provider narrowly beat analyst expectations for fourth-quarter earnings and forecast a strong start to 2012, despite falling revenues from government clients.F5’s market cap has now increased fivefold since the start of 2009, leaving some analysts cautious about the potential for further gains. “At over 24 times our full year 2012 expected earnings per share, we believe more earnings momentum is needed to keep the stock moving up,” said Rod Hall at JPMorgan.F5’s result provided a fillip to other networking and software companies. Juniper Networks advanced 6.1 per cent $23.88, while Cisco Systems was one of the best performers in the Dow Jones index, putting on 1.3 per cent to $19.79 ahead of results.Semiconductor manufacturer NetApp was up 8.3 per cent to $37.51 on reports it could be a subject of takeover bids.Cloud business software developer Salesforce.com rallied 6.3 per cent to $114.51 as Canaccord Genuity analysts said the company’s recent weakness on new billings, could prove temporary, “and not necessarily indicative of [the] firm’s outlook”.The tech-heavy Nasdaq Composite index climbed 0.7 per cent to 2,788.33, but Google, the second most heavily weighted stock in the index, plunged 10 per cent to $581.35 in after-hours trading, when the company reported fourth-quarter earnings that missed expectations by a large margin.The Dow Jones Industrial Average advanced just 0.4 per cent to 12,623.98. The S&P 500 finished 0.5 per cent higher at 1,314.50, a gain of 4.5 per cent for the year.The benchmark index is set for its best January since 1997, but analysts warned a disappointing start to the earnings season could weigh on the index. Of the 59 S&P 500 companies that had reported by Thursday afternoon, only 49 per cent had beat expectations, the lowest level in 10 years, according to Standard & Poor’s Capital IQ.“Investors are now faced with losing the catalyst that strong earnings growth typically provides during reporting season,” said Barry Knapp, chief US equity strategist at Barclays Capital.Bank stocks continued to rally, as Morgan Stanley and Bank of America beat analyst expectations with fourth-quarter results, but materials, the other star sector of this year’s rally, sold off as profit fell at copper miner Freeport-McMoRan and Newmont Mining lowered its 2012 copper production forecast.BofA eked out a fourth-quarter profit on strong loan growth, although a lossmaking quarter for its investment banking unit weighed on performance, continuing the trend set by JPMorgan and Citigroup.Morgan Stanley declared a loss, but one that was much smaller than expected by analysts, as the investment bank bucked the trend to report an increase in trading revenue.BofA closed up 2.4 per cent to $6.96, after breaching $7 for the first time since the end of October in the morning session. Morgan Stanley climbed 5.4 per cent to $18.28. Other big bank stocks also rallied, except for Wells Fargo, which slipped 0.3 per cent to $30.15.Regional bank Huntington Bancshares fell 4 per cent to $5.79 as its average return on assets fell slightly despite a surge in lending, as the low interest rate environment appeared to take a toll.Freeport-McMoRan opened 2.5 per cent lower, before paring losses to end the day off just 0.2 per cent to $44.37. Fourth-quarter profit of $640m was less than half the figure for the same period in 2010. But many analysts had predicted worse results, after labour disputes hit production at its Indonesian mines in the fourth quarter. Newmont Mining fell 1.2 per cent to $59.60, after raising its forecast for gold output, but lowering guidance on copper extraction.Gas-focused energy exploration and production companies continued their torrid 2012, after natural gas futures, which have been plummeting for some time, hit a decade low.Cabot Oil & Gas fell 6.5 per cent to $63.09 and Range Resources fell 4.1 per cent to $54.06. Cabot is now off almost 17 per cent year to date.Ebay climbed 3.9 per cent to $31.51, as the company beat fourth-quarter estimates, thanks mainly to heavy usage of its PayPal electronic payments site. But some analysts focused on the less than stellar performance at Ebay’s core internet auction website business.“We continue to question the sustainability of the recent mid-teens core general merchandise volume growth rates heading to 2012,” said Brian Nowak at Nomura.Car parts manufacturer Johnson Controls slumped 8.4 per cent to $32.60 for the worst performance in the S&P 500 as the company lowered full-year earnings guidance, citing weakness in demand from Europe.But the aircraft part supplier Rockwell Collins climbed 5.5 per cent to $59.96 after the company said it was doubling production of parts for Boeing’s 787 Dreamliner this quarter.First Solar slumped 10 per cent to $38.70, on reports the German government will cut subsidies for solar energy. The solar industry remains heavily dependent on support from eurozone governments for demand.Eastman Kodak, the company that invented the handheld camera, ended a prolonged share price slide by filing for bankruptcy. The shares were last trading at 36 cents.
106;CRM;Salesforce.com Inc;2012-01-16T23:20:57Z;Intuitive Surgical: cutting the mustard;It is very profitable but it is crucial the company steps up international sales;Intuitive Surgical has the key ingredients of a go-go growth stock: torrid revenue growth, a profitable business model, and robots. The company, which reports fourth-quarter earnings on Friday, makes systems that allow doctors to perform minimally invasive surgery while sitting at a video-game like console, using hand controls to manipulate a scope and tools within the patient’s body, by way of four mechanical arms.Revenue growth has averaged 40 per cent over the past five years. The business runs on a razors and blades model, with more than half of the revenue from recurring sales of accessories and from service contracts. It is very profitable, due in part to a near monopoly in robotic surgery, and has $2bn in net cash.All the excitement has left Intuitive shares selling at north of 20 times this year’s estimated earnings before interest, taxes, depreciation and amortisation. It has little company at this heady altitude, now that some of the biggest momentum stocks, such as Netflix and Green Mountain Coffee Roasters, have cracked. A Capital IQ screen finds only eight other US companies (outside of real estate) valued at more than $10bn trading at 20 times ebitda or higher, including Amazon, Groupon and Salesforce.com.If Intuitive can maintain growth near recent levels, it merits the price tag. But despite being in a defensive sector, a sharp sales slowdown in 2008-2009 shows that the company is sensitive to hospitals’ capital budgets and, therefore, the economy. JPMorgan notes that many of the largest US hospital groups now own Intuitive systems, which, at $1m-$2m apiece, are harder for smaller hospitals to afford. So it is crucial that the company steps up international sales, now just a fifth of the total. If growth slows, the market will perform a very invasive procedure on Intuitive’s stock.Email the Lex team in confidence at lex@ft.com
107;CRM;Salesforce.com Inc;2012-01-04T21:46:24Z;US retailers climb in flat market;Yahoo falls on naming of new chief executive;"Retail stocks rallied strongly as investors geared up for Thursday’s holidays sales reporting with apparel chains and luxury names to the fore.Ralph Lauren rose 4.2 per cent to $142.88 while VF Corp, which owns brands including Eastpak and The North Face, climbed 4.4 per cent to $134.38.Gap, which will report December sales figures today, was up 1.8 per cent to to $18.88 and Urban Outfitters climbed 2.4 per cent to $28.41.“All the indications are that volumes were up in December so same-store sales figures will probably look good,” said Daniela Nedialkova at Atlantic Equities. “But December was very promotional, so I will be looking for commentary on margins and profits, not just sales,” she cautioned.Elsewhere, US stocks ended the day flat as investors throttled back from Tuesday’s rally. The S&P 500 closed at 1,277.3, less than a quarter of a point up for the day, with financials bearing the brunt of selling, off 0.5 per cent.Morgan Stanley fell 0.9 per cent to $15.94, while the afterglow from Citigroup’s $2.5bn bond offering on Tuesday, its largest such debt issue since 2009, did not last long. Its shares fell 0.6 per cent to $28.17.The Dow Jones Industrial Average edged up 0.2 per cent to 12,418,42 and the Nasdaq Composite index was flat at 2,648.36, although the Nasdaq had opened sharply lower as technology stocks suffered.Ebay, the auction website, fell 3.8 per cent to $30.16 after Yahoopoached Scott Thompson from Ebay-owned PayPal as its new chief executive. Yahoo investors were unimpressed however, sending shares down 3.1 per cent to $15.78.Data storage company Netapp fell 3.1 per cent to $35.64 after a downgrade from Credit Suisse analysts, who tipped the company’s rate of market share growth to slow in 2012.Shares in Salesforce.com, which develops cloud-based software for businesses, slumped 3.7 per cent to $97.48. The stock was a darling of internet investors in 2009 and 2010 as it saw rapid customer growth but Mark Moerdler at Sanford Bernstein said the company may be unable to prize more market share from smaller rivals. “Looking forward, we believe it will become more difficult for Salesforce.com to grow,” Mr Moerdler wrote to clients.Netflix shares surged 11.4 per cent to $80.45, after the company said users had streamed 2bn hours of video from its website in the fourth quarter. However Netflix did not provide comparative figures for previous quarters.Cabot Oil & Gas climbed 7.2 per cent to $82.32 after the company raised its dividend 33 per cent to 16 cents a share and announced that it had doubled production in the Marcellus Shale during 2011. Separately, Cabot announced a two-for-one stock split.Shares of car vendor AutoNation fell 6.8 per cent to $33.26 after Edward Lampert’s ESL fund cut its stake in the company to 52.5 per cent from 56.4 per cent. Mr Lampert also reduced ESL’s stake in car parts retailer AutoZone to 12.6 per cent from 21.7 per cent, but after falling sharply at the open, shares recovered to close 2.2 per cent higher at $326.96.Chipotle Mexican Grill climbed 2.2 per cent to $348.75 after Goldman Sachs analysts added the fast food restaurant to its “conviction buy” list, tipping the company for earnings growth of 35-0 per cent this year as food costs fall, boosting margins.Shares in Chipotle rose almost 60 per cent in 2011 after more than doubling in value in 2010.Ford Motors rose 1.5 per cent to $11.30 as December sales rose 10 per cent, beating most analyst estimates. General Motors saw December sales growth of 5 per cent, which gave shares a 0.5 per cent fillip to $21.15. Both companies were left in the dust by Chrysler, which saw December sales leap 37 per cent compared with the previous year.Discount website Groupon fell 2.5 per cent to $18.79, significantly below the $20 offer price for its November IPO.Solar panel manufacturer First Solar fell 3.1 per cent to $34.70 as the Commerce Department said a decision on additional tariffs for Chinese solar-equipment would be delayed by a month to mid-February.CF Industries was up 2.7 per cent to $157.99, after Citigroup analysts recommended the nitrogen fertiliser producer.""Given the recent slowdown in fertiliser sales, we now prefer nitrogen as our top nutrient – nitrogen cannot be stored in the ground so its application tends to be steady,” Citi analysts told clients. MasterCard, off 3.3 per cent to $356.25, and Visa, off 1.8 per cent to $101.15, both fell as Janney analysts said the “secular shift from paper [money] to card [spending]” may be complete, and removed its buy recommendations from both stocks.Hospital operator Tenet Healthcare slid 5.4 per cent to $4.69, as investors continued to fret about long-term government funding for Medicare after Citigroup downgraded the sector on Tuesday."
