;Ticker;Nombre_Completo;Date_Time;Titular;Subtitular;Texto
49;CRM;Salesforce.com Inc;2016-04-03T16:30:55Z;Business is right to use its superpowers for social change;Big companies protect values by resisting attack on LGBT community in US, writes Margaret Heffernan;In the US state of Georgia, the Orwellian-sounding Free Exercise Protection Act has been vetoed by the governor, Nathan Deal. He was overriding his state legislature’s vote to allow faith-based organisations to refuse to serve or employ anyone who violated their religious beliefs. The bill’s implicit target was the lesbian, gay, bisexual and transgender community.Similar bills have been passed or are under consideration in a dozen states, as part of a backlash against last year’s US Supreme Court ruling in favour of nationwide marriage equality.Georgia’s bill sparked a broad coalition of resistance from some of the most powerful corporations in the US: Apple, Unilever, Delta Air Lines, Salesforce, Hilton, Walt Disney and Coca-Cola. The proposal represented an immediate threat to their diverse workforces: Disney’s forthcoming Marvel movies — Captain America: Civil War and Guardians of the Galaxy 2 — were made in the company’s Georgia studios. Coca-Cola is headquartered in Atlanta. Meanwhile, the National Football League warned Mr Deal that the legislation could rule out Atlanta’s bid to host a Super Bowl.You could argue that, by lining up in opposition to the bill, these organisations were simply protecting their businesses. In fact they were doing far more than that. They were saying that their cultural values outweighed those of the state in which they did business, and that their support for sexual diversity was more important than the feelings and attitudes of the democratically elected representatives of that state.It is more than a purely economic argument and reveals a clear social agenda. The tactic, however, is not new. In the 1930s, IBM started hiring female college graduates and Thomas Watson Senior, its chief executive, said they should be paid equally with men. He was decades ahead of the legal requirement to do so. In the 1950s, the company wrote an equal opportunity policy, in the 1960s a supplier diversity policy, in the 1980s a sexual orientation policy and in the 1990s it provided benefits for employees’ partners.While IBM set a high bar for other tech companies, many of which struggled to catch up, it was not the only organisation advancing social causes in advance of legislation. In 1992, Levi Strauss & Co was the first Fortune 500 company to provide health insurance to unmarried partners. Today this is standard in many large companies.More recently, Netflix began to offer unlimited paid maternity and paternity leave to its employees, something that is (currently) unheard of in the US.One could argue that these apparent trailblazers are economically self-interested — and they usually are. But their policies are value statements that shape public opinion and business norms. They give protection, even an incentive, to other companies who follow suit. In other words, these businesses set out to change society. And for those who believe that the business of business is just to make money, this is troubling. By what right do they wield such influence?Were these company innovations characterised by religious bigotry rather than social liberalism, we would expect to hear a lot about the abuse of corporate power. Some small businesses in Georgia may complain about overweening corporate influence. But the successful challenge to the state’s discriminatory legislation has been widely applauded in business circles, and corporations are now fighting a similar law in North Carolina.What makes this case a cause for celebration is that the companies’ stance is in line with public opinion and with federal law. In other words, demanding equality for a large and diverse community is not an idiosyncratic expression of corporate power, but a corporate defence of public consensus.In rejecting discrimination, the companies were not dominating society but serving it. And that is the business of business.The writer is author of ‘A Bigger Prize: How We Can Do Better Than the Competition’
50;CRM;Salesforce.com Inc;2016-02-25T21:51:59Z;Salesforce.com surges on sunny outlook;US energy sector rallies as crude oil prices bounce back from earlier declines;Salesforce.com, one of 2015’s high-fliers that has faced a sharp decline this year, rallied on Thursday after the cloud services company issued a sunny outlook.The company that provides business services through the internet said it expected to earn adjusted profits of 99 cents to $1.01 a share in the year through to the end of January 2017, above analyst estimates of 98 cents.Salesforce.com also posted financial fourth-quarter results that pointed to “broad-based strength across products, [geographies] and customer segments”, Abhey Lamba, an analyst at Mizuho, said in a note to clients.Mr Lamba added the company “continues to execute strongly” despite economic headwinds.Salesforce.com surged 32.2 per cent in 2015, but has tumbled this year as investors have shunned so-called momentum stocks and fretted that a slowdown in US economic growth could weigh on Salesforce.com’s customer base.The shares, however, rallied 10.6 per cent on Thursday to $69.17, cutting their year-to-date loss to 12.9 per cent.At the other end of the spectrum was Restoration Hardware. The upmarket US furniture chain warned on Wednesday that recent volatility in the equity and commodity markets would weigh on its profits.The company’s shares plunged 25.9 per cent to $38.49 after it forecast adjusted profits of 99 cents a share in the quarter to January 30, below the estimates of all Wall Street analysts in a Bloomberg survey.Gary Friedman, chief executive, said in a note to investors that Restoration Hardware continued to see “underperformance in markets affected by energy, oil or currency fluctuations”, such as Canada and Texas.At the same time, “increased volatility in the US stock markets, especially the extreme conditions in January” might have stoked a further pullback among high-end consumers, Mr Friedman said.The shares of Williams-Sonoma, which sells upmarket home goods, fell 6.1 per cent to $53.35 in sympathy with Restoration Hardware.The US energy sector rebounded after coming under renewed selling pressure as crude oil prices declined earlier in the day.Oil came back strongly, with West Texas Intermediate, the US benchmark, rising 2.9 per cent to $33.07 a barrel, while international marker Brent gained 2.6 per cent to $35.29 a barrel.The S&P 500 energy sector crept 0.2 per cent higher on the day.Williams Companies, an energy infrastructure group, slid 3.7 per cent to $16.01.By the close of trading, the S&P 500 was 1.1 per cent higher at 1,951.7, the Dow Jones Industrial Average rose 1.3 per cent to 16,697.3, and the Nasdaq Composite gained 0.9 per cent to 4,582.2.The financials, tech and healthcare sectors posted the biggest gains on Thursday.
51;CRM;Salesforce.com Inc;2020-04-23T21:49:51+0000;Tech finds a silver lining after the storm;Cloud software stocks prove resilient in the face of uncertainty;As the dust has settled from the rout in high-growth technology stocks at the start of the year, it has not taken long for the reassessment to begin.A market break like the one that hit with force in January is a natural time to cast a cold eye over companies — and new business models — that might not have been tested in a downturn.So it is no surprise that the growth sector that took the biggest pasting was cloud software. Shares in companies like Marketo, Hubspot, ServiceNow and Zendesk fell by more than 40 per cent, or four times the drop in the broader market. Tableau — a sexy cloud data analytics and visualisation company — plummeted 60 per cent after lowering its revenue guidance for the year.The sudden risk-aversion was apparent in the sharp contraction of revenue multiples for the so-called software-as-a-service companies, known as SaaS. Compared to roughly six times sales last November, the enterprise value of a basket of the leading SaaS companies had fallen to 3.5 times sales by the depths of the market rout earlier this month, according to an analysis by Barclays.How to account for the speed of the rebound that has set in since then?In little more than two weeks, companies like Workday and Zendesk have bounced by nearly 20 per cent, while Hubspot is up 31 per cent. There has been little in the way of actual news to drive this.The recovery in confidence was capped this week with a solid earnings report from Salesforce.com, the company that invented the category. Asked about the threat to new sales from global economic weakness, Salesforce’s executives gave barely a shrug. After falling by 31 per cent in the first five weeks of the year, its stock has rebounded by 26 per cent.The case for cloud software’s resilience in the face of macroeconomic uncertainty is made by chief information officers such as Stephanie von Friedeburg at the World Bank. Facing constant pressure to reduce costs, as well as a need to equip a globally distributed workforce with applications that run as efficiently as if they were hosted locally, Ms von Friedeburg is cutting the number of the bank’s data centres from five to two and pushing more services into the cloud, with its pay-as-you-go model.In little more than two weeks, some SaaS companies have bounced up to 31 per cent. There has been little in the way of actual news to drive thisNot that SaaS is completely immune in a downturn: at times of financial stress, customers cut back on most new projects — even ones that have a relatively short-term payback. And to the extent that smaller businesses or other tech companies are the main customers of newer cloud software suppliers, they are more vulnerable to the damage from a sharp downturn.Many SaaS companies are also at a relatively early stage of development and have yet to show they have the financial resilience to withstand a downturn. A more fundamental question is whether the business model of SaaS has been fully proven.With heavy upfront investment levels, cash flow profit margins at many of the younger companies are thin. As investors have become more wary of valuing these companies based solely on high multiples of their sales, that has left them vulnerable to a fall.At least in theory, the cloud software model has high attractions for investors. As Mood Rowghani, a partner at venture capital firm Kleiner Perkins, points out, it is relatively straightforward to model the cash flows of subscription businesses like these.Yet many companies have yet to show they can execute on this plan across the business cycle — let alone succeed in the more competitive markets that are likely as SaaS companies move out of their narrow niches.Age matters. Salesforce, which has faced no shortage of questions over the past 16 years, this week made its strongest case yet to be considered the first SaaS company to have made it into the mainstream enterprise software market. Its latest quarterly earnings included news of several giant contract wins. It is also finally showing consistent discipline on profit margins.Sales and marketing costs are still sky-high, at 49 per cent of revenues. But as long as growth rates also stay high, Wall Street has once again shown it is ready to stomach the SaaS model’s requirement for gratification deferred.richard.waters@ft.com
52;CRM;Salesforce.com Inc;2020-04-23T22:37:00+0000;Salesforce: diSaaSter averted;The software company has defied fears of a slowdown in IT spending and may even soon show profits;If there is one area in which Salesforce is the technology industry’s undisputed leader, it is superlatives. Quarterly results on Wednesday were described as “spectacular”, “unprecedented”, “tremendous” and “outstanding”.You might expect a side dish of profits with that main course of braggadocio, especially since another boast was “top and bottom line excellence”. You would be disappointed. Salesforce made a net loss of $25m on revenues of $1.8bn in the fourth quarter. Yet investors were content to embrace the hype: shares in the enterprise software company rose 9 per cent in after-hours trading.Relief is understandable. In the first five weeks of the year, Salesforce’s stock fell more than 30 per cent amid a sudden crisis of confidence in the prospects of “software as a service” — or SaaS — companies. The sell-off was premature. Some companies, such as Tableau Software, have indeed earned a lower multiple with weaker guidance. But any widespread collapse in IT budgets is not evident.As founder and chief braggart Marc Benioff is at pains to stress, not many companies of Salesforce’s size are growing at more than 20 per cent a year. Investors will still pay for growth — Salesforce’s enterprise value is back up at six times forward sales — they are just demanding more evidence that it is not going to fall off a cliff.One metric that provides some comfort is that 72 per cent of Salesforce’s customers tap it for only one product: there should be more opportunity to cross-sell. The company now crows about signing “nine-figure” deals. It also bumped up its revenue estimate to $8.1bn in 2017 from $6.7bn for the 2016 fiscal year. The bottom line has not shown a profit in five years but net cash from operations was $460m in the quarter and cash flow margins are strengthening. The top end of Salesforce’s 2017 profit guidance is a mighty $0 a share. If those targets are beaten you have to fear for Mr Benioff’s thesaurus.Email the Lex team at lex@ft.com
53;CRM;Salesforce.com Inc;2016-02-24T21:22:41Z;Salesforce shares pop on upbeat outlook;;Salesforce.com rallied seven per cent in after-hours trading on Wednesday after the cloud services company posted a stronger-than-expected earnings outlook.The company, which derives the bulk of its revenues from an online customer management system, said it expects to earn 99 cents to $1.01 a share in the current fiscal year, topping Wall Street estimates of 98 cents. A full-year sales guidance of $8.08bn – $8.12bn also compared favourably with estimates of $8.08bn.Salesforce.com has seen its shares slide about 20 per cent this year, after a 32.2 per cent surge in 2015, as investors have shifted away from last year’s high-fliers.However, the upbeat outlook seemed to re-instill confidence, with the shares jumping 7.5 per cent on Wednesday afternoon.The company narrowed its loss to $25.5m in the quarter through January 31, compared to a loss of $65.8m in the same period in the prior year. Sales rose 25.3 per cent to $1.8bn, matching estimates.Adjusted profits, which exclude certain items, came in at 19 cents, also matching estimates.
54;CRM;Salesforce.com Inc;2020-04-23T20:36:54+0000;Salesforce shares rise after analyst upgrade;US stocks weaker following global sell-off;Salesforce rallied on Tuesday after an investment bank said the company is gaining traction in the enterprise cloud services sector and that its stock decline this year may have run its course.John DiFucci, analyst at Jefferies, upgraded his rating on the stock from “underperform” to “hold”, adding that it is now fairly valued after a near 30 per cent fall this year.The company, which derives much of its revenue from fees related to its online customer relationship management products, was a top performer last year, soaring 32.2 per cent.Mr DiFucci said he reckoned the company’s sales to enterprises, or large companies, are “improving”.“We attribute this improved performance to exceptional sales leadership,” said Mr DiFucci in a note to clients.He also said sales to smaller mid-market companies had been “solid” and were gaining momentum. Salesforce is set to report its quarterly earnings later this month.The stock jumped 6.1 per cent to $57.36 by the close of trading on Tuesday.Elsewhere, shares in Sears Holdings, which also owns Kmart, fell 8.9 per cent to $15.25 after the retailer warned that sales in the fourth quarter would be shy of Wall Street’s forecasts.The Illinois-based company said it expects sales of $7.3bn in the fourth quarter as “the holiday season proved to be challenging” and warm weather and competition from other retailers weighed on its performance. That was below the $7.43bn that analysts were looking for.Meanwhile, comparable sales, a key industry metric, were down 7.1 per cent for the quarter.The retailer, which recently announced that it would close 50 stores, said it plans to accelerate the closing of unprofitable stores.Sears added that it is taking actions to lower its costs by $550m to $650m this year.Regeneron Pharmaceuticals shares fell 6.3 per cent to $365.97 after it reported disappointing fourth-quarter results and said sales of its key eye treatment would slow this year.The New York-based biopharmaceutical company reported profits of $155m, or $1.34 a share, in the three months ended in December, compared with $90.1m, or 78 cents a share, in the year-ago period.Sales rose 37 per cent to $1.1bn, missing analysts’ estimates of $1.2bn. Adjusting for one-time items, earnings of $2.83 a share were also shy of expectations of $3.37 a share.The company said sales of Eylea, its biggest drug, would advance 20 per cent next year compared with 54 per cent growth in 2015.Gap, the retailer behind Old Navy, Banana Republic and its eponymous brand, revealed a better than expected full-year profit outlook but reported declining same-store sales across all its brands.“While the company was able to deliver slightly better than expected fourth-quarter operating earnings per share guidance, we believe the earnings will be of low quality,” said Betty Chen, analyst at Mizuho.Shares were up initially before trading down 3 per cent to $23.27.By close of trading, the S&P 500 and the Dow Jones Industrial Average were trading 0.1 per cent lower at 1,852.21 and 16,014.38, respectively. The Nasdaq Composite fell 0.4 per cent to 4,268.76.
55;CRM;Salesforce.com Inc;2016-02-07T18:01:30Z;Tech sector: curses;Fear of declining growth is stalking companies from LinkedIn to Salesforce;"Forget “Fang”. Technology investors are relying on other f-words. The 2015 outperformance of Facebook, Amazon, Netflix and Google is in the past. On Friday, the tech-heavy Nasdaq Composite fell more than 3 per cent; the tech-heavier Nasdaq Internet index had its worst day since 2011, falling 5 per cent, and neither of those indices contains the true horror stock: LinkedIn.It looks increasingly like a recession mindset has taken hold and caught executives and analysts unawares. Going into this earnings season there was talk that macroeconomic fears gave something of a “freebie” to companies setting guidance — they could perhaps dial down those targets a little.Not a bit of it. When defensive securities are suddenly prized, the only growth tech stocks that will survive a portfolio cleanse are those whose revenues do not miss a beat. LinkedIn reported results on Thursday evening, which met expectations, and guidance for 2016, which did not, with revenue growth of 22 per cent compared with an expected 30 per cent. Before Friday’s opening, the stock fell more than 20 per cent. Analysts said it was overdone. Then it fell 43 per cent on Friday.In many ways, the more shocking move was Salesforce. The cloud software has a longer record of growth than LinkedIn (though it seems to share the same contempt for profits). But it endured the worst one-day performance in its history as a public company, down more than 12 per cent, despite producing no news. Tableau Software had fuelled fears with weak results and a warning of “more caution in how [customers] were spending and how they were allocating dollars”. Workday, another cloud software company, also fell 16 per cent in its wake.It is possible to find relatively safe havens in tech. Mizuho points to CA Technologies, a software company that lacks the double-digit growth of more glamorous peers but offers strong cash flow and a dividend yield of 3.5 per cent. In the top 50 international software companies, only IBM offers a bigger coupon.Yet it is also worth considering that the evidence of nosediving IT spending is slim. Salesforce, whose shares are down a quarter this year, and is now priced at a less frothy six times sales, reports its own quarterly earnings in two weeks. That will be a better moment to decide what sort of four-letter words will define 2016.Email the Lex team at lex@ft.com"
56;CRM;Salesforce.com Inc;2016-01-31T09:21:09Z;US companies forced to disclose pay gap;Obama administration in new push to crack down on income inequality;The Obama administration will require companies to disclose what they pay employees by gender, race and ethnicity in a new push to crack down on workplace inequality.The White House said the US needed to catch up with its international peers as it released data showing the wage gap between American men and women is 2.5 percentage points bigger than the average for rich countries.In the UK the gender wage gap has come down by 9 percentage points since 2000 and in Belgium, Ireland and Denmark it is down by about 7 percentage points over the same period, the White House found.President Barack Obama said a typical full-time female worker in the US earns 79 cents for every dollar a man makes, with black women earning just 60 cents and Hispanic women 55 cents.“What kind of example does paying women less set for our sons and daughters?” he said on Friday.Mr Obama is seeking to make a push against discriminatory pay practices part of his economic legacy and called for “equal pay for equal work” in his State of the Union address earlier this month.The disclosure requirement, which was unveiled as a proposal, would apply to businesses with 100 or more employers and cover 63m people — or about 40 per cent of the US civilian workforce — the White House said.The White House move mirrors steps taken in the UK, where prime minister David Cameron’s government is this year forcing companies with more than 250 employees to publish the difference between the average pay and bonuses of male and female staff.In the face of an intransigent Republican-led Congress, Mr Obama is again using his executive powers to make the move without lawmakers’ help. But as with unilateral policy steps he has taken on immigration, climate change and guns, it faces the risk of a legal challenge.The US Chamber of Commerce, corporate America’s main lobby group and a regular Obama critic, said it supported non-discrimination in pay, but cited studies suggesting the White House had exaggerated the size of the pay gap and criticised the president’s move.Randy Johnson, a Chamber senior vice-president, said: “[The] type of reporting proposed by the administration today would place unnecessary and onerous burdens on employers while providing no meaningful insight as to whether employer pay practices are discriminatory.”“Clearly the administration has embarked on one more fishing expedition to support a political agenda divorced from the facts. Soundbites don’t make sound policy.”The White House put forward Marc Benioff, chief executive of Salesforce.com, as a corporate ally on the proposal. He said that he never wanted pay discrimination to creep into his company but that two female leaders showed him it had, a problem he was spending $3m to fix.“We’re never going to solve this issue of pay inequality if CEOs like myself and others continue to turn a blind eye to what’s happening right now in their own organisations,” he said on a call organised by the White House.A number of other European countries require employers to publish gender pay data. In Sweden, companies with more than 24 employees have to publish an action plan for equal pay every three years, including information on gender pay gaps within grades.One of the biggest gender pay gaps among OECD countries is in Japan, where it is around 9 percentage points wider than in the US. Shinzo Abe, Japan’s prime minister, is seeking to narrow the gap as part of his “womenomics” programme.Tom Perez, the US labour secretary, said: “We can’t deliver on the promise of equal pay unless we have the best, most comprehensive information about what people earn . . . We expect that reporting this data will help employers to evaluate their own pay practices to prevent pay discrimination in their workplaces.”
