;Ticker;Nombre_Completo;Date_Time;Titular;Subtitular;Texto
15;SPG;Simon Property Group;2014-11-21T16:35:21Z;Chart that tells a story – Reits;Specialist property owners outperform bigger generalists;What does this show?The commercial property market is booming once again. But not all commercial property stocks are equal. Some are outperforming others. The key is specialisation. Landlords who specialise in a particular corner of the market – whether it is student housing (Unite), storage space (Big Yellow) or tech start-ups (Workspace) have done better than the big-name generalists over the past couple of years.Why is that?As investors worldwide engage in a desperate search for assets which generate a decent yield, real estate has become more of a mainstream asset class. Ever-increasing numbers of professional investors are piling in. Large-scale asset managers like to make their own calls about what to back. Britain’s biggest listed property companies hold too broad and diversified a range of assets, whereas smaller specialists, which are exposed to the fastest-growing sectors of the economy, offer the best returns.Why don’t the big guys specialise too?Most of the biggest landlords are shedding what they call “non-core” assets to focus their portfolios on one or two areas. Land Securities, for example, is selling many of its shopping centres to focus on only the biggest retail destinations, as well as its portfolio of high-quality London offices such as the newly-built Walkie Talkie. And in 2012 Hammerson shed its portfolio of London offices and decided to focus on retail property.So how come have their shares underperformed?It is the price they pay for being big in a country that’s relatively small. With a £13.2bn portfolio, Land Securities is the country’s largest real estate investment trust. Britain simply doesn’t have enough commercial property for it to invest all of its cash in one subsector of the market.By contrast, US Reits have both scale and specialism. One of the biggest, Simon Property Group, which specialises in shopping malls, has assets of $33bn. That is the benefit of operating in a country of 317m people, rather than 64m.That brings us back to the specialists. What is so good about them?The companies whose shares are most in demand by investors focus on novel or previously unregarded parts of the property market. They generally also have a direct connection with a specific economic or business trend. Student housing and tech start-up offices both feed on industries which are booming in Britain – universities and London’s Silicon Roundabout. Self-storage is doing well because the housing market is on the up – and when more people move, there is more demand for storage space.Are there any other specialists worth looking at?The biggest darling of the current property cycle is Derwent London. Like Workspace, it benefits from London’s tech economy, though it focuses on larger businesses rather than start-ups and also houses many creative industries. It recently won PR firm Freud Communications as a tenant, for example. Many of its buildings are in London’s hip eastern fringe around Shoreditch.West End office specialist Great Portland Estates has also been doing very well, benefiting from roaring occupier demand and lack of availability of space in the area.
16;SPG;Simon Property Group;2020-04-25T18:31:28+0000;Klépierre-Corio brings US-style consolidation to European malls;;If European shoppers want to see what the future holds for their favourite mall, they should look to Indianapolis.The US city is the home of Simon Property Group, the biggest US shopping mall operator by any measure, and now Simon is shaping the European market too.The acquisition of Netherlands-based Corio by retail landlord Klépierre will create Europe’s second-largest listed property company and could trigger a wave of consolidation, according to advisers and analysts who know the sector.Simon is Klépierre’s largest investor and its chairman and chief executive David Simon is also the French company’s chairman.Simon drove a two-decade-long period of consolidation in the US to become the dominant player. The merger of Europe’s second and third-largest listed retail landlords means that Mr Simon has made a move to do the same thing in Europe.Europe’s listed real estate market has long been regarded by major international investors as too fragmented, with a myriad different national regulatory and listing regimes making pan-European property ownership frustratingly difficult.“David Simon played the US consolidation brilliantly and is a top-quality dealmaker with a strong track record,” said John Lutzius, international managing director of Green Street Advisors. “The [Klépierre-Corio] merger makes sense as the European shopping centre [sector] evolves and consolidates. In this respect, the industry is following the pattern set over the past 15 years in the US.”The Klépierre-Corio deal was driven by major investors who wanted to hold stakes in a larger company, according to those with knowledge of the sector. It could be the first of many, they forecast.“The deal confirms our view that corporate activity and consolidation are likely to continue in European real estate,” said Valerie Guezi, an analyst at Exane BNP Paribas Research. “For continental companies such as [market leader] Unibail-Rodamco, we believe that the UK seems like a good place to expand.”She singled out FTSE 100 landlord Intu as “the clearest way to build scale in the market, although shareholders have shown resistance”. Intu is backed by Peel Holdings, a private company owned by publicity-shy billionaire John Whittaker.Hammerson, also an FTSE 100 company, “offers less concentrated exposure but without the obstacles in the shareholder base”, Ms Guezi said.
17;SPG;Simon Property Group;2014-07-01T18:31:08Z;Klépierre sells five Swedish shopping centres in €354m deal;Funds raised to pay for planned development projects;Klépierre has sold five Swedish shopping centres to Olav Thon, Norway’s largest private property owner, for €354m as part of an “asset rotation strategy to enhance” its overall portfolio.The French retail mall developer will use the funds raised to pay for planned development projects in Norway, Sweden and Denmark.Klépierre’s growth strategy is based on demographics, using population projections to identify local areas where the economy can be expected to grow.The five centres were majority-owned by Klépierre subsidiary Steen & Strom, a specialist in Scandinavian retail malls.Last year Klépierre sold 127 shopping centre sites to French retail giant Carrefour for €2bn, 12 years after Klépierre bought the properties from the supermarket chain.Klépierre, whose biggest shareholder is the world’s largest shopping centre developer Simon Property Group, has a total portfolio of €14.1bn covering 13 European countries.Mr Thon’s Thon Retail Properties AB, part of the Olav Thon Group, bought the five centres. Thon owns 450 properties, including 60 hotels.
18;SPG;Simon Property Group;2013-10-25T14:15:04Z;US malls pursue tourist spending;;Simon Property Group, the largest US shopping mall owner by every measure, is seeking to woo more of the foreign tourists who are traversing the globe in search of discount fashion.The Indianapolis-based company’s premium outlets – where designer brands sell stock at cheaper rates – have been so popular with foreign bargain hunters that Simon is renovating, expanding and developing new properties to boost growth. Installing luggage shops and boosting storage facilities have been part of a strategy to keep tourists splurging.“Overseas visitors are looking for items at better prices than they’d get at home. They’ll often come with a long list of luxury goods and electronic items,” said Nicole Domer, regional vice-president of marketing for Simon. “They’ll start the day off with an empty suitcase and fill it with things they want for themselves and gifts for their families. We wanted to make hands-free shopping easier.”Domestic consumption has been patchy this year as Americans spent more on big-ticket items such as cars and household appliances than on clothes, apparel and other products sold at malls. But the numbers of deep-pocketed foreign visitors have risen as has their spending on items such as Apple iPhones, Michael Kors handbags and Tag Heuer watches.International visitors to the US spent $87.1bn in the first half of 2013 on shopping, lodging, recreation and airfare among other tourism-related goods and services – a 7 per cent increase from a year ago. Holidaymakers from China, Mexico and Brazil that are propelling sales at Simon’s malls are expected to account for almost 40 per cent of visitor growth in the next five years.The company on Friday reported a 12 per cent gain in third-quarter funds from operations – which gauges a property company’s ability to generate cash – and raised its full year FFO forecast as retailers sought more outlet space. Revenue increased about 6 per cent from a year earlier to $1.3bn.Despite low vacancy rates and little new construction – suggesting mall owners are in an enviable position – “the recent lacklustre operating performance by underlying retailers raises a yellow flag”, said Cedrik Lachance, analyst at Green Street Advisors, ahead of the earnings. This is one factor leading even successful operators to push their tourism strategies.Simon has created appropriate language signage, added currency exchange outposts and hired multilingual staff for its malls. An aggressive international marketing effort, incentives for foreign travel agencies, ties with domestic tour bus operators, airlines as well as credit card companies have also been part of the company’s plan to lure overseas shoppers across continents and into its malls.Simon owns around 15 per cent of US malls and 50 per cent of the country’s suburban outlets. A quarter of its revenues are generated in its discount shopping centres, analysts say. Tourists are driving more than half of sales at Simon’s outlets on the outskirts of gateway cities such as New York, and in Florida and California.Overseas visitors start the day off with an empty suitcase and fill it with things they want for themselves and gifts for their families. We wanted to make hands-free shopping easierBut Simon has greater ambitions. Although most operators have remained within US borders or have retreated after unsuccessfully investing abroad, Simon is seeking to expand its shopping mall portfolio into Europe, Latin America and Asia.The company has stepped up its direct outreach to travellers, particularly as they become more sophisticated at scouring the internet for the best deals. “These shoppers will meticulously plan visits to coincide with the holiday shopping season,” said Linda Humphers, editor-in-chief of Value Retail News. “By the time they arrive they know what to buy, where and when.”Among other operators, Glimcher Realty Trust’s Jersey Garden shopping centre has benefited from international travellers to New York, while Macerich’s outlet in Niagara Falls targets Canadian shoppers from across the border.
19;SPG;Simon Property Group;2012-03-09T20:34:16Z;Real estate sector still faces challenges;;It has been a good week to be a landlord.Real estate was the week’s best performing FTSE industry group, with the sector hitting its highest level since October. The catalyst came from France, where US mall developer Simon Property paid $2bn for a controlling stake in Klépierre, the owner of nearly 300 shopping centres and offices across Europe.Though Simon paid a near 20 per cent premium for the Klépierre shares, its price was still around 11 per cent below the group’s last published net asset value. The news helped boost sector peers, which trade on an average discount to net asset value of around 19 per cent.If investors do not take advantage of the discount, predators will, says JPMorgan Cazenove analyst Harm Meijer: “European property companies remain undervalued in our view and M&A is needed to close this valuation gap.”JPMorgan has picked shopping centre owners as the most likely to re-rate. Given the outlook for their tenants, this may seem counter-intuitive. UK retail insolvencies rose 27 per cent quarter-on-quarter in the last three months of 2011, according to Deloitte, which sees little improvement in 2012.Yet earnings for the landlords have so far proved resilient. Results season for the sector last month showed that, while capital values had stalled, vacancy rates were still declining and rental income edged higher.Lessons may have been learnt from the decline of five years ago, says Exane BNP Paribas analyst Nick Webb. “While the outlook for the UK commercial real estate sector is unexciting in the near term, it is also far from disastrous,” he says.“The UK real estate stocks, in general, have insulated themselves from the potentially painful implications of a deteriorated operating environment by maintaining conservative leverage, long-dated financing, avoiding large speculative development schemes and underwriting projects on the basis of cautious rent and yield assumptions.”The contrast to the credit crunch is striking. Then, the threat of disappearing credit lines, pulled projects and rescue rights issues caused UK property stocks to decline 80 per cent in the two years to March 2009.The fears may have abated, but how much has changed since 2009 is open to question. Deleveraging has been much slower than many expected, with around €30bn of European commercial mortgage-backed securities still due to expire over the next two years.Some analysts argue that the real estate companies were effectively bailed out by “quantitative easing”, which boosted the value of real assets by increasing the money supply and stoking inflation expectations.Having been in a “state of paralysis” since 2007, some managements are only now taking a serious approach to cutting debt, says Merrill Lynch analyst Bernd Stahli.“Too many listed property companies over the past decade plastered over the cracks of their weak internal growth dynamics with leverage,” he says. “Some of the managements only did the bare minimum or did nothing and were helped by the bounce in markets – largely pinning their hopes on the return of economic growth to heal naturally their company ills. Hope is not really a strategy.”Hope has so far proved sufficient for investors. None of the major UK real estate developers has cut its dividend, issued equity or sold assets at a sharp discount over the past year.Having been quicker to shore up their balance sheets than European peers, they have been able to take a more patient approach to restructuring. Hammerson said last month that it would sell its London offices, while Segro indicated a shifting focus from warehouses to logistics.Such modest asset sales might not be enough if economic growth falters. The outlook for debt financing remains highly uncertain, as is the outlook for further central bank stimulus, while most analysts expect property capital values to remain flat at best this year. The process of reducing indebtedness could yet fall to shareholders.
20;SPG;Simon Property Group;2012-03-08T20:51:56Z;BNP Paribas sells half its Klépierre stake;;BNP Paribas has sold half its stake in Klépierre, one of Europe’s largest shopping centre operators by sales, to US-based Simon Property Group, as part of its plan to strengthen its balance sheet.Simon Property has agreed to buy the 28.7 per cent stake for €1.52bn, or €28 a share, representing a premium of 20 per cent to Wednesday’s closing price.BNP said it had made a €1.5bn capital gain on the sale and had committed to holding its remaining 22.2 per cent stake for at least a year. It would not comment on whether it intended to sell its remaining stake, which analysts regard as a non-core asset.France’s biggest listed bank by assets said the sale moved it closer to its aim of achieving a tier one capital ratio – a key measure of balance sheet strength – of 9 per cent under the new Basel III regulatory rules, by 2013.Commercial property businesses attract a relatively high capital charge because they are regarded as risky under the new rules. BNP said the sale would contribute 0.32 percentage points to the 9 per cent target, leaving it with another 0.31 points to go.European banks are shedding assets and conserving capital to adapt to the new rules. Last month BNP sold $9.5bn of energy loans to Wells Fargo. The lender says it has been seeking to shed dollar-denominated assets following the withdrawal of investment by US money market funds in European banks last year. It has also sold corporate loan books.Analysts said that the bank should also consider selling down its 5 per cent stake in Axa, the French insurer, regarded as another non-core business which attracts a disproportionately high risk weighting.Before the Klépierre and energy portfolio sales, it had achieved €25bn of its plan to reduce risk-weighted assets by €79bn.David Simon, executive chairman of Simon Property Group, said its stake in Klépierre was “an attractive opportunity for SPG as we seek to broaden our global footprint”.Laurent Morel, chief executive of Klépierre, which owns or manages 271 shopping centres in Europe, said the entry of Simon Property provided scope for cross-selling between the US-based and European retail groups. “For us, it’s very favourable because the acquirer understands our strategy,” he said.Analysts expected more takeovers in the property sector given that many companies are trading at sizeable discounts to net asset value, having been hit by the economic downturn and lower consumer spending.
21;SPG;Simon Property Group;2012-02-19T03:36:19Z;Aiming to be as safe as houses;Caution is key at the First State Global Listed Property fund;Due to a mixed outlook in Europe as a result of the ongoing eurozone crisis, Andrew Nicholas, manager of the £80m First State Investments’ Global Listed Property Securities fund, says he has reduced the fund’s regional exposure in order to lower risk in the portfolio.“The negative economic backdrop is undermining rental growth, banks are reluctant to provide finance and real estate markets are generally sluggish,” he says.“We’re concerned about some property securities companies’ ability to generate increases in income, and make sure that the ones we invest in are able to pay their dividends,” he adds.To make sure that he gets each investment right, Mr Nicholas utilises the help of his 10-strong investment team based in New York, Sydney, Hong Kong and London.Mr Nicholas says the fund’s global mandate has helped it to outperform the IMA Property sector, returning 80.5 per cent over the past three years (to January 31), versus 34.8 per cent for the sector. Some parts of the world, such as Australia, Canada and parts of Asia, have been performing well compared to other markets, he says.However, the fund has underperformed against its benchmark, the UBS Global Real Estate Investors Index, which showed growth of 90.3 per cent over three years.Mr Nicholas has increased his weighting in Australia to roughly 10 per cent, as Australian real estate investment trusts have proved themselves to be relatively defensive in the wake of current volatility, he says. “A dividend yield of 6.5 per cent remains attractive in a low interest rate environment,” he says.He is also overweight Brazil but underweight Japan, Europe and – marginally – the US. He is underweight the UK by roughly 1 percentage point, as he does not expect a recovery there “anytime soon”.“Demand for German residential property and all sectors in Switzerland remains high. However, city markets such as Paris, Brussels and Amsterdam are under pressure,” Mr Nicholas says.“The London market is also in relatively good health, although demand is slipping in the office market because of job losses in the financial sector. For instance, we owned a London property specialist which we thought got a bit overvalued, so we pulled back.”His favourite areas are retail and office property, which make up 35.1 and 18.2 per cent of the portfolio, respectively.At a stock level, he is particularly positive about the prospects for companies such as Simon Property, a US commercial real estate company that is the country’s largest real estate investment trust, and is his top holding at more than 7 per cent.However, the remaining nine holdings in the top 10 have less than half this weighting, as Mr Nicholas continues to err on the side of caution.“In general, property markets have fallen since 2007/08, and it’s pretty hard to say when they will bottom out. The asset class lacks a catalyst for strong performance at the moment because of concerns about the outlook for the global economy.“However, we believe that listed property markets are attractively valued following significant falls and offer good opportunities for the long-term, as development pipelines are limited and in some markets rents are increasing slightly.”Simona Stankovska is features writer at Investment Adviser, an FT publication
22;SPG;Simon Property Group;2012-01-15T14:25:47Z;Value Retail bucks eurozone gloom;;Bargain-hunting tourists from emerging markets have powered a 20 per cent rise in sales of cut-price designer goods for Value Retail, the European outlet chain.Best known for its Bicester Village outlet in Oxfordshire, which ranks as the UK’s third most popular tourist attraction, Value Retail achieved record sales of €1.5bn across its nine outlet villages in 2011 including those in Ireland, Spain and Italy.Despite the wider economic woes of the eurozone, tourists from Asia, Latin America and Russia are responsible for the lion’s share of the sales growth, snapping up discounted surplus products from an array of designer brands including Burberry, Versace and Armani.“In spite of the economy, one of Europe’s growth industries in the next five years will clearly be tourism,” said Scott Malkin, chairman of Value Retail. “Those who embrace the opportunity will triumph.”Kildare Village, its Irish outlet, recorded a 23 per cent jump in 2011 sales after spending from non-EU shoppers rose 38 per cent, according to tax reclaim analysis conducted by Global Blue. Mr Malkin said the Irish government’s relaxation of Chinese visa restrictions and Ethiad, the Middle Eastern airline, introducing direct flights to Ireland from Abu Dhabi were key factors behind the rise.In Spain, its La Roca village in Barcelona and Las Rozas outlet in Madrid both recorded a 60 per cent jump in sales to non-EU shoppers in 2011, who spent an average of €261 each. Tax refund data show sales to Brazilian customers in Spain rose 138 per cent and sales to Venezuelan customers increased 99 per cent in the period.The Fidenza Village in Milan saw a 71 per cent increase in sales to non-EU shoppers, who spent an average €370 each. Mr Malkin said Chinese, Russian and Middle Eastern tourists were driving the rise in Italy.At Bicester Village, where 40 per cent of customers come from outside the EU, total sales rose 30 per cent with Chinese shoppers accounting for half of the tax-refunded sales.The private company, which operates the centres, is owned by management and property investors with stakes in its outlet villages, including Hammerson, Simon Properties, Deutsche Bank and Dutch pension fund APG.Since 2007, Value Retail has seen gross sales at its outlets rise by “at least 20 per cent” every year, and Mr Malkin is confident this level of growth can be sustained by rising numbers of international tourists. “We don’t see our outlets as shopping centres, but as high quality tourism destinations,” he said.However, he was critical of London’s “inhospitable” attitude to tourists in its Olympic year. “The Hammersmith flyover is a terrific loss of face for Britain,” he said, adding that passengers from Heathrow spent hours stuck in traffic before entering the “parking chaos in Westminster”.Combined with tougher visa restrictions and fees than other European countries, he said: “The message [the UK] gives to tourists is we don’t want you, and you’re not welcome.”
