;Ticker;Nombre_Completo;Date_Time;Titular;Subtitular;Texto
38;SPG;Simon Property Group;2010-12-15T17:51:00Z;CSC spurns £2.9bn bid approach from Simon;;Capital Shopping Centres has rejected the £2.9bn takeover bid from US rival Simon Property Group but has been forced to delay a key shareholder vote over the contested acquisition of Manchester’s Trafford Centre.The US shopping mall operator on Wednesday said it would be willing to offer 425p a share for CSC if certain conditions were met, including the non-completion of the £1.6bn acquisition of the Trafford Centre from Peel Holdings and satisfactory due diligence.CSC, the largest owner of regional shopping centres in the UK, this afternoon rejected the indicative offer as “another attempt by Simon to frustrate the Trafford Centre acquisition without putting forward a proper proposal”.The board said that 425p “very substantially” undervalued the company and its prospects, and questioned the need for further due diligence and conditions. It has initiated a discussion with the Takeover Panel to establish a latest date and time by which Simon must make a formal offer.It added that it would postpone an extraordinary meeting of CSC shareholders to vote on the Trafford Centre deal until late January.In a letter to CSC’s board, David Simon, Simon’s chairman and chief executive, claimed that other shareholders were opposed to the Trafford Centre deal. “We believe that we [Simon and the CSC board] should work together to announce a recommended offer,” he said.Simon, which is a 5 per cent shareholder in CSC, said it was finalising a bridge loan facility worth about £3bn for the transaction. The deal, which would be worth £2.94bn, would also need approval from Simon’s board and shareholders.Shares in CSC rose sharply to 416p, having opened at 396p, in afternoon trading in London on Wednesday following disclosure of the approach. Analysts were still sceptical of the bid being carried at 425p, however. Nomura and JPMorgan both said that the price was too low, in particular for CSC’s large group of South African shareholders.CSC last month announced it had reached an agreement to buy the Trafford Centre for £1.6bn including assumed debt in exchange for shares in the company.The centre, one of the most popular in the UK, is owned by Peel, a family property company controlled by John Whittaker, who would become CSC’s biggest shareholder and deputy chairman with a stake of between 20-25 per cent.Simon said it was concerned that CSC was overpaying for the asset, and objected to the controlling stake that would be assumed by Mt Whittaker. On Sunday, it suggested an alternative financing proposal for the deal that would have given it a dominant stake in CSC but was again rebuffed.CSC was formed earlier this year when Liberty International, a real estate investment trust, split into two companies.
39;SPG;Simon Property Group;2020-04-25T18:31:28+0000;Simon / CSC;US property investor’s offer of cash may be too little too late;A surprise phone call from the office on Sunday afternoon is never a good sign. The culprit over the weekend was David Simon, chairman of the eponymous US property investor, who presented a letter to Patrick Burgess, his counterpart at the UK’s Capital Shopping Centres. He proposed to provide cash for CSC’s £1.6bn acquisition of Manchester’s Trafford Shopping Centre from Peel, entrepreneur John Whittaker’s investment vehicle. In return, Simon’s stake in CSC would increase from 5 to 27 per cent.The catch is that Mr Whittaker does not want cash. Under Peel’s contract with CSC, it receives a 25 per cent stake in CSC and Mr Whittaker will become deputy chairman. Although Simon’s financing proposal looks better on paper – it will buy shares of CSC at 400p, compared with Peel’s valuation of 367p – the cash appears a deal-breaker.In reality the bickering is not over price or the Trafford Centre, but the future ownership of CSC itself. As it stands, Mr Whittaker looks to have the upper hand. First, he has the support of the CSC’s shareholders, who have already subscribed for the £221m equity placement to supplement the Peel deal. Second, rejection of Simon now may well coax out a higher offer if it makes a complete bid for CSC later. To persuade an entrenched Mr Whittaker to sell out, Simon would have to pay a hefty premium – perhaps as much as 20 per cent – over the undisturbed share price of about 380p.Simon’s late offer is the next best thing to an admission it did not act quickly enough to build a cheaper stake in CSC. While that chance may be gone, the experience provides useful lessons: it is called first mover advantage for a reason, and surprise letters are more welcome on a Monday.E-mail the Lex team in confidence
40;SPG;Simon Property Group;2010-12-13T11:37:20Z;CSC rebuffs fresh approach from Simon;;Simon Property Group, the US mall operator bidding for Capital Shopping Centres, has tabled alternative plans that would give it a dominant stake through funding a proposed acquisition of the £1.6bn Trafford shopping centre.However, the CSC board rejected the fresh proposal as “completely impracticable”, promising to stick to plans for a shareholder vote on the acquisition from Peel Holdings next week.In November, CSC, the largest retail property company in the UK, agreed to buy the Trafford Centre in Manchester for £1.6bn in a deal that would pay at least 19.9 per cent of CSC’s equity to John Whittaker’s Peel Holdings.The transaction was opposed by Simon, a 5 per cent shareholder. It instead offered the prospect of a “superior” but unpriced bid for the company. CSC rebuffed the attempt last week and refused Simon further information.On Sunday, the US group presented an alternative proposal that would see CSC raise cash for the acquisition of the Trafford Centre from existing shareholders, including Simon, which would end up with a dominant stake given an offer to support the majority of the raising at a price higher than that agreed with Peel. It said that the earlier proposal remained on the table.The CSC board, which has recommended the purchase to shareholders ahead of a meeting on December 20, rejected the alternative proposals as “incapable of implementation and completely impracticable”. It said that Peel wanted to be paid in shares rather than cash as it aimed to remain an investor in regional malls through CSC.Peel Group said on Monday that it had no intention of selling the Trafford Centre for cash. It said: “This has never been an aim of the group - in spite of the fact that Peel has been advised a cash sale would achieve a higher price. Rather, Peel’s stated objective is to increase and diversify its exposure to the UK shopping centre market via a long-term investment in CSC.”Some analysts expect that this latest development could lead to an indicative offer from Simon, with shareholders expecting a price of at least 400p to begin discussions. Harm Meijier, analyst at JPMorgan, said an indicative offer for CSC had a high chance of appearing, although added an offer including Trafford Centre or the arrival of a third party on the scene was also possible.In a letter to the board on Sunday, David Simon, chief executive of Simon, had said the proposals would overcome concerns about overpaying for the Trafford Centre and ceding significant control to Peel without a premium.Simon has proposed to subscribe for 205.5m shares at a price of 400p per share, representing a 6.1 per cent premium to net asset value. Peel had agreed to take up to 224.1m shares on a blended share price of about 367p. The issue would comprise 153.3m shares, together with £209m of bonds convertible into 52.2m shares.The placing would be subject to a partial clawback of up to 50 per cent in favour of other CSC shareholders. Simon’s minimum resulting shareholding, assuming full clawback, would be 18.4 per cent, but could rise almost 27 per cent if bonds were converted. Simon also asked for a board seat, and said that it would match the Peel standstill requirements.
41;SPG;Simon Property Group;2010-12-08T23:19:48Z;CSC has simply no real reason to do what Simon says;;Capital Shopping Centres – product of the break-up of sleepy Liberty International – is an unlikely headline-maker. But by proposing the first major shares-for-assets deal this cycle to acquire the £1.6bn Trafford Centre, it has woken up not just the property sector but its own 5 per cent shareholder Simon Property Group.The US company’s interest in the UK real estate investment trust appears to offer shareholders an alternative to the Trafford Centre deal, which, once complete, would give the shopping centre’s vendor Peel Holdings a poison pill-shaped 25 per cent stake in CSC.But the Simon proposal looks sketchier by the day and is laden with conditions. The US company has called on CSC shareholders to reject the deal with Peel, but it offers no details of its own bid, having seemingly dropped the cash offer promised two weeks ago. It says it cannot proceed if CSC does not allow more due diligence.CSC’s more passive shareholders would be happy for it to bolster its portfolio with the impressive Trafford Centre. But others are worried about ceding influence to reclusive northern billionaire John Whittaker, Peel’s owner, at a low price. Mr Whittaker will gain his influential position on the register at a discount to net asset value and liquidity in the shares will be cut. While the Simon alternative is ill-drawn, the US company is right that the pricing of the Trafford Centre off a yield of about 5 per cent is full. It would add significantly to CSC’s gross rental income but would have only a neutral effect on earnings per share.But there are reasons why Simon may balk at paying enough to persuade CSC to reconsider its recommendation of the Peel deal. Any bid would have to start above 400p, against Wednesday’s closing price of 386.2p, and some investors would expect 420p. Meanwhile, core South African shareholders’ loyalty to CSC management and the approval of Liberty’s founder Donald Gordon, whose family interests still account for about 14 per cent, stack the December 20 vote in favour of the Trafford Centre purchase.Simon says: open your books. CSC could call the US group’s bluff by doing so. But arguably, there is enough information in the public domain already for Simon to advance an indicative offer. Having recommended the Peel deal and garnered the support of core shareholders, CSC can tough it out and let Simon, its conditions unmet, makes its exit with honour (more or less) intact.Flirting with controversyComplaints about De La Rue’s “failure” to declare sooner that it had received a preliminary approach from Oberthur of France confuse two issues: whether it should have announced the flirtation and whether it should have pursued it.On the former, it seems clear that there was no obligation under takeover rules for the banknote printer to announce that it had an unwanted suitor when the first billet doux arrived from Paris. Courtships can be kept secret as long as they don’t leak. The question is whether last week’s market activity – shares up 15 per cent in three days, accompanied by vague rumours of an approach by a different company – required a statement. But this rally came at the end of a long period of share price decline as De La Rue wrestled with reputational damage, and after an investor roadshow that prompted the issue of a couple of positive analysts’ notes. A tough call, but the requirement to reveal all was not met. You can argue that De La Rue directors, fighting to change a culture of over-zealous secrecy, should have said more, but they did not have to.As for whether the initial flame of interest from Oberthur should have been kept alive, that is a matter the French company will now get to explore direct with De La Rue’s shareholders.When bank duty callsGovernance expert Bob Garratt adds a piquant detail to the debate on the duties of bank directors, following the Financial Services Authority’s non-report on failing at Royal Bank of Scotland.He recalls advising the late Sir Brian Pitman, former head of Lloyds TSB, on the bank’s director development programme. Directors needed to balance three factors, Pitman explained: meeting the reasonable demands of the owners, scrutinising the cost of capital and fulfilling their fiduciary duty to ensure that the bank had a long-term future. This should be the focus of all board decisions.Sir Brian told Professor Garratt that the most difficult task was to manage the perception of “reasonable demands” by the owners. If those demands were seen as unreasonable, directors had only one option: they should resign.CSC: dan.thomas@ft.comandrew.hill@ft.com
42;SPG;Simon Property Group;2010-12-08T15:22:15Z;Simon puts fresh pressure on CSC;;Simon Property Group, the US mall operator, has stepped up its attempt to acquire Capital Shopping Centres, demanding access to the company’s books and threatening to sell its 5 per cent stake if CSC goes ahead with an alternative deal.CSC has agreed to buy the Trafford Centre in Manchester for £1.6bn ($2.5bn) in a deal that would cede at least 19.9 per cent of CSC’s equity to John Whittaker’s Peel Holdings.Simon, a 5 per cent shareholder in CSC, said it intended to make a “superior” bid for the company as long as the acquisition was abandoned.That would mean the takeover of CSC, Britain’s largest mall operator after it demerged from Liberty International earlier this year, by one of the biggest US retail groups.On Wednesday, Simon warned in a letter to the CSC board that the Trafford transaction would destroy CSC’s value and cause Simon to sell its shares. It asked for more information to prepare its bid.The CSC board, which has recommended the Trafford Centre purchase to shareholders ahead of a meeting on December 20, said that it was not appropriate to provide non-public due diligence information without an indicative offer.It added that the Trafford Centre deal was of significant benefit for shareholders, and that the arguments used by Simon were “selective and created an inaccurate representation of the transaction”.Simon said earlier on Wednesday that it was “disturbed and disappointed by the profound value destruction proposed to be inflicted” on CSC and its shareholders. The US group said its biggest problem with the Trafford acquisition was that it would be “transferring significant control to Peel, while failing to extract a premium”.The deal is to be financed through a placing of 62.3m shares at 355p, giving Peel a 19.9 per cent stake in CSC at a discount to its current share price. Peel’s stake could rise to 24.9 per cent if it exercises its convertible bonds, while Mr Whittaker would become CSC’s deputy chairman.Simon warned that the deal would reduce the amount of cash available to shareholders in the form of dividends, and said that, on an annual pro forma basis, the deal would reduce cash flow by £29.6m and increase debt payments.CSC responded that the overall transaction was expected to have a neutral impact on earnings per share in the first full year and on net asset value per share. It regarded the long-dated securitised debt as an attractive component of the transaction, it said, enhancing the overall financial position of CSC and lengthening its average debt maturity.The high quality income stream of the Trafford Centre, it added, would further enhance its overall financial position, and CSC’s dividend policy would be unchanged by the transaction.Shares in CSC fell 21.8p to 386.2p.
43;SPG;Simon Property Group;2010-11-25T22:47:19Z;Capital Shopping could face takeover bid;;Capital Shopping Centres, the UK’s largest shopping centre operator, could face a takeover bid after agreeing to buy the Trafford Centre in Manchester.Simon Property Group, the US mall operator that owns 5.6 per cent of CSC, has called for the deal to be delayed while it prepares a cash bid for the company, CSC said on Thursday.The board instead concluded the agreement with Trafford Centre owner Peel Holdings, subject to shareholder approval, and raised £221.2m ($348.6m) through a placing of 62.3m shares at 355p, 13p below its target price, to fund it. Shares in CSC shares closed up 43.6p, or 13 per cent, at 381p.If the deal goes through Peel will own 19.9 per cent of CSC, rising to 24.9 per cent if it exercises its convertible bonds. John Whittaker, billionaire chairman of Peel, will become deputy chairman of CSC.The deal values the Trafford Centre at just less than £1.6bn, given its £798m net debt. Peel will pay £77.1m in cash and receive 167.3m shares and £209m of convertible bonds.That would accelerate CSC’s move into out-of-town shopping, which would be 64 per cent of assets compared with 52 per cent in June. It would also extend its lead over Hammerson, the second-largest operator of shopping centres.However, while the Gordon family, CSC’s largest shareholder with 14.6 per cent, supported the transaction, Simon Property opposed it.CSC said Simon Property sent a letter on Wednesday about a “potential cash offer for the company at an unspecified premium to net asset value. The letter did not contain any offer or indicative offer nor provide any certainty that an offer would be made”. Simon Property could not be reached for comment.Patrick Burgess, chairman of CSC, said any offer would be discussed at an extraordinary meeting in December.If the Trafford Centre acquisition is approved, CSC would own 14 of the top 25 UK shopping centres, including Lakeside in Essex and the Arndale centre in Manchester.The Trafford Centre is the fourth biggest retail centre in the UK, with 35m visitors annually.Mr Whittaker said Peel would invest equity, assets and expertise “to assist in taking the company forward to new heights”.Peel has been seeking to sell controlling stakes as it moves out of operational management.Bank of America Merrill Lynch and UBS are advising CSC, while JPMorgan Cazenove is advising Peel.
44;SPG;Simon Property Group;2010-11-25T20:35:00Z;Simon / CSC;With a bid by Simon now unlikely, investors face a tough choice;"Only hours away from the four-day weekend, the directors of Simon Property Group, the largest shopping mall owner in the US, rushed a letter to the board of Simon’s British equivalent, Capital Shopping Centres. The message: please stop. Simon, a 5 per cent owner of CSC, was referring to the latter’s equity placement and planned £1.6bn acquisition of the Trafford Centre mall in Manchester. To entice CSC to pause, it added it would consider a cash bid for CSC itself. CSC’s share price, which fell 5 per cent on Wednesday, jumped 14 per cent on Thursday.Simon’s intervention may reflect the limits to growth at home, where its dominance is creating competition issues. Meaningful international expansion requires acquisition of sizeable companies, such as CSC. But the Trafford Centre deal would make a full acquisition of CSC harder. Simon would have to persuade billionaire John Whittaker, who controls Trafford’s owner Peel, to sell. Peel is set to get a 19.9 per cent stake in CSC.But Simon’s directors proved unreachable on the sacred Thanksgiving holiday, so CSC went ahead and raised £221m from an equity placement to help fund the deal; all systems are go. The deal does need shareholder approval at a meeting in three weeks time but, with agreements signed and money now raised, that looks to be a formality.Investors now have a tough choice. The 14 per cent jump in CSC’s share price is predicated on a bid by Simon, itself seemingly contingent on the Trafford deal not going through. Now that it looks as though the deal will be successful, a bid by Simon is unlikely. As the situation may not clear up until Monday at the earliest, short-term investors may wish to use the post-Thanksgiving Friday to take their profits and run.E-mail the Lex team confidentially"
