;Ticker;Nombre_Completo;Date_Time;Titular;Subtitular;Texto
64;XRX;Xerox Corp;2015-08-18T13:23:33Z;Faxes at work: from funky to clunky, but holding on;Not all users are ready to hang up on an apparently outmoded tool of communication;"When reactors at the Fukushima nuclear plant went into meltdown in 2011, operators tried to send a fax to alert authorities in the nearby town of Namie.Receipt of the fax “could not be acknowledged”, plant operators noted in a report a year later, leading to attempts to reach the town by landline, mobile, satellite phone and finally in person. The town had been devastated by the earthquake and tsunami that triggered the Fukushima crisis.The use of faxes at Fukushima — fax messages were also sent to notify officials in Tokyo of the unfolding disaster — is a reminder of the hardiness of an apparently outdated technology.Email may be faster, and cloud-based word-processing systems such as Google Docs better geared to collaboration, but the fax — short for facsimile — survives. It has adapted to the advent of email and has even found at least one new use.Why does the fax survive? The technology’s virtues for those businesses that continue to see a future in the fax is that it is cheap and relatively simple to use, according to a survey by research firm IDC. It is also regarded as more secure than an email for confidential data such as medical records.In an IDC poll of more than 1,000 businesses in the US last September, just over half said fax use in the past year had stayed constant while just under a fifth said it had gone up. Very few said they never used the technology.Peter Davidson, of Davidson Consulting, which researches the fax sector, notes that the ease with which people used to send a fax for, say, notifying someone when they would be back in the office has been transferred to email and text. “But when you send important documents, you want to know [they have] got there, which you can do with the fax. It is also extremely difficult to intercept a fax.” Unless, of course, the interceptor is physically standing next to a fax machine.The changing world of work
The workplace reflects how work and the people doing it are organised. FT writers this week consider four office items and what they tell us about the working environment today:
● personal photographs;
● faxes;
● the desk:
● and voicemailSiddhartha Bhattacharya, head of technology marketing at Xerox, notes that digital signatures in PDFs have been widely adopted, but are not always considered legitimate for contracts: “There are many companies that still require an actual signature on the dotted line.”The fax’s popularity in Japan is associated with the complexity of the writing system — making scanning a written image easier than typing — and the Japanese practice of sending guests a map with invitations.Many Japanese government and political offices still insist on receiving written communications by fax. The document is passed between officials, who may stamp or initial the paper to create a physical record of who has read it.The fax also lingers in Israel, a country associated with technological innovation. While business use of faxes has declined in Israel, government offices prefer faxes for transmitting documents. Shally Tshuva, a partner at consultancy Deloitte Israel and author of a report on the adoption of technology in the country, says: “There are two issues. It is partly to be sure that a document is authentic. The second is whether digitisation helps those who are already at the [socio-economic] high end, and widens gaps.”The perception among some in the Israeli public sector, he says, is that poorer social groups may be less adept at scanning and emailing documents, while even blue-collar workplaces such as garages will still have a fax machine.Faxes became ubiquitous in business life in the 1980s, but the technology has been in use since the early 20th century when Arthur Korn, a German physicist, first used telephone lines to relay images. The technology was quickly adopted by the military to transmit maps and weather charts, and by newspapers to send photographs.Xerox launched the first commercial fax machine in 1964, followed by other companies, and over the subsequent decades faxes became an essential business technology.More generally, however, the fax machine has been steadily supplanted by computers with internet connections. The UN’s telecoms body, the ITU, stopped gathering data about faxes in 2000 although it notes that “some countries have a regulatory or cultural mindset to better accept fax rather than emails.”As communications shift to faster technologies, there is a competitive cost to companies that continue to rely on physical paper trails. Deutsche Post DHL is overhauling the IT system at its freight forwarding division, where the DHL unit makes heavy use of paper because it grew by acquisition, which involved knitting to­gether companies with their own IT systems.Stephen Furlong, analyst at Davy, says that has affected its competitiveness with rivals, because making information flow efficiently is particularly crucial in decentralised businesses such as logistics: “The more efficient your information flow, the more you can cut costs and make the right decisions for customers.”As well as slowing the conduct of business compared with email, fax mach­ines can be irritating to operate. When they were in heavy use, they were a byword for frustration: a fax might not go through at the first at­tempt, the message might be blurred or faded. In 2002, a fuzzy fax was blamed for a crucial misunderstanding over an order for Germany’s Fuchs tanks by Israel.However, the internet has not entirely superseded the fax; in fact, it has created at least one new use for it, which is as a way of linking businesses with high and low technology. Customers placing an order on an online food delivery portal can have their message transmitted to a restaurant by fax. The faxed order can then be handed on physically to a delivery man who does not have a fax machine, and may not have a smartphone.On the one side there are the smart chaps in Berlin. And on the other are people who need delivery slips and bills on paperThe same logic applies to a big manufacturer dealing with multiple suppliers whose technology may use differing technology levels.Martin Hager, chief executive of Retarus, a Munich-based company that manages cloud-based communications services including faxes, says: “With a fax one doesn’t need to know who’s at the other end, or what technology they have. You just need a telephone number, and the document comes out the other side — whether as paper or as an entry into a computerised scanning system.”The use of faxes to bridge high and low tech is not new in itself — faxing lunch orders from an office to a local sandwich shop was familiar enough in the 1980s — but the combination of fax and the internet helps support the creation of new online marketplaces.As internet businesses increasingly set up in sectors such as domestic cleaning or laundry services, where there are differing levels of technology, the fax has been given a new lease of life.Customers can place orders on a smartphone, via businesses in Berlin or London, but those orders are often carried out by contractors who need faxed documents.“On the one side there are the smart chaps in Berlin,” says Mr Hager. “And on the other are people who need delivery slips and bills on paper.”"
65;XRX;Xerox Corp;2015-06-17T11:38:26Z;Let algorithms show if they can make better hiring choices;It is not just our biases that get in the way but that past performance cannot predict results;"We reported this week that top professional services firms in London, Scotland and the US practised widespread discrimination, shutting out recruits who did not belong to a select social and educational group.Some of the firms had made an effort to look beyond top universities. London law and accountancy practices had offered internships and mentoring to school and university students from less privileged backgrounds, according to the UK’s Social Mobility and Child Poverty Commission, which studied the situation in England and Scotland.But that did not significantly raise the number of trainee lawyers and accountants they hired from those groups. The problem was that, faced with a final set of potential recruits, too many interviewers opted for people with whom they felt comfortable.One called it the roommate test. “Are they someone you want to share a room with?” Another said: “I’m very interested in people who’ve gone travelling” — which, as the Social Mobility Commission pointed out, required money.Some firms said they did not have the time to search beyond the top universities, which had already selected the best students. “Number one people go to number one schools,” said one US lawyer, quoted in a book called Pedigree: How Elite Students Get Elite Jobs.An interviewer at a London law firm agreed that it was statistically highly probable that there were able recruits at non-elite universities, but asked: “How much mud do I have to sift through . . . to find that diamond?”But, even after dredging familiar waters, many of the firms did not seem happy with what they had found. The UK commission reported that many of the recruiters said the people they thought would be the best lawyers and accountants often did not end up having very successful careers.No one who has ever done any hiring should be surprised by this. My own record in appointing people is mixed: some worked out, others did not.It is not just our biases, unconscious or not, that get in the way. It is that people who succeed in one job do not necessarily thrive in the next one.This is particularly true when people move into management. Those who seemed decisive flounder when having to deal with so much more information. Some, who seemed adept at talking people round, become authoritarian and inflexible when, as bosses, they encounter opposition.As the investment advice says: past performance is no guarantee of future results.This is why, while I am sceptical about some of the claims of big data enthusiasts, I am prepared to give a hearing to those who say algorithms would make better hiring decisions than humans.Xerox Services teamed up with Evolv to help it recruit people for its call centres. Evolv used data on what made people leave their jobs to help Xerox reduce staff turnover.People who belonged to fewer social networks were more likely to settle down at work. Xerox found that staff attrition at some call centres fell by 20 per cent. Other findings accorded with mine: experience was no predictor of how a candidate would perform.The data-based process “actually opens up doors for people who would never have gotten to interview based on their CV”, Xerox said.Could it work for more senior jobs? Laszlo Bock, Google’s head of “people operations”, insists it could. You do it “by looking at large sets of data and inferring relationships, similarities, and predictors of success and failure”, he wrote in a LinkedIn post.Instead of looking for people with four years of accounting experience, you search for those with “ability to learn quantitative methods combined with a zeal for catching and correcting the smallest of errors, persuade with data, and thrive in social settings”, then use the data to tell you what sorts of people are likely to have that.I still see problems: interrogating the data still requires those fallible managers to understand and articulate what they are looking for.Also, humans are not aeroplanes or even driverless cars. Doing their jobs requires them to interact with other quirky unpredictable people.But let us see more experiments in data-driven recruitment and compare the outcome with what we have now. We can look at whether the results are any more impressive than our current flawed methods — and whether we uncover any hidden diamonds.michael.skapinker@ft.com
Twitter: @Skapinker"
66;XRX;Xerox Corp;2014-12-19T22:37:59Z;Nike disappoints amid Fed-fuelled rally;Future orders fall short of expectations for sportswear group;Nike shares fell out of favour after future orders at the US sportswear group disappointed Wall Street, going against the trend in stronger overall US equities markets.Although future orders only just fell short of expectations, it was enough to hit a stock that has comfortably outperformed the S&P 500 this year. The shares fell 2.3 per cent to $94.84, leaving their gain for the year at 20 per cent.Nike’s quarterly results, however, underlined why investors had chased the shares higher this year and were setting higher expectations. Profits climbed 23 per cent and revenues rose 15 per centThe slump in the oil price provided a boost for Carnival, the world’s biggest cruise operator.Shares rose almost 1 per cent to $44.79 as the company behind the eponymous brand, as well as Costa Cruises, said it expected its fuel bill to drop by $475m in its current financial year, which began at the start of the month.This was worth 61c a share in full-year profits, according to Carnival, which now forecasts will be between $2.30 and $2.60 a share. Wall Street was expecting $2.36, according to a poll by Bloomberg.Cheaper oil has contributed to a 30 per cent rally in Carnival shares since mid-October.Arnold Donald, chief executive, said the company had “worked hard to contain costs and achieved an almost 5 per cent reduction in fuel consumption for the year as we continue to implement energy conservation measures”.Carnival has been spending heavily on marketing to arrest setbacks that have damaged its reputation, most notably the Costa Concordia disaster off the Italian island of Giglio in 2012.The company said profits for the year to November 30 rose to $1.2bn, or $1.59 a share, from $1.1bn, or $1.39, in the year-ago quarter.Shares in Ally Financial surged more than 2 per cent to close at $23.25 after the US Treasury sold its remaining 54.9m shares at that price, against the previous closing price of $22.75 on Thursday.The sale will allow Ally to exit the troubled asset relief programme, which was put in place during the financial crisis.Xerox shares also received a fillip from news that the company had agreed to sell its information technology outsourcing arm to the French IT services company Atos SE for $1.05bn.Xerox shares rose as much as 2.2 per cent to $14.20 after the group said it would divest a slower-growing unit to focus on building up its business-process outsourcing and document outsourcing operations.The company has seen its market value rise from a low of $10.26 in February this year as it restructures.Overall, US equity markets extended their gains, after a surge over recent days in the S&P 500 benchmark index sparked by the US Federal Reserve’s latest policy statement.The S&P had climbed 4.5 per cent over the previous two sessions, lifted by the central bank’s commitment to take a “patient” approach towards raising interest rates, while signalling it was on track to boost rates in 2015, providing more certainty for investors.The S&P 500 index gained 0.5 per cent to 2,070.65 by the end of Friday’s session, while the Dow Jones Industrial Average rose 0.2 per cent to 17,804.80, and the Nasdaq Composite climbed 0.4 per cent to 4,765.38.
67;XRX;Xerox Corp;2014-11-28T15:52:39Z;Harriet Green and the dangers of the glass cliff;;Harriet Green, ex-chief executive of Thomas Cook, certainly broke through the glass ceiling on her way up to the top of corporate Britain. But was her abrupt departure from the travel group this week further evidence of the existence of a “glass cliff”, off which female CEOs are often said to plummet?Research by Strategy& (formerly Booz & Company) earlier in the year suggested female chief executives were more likely to be forced out of their roles than their male counterparts. The consultancy indicated that this might be because companies that wished to appoint a woman to the top job took more of a risk. The other reason cited for the disparity was that male-dominated boards might be less supportive of female chief executives.The “glass cliff” was a phrase coined some years earlier, in reference to the challenge assigned to women who take the helm at companies in crisis. Why do women find themselves in these precarious positions? Academics Susanne Bruckmüller and Nyla Branscombe ran experiments a few years ago that seemed to illustrate a “status quo bias” among people considering whether a woman or a man would be best placed to run a company. As they wrote in Harvard Business Review in 2011:As long as a company headed by men performs well, there’s no perceived need to change its pattern of male leadership. Only if male leaders have manoeuvred an organisation into trouble is a switch to a female leader preferred.Women leaders, according to the glass cliff theory, often seem set up to fail. I remember Jack Welch voicing his fear more than 10 years ago that if Patricia Russo, then at Lucent (later Alcatel-Lucent), Carly Fiorina, then at Hewlett-Packard, and Anne Mulcahy of Xerox did not overcome the challenges they had been handed, perceptions they had failed would set back the cause of senior women executives. In the end, of the three, only Ms Mulcahy succeeded in backing away from the slippery slope.The Bruckmüller-Branscombe description certainly fits Thomas Cook in 2012, when Ms Green was appointed. The company, previously led by men, was facing a cash crisis and the share price stood at less than 19p. But Ms Green’s subsequent trajectory as chief executive looks nothing like that of Ms Russo or Ms Fiorina – both of whom left when their companies’ share prices were struggling. Although Thomas Cook this week forecast more moderate growth, its shares were trading near 140p ahead of Ms Green’s exit. So far, we know only that the chairman says the board (for the record: three women, four men, excluding executive directors) agreed unanimously on Tuesday to enact a transition plan.Ms Green has proved a forthright promoter of her own image as a tough boss – notably in a colourful interview with The Times a month ago, conducted in part during an early-morning workout at the gym in Brown’s hotel. Perhaps the most surprising part of this week’s unexpected events is that, until Tuesday, she looked like the woman most likely to shatter the glass cliff utterly.
