;Ticker;Nombre_Completo;Date_Time;Titular;Subtitular;Texto
112;ABBV;Abbvie Inc;2014-07-31T17:30:41Z;Drug pricing: Bitter pill;A hepatitis treatment’s soaring price is prompting the debate that most alarms the industry;"When delegates turned up for a big healthcare conference at New York’s plush Waldorf Astoria hotel in February, they were met by placard-wielding activists.That in itself was not unusual. Big pharma has long been the subject of angry campaigns over issues such as animal testing and access to Aids drugs in Africa.Yet the focus of these protesters was something different: the high cost of a new hepatitis medicine in the US.This small-scale insurrection on a Manhattan sidewalk has since turned in­to something approaching a national rebellion against Gilead Sciences and its drug known as Sovaldi, which costs $84,000 for a 12-week course of treatment. Scrutiny increased further last week when the California-based biotech company announced that sales of the medicine had reached $5.7bn after six months on the market, making it the most successful drug launch on record.But while investors were celebrating – Gilead’s share price is up 50 per cent in the past year – many in the industry were nervously monitoring the growing political debate over drug pricing that Sovaldi has triggered.Last month two senior members of the US Senate finance committee wrote to John Martin, Gilead’s chief executive, asking him to justify Sovaldi’s price and expressing “serious concerns about the extent to which the market for this drug is operating efficiently and rationally”.Such an intervention is unusual in the US, which, alone among big developed economies, has no government powers to regulate pharmaceutical pricing. The letter from Ron Wyden, Democratic chairman of the Senate finance committee, and Charles Grassley, a Republican, has raised questions over whether this laisser-faire approach could be destined to change.After a slowdown since the financial crisis, US healthcare costs have started to rise again. At about 17 per cent of gross domestic product, they are the highest in the developed world. Pharmaceuticals account for only one in every $10 spent on health but they are among the most visible to patients because of the steep co-payments demanded by insurers.President Barack Obama’s healthcare reforms have increased incentives for healthcare providers to control costs as insurance coverage is widened. But Sovaldi has shown that, when a new medicine arrives with high demand and no competition, there is little to stop drugmakers charging what they wish.“Other countries have come up with frameworks to make drugs affordable for people whereas in the US it has always been a case of what the market will bear,” says Steve Miller, chief medical officer of Express Scripts, one of America’s biggest prescription management companies. “We think the market is no longer bearing up.”For the pharmaceuticals industry, there is nothing that causes greater anxiety than the idea that its cherished pricing freedom in the US could be imperilled. Annual US per-capita spending on pharmaceuticals is $1,010, more than double the $498 average among members of the OECD.This high US spending underpins the economics of the global pharmaceuticals industry. More than half of all sales from new drugs launched between 2009 and 2013 were made in the US, compared with 23 per cent in Europe.Seldom has the international disparity in drug pricing been starker than in the case of Sovaldi, a drug hailed as the biggest breakthrough in hepatitis C treatment since the virus was discovered in 1989. In more than nine out of 10 cases, the treatment will lead to complete cure within 12 weeks.Gilead agreed to sell the drug in Egypt, the country with the world’s highest prevalence of hepatitis C, at a 99 per cent discount to the US price. The move was aimed at heading off the kind of controversy faced by drugmakers in the 1990s when the industry was accused of keeping HIV medicines out of reach of poor Africans.However, while few would begrudge efforts to make the medicine more affordable in the developing world, many Americans have been asking why, if Gilead can afford to price Sovaldi at $11-a-pill in Egypt, does it charge $1,000 in the US.“The answer is because it can,” says Dr Miller, one of Gilead’s fiercest critics. “Sovaldi has shone a light on the fact America is subsidising healthcare innovation for the rest of the world.”US drug prices are high because, unlike in most other countries, the government does not use its purchasing power to contain them. There is nothing like the UK’s National Institute for Health and Care Excellence (Nice), for example, which acts as a gatekeeper for new medicines.Before a treatment is recommended for use in Britain’s National Health Service, its manufacturer must convince Nice that the product represents value for money.The result is that fewer new drugs are adopted in the UK and those that are command a lower price than in the US. Gilead, for example, has priced Sovaldi at a 30 per cent discount to its US price in Britain. Yet even that has not been enough to convince Nice of its clinical value. The agency told Gilead in June to come back with more data to support its case for the drug. France, too, is playing hardball.To many in the US, the notion of government rationing drugs and regulating prices is wholly un-American. Republicans have long characterised Nice as a “death panel” that epitomises all that is wrong about European socialised healthcare. A study sponsored by the Pharmaceutical Research and Manufacturers of America, the industry lobby group, in July showed that almost 80 per cent of cancer drugs reviewed by Nice in the past seven years have had some type of restriction placed on access. This, said the lobby group, could explain why the average five-year survival rate for US breast cancer patients is higher, at 90 per cent, than the UK’s 78 per cent.Yet the fact that the US industry issues warnings against “centralised, one-size-fits-all value assessments” across the Atlantic exposes its concern that such concepts could be gaining ground in the US.Nobody expects a US equivalent of Nice or anything similar to be adopted in the foreseeable future. Political resistance is too strong and the health system too fragmented and privatised. However, there are increasing signs that politicians and health officials are taking a harder look at how to rein in rising costs.“We can’t ignore the elephant in the room,” says Karen Ignagni, president of America’s Health Insurance Plans, which represents health insurers. “The Sovaldi case brings all these issues together in a very stark way: How much is too much? Can this price be sustained? What happens if it blows up your budget? This is a debate we’re just on the cusp of having in our society.”Sovaldi is not the most expensive drug on the market. What sets it apart is the size of the patient population it aims to treat. There are an estimated 3.2m people in the US infected with hepatitis C, four times more than the number with HIV.So far 70,000 patients have been prescribed Sovaldi but its impact is being felt throughout the healthcare system. WellPoint, one of the biggest US health insurers, for example, spent $50m on hepatitis C treatment in the first quarter – as much as the whole of last year. State governments warn that their social healthcare budgets risk being crippled. Louisiana would have to spend more than its entire transportation budget if everyone who was eligible was treated with Sovaldi, says Express Scripts.While Sovaldi may be an exceptional case, there is a growing number of expensive speciality medicines emerging from laboratories that collectively promise to put further stress on budgets. As mass-
market blockbusters, such as statins and beta-blockers, have gradually lost patent protection, many drugmakers have refocused on speciality treatments. These are often cutting-edge biological drugs that draw on breakthroughs in genomic science over the past decade to target rare diseases and subtypes of more common conditions, such as cancer. In order to recoup high development costs from relatively small patient groups, prices tend to be very high. Take, for example, a cystic-fibrosis drug, called Kalydeco, made by Vertex Pharmaceuticals, which costs $300,000 a year.Increased spending on speciality medicines explains why the average price of branded medicines in the US has almost doubled since 2008, according to Express Scripts. The overall drugs bill has been growing more slowly because of the falling price of generic medicines, which represent 86 per cent of all US prescriptions.However, rising use of speciality products is expected to create more upward pressure in future. While they account for less than 1 per cent of total prescriptions, they drain more than a quarter of pharmacy spending.Gilead and other drugmakers argue that their prices are justified both by the need to provide a return on investment in research and development and by their long-term value to patients. John Castellani, president of the PhRMA, says that, by curing hepatitis C, Sovaldi has the potential to save the US healthcare system $9bn a year in the long run by reducing hospitalisations from the liver disease that often results from the virus.“It is penny wise and pound-foolish to focus solely on the price of a new medicine while completely ignoring the value it provides to patients and the healthcare system broadly,” says Mr Castellani. A broader debate is needed, he adds, about “outdated” insurance models that force patients to pay an ever-growing share of prescription drug costs while shielding them from the typical $5,000-a-day cost of hospitalisation.However, industry leaders accept that they have a role to play in bringing healthcare costs under control. It has become almost obligatory for pharma executives to espouse a shift towards more “value-based” pricing models that reward drugmakers based on measurable health outcomes. This is code for acknowledging that the era of overpriced “me too” drugs is drawing to a close, while making clear the industry expects to be rewarded for true innovation.“If you are not number one or two to market or you do not have a demonstrable clinical advantage over rival products you are going to be up against it,” says Daniel Hoffman, president of Pharmaceutical Business Research Associates, a consultancy.This trend is already visible in the most competitive parts of the market. GlaxoSmithKline, the UK drugmaker, last week issued a profits warning in large part because of increased pricing pressure on respiratory drugs in the US. Sir Andrew Witty, chief executive, said several factors, including consolidation within primary care networks, were eroding pricing power. The Obama administration’s Affordable Care Act had “added some fuel to this fire” by making the whole system more cost-conscious, he added.The question is whether such pressures will influence pricing of high-margin speciality drugs such as Sovaldi. A big test will come in the months ahead when AbbVie and
Bristol-Myers Squibb are expected to launch rival hepatitis C medicines. If they significantly lower prices, the controversy may be quickly forgotten and the primacy of market forces in the US healthcare system reasserted. If not, calls for some form of government intervention are likely to grow. “It will tell us,” says Mr Hoffman, “whether this is a competitive market or a cartel.”Innovation: A young company reshaping the industryCritics have cast Gilead Sciences’ $1,000-a-day pricing of its Sovaldi hepatitis C medicine as an example of drug industry greed at its worst, writes Andrew Ward. To others, it shows how market forces are the only reliable way to drive medical innovation. Founded in 1987 by a 29-year-old medical doctor with a Harvard MBA, Gilead is among a new generation of young US biotech companies that are reshaping the pharmaceuticals industry.It is already bigger by market capitalisation, at $143bn, than some traditional pharma mainstays, including GlaxoSmithKline and AstraZeneca.This reflects the phenomenal success of Sovaldi, on top of breakthrough treatments for HIV and flu. Sovaldi is on course to generate more than $10bn of sales in its first year on the market. The medicine is the first of a new category of hepatitis C drugs that treat the virus more effectively, more quickly and with fewer side effects than previous therapies.While Sovaldi shows how much of the best drug innovation comes from biotech companies rather than traditional big pharma, Gilead’s own scientists cannot claim credit. The medicine was acquired in 2011 through an $11bn acquisition of Pharmasset, founded by Sovaldi’s inventor, Egyptian-born Raymond Schinazi. The speed with which Gilead has started to recover that investment is cited by critics as evidence that its drug is overpriced.Addressing investors last week, John Milligan, the company’s chief operating officer, said the full value of Sovaldi was only now becoming clear. Patients who previously had faced up to a year of treatment with nasty side effects and patchy success rates are now cured within 12 weeks in most cases.“I don’t think anybody disagrees with the fact that Sovaldi is a remarkable drug,” he said. “It’s an outlier because we are curing people of a horrible disease in a very rapid timeframe, and that’s a very unusual thing for payers to think about.”Gilead’s success has intensified the race among rivals to catch up. AbbVie and Bristol-Myers Squibb are nearing market with similar drugs, and in June Merck & Co paid $3.85bn to buy Idenix, a hepatitis C specialist, to strengthen its position."
113;ABBV;Abbvie Inc;2014-07-29T17:01:20Z;Windstream soars on Reit spin-off plan;;The US telecoms sector climbed on Tuesday after a small wireline network announced plans to spin off part of its business into a real estate investment trust, establishing a new way for rivals to derive value from assets.Windstream, based in Little Rock, Arkansas, said it would turn its existing fibre and copper network, as well as other fixed real estate assets, into a publicly traded Reit, allowing the new company to avoid federal income taxes.The approach has been tried by cellular tower operators like American Tower, but not by a larger cable or fibre optic network owner.Windstream said its board of directors had received a favourable private letter ruling from the Internal Revenue Service, although it will still require regulatory approval.“Given the IRS approval, we expect other companies may explore the possibility of spinning off their wireline assets into a similar structure,” Mike McCormack, an analyst with Jefferies, said.Analysts with Credit Suisse said AT&T and Verizon were likely evaluating a similar strategy, but would “have the advantage of waiting to see how the Windstream transition plays out”.The conversion to a Reit comes as many companies, particularly those in the pharmaceutical sector, evaluate means to reduce taxes. Several, including AbbVie, are hoping to redomicile overseas to reduce their tax bill.The news sent shares of S&P 500 listed telecom operators broadly higher. Windstream soared 12 per cent to $11.83, AT&T rose 3 per cent to $36.59, Verizon advanced 1 per cent to $51.97 and Telephone & Data Systems increased 5 per cent to $25.92.UPS was under pressure after the company, which together with FedEx and Deutsche Post’s DHL dominates the business of shipping parcels around the world, cut its profit forecast for the year as it invests in its business.The company said it would expand operations on the day after Thanksgiving in the US as part of a $175m increase in operating expenses. UPS executives hope to avoid a surge in demand last year that left it incapable of meeting delivery targets.Earnings per share will now be between $4.90 and $5.00 this year, UPS said, compared to a previous forecast of $5.05 to $5.30 a share.Shares of UPS are among the worst performing on the Dow Jones transport index this year. The company declined 4 per cent on Tuesday to $98.86 while rival FedEx dropped 2 per cent to $147.14.A 17 per cent slide in second-quarter profits and tepid third-quarter earnings guidance from Herbalife sent its shares 14 per cent lower to $58.35.Net income at the nutrition supplement company declined to $120m, or $1.31 per share, shy of Wall Street expectations. Sales climbed 7 per cent from a year earlier to $1.3bn.Herbalife has sought to keep shareholders on board amid its battle with Mr Ackman, the founder of the Pershing Square hedge fund who claims the company is a pyramid scheme.The company, which denies Mr Ackman’s allegations, accelerated its $1.5bn share buyback plan earlier this year.Both the US Department of Justice and the Federal Bureau of Investigation have launched a probe into the allegations.Darden shares rose 4 per cent to $46.88 after the company said Clarence Otis, who has served as Darden’s chief executive for nearly a decade, would step down at the end of the year amid an ongoing tussle with activist investor Starboard Value.The shake-up within Darden’s executive suite came as the company entered settlement discussions with Starboard regarding the firm’s proxy contest.Darden, which owns the Olive Garden and Longhorn Steakhouse chains, said it would trim the list of nominees to its board of directors to ensure at least three Starboard nominees are elected at the company’s annual general meeting in September.Overall, US equity markets trended lower despite rising consumer confidence figures. The S&P 500 fell 0.5 per cent to 1,969.95 while the Dow Jones Industrial Average declined 0.4 per cent to 16,912.11. The Nasdaq Composite fell 0.1 per cent to 4,442.70.eric.platt@ft.comTwitter: @ericgplatt
114;ABBV;Abbvie Inc;2014-07-27T20:00:33Z;Hepatitis C researchers battle to ‘nuke’ the competition;Search for improved therapies intensifies;Idenix has fewer than 100 employees and no products on the market. So what was it that persuaded Merck to pay $3.85bn – more than triple Idenix’s market capitalisation before the deal – to buy the Boston-based biotech company in June?The answers lay in Idenix’s portfolio of experimental treatments for hepatitis C, widening Merck’s arsenal in the battle for supremacy over one of the hottest areas of drug development.Little doubt exists over who leads the race. Gilead Sciences’ Sovaldi medicine had sales of $5.8bn in its in its first six months on the market this year, a record for a drug launch.Gilead’s success has encouraged a cluster of other companies to step up their pursuit of therapies for a condition affecting 150m people worldwide. Analysts say the market could be worth up to $20bn a year by the decade’s end.Along with Merck, others in the chasing pack include AbbVie, Achillion, Bristol-Myers Squibb and Johnson & Johnson. While the burst of innovation around hepatitis C has stoked debate over pricing because of the $1,000-a-day cost of Sovaldi, it is an example of strong commercial incentives driving medical breakthroughs.The rush of new drugs promises to transform treatment of a disease for which previous therapies had low success rates and unpleasant side effects.“The development of direct-acting antiviral agents has revolutionised hepatitis C treatment by offering genuine prospects for the first comprehensive cure of a chronic viral infection in humans,” say Harvard liver specialists Raymond Chung and Thomas Baumert in the New England Journal of Medicine. “It may now be possible to imagine the global eradication of chronic hepatitis C.”Previously, patients faced up to a year of medication on a pill called ribavirin and injections of interferon, which boost the immune response to hepatitis C but cause flu-like symptoms.Direct-acting antiviral agents offer prospects for comprehensive cureMany people failed to complete the course. Even for those who did, the success rate was less than half in cases involving genotype one – the hardest-to-treat form of the disease – and no more than 80 per cent for other genotypes.A step forward came from 2011 with the new so-called protease inhibitors from Merck, Vertex Pharmaceuticals and, more recently, Janssen, part of Johnson & Johnson. These drugs, taken in combination with ribavirin and interferon, nudged cure rates up significantly but the nasty side effects remained.The big breakthrough came in December with the US regulatory approval of Sovaldi. The outcome was treatment time down to as little as 12 weeks with success rates of above 90 per cent – even for those with genotype one. Sovaldi, also known as sofosbuvir, is the first of a generation of hepatitis C drugs called nucleotide analogue inhibitors, or “nukes”.Gilead’s medicine still leaves room for improvement, however, because many patients must still take it together with interferon. The race is on to develop the first “nuke” that eliminates the need for injections and older drugs altogether.Analysts say Gilead remains in the lead, with the US Food and Drug Administration expected to rule by October on its application for a once-a-day, all-oral pill combining Sovaldi with another new medicine called ledipasvir.Others are scrambling to catch-up. AbbVie, for example, filed in April for FDA approval of an interferon-free combination, including an experimental “nuke” that cured more than 90 per cent of patients in trials. Merck and Bristol-Myers Squibb have revealed some strong trial data this year.Many doctors, meanwhile, have ditched interferon by prescribing Sovaldi with Janssen’s Olysio protease inhibitor, even though the combination is not officially approved by the FDA.“If you have to have Hepatitis C, now is the time to have it,” says Douglas Dieterich, a liver specialist at the Icahn School of Medicine at Mount Sinai Hospital in New York.“We have these marvellous drugs we can treat you with right now, without side effects,” he adds. “And this time next year, we’ll have another round of drugs available.”The revolution in hepatitis C drugs has not been without setbacks and controversy. In addition to the political furore over pricing, Sovaldi is the subject of several patent disputes. AbbVie and Merck are among those to have challenged Gilead’s rights to some of the intellectual property behind the drug.Safety has been a concern. Bristol-Myers Squibb wrote off $1.8bn in acquisition and development costs after a patient died and others were admitted to hospital during trials of a nuke it was developing in 2012, leading to the drug being abandoned. Idenix, Vertex and Achillion have been slowed down by worries over toxicity.Analysts say it is still uncertain which company will emerge with the most effective and safest drug cocktail. This explains why Merck was prepared to take a gamble on Idenix to boost its range of combination options.Progress in tackling hepatitis C is as welcome for drugmakers as it is for patients.After a long period of sluggish growth and productivity, Sovaldi’s success has shown that the industry is capable of powerful financial returns when it produces true innovation.But Mark Purcell, analyst at Barclays, cautions that not everyone will be a winner in an increasingly competitive market where “economic returns might not meet increasingly high expectations.”
