;Ticker;Nombre_Completo;Date_Time;Titular;Subtitular;Texto
80;ABBV;Abbvie Inc;2015-01-11T18:50:41Z;Shire in $5.2bn deal for US biotech NPS;UK group to boost pipeline of standalone speciality drugs;Shire, Britain’s third-largest drugmaker by market value, has made its biggest ever acquisition with a $5.2bn deal for US biotechnology company NPS Pharmaceuticals, as the FTSE 100 group looks to build its pipeline of standalone speciality drugs.The all-cash deal comes just three months after Shire’s proposed $54bn sale to larger US rivalAbbVie collapsed as a consequence of US government efforts to limit the tax advantages of takeovers in which the acquirer uses the transaction to redomicile its tax base outside the US.Shire, which has its headquarters in Dublin, will pay $46 a share for New Jersey-based NPS, a 51 per cent premium to its share price on December 16 when news of Shire’s interest resurfaced. The Financial Times first reported that Shire was considering a takeover of NPS in May, but those plans were sidelined after it emerged that AbbVie was pursuing Shire and were reignited when that deal failed in October.Lossmaking NPS specialises in treatments for rare diseases and has one drug approved in the US, Germany and Sweden to treat Short Bowel Syndrome, a gastrointestinal disorder.NPS has also been seeking approval for a hormone replacement therapy that can be used to treat hypoparathyroidism, a rare disease affecting the endocrine system. The treatment is being reviewed by the US Food and Drug Administration with a possible decision this month. Analysts have said that, if approved, it would significantly bolster the value of NPS.Flemming Ornskov, Shire chief executive, said: “Based on what we saw in the regulatory filings and with the correspondence with the FDA, we feel confident that it is a risk worth taking. What was absolutely key for us was to get in as early as possible.”Mr Ornskov added that the deal, which could close before the end of March, would help advance Shire’s strategy of becoming a leading biotechnology company and that it would continue to look at other deals.Shire, which has a market capitalisation of £28.1bn and trails only GlaxoSmithKline and AstraZeneca by value on the UK stock market, will pay for the deal with cash from its balance sheet as well as by tapping two credit facilities worth almost $3bn.Shire received a break fee of $1.6bn from AbbVie when their deal faltered late last year. The move for NPS is the company’s largest on record, topping its $4.2bn takeover of ViroPharma, which also makes rare drugs, in November 2013.Shire received financial advice from Citigroup and Lazard and legal advice from Davis Polk and Slaughter and May. Financial advisers to NPS were Goldman Sachs and Leerink Partners, while Skadden Arps provided legal advice.The deal adds to the deluge of large transactions taking place in the pharmaceuticals sector and is the first major announcement with the annual JPMorgan Chase Healthcare conference starting in San Francisco on Monday.Drugmakers in search of fresh sources of growth have been striking large deals as they face patent expiry on many of their most valuable products. Last month US pharma group Merck & Co agreed the $9.5bn acquisition of Cubist, which develops medicines designed to tackle the spread of drug-resistant “superbugs”. Swiss drug company Roche bought InterMune, which focuses on pulmonary treatments, for $8.3bn in August.
81;ABBV;Abbvie Inc;2015-01-07T13:12:33Z;Pharma takeover battles boost FTSE 100 performance;AstraZeneca and Shire were biggest contributors to index performance over 2014;Two companies at the centre of takeover battles had the biggest positive impact on the performance of the FTSE 100 last year, underlining the importance of renewed deal activity to the London market.The 2.7 per cent fall in the index over 2014, would have been almost half as deep again had it not been for the 1.3 percentage point contribution from pharmaceutical groups AstraZeneca and Shire.AstraZeneca’s share price rose more than one-quarter during the 12 months, hitting a peak in May when the company became the target of a £69.4bn bid from its larger US rival Pfizer.Shire experienced an even steeper rise of almost 60 per cent in its share price, after its board recommended a £32bn cash and shares bid from US group AbbVie in July.It is the first time this century that both the largest positive contributions to the FTSE 100 performance have come from takeover targets.However, neither of these takeovers reached completion. Pfizer abandoned its bid for AstraZeneca in May after the UK group rejected its offer. AbbVie walked away from the speciality pharma group after a US government clampdown on so-called inversion deals involving American companies moving their tax bases overseas.That same tax clampdown has made it less likely that Pfizer will renew its pursuit of AstraZeneca, even though the six-month period when UK takeover rules prevented it returning with a higher offer ended in late November.As the FTSE 100 index is weighted, the largest companies by market value are always most important. This makes it all the more striking that Shire was the second largest contributor last year, as its current market value of just under £28bn is less than half that of larger stocks such as HSBC, BP and Vodafone. It is the first time this century that Shire has been among the largest contributors.It also means that the UK index relies more heavily on the performance of a handful of the biggest groups compared with many indices elsewhere. Despite this, the performance of the FTSE 100 is still widely used as an indicator of how well the British economy or the City is doing.Financial Times analysis of data from the FTSE shows that after two years in which the resurgence of financial stocks has been a feature of the FTSE 100 — being two of the five biggest contributors in 2013 and four of the five in 2012 — not one of the top five contributors was financial last year.Instead, two defensive stocks — British American Tobacco and Imperial Tobacco — were among the other largest contributors, reflecting investors’ quest for stability and income.The largest negative contributions came from two companies hit by the fall in oil prices — BP and BG Group.Supermarket group Tesco, which suffered a disastrous year, had a negative impact of more than 60bp on the index as its share price dropped more than 40 per cent over the 12 months, hit by profit warnings, management changes and accounting errors.
82;ABBV;Abbvie Inc;2015-01-05T23:09:08Z;Gilead hepatitis-C drug wins CVS/Caremark backing;Agreement follows withdrawal of Express Scripts support;One of the largest US pharmacy groups has said it will make a $1,000-a-day pill the exclusive treatment for hepatitis-C sufferers, boosting Gilead, the drug’s maker which recently lost the backing of America’s largest pharmacy benefits manager.CVS/Caremark, the number two pharmacy benefit manager, said that Gilead’s Sovaldi and Harvoni pills would be the preferred treatment for sufferers of the disease, lifting Gilead shares by 2 per cent on Monday.CVS’s larger rival, Express Scripts, last month granted exclusivity to a competing drug made by AbbVie. That move wiped $20bn off Gilead’s market capitalisation in a single day and sparked a broader sell-off in the biotech sector, due to fears that healthcare groups would start forcing down the prices of expensive new drugs.Gilead’s once-a-day hepatitis-C pills are extremely effective, with success rates of between 94 and 99 per cent, but their cost has sparked an outcry among doctors and health insurers and triggered questioning from senators. A 12-week treatment of Harvoni costs $94,500 — or $1,125 a pill.Some pharmacy benefit managers, which manage prescription drug programmes on behalf of insurers, employers and other healthcare providers, had threatened to ditch Gilead’s drug when AbbVie started selling its rival hepatitis-C medicine, Viekira Pak.Express Scripts was the first to follow through last month, when it said it would make Viekira Pak the exclusive treatment for hepatitis-C sufferers among the 25m patients whose employers deal directly with the company. It said it would also encourage representatives of a further 65m patients to switch.Viekira Pak has a success rate of up to 96 per cent and carries a price tag of $83,319 for a 12 week treatment — although Express Scripts secured a big discount in exchange for granting the drug exclusivity.However, Abbvie’s drug requires the patient to take between three and six pills a day, compared to just one for Gilead’s Harvoni, making it a much more cumbersome treatment. Given that many hepatitis-C patients are either vulnerable or ageing, doctors say a complicated regimen could have a negative impact on success rates.A spokesperson for CVS/Caremark said it had decided to make Gilead’s drugs the preferred treatment from Wednesday following “a thorough evaluation of the existing and new hepatitis C therapies”.They added: “Our goal was to create the lowest net-cost solution for the entire population of patients with all genotypes of hepatitis C.”The company did not say what discount it had received from Gilead in exchange for exclusivity.Brian Abrahams, an analyst at Wells Fargo, said CVS/Caremark’s decision had removed an “overhang for Gilead as it achieves near-guaranteed access to a large [patient] population”. He also said the move reduced concerns that AbbVie would be better able to win significant market share by offering big discounts.Steve Miller, chief medical officer at Express Scripts, said he did not regret doing an exclusive deal with AbbVie. “There would be no discounts if we hadn’t done what we did,” he said.“We found a partner in AbbVie that changed the whole dynamic. Today’s decision from CVS is a natural extension of the good work that we’ve done.”Shares in AbbVie closed 1.9 per cent lower in New York trading.
83;ABBV;Abbvie Inc;2014-12-22T18:47:56Z;Takeover volumes move to highest post-crisis levels;Global M&A volumes rise by almost half to top $3.3tn in 2014;Corporate takeover deals surged to their highest levels since the financial crisis this year, with merger and acquisition volumes rising 47 per cent to $3.34tn globally.In the busiest period since 2007, megadeals returned with a vengeance, as historically low borrowing rates, buoyant capital markets and inflated share prices prompted big transactions with the potential to remake industries — particularly in pharmaceuticals, technology and media.The thirst for deals is expected to pour into the new year, led by the US and UK, where growth prospects are rosier than in other developed economies.Wilhelm Schulz, head of M&A at Citigroup for Europe, Middle East and Africa, said: “A clear theme of this year has been the need for large European companies to make acquisitions outside their main markets. That outbound M&A is likely to persist in 2015.”But by number of deals, Thomson Reuters data show that M&A activity climbed just 5 per cent from a year ago, meaning that midsized and small companies have yet to join in.Henrik Aslaksen, global head of M&A at Deutsche Bank, said: “The large deals are masking subdued growth in M&A activity. The rate of growth of deal activity in the US is likely to normalise next year following a very strong 2014. However, we could see Emea activity pick-up from a comparatively low base.”Three deals this year, including Comcast’s $71bn acquisition of Time Warner Cable and AT&T’s $67.2bn takeover of DirecTV, ranked among the 10 largest of the past decade if debt on the target company’s balance sheet is added.The moves — which are reminiscent of the earlier dotcom days when AOL offered a stunning $164bn in stock for Time Warner — give the acquiring internet and media distributors greater purchasing power and scale.Content makers responded, punctuated by 21st Century Fox’s unsolicited and later abandoned $80bn approach for Time Warner, the parent company of HBO and Warner Brothers film studio.“What we’ve seen this year is not just large strategic deals that changed industry structures, but the speed with which consolidation happened,” said Michael Carr, head of Americas M&A at Goldman Sachs.That differentiates from the pre-crisis period, which was dominated by large buyouts. Advising on nearly $1tn worth of deals, Goldman Sachs ranked first among advisory banks.Energy was the busiest sector in the year to December 17, with oil services company Halliburton pouncing on smaller rival Baker Hughes last month in a $38.5bn deal that is seen as a prelude to further consolidation given the dramatic fall in oil prices. That trend continued last week with Spain’s Repsol acquiring Canada’s Talisman for $8.3bn. On Monday, UK-listed Afren said it had received an approach from Nigerian oil group Seplat.Dealmaking helped the pharmaceuticals industry tackle the boom in biotechnology and the rise of challengers with tax-friendly corporate domiciles — the latter pressuring the US’s Pfizer and AbbVie to unsuccessfully pursue European rivals AstraZeneca and Shire in failed efforts to lower their tax profile.Using its tax-efficient structure, Valeant became a household name with its dogged chase of Botox-maker Allergan, but it could not best a $66bn bid by rival deal-machine Actavis.In many instances, investors blessed these aggressive actions, sending up stocks of acquirers and emboldening boardrooms.
84;ABBV;Abbvie Inc;2020-04-16T04:01:47Z;Ethical investors want more proof of good deeds;Clients and advisers push for tougher validation of data;Last year, investors ploughed $20.6bn into US sustainable investment funds compared with $5.5bn of net inflows in 2018, according to Morningstar, the data provider.But despite the near fourfold increase in investor interest, advisers are sceptical about the company and asset management data showing the environmental, social and governance impact of the funds themselves.“I struggle mightily. I don’t believe the indexes. They are using self-reported data and I just don’t buy it,” says Traci Richmond, a financial adviser with The Meakem Group in Bethesda, Maryland.The problem with ESG data is the lack of verification. “There’s so much data and information out there, it’s really, truly a data war,” says Tim Williams, the director of education initiatives at the Money Management Institute, a trade association.Morningstar, Bloomberg and MSCI are among the providers of ESG data and rankings. Each has recently attempted to address investors’ scepticism by seeking out more third-party verification. MSCI, for example, points to “alternative data sets” published by “sources outside of the company” that help “minimise reliance on voluntary disclosure”.There is also a growing trend to adopt ESG reporting standards set by organisations such as the Sustainability Accounting Standards Board (SASB) and the Task Force on Climate-Related Financial Disclosures (TFCD). But these bodies cannot set mandatory rules on data verification.I don’t believe the indexes. They are using self-reported dataThe US Securities and Exchange Commission has resisted adopting measures that some investor groups have proposed. Hester Peirce, one of the commissioners, has been openly disdainful of the ESG trend, describing it as “labelling based on incomplete information, public shaming, and shunning wrapped in moral rhetoric preached with cold-hearted, self-righteous oblivion to the consequences, which ultimately fall on real people.”Even so, late last year the SEC sent letters to some fund managers who target socially responsible assets, asking them to provide data on what factors they took into consideration.With no clear state-backed scrutiny of ESG data, investors and advisers must uncover deficits or misrepresentations in the growing pool of facts and figures themselves. “The challenge is how do you take all that information and turn it into useful investment decisions at all levels of the food chain,” Mr Williams says.Many wirehouses, the national brokerages selling investment services via advisers, have started to provide tools and resources to help clients better evaluate ESG data — and not just accept them at face value.Morgan Stanley, Merrill Lynch, Wells Fargo and UBS have increased their spending to acquire higher quality data and better sorting mechanisms for funds and assets that purport to be socially responsible.Last summer, Morgan Stanley launched a tool to help investors and advisers uncover misalignments between their portfolios’ assets and socially responsible objectives. The tool only uses third-party verified data and identifies where data quality deficits persist, says Courtney Thompson, a vice-president in Morgan Stanley’s Global Sustainable Finance group. “Having the data available is a key [and is] driving traction around the investments.”Morningstar also advises investors to be sceptical of fund managers and companies claiming a socially responsible focus. “I would caution investors that, while ESG index funds on the whole separate ‘better’ ESG companies from ‘worse’ ones reasonably well, those decisions are not based on fundamental evaluations and mistakes can be made,” says Jon Hale, Morningstar’s head of sustainability research. “Companies have started to understand that their ESG and sustainability disclosures are being scrutinised more heavily, and that helps.”Investors should seek underlying holdings reports from fund managers “so they can look at really what exposures they have”, says Vanessa Jilot, a financial adviser at Viewpoint Financial Network in Pleasanton, California. “My clients hope that, as you have more money moving to request ESG data, reporting will get better.”
