;Ticker;Nombre_Completo;Date_Time;Titular;Subtitular;Texto
48;ABBV;Abbvie Inc;2020-04-23T23:15:08+0000;Slaughter and May elects new senior partner;It becomes the latest Magic Circle firm to change leadership;UK law firm Slaughter and May has elected Steve Cooke, a mergers and acquisitions heavyweight, as its senior partner as the elite Magic Circle firms continue to overhaul their management teams.Mr Cooke, whose clients include Centrica, Diageo, IAG and Rolls-Royce, will take over from Chris Saul as leader of the most profitable British law firm starting on May 1 for a five-year term. He is a veteran Slaughter and May lawyer, having started as a trainee solicitor there in 1982.As head of the firm’s M&A practice, Mr Cooke recently led the team advising Hikma Pharmaceuticals on its $2.65bn acquisition of Roxane from Boehringer Ingelheim, and Shire on its proposed merger with AbbVie in 2014. He also advised Autonomy in its takeover by Hewlett-Packard, Cadbury in its hostile takeover by Kraft, British Airways in its merger with Iberia, and Cazenove on the merger of its investment banking business with JPMorgan.He will continue to practise part-time in addition to managing the firm.Mr Cooke’s election follows the appointment of new management at Freshfields Bruckhaus Deringer and Linklaters, while Allen & Overy partners will vote in February on replacements for David Morley, its senior partner who is retiring, and Wim Dejonghe, its managing partner.Candidates at A & O for senior partner are Mr Dejonghe, Tim House, Stephen Kensell and Michael Struys, while managing partner possibilities include Andrew Ballheimer, Simon Black, Michael Castle and Andrew Trahair.The simultaneous moves are partly coincidental — various appointment terms happen to expire at the same time. But they also come as the legal market in Britain grows ever more crowded as more US law firms seek to establish stronger footings in London.US firms generally offer higher salaries and slimmer management structures, giving them an advantage in luring British lawyers. However, they are still perceived as harder places to work because of hourly billing expectations.British firms have responded to the competition and continued pressure from clients to keep billing rates down by hiring more managers to oversee projects and ensure work is being done efficiently, and opening lower-cost centres in places like India, Belfast and Manchester.At Freshfields, Edward Braham, a top deal lawyer who has advised Kingfisher, Betfair Group and Anheuser Bush, took over as senior partner from Will Lawes on January 1. London litigation partner Chris Pugh and Cologne tax partner Stephan Eilers became joint managing partners, while Michael Lacovara in New York was appointed executive partner, an operations role.At Linklaters, Gideon Moore was elected as the firm’s managing partner in November for a four-year term, succeeding Simon Davies. Mr Davies had held the post since 2008 and is joining Lloyds Banking Group. He took over this week as managing partner, with Tony Bugg replacing him as the global head of the banking practice at Linklaters.Clifford Chance’s management team is steady for the moment, with managing partner Matthew Layton in the middle of a four-year term.
49;ABBV;Abbvie Inc;2020-04-23T20:10:10+0000;Gilead invests $2bn in Galapagos alliance;US group to develop arthritis drug with Belgian biotech firm;Gilead Sciences has agreed to invest up to $2bn to develop a rheumatoid arthritis drug with Belgian biotech group Galapagos — just three months after AbbVie pulled out of a similar alliance with the Mechelen-based company.News of the deal reinforces Galapagos’s standing as one of Europe’s most promising biotech companies, and repairs the damage caused in September by AbbVie’s decision to abandon a partnership in favour of its own rival drug.Gilead will now join forces with Galapagos in developing the Belgian company’s product, called filgotinib, in a head-to-head contest with AbbVie.California-based Gilead agreed to an upfront payment of $725m in return for a 15 per cent stake in Galapagos and a licence to co-develop and commercialise filgotinib. Further payments of up to $1.35bn may come from royalties and profit sharing if the product reaches the market.For Gilead, the partnership promises to strengthen its position in treatments for inflammatory diseases as it seeks new sources of growth after its success in hepatitis C and HIV.Onno van de Stolpe, Galapagos’s chief executive, said he was still disappointed about the way AbbVie announced its exit from their partnership without consulting the company first. But he added he was happy to have a new partner committed to putting filgotinib at the centre of its inflammation franchise.Galapagos held talks with eight potential investors after AbbVie’s withdrawal, Mr van de Stolpe told the Financial Times. Gilead was felt to be the best fit because of its greater nimbleness compared with bigger pharma groups.“Gilead has built its HIV and [hepatitis C] franchises into a fantastic company with quite a small footprint of only 7,500 people,” he said. “The culture fits extremely well with Galapagos.”Shares in Galapagos rose 11 per cent following the announcement to an all-time high of €58.55 — more than recovering the sharp losses they suffered after AbbVie’s exit. This gave it a market capitalisation of €2.3bn.Mr van de Stolpe said another appeal of Gilead was its willingness to share marketing rights in some European countries and work together on development — supporting his aim to build Galapagos into one of Europe’s first big biotech groups.$725mUpfront payment from Gilead in return for 15% stake in Galapagos and licence to co-develop and commercialise filgotinib“It’s about time Europe built something substantial in biotech,” he said. “That is something that has been lacking because companies have been acquired too early rather than being given the time and capital needed to grow.”Gilead’s Galapagos deal marks the second boost for European biotech within weeks after Genmab of Denmark won approval from US regulators for the Darzalex blood cancer drug it is developing with Johnson & Johnson.Genmab is ranked second in terms of market capitalisation among European biotech companies, at about $8bn, behind Actelion of Switzerland at $15.5bn.However, they remain just a fraction of the size of US biotech groups such as Celgene, Biogen and Gilead, whose $147bn market valuation is greater than all but two of Europe’s traditional pharma groups.Galapagos said it planned to start late-stage trials of filgotinib in rheumatoid arthritis and Crohn’s disease next year and would fund 20 per cent of the development costs, with Gilead paying the rest.Mr van de Stolpe said he was convinced filgotinib was a safer product than AbbVie’s ABT-494, but their relative efficacy was still to be determined. Analysts have forecast annual peak sales in excess of $3bn for filgotinib, which Galapagos hopes will reach market in 2019.
50;ABBV;Abbvie Inc;2015-12-17T09:41:52Z;AstraZeneca adds 55% Acerta Pharma stake to swath of deals;UK drugmaker has option to buy remainder of US-Dutch biotech company for about $7bn;"AstraZeneca has agreed to buy a majority stake in Acerta Pharma with an option to take full control for up to $7bn, capping an intense period of dealmaking for the UK group as it races to refill its drugs portfolio.Acerta is a US-Dutch biotech company developing a promising blood cancer drug that would, if it reaches market, be a direct challenger to the Imbruvica treatment which prompted AbbVie to buy Pharmacyclics for $21bn in March.AstraZeneca will pay an initial $2.5bn for 55 per cent of privately-owned Acerta, with a further $1.5bn by the end of 2018 and an option to buy the remainder of the company at any time for a further sum of approximately $3bn.The investment came a day after AstraZeneca agreed to pay Takeda of Japan $575m for a portfolio of respiratory medicines and a month after it bought ZS Pharma, a US biotech company, for $2.7bn.Pascal Soriot, chief executive, said the deals were complementary to the group’s in-house research and development as it seeks replacements for several old medicines where patent protection has lapsed or will do so soon.Some analysts and investors are sceptical of his target — set during the successful battle to fend off a $100bn takeover by Pfizer last year — to increase revenues by three-quarters to $45bn by 2023.However, Mr Soriot said on Thursday that he remained confident of hitting the goal and said the Acerta deal and other recent acquisitions would lift AstraZeneca's potential further. “These deals are not substitutive, they are additional,” he said. “We look forward to demonstrating to the sceptics that our forecast can be achieved.” Three products that accounted for almost 40 per cent of total revenues last year — Nexium for heartburn, Crestor for high cholesterol and Seroquel for schizophrenia — will have lost market exclusivity by the end of 2017.Efforts to renew the product portfolio received a boost last month when US regulators approved a new lung cancer treatment, called Tagrisso, and several other promising therapies are approaching market.The Acerta deal would strengthen the group’s position in haematological cancers — an area it has previously acknowledged to be a weakness. In early stage trials, Acerta’s drug, known as acalabrutinib or ACP-196, showed a 95 per cent response rate in patients with relapsed chronic lymphocytic leukaemia, the most prevalent form of adult leukaemia. Late-stage trials are under way, as well as early-stage studies in solid tumours.AstraZeneca said it believed acalabrutinib had advantages over Imbruvica that made it a potentially best-in-class medicine for a range of blood cancers that could generate peak annual sales in excess of $5bn. AbbVie, which co-owns Imbruvica with Johnson & Johnson, has forecast peak sales of at least $7bn for its drug.People close to the situation said AstraZeneca had faced competition for the asset, with other interested parties including Merck & Co and Amgen. Acalabrutinib was inherited by Merck when it bought Schering-Plough in 2009 but it later disposed of the drug.Alistair Campbell, analyst at Berenberg, said it looked like a good deal at a good price for AstraZeneca, highlighting the 1.4 multiple of forecast peak sales it was paying compared with the 2.8 paid by AbbVie for Imbruvica. He said trial data suggested acalabrutinib had a ""major safety advantage"" over Imbruvica.Some analysts have questioned why AstraZeneca has made a sudden dash into haematology less than a year after deciding to put one of its most promising drugs into a partnership with Celgene to target blood cancers.Analysts at Natixis investment research said this left a “confused message” now that AstraZeneca appeared to be building its own in-house capabilities.However, Mr Soriot insisted the deals were complementary and said Celgene was helping advance its MEDI4736 immunotherapy in blood cancers much quicker than it could have done alone.Acerta is 40 per cent-owned by Wayne Rothbaum, a veteran US biotech investor and founder of Quogue Capital, a venture fund. The company was advised by Goldman Sachs."
51;ABBV;Abbvie Inc;2015-12-14T20:17:32Z;AstraZeneca: in search of a blockbuster;Cancer drugs are not certain to ensure the pharma group’s share price recaptures past glories;"Jimmy Carter can tell you why AstraZeneca is contemplating paying $5bn for an unquoted Dutch biotech company with a single product in phase III trials. The former US president recently declared himself cancer-free following treatment with pembrolizumab, an immunotherapy drug marketed by Merck & Co. Its UK rival is trying to bulk up in the same sector — and with good reason.The object of Astra’s attention, Acerta, is developing a treatment for certain types of leukaemia. Analysts think it could ultimately generate more than $2bn a year in sales. An existing rival product, Imbruvica, is forecast to become a blockbuster (a drug that generates more than $1bn a year in sales) in 2016; AbbVie paid about $21bn to buy the company that developed it. The Acerta product may work better but trials will not be complete until 2018.Oncology is the smallest of Astra’s therapy areas by sales but the company wants to build a portfolio that can replace the revenues from blockbuster products that are losing their patent protection. It has had some successes this year: Tagrisso, a treatment for lung cancer, was approved earlier than expected while Lynparza, for ovarian cancer, was recently cleared for use by the UK’s National Health Service.This progress has made it easier for Pascal Soriot, Astra’s chief executive, to justify rejecting Pfizer’s £55 a share bid for the company last year. Its share price, at £43, is little changed from the day Pfizer withdrew; GlaxoSmithKline has fallen over the same period.Yet risks remain, not least over the timing. Astra’s statutory earnings have not covered its dividends for the past two years, and the squeeze will get worse in 2016.According to consensus forecasts, none of its cancer drugs will be a blockbuster even by 2018. Oncology is also increasingly competitive; cancer drugs account for almost a third of the assets in the pipelines of the top 12 pharma groups, says Deloitte.Mr Soriot may well achieve his target of bringing six cancer drugs to market by 2020. It is less certain whether their revenues will recapture past glories — or return Astra’s shares to the level of past takeover bids.Email the Lex team at lex@ft.com"
52;ABBV;Abbvie Inc;2015-12-14T15:46:40Z;AstraZeneca weighing up Acerta bid to secure blood cancer drug;UK-based group seeking to reinforce research and development pipeline before patents lapse;"AstraZeneca is weighing a direct challenge against AbbVie and Johnson & Johnson with a potential bid for a Dutch biotech company developing a competitor to the US groups’ Imbruvica blood cancer drug.The UK-based group said it was “exploring potential strategic options” with privately owned Acerta Pharma, whose rival treatment for chronic lymphocytic leukaemia is in late-stage trials.An acquisition would mark the latest effort by AstraZeneca to refill its research and development pipeline as it braces for the loss of patent protection next year on its blockbuster Crestor anti-cholesterol pill.It would also strengthen the group’s capabilities against haematological cancers — an area it has previously acknowledged to be a weakness.Analysts said speculation about a $5bn valuation for Acerta sounded attractive compared with the $21bn paid by AbbVie to buy Pharmacyclics in March — giving it a half share in Imbruvica alongside co-owner J&J.Sachin Jain, analyst at BofA Merrill Lynch, said encouraging data from early stage trials suggested Acerta’s product, known as ACP-196, could generate peak annual sales in excess of $2bn. AbbVie has predicted peak sales of $7bn for Imbruvica.However, Jo Walton, analyst at Credit Suisse, foresaw “significant interest from multiple other bidders” if Acerta was for sale, suggesting that AstraZeneca risked being drawn into a bidding contest.In a statement reacting to a report about the potential deal in the Wall Street Journal, the UK group said there was “no certainty that any transaction will ultimately be entered into, or as to the terms of any transaction”.A deal, should it happen, would be the latest of many bolt-on deals and partnerships by AstraZeneca as Pascal Soriot, chief executive, reshapes the business in response to declining sales of older drugs.Three products that accounted for almost 40 per cent of total revenues last year — Nexium for heartburn, Seroquel for schizophrenia, and Crestor — will have lost market exclusivity by the end of 2017.AstraZeneca last month agreed to buy ZS Pharma, a US biotech company with a drug in late-stage development for a condition associated with kidney and heart failure.However, Mr Soriot is staking his greatest hopes on the group’s own R&D pipeline, including its Tagrisso lung cancer drug approved by US regulators last month.AstraZeneca is aiming for a return to sales growth in 2017 after a dip next year, with a long-term goal of increasing revenues by three-quarters to $45bn by 2023. This latter target was set by Mr Soriot during the group’s successful battle to resist a £69.4bn takeover by Pfizer last year.Some analysts and investors remain sceptical; AstraZeneca’s shares have fallen almost 5 per cent this year and were unchanged on Monday at £43.33, well below Pfizer’s offer of £55 a share.However, Mr Jain at BofA Merrill Lynch said AstraZeneca had “a broad and under-appreciated pipeline”, which had the potential to outperform the wider pharma sector from 2017 onwards."
