;Ticker;Nombre_Completo;Date_Time;Titular;Subtitular;Texto
34;ADP;Automatic Data Procs;2012-03-07T14:57:34Z;Private sector boosts US labour market;;The US private sector added 216,000 new jobs in February as the labour market recovery continued to strengthen.Job creation reported by ADP, the payroll processor, was slightly higher than the average 215,000 positions forecast by economists, and January’s reading was revised up to 173,000 from 170,000.Joel Prakken, chairman of Macroeconomic Advisers, which conducts the ADP survey, said: “The last three monthly gains in employment … have averaged 223,000, compared to 156,000 per month over all of 2011. This pick-up is consistent with the recent acceleration of the nation’s gross domestic product.”The report comes ahead of Friday’s labour department release of non-farm payrolls, which includes government jobs. Economists expect that survey to show that the economy added a net 210,000 jobs in February compared with 243,000 in January, with the private sector contributing 225,000 positions. The unemployment rate is forecast to hold at 8.3 per cent.Gains in the ADP report were spread across size of business, with small companies – those employing fewer than 50 workers – contributing the most growth with 108,000 new hires. Medium-sized businesses added 88,000 jobs, while companies with more than 500 employees grew by 20,000 workers.Phil Orlando, chief equity market strategist at Federated Investors, said: “These small and midsized firms are critically important. They are the engine of job creation here in the US.” He said that the government’s jobs reading “will eventually capture this bump in small and midsize hiring but with a lag.”Scott Brown, chief economist at Raymond James, said he was also encouraged by the growth in smaller companies, which was “a very good sign for the recovery.” He noted, however, that concerns remain over the effect of the mild weather across much of the US, which may have brought forward some seasonal hiring, and over rising petrol prices, which he said may cause some companies to delay expansion plans.Increases were seen in all sectors of Wednesday’s report. The services industries continued to lead growth, adding 170,000 jobs. In the financial sector, the 14,000 workers added was the largest monthly gain in two years.Employment in goods-producing industries, which includes manufacturing, mining and construction, added 46,000 positions. Within that category, manufacturers hired 21,000 new workers and construction jobs increased for the fifth consecutive month, adding 16,000 jobs.
35;ADP;Automatic Data Procs;2012-02-01T15:54:08Z;US jobs growth slower than expected;;Jobs growth slowed in the US private sector last month after a surge in December, missing estimates of a stronger rise in a report released ahead of Friday’s government payrolls tally.Separately, US manufacturers followed upbeat factory data from China, Germany and the UK, reporting the fastest growth in seven months.US companies added 170,000 jobs in January on a seasonally adjusted basis, according to ADP, the payroll processor, below expectations of 182,000 new positions. December’s record-high of 325,000 newly created jobs was revised down to 292,000.“Over the last three months, the monthly gains in employment shown in the ADP National Employment Report have averaged 223,000, compared to 163,000 per month over all of 2011,” said Carlos Rodriguez, ADP chief executive.Paul Ashworth, chief US economist at Capital Economics, said the downward revision was not “overly concern[ing], however, since the ADP survey has a habit of vastly overestimating employment growth in the final month of each year because of seasonal adjustment problems”.The report showed the private sector added 152,000 services jobs and 18,000 goods-producing jobs in January. Manufacturers added 10,000 workers, compared with a surge of 20,000 in December.Growth was once again strongest among small and medium-sized businesses, which added 95,000 and 72,000 jobs respectively, while companies employing more than 499 people added 3,000 new workers.“Labour market conditions continue to improve at a moderate pace,” said Joel Prakken, chairman of Macroeconomic Advisers, which produces the ADP report. He said the reading was “consistent” with the commerce department’s announcement last week that the US economy grew by 2.8 per cent in the fourth quarter.On the heels of positive purchasing managers’ indices from other leading industrial countries, the Institute for Supply Management said on Wednesday that the US manufacturing sector expanded for a 30th consecutive month.Its PMI rose to 54.1 from 53.1 in December, below expectations of 54.5, but the fastest pace since June. Readings above 50 indicate expansion.“Far from the US being tugged down by Europe, it looks like the US has done some heavy lifting (with of course plenty of help on sentiment from ECB liquidity policies!) in supporting European and global growth sentiment,” Alan Ruskin, strategist at Deutsche Bank, said in a note.New orders grew faster last month, rising to 57.6 from 54.8. Production and employment also continued to grow, but decelerated from their December rates. The employment sub-index slipped to 54.3 from 54.8, while production lost more ground, declining to 55.7 from 58.9.Inventories continued to contract, but at a slower pace, while prices swung from decreasing to increasing.Several of the survey respondents quoted in the ISM report were positive about the outlook for 2012. The “year [is] starting a little slow, but customers are positive about increased business in 2012”, said one, while another noted that “market conditions appear to be improving”.Rich Bergmann, global manufacturing lead at Accenture, said he was encouraged by the latest data. “In the last quarter, we’ve seen investment in infrastructure, investment in technology, rehiring and new hiring and expansion of new facilities.”Nine of the 18 industries surveyed reported growth, led by apparel and leather products, petroleum and coal products and machinery.Also on Wednesday, the commerce department said construction spending jumped 1.5 per cent in December as private building surged to a two-year high.
36;ADP;Automatic Data Procs;2012-01-19T06:10:48Z;Paris rolls out the red carpet for Chinese tourists;;"China hosts the world’s biggest yearly mass migration during Lunar Year/Spring Festival celebrations, but the pushing and shoving involved with returning home doesn’t stop there. The travel rush is also spilling to Europe, where beleaguered economies are hoping to benefit from the bonanza.Paris is rolling out the red carpet for Chinese tourists as soon as they touch down on French soil.Airport operator ADP (Aéroports de Paris) plans to organise a lavish “welcome scheme” – its biggest ever for a single nationality – at its Orly and Charles de Gaulle airports designed to help Chinese “feel at home”.Although Paris is as famous for its brusqueness (the oft-cited anecdote of garçons refusing to answer tourists in English being one example) as it is for its sophistication, the fanfare would seem sensible, considering that Chinese are among the most lavish buyers of French goods.One Chinese jewelry magnate last year wasn’t satisfied buying just Bordeaux wine, so he decided to buy a vineyard complete with its 15th-century chateau. Another tycoon was so mesmerised by Versailles that he recreated the palace back home with imported materials.The ADP plans to deck its airports in Chinese New Year decorations and have an army of smiling Mandarin-speaking officials waiting to hand out red envelopes with a welcome message written by Pierre Graff, the operator’s president.The VIP treatment doesn’t stop there. Announcements will be broadcast in both Mandarin and Cantonese, passengers will be offered free guides, reductions on certain luxury items, and even apps for iPhone/Android in Mandarin that will help them organise their travel.The operator has even given guidance to non-staffers such as police officials and cleaners to be “aware” of cultural sensitivities in order to improve serviceability, an ADP spokeswoman told beyondbrics, adding that a research team had been set up to observe Chinese behaviour.“When our staff return credit cards [after a transaction] or a document to Chinese passengers, they make sure they are given with both hands instead of one,” she said. “In light of the constant rise in the number of arrivals of Chinese tourists in the past five years, the decision to organise the scheme was obvious.”While China’s Communist party has campaigned to put tourists on their best behaviour (via the Spiritual Civilisation Steering Committee) by issuing guidelines against spitting, queue-jumping, eating loudly, or haggling in shops with fixed prices, Parisians and other French people are also adapting.France is the top destination for Chinese travellers in Europe with 910,000 arrivals in 2010, according to the latest report from Euromonitor International, which looks at industry trends. Beyond Paris, the lush lavender fields of southern Midi are also popular, in part due to a Chinese television mini-series set in the region.Chinese spent by far the biggest amount in France too – $375m, according to Euromonitor. Chinese are avid shoppers, preferring to fork out on goods – often luxurious ones – rather than hotels and food. In fact, a majority of Chinese tourists visiting Paris stay in cheaper accommodation outside the city.Chinese visitors are clearly enticed by those very French flavours of romance, history, luxury and quality. But competition is hotting up, Euromonitor warned.European countries face a greater deal of competition for Chinese travellers from other Asian destinations, as well as from the US and Australia. It is therefore important for European countries to market Europe in China in order to continue its prestige reputation and to inspire Chinese travellers to pay the higher costs involved in travelling to the region.So China may come to Europe’s rescue after all. But rather than through the bond market, it’ll be via the baggage reclaim.Related reading:
China’s Riviera?, beyondbrics
China luxury: from Paris with love, beyondbrics
Luxury sector holding up, FT
A New Grand Tour, The Economist"
37;ADP;Automatic Data Procs;2012-01-05T19:48:17Z;US consumers: hey, big spenders;Will they expend new-found vigour by consuming, or go into their bunkers?;It looks as if, little by little, US consumers are regaining some of their strength. But will they expend their new-found vigour by actually consuming, or will they dig down deeper into their bunkers?The answer matters for the world economy. US consumption accounts for roughly 70 per cent of the country’s GDP and 15 per cent of the planet’s. This means that a 3 per cent contraction in US consumption would be the equivalent to the economy of, say, Colombia, simply disappearing.The good news is certainly not ubiquitous. It comes in dribs and drabs. Household net worth took a nasty step down in the third quarter as property and share prices slipped. But Thursday’s private sector jobs report from payroll processor ADP was surprisingly robust (and will look even better if confirmed by Friday’s official jobs figures). It was accompanied by another tick down in initial jobless claims. In addition, delinquencies for many types of loan fell in the third quarter, according to the American Bankers Association. Consumer debt payments, as a percentage of disposable income, have reached lows last seen in the 1990s even while credit is expanding.The ultimate confirmation will come, of course, from the results of the companies where Americans spend their money. Here the signals are mixed. There are some bright spots, such as the Macy’s department store chain, and car sales were surprisingly strong. But several of the biggest retailers to report – Kohl’s, JC Penney, and, most significantly, Target – have posted disappointing Christmas trading.A thriftier US might be stronger and more balanced in the long run, and the great crash may have taught consumers valuable lessons. But austerity, whether from governments or from individuals, could not come at a worse time. By all means have virtue, but tomorrow.Email the Lex team in confidence at lex@ft.com
38;ADP;Automatic Data Procs;2020-04-24T20:32:47+0000;US private sector adds jobs in December;;US companies added the most positions in a year last month in a further sign that the labour market recovery is strengthening, but other data painted a mixed picture of the pace of economic growth.Private sector hiring increased by 325,000 in December, surging past forecasts of 178,000 new jobs, according to ADP, the payroll processor. November’s reading was revised slightly to 204,000 from 206,000.“The employment situation is improving slowly but with lower paying jobs, which means that the debt overhang will continue to be a problem going forward, which further diminishes the ability of consumers to accelerate gross domestic product growth in the coming year,” said Steve Blitz, chief economist at ITG Investment Research.Thursday’s figures come ahead of the government’s employment report, due on Friday, which is expected to show the economy added 150,000 new positions, bolstered by a 175,000 increase in private payrolls. Employers added 120,000 new workers in November and the unemployment rate fell to 8.6 per cent, the lowest since March 2009.“The [ADP] estimate for December suggests that employment accelerated for the fourth consecutive month, consistent with the year-end pick-up in economic growth,” said Joel Prakken, chairman of Macroeconomic Advisers, which conducts the ADP survey. “Today’s report also suggests that November’s somewhat surprising decline in the unemployment rate might stick and, indeed, that the unemployment rate could fall further in December.”Some analysts warned against raising expectations for Friday’s report, however, noting that ADP estimated 297,000 new jobs in December 2010 but the government figure came in at just 113,000.“Nonetheless, this report adds to the list of more encouraging indications on the labour market,” said John Ryding and Conrad DeQuadros of RDQ Economics.A detailed look at the condition of the US economy state-by-stateAnother sign the job market may be gaining some momentum came in the labour department’s weekly report on jobless claims.First-time claims for unemployment benefits fell to a seasonally adjusted 372,000 in the week ending December 31 from 387,000 the prior week. That was better than expectations of 375,000 claims and pulled down the four-week moving average to 376,500, the lowest level since June 2008.The ADP report showed services industries leading gains once again, adding 273,000 workers, while goods producers hired 52,000 new employees. Manufacturing employment rose by 22,000 and construction companies added 26,000 jobs in a positive sign for the housing market.Growth in the service industry picked up on December, according to the Institute for Supply Management. The group’s non-manufacturing index rose to 52.6 from 52 in November, but missed expectations of a rise to 53. Readings above 50 indicate expansion in the US services sector, which accounts for about 80 per cent of the economy.While the acceleration signalled an uptick in activity at the end of the year, it did not fully reverse November’s decline, and employment continued to contract, though at a slower pace than the previous month.“Economic growth continues to be slowed by the lag in employment,” said Anthony Nieves, chair of the ISM’s survey committee.“Employment remains contractionary at 49.4 against 48.9 and goes no way towards corroborating the particularly strong ADP release,” warned David Semmens, US economist at Standard Chartered.Another survey released on Thursday also suggested that employers may still be cautious about expanding. Planned job cuts rose in December from a year ago, according to Challenger, Gray & Christmas, the placement company. Planned redundancies rose 31 per cent to 41,785 from 32,004 in December 2010, which was a 10-year low.That left total planned firings for the year at 606,082, a 14 per cent increase over 2010. Forty-one per cent of those redundancies were in government and the financial sector.Banks also led job cuts in December, followed by industrial goods manufacturers. From November, planned firings eased by 1.6 per cent, but the figures are not adjusted for seasonal variations.“Even as job cuts remain low in most sectors, employers still appear reluctant to add jobs,” said John Challenger, chief executive of Challenger, Gray & Christmas. “Job creation is likely to remain slow and steady in 2012.”
39;ADP;Automatic Data Procs;2020-04-24T18:07:40+0000;US private jobs growth quickens;Number of planned lay-offs stabilises;The pace of US employment growth accelerated in November, with private-sector companies adding a better than expected 206,000 jobs while the number of planned lay-offs stabilised.Meanwhile, low interest rates and falling home prices lured more buyers into the housing market, sending pending sales of existing homes up the most in nearly a year.In further evidence that the US economy has regained a little vigour in the last few months, the Federal Reserve’s latest Beige Book survey found “slow to moderate growth” across most of the country.The employment report from ADP, the payroll processor, beat economists’ expectations of 125,000 new positions over the month and was the largest gain in nearly a year. ADP also revised up the number of new jobs added in October to 130,000.Markets reacted positively to the report and an announcement that the world’s leading central banks were taking joint action to boost liquidity.Wednesday’s report came ahead of the government’s closely watched non-farm payrolls data, set to be released on Friday. Economists surveyed by Bloomberg are expecting total employment to rise by 122,000 after October’s 80,000 net gain and for the jobless rate to hold at 9 per cent.“This [ADP] report is strong enough certainly to pose some upside risks to the street’s forecast for NFP on Friday,” said David Semmens, US economist at Standard Chartered. “This also fits nicely with the improvement seen in initial jobless claims.” New claims for unemployment have come in below 400,000 for the last several weeks, an indication that lay-offs may be stabilising.Joel Prakken, chairman of Macroeconomic Advisers, which conducts the ADP survey, said the increase “normally would be associated with a decline in the unemployment rate. An acceleration of employment is consistent with data showing that GDP growth, which slowed sharply around the turn of the year, is gradually recovering.”The services industry led job gains in November, ADP said, adding 178,000 jobs over the month compared with 28,000 new positions in the goods-producing sector. New construction jobs came in at the highest in five years, with a 16,000 gain, while manufacturers added 7,000 workers.The bulk of new hiring came from employers with less than 50 workers, which added 110,000 jobs. Companies employing between 50 and 499 workers hired 84,000 people, while big companies, with more than 500 employees, added 12,000 jobs.Also on Wednesday, a report from Challenger, Gray & Christmas, the placement company, said planned lay-offs in November were down 13 per cent from a year ago at 42,474. That level was slightly below the 42,759 planned cuts tallied in October, following a spike above 115,000 in September.The Beige Book – a round up of reports from business contacts across the US – found that “consumer spending rose modestly” and “manufacturing activity expanded at a steady pace” with only the St Louis district reporting a decline.The relatively upbeat tone is consistent with other data that suggests growth is slow but stable following a series of shocks over the summer.Figures from the National Association of Realtors showed pending home sales rose 10.4 per cent in October, the strongest rise since November 2010. That was well ahead of the 2 per cent increase economists had forecast.“Home sales have been plodding along at a sub-par level while interest rates are hovering at record lows and there is a pent-up demand from buyers who normally would have entered the market in recent years,” said Lawrence Yun, NAR chief economist. “We hope this indicates more buyers are taking advantage of the excellent affordability conditions.”Pending sales track contract signings but not closed transactions. Existing home sales, which reflect closed deals, rose in October, but so did the number of cancelled contracts. Cancellations have spiked recently on higher numbers of declined mortgage applications and appraisals coming in below negotiated prices.House prices have continued to slide, dropping 3.6 in September from a year ago, according to data released on Tuesday. Meanwhile, rates on conventional 30-year fixed mortgages have fallen to record lows since the Federal Reserve intervened to stimulate the housing market.“This is mostly a rebound rather than a surge from a steady trend, but it is welcome nonetheless,” said Ian Shepherdson, chief US economist at High Frequency Economics, noting that pending sales had fallen 7 per cent over the previous three months. “It also is consistent with the recent strengthening in homebuilder sentiment and the modest pick-up in mortgage applications. In short, something seems to be stirring in the housing market, though we would certainly hesitate before calling a definitive start of a recovery.”
40;ADP;Automatic Data Procs;2011-11-02T20:51:59Z;US companies add 110,000 jobs in October;;US companies added more jobs than expected in October while planned lay-offs fell to the lowest level in four months in a sign that the job market is stabilising, though at a weak level of activity.The private sector added 110,000 jobs last month, beating economists’ estimates of 100,000 new positions, and September’s total was revised up to 116,000 from 91,000, according to ADP, the payroll processor.“The good news is that employment growth appears stable, but the bad news is that gains of 100,000 or slightly less a month won’t be sufficient to reduce the unemployment rate or generate a pick-up in income growth,” said Paul Ashworth, chief US economist at Capital Economics.Analysts were looking to the US labour department’s non-farm payrolls report, due on Friday, to see whether the boost in economic growth seen in the third quarter will be reflected in hiring trends.Figures last week showed that third-quarter growth accelerated to 2.5 per cent, following an anaemic 0.4 per cent in the first three months of the year and 1.3 per cent in the second quarter.Economists polled by Bloomberg were expecting Friday’s figures to show the US economy added 95,000 jobs in October, led by 125,000 new private-sector positions.“ADP data is not going to change any [non-farm payroll] forecasts and is consistent with a pretty steady labour market in the last four months,” said Alan Ruskin, strategist at Deutsche Bank.The latest ADP report shows growth entirely concentrated in the services sector, which added 114,0000 workers. Goods-producing companies eliminated 4,000 positions.Manufacturers continued to downsize for a third month, cutting 8,000 jobs in a reflection of “uncertainty around investment and hiring,” said Gary Butler, ADP chief executive. The manufacturing sector slowed in October, according to the Institute for Supply Management amid concerns over domestic growth and global turmoil fuelled by the eurozone debt crisis.Employment growth in October was also stratified by company size. Small and medium-sized firms accounted for the entire monthly rise, adding 58,000 and 53,000 jobs respectively, while companies employing more than 499 people cut 1,000 jobs – the first reduction in five months.“Big manufacturing exporters have employment on hold, probably because of the deterioration in economic growth in Europe and Asia, but smaller domestically focused services firms are still expanding,” Mr Ashworth said.Meanwhile, planned job cuts slowed from a two-year high in September to 42,759 in October, the lowest level since June, according to a separate report from Challenger, Gray and Christmas, the placement company. That still left lay-off announcements 12.6 per cent above their level of a year ago, however.The biggest pullback in cuts came in the financial and government sectors, the report said. That was unsurprising following September’s report, in which the majority of cuts were attributable to the US Army’s five-year troop reduction plan and the announcement of 30,000 cuts at Bank of America.“Job cuts in government and financial services dropped significantly last month, but the two sectors are not out of the woods, by any means. Most of the government cuts this year were at the state level. We have yet to see the full impact of mandated federal spending cuts. Anticipated cuts at the US Post Office alone could result in more than 200,000 job cuts,” said John Challenger, chief executive of Challenger, Gray and Christmas.
