;Ticker;Nombre_Completo;Date_Time;Titular;Subtitular;Texto
107;ADP;Automatic Data Procs;2009-09-30T20:38:08Z;Wall Street slides in volatile trading;;"Wall Street struggled to recover from early losses in volatile trading on Wednesday after a gauge of business activity in America’s Midwest unexpectedly shrank.The Institute for Supply Management-Chicago business barometer fell to 46.1 in September from 50 in August after economists had forecast a reading of 52.A reading above 50 indicates expansion in the regional economy.Rising commodity prices and the weak dollar lifted stocks back into positive territory for brief periods in afternoon trading.US stocks opened higher after data showed the country’s economy contracted at a slower pace than thought.The commerce department said gross domestic product fell at a 0.7 per cent annual rate in the second quarter compared with an estimated decline of 1.2 per cent.The market was also weighed down by disappointing data on jobs. The ADP National Employment Report showed that employers in the private sector cut 254,000 jobs from payrolls in September after cutting a revised 277,000 jobs in August. Analysts expected a reduction of 200,000 jobs.Investors were nervously awaiting Friday’s report on the unemployment rate.The S&P 500 eventually closed 0.3 per cent lower at 1,057.08. The Dow Jones Industrial Average lost 0.3 per cent to 9,712.28 and the Nasdaq Composite dropped 0.1 per cent to 2,122.42. But Wall Street still recorded its seventh straight monthly gain and has risen about 15 per cent over the last quarter. The Dow also notched up it biggest quarterly rise since the fourth quarter of 1998.“Watching today’s trading in equity markets reminds me of watching a marathon runner heading for a finish line with no energy left, aiming just to finish the race,” said Colin Cieszynski, an analyst at CMC markets. “With the third quarter ending today, it appears in some ways that equities are continuing to mark time before quarter end and the big data points due later this week.”Industrial stocks led the market lower throughout the day on fears about the pace of economic recovery. Alcoa dropped 1.4 per cent to $13.12 and United States Steel lost
2.6 per cent to $44.37.American Superconductor rose 10.5 per cent to $33.54 after the company said late on Tuesday that it had signed a contract with China’s Sinovel Wind to provide electrical components for use in wind turbines.Jabil Circuit, the electronics maker, posted better-than-expected earnings for the first quarter, mainly due to cost cuts.The company has said it expects to cut about 4,500 jobs as part of a restructuring programme. Its shares gained 9.2 per cent to $13.41.Financial stocks also dragged the market lower. CIT Group fell 45 per cent to $1.21 after reports that the group was nearing a plan that would be likely to hand the commercial lender over to its bondholders.CIT, which specialises in lending to retailers and other middle-market companies, is said to be preparing an exchange offer that would eliminate up to
40 per cent of its more than $30bn in outstanding debt.Bank of America lost 1.4 per cent to $16.92 after announcing a deal to sell a long-term asset management business, which makes up its Columbia Management division, to Ameriprise Financial for about $1bn. Ameriprise rose 12.3 per cent to $36.33.However, Nike, the largest athletic shoemaker, helped lift the market from the opening bell.Late on Tuesday, the company reported better-than-expected quarterly earnings after cost cuts offset declining revenues in key markets such as the US and China. Its shares rose 7.7 per cent to $64.70.Darden Restaurants, which owns the Red Lobster chain, also beat analyst estimates when it reported its first-quarter earnings. However, its shares fell 5.6 per cent to $34.13 after
the group’s forecast disappointed analysts.Saks fell 4.9 per cent to $6.82 after the luxury department store chain said it would offer as much as $100m in shares.In a regulatory filing posted late on Tuesday, the group said it would use the proceeds to reduce debt.Discovery Laboratories struck an agreement with the Food and Drug Administration over its experimental lung drug, sending the company’s shares
22.5 per cent higher to $1.36."
108;ADP;Automatic Data Procs;2009-09-02T20:36:32Z;Downbeat jobs report drag on Wall Street;;US stocks dipped in and out of the red before ending lower on Wednesday following the release of downbeat data on job losses, prompting speculation that the market’s correction had begun.The ADP employment report suggested that private employers cut more jobs in August than had been expected, which continued to weigh on the market after it opened lower for the third consecutive day.Wall Street had initially taken some comfort from the Challenger jobs report, which showed that the pace of US job losses had slowed.This was quickly counterbalanced by the ADP data, which said companies cut 298,000 posts in August. Analysts had expected 250,000 job losses.Disappointing news on factory orders also offset better-than-expected data on non-farm productivity.The S&P 500 closed down 0.3 per cent at 994.75. On Tuesday, the index fell below 1,000 for the first time since the middle of August. The Nasdaq fell 0.1 per cent to 1,967.07, while the Dow Jones Industrial Average dropped 0.3 per cent to 9,280.67.“Even though the ADP numbers were a little bit disappointing, it is still consistent with improving data so I think what we’re going to see . . . is the market trying to stabilise over the next day or so before we move into the long weekend,” said Peter Cardillo, chief market economist at Avalon Partners.Energy companies were some of the market’s best performers following BP’s announcement that it had made a significant oil discovery at its Tiber Prospect in the US waters of the Gulf of Mexico.ConocoPhillips, one of BP’s partners in the Tiber, closed up 0.4 per cent at $44.34. The materials sector also fed the market’s gains after the price of gold climbed to a three-month high during the day.As the mood of uncertainty persisted, investors headed towards the consumer staples sector later in the day. Brown-Forman, the maker of Jack Daniels and Southern Comfort, was one of the main beneficiaries, rising 5.9 per cent to $46.39. Coca-Cola climbed 2.3 per cent to $49.8.After leading Tuesday’s decline, the S&P financials group flirted with gains for brief periods before closing down 1 per cent.Wells Fargo rose 0.5 per cent to $26.09, after Bloom-berg reported the bank planned to pay back bail-out money to the US government without issuing new shares.The San Francisco-based lender had been at the centre of a sell-off in the financial sector on Tuesday as fears grew about the health of the banking system.But concern still lingered. Citigroup closed up 0.4 per cent at $4.56 and Bank of America was up 1.1 per cent at $16.27.Fannie Mae and Freddie Mac suffered after the Mortgage Bankers Association proposed that Congress transform the government-controlled mortgage lenders into several smaller privately-held companies backed by government guarantees.Fannie Mae was down 13.8 per cent at $1.37, while Freddie Mac retreated 13.7 per cent to $1.64.The industrial sector also showed losses as investors digested the stream of mixed economic data.General Electric was down 1.1 per cent at $13.20, while US Steel Corporation was down 0.6 per cent at $41.71.Textron, which owns a network of aircraft, defence, industrial and finance businesses, escaped the sector’s decline and closed 12.2 per cent up at $17.39 after an upgrade from Goldman Sachs.However, homebuilders maintained losses even as the broader market wavered.Hovnanian fell 7.4 per cent at $4.65, while Standard Pacific was down 1.2 per cent at $3.26. The stocks had enjoyed a rally a week previously when US home sales data for July came in above forecast.In the pharmaceuticals sector, Walgreen fell 0.7 per cent to $33.81 after the drugstore chain announced that comparable front-end sales had fallen 1.3 per cent in August as shoppers cut back on discretionary items.After a rally on Tuesday on news of trials of seasonal flu vaccines, Novavax fell 10.7 per cent to $5.94 on a downgrade.The utilities sector remained in the red for most of the day.
109;ADP;Automatic Data Procs;2020-04-24T18:07:40+0000;Pace of US job cuts appears to ease;;US companies shed the fewest number of jobs in nearly a year last month, as the sharp pace of job cuts slowly started to ease.Separately on Wednesday the commerce department said that US factory orders increased in July for the fifth time in the last six months as companies have begun to replenish their stocks.Private companies cut 298,000 jobs from their payrolls in August, according to a survey by ADP employer services on Wednesday. The figure was an improvement from the previous month’s decline of a revised 360,000 jobs but was worse than economists had predicted.Job cuts have eased in the private sector in each of the past three months and have shown substantial improvement from earlier in the year, when monthly job losses averaged 691,000 in the first quarter. Although the pace of job cuts is slowing, economists are fearful that the US economy could be facing a “jobless recovery”, where hiring painfully trails behind other areas of growth.“Employment losses are clearly diminishing,” ADP said in its report. “Despite recent indications that overall economic activity is stabilising, employment, which usually trails overall economic activity, is still likely to decline for at least several more months, albeit at a diminishing rate.”Producers of goods were hit the hardest last month, with the sector shedding 152,000 jobs. Companies providing services cut 146,000 workers, while manufacturers had their best month since July 2008, cutting 74,000 jobs.Big companies, with more than 500 workers, fared the best last month, with medium-sized and small businesses bearing the brunt of job losses.“Firms may have cut labour aggressively in this cycle, but for the moment there is enough spare capacity to defer the decision of increased hirings,” said Alan Ruskin, strategist at RBS Greenwich Capital.Analysts took hope from a separate report on Wednesday from Challenger, Gray & Christmas, an outplacement consultancy, which showed that announced layoffs declined to the lowest level this year in August and were down by 21 per cent from July. Planned job cuts have narrowed in six of the past seven months and were off by 14 per cent compared with the same month the year before.“This report is consistent with other data showing a considerable lessening of the pace of job declines from the peak rates earlier in the year,” said Joshua Shapiro, chief US economist at MFR.In spite of recent signs of easing, the US labour force remains under severe pressure. High rates of unemployment and and the impact of companies reducing the number of hours their employees are working is ramping up productivity.The labour department said that in the second quarter of this year productivity in the business sector grew at an annual rate of 6.6 per cent. That was the sharpest rise since the third quarter of 2003, as hours worked fell by 7.6 per cent but output showed a moderate dip of 1.5 per cent.Economists were eagerly awaiting the official non-farm payroll report due on Friday. Wall Street analysts expect that the US economy shed 225,000 jobs last month, raising the unemployment rate to 9.5 per cent.Meanwhile, the rise in US factory orders followed Tuesday’s Institute for Supply Management figures showing that manufacturing activity in the US expanded for the first time in 19 months. Factory orders grew by a less-than-expected 1.3 per cent to $355.5bn, fuelled by a surge in demand for durable goods.John Ryding and Conrad DeQuadros, economists at RDQ Economics, note that factory orders are up at an annual rate of 14.3 per cent in the last three months, signalling a boost in business equipment spending in the second half of the year.
110;ADP;Automatic Data Procs;2009-08-05T21:02:17Z;Banks buck wider Wall St retreat;;"US stocks declined on Wednesday but the benchmark S&P 500 index managed to stay above 1,000 as the market pared some of its early losses sparked by downbeat economic data.The ADP employment report suggested that private employers cut more jobs in July than expected, which weighed on markets at the start of trading.Equities then extended those losses following the release of figures showing output in the service sector in July was weaker than expected.The ADP report is considered an indication of the unemployment rate, which will be released on Friday, and investors focused on this more than the Challenger jobs report, which suggested fewer companies announced job cuts in July than a year ago.But positive words from UK bank Lloyds, which said that its loan impairments had peaked, along with figures showing mortgage applications rose more than 4 per cent last week, drove buying in US bank stocks even in the face of negative data.Citigroup rose 10.2 per cent to $3.58 while Bank of America rose 6.5 per cent to $16.66 and Wells Fargo gained 5.7 per cent to $28.02.After the closing bell, Cisco and News Corp released their quarterly earnings and both companies beat estimates.Industrial stocks were the significant drag, led lower by Quanta, the biggest US builder of powerlines, which missed earnings estimates after being hurt by continuing weakness in the energy sector. Its shares fell 1.2 per cent to $23.17.The S&P dropped 0.3 per cent to 1,002.72, and the Dow Jones Industrial Average fell 0.4 per cent to close at 9,280.97.The Nasdaq Composite index dropped 0.9 per cent to 1,993.05.“The economic news suggests that the economy is bottoming but the turn is going to be slow,” said Alan Gayle, senior investment strategist at RidgeWorth Investments.There were mixed signs on consumer activity as several blue-chip companies reported quarterly results. Shares in Whole Foods, the upmarket grocery chain, bounced 15.6 per cent to $28.70 after the company beat estimates for sales, profits and margins.Kraft also showed resilience in the food sector after the company, which counts Oreo cookies among its well-known brands, beat analysts’ expectations and raised its full-year profit outlook.But the shares slipped a fraction lower to $28.33
following a recent spike on the back of similarly good numbers from rivals General Mills and Kellogg’s.There were more negative signs on customer spending, however, from Procter & Gamble, the world’s largest consumer group.The company’s revenues disappointed Wall Street and, even though earnings were slightly ahead of analysts’ expectations and the company maintained its full-year guidance, its shares fell 2.8 per cent to $53.91.Meanwhile, Polo Ralph Lauren, the clothing company, rose 7.1 per cent to $68.31 after stronger sales and cheaper supply chain costs helped the company post stronger profits and margins than expected.Elsewhere in the consumer sector, Electronic Arts saw its shares rise
following impressive results, fuelled by strong sales of The Sims 3 video-game and tight cost
controls.But the stock ultimately lost 6.8 per cent to $20.40, after John Riccitiello, chief executive, warned of continued weakness in the sector, saying orders from retailers remained low.Garmin jumped 23.8 per cent to $33.66 after the satellite navigation system maker beat its earnings estimates and significantly improved profit margins following steep cost cuts.Two of the best-known car rental companies found gains. Shares in Dollar Thrifty rose 14.2 per cent to $20.02 after the company exceeded estimates, having successfully raised its prices and cut costs last year.Some industry analysts now predict the company could become a takeover target for a bigger rival.One of those rivals, Avis, announced a quarterly loss with rental volumes remaining low. But the shares closed up 5 per cent to $9.39 as the company said demand had begun to stabilise."
111;ADP;Automatic Data Procs;2020-04-24T18:07:40+0000;Survey finds US job losses slowed in July;;A survey on Wednesday showed US companies cut a worse than expected 371,000 jobs last month, but the haemorrhaging of jobs across the economy continues to slow.The ADP National Employment Report, published with Macroeconomic Advisors, showed its smallest decline since October. Economists surveyed by Bloomberg expected, on average, a decrease of 350,000.Barack Obama, US president, later on Wednesday touted the impact of his administration’s stimulus programme on creating jobs, while announcing $2.4bn in Energy Department grants for electric-car development.Speaking in Indiana, one of the areas hardest hit by job losses, the US president said:“This area has been hit with a perfect storm of economic troubles…And there have been times where nearly one in five people in this area have been looking for work. Overall the companies believe these investments in battery technology will save or create thousands of Hoosier [Indiana] jobs.”He said the stimulus passed in February had already created “dozens” of jobs resurfacing the runway at a local airport and that local factories had begun recalling employees.The 371,000 lost posts shown in the ADP report are consistent with an increase of 0.3 percentage points in the unemployment rate, Chris Varvares, president of Macroeconomic Advisors, said in a conference call. This would bring the unemployment rate for July - which will be released on Friday by the Bureau of Labor Statistics - up to 9.8 per cent. But, he said, the numbers could represent a change of as little as 0 or as much as 0.6 per cent.According to the report, the private sector has shed 6.7m jobs since losses began in February 2008. But losses have moderated considerably, down over 100,000 from June and at about half of their peak level last March.“It’s going to be a slow grind upward for the remainer of the year,” said Joseph Brusuelas, director of Moody’s Economy.com.Losses continued to be widespread. Employment in the service sector fell by 202,000. In the goods-producing sector it fell by 169,000 and in the manufacturing sector it dropped by 99,000. Large businesses lost an additional 74,000 workers in July, medium-sized businesses dropped 138,000 people and small business payrolls fell by 138,000.“Sub-par” job gains should begin at the beginning of next year, said Mr Varvares, and consisted job growth is expected by mid-2010.ADP began releasing the survey of the payroll data of 1 in 6 private employers in May 2006, and revised its methodology in January after criticism about its accuracy.A separate survey by outplacement consultancy Challenger, Gray & Christmas, found that planned job cuts jumped 31 per cent in July to 97,373, after falling to a 15-month low in June.“After June’s surprisingly low job-cut total, a July rebound was not entirely unexpected,” said John A. Challenger, chief executive officer of Challenger, Gray & Christmas in a release. “Monthly job cuts are likely to return to levels in excess of 100,000 by the fourth quarter.”Separately, the pace of the contraction of the service sector, which accounts for about 80 per cent of US economic activity, unexpectedly increased, according to an index of the Institute of Supply Management, released on Wednesday.The index fell 0.6 from 47.0 to 46.4. Economists surveyed by Reuters had been expecting the index to increase to 48.0. Any number below a 50 indicates a contraction. The reading comes just two days after the ISM’s manufacturing survey showed the pace of the decline of the non-manufacturing sector slowed.The employment component of the index also showed a faster decline, falling -1.9 points to 41.5.“The service sector poised to continue cutting jobs at an advanced pace,” said Mr Brusuelas, director of Moody’s Economy.com.
112;ADP;Automatic Data Procs;2009-07-01T13:00:42Z;US private sector sheds 473,000 jobs;;US companies cut nearly a half million jobs last month as the recession continued to cut into the labour market in spite of other recent signs of hope in the economy.Private companies cut 473,000 jobs from their payrolls in June, according to a survey by ADP employer services on Wednesday. The figure was slightly lower than the revised 485,000 jobs slashed in May, but was worse than economists expected and raised fears that the unemployment rate would continue to climb.Although the monthly figure remains grim it was the lowest total since last October and marks an improvement from the more severe job losses earlier in the year. ADP noted that monthly job losses in the second quarter averaged 492,000, down from 691,000 in the first quarter.Employment in the goods-producing sector was hit the hardest, where 250,000 jobs were shed. Manufacturers, which have shed workers for 40 months in a row, culled 146,000 jobs in June, and construction employment fell by 97,000 as builders continue to cut back. In the services sector 223,00 jobs were lost.Last month medium-sized businesses suffered the most job cuts, followed by small businesses and large companies.“Despite some recent indications that economic activity is stabilising, employment, which usually trails overall economic activity, is likely to decline for at least several more months,” ADP said in its report.Some analysts took hope from a separate report from Challenger, Gray & Christmas, an outplacement consultancy, which showed that announced lay-offs declined in June for the fifth straight month and were down 9 per cent compared with the same month a year ago. However, persistent high levels of jobless claims and Tuesday’s Conference Board report showing a drop in consumer confidence continue to darken optimism for a fast recovery.Wednesday’s reports sets the stage for Thursday’s labour department non-farm payroll figures. Economists expect that the US shed another 363,000 workers in June, pushing the unemployment rate to 9.6 per cent.Wall Street initially took confidence from the Challenger report but futures lost some of their shine after the release of the ADP figures.
113;ADP;Automatic Data Procs;2020-04-24T20:32:47+0000;ADP: Private sector cut 532,000 jobs in May;;US companies cut more than half a million jobs last month as the recession continued to chip away at the country’s labour market, while the service sector shrank more than expected.Private companies cut 532,000 jobs from their payrolls in May, according to a survey by ADP Employer Services. Although that was fewer than the revised 545,000 jobs slashed in April, the number was worse than many predicted and pushed shares lower on Wednesday morning.“This is a weak report [but] you could argue at least it was better than it was a few months back,” said Joel Prakken, chairman of Macroeconomic Advisers, which jointly produces the ADP survey. Earlier in the year, payrolls were consistently being cut by more than 600,000 each month. “That improvement, if it sticks and even improves further, is consistent with a notion that a freefall in the economy is likely over,” Mr Prakken added.Figures from the Institute of Supply Management showed that the US service sector – which represents about 80 per cent of economic activity in the US – was still contracting in May, albeit at a slightly slower pace.The index rose to 44, from 43.7 in April. Any number below 50 indicates contraction, and economists had predicted a better figure of 45.”It kind of fits with all the other news we’re getting: things are less bad but they’re not yet growing,” said Jonathan Basile, an economist at Credit Suisse. “It’s encouraging to see this stabilisation process start to take hold, but at the same time the weakness does persist. These are still indications that we’re not totally out of the woods yet.”Companies have responded to such shrinking activity by cutting jobs. Last month the number of manufacturing jobs dropped by 149,000, while service providers cut 265,000 workers.The ADP report is closely watched because it comes two days ahead of the government’s official payroll and unemployment figures for May. In April, unemployment climbed to 8.9 per cent while payrolls dropped 539,000. Economists expect the unemployment rate to punch through 9 per cent when it is released on Friday.
