;Ticker;Nombre_Completo;Date_Time;Titular;Subtitular;Texto
66;ADP;Automatic Data Procs;2011-01-05T22:36:33Z;US jobs cheer spurs dollar’s advance;;The dollar surged higher on Wednesday as robust US economic data raised hopes over the strength of the country’s recovery.The ADP survey of US private sector employment showed private payrolls rose 297,000 in December, far ahead of expectations for a 100,000 rise and lifting hopes that Friday’s US employment report would come in strong.Robert Lynch of HSBC said that the payrolls rise could be taken as a sign of the kind of broader improvement in the US economy that could let the Federal Reserve end quantitative easing sooner than planned. “The prospect of an early end to [the Federal Reserve’s quantitative easing] programme could temporarily work to the dollar’s advantage,” he said.The dollar rose 1.5 per cent to Y83.27 against the yen, was up 1.9 per cent at SFr0.9668 against the Swiss franc and 0.5 per cent stronger at $1.5505 against the pound.The dollar also climbed 1.2 per cent to $1.3155 against the euro, with the single currency coming under pressure as concerns over the finances of countries on the periphery of the eurozone continued.The euro fell as the yield demanded by investors to refinance Portugal’s government debt rose sharply. In a six-month Portuguese bill auction, yields soared to 3.686 per cent from 2.045 per cent at the previous sale.Analysts said that reports in the Irish press that the Swiss National Bank had refused Irish government bonds as collateral from investors attempting to raise funds in repo transactions could also focus attention on Dublin’s continuing financial problems.Guilia Comotti at Barclays Capital said that the move actually took place on December 21. It appeared to be the result of Ireland’s credit rating falling below the minimum double A minus rating acceptable by the SNB for euro-denominated collateral following downgrades from ratings agencies Fitch and Moody’s in December.She noted that Irish bonds were still acceptable as collateral by the European Central Bank, though the lack of clarity on the extent of eurozone authority to address such structural problems left peripheral debts vulnerable.“This uncertainty is likely to weigh on the euro in the next few months,” said Ms Comotti.Commodity-linked currencies were stronger as oil rose in defiance of the dollar’s surge. The Mexican peso was up 0.3 per cent to 12.1951 against the dollar, and the Canadian dollar rose 0.2 to C$0.9960.The Australian dollar fell below parity with its US counterpart for the first time in more than a week as worries about flooding continue to weigh on its economy. The Aussie fell 0.6 per cent to $0.9994.
67;ADP;Automatic Data Procs;2011-01-05T22:18:01Z;US stocks lifted by jobs report;;"A surprisingly positive jobs report and data showing that service industries expanded at their fastest pace since 2006 helped US stocks edge higher.Private sector employment in the ADP report increased by 297,000 in December for the biggest monthly gain in jobs since 2001, coming in far above the average estimate of 100,000 extra jobs.“There is almost no reason to quibble with today’s ADP report. This is unquestionably a positive for the economy, the labour market, income growth and risk assets,” said Dan Greenhaus, chief economic strategist at Miller Tabak. “[But] it should be pointed out that December always has seasonal quirks for a host of estimates and, while ADP suggests that there is no real reason to dispute this number, we doubt such strength will be repeated.”The Institute of Supply Management’s reading on the services industries improved in December to its highest level since May 2006.Financials and consumer discretionary stocks led the risers after the improving economic data boosted confidence in the recovery.The financial sector gained 1.2 per cent with AIG jumping 7.3 per cent to $60.93 after the insurer said that it had received offers of up to $3bn for Nan Shan Life Insurance, its Taiwanese unit. Wells Fargo added 2.3 per cent to $32.14 while JPMorgan rose 1.2 per cent to $44.70.The S&P 500 consumer discretionary index rose 0.8 per cent with online travel agencies leading the gainers. Priceline.com added 5.9 per cent to $433.60 while Expedia increased 4.1 per cent to $25.43.The S&P 500 closed up 0.5 per cent to 1,276.56, the Dow Jones Industrial Average closed 0.3 per cent higher at 11,722.89 while the Nasdaq Composite had added 0.8 per cent to close at 2,702.20.Atheros Communications added 1.5 per cent to $44.64 after soaring 19 per cent in late trade on Tuesday on deal speculation. On Wednesday it agreed to be bought by Qualcomm for about $3.2bn in cash, or $45 a share.In the latest in a series of deals in the technology sector, Qualcomm is aiming to compete more effectively in the market for tablet computers by using Atheros’s expertise in wireless technology. Shares in Qualcomm added 2.1 per cent to $52.03.Elsewhere in technology, Youku, the Chinese online video website that listed in the US to much fanfare at the end of last year, climbed 6.5 per cent to $37.95 after the company said that it was working with a “major” Hollywood studio to provide an on-
demand paid video service.Falling commodity prices weighed heavily on energy and materials stocks in early trading but the sectors had pared their losses by midday.The S&P 500 energy index edged higher by 0.2 per cent while the materials sector closed flat.ExxonMobil fell 0.3 per cent to $74.70 and Conoco-Phillips was down 0.5 per cent at $67.55.In the materials sector, Freeport-McMoRan Copper & Gold declined by 0.3 per cent to $118.35 while Southern Copper Corporation lost 0.7 per cent to $48.60.Elsewhere in materials, Alcoa, which has risen in recent days on the back of analyst recommendations, spent much of the day in negative territory before closing up 0.2 per cent at $16.56. Brian Yu, an analyst at Citigroup, cut the aluminium producer’s rating from “buy” to “hold”.Rising demand for fertiliser helped Mosaic beat earnings expectations in its second quarter. Farmers are buying more fertiliser as they seek to make the most of corn and soyabean prices that are at multi-year highs.Analysts at RBC Capital Markets kept their “outperform” rating on the stock. “Interestingly, the stronger-than-expected performance was largely attributable to the phosphate business,” they said. “Consistent with Mosaic’s third-quarter 2011 guidance, we expect to see improving results from the potash business that could provide additional momentum for Mosaic’s stock.”Majority-owned by Cargill, the agribusiness group, Mosaic earned $1.01 per share, excluding the sale of its stake in a Brazilian fertiliser producer, up from 24 cents a share in the same quarter the year before. Shares in Mosaic gained 2.8 per cent to $77.09."
68;ADP;Automatic Data Procs;2011-01-05T21:26:14Z;Job growth bolsters recovery confidence;;Surveys showing faster-than-expected jobs growth and a boost for the services sector bolstered confidence that the US economic recovery has shifted to a higher gear.The strong monthly readings on Wednesday from ADP and the Institute for Supply Management added to a string of encouraging news on the health of the US economy, which has recovered from the recession of 2007-2009 at a sluggish pace but has recently been showing signs of more rapid growth.The ADP survey signalled that businesses have started to hire new workers more aggressively, a key step towards bringing down the 9.8 per cent unemployment rate.“It’s clear that the US economy is entering 2011 on a very strong note, with good upward momentum,” said Michelle Girard, an economist at RBS in Connecticut.“Employment is clearly accelerating and that seems consistent with other data gathered at the end of the year. There are a lot of things that seem promising to us,” said Joel Prakken, chairman of Macroeconomic Advisers in St Louis.The latest evidence of a more rapid economic expansion caused 10-year Treasury yields to increase from 3.36 per cent to 3.46 per cent in morning trading, as the bond sell-off of the past two months continued.The dollar rallied and equity indices moved higher, with the S&P 500 index up 0.5 per cent. In minutes from their December 14 policy meeting released this week, Federal Reserve policymakers noted the improved outlook, but judged that the improvement was not sufficient to consider curtailing their plans to support the economy through the purchase of a total $600bn in long-term government bonds by the end of June.Still, a more rapid acceleration in activity could prompt the central bank to begin reining in the programme.The private sector added 297,000 jobs in December, up from a revised 92,000 in November and the 11th straight month of expansion, according to ADP. The gain was significantly higher than the 100,000 new jobs that economists had predicted, and bodes well for the more widely followed monthly jobs report from the US government, set to be released on Friday.The services sector led gains with 270,000 new jobs, the largest monthly rise since the survey began in 2000. The improving health of services businesses – which account for the bulk of US economic activity – was highlighted by the ISM’s non-manufacturing index, which rose to 57.1 in December from 55 in November, surpassing estimates of 55.6 per cent. A reading above 50 indicates growth. The December figure was the 12th consecutive month of growth in the sector, and the most rapid expansion since May 2006.Executives were “mostly positive about business conditions,” said Anthony Nieves, chair of the ISM non-manufacturing business survey committee, though some warned of growing price pressure. Business activity and new orders grew faster in December, with executives citing increased consumer optimism and demand for new products.The strong business activity reading “should translate into some sharing of that revenue with the labour side of the economy,” said Jonathan Basile, director of economics at Credit Suisse.Hiring continued for the fourth straight month, though at a slower rate than in November. But with companies sitting on more cash as business activity increases, employment is likely to pick up, Mr Basile said.“It’s about ‘show me the money’, and it looks like the service firms have it. They need people to generate the output.”
69;ADP;Automatic Data Procs;2020-04-16T04:01:47Z;Ethical investors want more proof of good deeds;Clients and advisers push for tougher validation of data;Last year, investors ploughed $20.6bn into US sustainable investment funds compared with $5.5bn of net inflows in 2018, according to Morningstar, the data provider.But despite the near fourfold increase in investor interest, advisers are sceptical about the company and asset management data showing the environmental, social and governance impact of the funds themselves.“I struggle mightily. I don’t believe the indexes. They are using self-reported data and I just don’t buy it,” says Traci Richmond, a financial adviser with The Meakem Group in Bethesda, Maryland.The problem with ESG data is the lack of verification. “There’s so much data and information out there, it’s really, truly a data war,” says Tim Williams, the director of education initiatives at the Money Management Institute, a trade association.Morningstar, Bloomberg and MSCI are among the providers of ESG data and rankings. Each has recently attempted to address investors’ scepticism by seeking out more third-party verification. MSCI, for example, points to “alternative data sets” published by “sources outside of the company” that help “minimise reliance on voluntary disclosure”.There is also a growing trend to adopt ESG reporting standards set by organisations such as the Sustainability Accounting Standards Board (SASB) and the Task Force on Climate-Related Financial Disclosures (TFCD). But these bodies cannot set mandatory rules on data verification.I don’t believe the indexes. They are using self-reported dataThe US Securities and Exchange Commission has resisted adopting measures that some investor groups have proposed. Hester Peirce, one of the commissioners, has been openly disdainful of the ESG trend, describing it as “labelling based on incomplete information, public shaming, and shunning wrapped in moral rhetoric preached with cold-hearted, self-righteous oblivion to the consequences, which ultimately fall on real people.”Even so, late last year the SEC sent letters to some fund managers who target socially responsible assets, asking them to provide data on what factors they took into consideration.With no clear state-backed scrutiny of ESG data, investors and advisers must uncover deficits or misrepresentations in the growing pool of facts and figures themselves. “The challenge is how do you take all that information and turn it into useful investment decisions at all levels of the food chain,” Mr Williams says.Many wirehouses, the national brokerages selling investment services via advisers, have started to provide tools and resources to help clients better evaluate ESG data — and not just accept them at face value.Morgan Stanley, Merrill Lynch, Wells Fargo and UBS have increased their spending to acquire higher quality data and better sorting mechanisms for funds and assets that purport to be socially responsible.Last summer, Morgan Stanley launched a tool to help investors and advisers uncover misalignments between their portfolios’ assets and socially responsible objectives. The tool only uses third-party verified data and identifies where data quality deficits persist, says Courtney Thompson, a vice-president in Morgan Stanley’s Global Sustainable Finance group. “Having the data available is a key [and is] driving traction around the investments.”Morningstar also advises investors to be sceptical of fund managers and companies claiming a socially responsible focus. “I would caution investors that, while ESG index funds on the whole separate ‘better’ ESG companies from ‘worse’ ones reasonably well, those decisions are not based on fundamental evaluations and mistakes can be made,” says Jon Hale, Morningstar’s head of sustainability research. “Companies have started to understand that their ESG and sustainability disclosures are being scrutinised more heavily, and that helps.”Investors should seek underlying holdings reports from fund managers “so they can look at really what exposures they have”, says Vanessa Jilot, a financial adviser at Viewpoint Financial Network in Pleasanton, California. “My clients hope that, as you have more money moving to request ESG data, reporting will get better.”
70;ADP;Automatic Data Procs;2010-12-01T22:09:29Z;Wall Street enjoys broad-based rally;;"Energy and materials stocks led a broad-based rally after strong economic data out of the US and China combined with fading concerns about eurozone debt.The S&P 500 closed up 2.2 per cent to 1,206.04, the biggest one-day gain since the beginning of September.The Dow Jones Industrial Average gained 2.3 per cent to 11,255.85 and the Nasdaq Composite was 2.1 per cent higher at 2,549.43.All 10 main sectors of the S&P 500 rose more than 1 per cent and six adding more than 2 per cent.“The tone was set quite favourably overseas with good news from both China and the eurozone overnight,” said Phil Orlando, chief market strategist at Federated Investors. “The futures were poised to rally 1 per cent or so from the get-go but they added 1 per cent or so from the constructive US economic news.”The energy sector led the risers, gaining 2.9 per cent with Chevron advancing 2.1 per cent to $82.70 and ExxonMobil higher by 2.5 per cent to $71.33.The materials sector added 2.8 per cent, with Titanium Metals Corp
surging 4.6 per cent to $18.07 and Freeport-McMoRan Copper & Gold gaining 4.1 per cent to $105.49.The S&P 500 industrials index jumped 2.6 per cent with Caterpillar, the best performing Dow stock in November, gaining 3.4 per cent to $87.45, Cummins adding 3.5 per cent to $100.52 and Honeywell advancing 2.4 per cent to $50.88.Investors were cheered by the Chinese Purchasing Managers’ Index, which climbed to a seven-month high, and the ISM index of US manufacturing activity, which slipped only slightly in November after a very strong October.In a big day for US economic data, ADP’s national employment report released before the opening bell showed that the number of private sector jobs had risen more than expectedin November.“Although we do not put great weight on ADP employment in our payroll forecast, it is worth noting that this is the strongest reading on ADP private payroll growth since Nov-ember 2007 (the month before the onset of the recession),” said John Ryding, of RDQ Economics.A separate report showed US non-farm productivity in the third quarter had grown faster than previously estimated. The upward revision of the figure, a leading indicator for hiring, matched economists’ expectations.Recruitment companies, which have risen significantly in the past couple of months, gained after the report. Monster Worldwide, which rose 25 per cent in November, added 1.7 per cent to $22.97 while Manpower was up 2.4 per cent to $57.27.Fears about the stability of the eurozone, which have dominated the market in the past two weeks, subsided after Jean-Claude Trichet, president of the European Central Bank, said the ECB could step up its purchases of eurozone bonds.A report showed US shoppers had spent 16 per cent more online on Monday, the busy internet shopping day now dubbed Cyber Monday, than on the same day last year. The ComScore release said sales from websites had reached $1.03bn.The S&P 500 retail index added 1.8 per cent. But Amazon gained just 0.7 per cent to $176.55 and Ebay nudged up 0.4 per cent to $29.26.Google fell on Tuesday after the European Union said it had opened a full investigation into allegations from smaller competitors that the company
had abused its dominant market position. But the stock rebounded 1.6 per cent to $564.35 after it was reported the company planned to open an online store for electronic books in the US this year and internationally in 2011.American Express added 2.5 per cent to $44.30 after the payment processor was rated “overweight” by Richard Shane, an analyst at JPMorgan.Mr Shane started coverage of the stock with a 12-month price target of
$50 a share, saying its spend-driven model should outperform companies
with credit-driven models as consumers reduced their debt.Motorola soared 4.5 per cent to $8.01 after the phone maker said that it would complete its plans to split in two on January 4, issuing new shares in the two companies to current shareholders."
71;ADP;Automatic Data Procs;2020-04-24T20:32:47+0000;US private sector adds 43,000 jobs;;Private companies added 43,000 jobs in October, offering a glimmer of hope ahead of the national jobs report on Friday.Economists had expected the survey of ADP private sector employers to show growth of just 20,000 jobs. Instead, the jump of 43,000 was the largest addition of jobs to the economy since June.The gains were a good sign as the US Federal Reserve wraps up its meeting, at which it decides how much stimulus to pump into the economy. But it was still not a reversal of longstanding weakness in the US labour market.“Double-digit trends in ADP are not strong enough to bring down the unemployment rate,” said Jonathan Basile, an economist at Credit Suisse, who said that sustained triple-digit increases are needed to reduce unemployment.September’s loss of 39,000 jobs was revised to a loss of just 2,000. Combined with other revisions and the new gains, the report showed an overall job gain of 107,000.The strongest gains were made by small and medium-sized businesses with fewer than 500 employees. Those companies added 45,000 jobs, offsetting a decline of 2,000 jobs by the largest companies.The jobs also came from the service sector, which added 77,000 jobs, offsetting a decline of 34,000 jobs in the manufacturing sector.“These would be welcome developments if they persist as the service sector needs to be the primary engine of job growth as the manufacturing cycle slows, and smaller firms have been hiring at a sluggish pace,” said Julia Coronado, chief US economist at BNP Paribas.The financial services industry lost jobs, but by the slimmest margin since July 2007, by just 2,000 jobs. Construction continued its heavy losses, losing 23,000 jobs.The non-farm payroll report for October on Friday is expected to show a gain of 60,000 jobs overall, with a loss of 20,000 government jobs offsetting a gain of 80,000 private-sector jobs. That would reverse a net loss of 29,000 jobs in September.According to Credit Suisse figures, the ADP survey has underperformed the national survey FROM the Bureau of Labor Statistics by an average of 73,000 jobs a month over the past year.It follows strong performances for the Institute of Supply Management’s surveys of manufacturing and non-manufacturing activity for October.The non-manufacturing survey, a measure of service sector activity, released on Wednesday showed the index at 54.3, its highest level since March and an improvement from 53.5 in September. A reading of more than 50 indicates expansion.Earlier in the week, the manufacturing index, a measure of new factory orders, was at 56.9, marking the 15th consecutive month of rising manufacturing activity.
