;Ticker;Nombre_Completo;Date_Time;Titular;Subtitular;Texto
27;COTY;Coty Inc;2017-04-03T15:00:19Z;Burberry licenses make-up and fragrances to Coty;US group to pay £130m for global rights and £50m for assets as fashion house ends in-house experiment;Burberry has thrown in the towel on a four-year experiment to develop its fragrance and beauty business in-house, by franchising the operations to Coty — the fast-expanding US cosmetics group.Coty is to pay £130m for the global licence and a one-off £50m for the assets. The unit has annual revenues of £203m, of which 92 per cent is from fragrances.Burberry is the first big franchise win for Coty since it acquired the licence to make Gucci and Hugo Boss fragrances as part of its $12.5bn acquisition of Procter & Gamble’s beauty business, which completed last year.That acquisition has made it the world’s third-largest cosmetics group by sales, after France’s L’Oréal and Estée Lauder of the US.Burberry’s decision was welcomed by analysts as freeing it to focus on improving returns from its retail operations, after a year of upheaval.Helen Brand, analyst at UBS, said: “We see this deal as an incremental positive for the stock as the beauty division has been underperforming and was likely a drag on management time.”Rogerio Fujimori, analyst at RBC Capital Markets, said Burberry had recognised “the challenges to develop the business internally in a highly competitive category and against much bigger competitors like Chanel or Dior”.Burberry paid £144m to take back the licence to its fragrance business in 2013, but as Ms Brand noted: “A licence income of £25m-£30m previously has fallen to less than £10m of earnings before interest and tax today, as there was more ‘clean-up’ required than hoped.”For Coty, the Burberry deal goes some way to compensate for missing out on the licence for Dolce & Gabbana fragrances, which went from P&G to Japan’s Shiseido.It also lessens Coty’s dependence on celebrity fragrances. Camillo Pane has emphasised expansion into luxury brands since becoming chief executive last October.Mr Pane said: “Celebrity fragrances remains part of the market and our portfolio. Our growth strategy, however, is more focused on the prestige fragrance market and Burberry will be a great addition.”Burberry tried to relaunch its make-up division this year with a major campaign headed by model Iris Law, daughter of actors Jude Law and Sadie Frost. The British fashion house said it expected sales of make-up to rise to 15 per cent of beauty revenues from 8 per cent currently.John Smith, who stepped down in January as Burberry’s chief operating officer but remains an executive director, said the new licence was “unusual” as it gave Burberry creative control over everything customer-facing, including imagery, point of sale marketing and the faces of its beauty advertising campaigns.As part of the rebranding of its beauty business, Burberry cut the number of points of sale from 3,500 when it took over the licensing agreement in 2013, to just 35.Luca Solca, analyst at Exane BNP Paribas, said: “We welcome the choice of a first-class partner to develop the Burberry beauty business — we never liked the idea of Burberry managing its beauty business directly, as beauty is an FMCG [fast-moving consumer goods] business where you win on the back of global reach.”
28;COTY;Coty Inc;2017-02-09T21:33:47Z;Coty slides on pessimism over declining sales;US stocks rally as all three big benchmark indices hit record highs;Investors soured on Coty shares after the US cosmetics group’s latest results showed that it is struggling to stem the tide of declining sales in its own portfolio and its newly acquired stable of Procter & Gamble’s beauty brands.Coty shares slid 8.6 per cent to $18.32 after the owner of Covergirl reported a 7 per cent drop in revenues for its fiscal second quarter.The result is the first to include the sales of Clairol and 42 other beauty brands that Coty acquired from P&G for $12.5bn and the weak performance is expected to raise questions over the timing of the deal, given the competition in the mass beauty and personal care industry.“The business was impacted by significantly higher than anticipated inventory levels in the market on the acquired P&G Beauty Business, competitive pressure in the Consumer Beauty division and the distraction associated with the merger integration efforts,” said chief executive Camillo Pane.Revenue for the combined businesses fell to $2.29bn for the three months to end of December, below expectations of $2.36bn as the strong dollar exacerbated the sales drop in its luxury and consumer beauty divisions.Coty had a particularly rough quarter in the US, where weak demand dragged revenues in North America 12 per cent lower.7%Drop in revenues for the fiscal second quarter at CotyOverall net income tumbled to $46.8m from $89m “reflecting lower operating income and higher interest expense, partially offset by lower tax expense”.Stripping this out, adjusted net income rose 45 per cent to $223.3m — albeit still be low forecasts for $245.3m.The sell-off in Coty shares came alongside a rally in US stocks that saw all three major benchmark indices hit record highs.At the close in New York, the S&P 500 was up 0.6 per cent to 2,307.9, the Dow Jones Industrial Average gained 0.6 per cent to 20,172.4 and the Nasdaq Composite climbed 0.6 per cent to 5,715.2.Teradata was the biggest gainer on the S&P 500 after the big-data software maker said it swung to a profit in the fourth quarter and issued an upbeat sales outlook for the current quarter.The Atlanta-based company posted profits of $58m, or 44 cents a share, in the three months ended in December, compared with a loss of $49m, or 37 cents, in the year ago quarter.$58mTeradata profits in the three months to end-DecemberAdjusting for one-time items earnings of 67 cents a share, topped estimates. However, sales slid more than expected to $626m, impacted by the 2016 sale of its Marketing Applications business.For the fiscal first quarter, the company projected sales of $500m that beat Wall Street expectations of $485.4m.Teradata’s shares rose 8.5 per cent to $32.74.Meanwhile, data and analytics company Dun & Bradstreet was the biggest decliner on the S&P 500, tumbling 16.8 per cent to $101.88 after posting weaker than expected fourth-quarter profits and downbeat guidance.The New Jersey-based company reported adjusted earnings of $2.99 a share that missed Wall Street projections of $3.03. Sales climbed 4 per cent to $517.1m and were ahead of projections for $513.4m.The company also said that it expects earnings per shares to decline in a range of 4 to 9 per cent year on year in fiscal 2017 primarily due to increased interest expense, citing the impact of a possible two to three rate rises by the Federal Reserve.The company also said it expected organic revenue growth in a range of 1 to 3 per cent. This was weaker than the mid-single digit growth that some analysts were looking for.
29;COTY;Coty Inc;2017-02-09T14:18:41Z;Coty drops as P&G deal weighs on sales growth;;Bad decision? Bad timing? Either way, investors are not reacting kindly to Coty’s latest earnings results, which show the US cosmetics group struggling to stem the tide of declining sales in both its own portfolio and its newly acquired stable of Procter & Gamble’s beauty brands.Shares in Coty fell more than 5 per cent in pre-market trading after the owner of Covergirl reported a 7 per cent drop in revenues for its fiscal second quarter.The result is the first to include the sales of Clairol and 42 other beauty brands that Coty acquired from P&G for $12.5bn and the weak performance is expected to raise questions over the timing and wisdom of the deal given the fierce competition in the mass beauty and personal care industry.“Consistent with our comments on the last earnings call, Q2 was a challenging quarter,” said chief executive Camillo Pane.“The business was impacted by significantly higher-than-anticipated inventory levels in the market on the acquired P&G Beauty Business, competitive pressure in the Consumer Beauty division and the distraction associated with the merger integration efforts.”Revenue for the combined businesses fell to $2.29bn for the three months to end of December, below expectations of $2.36bn as the strong dollar exacerbated the sharp sales drop in its luxury and consumer beauty divisions.Coty had a particularly rough quarter in the US, where weak demand for consumer beauty products dragged revenues in North America 12 per cent lower.“There are some changing dynamics in cosmetics where consumers look at brands and products and trends, and want innovation more frequently, so we need to adjust the positioning of some of our brands, [we'll be] changing the innovation process in colour cosmetics to be faster to market,” Mr Pane said, adding that pushing the company’s ecommerce strategy of of key importance as well.Overall net income tumbled to $46.8m from $89m “reflecting lower operating income and higher interest expense, partially offset by lower tax expense.” Stripping this out, adjusted net income rose 45 per cent to $223.3m – albeit still low for forecasts of $245.3m.Last quarter Bart Becht, Coty chairman, blamed the “massive distraction” of integrating the P&G assets for a fall in Coty’s first quarter sales.On Thursday the company said it remained on track to complete its P&G beauty business integration, with a $750m synergy target by 2020 and said it expects the revenue decline to slow down for the second half of fiscal 2017.“It’s a transitional year and we were somewhat expecting these results,” Mr Pane said. “We need to remind ourselves that this is not an integration but a new organisation, and we believe the new company will be much stronger than the previous organisation, one with larger scale . . . with better people, and can attract stronger people.”
30;COTY;Coty Inc;2017-01-10T17:48:25Z;Coty buys $600m stake in online cosmetic retailer Younique;;Coty, the US cosmetics group, has begun the New Year with its appetite for acquisitions undiminished. It announced on Tuesday that it would pay $600m for a controlling stake in Younique, a four-year old start-up.Younique’s sibling founders, Derek Maxfield and Melanie Huscroft, will retain a 40 per cent stake in the online cosmetics retailer, which they will continue to run as a separate business within Coty’s consumer beauty division, reports Scheherazade Daneshkhu in London.Coty is to pay $600m cash for a 60 per cent stake, funded through a mix of cash on hand and debt.Younique, which had net revenues of $400m last year and is profitable, sells cosmetics online, mainly on mobile devices, and said it had 4.1m consumers in 10 countries.It is also an online version of Avon, the door-to-door retailer, having recruited 200,000 online staff who earn commission on sales.The acquisition follows that of London-based Ghd, the haircare business, Coty bought for $510m in October.Coty has spent more than $15bn on beauty assets – reducing its dependency on fragrances – since July 2015 when it acquired Procter & Gamble’s beauty brands for $12.5bn.Bart Becht, Coty chairman, in November blamed the “massive distraction” of integrating the P&G assets for a fall in Coty’s first quarter sales.He said he expected “similar revenue trends” for the following quarter. Coty’s shares have lost 20 per cent of their value over the past 12 months.Nevertheless, Coty’s acquisitions have doubled the size of the business and put the New York group on course to challenge L’Oreal, the industry leader, which is three times bigger than Coty in annual revenue terms.The French group also hit the acquisition trail on Tuesday by spending $1.3bn on three Canadian skincare brands, while Unilever, the Anglo-Dutch group has also been buying up high-end personal care brands, as it seeks to reduce its dependence on its slow-growth food business.Mr Becht is also chairman of JAB Holding, the group privately-held by Germany’s billionaire Reimann dynasty, which is Coty’s controlling shareholder.JAB has also been spending lavishly on building a coffee empire to rival Nestle, with acquisitions that include Keurig Green Mountain, Peet’s Coffee & Tea and Caribou Coffee.
31;COTY;Coty Inc;2016-11-09T19:13:26Z;Coty suffers record drop on weak sales outlook;;Coty is going to need a lot of lipsticks to dress up its fiscal first quarter results.Shares in the US cosmetics group dropped by the most on record on Wednesday after it delivered a surprise slide in sales and warned that the weak trend is expected to continue into the current quarter.For the September quarter, sales fell 3 per cent to $1.08bn, confounding Wall Street expectations for a modest increase to $1.135bn, from the $1.11bn recorded in the year ago period.That was led by a 10 per cent decline in sales in its two biggest division – fragrances and colour cosmetics. The company blamed the drop on “distractions” from the time and energy it spent closing the $12.5bn acquisition of Procter & Gamble’s beauty brands.Bart Becht, Coty’s chairman, said:As discussed prior to the closing, the resources which normally work on the business, have also been working on closing the transaction, and setting up and preparing for the future of the combined company. The resulting distraction as well as the recent change in management teams in our headquarters, regions and countries, have contributed to a decline in Coty stand-alone revenues and profits in Q1.The company said it expected “similar revenue trends” for the current quarter, although this should improve in the second half of the year.Coty shares fell by as much as 15.6 per cent before bouncing back to trade 9.3 per cent lower at $19.84. The drop still makes it the stock’s biggest one day decline since the company went public in June 2013.Coty broke even during the quarter, compared with a profit of $125.7m or 34 cents a share in the year ago period, when earnings were bolstered by a one off $113.3m favourable tax settlement. Earnings during the quarter were also held back by a $24.4m jump in net interest expenses.Adjusting for one-time items the company posted earnings of 23 cents a share, shy of analysts’ estimates for 33 cents. Coty, which was only added to the S&P 500 last month, has seen its shares down 24 per cent so far this year.
32;COTY;Coty Inc;2016-10-17T21:47:42Z;Coty snaps up Ghd for $510m;UK acquisition comes on top of at least $14bn that the US group has spent since June last year;US group Coty continued its spending spree on Monday, this time snapping up London-based Ghd, which makes hair straighteners and curlers, for $510m.The acquisition comes on top of at least $14bn that the US cosmetics and fragrances group has spent since June last year, in deals that have put it on a trajectory to challenge France’s L’Oréal in the global beauty industry.Coty, whose brands include Rimmel, Calvin Klein and Davidoff, last year bought Procter & Gamble’s beauty assets in a $12.5bn transaction. It spent another $1bn on Hypermarcas, the Brazilian beauty business, as it sought to bolster its overseas presence.Ghd — Good Hair Day — is being bought from Lion Capital, the private equity group, with a mixture of cash and debt, Coty said. It sells hair dryers and other electrical hair tools, including straighteners and curling tongs.Camillo Pane, chief executive of Coty, said the acquisition would “strengthen our professional haircare business through the addition of innovative market-leading brands”.Mr Pane, who became chief executive this month after the completion of the P&G deal, joined Coty last year from Reckitt Benckiser, the Dettol-to-Durex consumer goods group, which used to be headed by Bart Becht, now chairman of Coty.Ghd generated £178m in revenues last year and has operations in Australia, the US, Germany, France, Spain and Italy. Its chief executive Anthony Davey, will continue to run the business as a standalone operation within Coty’s professional beauty division.The sale gives Lion Capital an exit from Ghd, which it bought three years ago from rival Montagu Private Equity for £300m. Lyndon Lea, partner at Lion Capital, said Ghd had increased its sales by 30 per cent over the past three years.Coty’s acquisition spree has more than doubled its annual revenues to $9bn, making it the world’s biggest seller of fragrances and the third-largest company in colour cosmetics.The dealmaking has been regarded favourably by investors. Coty’s shares have risen 34 per cent since 2013, when it raised $1bn in its initial public offering on the New York Stock Exchange. It now has a market value of $17bn.JAB Holding, the group privately held by Germany’s billionaire Reimann family, is the controlling shareholder in Coty.L’Oréal, the world’s biggest cosmetics group, is almost three times bigger in terms of sales with annual revenues of €25bn and a market value of €93bn.
33;COTY;Coty Inc;2020-04-25T23:17:40+0000;US cosmetics group Coty to join S&P 500;;Coty shares popped in extended trading after the S&P Dow Jones Indices said the company would replace Diamond Offshore Drilling on the S&P 500.Shares in the US cosmetics group climbed as much as 5 per cent in extended trading after the index provider said Coty would join the S&P 500 after the close of trading on Friday.Meanwhile, Diamond Offshore Drilling will join the S&P MidCap 400, replacing Polycom, which was acquired by Siris Capital on Tuesday.The offshore rig operator has seen its shares fall more than 67 per cent since crude prices began their protracted slump in mid-2014. The company, which now has a market valuation of $2.2bn, saw its shares slide 0.7 per cent in extended trading.“Diamond Offshore Drilling is ranked at the bottom of the S&P 500 and has a market capitalization more representative of the mid-cap market space,” S&P Dow Jones Indices, said.
34;COTY;Coty Inc;2016-05-03T17:00:43Z;Coty upbeat on cost savings from P&G beauty deal;Bart Becht predicts group will generate industry-leading margins;Coty, the US cosmetics group with ambitions to expand rapidly, has sharply increased its estimate of cost savings from the beauty assets acquired from Procter & Gamble last year in a transaction valued at $12.5bn.However, acquisition-related costs of $37m contributed to a net loss of $26.8m in the three months to March 31, compared with net income of $75.5m in the same quarter last year.Coty shares, which have outperformed the S&P 500 this year, were down more than 5 per cent by lunchtime in New York, after earnings per share missed analysts’ expectations.The group, whose brands include Rimmel, Calvin Klein and Davidoff, said on Tuesday it expected to make $780m of cost savings annually from the P&G brands — at a one-off cost of $1.2bn.The savings, to be made over the next four years, equate to 16 per cent of revenues acquired from P&G, up from Coty’s previous estimate of $550m of savings at the time of the deal last July.The P&G deal will double Coty’s annual revenues to more than $9bn, making it the world’s biggest seller of fragrances and the third-largest company in colour cosmetics. Brands such as Wella will also give it a sizeable presence in the haircare market.Bart Becht, chairman and acting chief executive, said the savings would boost Coty’s operating profit margins by 6 percentage points, making it “industry leader from an operating margin point of view with margins of approximately 18 per cent”.Mr Becht, who acquired a formidable reputation in his previous job in transforming Reckitt Benckiser into one of the world’s best-performing consumer products groups, emphasised the management challenge in what he described as “the highly complex transaction”.“You are buying a carve-out, so you get a piece of the staffing, not the whole staffing. On top of that, P&G is run differently from Coty — they have more central services, for example,” he said. “Making sure we have the right people on board and that they are clear about what needs to be done, is going to be key to success.”He said there was “no timetable” for finding a full-time chief executive until “we are much more comfortable that the P&G integration is on the right track”.Mr Becht was charged with steering the integration process last year, a decision that led to Coty paying a $1.8m severance package to Elio Leoni Sceti, a former Reckitt colleague of Mr Becht, who had been anointed chief executive before the P&G deal was struck.Mr Becht is also chairman of JAB, the Reimann family holding company which is the controlling shareholder in Coty. JAB aims to forge a parallel empire to cosmetics in coffee through acquisitions, such as last year’s $13.9bn purchase of Keurig Green Mountain.Net sales rose 1.8 per cent to $950.7m. Sales of fragrances, Coty’s biggest business by revenue, fell 4 per cent — the seventh consecutive quarterly fall — while sales of colour cosmetics rose 11 per cent.In February, the group closed a deal to buy Hypermarcas, the Brazilian beauty business, for $1bn as it continued to boost its overseas presence.Hypermarcas had $14.3m in sales during the quarter, but reported an operating loss of $6.6m, due to charges relating to its integration.Coty’s expansion comes at a challenging time for the global cosmetics industry, especially in the US, as consumers increasingly choose to buy online rather than from the department stores that have been the backbone of distribution.Analysts at Deutsche Bank said: “While organic growth trends remain lacklustre, company has and should continue to aggressively use its balance sheet to transform its business into one of three clear, pure-play leaders in the global beauty industry.”
