;Ticker;Nombre_Completo;Date_Time;Titular;Subtitular;Texto
51;COTY;Coty Inc;2020-04-25T23:17:40+0000;Coty postpones $700m IPO amid slowdown;;Coty, the cosmetics group, has delayed plans to raise up to $700m in an initial public offering that had been set to be this year’s biggest consumer retailer debut.The New York-based company, which filed documents with US regulators at the end of June, is now planning to launch its IPO sometime in the first half of next year, according to people familiar with its plans.The decision comes several weeks after the company named Michele Scannavini, a Coty executive and former head of Fila sportswear, as its chief executive and amid signs of a market slowdown in North America and Europe.A sluggish IPO market in the US has made it difficult for companies without strong sales growth to debut, equity capital market bankers have said.Coty, which produces scents carrying the brands of celebrities such as Beyoncé Knowles and David Beckham, said the bulk of its sales come from the two continents. Only about a quarter of its revenue derived from emerging markets, where the company seeks to expand.Analysts highlighted cautious sales guidance by Estée Lauder and L’Oréal as indications of weakness in the broader cosmetics sector.Pablo Zuanic, consumer goods analyst at Liberum Capital, said: “There are some concerns that the prestige segment is slowing down.”Estée Lauder warned that it had seen weakness in “certain western European countries” and blamed continued global economic uncertainty for a possible slowdown.Bank of America, JPMorgan Chase and Morgan Stanley are the lead underwriters for the IPO, according to its June filing. The banks and Coty declined to comment.Coty hired the banks to launch a public offering soon after the group withdrew its bid for cosmetics direct seller Avon, bringing to an end a six-week stand-off between the two companies.“It might make more sense for Coty to wait, do a deal to get larger and get bank financing, then later when it has a more compelling story and a more fleshed out company strategy it can go for an IPO,” Mr Zuanic added.The proceeds of the IPO are intended for existing shareholders and not for the company’s useJoh A Benckiser, a family holding company based in Luxembourg, holds an 80.5 per cent stake in Coty, while entities affiliated with Berkshire Partners, the Boston-based private equity firm, hold a 7.5 per cent stake, as do affiliates of private equity firm Rhône Group, the filing said.
52;COTY;Coty Inc;2012-07-25T18:04:01Z;Coty names new chief ahead of IPO;;Coty, the cosmetics group that tried to buy Avon, will launch its planned initial public offering under new leadership after Bernd Beetz, its chief executive for 11 years, announced he would step down.He will be replaced by Michele Scannavini, a Coty executive and former head of Fila sportswear, as the company prepares for a share listing in New York that is expected to give it a market value of up to $700m.“It’s a good crossroads as we embark on the IPO,” Mr Beetz told the Financial Times at Coty’s head office in New York.Coty, which produces scents carrying the brands of celebrities such as Beyoncé Knowles and David Beckham, filed IPO documents with US regulators at the end of June as it sought to move on from a failed $10.7bn takeover bid for rival Avon.Mr Beetz, who will remain on the Coty board, declined to comment on the timing of the IPO. He also did not comment on whether Coty would launch another bid for Avon, a troubled group that consistently stonewalled approaches from Coty.Pablo Zuanic, consumer goods analyst at Liberum Capital, said: “The company needs the IPO to get the exposure as it seeks to grow through acquisitions …$700m in the scheme of things is a drop in the bucket, but it is about raising their profile in order to get better known by the investment community.”A division head at Coty for the past decade, Mr Scannavini will become chief executive on August 1.Bart Becht, Coty’s chairman and former chief executive of Reckitt Benckiser, said in a statement that Mr Scannavini “is the key architect behind Coty’s designer brand licences and the growth of our fragrance business.“Michele has also successfully led the integration of acquired businesses, including UCI from Unilever and American Designer Fragrances from LVMH.”Mr Scannavini was previously chief executive of Fila and before that reported to Mr Beetz when both men worked at Procter & Gamble.Joh. A Benckiser, a German family holding company, has an 80.5 per cent stake in Coty, while entities affiliated with Berkshire Partners, the Boston private equity firm, own 7.5 per cent, as do affiliates of private equity firm Rhône Group.Since Mr Beetz joined as chief executive in 2001 Coty’s annual revenues have increased from approximately $1.5bn to more than $4.5bn as it has created new perfume and nail polish brands and acquired others, including OPI, Calvin Klein and Sally Hansen.In the IPO Coty shareholders will sell some of their existing stock. The company, which was founded in Paris in 1904, does not plan to issue new shares in the offering and will not gain any proceeds from the IPO.
53;COTY;Coty Inc;2012-06-29T02:41:45Z;Coty files for $700m IPO;;Coty, the cosmetics group, has filed documents with US regulators to raise as much as $700m in an initial public offering as it seeks to move on from its failed $10.7bn takeover bid for rival Avon.The filing on Friday did not disclose a price-per-share target for the IPO, but said it would offer Class A shares being sold on behalf of existing stockholders. While the shareholders will be able to cash in some of their holdings, Coty itself will not see any proceeds from the IPO.Joh. A. Benckiser, a family holding company based in Luxembourg, holds an 80.5 per cent stake in Coty, while entitites affiliated with Berkshire Partners, the Boston-based private equity firm, hold a 7.5 per cent stake, as do affiliates of private equity firm Rhône Group.Former chairman Peter Harf holds 2.2 per cent of the stock, while chief executive Bernd Beetz holds 1.6 per cent and current chairman Bart Becht owns 1.2 per cent.New York-based Coty did not wish to comment.Bank of America Merrill Lynch,JPMorgan Chase and Morgan Stanley will advise Coty on the offering.Coty hired the banks just after the group withdrew its raised bid for cosmetics direct seller Avon, bringing to an end a six-week stand-off between the two companies.Coty, which produces scents under the brands of celebrities such as Beyoncé Knowles and David Beckham, walked away after the deadline it had set for Avon to respond to its raised bid expired.Mr Becht said in a letter to the Avon board at the time: “It is time for Coty to move on and pursue other opportunities.”Coty posted net income attributable to Coty of $32.9m on revenue of $3.58bn for the nine months ended March 31. It said in its IPO filing that it anticipated more than $4.5bn in revenue for the fiscal year 2012.The company intends to list its common stock either on Nasdaq or the New York Stock Exchange under the symbol “COTY”.Coty, which competes with companies such as Estée Lauder and L’Oreal, made a steady stream of acquisitions in recent years to become the world’s 12th largest beauty company based on retail sales, according to Euromonitor.In 2010, it bought nail care company OPI Products and beauty products company Philosophy, both for about $1bn, as well as Dr Scheller Cosmetics of Germany and China’s TJoy Holdings. It also acquired the perfume licences for a clutch of designers, including Calvin Klein, from Unilever in 2005.Mr Becht, who joined Coty last year, has been known for his ambitious and transformative strategies and a successful public offering would be a victory for the former chief executive of Reckitt Benckiser, the household products maker he previously led.
54;COTY;Coty Inc;2012-05-20T23:39:52Z;Pressure on new chief for Avon makeover;;"By turning its back on Coty’s unsolicited $10bn-plus bid, and staying that way for six weeks, Avon Products sent a clear message to the market – it believed it could create more shareholder value by turning round the company than accepting Coty’s “opportunistic” offer.Avon got what it asked for. Coty, the fragrance maker, withdrew its bid in frustration last week. Now the pressure is on Sheri McCoy, Avon Products’ new chief executive, to revive the fortunes of the troubled 126-year-old cosmetics direct seller.Ms McCoy, a former Johnson & Johnson executive once seen as a possible successor to retiring chief executive William Weldon, was brought in by Avon last month, after Coty made its initial offer. She replaced Andrea Jung, who stepped down after 12 years as chief executive and remained chairman.Yet from the start, Ms McCoy’s job was more complex than simply defending her new company from Coty’s bid. Avon is plagued by multiple regulatory investigations and waning profitability. It has spent more than $200m on fees associated with an investigation into possible violations of the US Foreign Corrupt Practices Act, and could face big fines if found guilty.“Sheri has some fires to put out,” said Connie Maneaty, analyst at BMO Capital Markets. The company faces challenges over “execution issues, greatly diminished morale, bribery investigations, the secular decline of sales representatives, sales, and lack of cash flow generation in the US, and the future of Avon in China.”Almost all of Avon’s cash is held outside the US, making it difficult for the company to use without paying steep repatriation taxes. Meanwhile, Ms Jung took home more than $70m in compensation over the past six years. All of which makes Ms McCoy’s new job one of the most difficult in the industry.“I don’t think the new chief executive has a magic wand that she can wave to fix all of Avon’s problems,” said Mark Astrachan, analyst at Stifel Nicolaus. “The company needs to look at every aspect of the business from product categories to assessing the markets they are in and what their consumers want.”After reporting poor first-quarter earnings earlier this month, a week after starting in her new role, Ms McCoy said “stabilising the business” and rebuilding confidence and trust in the brand were her priorities. She said she would aim to tackle operational issues, address commodity costs, assess changing demographics and review the company’s product portfolio in her first few months.Ms McCoy acknowledged Avon’s woes. “It has lost market share; missed expectations; it has operational and strategic issues; the rate of growth has declined; and cash generation and cost management needs to improve,” she said.Such bleak assessments from the company itself left some analysts and shareholders wondering why Avon did not engage with Coty. Shares in Avon are down 19 per cent since Coty withdrew its bid, shrinking the company’s market capitalisation to $7.4bn. The stock now trades below its price directly before Coty’s first bid.“Clearly the market has spoken in terms of how much investors think Avon is worth without a bid,” said Ali Dibadj, analyst with Sanford Bernstein. “The Coty offer looks extraordinarily attractive now.”Coty itself was exasperated by Avon’s unresponsiveness. Though its bid was unsolicited and never went hostile, Coty lined up financing from Warren Buffett’s Berkshire Hathaway and JPMorgan, and publicly asked Avon to allow it to perform due diligence in order to determine a final offer price.Avon steadfastly rebuffed Coty’s advances, adopting what one person close to the situation described as a “bunker mentality”.After Coty raised its bid from $10bn to $10.7bn earlier this month, Coty chairman Bart Becht personally tried to reach Ms McCoy, Ms Jung and Fred Hassan, Avon’s lead independent director, according to people familiar with the situation. None of Mr Becht’s phone calls was returned.At least two law firms have now announced investigations into alleged breaches of fiduciary duty by Avon’s board in rejecting the bids, hoping to drum up support for possible class action lawsuits. Yet Avon won a vote of confidence of sorts from institutional shareholders when they re-elected the board at the company’s annual meeting this month.With Coty gone for now, Ms McCoy will try to increase sales and reduce expenses as part of Avon’s previously announced strategic review. Analysts believe a turnround could take years.Yet Avon may remain an attractive target, especially given its diminished market capitalisation. Richmont Holdings, a private Texas group, is said to be interested in acquiring Avon. And Coty has hired banks to prepare for a public offering this year that could value it at $8bn, leading some to suggest it could come back for Avon soon.“The company is very much in a state of flux,” said Mr Dibadj. “There are rumours of other bids. Will they find a strategy that works for them on their own? These are questions that are very much still there.”"
55;COTY;Coty Inc;2012-05-15T17:45:48Z;Avon’s long road ahead as Coty walks away;;When Bart Becht left household products maker Reckitt Benckiser and became chairman of fragrance giant Coty, he might have thought the days of detergents and cleaning agents were behind him.But with Coty’s withdrawal of its unsolicited $10.7bn bid for cosmetics direct seller Avon late on Monday, Mr Becht walks away from perhaps the biggest mess of his otherwise sparkling career.Coty made its initial bid for Avon in March, after talks between the two companies about a possible Avon takeover of Coty went quiet. “We turned the tables and made a bid for Avon,” Mr Becht told the Financial Times last month. “But the initiative was always on the Coty side.”It was an ambitious gambit from the start. With $11bn of sales, Avon is more than twice the size of Coty. The US group is also plagued with operational and regulatory problems.Avon’s difficulties have include disgruntled sales representatives, slumping US sales and order fulfilment problems in Brazil. It also faces fallout from bribery allegations in China and Latin America that are being probed by US regulators.Investors and analysts believed that if anyone was capable of pulling off a deal, it was Mr Becht. He became chief executive of Reckitt Benckiser when Benckiser merged with Reckitt & Colman in 1999 and made the company one of the best performers in the FTSE 100 with brands like Woolite and Vanish. He was rewarded for his work, taking home £90m in 2009.As chairman of Coty – which is majority owned by Joh. A Benckiser, a family holding company based in Luxembourg that also holds a significant stake in Reckitt Benckiser – Mr Becht saw similar opportunities for value creation.He launched Coty’s bid on April 2 with a letter to Andrea Jung, who was then Avon’s embattled chief executive. The “Dear Andrea” letter laid out the rationale for the deal and offered $23.35 per share for Avon, a 27 per cent premium over the stock’s three month volume weighted average price.But Coty also said it had no intention of going hostile by making a tender offer or pursuing a proxy battle for control of Avon’s board.That move struck many observers as a sign of half-heartedness, yet Coty maintained that it needed to perform due diligence to fully understand the state of the business, and the potential regulatory liabilities.Avon shares jumped on news of the bid, but the company immediately rejected Coty’s initial $10bn offer as too low, calling it “opportunistic” and complaining that Coty had not secured financing for its bid.A week later, it announced the appointment of former Johnson & Johnson executive Sheri McCoy as its chief executive and reiterated its desire to remain independent.Coty came back two weeks later, saying it had lined up $5bn in equity financing and was confident it could raise another $9bn in debt. In a conference call with investors, Mr Becht told shareholders that “this week is the time to act and express their opinion to the Avon board”. Avon quickly dismissed Coty’s promises of financing and held its ground.Last week Coty raised its bid to $10.7bn and brought in Warren Buffett’s Berkshire Hathaway as an equity investor. Coty had been advised by BDT – a firm founded by Byron Trott, a former Goldman Sachs partner known to be Mr Buffett’s favourite banker – which was also providing equity financing.The alliance with Mr Buffett was seen as a way for Coty to force Avon to the table, and Coty said it would withdraw its offer if Avon did not engage in discussions by Monday night. On Sunday Avon said it needed another week to respond.If Avon thought Coty was bluffing with its deadline, it was wrong. Late Monday night Coty withdrew its bid, expressing frustration that Avon would not return phone calls over the weekend.“Avon shareholders should yet again be truly exasperated with Avon’s board and management,” said Ali Dibadj, an analyst with Sanford Bernstein. “Coty’s actions all seemed to suggest that it was serious about Avon. Avon’s actions did not return that sentiment.”Avon now faces a long road ahead as it attempts to fix its business and grapple with regulators. With Avon stock down 10 per cent on Tuesday, below the undisturbed price before the Coty bid, shareholders can only hope Ms McCoy finds success.Coty, meanwhile, came a long way only to walk away at the last minute. For Mr Becht, who made a career of knowing what people want to buy, and offering it at the right price, Avon may be the one great deal that got away.Additional reporting by Barney Jopson
56;COTY;Coty Inc;2012-05-15T07:28:33Z;Coty drops $10.7bn bid for Avon;;Coty has withdrawn its unsolicited $10.7bn bid for Avon, bringing to an end a tense six-week stand-off between the fragrance maker and the direct seller of cosmetics.The withdrawal of the bid came as the deadline Coty set for Avon to respond to its sweetened offer expired. Last week Coty raised its bid and brought in Warren Buffett’s Berkshire Hathaway to help provide financing, saying it would give Avon until Monday night to enter into discussions about a possible deal.Avon on Sunday said it would consider the raised bid and respond to Coty within a week. It gave no explanation why the additional time was needed, and Coty said in its letter that it had not been able to reach Avon management despite multiple attempts over the weekend.“As our deadline to begin discussions expired today, our proposal is withdrawn,” Bart Becht, Coty’s chairman, said in his letter to the Avon board. “It is time for Coty to move on and pursue other opportunities.”The bid was a distraction for a group already facing a host of business and regulatory challenges.“Avon shareholders should yet again be truly exasperated with Avon’s board and management,” said Ali Dibadj, an analyst with Sanford Bernstein. “Coty’s actions all seemed to suggest that it was serious about Avon. Avon’s actions did not return that sentiment.”But the end of Coty’s interest is likely to be welcomed by Avon’s management and new chief executive Sheri McCoy, who had expressed their desire to keep Avon independent.Coty’s withdrawal also signalled a rare defeat for Mr Becht, who became a stock market favourite as chief executive of Reckitt Benckiser, the household and personal goods company, where he consistently trumped his own and market earnings guidance over more than a decade at the top.When he left last year and became Coty’s chairman, he was not moving far – Coty is majority-owned by Joh. A Benckiser, the holding company for Germany’s Riemann family, which also has a minority stake in Reckitt Benckiser.Mr Becht had wanted to combine Coty’s strength in fragrance and nail products in developed markets with Avon’s make-up and skin products and its emerging markets presence.Before Coty withdrew its bid on Monday some major Avon shareholders said the new bid was getting closer to the right price and, with the backing of Mr Buffett, was a more credible offer.“It’s an OK price, but not great,” said Jason Subotky of the Yachtman Funds, Avon’s sixth-largest shareholder with 3.8 per cent, according to Bloomberg.However, Mr Subotky also said that, while he would need another 10 per cent to start to be persuaded, the Yachtman Funds had built its position only recently and other shareholders might be happy to take what money was available.“We believe that we provided a compelling and well-financed proposal for a business facing multiple challenges,” Mr Becht said in his letter. “We received encouragement from many of your shareholders, research analysts and others in the financial community. Despite this support, your total lack of engagement with us leads us to believe that you remain reluctant to explore a friendly, negotiated combination on a reasonable timetable. Two months is enough.”Additional reporting by Anjli Raval and Dan McCrum
57;COTY;Coty Inc;2012-05-11T20:05:51Z;Avon board has weekend to ponder offer;;"Avon’s directors are in for a sleepless weekend. On Monday they have to give the green light to allow Coty, the maker of celebrity perfumes, to begin due diligence – or wave goodbye to its unwelcome suitor and, possibly, its own bid-fuelled share price.Privately-owned Coty spent last week filling its war-chest as it stepped up its $10.7bn unsolicited takeover bid.Parent JAB Holdings raised $2bn from the sale of part of its stake in Reckitt Benckiser, the household and personal care goods company, and Warren Buffett’s Berkshire Hathaway also agreed to put up funding.Coty further burnished its suit by raising its conditional offer from $23.25 a share to $24.75 and holding out the potential carrot of “an opportunity to provide significant and certain immediate value to Avon’s shareholders” if the direct-seller of cosmetics agreed to open its books.Avon, which has so far rebuffed all advances, said it would review the new offer “in due course”.Its long-suffering shareholders will want to be sure of the company’s own turnround plans if it closes the door on talks with Coty. Avon has been plagued with operational and legal troubles in recent years. In the summer of 2008, it began an internal investigation of possible violations in China of the Foreign Corrupt Practices Act, the US law that forbids bribery of officials overseas to win or retain business.Last October, Avon revealed a second investigation by US regulators, this one to determine if the company had violated rules around selective disclosure in its communications with financial analysts.Adding to its problems, Avon had its credit rating downgraded by the three ratings agencies last week; Moody’s Investors Service on Thursday brought up the rear with a downgrade from A3 to Baa1, or three notches above junk status."
