;Ticker;Nombre_Completo;Date_Time;Titular;Subtitular;Texto
14;COTY;Coty Inc;2019-02-08T16:22:26Z;Coty takes near $1bn writedown on P&G beauty brands;Shares jump 27% on promise of return to profit in second half of fiscal year;Cosmetics maker Coty acknowledged difficulties in turning around the beauty brands acquired from Procter & Gamble in a blockbuster 2015 deal, and was forced to take a nearly $1bn writedown on the assets.The problems at Coty are a headache for JAB Holdings, the serial dealmaker that invests the wealth of one of Germany’s richest families, the Reimanns. It is one of JAB’s oldest investments, but now needs a major overhaul if its precipitous share price decline is to stop dragging down the value of JAB’s portfolio.The $12.5bn acquisition of P&G’s beauty brands, which included CoverGirl and Clairol, doubled Coty’s size by revenues and was aimed at challenging established beauty leaders such as L’Oreal and Estée Lauder.But integrating the P&G assets has proven challenging and time-consuming, and those challenges have weighed heavily on Coty’s results in recent quarters. In November it announced the abrupt departure of its chief executive Camillo Pane.In the fiscal second quarter, Coty slumped to a loss of $956m, with the bulk of that driven by goodwill writedown on assets acquired from P&G.Pierre Laubies, a food industry veteran who took over as chief executive, is working on a strategy plan to be unveiled in the coming months. But he admitted on an analyst call on Friday that it would take time to get Coty on “a path of sustainable growth” given “the difficult trajectory of our Consumer Beauty division.”CoverGirl’s woes are emblematic of the challenge, and Mr Laubies admitted that last year’s relaunch had not been successful, “There are some issues with how we market the Cover girl brand, and the team is taking stock. The brand deserves better and we’ll work strongly to turn it round.”Still investors appeared to take heart from the company’s promise to return to profit in the second half and sent Coty’s bruised shares sharply higher.The stock, which has shed over two-thirds of their value since mid 2015, jumped more than 27 per cent on Friday to $9 and was the biggest gainer on the S&P 500. However it remains well below its 2013 IPO price of $17.50.The problems at the consumer beauty division were underscored by Coty’s latest earnings. The division suffered a 15 per cent drop in sales during the final three months of last year as brands like Cover girl and Bourjois, which are often sold in supermarkets and grocery stores, lose out to trendier, newer ones marketed on social media and sold in specialist make-up stores like Sephora.Such has been the decline that the unit has now been overtaken by the luxury beauty business as Coty’s biggest by sales.Total group revenue for the quarter came in at $2.5bn, a near 5 per cent year-on-year decline but slightly better than the $2.46bn that the market had expected. Stripping out the $965m in impairments, adjusted earnings of 24 cents also came in ahead of forecasts for 22 cents.Stephanie Wissink, analyst at Jefferies, cautioned that while Coty’s results came in ahead of expectations, that was largely driven by temporary factors, such as the lift provided by its new partnership with Burberry.Instead she said management would need to provide “a pathway to improvement in the consumer beauty division” and “clarity around the recovery curve” if the turnround in sentiment is to hold.
15;COTY;Coty Inc;2018-11-15T04:00:57Z;JAB needs more than cosmetic improvement at Coty;Investment group aims to fix problems from a $12.5bn purchase of P&G brands;A new flagship store in New York’s Times Square is the latest attempt to revive Covergirl, a 60-year-old make-up label that is struggling to compete in a market where social media influencers mint new beauty brands overnight.The success or failure will help determine the future of the cosmetics group that owns Covergirl — Coty — and affect the reputation of its controlling shareholder, JAB Holdings, the voracious group that manages the wealth of Germany’s Reimann family.Led by Bart Becht, the well-respected former chief executive of Reckitt Benckiser, JAB has gone on a roughly $50bn deal spree across the consumer sector in the past five years. Its biggest bets are now on the coffee market, where it recently combined Keurig Green Mountain with Dr Pepper Snapple, and in casual dining with Panera Bread Company and Pret A Manger.But it is Coty, a much older deal, which JAB acquired in 1992, that is causing doubts. The group’s shares are down more than 50 per cent this year, below their 2013 IPO price. On Monday, Coty replaced its CEO unexpectedly, naming its fourth boss in five years.Covergirl was just one of a portfolio of 43 beauty products that Coty acquired two years ago from Procter & Gamble for $12.5bn. The performance since has raised questions about JAB’s model of combining companies via often pricey acquisitions and then seeking to improve performance by stripping out cost.The value of JAB’s 39 per cent stake in Coty has fallen by 60 per cent to $2.5bn since the P&G deal closed in October 2016 — a notable decline even given JAB’s decades-long investment horizons.“The shine has come off the JAB story,” said Rosie Edwards, an analyst at Berenberg who covers Coty. “When they bought the P&G brands, investors had faith they would work their magic. Now, no one really thinks JAB has all the answers.”Nobody questions that the scale of the job at Coty is considerable. The company doubled in size with the P&G deal, bringing together 20,000 employees in 41 countries, working across 70 brands, and 16 manufacturing sites. The integration has proven time-consuming and difficult.In an interview with the Financial Times, Mr Becht hit back against the critique that the P&G deal had gone wrong. “As this is one of the most complex transactions JAB has done, we said from the very beginning this would be a five-year project,” he said.“The integration is largely complete but the business transformation is not,” he said, acknowledging that Coty’s consumer beauty division still needed to be fixed. “But the other two divisions, professional [salons] and luxury, are doing actually very well.”JAB has long cast itself as a better manager and steward of capital than its big consumer packaged goods rivals. But it is now competing in categories such as coffee and make-up, where powerful incumbents such as Coca-Cola and L’Oréal are trying to seize and protect market share.Some of the problems now plaguing Coty stem from the extraordinarily long 15 months it took to close the P&G deal. The deal was structured as a so-called Reverse Morris Trust, which allowed P&G to spin out and sell the assets to Coty without paying capital gains tax. During the transition, the brands were stuck in limbo, and Covergirl, Rimmel and Wella lost market share.“P&G put them in a tough spot by cutting marketing spend and losing shelf space in stores,” said Mark Astrachan, analyst at Stifel. “But Coty bit off more than they can chew in the mass-market: the category has slowed, competition from new, niche brands is intense, and they do not have the marketing knowhow their larger rivals do.”All the blame cannot be laid at P&G’s feet. Critics argue that Coty overpaid for a series of legacy brands that do not really appeal to young people. Growth slowed in the mass market just as Coty was increasing its exposure: its largest division, consumer beauty, which accounts for 45 per cent of sales, had like-for-like revenues decline by 10 per cent in the year ended June 2017, and 4 per cent in the year to June 2018.Coty has also botched three recent integration projects, including a supply hub in the UK and a German warehouse, which were part of changes made to deliver on the promised $750m cost-savings from the P&G deal. The mistakes led to supply chain disruptions that left Coty unable to meet demand for its luxury, professional and consumer products in the US and Europe. It ended up having to pay fines to retailers for not meeting contractual obligations.“The risk is that in its rush to cut costs and reorganise the group, Coty cut too fast, too far and is now paying the penalty,” said Société Générale analyst Mitul Girotra.Coty’s troubles come as the cosmetics business has been in a period of rapid change as consumers increasingly shop online or via speciality stores such as Sephora or Ulta Beauty where buying make-up is more of an experience. New brands like e.l.f or pop star Rihanna’s Fenty Beauty can be built faster than ever with the help of online armies of influencers.“The market has moved on, it’s not about selling mass-market brands better into retail channels like Walgreens or Boots,” said one industry consultant who has worked with cosmetics companies. “It’s more about developing fast make-up like fast fashion.”To that end, cosmetics giants such as L’Oréal and Estee Lauder have eschewed mega-deals such as the one Coty is trying to pull off, and instead have bought small, founder-led brands just as they are starting to show traction.With chief executive Camillo Pane resigning this week, the task of turning round the company will now fall to Coty’s new chief executive Pierre Laubies, a coffee industry veteran chosen by JAB for his expertise at overseeing merger integrations. Mr Laubies has not worked in the beauty business before, however.Shareholders may be hoping that JAB will come to their rescue by buying up shares in Coty. It has been restricted since the P&G deal in the amount of shares it could buy, but those limits expired in October.Asked whether JAB would buy more shares, Mr Becht said: “We have been buying shares regularly in the past two years, so clearly we like the asset. We have been strong supporters of the company and will continue to be.”JAB traces its roots to the German businessman Johann Adam Benckiser, who in 1823 bought a chemicals factory in southwestern Germany. With the help of a chief scientist named Ludwig Reimann, who later married into the family, the Benckiser company grew into a major maker of industrial chemicals. Several generations of the Reimanns ran the business, which eventually made them into one of Germany’s richest families.The last of the Reimanns to be actively involved in the day-to-day running of Benckiser was Albert junior, Ludwig’s great-grandson, who inherited the company in 1952 and pushed it in the direction of consumer goods. He died in 1984, leaving equal stakes to his nine adopted children. In 1997, the family took Benckiser public and two years later engineered a merger with the British consumer goods group, Reckitt and Colman, to form Reckitt Benckiser.Four of the descendants eventually bought out the others, and they remain the owners of most of JAB today. Over time the family handed over JAB to professional managers, who began to turn it into the investment vehicle it is today.Peter Harf, Bart Becht and Olivier Goudet are the trio at the helm. Mr Harf started at Benckiser in 1981, while Becht joined in 1988. Mr Goudet, a former Mars executive, joined in 2012.The managers make suggestions to the family members on possible investments, which they then discuss, with the family having the ultimate say. The trio have also invested some of their own capital into JAB.In recent years, JAB has been ploughing billions into the coffee sector and casual dining chains in the US and Europe. In coffee, it has real ambitions to unseat Nestlé as the market leader, and it wants to play a role in the global consolidation of what is a rapidly growing, yet fragmented sector.At the same time, JAB has also unwound its luxury investments by selling shoemaker Jimmy Choo, clothing brand Belstaff, and Swiss brand Bally, in which it retains a minority stake. It has also steadily been selling down its stake in Reckitt Benckiser to reach 1.64 per cent currently.JAB now sees itself as having three main areas of focus: coffee and beverage, beauty, and casual dining. It disclosed total assets of €23.3bn at the end of June 30 2018.
16;COTY;Coty Inc;2018-11-12T13:44:37Z;Coty replaces chief and names new chairman;Cosmetics group has struggled to integrate $12.5bn acquisition of brands from P&G;Cosmetics and fragrance maker Coty abruptly replaced its chief executive only days after reporting a disastrous quarter in which supply chain disruptions stemming from the integration of a major acquisition knocked sales and profits.Camillo Pane, a Reckitt Benckiser veteran who had been running the company since July 2016, resigned for “family reasons”, Coty said in a statement on Monday. He will be replaced with immediate effect by Pierre Laubies, who was most recently chief executive of Jacobs Douwe Egberts, a coffee company owned by Coty’s largest shareholder JAB Holdings.Coty has become a problem child for JAB Holdings, the Luxembourg-based investment company that manages the wealth of Germany’s reclusive billionaire Reimann family. The value of JAB’s 38.6 per cent stake in Coty fell by €1.3bn in the six months to June 30 — a notable decline even given JAB’s decades long investment horizons.The problems have stemmed largely from Coty’s struggles to integrate the acquisition two years ago of a large portfolio of cosmetics brands from Procter & Gamble for $12.5bn. The deal, which doubled the size of Coty by revenue, was the brain child of JAB chairman Bart Becht, the former chief executive of consumer giant Reckitt Benckiser. He ran the enlarged Coty for almost two years before handing over to Mr Pane.“We are very grateful for Camillo’s many contributions to Coty during his time as CEO,” Mr Becht said in a statement. “His leadership was critically important during Coty’s integration of the P&G speciality beauty business.”The brands lack resonance with millennials. I have questions around the quality of the brand portfolio, and whether Coty can really compete in the new reality of beauty marketFurther boardroom changes will see Mr Becht give up his chairman’s seat to another of JAB’s trio of managing partners, Peter Harf. Mr Becht will remain on the board, however. Coty also said that the board planned to recruit “two new independent board members with deep commercial and financial experience”.Investors have become impatient with Coty’s poor results. After the supply chain problems, Coty declined to give further financial guidance for the year, leading investors to wipe a fifth off the company’s market value.The P&G deal, which gave Coty brands such as Cover Girl make-up, Gucci fragrances and Clairol hair dye, helped catapult the company from the world’s seventh-largest cosmetics group to the third, behind L’Oréal and Estée Lauder.But the acquisition was struck at a time of deep change in the mass-market beauty and personal care industry. Social media and the rise of influencer marketing have made it easier than ever to start new brands and challenge the old stalwarts. It remains to be seen if Coty will have the resources and knowhow to revitalise the 41 brands it took on from P&G, some of which are in structural decline, while ensuring its own brands like Rimmel and nail polish OPI remain relevant.“The brands lack resonance with millennials,” Rosie Edwards, an analyst at Berenberg Research, said in an interview last week. “I have questions around the quality of the brand portfolio, and whether Coty can really compete in the new reality of beauty market.”Responsibility for the turnround will now fall to Mr Laubies, who is a known quantity to the JAB executives from his time at JDE. In its statement and an accompanying biography, Coty talked up Mr Laubies’ skills in overseeing merger integrations, which were honed when he oversaw JDE’s combination with Mondelez’s coffee business. Mr Laubies contributed by “fully realising the associated synergies, reducing the debt and driving strong financial performance”.
17;COTY;Coty Inc;2018-11-07T12:58:48Z;Coty shares slump as supply-chain disruptions hit sales;Problems persist as group struggles to integrate portfolio two years after $12.5bn P&G deal;Cosmetics and fragrance maker Coty lost roughly a fifth of its value on Wednesday after it said that serious supply-chain disruptions at US and European warehouses had hit quarterly revenue and profit.The company, whose largest shareholder is the investment vehicle and prolific dealmaker JAB Holdings, said the issues would continue into the second quarter and their financial impact would be felt all year.The difficulties at the warehouses, which were first flagged in August, were compounded by new problems that cropped up at the luxury business, including packaging shortages and a hurricane in the US that affected a North Carolina factory.The troubles are the latest sign of how Coty is still struggling to digest the acquisition of a large portfolio of beauty brands from Procter & Gamble that closed two years ago. The $12.5bn deal, which included the CoverGirl and Clairol brands, doubled Coty’s size by revenues and was aimed at challenging established beauty leaders such as L’Oreal and Estée Lauder. But integrating the P&G assets has proven challenging and time-consuming, and investors have begun to question when the promised brighter future for Coty will be realised.Even before the weak results for the first quarter of Coty’s 2019 financial year, the shares were down 40 per cent this year, while L’Oréal’s are up 10 per cent and Estée Lauder’s are 8 per cent higher.Coty shares were down 20 per cent at $8.92 in late morning trade on Wednesday.The supply-chain issues were caused by changes intended to make the enlarged company more efficient and deliver on the promised $750m cost savings from the P&G deal.Camillo Pane, chief executive of Coty, admitted that the execution of three projects, including a supply hub in the UK and a German warehouse, had simply been poor. “It’s clear we set very ambitious goals for the transformation plan, and all did not go as expected on these specific projects,” he said.As a result, Coty “was unable to meet demand and created a backlog that will take some time to clear”, he said, referring largely to luxury fragrances and professional hair and nail products.The disruptions meant that like-for-like sales fell 7.7 per cent compared with a year earlier on quarterly revenue of $2.03bn. Coty reported a net loss of $12.1m compared with a loss of $19.7m in the same period last year. Gross margins also contracted 70 basis points to reach 60.2 per cent in the quarter.Without the supply-chain problems, the company said like-for-like sales would have fallen by only 2.5 per cent, and two of its three divisions — luxury and professional — would have actually increased sales.Nevertheless, the consumer division, which is its largest, continues to lose market share despite having relaunched several of its biggest brands this year, including CoverGirl and Max Factor. Organic revenue shrank 14 per cent in the quarter, and even without the supply-chain problems the decline would have been 9 per cent.Rosie Edwards, an analyst at Berenberg, said the “biggest concern” was the return of such weak performance in consumer beauty, which saw organic sales decline 4 per cent in the last financial year. “Further earnings shortfalls have been created in the quarter which continues to raise questions about the outlook for margins and the extent to which synergies will fall though to the bottom line,” she said.Mr Pane said that Coty needed further time to assess whether to revise its annual guidance that predicted operating profit and margin growth.JAB, which has also invested in coffee and casual dining chains such as Pret A Manger, owned 38.6 per cent of Coty as of June 30. In August, it bought an additional 2.6m shares for about $32mn, according to SEC filings.
18;COTY;Coty Inc;2018-10-04T19:32:22Z;Chinese spending fears hit beauty stocks;Estée Lauder and Coty shares slip as analyst warns of cooling spending by tourists;"Estée Lauder and Coty were among the biggest decliners on the S&P 500 on Thursday as an analyst warned Chinese travel spending in the beauty aisle has cooled.Estée Lauder shares fell 5 per cent to $136.22, while Coty shares fell nearly 8 per cent to $11.51 — leading the decline on the S&P 500.The drop came as Stephanie Wissink, an analyst at Jefferies, noted that spending in travel retail’s beauty segment — which accounts for 35 per cent of travel retail purchases — had cooled in the third quarter, while spending on spirits and confectionery had accelerated.Her report was released amid hints that the Chinese government is cracking down on the “daigou” industry, in which a network of Chinese tourists and Chinese nationals living overseas sells on highly sought-after consumer goods purchased abroad at prices lower than in shops in China.Social media images of airport inspections of returning tourists over the past few days triggered a sell-off in Japanese beauty products companies earlier on Thursday.Underscoring the influence of Chinese shoppers on the beauty industry, Ms Wissink noted 70 per cent of dollar growth in the travel retail segment over the past year had been directly linked to the Chinese traveller.But China’s government data showed that beauty retail spending was up only 7.8 per cent in July and August, down from 11.5 per cent in June and 22.7 per cent in March, Ms Winnick pointed out.The news could augur a tougher time for Estée, behind brands like Mac and Too Faced, which has credited part of its success to “strong growth” in the travel segment, including airports.Estée said on its earnings call in August, that it gained share across all categories in travel retail in the 2017 calendar year and became the “top ranked beauty company in Asia/Pacific airports and reinforced our global leadership position in skin care and make-up”.The company added its travel strategy had benefited from higher global passenger traffic and noted that Chinese tourists were important shoppers in this channel. “Their increasing travel helped meet growth across our portfolio,” the company said on its last earnings call.The Jefferies note suggested several reasons for the slowdown in Chinese travel spending.“Currency devaluation has become a concern in recent months,” Ms Winnick noted. China’s onshore renminbi has been hurt this year amid uncertainty about the US-China trade spat, and has declined more than 5 per cent year-to-date.“This has tracked toward a more moderate rate of growth alongside China traveller data to pan-Asian countries also slowing,” Ms Wissink said. “Data from Japan, Hong Kong, Macau, and Korea points to China passenger traffic growth moderating quite significantly in recent months.” Moreover, this drop hasn’t translated to higher spending in mainland China.Ms Wissink added that in Europe, within the beauty segment, “make-up sales have slowed most precipitously; skin care (self purchases) are still growing, but at a slightly slower rate than 2017”.Before Thursday’s drop, Estée shares were up 13 per cent year-to-date. Coty shares were down more than 36 per cent over the same period."
