;Ticker;Nombre_Completo;Date_Time;Titular;Subtitular;Texto
138;CSX;CSX Corp;2008-06-19T20:47:02Z;Wall St rebounds after drop in oil prices;;Wall Street stock markets rebounded on Thursday after a drop in oil prices buoyed consumer discretionary and transport stocks, taking the sting out of data showing continued weakness in the US economy and a warning from Citigroup about further writedowns.The day began in a downbeat fashion with new data that showed initial jobless claims dropped by less than expected last week, while manufacturing activity in the Philadelphia region contracted more than expected in June.Still, it was the travails of the banking sector that weighed heaviest on equity markets in early trading. Comments from the chief financial officer of Citigroup accelerated losses.Gary Crittenden told investors that the largest US bank would have substantial writedowns on its holdings of subprime mortgage-related debt. Citigroup shares slid as much as 4.9 per cent before recovering to $20.17, down 1.3 per cent.As oil prices fell back however, a rally in the consumer discretionary and industrial sectors picked up steam, and they advanced 1.2 per cent and 0.9 per cent respectively erasing early losses.Amid the broad market rally, even financials ended the day in positive territory, adding 0.9 per cent alongside a 1.2 per cent gain for technology.By the close S&P 500 was up 0.4 per cent at 1,342.83 points. The Dow Jones Industrial Average briefly dipped below 12,000 points for the second successive day, before reviving. The index ended the day 0.3 per cent higher at 12,063.09 points. The Nasdaq Composite added 1.3 per cent to 2,446.99 points.On Wednesday, equity markets sold off sharply, and the Dow hit a three-month low, after declines in the banking sector and a downbeat outlook on the economy from FedEx weighed on sentiment.The pattern initially repeated on Thursday after analysts cut their earnings estimates for Morgan Stanley, triggering a sell-off. Morgan Stanley shares, which struggled to a small gain on Wednesday, fell 1.2 per cent to $40.19.Regional banks have come under particular selling pressure in the past few days as a number of analysts have questioned the ability of smaller, less capitalised banks to stand up to the strains of the credit crisis and mounting losses on mortgage assets.But they also found some positive momentum on Thursday, adding to their gains after BB&T said that it would increase its dividend, dismissing an analyst’s prediction that the North Carolina bank would do just the opposite. BB&T overturned early losses to climb 0.1 per cent to $24.35, while Fifth Third recovered 5.3 per cent to $9.75.Industrials proved robust, as transport stocks helped them shake off the poor macroeconomic data.A number of rail companies have given warnings that flooding in the Midwest of the US will dent earnings, most recently Burlington Northern Santa Fe, but analysts and investors remain positive over the long-term outlook for the sector.Burlington shares added 2.3 per cent to $105.55 while peers Union Pacific and CSX climbed 2.6 per cent to $77.80 and 3.3 per cent to $66.34 respectively.In earnings news, Circuit City Stores, the electronics retailer that put itself up for sale last month, disappointed investors by reporting a loss of $164.8m and revenue down 7.4 per cent to $2.3bn. Circuit shares fell 1.7 per cent to $3.98.Better than expected second-quarter results from Carnival, the cruise line company, a rally in oversold stocks in the staples sector and a $5 drop in oil prices helped keep consumer-facing stocks well above water.Carnival rose 5.4 per cent to $36.84 and Tyson Foods added 5.8 per cent to $14.47.Technology stocks were among the biggest gainers, benefiting from tumbling oil prices, which may ease strains on global economic growth. Microsoft rose 1.7 per cent to $28.93, Intel 2.6 per cent $22.85 and IBM 0.7 per cent to $125.02.Broadcom, the maker of chips for Nintendo’s Wii video-game console, rose 7.6 per cent to $27.22 after analysts at Lehman Brothers said second-quarter earnings will get a boost off higher demand.Energy was the only sector to close in the red.ExxonMobil dropped 2.3 per cent to $85.79 while ConocoPhillips fell 1.6 per cent to $93.66.
139;CSX;CSX Corp;2008-06-18T20:34:48Z;US stocks fall as oil prices surge;;US stocks fell for a second session on Wednesday as oil prices surged in late trading while poor results from FedEx underscored the challenges of rising energy prices and crumbling profitability facing the broader economy and equity markets.FedEx said it had lost $241m in the fourth quarter after rising fuel costs and a writedown on FedEx Kinko, its copy centre unit, took their toll. The company’s outlook statement for 2009 was also downbeat.The results will further heighten fears about the impact of elevated oil prices on the wider economy.The parcel delivery firm is often seen as a bellwether because its business depends on the levels of activity in the economy.FedEx shares fell 2.1 per cent to $82.60 while rival UPS lost 2.3 per cent to $65.80, dragging the industrials sector down 1 per cent.Meanwhile, Morgan Stanley said profit dropped 57 per cent in the second quarter due to weak performances at its trading and investment banking units. The stock initially fell as much as 7.8 per cent, weighing on sentiment, only to swing back into the black in late trading.Still, the rally had little effect on the broader financial sector.On Tuesday, Goldman Sachs undermined market sentiment, in spite of posting better-than-expected results, after its analysts warned that US banks might have to raise as much as $65bn in additional capital to shore up balance sheets weakened by the mortgage crisis.As if to confirm those predictions, Fifth Third Bancorp said on Wednesday that it would raise $2bn by selling shares and assets to shore up its balance sheet after nine quarters of declining profit. The Ohio-based bank will also cut its dividend.Morgan added 0.5 per cent to $40.80, Goldman rose 1.9 per cent to $182.77 but Fifth Third slumped 27.3 per cent to $9.26.The S&P 500 financials sector slipped 1.2 per cent while the KBW banking index hit a six-year low.By the close, the S&P 500 was down 1 per cent at 1,337.84. The Dow Jones Industrial Average gave up 1.1 per cent to 12,029.06, hitting a three-month low, while the Nasdaq Composite fell 1.1 per cent to 2,429.71.On Tuesday, equity markets ended a weak three-day rally, led lower by the financial sector and economic data that triggered further worries about inflation and the housing market.Regional bank shares were sold particularly hard after some negative analyst comments. That trend continued on Wednesday as Fifth Third’s capital-raising weighed on the sector.SunTrust Banks fell 9 per cent to $36.95, Regions Financial dropped 10.4 per cent to $11.40 while Huntington Bancshares slipped 9.5 per cent to $5.52.The FedEx results cast a pall over equity markets and by the end of the day, all 10 leading industrial groups on the S&P 500 retreated into the red.A rise in oil prices did little to help, and the consumer discretionary and staples sectors were among the leading fallers, dropping 1.9 per cent and 1.1 per cent respectively.Carmakers led the way down after analysts predicted that US vehicle sales could slump to their lowest in more than 15 years this month as buyers shun the gas-guzzling vehicles that are their bread and butter. General Motors lost 5.9 per cent to $14.89 while Ford slid 5.8 per cent to $6.22.Tyson Foods, the chicken producer, also fell back, slumping 8.2 per cent to $13.68 after Fitch cut its debt to non-investment grade.In other corporate news, MF Global, the broker of exchange-traded futures contracts, tumbled 41 per cent to $7.83 after it said revenues would come in below analysts’ estimates. It added that it planned to sell shares to pay down debt.There were bright spots. Union Pacific said in the week that flooding in the Midwest had disrupted services and damaged its infrastructure – it estimated that the weather would trim second-quarter earnings. However, its shares still rose 4.6 per cent to $75.82 on Wednesday following an upbeat report from Morgan Stanley said rising productivity would offset higher oil prices and boost profit.Peer CSX added 1.3 per cent to $64.20 while trucking company YRC Worldwide added 5.4 per cent to $17.68 after reaffirming its second- quarter guidance.
140;CSX;CSX Corp;2008-06-11T21:40:15Z;UK fund set to escape Cfius probe;;The US Treasury is unlikely to pursue a request by senators to investigate an attempt by the Children’s Investment Fund, a British hedge fund, to replace some members of the board of the rail operator CSX.Snehal Amin, a partner at the fund (TCI), said in an interview with the Financial Times that the fund’s attorney had since January been in contact with Cfius, the committee that investigates foreign deals. The attorney had answered questions about the deal and offered to make TCI partners available to the committee.But in a sign that the Treasury is unlikely to seek an investigation, the department has not requested a meeting or indicated that the hedge fund should submit the transaction for formal review.TCI’s comments come after six senators, led by Indiana Democrat Evan Bayh, pressed for Cfius to investigate the fund’s acquisition of what they called a “dominant minority” of CSX shares because of concerns that the deal would give “unknown [foreign] investors” control of critical US infrastructure.“We don’t want to take part in trying to politicise this and drag Cfius, a serious body with important responsibilities, into this. We don’t want to clog up the Cfius system with a filing, just for the sake of public relations,” Mr Amin said.TCI’s attempt to place its own directors on CSX’s board is not the first time a foreign-based hedge fund has sought to gain more influence over a US company’s management and decisions. But the battle, which now involves a group of influential legislators seeking to protect CSX from the hedge fund, is being closely watched in Washington.One influential legislator said he was not ready to rise to CSX’s defence.Barney Frank, the Democratic chairman of the powerful House financial services committee, told the FT he was sceptical of allegations by other legislators that TCI’s proxy fight might represent a threat to national security and should be investigated.Mr Frank, a Massachusetts congressman, said he was disinclined to “protect” CSX because of a tussle between Massachusetts lawmakers and the company over a commuter rail line from Boston to New Bedford.“At this point CSX is being so unreasonable, maybe some new group would be more reasonable,” Mr Frank said. “I’m not looking at it with an open mind right now.”If the Treasury, which chairs Cfius, agrees to the senators’ demand and opens an investigation, it risks setting a dangerous precedent and making the committee look like a political tool to be used by US companies seeking to stave off fights with non-US hedge funds.The Treasury must also, however, show it is sensitive to national security concerns in Congress or risk a congressional backlash in an election year. TCI’s proxy fight has become a pet issue for Lou Dobbs, one of the leading proponents of US protectionism and a top anchor on CNN, the television news networkUnder current rules Cfius can investigate investments in sensitive US assets by non-US companies if they constituted a “change in control”.TCI says it is not seeking to take over CSX and has sent a letter to the senators stipulating it would not compromise US security.The Treasury said on Wednesday: “Whether Cfius does or does not meet with any particular company is not indicative of whether any matter is or may be before the committee.”One Democratic staffer involved in the fight to force a review said that the senators were not passing judgment on whether the deal should be approved by Cfius or not.“We thought it would be a good test case for the new critical infrastructure standard,” the person said, referring to regulatory proposals that state Cfius may review takeovers of assets that are so vital to the US that their incapacity would have a debilitating impact on national security.
141;CSX;CSX Corp;2008-06-11T20:40:57Z;Wall St falls led by financials;;Wall Street fell sharply on Wednesday as financials resumed their relentless downward path and technology stocks came under heavy selling pressure after a key industry group cut its sales outlook for semi­conductors.In the background, oil prices jumped more than $5 a barrel, taking the momentum out of Tuesday’s shallow rally in consumer-facing shares. The consumer discretionary sector fell 2.2 per cent while the homebuilder sub-sector fell 8 per cent to within touching distance of a seven-year low.The leading fallers, however, were financial stocks, which dropped 3.3 per cent, giving up recent fragile gains and suggesting that the sector has yet to find a solid bottom amid a steady trickle of bad news.Technology stocks followed close behind, slipping 2.4 per cent after the Semiconductor Industry Association said sales will grow less rapidly than expected this year as competition drives down prices, particularly for memory chips.Nine of the 10 leading industry sectors were in the red, dragging the S&P 500 index down 1.7 per cent to 1,335.50. The Dow Jones Industrial Average slipped 1.7 per cent to 12,083.69. The Nasdaq Composite dropped 2.2 per cent to 2,394.01.The tone on Wall Street has perceptibly darkened over the past few weeks as investors cope with bad news from financials and look ahead to rising inflation, weak consumer spending and a prolonged period of depressed earnings.While the S&P 500 posted monthly gains of 1.1 per cent and 4.8 per cent in April and May, so far in June the benchmark index is down 4.6 per cent.Scott Armiger, a vice-president at Christiana Bank & Trust, said: “We were thinking that you would see some signs of expansion in the second half, and now it seems that it is going to be a long, hot summer and perhaps we won’t start to recover until next year.”Financials reprised their role as the villains of the piece on Wednesday and have fallen in all but two sessions in June. The sector is down 23.8 per cent this year.Washington Mutual, First Horizon and Huntington Bancshares fell 9.3 per cent to $6.06, 6 per cent to $8.27 and 6.5 per cent to $6.92 respectively. The banks have some of the highest exposures to home equity loans, which some analysts see as the next front in the ongoing credit crisis.Investment banks also took a beating as Lehman Brothers fell a 13.6 per cent to $23.75, dragging the sector down 5.3 per cent. It was followed by Merrill Lynch, down 6.6 per cent to $35.46. Matthew Albrecht, an equity analyst with S&P, said: “Preliminary results from Lehman Brothers should remind investors that this group is not out of the woods regarding mortgage and bridge loan exposure, and risk governance remains in focus.”Industrials came under pressure after UBS rated Burlington Northern Santa Fe, the railway company, a “short-term sell”, suggesting rising fuel prices may impact second-quarter earnings. Burlington dropped 7 per cent to $103.77, dragging down peers Union Pacific and CSX, which slipped 5.7 per cent to $74.10 and 4 per cent to $63.60 respectively. CSX is in the middle of a messy proxy battle with British hedge fund The Children’s Investment Fund.Energy stocks were the sole gainers amid the broader malaise, following oil prices higher. ExxonÂ­Mobil rose 0.8 per cent to $88.61 and ConocoPhillips added 1.3 per cent to $94.08.Materials stocks fell in spite of some positive momentum for gold focused shares. Freeport-McMoRan Copper & Gold, for example, rose 0.6 per cent to $120.09.Gains for the broader sector were swamped, however, after JPMorgan downgraded Alcoa from “overweight” to “neutral”, suggesting that the aluminium producer would likely not be a take­over target. Alcoa dropped 8 per cent to $39.32.In technology, Advanced Micro Devices and Intel were among the leading fallers, losing 6.3 per cent to $6.96 and 3.8 per cent to $21.81 respectively.Amerigroup, the managed healthcare provider, fell 14.1 per cent to $23.36. It suspended its annual profit forecast as higher-than-expected claims forced it to renegotiate rates with the state of Tennessee.Meanwhile, Staples succeeded in its efforts to buy Corporate Express, a Dutch peer, with a revised $2.7bn offer. Staples shares rose 5.3 per cent to $24.38.
142;CSX;CSX Corp;2008-06-11T02:47:17Z;China hits out at US ‘protectionism’;;Chinese officials have accused the US of harbouring “hostility” to investments by foreign government-controlled entities and of drifting towards “investment protectionism” in proposed regulations that set out how cross-border deals ought to be vetted.The Chinese Securities Regulatory Commission said in a letter to the US Treasury that the proposed regulations left “too much room for interpretation” by the Committee on Foreign Investment in the US, or Cfius, an inter-agency panel chaired by the Treasury, and left the body with “excessive authority”.The proposals were also criticised by the Chinese Ministry of Commerce. “This discriminating provision apparently tilts toward investment protectionism and is tinged with the colour of politicising economic issues. It therefore stands as a grave impediment for the normal course of investment in the US,” it said.The letters, sent during a public comment period on the proposed rules, come one week before US and Chinese authorities prepare to meet for a fresh round of their strategic economic dialogue in Annapolis, Maryland. Hank Paulson, Treasury secretary, said on Tuesday the talks would include discussions about bilateral investment and how to “counter protectionist pressures”.In a sign that the US had its own gripes about Chinese regulations, Mr Paulson added: “We will also discuss the concerns of American companies that China’s investment regulations are opaque and seem in many ways to be designed to favour China’s ‘national champions’.”If adopted, the proposed US regulations would clarify a grey area of existing law by making it clear that Cfius could open national security investigations of foreign investments in sensitive US assets, even if they fell below a threshold of 10 per cent, if the investments constituted a “change in control”.The proposed rules, in effect, encourage foreign minority investors to forgo certain rights that might appear to give them control of a company – such as acquiring seats on a board or the right to fire and hire management – in order to avoid a national security review.The proposed rules were also criticised by the Association of British Insurers, which said they sent a signal that the US “is not genuinely open to inward investment”.The ABI focused on two issues: that Cfius could raise concerns about deals that were “wider than genuine national security concerns” and that the regulations would lead to bona fide investors disclaiming rights they would otherwise be entitled to.The US Treasury said on Tuesday that it would consider all submissions. It has previously argued that, if adopted, the rules would clarify Cfius procedures and safeguard national security while reinforcing an open investment policy.The China Investment Corporation, which holds minority investments in Blackstone and Morgan Stanley, agreed with that assessment, saying the proposed rules helped “clarify issues” that were previously ambiguous and served as a “useful roadmap” for potential investors.But at the heart of criticism by both Chinese regulators and the Chinese ministry of commerce were accusations that the proposed rules discriminated against companies with state ownership, a big source of China’s outbound investment.…………………………………Foreign investors face political backlashThe danger that deals involving foreign investors may become politicised was highlighted last week when six US senators asked Hank Paulson, the Treasury secretary, to initiate a Cfius investigation into the alleged acquisition of a controlling stake in rail operator CSX by a “dominant minority” of foreign investors, write Stephanie Kirchgaessner and Robert Wright.The senators, headed by Democrat Evan Bayh, believe The Children’s Investment Fund (TCI) is behind the share buying. Mr Bayh, a potential running mate to Barack Obama, described the Cayman Island hedge fund as “aggressive” and “invisible to government regulators”.“The investment funds being used lack transparency, leaving the ownership and control of critical US infrastructure in the hands of unknown investors,” the senators said.Snehal Amin, a partner at TCI, denied the fund was seeking to take over CSX.The rail operator, which had lobbied the senators, was criticised by the head of the Organization for International Investment, which represents foreign companies in the US.“CSX is using a serious national security process as a public relations prop in a run-of-the-mill proxy fight. TCI doesn’t have any control of CSX,” said Todd Malan.
