;Ticker;Nombre_Completo;Date_Time;Titular;Subtitular;Texto
49;CSX;CSX Corp;2015-10-11T14:23:22Z;Week ahead: Markets diary;Investors focus on third-quarter reporting season, US Democratic presidential debate and EU meeting;US earnings season, democratic presidential debates, and EU talks on the migration crisis will compete for investor attention next week.More than 30 S&P 500 companies will announce earnings next week. The roster includes Schlumberger, Mattel, General Electric, Johnson & Johnson, CSX Corp, Intel, Netflix, Bank of America and Goldman Sachs.EU leaders gather in Brussels on Thursday to discuss the refugee crisis. Donald Tusk, president of the European Council, will also update European leaders on talks with Britain ahead of the UK’s referendum on its membership in the EU.EU foreign ministers are scheduled to hold a separate meeting to discuss the conflicts in north Africa and the Middle East in Luxembourg earlier in the week.The first Democratic debate of the 2016 presidential election cycle will be held in Nevada on Tuesday.Hillary Clinton, former secretary of state and the frontrunner for the Democratic presidential nomination, is expected to share the stage with senator Bernie Sanders of Vermont, former Rhode Island governor Lincoln Chafee, and former senator Jim Webb of Virginia in the debate being hosted by CNN.
50;CSX;CSX Corp;2015-09-14T16:33:57Z;US rail: off track;A mismatch between depreciation and capex mean the railroads are not in value territory yet;The US has, arguably, the healthiest large economy in the world. Railroads are a crucial part of its circulatory system. Yet shares in the biggest rail companies — Union Pacific, CSX, Norfolk Southern and Kansas City Southern — are down by about a quarter so far this year. Relative to expected earnings, the shares are the cheapest they have been in two years. Surely, then, the value train is pulling into the station?No. The problem is an industry-wide gap between depreciation (the item on the income statement reflecting consumption of fixed capital) and capital expenditure (the cash the companies spend on fixed capital). When depreciation is less than capex, cash generation lags behind reported earnings (because capex is a cash expense and depreciation is not). For the railroads, the gap is longstanding but has widened notably over the past decade. This makes a certain amount of sense, given the industry’s solid growth: capex rises first when companies expand. But in general, depreciation and capex should converge as growth normalises.And growth is normalising, to put it kindly. Coal shipments have fallen badly, agricultural volumes are soft and a strong dollar does not help shipments to the country’s ports and borders. Sales at the big four are expected to fall this year, earnings will be flat to down. The market took lagging cash in its stride while the industry was expanding. But as growth investors and momentum-chasers look elsewhere, and value investors start assessing the stocks, the question is going to be asked: when is capex going to come down? Because at 30 or more times free cash flow, value investors are not going to consider these stocks cheap. And, with the exception of Kansas City Southern, capex has risen in the first half of this year.Last year, all four companies spent more on dividends and share buybacks than they generated in free cash. So they are adding leverage, too. Their debt loads are not too heavy but adding debt to please investors can only go on for so long. Increasing cash flow then becomes even more crucial.Email the Lex team at lex@ft.com
51;CSX;CSX Corp;2015-09-09T17:47:25Z;How a traffic jam on a New York bridge led to a CEO’s ousting;United Continental boss Jeff Smisek has stepped down amid an investigation into port authority;It is one of the strangest business stories in the US in the recent years: an investigation into traffic jams on a bridge into New York that has led to the downfall of the chief executive of one of the country’s largest airlines.On Tuesday, Chicago-based United Continental announced that Jeff Smisek, its chief executive, chairman and president, had stepped down “in connection with” an internal inquiry carried out by the company, which in turn was linked to a US federal investigation into the Port Authority of New York and New Jersey.What began as an investigation into allegations — subsequently confirmed — of politically-motivated lane closures on the George Washington Bridge from New Jersey to New York has gone on to examine whether United laid on a special “chairman’s flight” for the benefit of the head of the port authority.It is that investigation that led to Mr Smisek’s abrupt departure, to be replaced by Oscar Munoz, a longstanding director of United and former chief operating officer at CSX, the railway group.The affair has also caused problems for Chris Christie, the governor of New Jersey who is seeking to be the Republican candidate in next year’s presidential election, but has been lagging behind in the polls in a crowded field.The lane closures were allegedly ordered to cause traffic problems in Fort Lee, a town on the New Jersey side of the bridge, after its mayor declined to support Mr Christie’s re-election campaign for the governorship. David Wildstein, a former ally of Mr Christie, in May pleaded guilty to having been involved in the conspiracy.The federal investigation into that issue led to a wider look at other issues relating to the port authority, which operates bridges and tunnels in the New York area, including the George Washington Bridge, and also the New York region’s three airports. Mr Wildstein had been a senior official at the authority.United was drawn into the investigation when federal prosecutors started to examine whether the airline had been asked to do favours for David Samson, the port authority’s former chairman, in exchange for benefits such as improvements at Newark airport.Subpoenas have been issued seeking information about those potential favours, including details surrounding United flights between Newark and Columbia, South Carolina. Columbia is a small town 56 miles from where Mr Samson had a weekend home, according to people familiar with the case.The twice-weekly service was known as the “chairman’s flight”, according to The Record, the New Jersey newspaper that first reported on it. The flight was stopped three days after Mr Samson stepped down from the port authority in March last year.Mr Samson has not been charged, although he is under investigation. A spokesperson for Mr Samson declined to comment.Mr Smisek’s exit comes soon after United’s reputation took another battering because of persistent problems with its computer systems. They have been troublesome in spite of efforts to improve them since the group was formed when United Airlines and Continental were brought together through a merger in 2010.In June this year United was forced to stop all domestic flights for an hour because of what it called “automation issues”, and then in July halted all operations out of the country for an hour because of “computer problems”.United was ranked the lowest for customer satisfaction of the traditional US carriers in a survey conducted by JD Power in 2014-15.However, Adam Pilarski of Avitas, a consultancy, says Mr Smisek and his team had been making some progress in improving the performance of United, which had long suffered from poor management before the merger with Continental.“Smisek is an educated lawyer, he’s not a charismatic guy, but he has been an excellent CEO,” says Mr Pilarski.“United was the worst airline, and now they are just mediocre, which is an improvement. They get a solid C grade, and they used to be D-minus.”United Continental’s financial results have improved, and its share price performance has reflected that. Its shares are up 172 per cent over the past five years, compared to a 70 per cent rise for the US airline sector as a whole.The group’s pre-tax profits for the first half of 2015, excluding special items, were more than four times their level in the equivalent period of 2014 at $1.85bn, after it reported record earnings for the second quarter.At the top of Mr Munoz’s agenda will be fixing United’s information technology problems, and that is clearly a tough job.In other respects, though, this looks like a good time to be taking over a US airline. Consolidation appears at last to be creating some market power that will allow carriers to improve their margins, enabling them to benefit from the fall in oil prices.After the turbulence at United Continental this week, Mr Munoz can hope for some smoother air ahead.
52;CSX;CSX Corp;2015-09-08T22:45:11Z;United Airlines chief executive steps down amid inquiry;Investigation over flights involving onetime ally to Chris Christie;United Continental chief executive Jeff Smisek is stepping down in connection with a federal investigation, the US carrier said in an unexpected announcement on Tuesday.Mr Smisek, a former Continental Airlines CEO who has run the merged carrier since the merger with UAL in 2010, will be replaced by Oscar Munoz immediately, the airline said in a statement after the stock market closed.United’s executive vice-president of communications and government affairs and its senior vice-president of corporate and government affairs are also leaving the company.The carrier said in a statement that all three exits were “in connection with the company’s previously disclosed internal investigation related to the federal investigation associated with the Port Authority of New York and New Jersey.”The investigation is looking into the circumstances under which United Airlines — the biggest user of the port authority’s Newark Airport — came to reinstate its lightly used service to a destination near the holiday home of David Samson, the port authority’s former chairman. Mr Samson was a key ally of Chris Christie, the New Jersey governor who is running for the White House.United Continental Holdings announced on Tuesday that the US airline’s chief executive Jeff Smisek would resign in connection with a federal investigation linked to a key ally of New Jersey Governor Chris Christie, who is running for the White House. Aimee Keane speaks with Ed Crooks to find out how the carrier found itself entangled in the probe.“The investigations are ongoing and the company continues to co-operate with the government,” the statement said, adding that the probe had not raised “any accounting or financial reporting concerns”.Mr Smisek will receive a separation payment of $4.88m to be paid as a lump sum in cash, according to a company filing with the Securities and Exchange Commission.Mr Munoz, who pledged to make United “the top-performing airline”, was most recently chief operating officer of CSX, the US railroad operator. United’s board also promoted Henry Meyer, its lead independent director and a former chief operating officer of CSX, to the role of non-executive chairman.Shares in United fell as much as 3 per cent to $55.80 after the departure news.
53;CSX;CSX Corp;2015-07-23T16:02:41Z;Coal slump weighs on Union Pacific;Revenues drop 10 per cent as natural gas trumps coal;Union Pacific, the US’s largest rail network, on Thursday became the latest rail company to reveal the impact of sharp declines in coal traffic when it announced net income fell 7 per cent to $1.2bn after a 31 per cent drop in coal revenue.The fall in coal revenues compared with last year’s second quarter, to $679m, helped to push group revenue down 10 per cent to $5.43bn.The decline reflected the falling price of natural gas, which has pushed out coal as a fuel for generating electricity, weak demand for export coal and weather disruptions that closed some tracks. The volume of coal carried fell 26 per cent, pushing overall volumes down 6 per cent.Shares in the company fell 5.7 per cent by close of trading in New York at $92.12.The reversal in coal has ended a period when the US’s big railroads were scrambling to add capacity to cope with strong growth in movements of oil, agricultural products and shipping containers to head off growing congestion on their networks. On July 14, CSX, the main railroad in the eastern US, reported an 11 per cent second-quarter fall in coal revenues and a 15 per cent decline in traffic.UP, which operates in the western two-thirds of the US, suffered particularly heavily because its main coal traffic is low-quality coal from the Powder River Basin, which is used mainly for electricity generation. Much of the coal traffic for CSX and Norfolk Southern, which operate east of the Mississippi, is high-quality metallurgical coal used in steel production.Lance Fritz, UP chief executive, said that gains from price increases in the quarter had not been enough to overcome a “significant decrease” in demand.Industrial products — where revenue fell 14 per cent to $970m — and agricultural products — where revenue fell 7 per cent to $867m — also produced what Mr Fritz called “significant volume decreases”. Earnings per share fell 3.5 per cent to $1.38.However, he added that the company had made “meaningful progress” in “right sizing” its resources to the current volumes.Many of the challenges facing UP reflect the reversal in the high oil price, which significantly benefited railroads in recent years. The companies benefited not only from a boom in movements of domestically produced crude oil and supplies for new oil and gas wells, but also from strong movements of coal encouraged by the high price of natural gas.Intermodal traffic — shipping containers and truck trailers — benefited from pressure on companies to convert truck movements to rail to exploit rail’s greater fuel-efficiency.UP’s crude oil traffic for the quarter declined 29 per cent to 25,200 carloads. Intermodal volume was down 5 per cent to $1.09bn, despite a 2 per cent increase in volumes. International intermodal traffic — containers going to and from ports — grew only 1 per cent as US west coast ports continued to grapple with the effects of a months-long labour dispute. Domestic intermodal grew 3 per cent.Mr Fritz said the volume outlook remained “uncertain” but the company was “laser focused” on operating safely and efficiently.“We will continue to reduce costs and improve productivity as we further align resources with demand,” he said.
54;CSX;CSX Corp;2015-07-15T16:28:21Z;CSX buoyed as profits beat estimates;US quarterly earnings season heats up, Yum Brands disappoints;CSX Corp shares climbed after the largest railroad operator on the US east coast reported second-quarter profits ahead of estimates as the quarterly results season heated up.Net income at the Jacksonville, Florida-based company climbed 5 per cent from a year earlier to $553m, or 56 cents a share, in the three months to June 26. Sales fell 6 per cent to $3.1bn.Analysts on Wall Street had forecast earnings of 53 cents a share on sales of $3.1bn.The company said lower fuel prices and savings from efficiency initiatives resulted in a 9 per cent drop in expenses, lifting operating income to $1bn during the quarter.Shares of the railroad operator rose 1 per cent to $32.40.Macy’s shares jumped almost 8 per cent to $72.01 after an activist investor was reported to have taken a stake in the US department store group, best known for its flagship store in Manhattan.Jeffrey Smith of Starboard Value told the Delivering Alpha conference that the firm had a stake in Macy’s and argued that the retailer’s real estate was undervalued by the stock market, according to CNBC, which is a co-organiser of the conference of hedge funds and activist investors in New York. Starboard’s previous targets have included stationery chain Staples.Yum Brands shares slipped 3 per cent to $88.88 after the owner of KFC, Pizza Hut and Taco Bell said same-store sales in China slid 10 per cent from a year earlier — offsetting sales at newly opened stores and pulling overall revenues in the country down 4 per cent.The company has struggled to woo customers back to its restaurants after a food safety scare in July 2014. Comparable sales in the country — Yum’s largest by sales — have fallen for four consecutive quarters now.The figures accompanied a 30 per cent drop in second-quarter profits to $235m, or 53 cents a share, falling short of Wall Street estimates. Overall revenues fell 3 per cent to $3.1bn.Mead Johnson Nutrition briefly led the declining stocks on the S&P 500, falling 1.8 per cent to $86.51, after the company warned second-quarter results would fall short of analyst expectations.The company said revenues fell 7 per cent from a year earlier as a stronger dollar and declining sales of China-based manufactured products weighed on growth. Mead Johnson added that slow emerging market growth and low dairy prices increased promotional pricing in Latin America and Asia.PayPal shares trading on a so-called when-issued basis climbed 1.5 per cent to $37.49 — valuing the company at $42.5bn — after index manager S&P Dow Jones Indices said the company would replace Noble Corp in the S&P 500 after the close of trading on Friday.Shares of the digital and mobile payments processing company began trading on a when-issued basis earlier in July, ahead of its split from eBay.The division accounted for more than half of eBay’s market capitalisation when the stock began trading on the Nasdaq. S&P Dow Jones Indices added that PayPal would also usurp its former parent on the S&P 100 index.Overall, US equity markets were moderately weaker despite stronger industrial production and a report from the New York Federal Reserve that eclipsed economists’ expectations.The S&P 500 fell 0.1 per cent to 2,107.40 while the Dow Jones Industrial Average was little changed at 18,050.17. The technology-heavy Nasdaq Composite lost 0.1 per cent at 5,098.94.eric.platt@ft.comTwitter: @ericgplatt
55;CSX;CSX Corp;2015-04-23T23:00:51Z;The Nasdaq — going nowhere for 15 years;Almost any other equity investment would have been a smarter bet;This was the day that many market-watchers thought they would never live to see: the day the Nasdaq Composite index closed at a new all-time high.The last time it did so was on March 10, 2000, at the top of arguably the single most grotesque bubble in stock market history. Within a month it had fallen by more than a third.The valuations the Nasdaq hit at that point were so extreme that many assumed it could take a lifetime to get back to a new high. This was not unreasonable. US stocks at that point were more overvalued by sensible long-term metrics than at any other point in history.Nasdaq stocks looked more expensive even than industrial stocks had done before the Wall Street Crash in 1929 — and it had taken until 1954 for them to set a new high.In history’s other great bubble, Japanese stocks peaked on New Year’s Eve 1989. A quarter of a century later, Tokyo stocks remain almost 50 per cent below that peak.So the recovery of the Nasdaq is genuinely remarkable and is backed, hearteningly, by truly remarkable corporate performance. Apple, still a year away from the launch of the iPod in March 2000, leads the pack. It appeared in the dotcom era to have decisively lost its war with Microsoft. But since then it has gained 4,200 per cent while the Nasdaq has been flat. Its extraordinary success — achieved with profit multiples that still make it look cheap — is the single biggest factor in Nasdaq’s recovery.But buying the Nasdaq at its last peak would still have been a terrible idea. Scarcely any equity market anywhere has fared worse. Even Argentina’s Merval index, despite the disasters of default and devaluation in the interim, has gained 135 per cent.Those who dared to be contrarian would have trounced those who jumped into the hot stocks of the Nasdaq. According to Bloomberg data, five stocks in the S&P 500 have risen more than 1,000 per cent since then. For those who could not foresee the iPod, iPhone and iPad, and missed out on Apple, there was always the Ball Corporation, which makes cans, VF Corporation, which makes jeans, and CSX Corporation, a railroad. All were industries that appeared to be in terminal decline 15 years ago.
56;CSX;CSX Corp;2015-03-26T19:04:46Z;Dow Transports puts shadow on US equities;Barometer of economy and overall sentiment lags broader market;Investors are shunning US transport stocks and this barometer of the economy and overall equity sentiment on Thursday continued lagging the broad market.Investors have turned cold on transport equities since the start of the year, discouraged by weakening economic reports that have forced economists to downgrade their forecasts for the world’s biggest economy.The shift by investors accompanies spotty performance for some of the sector’s biggest companies after bumper returns in 2013 and 2014. Shares of UPS, Avis and Kansas City Southern have all fallen more than 10 per cent, while two-thirds of the Dow Jones Transportation Average members have declined since the start of the year.The Dow Transports retreat casts a cloud over the broader equity market as a bullish or bearish trend is flagged whenever the benchmark rallies or declines sharply. This is based on the notion that transport stocks reflect the underlying economy far better than the average company and thus foreshadow prospects for economic growth.Analysts with JPMorgan said a stronger dollar has crimped export activity, which is a key component of the rail business. Credit Suisse, which remains bullish on the rail industry, noted that a slide in energy prices has weighed on deliveries of coal and crude oil products.“We have witnessed the impact in the past few weeks during which CSX, Norfolk Southern, Union Pacific and Kansas City Southern have each experienced notable year-over-year declines in coal,” said Allison Landry, an analyst with Credit Suisse.She added: “This, in conjunction with a step down in shale-related volumes relative to the beginning of the quarter, potentially leading to extra costs related to a mismatch in the resource-to-demand equation, will likely result in downward first-quarter earnings revisions.”That left Dow Transports on course for lagging its namesake counterpart for a fifth consecutive day on Thursday. The benchmark has registered a fall of almost 5 per cent this year, reflecting in part investors increasing bearish or so-called short positions in transport companies after two years of double-digit gains.Shares of SPDR S&P Transport ETF constituents, which includes CSX, FedEx and Avis Budget, on loan to short the underlying stock have climbed 33 basis points from a low touched in January. At 3.4 per cent, the figure was the highest since the middle of November, according to data provider Markit.The case for transport stocks rests largely on wider US and global activity as the rail and shipping behemoths depend on increases in trade to fill rail cars and cargo holds.Retailers have warned that port disputes on the US West Coast have stunted supply chains, prompting companies including Union Pacific to forecast first-quarter volumes that will be flat to slightly down as it takes weeks to clear inventory backlogs.The strength of the dollar is also weighing on export-heavy industries, including semiconductors, as big corporations put systems upgrades on hold.“Foreign demand should be cut as long as [the] dollar stays in this area,” said JJ Kinahan, chief strategist at TD Ameritrade. “Until we have consistent strength in the economy, domestic companies may say, ‘Let’s hold off a little bit’.”eric.platt@ft.comTwitter: @ericgplatt
