;Ticker;Nombre_Completo;Date_Time;Titular;Subtitular;Texto
98;CSX;CSX Corp;2010-11-08T22:11:52Z;Deal speculations lifts tech stocks;;"Deal speculation and an analyst upgrade for Hewlett-Packard helped the technology sector edge up while the broader S&P 500 fell. Hewlett-Packard rose 1.2 per cent to $44.25 after it was added to the UBS short term buy list.Analysts said holiday sales of computers and servers would drive fourth quarter results. But they kept its long term rating “neutral” on concerns of increasing competition.Intel was upgraded to “buy” from “neutral” by UBS and given a price target of $25. Shares rose during the day but closed down 0.1 per cent at $21.23. Analysts predicted that the PC component inventory cycle had bottomed out and that the threat from tablet computers was included in the sales outlook.Amazon.com surged 0.7 per cent to $171.99 after the online retailer bought privately owned Quidsi, which owns diapers.com and soap.com. It paid $500m in cash for the company that will help it expand into baby care products.Yahoo rose 1.1 per cent to $16.44 after it was reported that the search engine operator could be exploring a tie-up with AOL. The latter’s shares climbed 4.7 per cent to $26.10.The S&P 500 closed down 0.2 per cent to 1,223.25, the Dow Jones Industrial Average had lost 0.3 per cent to close at 11,406.84, but the Nasdaq Composite closed up 0.1 at 2,580.05.Last week, stocks hit their highest levels in two years as investors cheered the Federal Reserve’s decision to extend quantitative easing and the Republican victory in the House of Representatives. David Bianco, head of US equity strategy at Bank of America Merrill Lynch, comparing the market to last time the S&P 500 broke out above 1,200 in April, said: “There are many fundamental reasons for stocks to rally further.“Higher earnings per share has made the S&P cheaper today than in April. Currently, the S&P is trading at 13.8 times annualised third-quarter earnings per share compared with 15.2 times annualised first-quarter earnings per share in April.“We believe the rising likelihood of Congress passing a tax package before year-end can get the S&P close to 1,300.”Financials fell 0.8 per cent as regional banks continued to suffer since they reported their third-quarter results.The S&P 500 regional banking index slid 0.8 per cent with Regions Financial Corp losing 1.7 per cent to $6.34 and PNC Financial Services declining 1.3 per cent to $57.65.Analysts at Oppenheimer reaffirmed their “overweight” rating for the industrial sector but said they were selectively increasing risk exposure, looking at machinery and road and rail stocks. They said machinery stocks were attractive because they would benefit from new orders and construction spending trends. Analysts at Credit Suisse echoed this recommendation, saying the stocks were cheap.Oppenheimer analysts also said road and rail stocks were expected to increase their sales, earnings and margins at a higher rate than the overall sector in 2011 because of freight volumes and truck tonnage increasing significantly in recent months.The S&P 500 industrials sector lost 0.3 per cent.But manufacturing and construction company Fluor added 2.2 per cent to $55.72 and rail transport stocks CSX and Union Pacific both edged up.CSX rose 0.7 per cent to $62.23 and Union Pacific, which benefited from an upgrade at Credit Suisse, was up 0.8 per cent to $91.98. Also in industrials, Boeing shares fell in spite of a $3.3bn order from Saudi Arabian Airlines for 12 aircraft and were lower by
1.5 per cent at $70.21.In materials, General Steel Holdings fell 6.8 per cent to $2.76 after the Chinese group reported a surprise third-quarter loss as it suffered from higher prices of iron ore and coking coal.McDonald’s was almost flat at $79.31 after it reported its global sales in October. The rise of 6.5 per cent was helped in recent months by sales of smoothies and its dollar menu but the increase in the US was lower than analysts had forecast. Sysco, which distributes food for the food service industry, fell 2.7 per cent to $29.23 after it reported its earnings were squeezed by higher food and commodity costs."
99;CSX;CSX Corp;2010-11-02T16:56:04Z;Investors gauge election bounce;;Even though Republicans, touting business-friendly policies, appear set to take control of the US House of Representatives from Democrats, analysts are far from certain about the potential for a positive bounce for the US stock market.Historically, US markets have performed extremely well in the fourth quarter of a midterm year, following the typical loss of seats for the president’s party in the midterm election.The S&P 500 index has not made a total return of less than 10 per cent in such a quarter since 1950, according to figures from LPL Financial. UBS research shows that the year after a midterm, the S&P 500 sees a median price increase of nearly 20 per cent.Stock markets tend to prize political gridlock, believing fewer new regulations will emerge and less government deficit spending will keep borrowing rates low. A study by Fidelity Investments found that large-cap stocks saw average price gains of 23 per cent during the four periods of gridlock – a split in party control of the White House and both houses of Congress – since 1970.Some of those gains will already be priced in, however, in part because gridlock to some degree has been the rule in Washington since Democrats lost their 60th vote in the Senate. Only a surprise Republican seizure of the Senate could be a near-term catalyst for further gridlock-led gains.Other factors will also limit the effect. The largest looming change resulting from increased clout for the Republicans – an agreement to extend the Bush tax cuts, which would lower government revenues by $500bn, according to the Congressional Budget Office – will probably not be resolved to the market’s satisfaction by the election.“The changes may not be permanent,” said Jeffrey Kleintop, chief market strategist at LPL Financial. “A one-year extension of current tax rates may not be as welcome as a [permanent] resolution of the tax rate uncertainty.”A report on deficits by a bipartisan committee set for December could be a much more important event for clarity on tax cuts, analysts said, as a recommendation to extend would provide cover for Democrats who may face frustration from their own base if they agree to cuts.If such changes do come to pass, higher-yielding stocks could rally as investors look to take advantage of the extended tax break to pocket dividends.“High dividend-paying sectors such as telecoms and utilities may benefit. Cash-rich companies in other sectors may also benefit as they introduce or substantially increase their dividend payout as they look to attract a new class of investors seeking yield,” said Mr Kleintop.Many strategists have argued that the S&P 500 index has been discounted in 2010 due to uncertainty created by the tax expiration, heavier regulation and deficit spending. The S&P has risen just 6 per cent so far this year, even as earnings-per-share are projected to increase 35 per cent this year.Thomas Doerflinger, strategist at UBS, termed recent policies such as healthcare reform, financial regulation, a Gulf of Mexico drilling moratorium and the tax rises likely to follow from deficit spending, “the Great Suppression”.“It should be positive for equities if the 2010 elections begin a policy shift toward lower taxes, less spending, and lighter regulation,” he said.He warned, however, that the Republican victory would not represent an immediate reversal of the “Great Suppression”. He said he was watching for a “tax holiday” on a repatriation of foreign earnings, which could signal a significant shift in the balance of power.Economists at RBS warned that a sizable victory may also raise expectations of Republican victory in the 2012 presidential election, and could hinder the economy over the next two years.“Hopes of a more business-friendly fiscal agenda, if the Republicans sweep both the presidency and Congress in 2012, could keep companies from aggressively hiring and capital spending near-term,” said Michelle Girard and Omair Sharif of RBS.The circumstances of this election are also historically unique, coming on the eve of what is expected to be a massive intervention by the US Federal Reserve in the form of “quantitative easing”.Bruce Bittles, equity strategist at Robert W. Baird, said the expected election result would not be a strong catalyst itself, instead only raising the relative importance of the Fed as an economic actor.“If we get political gridlock in Washington, as expected, the Federal Reserve will be the one left with any ability to provide stimulus to the economy,” he said.Economists at Société Générale suggested that changing course could unravel the gains seen as “QE2” has been priced in, and from a cheap dollar powering global revenues at multinational groups.“New fiscal stimulus, more likely [if the Democrats retain significant power], could prove potent, particularly when combined with further monetary easing,” they said. “The increased presence of conservatives could lead to premature fiscal tightening, which would be a negative for the economy, and risky assets.”The economy is also not in a typical position. In the 1980s and 1990s, gridlock was prized because it was not to going to upset already strong growth. The 1994 Republican sweep into power in Congress saw the S&P 500 index return 30 per cent in the fourth quarter of that year.The poorest showing for the market after a midterm election was in 1978, when inflation was rampant and investors were frustrated that the government was not cutting spending faster. The S&P rose 12 per cent.In an environment with high unemployment and deflation, gridlock may similarly not be as valuable to the market.Richard Soultanian of Nus Consulting, who advises companies on financial decisions, said: “Gridlock can be a positive when the country’s underlying economy and fiscal situation are in good order. Today this is not the case …The act of doing nothing will hamper the global economic recovery rather than accelerating it.”
100;CSX;CSX Corp;2010-10-13T21:07:40Z;US indices reach five-month highs;;CSX led US industrial stocks to strong gains as the railroad operator reported record third-quarter earnings after a big increase in car shipments.Its shares gained 4.2 per cent to $59.66, their highest since equity markets plummeted in the wake of the failure of Lehman Brothers in September 2008.CSX had its best third quarter in terms of operating income, which surged 48 per cent from the comparative period last year to $414m.The S&P 500’s industrials sector rose 1.3 per cent. Shares in Norfolk Southern, which competes with CSX on the US’s east coast, rose 4.2 per cent to $62.21.“When CSX reports better than expected earnings, it shows that goods from international trade are moving strongly all over the country,” said Phil Dow, chief equity market strategist at RBC Wealth Management.Boeing, the aerospace group, added 1.8 per cent to $71.47, and Caterpillar, the equipment manufacturer, added 1.2 per cent to $80.29.US indices were at five-month highs. The S&P 500 index gained 0.7 per cent to 1,178.10 and the Nasdaq Composite index rose 1 per cent to 2,441.23.The Dow was up 0.7 per cent to 11,096.08. Seven of its 30 components declined.Materials stocks rose 1.6 per cent after Beijing policy moves are set to allow Chinese banks to lend more to new infrastructure projects.Alcoa, the aluminium group, added 1.3 per cent to $13.39. Owens-Illinois, a maker of glass containers, rose 4.1 per cent to $27.23 a share.The sharpest one-day rise in gold prices in five months sparked a 3.5 per cent gain for Freeport-McMoRan Copper & Gold to $98.47 – the group’s highest since July 2008.But estimate-beating results for Intel failed to lift the shares, which fell 2.7 per cent to $19.24. Intel said fourth-quarter sales could be below expectations.Analysts noted that its development of a new chip product, known as Sandy Bridge, could hinder future margin improvement.Linear Technology, which builds components for Apple’s iPad, missed its quarterly earnings target and said next quarter’s earnings could also miss. The shares lost 3.9 per cent to $30.15.However, the technology sector was broadly higher thanks to Intel’s steady consumer sales. Cisco was up 2.5 per cent to $23.18, and Hewlett-Packard added 2.1 per cent to $42.21.JPMorgan Chase topped estimates by reducing its credit loss write-offs, but income in its investment banking division declined. It also said it could incur more losses due to its mortgage portfolio.Its shares fell 1.4 per cent to $39.84.Financials were the only sector to decline, amid fears that banks would have to buy back bad mortgages and incur heavy losses.Wells Fargo fell 0.7 per cent to $25.81, Citigroup slipped 0.6 per cent to $4.28 and Bank of America was down 1.7 per cent at $13.29.The St. Joe Company, a Florida real estate developer, fell 9.8 per cent to $22.14 after David Einhorn of Greenlight Capital revealed that he was shorting the stock.“Mortgages continue to produce stiff headwinds,” said Glenn Schorr, head of financials equity research at Nomura Securities.Chevron, the US oil major, warned that costs due to the Gulf of Mexico drilling ban and the weaker dollar would hurt third-quarter earnings. Its shares fell 0.2 per cent to $83.67.Monsanto added 4.7 per cent to $54.69 after the agricultural group received approval from Argentina and Brazil to sell bio-engineered seeds.Yahoo rose 5.7 per cent to $15.25 after analysts at JPMorgan raised price targets, citing a faster improvement in display advertising revenue.Williams Company, a natural gas producer, jumped 9.8 per cent to $21.53 after it named a new chief executive, Alan Armstrong.Shares in Crown Media, owner of the Hallmark Channel, jumped 46 per cent to $3.72 after a report speculated that a recent recapitalisation may lead to a sale.A new sale of $500m of stock by MGM Resorts International, the hotel and casino group, led to an 11 per cent fall to $12.10. It also reported preliminary third-quarter results slightly below expectations.
101;CSX;CSX Corp;2010-09-22T21:28:30Z;Return trip to top levels of UK transport;Tim O’Toole elevated to the leading job at First Group;Tim O’Toole’s elevation to the leading job at First Group represents a remarkable return to the top levels in British transport, less than 18 months after he announced his departure from the UK to return to his native Philadelphia.Mr O’Toole had spent six years in London as managing director of London Underground, operator of the capital’s tube. He left in April last year saying he wanted to spend more time with his family, amid rumours of rows over future funding for underground upgrades.He had become one of the most respected figures in UK transport and brought new discipline to London Underground’s operations.He never fully left the UK. He became a non-executive director of FirstGroup in May 2009 and, this March, was approached by Tube Lines, the private contractor upgrading three London tube lines, to be its chief executive. That offer lapsed after London Underground announced in May it was taking Tube Lines over.Instead, in June he became FirstGroup’s chief operating officer and deputy chief executive, a move that can now be seen as preparation for his elevation to the top job.Mr O’Toole, who has a reputation as an intense, methodical man with an eye for operational detail, has previous experience as chief executive of a major company. He was the last chief executive of Conrail, one of the US’s biggest railroads, before it was split up between CSX and Norfolk Southern, two rivals. He is still a non-executive director of CSX.However, he is likely to need both his operational expertise and his skill at operating with the public sector in his new task. FirstGroup both needs to maintain a tight grip over complex operations such as its First Great Western rail franchise and do its best to avoid losing out from looming cuts in UK public spending.
102;CSX;CSX Corp;2010-07-13T20:57:14Z;Alcoa and CSX earnings lead Wall St higher;;US stocks rallied on Wall Street on Tuesday for the sixth consecutive session as the earnings season got off to a better start than many had feared.Alcoa and CSX, the first two S&P 500 components to report, both posted slightly better-than-expected earnings on Monday after the market close.Myles Zyblock, analyst at RBC Capital Markets, expects the earnings quarter to most likely be solid again. However, he added: “Nevertheless, we believe the potential for somewhat waffling guidance has the equity community worried at present.”Investors remain fearful. Mr Zyblock said: “The budding note of caution seems most closely linked to the idea that we had all turned too optimistic about growth rates on earnings.”At the close, the S&P 500 was up 1.5 per cent at 1,095.34, the Dow Jones Industrial Average gained 1.4 per cent to 10,363.02 and the Nasdaq Composite rose 2 per cent to 2,242.03.Alcoa advanced 1.2 per cent to $11 a day after the largest US aluminium producer reported second-quarter profit that modestly beat analysts’ expectations, as higher metal prices boosted revenues.CSX, a freight transportation company, fell 1.4 per cent to $51.72 after rallying at the start of the session. It had reported second-quarter earnings of $1.07 per share, also topping analysts’ average estimates.Tyco Electronics, a leading maker of electronic connectors, rallied 2.5 per cent to $25.92 as it agreed to buy ADC Telecommunications for about $1.25bn to bolster its broadband connectivity products offering.Shares in ADC surged 41.5 per cent to $12.52. Trading in the stock was halted for part of the session.AIG gained 6.8 per cent to $37.99 as the bailed-out insurer’s board was reported to be close to agreeing to sell its AIA Asian unit in an initial public offering. An announced sale of the unit to London-listed Prudential collapsed last month after the latter’s shareholders failed to support the deal.Intel, a leading semiconductor maker, was up 2.1 per cent to $21 ahead of its second-quarter earnings announcement, due after the close of trading.US-listed shares in BP were up 0.3 per cent to $36.88, as tests continued on its new sealing cap for the leaking oil rig in the Gulf of Mexico. The company is forecast to pay about $10bn less tax over the next four years as it meets the costs of its huge oil spill in the Gulf of Mexico, hitting the revenues that Britain and the US receive from the oil group each year.Apple was among the worst performers in the S&P 500 as the stock dropped 2.1 per cent to $251.80. Its latest iPhone model was not recommended by Consumer Reports, an influential publication which carries out consumer products comparisons, in its latest review of smartphones. JPMorgan said that Apple was set for “prolonged negative” public relations after failing to win the’commendation.“The problem seems to be a design flaw, and it is significant,” said Mike Gikas, senior electronics editor at Consumer Reports. The publication has recommended the three previous iPhone models.Financial stocks were higher across the board as a landmark financial reform bill neared final approval in Congress. Three Republicans said late on Monday they would support the bill, boosting the 54 Democrats and two independents who are also expected to vote for it. The bill needs 60 votes be approved.Goldman Sachs was up 2.2 per cent to $140.25, Citigroup added 4.6 per cent to $4.30, Morgan Stanley gained 4.5 per cent to $25.66 and JPMorganclimbed 3.3 per cent to $40.48.Invesco, the manager of the Aim and PowerShares funds, was one of the day’s best performers as it rallied 6.5 per cent to $19.43. The company reported assets under management of $558bn at the end of the second quarter, beating analysts’ average estimates.Fastenal, an industrial distributor, posted better-than-expected earnings, boosted by a 20 per cent surge in revenues. But its shares fell 4.1 per cent at $50.44 after rallying more than 22 per cent since the start of the year. Its net income in the quarter was 47 cents per share, compared with analysts’ average estimate of 44 cents.
