;Ticker;Nombre_Completo;Date_Time;Titular;Subtitular;Texto
0;ETR;Entergy Corp;2016-02-02T20:15:11Z;Hinkley resignation continues uncertainty over £18bn plant;Departure of nuclear chief raises further doubts over project’s go-ahead;The man in charge of building an £18bn nuclear power plant in Somerset has resigned his post amid continued uncertainty over when the company will give the final go-ahead for the project.Chris Bakken has been named as the next chief nuclear officer for Entergy, the US power company, a post he will begin on April 6. That will mean he leaves his current job as project director for Hinkley Point C, a huge nuclear power station project in Somerset that has been dogged by delays.Mr Bakken said: “This is a critical time for the industry, Entergy and its nuclear fleet. I’m proud to join the Entergy team.”EDF said: “Chris Bakken has decided to return to the USA, his home country, to pursue new professional opportunities whilst allowing him to spend more time with his family.”The company has appointed Philippe Bordarier, currently the chief nuclear officer for EDF Energy Generation, to run the project.Under current plans, Hinkley Point is due to be completed by 2025, after which it will provide 7 per cent of Britain’s electricity. But the process has dragged on in part because of technology problems at the company’s plant at Flamanville, in Normandy, which is built to the same specifications.EDF was set to take the final investment decision at a board meeting last week. But the company delayed doing so because of concerns by some of its backers about how it plans to finance the project.Reports in France have suggested EDF is currently pressing the French government, which owns 85 per cent of the company, to take some of its 66.5 per cent stake in the project. The other 33.4 per cent is owned by CGN, the Chinese state-owned nuclear group.Anti-nuclear campaigners said Mr Bakken’s move was another sign that the project is in trouble. John Sauven, executive director at Greenpeace, said: “Coming just days after the EDF board failed to agree a final go-ahead for Hinkley, this move is yet another symptom of the disquiet this project is causing within the company itself.“The whole enterprise makes so little economic sense that EDF’s own staff and many board members are concerned it will seriously damage the company. ”But EDF said the project is ready for its final investment decision. Vincent de Rivaz, chief executive of the UK arm of EDF, recently told a parliamentary dinner: “I can tell you that I am absolutely confident that Hinkley Point C will be reaching a final investment decision soon.”
1;ETR;Entergy Corp;2015-08-10T16:47:07Z;Industrials and materials lead S&P rally;Energy sector boosted by rising oil prices;The industrials and materials sectors led a rebound on Wall Street on Monday, as investors bet that lacklustre Chinese economic data would bolster the case for additional stimulus from Beijing.The gains follow a torrid few months for the two cyclical sectors — materials and industrial stocks have both trailed behind the broader S&P 500 since the third quarter began in July and are both negative for the year.While data on the weekend revealed a sharp decline in China’s exports for July over the past year, strategists with Deutsche Securities said Chinese equities, which climbed overnight, were “supported by the potential for more stimulus”.Marc Chandler of Brown Brothers Harriman noted that the figures reported from China showed demand for certain commodities and that related sectors were likely “oversold” last week and due for a bounce.“Even when you look at the decline in Chinese exports, they still imported a record amount of oil. Iron ore also held up well for example,” Mr Chandler said. “My sense is that the China story helps at the margin.”Shares in Joy Global rose 8.4 per cent to $26.84, Caterpillar climbed 3.7 per cent to $80.16, Dover advanced 3.5 per cent to $66.06, Alcoa increased 7.1 per cent to $10.07 and CF Industries gained 3.4 per cent to $60.95.The energy sector also climbed as oil prices rebounded off of recent lows. US crude prices rose 2.2 per cent to $44.83 a barrel while Brent, the international benchmark, advanced 3.3 per cent to $50.21.Shares in Valero advanced 5.5 per cent to $69, Consol Energy improved 5.4 per cent to $13.86, Transocean climbed 6.6 per cent to $14.46 and Halliburton rose 4.7 per cent to $41.64.The S&P 500 energy index, which advanced 3.1 per cent to 505.61, remains the worst performing sector on the blue-chip index, battered by oil price declines. The industry is one of only two within the S&P 500 that is expected to report a decline in second-quarter earnings.Strategists with Morgan Stanley, who have called their overweight energy position a “bad call”, said they nonetheless expected the sector to rebound as funds flow into the industry.“Sentiment on the stocks is low. Analysts slashed their numbers so aggressively that earnings look like they will be upwardly revised throughout the year. We remain optimistic that money will flow to this group in the second half of this year,” Adam Parker, a strategist with Morgan Stanley, said.Investors shifted out of US utilities after the sector recorded its best week since March, sending shares in Entergy down 1.9 per cent to $68.91 and Edison International 2.4 per cent lower to $59.54.Utilities, which have lagged behind the wider market since the year began, have been buffeted by fears that the Federal Reserve will soon begin to raise interest rates, a negative for a sector closely correlated to rate moves.Overall, US equities climbed on Monday, joining a rally in place across European and Asian stock markets. The S&P 500 gained 1.3 per cent to 2,104.18, while the Dow Jones Industrial Average rose 1.4 per cent to 17,615.17.The technology-heavy Nasdaq Composite rose 1.2 per cent to 5,101.80.eric.platt@ft.comTwitter: @ericgplatt
2;ETR;Entergy Corp;2015-03-10T17:19:36Z;Financials and techs fall amid defensive turn;Utilities the sole beneficiary after big US stocks retreat;US investors piled out of cyclical sectors in a defensive turn that dealt a blow to the consumer discretionary, financial and technology industries and erased the S&P 500’s gains for the year.A sharp rise in the dollar against its largest trading partners, as well as renewed concerns over negotiations between Greece and its creditors, weighed on US stocks.The shift out of cyclical sectors on Tuesday sent more than four in five issues within the S&P 500 lower.Shares of Micron Technology fell more than 3 per cent to $27.61, Genworth Financial slid 4 per cent to $7.15, Freeport-McMoRan slipped 4 per cent to $18.84 and Citigroup fell 3 per cent to $51.23.Interest rate-sensitive utilities proved the sole beneficiary of the day’s rout, rising 0.2 per cent.Water and electricity providers have fallen out of favour since two blockbuster jobs reports increased the possibility that the Federal Reserve could lift rates in the coming months.Entergy rose 1 per cent to $75.48 and Exelon advanced 0.1 per cent to $32.13.New issuance also exacerbated dynamics in the market, strategists said, increasing selling pressures as investors bought into block and follow-on offerings over the past week.“Clearly there is a message being sent about risk assets and that message is probably that we’re going into a period of time where you’ve got some big macro risks,” said Joseph Spinelli, head of single stock trading for the Americas at Deutsche Bank.“The biggest one around the US market probably is what the Fed has to say and whether or not they change their language.”Debate has centred on when the Fed will change the language and eliminate the word “patient’ from its statement — which many economists say could occur on March 18.That could be followed by a rate rise as early as June, some investment banks wager.The divergence between Fed policy and that of the European Central Bank and Bank of Japan has weakened the euro and yen against the US dollar, creating a headache for US multinationals.Companies within the blue-chip S&P 500 index earned about 46 per cent of revenues abroad and a majority have already warned that profits and revenues will be hit by the stronger dollar.Investors have instead turned to European equities, which have far outperformed their US counterparts this year.Mutual funds and ETFs invested in large-cap US stocks have recorded $35bn worth of withdrawals since the year’s start, according to fund tracker EPFR.“The US market is an easy target right now — it’s the worst performing of the major developed markets,” Mr Spinelli added.“With that as the backdrop, you have a situation where a fund flow dynamic exists. As we talk to institutional clients, they’re highly convicted that with quantitative easing, Europe and Japan are a much easier bet than the US is.”The S&P 500 slid 1.7 per cent to 2,044.16 while the Dow Jones Industrial Average declined 1.9 per cent to 17,662.94. The technology-heavy Nasdaq Composite fell 1.7 per cent to 4,859.79.eric.platt@ft.comTwitter: @ericgplatt
3;ETR;Entergy Corp;2015-02-16T11:26:05Z;US utilities turn down as summer rate rise expectations grow;Outlook for sector depends on timing and trajectory of interest rate changes;US policy lift-off is looming and the once high-flying utilities sector is feeling the pain.Investors have rotated out of US utilities, the top trade of 2014, as traders begin to re-price the possibility that the Federal Reserve will raise interest rates some time this summer, fuelled by a steadily improving economic picture and brisk labour market gains.The S&P 500 utilities index has quickly become the worst performing sector within the broader market, sliding 4.6 per cent since the year began and trailing behind the main index’s 1.6 per cent advance.A bumper payrolls report on February 6 acted as a catalyst for the sell-off, with shares in Entergy, Ameren, Exelon and AES each off more than 10 per cent for the year. Utilities had been among the best performing members of the S&P 500 before the report showed a rise of more than 1m jobs over the past three months. This bolstered expectations that the Fed could drop “patience” from its language at its March meeting before raising rates in June or July for the first time since the financial crisis.“Utilities are not going to be middle of the pack,” Julien Dumoulin-Smith, an analyst at UBS said. “In an interest rate sensitive environment like the one we’re in, I’m not surprised to see it leading the pack up or down.”The sector is particularly sensitive to interest rate movements and has benefited from a low rate environment. Investors have bought the stocks for their high dividend yields as Treasury yields hovered below 1.7 per cent.S&P 500 utilities have returned an average dividend yield of 3.6 per cent over the past decade compared with the 2 per cent yield the S&P 500 has offered, according to S&P Capital IQ. But the sector also carries more than twice as much debt as the wider market, with net debt to earnings before interest, tax, depreciation and amortisation of 3.75 times forecast 2015 results.“In this environment, it’s more of a macro call,” Anthony Crowdell, an analyst at Jefferies, said. “If you believe interest rates will increase then utilities will underperform the general market. If that does not happen and global risks rise, investors could get defensive and utilities should do well.”Investors had broadly ignored the Fed’s own statements that it remained on course to raise its benchmark interest rates until recently. John Williams, president of the Federal Reserve Bank of San Francisco, who is believed to have a similar policy view to chairwoman Janet Yellen, last week said the time for raising rates was getting “closer and closer”.Much of the move in utilities over the remainder of the year will depend on the trajectory of the rate rise. Several strategists forecast the Fed may only raise rates once or twice this year in small increments, falling short of the central bank’s own earlier published projections.“Typically during the first year of the Fed tightening sequence, the Fed funds rate rises 215 basis points,” Carmine Grigoli, chief investment strategist at Mizuho Securities, says. “Right now most economists are likely to tell you that we will see about a 100 basis point rise, as the economy will not grow to escape velocity and because of problems in Europe.”Valuations are another point of concern for strategists: utility shares climbed 24.3 per cent in 2014.“The sector is outright unattractive on a valuation basis and has been experiencing yield compression,” strategists with JPMorgan say.
4;ETR;Entergy Corp;2014-10-01T17:38:24Z;Utilities gain as eurozone fears damp tech;S&P 500 slumped as investors sold off positions in the technology and industrial sectors;US investors postured defensively on Wednesday following the weakest reading of eurozone manufacturing in more than a year.Activity was weighed down by a stagnation in German manufacturing in September as well as an unexpected dip in British manufacturing during the month, adding to concerns that a weakening Europe could weigh on S&P 500 earnings.Overall, the closely watched Markit eurozone manufacturing PMI index fell to a 14-month low of 50.3. Conversely, a report from the Institute for Supply Management showed a moderation in activity in the US, although it remained above the trailing 12-month average and indicated the 16th consecutive month of expansion.“The global readings on the manufacturing sector fall into three camps. Activity is humming in North America, stalled in Europe and most of Asia, and dreary with minor declines in most of the rest of the world,” Michael Montgomery, an economist with IHS Global Insight, said.Companies on the benchmark US index, which generate 46 per cent of sales abroad, according to data from S&P Dow Jones Indices, slumped as investors sold off positions in the technology and industrial sectors.Utilities, which are less exposed to currency movements and earn a far lower portion of revenues abroad, advanced.Since the year’s start, utilities have been among the best performing sectors on the S&P 500 – rising 11 per cent, trailing only the 14 per cent gain by the healthcare industry.Shares of Exelon advanced 1 per cent to $34.57, NRG Energy climbed 2 per cent to $31.19, Entergy rose 1 per cent to $78.04 and Southern Company increased 1 per cent to $44.09.Shares of pharmaceutical companies with potential treatments for the deadly Ebola virus rallied after the Centres for Disease and Control confirmed that the first case of Ebola had been diagnosed in the US on Tuesday.Shares of Canadian drugmaker Tekmira Pharmaceuticals surged 18 per cent to $24.99, while NewLink Genetics, which received Food and Drug Administration approval last month to proceed with clinical trials of its Ebola vaccine, advanced 7 per cent to $22.95.Lakeland Industries, the maker of protective suits to combat Ebola in west Africa, climbed 30 per cent to $9.01.Shares of fee-based consumer review site Angie’s List, surged 19 per cent to $7.59 after the FT reported that it hired bankers to review strategic options including a possible sale.Angie’s List executives are not tied to the sale, people familiar with the matter said. The stock remains 50 per cent lower this year to date.America’s biggest automaker, General Motors, rose after it unveiled plans to double profit margins to 9 to 10 per cent as measured by earnings before interest and tax adjusted for special items.The Detroit-based automaker also reported that September vehicle sales rose 19 per cent from a year ago. Shares of GM climbed 2 per cent to $32.49.Overall, the S&P 500 fell 1.3 per cent to 1,946.16 while the Dow Jones Industrial Average declined 1.4 per cent to 16,804.71. The technology-heavy Nasdaq Composite slipped 1.6 per cent to 4,422.08.eric.platt@ft.comTwitter: @ericgplatt
5;ETR;Entergy Corp;2014-08-14T20:42:41Z;Utilities climb amid appetite for haven assets;;Utilities led a languid trading day as markets digested stagnant European economic activity as a drop in yields on German and US treasuries made the sector comparatively more attractive.Investors shifted back into haven assets, particularly higher dividend-paying equities in the US, and out of higher growth sectors including the technology industry.The reversal into US utilities, including Pinnacle West, Entergy and Exelon, which all climbed more than 1 per cent, followed a difficult quarter for the sector.Since the start of July, utilities have lagged behind all others on the benchmark S&P 500, falling 5.2 per cent.Analysts with Credit Suisse noted that much of the weakness at the end of July related to “market concern over Fed activity and the threat of rising interest rates”.Sluggish activity across Europe, which economists with IHS Global Insight said faced significant growth constraints, and a Federal Reserve cautious of lifting rates amid a fragile recovery, has made utilities more appealing.“Fiscal policy is still generally restrictive, despite increased flexibility over countries’ fiscal targets, and tight credit conditions persist in several countries amid still significant banking sector problems,” said Raj Badiani, European economist with IHS.The Dow Jones Utilities Average advanced 0.8 per cent to 545.91 while the Russell 2000 technology index declined 0.2 per cent to 2,047.88.Shares of Pinnacle West rose 1.8 per cent to $54.35, Entergy climbed 1.5 per cent to $73.01 and Exelon advanced 1.2 per cent to $31.83.Cisco shares were under pressure after the company said it would lay off 6,000 employees, or 8 per cent of its workforce, beginning in its current fiscal quarter as it seeks to trim costs and better compete with rivals.The San Jose, California-based company said it would incur a pre-tax charge of $700m relating to the restructuring.Cisco, like venerable tech giants IBM and Hewlett-Packard, has found difficulty lifting revenues, particularly as emerging markets struggle to maintain economic growth rates seen over the past decade.John Chambers, the Cisco chief executive, highlighted the “economic and geopolitical challenges” in China, Brazil, Russia, Argentina, Turkey and Thailand for some of the weakness.Cisco declined 2.6 per cent to $24.54 while HP rose 0.8 per cent to $35.59.Berkshire Hathaway, the company controlled by billionaire Warren Buffett, soared to $200,000 for the first time on Thursday.The Omaha, Nebraska-based company’s class A shares advanced 1.6 per cent to $202,850 valuing Berkshire at more than $326bn.Kohl’s buoyed the wider department store sector after it said profits exceeded expectations as it trimmed costs and saw an uptick in July sales.The Wisconsin-based retailer said quarterly sales fell 1 per cent to $4.24bn.Profits were little changed at $232m, or $1.13 per share. Analysts on Wall Street had expected earnings of $1.07 a share.Kevin Mansell, chief executive, told analysts on a call that the company saw sales momentum at the start of July, reporting “a positive comp for the first time in several months”.The results followed figures from Macy’s on Wednesday, which fell short of analyst forecasts.Kohl’s shares rose 3.3 per cent to $56.91. Rival Dillard’s edged up 0.2 per cent to $115.60 while JC Penney climbed 4 per cent to $9.74, ahead of stronger results which lifted the stock another 5 per cent to $10.24 in after-market trading.Restaurant chain Noodles & Co tumbled 16 per cent to $21.16 after the company said second-quarter profits and sales missed analyst expectations as same-store sales declined.The company said overall sales advanced 11 per cent from a year earlier to $99.5m as it continued to open new restaurants, while profits climbed to $3.5m, or 11 cents per share.Overall, US equity markets advanced as new figures showed recent jobless claims hovering near pre-crisis levels.The S&P 500 advanced 0.4 per cent to 1,955.18 while the Dow Jones Industrial Average rose 0.4 per cent to 16,713.58. The technology-heavy Nasdaq Composite rose 0.4 per cent to 4,453.eric.platt@ft.comTwitter: @ericgplatt
6;ETR;Entergy Corp;2014-07-03T17:11:50Z;Utility stocks cool with temperatures;;Energy utility company stocks cooled along with US midwest and east coast weather forecasts, with natural gas prices trading near their three-month lows.The price of gas fell to $4.36 midweek from a spike to a high of $6.15 in February following the severe winter weather patterns. In the past three days, the price had fallen sharply from $4.60, said Travis Miller, a Morningstar analyst.The drop was the consequence of cooler than expected weather forecasts, and demand for power to run air conditioners and fans fell.“This is the biggest drop since February after the polar vortex,” Mr Miller said. “Utilities had a big run in gas prices after the polar vortex. It had a big spike and a big drop.”It was not unusual to see investors rotating their funds from utilities into more growth-oriented sectors, particularly in a rallying market, he noted.The fallers in the S&P 500 were led by Public Service Enterprise Group, the New Jersey-based utility company, down 3 per cent to $38.16.The Tampa-based TECO Energy fell 2 per cent to 17.71. New Orleans-based Entergy fell 2 per cent to $76.97, and North Carolina’s Duke Energy fell 1 per cent to $71.39. Chicago-based Exelon fell 2 per cent to $33.97.By contrast, the S&P 500 gainers were led by Petsmart, the US’s largest retailer of pet items, rising 13 per cent to $67.28 after hedge fund Jana Partners expressed interest in buying the company.Jana Partners on Thursday disclosed a 9.9 per cent stake in Petsmart and pushed management to examine options for the company.Jana, run by Barry Rosenstein, amassed its stake after a difficult first quarter for Petsmart in which sales missed expectations.Shares in the company have fallen roughly 12 per cent over the past year.A filing with the Securities and Exchange Commission made clear that, with its almost 10 per cent stake, Jana expected Petsmart to look at options including a sale, better operating performance and a return of capital to investors.Shares in tobacco groups Lorillard and Reynolds American jumped on merger speculation, after a CNBC report that the two were nearing a deal, following on rumours of talks earlier this year.Shares in Lorillard, maker of Newport and other brands, jumped 5 per cent to $64.41. Shares in Reynolds, maker of Camel, Pall Mall, Winston and others, rose 2 per cent to $61.56.Shares in truck manufacturer Paccar added 5 per cent to $67.25 after Volkswagen denied claims it was interested in making a bid for the company.Speculation of a potential bid for Paccar surfaced late on Wednesday after analysts at Sanford Bernstein said that the head of Daimler’s truck division had told investors that Volkswagen was eyeing a bid for the US truckmaker.Washington-based Paccar had been seen as offering the potential for VW to gain a foothold in the North American market where it lacks a presence.Volkswagen has been trying to integrate its truck operations more closely as it says that could help it achieve extra synergies of at least €650m annually within the next 10 to 15 years.That will help it boost its challenge to rivals Daimler and Volvo. VW’s truck assets comprise Scania, MAN and VW commercial vehicles.Christine Ritz, a VW spokeswoman, denied the reports to media outlets.The Dow Jones Industrial Average rose 0.5 per cent to breach the 17,000 level for the first time, reaching 17,068.26 by close, buoyed by a much stronger than expected employment report.The S&P 500 rose 0.6 per cent to 1,985.44 and the Nasdaq Composite gained 0.6 per cent to 4,485.92.
