;Ticker;Nombre_Completo;Date_Time;Titular;Subtitular;Texto
7;ETR;Entergy Corp;2014-05-28T15:42:50Z;Power industry braced for US carbon rules;;Next Monday, President Barack Obama is expected to launch the most significant environmental policy of his presidency: proposed rules to curb carbon dioxide emissions from existing power plants.Many of the critical details of the plan from the Environmental Protection Agency are still under wraps. It is already clear, though, that the new regulations are likely to have a significant impact on the consumers and producers of electricity.Gas-fired generation, renewables such as wind and solar power, and energy efficiency will be favoured, while the struggling US nuclear industry could be thrown a lifeline. Coal, which generates roughly twice as much carbon dioxide as a modern combined-cycle gas-fired power plant, will be the worst hit.The rules for new plants proposed by the EPA in 2012 have the effect of preventing the construction of any new coal-fired plants that do not have some capacity to capture and store their CO2 emissions.The rules for existing plants would be much less restrictive. Gina McCarthy, the EPA’s administrator, has promised a “flexible” approach, which would allow states freedom to decide for themselves how to reduce emissions, although it is expected to set at a national level the targets they would have to hit.Its proposals are sure to be thoroughly tested in the courts. “You can expect this to be a wildly litigated document at every level,” says Julien Dumoulin-Smith, an analyst at UBS.Some companies, though, will be more troubled by the rules than others. Research published on Wednesday by Ceres, a group that works with investors to campaign on social and environmental issues, shows how widely their emissions vary.Among the largest generators, companies with a high rate of emissions relative to their total power output include Ohio-based American Electric Power and Missouri-based Ameren. Other high emitters include Energy Future Holdings, the Texas utility group that sought bankruptcy protection last month, and MidAmerican Energy, owned by Warren Buffett’s Berkshire Hathaway. At the other end of the spectrum is Exelon, which relies heavily on nuclear power.One consequence of the Environmental Protection Agency’s new carbon dioxide rules may be a wider role for the fledgling US emissions trading schemes such as the Regional Greenhouse Gas Initiative, which covers nine states in the northeast of the country.It has not yet been formally confirmed, but it seems very likely that participation in the RGGI or a similar scheme would be accepted by the EPA as a way to comply with its regulations . . .Continue readingThe differences are striking: AEP emitted more than eight times as much carbon dioxide as Exelon for every megawatt hour of electricity that it generated, according to the most recent data, for 2012.The prospect of carbon regulation puts low-emitting companies at an advantage, particularly in the 17 US states that have more or less competitive electricity markets, rather than tightly regulated utilities.Calpine, one of the relatively low emitters which specialises in competitive markets, is urging the EPA to push for significant cuts. “The EPA should propose something that has meaningful reductions,” says Derek Furstenwerth, Calpine’s senior director of environmental services. “It’s not worth all the effort that we’ll be going to if they only have token reductions.”Conversely Southern Company, which created emissions at a rate about 40 per cent higher than Calpine, is suggesting the EPA should hold back.The new rules “should not infringe upon states’ authority to develop performance standards and flexibility to choose compliance mechanisms”, it says. It is arguing for the standards to be based on what measures to reduce emissions are practicable not at a state level but at each individual plant, which would allow for much smaller cuts.Creating fewer emissions has not so far been an infallible route to superior investment performance. Exelon’s shares have dropped 25 per cent in the past five years, while AEP’s have more than doubled.If they are allowing the industry to retire nuclear plants prematurely, it would significantly impede their ability to hit their national carbon targetsHowever, some investors are starting to use greenhouse gas emissions as a factor when making decisions about where to put their money. Calvert Investments, a Maryland-based fund manager, in March launched an investment strategy based on comparisons of companies’ performance in areas including greenhouse gas emissions and resource use.Stu Dalheim, vice-president of Shareholder Advocacy at Calvert, says investors are becoming increasingly concerned about climate change, and the Obama administration’s plans show how companies are operating in a “carbon-constrained world”.One way in which that may manifest itself is in better prospects for US nuclear generators. Exelon and Entergy have been under pressure because the economics of their reactors are threatened by cheap gas. But UBS analyst Mr Dumoulin-Smith argues that carbon limits will make it much less likely that regulators will allow otherwise viable plants to shut purely for economic reasons.“If they are allowing the industry to retire nuclear plants prematurely, it would significantly impede their ability to hit their national carbon targets,” he says.The technical details in the regulations would make a significant difference to their effects. For example, Entergy emits at about half the rate of Southern Company, but over 2006-12 Entergy’s emissions were roughly unchanged, while Southern’s fell 27 per cent. So how much credit should Southern gain for that improvement?It is a reason for every US electricity company to be nervous as they look ahead to next week.Chuck Barlow, vice-president of environmental strategy and policy at Entergy, says the company’s “very manageable” carbon risk is a source of competitive strength. But he is also concerned that the EPA should not be too ambitious with the emissions cuts it demands.“We believe we’ve put ourselves in a good position to comply with a carbon rule,” he says. “But they do need to make sure it is flexible enough for us to cope with the regulations.”
8;ETR;Entergy Corp;2014-02-19T18:23:20Z;Uneconomic US nuclear plants at risk of being shut down;;"More US nuclear power plants are at risk of closure because they are no longer economic, industry leaders have warned, jeopardising the administration’s hopes that the reactors can help support energy security and limit greenhouse gas emissions.Exelon and Entergy are among the US power generators facing pressures to close some of their nuclear plants, as a result of lower electricity prices, competition from cheap gas, and sometimes political opposition.For a list of the US nuclear power plants being shut down and those at riskSee belowOn Wednesday Ernest Moniz, energy secretary, said the government would offer $6.5bn in loan guarantees to support the construction by a consortium led by Southern Company of two new reactors at Vogtle in Georgia, scheduled to start up in 2017-18.Over the next five years, however, it is possible that more nuclear capacity will be shut down in the US than started up. The country has a patchwork of regulatory systems, with competitive retail electricity markets in 20 states, and it is in those states that nuclear power is under pressure.Where nuclear plants have to go head-to-head with gas-fired plants, and with wind and solar power that are supported by regulatory mandates, they are finding it hard to compete.“Competitive markets can be efficient, but right now they aren’t,” says Marvin Fertel, president of the Nuclear Energy Institute, the industry group.“We’ve seen a real problem that needs to be fixed.”It has been clear for years that the shale gas boom made it hard for costly new reactors to compete. Over the past year, though, it has become clear that even some existing plants are no longer commercially viable.About 3.6 gigawatts of nuclear generation capacity were retired last year, compared with 4.5GW of coal-fired capacity, according to the US government’s Energy Information Administration.While existing US nuclear plants may face an increasingly uncertain future, the new reactors being built by a consortium led by Southern Company in Georgia are at least making reasonably good progress, so far.Continue readingOf the four nuclear plants where closures were announced in the past 18 months, two – Duke Energy’s Crystal River in Florida and Edison International’s San Onofre in California – were already shut down and required multibillion-dollar repairs that made the economics of restarting them particularly challenging.The two decisions that really rattled the industry were the closures of Dominion Resources’ Kewaunee plant in Wisconsin and Entergy’s Vermont Yankee in Vermont. Both were running fine and licensed to keep going into the 2030s, but became uneconomic to keep in operation.Now executives and analysts are warning that several other reactors are threatened by a similar fate.Chris Crane, chief executive of Chicago-based Exelon, one of the largest nuclear generators in the US, warned earlier this month that some of the company’s reactors were losing money “due to the low prices and the bad energy policy that we’re living with”.Speaking on a call with analysts to discuss the company’s fourth-quarter results, he said: “If we do not see a path to sustainable profits, we will be obligated to shut units down to avoid the long-term losses.”New Orleans-based Entergy has not issued such direct warnings. Leo Denault, chief executive, told analysts on its call this month that the company had been “exploring opportunities” for its nuclear plants, but “we didn’t find anything that we liked. And we like owning them better”.However, analysts at Morningstar, the research company, have identified two of Entergy’s plants, Pilgrim in Massachusetts and James A. Fitzpatrick in New York, as among those at greatest risk of closure. Its Indian Point plant near New York City is also under heavy political pressure.Morningstar argued in a note last November that Entergy’s plants generally had a “a long-term competitive advantage”.However, Julien Dumoulin-Smith of UBS wrote in a note last week that its reactors selling in competitive markets were “fundamentally challenged and driving downside to [the] shares”.Figures published this month by the NEI show that across the 61 nuclear plants in the US – 35 of them with more than one reactor – operating and capital costs averaged about $44 per megawatt hour generated in 2012.Cheap US coal has made gas-fired electricity uneconomic and accelerated a capacity shortfall in the UKContinue readingThat compares reasonably well with a new gas plant that will cost about $47 per MWh to run, according to the EIA, but there is a wide variation in nuclear plants’ costs. The best-performing quarter of the fleet cost only about $28 per MWh in 2010-12, while the worst cost more than $62 per MWh.Security and safety measures following the 9/11 attacks and the 2011 Fukushima disaster in Japan, and a generally tougher line from regulators, have been putting upward pressure on costs.Nuclear plants’ prospects also depend on which market they serve. In the Miso grid region of the midwest, where wholesale power prices averaged about $35 per MWh in the first half of last year, even the lower-cost reactors are under pressure.In regulated markets, where generators are allowed a guaranteed return, nuclear’s prospects are much better. Duke, for example, operates all of its reactors in regulated markets, and Lynn Good, its chief executive has said she is confident they can continue as part of the company’s fleet for decades to come.Re-regulating competitive markets to support nuclear plants would be a controversial move, but may be the only way to prevent the US industry shrinking further.Nuclear power: on the way outPlants that are planned to be shut downSan Onofre in California, pictured, operated by Edison International
Crystal River in Florida, operated by Duke Energy
Vermont Yankee in Vermont, operated by Entergy
Kewaunee in Wisconsin, operated by Dominion ResourcesOther plants seen as potentially at riskPilgrim in Massachusetts, operated by Entergy
Indian Point in New York, pictured, operated by Entergy
Clinton in Illinois, operated by Exelon
Quad Cities in Illinois, operated by Exelon"
9;ETR;Entergy Corp;2020-04-16T04:01:47Z;Brokers must prepare for unparalleled conditions;Top advisers face grim task of navigating crisis for clients;"The coronavirus pandemic is first and foremost a human tragedy whose scale is yet to be fully comprehended.The resulting economic shock of recent weeks has also created unprecedented disruptions which have left many people confronted with pressing questions about job security, threats to household income, tax liabilities, and the survival of their businesses. Financial advisers now face the task of dealing with many clients who, beyond all this, will probably have suffered sharp falls in the value of their assets.Louise Gunderson, an FT 400 adviser with UBS Financial Services in New York, has vivid memories of the last financial crisis. When the US stock market began dropping in February, the first thing she did was check that her clients had enough cash. “After 2008, I make sure people have at least a year of cash flow available,” Ms Gunderson says.Like many other advisers, Ms Gunderson and her team of seven have spent most of their time in recent weeks reassuring investors about their long-term plans and talking through clients’ personal worries.Against the distressing backdrop of crisis, the eighth annual edition of the Financial Times 400 Top Financial Advisers provides a snapshot of the best professionals at traditional US broker-dealers.The scale of assets under management is important in selecting the FT 400, as is a positive record in growing this figure, which is a measure of client retention and investment performance. But the list also recognises that advisers’ jobs extend to acting as consultants, life coaches and even amateur psychologists.More advisers have advanced industry designations such as those for financial planners, retirement specialists or financial analysts. Some 72 per cent of the FT 400 advisers have at least one such credential, up from 69 per cent last year.Managing client relationships will be more important than ever this year, in the wake of a crisis many commentators say is without modern precedent. Advisers had already been emphasising services besides investing such as longer-term financial planning and tax management.In recent years, a growing number of advisers have also given up assembling their own mix of investments for clients in favour of selecting from an array of model portfolios. These are computer-aided blends of stocks, bonds and funds that are actively managed to the investor’s risk tolerance and financial goals. Some 20 per cent of advisers say they have increased their use of model portfolios over the past year, while only 10 per cent have decreased such use.Managing client relationships will be more important than ever in the wake of this crisisSelecting investments is not financial advisers’ biggest worry, according to our survey conducted in November and December of 2019. Instead, the top challenge cited by 70 per cent of FT 400 advisers is managing their day-to-day operational requirements. That is a change from the prior year when the FT 400 picked meeting client demands as their biggest burden.Operational challenges are only intensifying in response to coronavirus, as nearly all meetings with clients have shifted to phone calls or video-chat services such as Zoom and Skype. Advisers may long for an eventual return to consultations in person, but some say they might continue to use video or screen-sharing technology more often when things return to normal.Any return to normal cannot be predicted. Brokers who offer investment advice are also planning for the new Securities and Exchange Commission “Regulation Best Interest,” that could be the biggest rule change to their business in many years. The new regulation will limit brokers to recommendations that serve their clients’ best interests, and includes new standards for disclosing brokers’ potential conflicts of interest. The rule is scheduled to take effect on June 30. The SEC has indicated it intends to stick to this deadline despite the pandemic and its consequences.As usual, the larger states with higher concentrations of wealth have more FT 400 advisers. New York has the largest number of advisers on the list with 77, followed by California with 67. Florida is in third place with 21, followed by Illinois with 20.Many first-rate advisers missed the list. Competition is tight, so the gap between those who made and missed the cut can be narrow. The advisers in this year’s listing benefited from strong financial markets last year; the average adviser managed $2bn in assets as of June 30, up from the $1.8bn average in the previous year’s list. This year’s markets in June are highly unlikely to provide such a boost.How is coronavirus taking its toll on markets, business, and our everyday lives and workplaces? Stay briefed with our coronavirus newsletter.Sign up hereListed advisers come from 23 broker-dealers, and the best-represented companies are Merrill Lynch (with 18 per cent of advisers) and Morgan Stanley (16 per cent). Wall Street’s dominance is not guaranteed to last for ever, though. Such national brokerages with the broadest array of services, known as the wirehouses, have focused on retaining successful brokers over the recruitment of a high volume of additional advisers.And many successful brokers have been leaving wirehouses to run their own businesses. The four wirehouses, which also include UBS and Wells Fargo, have the smallest concentration of advisers on the list in its eight-year history: 48 per cent of the FT 400, down from 53 per cent the previous year.It is still unclear how the pandemic and its attendant disruptions will affect the long-term changes under way in the financial advice industry. Fortunately for their clients, the top advisers are used to turbulence."
10;ETR;Entergy Corp;2020-04-25T18:31:28+0000;Letter from Lex: the $130bn question;Vodafone and Verizon discuss a $130bn deal as the west teeters on the brink of yet another war in the Middle East;As the west teetered on the brink of yet another war in the Middle East, this time threatening air strikes on Syria, the oil price predictably crept higher. Any military action, however, may only have a small effect on the price with Libya’s declining production more of a long-term worry. This comes at a time when nuclear plants are being shut across the US, the latest an Entergy-owned one in Vermont, in what could prove to be a short-sighted move if clean energy remains a worthy goal. Prices for another basic material, potash, are falling fast with the arrest of Uralkali’s chief executive in Belarus dashing any hopes of the previous cartel being re-established.Those not distracted by events in Syria had plenty of dealmaking to keep them busy. Vodafone confirmed it was in talks with Verizon about selling its 45 per cent stake in Verizon Wireless, but the US telecoms company may have to find $130bn to seal the deal. In the US, Amgen agreed the cash purchase of biotech company Onyx for $9.7bn as it searches for growth. Also in America, stock exchange operators BATS and Direct Edge combined forces in an attempt to give Nasdaq and NYSE a run for their money.But any hopes Ryanair had of acquiring rival Irish airline Aer Lingus were dashed after the UK Competition Commission ordered the former to sell down its stake in the latter. In Asia, conglomerate Fraser and Neave was busy breaking itself up after 130 years in existence by spinning off its property portfolio. If activist investor Dan Loeb is hoping to shake up the cosy auction house duopoly after raising his stake in Sotheby’s, he has his work cut out.Finally in financial services, JPMorgan had yet another fine hanging over it – this time for mortgage bonds sold to Fannie Mae and Freddie Mac that allegedly included faulty loans – but the US bank can easily afford what could be a $6bn bill. Its reputation is another matter. In Switzerland, the chairman of Zurich Insurance, Josef Ackermann, stepped down after the apparent suicide of the company’s CFO, leaving investors wondering exactly what was happening behind the scenes.John Casey, Lex Publisher
11;ETR;Entergy Corp;2013-08-27T18:35:40Z;Vermont reactor is new victim of shale boom;;"The financial pressures on the US nuclear industry caused by the shale gas boom claimed another plant on Tuesday, as Entergy Corporation announced the closure of its Vermont Yankee reactor in the northeast of the country ahead of schedule.Leo Denault, chairman and chief executive of Entergy, a Louisiana-based utility, described the closure as “an agonising decision” but said energy market conditions, including low gas and electricity prices resulting from the shale boom, meant it was the right move to take.The plant was expected to break even in 2013 and would have fallen into loss in subsequent years, the company said.It is the fourth closure of a US nuclear plant to be announced this year, as utilities decide that investing in older reactors is no longer commercially viable.The Nuclear Energy Institute, the industry group, said the decision was “jarring evidence that market reform is essential to ensure [the US] maintains a diversified portfolio of electricity options”.Vermont Yankee is one of the older US nuclear plants, having come into operation in 1972, but it had a licence from the Nuclear Regulatory Commission to remain in service until 2032.However, Entergy said that its economics had been hit by “a transformational shift in supply”, driving down the price of natural gas, which generally sets the price of electricity.It added that Vermont Yankee was a small standalone plant, with a capacity of 650 megawatts, which meant that it had relatively higher costs and a greater burden for regulatory compliance than larger plants.Entergy’s announcement follows Duke Energy’s retirement of the Crystal River plant in Florida, Dominion’s closure of the Kewaunee plant in Wisconsin, and Edison International’s retirement of both units at the San Onofre plant in California.Those plants have also faced challenging market conditions, and in the case of Crystal River and San Onofre would have required costly repairs.The Vermont Yankee decision means that retirements of about 4,200MW of nuclear generation have been announced this year; about 4 per cent of US nuclear capacity.Mr Denault said Entergy remained committed to nuclear power. “Nuclear energy is safe, reliable, carbon-free and contributes to supply diversity and energy security as part of a balanced energy portfolio,” he said.Entergy bought six nuclear plants in 1999-2007, shortly before the shale gas boom really got under way, and once Vermont Yankee is closed will continue to operate 11 other reactors on nine sites.Entergy will take a $181m charge after tax in the third quarter for the closure, which is expected to be completed by the end of next year, and a further $55m-$60m for the costs of severance or retention for the plant’s 630 employees.However, the fact that the Vermont Yankee was expected to sink “gradually” into loss means the move will boost earnings, excluding the one-off closure costs, within two years, and add $150m-$200m to cash flow by 2017.In its statement announcing the closure, the company criticised what it called “flaws” in the design of the New England power market, saying it resulted in “artificially low energy and capacity prices” and did not provide “adequate compensation to merchant nuclear plants for the fuel diversity benefits they provide”.Marvin Fertel, president of the Nuclear Energy Institute, said failure to reform power markets to support nuclear power would “jeopardise reliable electricity supplies and leave consumers vulnerable to steep or long-term electricity price swings”.Vermont Yankee’s capacity represents about 2 per cent of the 32,000MW available on the New England independent system operator’s grid, which covers an area from Connecticut to Maine in six states, including Vermont.Electricity demand in the region has stagnated in recent years. The record high for demand was in 2006, at about 28,130MW, and the peak day so far this year has been about 3 per cent lower, at 27,4360MW."
