;Ticker;Nombre_Completo;Date_Time;Titular;Subtitular;Texto
12;ETR;Entergy Corp;2013-02-04T06:31:06Z;Powerless Super Bowl disrupts advertisers;Brands turn to Twitter as outage halts play for half an hour;The Baltimore Ravens held off a resurgent San Francisco 49ers and survived a power outage to win American football’s most lucrative game, the 2013 Super Bowl.Advertisers paid up to $4m to appear in 30-second spots between plays but many of them had an eye to the digital world too, with about half of the ads using Twitter’s “hashtags” to stimulate online discussion after their broadcast.After a flurry of news about how she sang to a backup track during the US presidential inauguration, Beyonce showed up with an all-singing, all-dancing half-time show that also reunited her former group, Destiny’s Child, and was sponsored by Pepsi.CBS, which broadcast the game, remained on the air despite the half-hour power failure in the third quarter, which plunged the New Orleans Mercedes-Benz Superdome into darkness.The broadcaster did not cash in by running extra ads during the interruption, telling Advertising Age that its commitments to advertisers were “being honoured” despite what the industry magazine called “one of the oddest moments in Super Bowl history”.However, the blackout interrupted the plans of some marketers, including Coca-Cola’s two-part desert race ads, and altered the momentum of the game.The Ravens had been leading 28-6 until that point with a strong showing that included a touchdown run the full length of the field. Amid jokes on social media networks that Silicon Valley hackers had intervened on behalf of their home team, the 49ers staged a comeback once power was restored, but were unable to close the gap from the first half.Ravens coach John Harbaugh eventually held his team’s lead to win over his younger brother Jim, who coached the 49ers.A spokesman for the Superdome later apologised for the blackout while the sport’s organising body, the NFL, said it was investigating the cause. In a statement, energy provider Entergy said: “At all times, Entergy’s distribution and transmission feeders were serving the Mercedes-Benz Superdome.”Some fleet-footed brands, including Mercedes rival Audi and Oreo cookies, used Twitter to capitalise on the blackout, with witty takes on the interruption. “Sending some LEDs to the @MBUSA Superdome right now,” tweeted Audi.Oreo and Audi both had TV ads running during the game too, as more brands try to integrate their media campaigns.The TV ad line-up included ambitious spots from Budweiser, including the debut of its new Black Crown beer that tried to appeal to a more sophisticated audience, and Taco Bell, whose depiction of elderly residents escaping from a retirement home to have a wild night out has been building since December.As ever, some ads caused controversy, including web host GoDaddy’s “The Kiss”, accused of sexism as a swimwear model smooched a red-faced nerd, and Volkswagen’s “Get Happy” ad, criticised by some in social media of cultural insensitivity by having a white man parodying a broad Jamaican accent.
13;ETR;Entergy Corp;2012-10-15T17:26:12Z;NY plant at heart of nuclear power battle;;Forty miles north of New York City, the Indian Point nuclear power plant has become the latest battleground in the debate over nuclear safety in the US.Critics including Andrew Cuomo, New York governor, say the site is old, unsafe and a ripe target for terrorists. Defenders warn that shuttering the plant would cost the state billions, raise the city’s already high energy prices and lead to sweeping job losses.Safety concerns are being showcased at a hearing on Monday as the US Nuclear Regulatory Commission considers whether to renew the plant’s licences for another two decades. The original 40-year licences are set to expire in 2013 and 2015.Opponents say the risks of continuing to operate the ageing plant are too great and shutting it down will not disrupt New York’s energy grid. The 2,000-megawatt plant supplies more than a quarter of the city’s electricity.“It simply makes no sense to keep operating 40-year old reactors that are vulnerable to fire, earthquake, outside attack and a host of other potential disasters,” said Robert F. Kennedy, Jr, chief prosecuting attorney for Riverkeeper, an environmental group that is challenging the re-licensing. “Even if you closed it today there would be no [energy] shortage until 2020 and there’s so much new power in the pipeline that it would be replaced.”Industry advocates disagree. “Indian Point is very valuable in terms of ensuring a stable voltage level across the transmission grid and ensuring a reliable flow of electricity,” said Jim Steets, a spokesman for Entergy, which owns the plant. He said security and back-up measures have been improved at the site since the meltdown at Japan’s Fukushima Daiichi nuclear facility last year prompted a reassessment of seismic risk at the 104 US plants.The Japanese crisis raised particular fears over Indian Point, which sits near two active faults.“This plant could never be built by today’s safety standards,” Mr Kennedy said.But Mr Steets said: “We have seismic protections that protect the plant from an earthquake twice the magnitude of the strongest ever recorded [there].”New York state is among the parties opposing new licences, citing concerns over the cost of exposure to radioactivity in case of an accident and possible corrosion or leaks in piping that could contaminate the nearby Hudson River.Mr Cuomo has advocated closing Indian Point since before his election as governor in 2010. During the 2011 post-Fukushima safety review, he said a proposed 50-mile radius evacuation – which would include more than 20m people in New York City and much of its suburbs – is not “a feasible concept”.The hearing has also fuelled debate over the economic impact of closing Indian Point.Last month, a study from the Manhattan Institute, a fiscally conservative think-tank, concluded closing the site would raise prices for consumers who already pay well above the national average.Switching to alternative sources would raise the average New Yorker’s energy bill by $76 to $112 a year, the report said, as well as adding to costs for the city’s public transit agency.All told, closing the plant would increase average electricity costs statewide by up to $2.2bn, reduce overall economic output by up to $2.7bn and eliminate 26,000 to 40,000 jobs a year, the study found.Mr Steets warned of higher energy prices “in a state that already has high electricity costs and which any business will tell you could be a determining factor in locating there”.Environmentalists responded with their own study last week that said the power produced at Indian Point could be replaced by improved energy efficiency and renewable resources at a limited cost to consumers.The report, commissioned by Riverkeeper and the Natural Resources Defense Council, found New York has enough capacity to withstand the loss of output from Indian Point until 2020, at which point proposed investments to boost efficiency and increase solar and wind production would make up for it. That would add about 1 per cent a year to electricity bills, or $12 a year for the average residential customer, the study said.
14;ETR;Entergy Corp;2011-12-05T19:15:19Z;ITC to buy Entergy’s south-east US grid;;ITC, the Michigan-based electricity grid company, is to become the largest US high-voltage transmission operator, with an enterprise value of about $11bn, by acquiring the networks in the south-east of the country owned by Entergy, the integrated power group.The deal means Entergy can strengthen its financial position by cutting its debt and offloading a cash-hungry network business that will require heavy investment over the next few years.It also enables the two companies to benefit from a favourable shift of regulatory regime, by moving from the state regulation imposed on Entergy to the federal regulation that governs ITC.In a complex transaction known as a “reverse Morris Trust”, which is a tax-effective way to make a disposal, Entergy is spinning off its transmission business in Texas, Mississippi, Arkansas and Louisiana, and then merging it with ITC.At ITC’s share price on Friday night, the deal puts an enterprise value of about $4.86bn on the business being sold, based on ITC issuing 52m new shares, which will go to Entergy shareholders, and taking on about $1.78bn in debt. Entergy shareholders will end up with just over half the equity of the enlarged ITC.Power transmission grids in the US need heavy investment to replace ageing equipment and meet new regulatory requirements such as connecting wind farms and solar power plants.Entergy expects the network business it is selling will have to invest up to $525m a year until 2014 to meet those requirements. Under state regulation, its ability to make a return on that investment would be uncertain.As a pure transmission business, ITC is regulated by the Federal Energy Regulatory Commission, which takes a more favourable position on allowing returns on investments made to meet policy objectives.Wayne Leonard, Entergy’s chief executive, said: “Transmission really needs to be independent. It is far less complicated and more value-creating when you don’t have a stake in any business at either end of the line.”Entergy warned last month that it expected earnings to drop next year because of a drop in power prices, the absence of favourable tax effects and an expected reversion of the weather to more normal temperatures.The transmission disposal will strengthen its cash position and help sustain its investment-grade credit rating.Shares in both companies rose sharply on the news: at 1pm in New York, Entergy was up 4 per cent at $72.57, and ITC up 3 per cent at $76.25.However, the deal still has to win approval from state and federal regulators.Joseph Welch, ITC’s chief executive, said the deal served to validate the benefits of the independent transmission model.He added: “This is an attractive and natural strategic fit for ITC that provides benefits for stakeholders, including customers, employees, local communities and shareholders. Customers in Entergy’s service territory will benefit from the commitment that ITC makes to the regions and communities we serve.”ITC was advised by JPMorgan and Barclays Capital. Entergy was advised by Goldman Sachs.
15;ETR;Entergy Corp;2011-09-30T16:52:52Z;Scouring the data for quality indications;How I go about picking “quality” stocks;What constitutes a quality stock? In last week’s column, I began trying to define the criteria for picking shares in mega-cap companies with strong business franchises. As you’d expect, there are a great many definitions of “quality”, some involving attributes that might equally be ascribed to a “defensive” company, others to companies with valuable “strategic assets”, such as large oil and gas reserves. “Value” investors, meanwhile, might see quality more in terms of companies paying a sustainable dividend yield.As last week’s headline – Quality in the eye of the beholder – surmised, any definition is intensely personal. It is easy to pick a list of companies with a loosely defined “great business franchise”: such a list would probably contain Microsoft, Google, ExxonMobil, BG Group, AstraZeneca and Vodafone. However, I prefer to start with a quantitative screening of the market, and then add a series of personal overlays. These overlays are essentially tests of whether a company can defend its business franchise in an era of low-growth rates and intense price competition.To do this, I use a piece of software called Sharescope, which allows you to sift fundamental data on both UK and US stocks – but you can run a similar exercise using web-based services such as the FT’s stock screener at www.markets.ft.com/screener/customScreen.aspA quick update on Golden Prospect, the precious metals fund I mentioned a few weeks back. As part of its fundraising, it is offering new subscription shares. These are priced at 150p and can be converted into ordinary shares every quarter from May 2012 to May 2014.A few institutions are wary of subscription shares, thinking they could dilute profits for existing investors. But they could be especially appealing to outside investors looking for a medium-term hedge. In effect, you’re buying an option on gold – if spot prices shoot up past $2,500 I’d expect profit margins at the gold miners to soar, producing an uplift in their share prices.These subscription shares will be geared to this increase – so, in effect, you could look on them as a bet on really bad things happening in the global economy. Of course, if gold prices fall back, the subscription shares could expire worthless, but that’s the nature of insurance.My quantitative screen is relatively simple. I’m trying to find a large-cap stock in the UK and the US, with a decent dividend, controllable debts, a substantial profit margin, and lots of cash inflows. So these are the fundamentals measures that I screen for – and note that I deliberately exclude any banks or financial institutions.● Market capitalisation > £2bn● Dividend cover > 1.5● Historical dividend yield > 4 per cent● Net gearing < 150 per cent● Operating margin > 5 per cent (unless it is a utility company)● Cash flow per share: positive (unless it is a utility company)Where more than two companies from the same sector are identified, I will only take the two with the best figures for yields, dividend cover and net gearing.This “screen” will probably throw up a couple of dozen “big-name” candidates, which I will then whittle down to a shorter list by carrying out a qualitative investigation of the business franchise. By this I mean finding out whether a company has a clearly discernible “moat” of competitive advantage, which should deter low-margin competitors. To do this, the simplest approach is to look at past profit margins to check the trend, then search press commentary on the company, and then list the strengths and weaknesses of its main competitors.In this process, I tend to favour companies with substantial strategic assets, such as oil reserves – that’s why I’m currently a bull on the large integrated oil majors. I also believe that utilities have an innate attraction for long-term investors, as their businesses are heavily regulated and built around the notion of returning cash to shareholders through dividends.When I recently carried out this combined quantitative/qualitative screening process, I ended up with the following 14 stocks (although I’d be tempted to have only one North American telecoms utility – either BCE or AT&T – and I’m not entirely convinced about Microchip Technology’s inherent competitive advantage).My shortlist contains lots of companies that I don’t think you’d find surprising.BAE Systems is having a rough time at the moment due to declining orders, but it still possesses some fantastic technology and products. Drug companies are usually popular among fund managers right now, and both AstraZeneca and US group Eli Lilly make it on to my list. Tobacco stocks have long been popular with income fund managers such as Neil Woodford at Invesco Perpetual, and Vodafone offers strong yields and international diversification. All of these companies are in some way protected by that “moat” of competitive advantage. Then, meeting my strategic assets criterion, there are oil majors in the shape of Royal Dutch Shell and American outfit Marathon Oil. Completing the list are a smattering of utility companies including SSE (in which I already hold shares), US outfit Entergy, and Centrica (probably the favourite utility of the institutional investor).My list of “quality stocks” is BAE Systems, Marathon Oil Corp, Royal Dutch Shell, AstraZeneca, Eli Lilly & Co, British American Tobacco, Imperial Tobacco Group, Scottish and Southern Energy, Entergy Corp, Centrica, Microchip Technology, AT&T, BCE, Vodafone Group.adventurous@ft.com
16;ETR;Entergy Corp;2011-06-27T20:54:37Z;Financials lead US markets higher;;Wall Street kicked off the week in positive territory despite some lacklustre consumer spending data as the big indices bounced off key technical support levels after nearly two straight months of losses.The financial sector, which has been one of the worst performing in recent months, falling 13 per cent from its last cyclical high in February, saw some of the strongest gains in the session.Janus Capital was up 3.3 per cent to $9.08 while Bank of America rose 3.1 per cent to $10.85. The S&P financial index added 1.1 per cent while the KBW banking index climbed 1.4 per cent.The sector was helped by news that banking capital requirements agreed over the weekend were less punitive than some had feared.These gains helped the S&P 500 up 0.9 per cent to 1,280.09, with the index finding support just 4 points away from the 200-day average of 1,264 – a line many analysts consider to be a crucial technical level.“The markets had become technically very oversold after the recent run of losses, and traders are using the 200-day average as an excuse to get back in,” said Randy Warren, chief investment officer at Warren Financial Service.The rebound on Wall Street was broad based, with all 10 big S&P indices gaining ground.But technology stocks saw the strongest gains, rebounding from the 1.8 per cent losses in the previous session.The S&P technology index, which had suffered a 10.7 per cent correction since its last cyclical high in February, was up 1.4 per cent.Microsoft was one of the best performing stocks in the sector, rising 3.7 per cent to $25.20 in the biggest one-day move upwards in more than nine months. On Tuesday, the technology group is launching a new cloud version of Microsoft Office.Elsewhere, Amazon was up 4.5 per cent to $201.25 while Adobe Systems added 3.1 per cent to $30.89.The material sector was the worst performing in the session as commodity prices softened. Allegheny Technologies fell 1.5 per cent to $59.11 and the S&P material index was up 0.2 per cent.Sentiment in the session was not helped by weak data on consumer spending, but these technical factors meant the news was largely shrugged off by the markets. Still, data from the commerce department showed that consumer spending had remained largely unchanged in May, which was the first time in nearly a year that spending had not gone up. The figure was also below the 0.1 per cent rise that had been expected by economists.The data are just one in a long line of weak economic numbers released in the past few months which have left the S&P 500 6.1 per cent lower since the start of May.“With the economic indicators weakening and the concerns about the European periphery rising, markets are once again questioning the strength of the economic recovery,” said analysts at Goldman Sachs.Even so, the Dow Jones Industrial Average was up 0.9 per cent to 12,043.56 in the session, reclaiming its 150-day moving average lost last week.The Nasdaq Composite was up 1.3 per cent to 2,688.28, bouncing off its own 200-day moving average level hit on Friday.The Nasdaq and the Dow indices are on their way towards 5.2 per cent and 4.2 per cent losses this month, respectively. The S&P 500 is looking at a 4.8 per cent fall in the worst month on the index since June 2010.In corporate news, ReneSola lost ground after announcing that its chief financial officer was resigning. The Chinese solar panel wafer maker was down 3.2 per cent to $4.88 after disclosing the news late on Friday.The stock has lost 53.7 per cent since the start of April.The Bank of New York Mellon China ADR index is down 8.5 per cent since its last cyclical high in the middle of April.Sino-Forest, a Chinese forestry company, has lost 88 per cent to $2.29 since the start of the month, and Renren, the Chinese social networking site, has fallen 53.7 per cent to $7 since its initial public offering in May.Other solar companies have also suffered in the past few months. First Solaris down 16.4 per cent to $116.68 since the start of May. But LDK Solar jumped 4.9 per cent to $7.14 in the session after the Chinese solar company said it planned to buy back up to $100m of its American Depository Shares.Wall Street kicked off the week in positive territory despite some lacklustre consumer spending data as the major indices bounced off key technical support levels after nearly two straight months of losses.The financial sector, which has been one of the worst performing in recent months falling 13 per cent from its last cyclical high in February, saw the strongest gains in the session.Janus Capital was up 2.3 per cent to $8.99 while Bank of America rose 2.3 per cent to $10.76. The S&P financial index added 0.9 per cent while the KBW banking index climbed 1.3 per cent.These gains helped the S&P 500 up 0.6 per cent to 1,275.69, with the index finding support just 4 points away from the 200-day average of 1,264 – a line many analysts consider to be a crucial technical level.“The markets had become technically very oversold after the recent run of losses, and traders are using the 200-day average as an excuse to get back in,” said Randy Warren, chief investment officer at Warren Financial Service.The rebound on Wall Street was broad based, with nine out of ten major S&P indices gaining ground in the session.After financials, technology stocks saw the next strongest gains. The S&P technology index, which has suffered a 10.7 per cent correction since its last cyclical high in February, was up 0.9 per cent.Microsoft was one of the best performing stocks in the sector, rising 3.5 per cent to $25.15 in the biggest one-day move upwards in over nine months. On Tuesday, the technology giant is launching a new cloud version of Microsoft Office.Only the material sector was lower in the session as commodity prices softened. Freeport-McMoRan, the largest copper miner in the world by market capitalisation, lost 0.6 per cent to $48.14 while Cliff Natural Resources fell 0.8 per cent to $85.90.Sentiment in the session was not helped by weak data on consumer spending, but these technical factors meant that the news was largely shrugged off by the markets.Still, data from the commerce department showed that consumer spending had remained largely unchanged in May, which was the first time in nearly a year that spending had not gone up. The figure was also below the 0.1 per cent rise that had been expected by economists.The data is just one in a long line of weak economic numbers released in the last few months which has left the S&P 500 6.3 per cent lower since start of May.“With the economic indicators weakening and the concerns about the European periphery rising, markets are once again questioning the strength of the economic recovery,” said analysts at Goldman Sachs.Other data from the Federal Reserve Bank of Dallas showed that business conditions in Texas-area manufacturing worsened this month.Even so, the Dow Jones Industrial Average was up 0.7 per cent to 12,012.16 in the session, bringing the index to within striking distance of its 150-day moving average.The Nasdaq Composite was up 0.9 per cent to 2,677.09, bouncing off its own 200-day moving average level hit on Friday.The Nasdaq and the Dow indices are on their way towards 5.6 per cent and 4.5 per cent losses this month, respectively. The S&P 500 is looking at a 5.2 per cent fall in the worst month on the index since June 2010.In corporate news, ReneSola lost ground after announcing that its chief financial officer was resigning. The Chinese solar panel wafer maker was down 2 per cent to $4.94 after disclosing late on Friday that Julia Xu will leave the company and will be succeeded by financial executive Henry Wang.The stock has lost 53.3 per cent since the start of April and is one of the many US-listed Chinese companies to suffer in recent months.The Bank of New York Mellon China ADR index is down 8.8 per cent since its last cyclical high in the middle of April.Sino-Forest, a Chinese forestry company, has lost 86.6 per cent to $2.70 since the start of the month, and Renren, the Chinese social networking site, has fallen 64.5 per cent to $6.31 since its initial public offering in May.Other solar companies have also suffered in the last few months. First Solar is down 16.1 per cent to $117.10 since the start of May.But LDK Solar jumped 7.4 per cent to $7.31 in the session after the Chinese solar company said it plans to buy back up to $100m of its American Depository Shares.
