;Ticker;Nombre_Completo;Date_Time;Titular;Subtitular;Texto
17;ETR;Entergy Corp;2011-03-23T20:54:51Z;US officials make NY nuclear site top priority;;US nuclear officials pledged to make New York’s Indian Point nuclear site “its first and top priority” in their review of 27 facilities across the country, Andrew Cuomo, New York governor, said this week.The promise came after a meeting on Tuesday between Nuclear Regulatory Commission staff and Robert Duffy, New York lieutenant governor, about concerns over seismic risks at the site in the wake of Japan’s nuclear crisis following the March 11 earthquake.The NRC has also agreed to join state officials in a cooperative review of the plant and Greg Jaczko, the federal watchdog’s chair, will personally inspect the site, Mr Cuomo said in a statement.The regulator is in the midst of a study evaluating US nuclear plants’ “seismic risk and their ability to cope with it” based on data received in September 2010 from the US Geological Survey, said Beth Hayden, a NRC spokeswoman. In addition “the NRC is going to look at all aspects of the response of Japan to the earthquake and tsunami to determine if any action should be taken.” The study is expected to be released in 2012, she said.Indian Point, located in Buchanan, New York, about 40 miles up the Hudson River from New York City, sits near two active seismic faults. The site has been the focus of intense scrutiny amid a growing debate over the safety of nuclear plants.The two reactors at the New York site began operating in the mid-1970s, according to the NRC, well before the area’s seismic nature was identified. During his 2010 gubernatorial campaign, Mr Cuomo called for the reactors to be closed and alternate sources of energy to be found to replace their output. The site provides up to a third of the electricity used in New York City and Westchester County. The balance of electric power comes from natural gas, hydroelectricity, coal and petroleum.“There’s no immediate safety concern” at Indian Point, Ms Hayden said. The US Geological Survey data “shows for eastern and central states, the reactors remain safe and the overall seismic risk remains low. However, some of them had different risk information that came out slightly higher than we had initially calculated. Indian Point is one of those.”It “remains to be seen” whether the NRC’s evaluation will be affected by events at the Fukushima Daiichi nuclear plant, she said. “We are going to be looking at what’s going on over in Japan and we will factor that into whatever seismic reviews we do.”In a statement following Tuesday’s meeting with New York officials, the NRC said that “the robust design of US plants makes it highly unlikely that a similar event could occur in the United States.”Entergy, the company that operates the Indian Point site, told Westchester County legislators on Monday that the plant is unlikely to be hit by an earthquake of the magnitude of the Japanese temblor or by the tsunami that destroyed Fukushima Daiichi’s backup power supply.The largest recorded quake in the area was a 5.25-magnitude temblor in 1884, according to the 2008 Columbia University study that first identified the intersection of two seismic zones near Indian Point. Entergy says the plant can withstand a 6.1-magnitude earthquake.But critics dispute that risk assessment. The same Columbia study found that magnitude six and seven quakes are “quite possible” along the faults. “The seismic risk is something that has to be examined quite carefully and independently,” said Phillip Musegaas, the Hudson River program director at Riverkeeper, an environmental group that has called for the site’s closure. “From six to seven is orders of magnitude stronger.”In addition, Mr Musegaas said that while Indian Point may not be at risk for the tsunami like the one that knocked out power at the Japanese site, “a different kind of accident or natural disaster here could have the same effect.” Flooding or a storm surge from a hurricane could disable the plant’s back-up diesel generators, which are necessary to keep the nuclear fuel cooled and avoid a meltdown, he said.Mr Musegaas also questioned evacuation at the site. Indian Point’s emergency plan, which is approved by the NRC and the Federal Emergency Management Agency, calls for evacuating a 10-mile zone around the plant. But following damage at Fukushima, Mr Jaczko, the NRC chair, advised Americans to stay 50 miles away from the site, and said he would recomment the same distance were the crisis occurring in the US, he said. According to Riverkeeper, some 20m people live within 50 miles of Indian Point, including the population of New York City and parts of New Jersey and Long Island.“I’m not sure how you can square that with the regulation that we have now,” Mr Musegaas said. “We have clear evidence now that the radiation contamination in Japan goes far beyond this 10-mile zone.”Ms Hayden said she was not aware of plans to change the standard evacuation zone.Entergy has applied for 20-year extensions of its operating licenses for the Indian Point reactors, which come up for renewal in 2013 and 2015. Mr Cuomo said on Tuesday he “has long been an opponent of Indian Point and has worked to prevent the federal relicensing of the facility.”
18;ETR;Entergy Corp;2011-03-16T18:44:55Z;New York nuclear site under scrutiny;;The nuclear crisis in Japan has sparked a fresh round of calls for reviews of US facilities. One target is Entergy’s Indian Point power plant in Westchester County, New York, about 40 miles north of Manhattan, which provides about a third of the electric power used in the area.This week, Nita Lowey, a New York congresswoman, called on the Nuclear Regulatory Commission to “evaluate all possible threats, including terrorism, natural disasters, and the challenges that must be met in developing safety standards and evacuation procedures while determining the re-licensing” of Indian Point. Operating permits for two of the site’s reactors are up for renewal in 2013 and 2015.Riverkeeper, the New York-based environmental group, has called for the plant to be closed until it is “proven safe”, citing a 2008 Columbia University study that found Indian Point “sit[s] astride the previously unidentified intersection of two active seismic zones.”The permit renewal also played a role in Andrew Cuomo’s successful bid to become New York’s governor last year. During the campaign, Mr Cuomo urged the NRC to close the site, writing in a position paper that “We must find and implement alternative sources of energy generation and transmission to replace the electricity now supplied by the Indian Point facility.”Entergy, the plant operator, said in statement that “Entergy’s nuclear plants were designed and built to withstand the effects of natural disasters, including earthquakes and catastrophic flooding.”“The company understands and appreciates that these forces, natural and man-made, require constant vigilance and preparation for the unexpected. Accordingly, the company will continue to monitor closely the situation in Japan, and lessons will be learned and translated to even greater safety and effectiveness to meet the challenges of the most adverse and unexpected events, creating stronger public confidence in US nuclear programs.”
19;ETR;Entergy Corp;2011-03-14T19:20:16Z;Nuclear power: Fukushima fallout;The damage to the world’s energy industry will be widespread and long lasting;Even if further serious consequences are averted, Fukushima has already joined Chernobyl and Three Mile Island as a once-obscure place whose name the opponents of nuclear energy can invoke to great effect.The public’s visceral reaction to the terrifying images from Japan will overwhelm nuances such as redundant reactor technology, modern safety mechanisms or the geological stability of plant locations, nipping a nascent industry renaissance in the bud. Nuclear is once again a dirty word.In the US, tens of billions in loan guarantees as well as the first wave of new plant licences since Three Mile Island in 1979 are in jeopardy. In Europe, Germany’s reversal of plans to phase out nuclear plants in a decade face new criticism. And in Asia, India’s plans to ease power shortages through a big expansion of nuclear generation are being questioned.The only country sending a clear signal about sticking to development goals is China, with nearly half the world’s 155 planned reactors. In democracies though, Nimbyism, a potent phenomenon at the best of times, has been fortified.Companies most directly affected are uranium miners and processors such as Camecoand USEC, and reactor-builders Areva, Toshiba and General Electric. Secondary effects will harm, and in some cases help, other industries. In the US, utilities such as Entergyand Southern Company, in the middle of relicensing or developing multiple reactors, appear vulnerable, while thermal coal producers Arch Coal and Peabody Energy could benefit.Meanwhile, big liquefied natural gas producers such as Shell and Chevron will see both short- and long-term demand increase. Developers of other zero-emission power sources may also benefit, though they can replace only a fraction of nuclear’s potential.For the world’s energy industry, Fukushima’s economic fallout will be widespread and long lasting.E-mail the Lex team in confidence
20;ETR;Entergy Corp;2010-10-18T16:17:06Z;High stakes played for in UAE nuclear scheme;;When Abu Dhabi awarded a $20.4bn contract last December to a consortium led by the Korea Electric Power Corporation to oversee construction of a nuclear programme, many observers were taken by surprise.The bid battle had been considered a two-horse race between US- and French-led consortia. Critical to Kepco’s success was a commitment to technology transfer and to train and employ a high proportion of UAE nationals in the massive plants to be built.But that commitment may be difficult to meet, say industry watchers and participants, because of a dearth of qualified engineers locally and because of high international demand for skills. Today, some 60 nuclear plants are being built worldwide.The UAE plans to complete its first 1,400MW unit at Braka, an uninhabited region 50km south-west of Ruwais, by June 2017, and to add a further three plants to generate a total of 5,600MW by 2020. The long-term intention is that 60 per cent of employees should be UAE nationals.“We have an extremely limited pool of Emiratis available,” Abdullatif al-Shamsi, director-general of Abu Dhabi’s Institute of Applied Technology, pointed out at a nuclear construction conference in Dubai last month.The existing UAE bachelor’s programme to train potential Emirati nuclear personnel takes too long, Mr Shamsi says, so he has had no choice but to truncate study and work experience programmes from eight to five years.Away from the classroom, UAE planners have seized opportunities for hands-on experience. In the summer, 50 Emirati students visited South Korea for a four-week training programme in electrical and mechanical engineering, and worked at a nuclear reactor simulator.The Emirates Nuclear Energy Corporation has also launched scholarship programmes and is working with institutions to start different degrees, such as in nuclear engineering.“We believe we’re off to a strong start – within a year of launching the nuclear energy scholarships programme, we’ve received more than 1,000 applications from interested students,” says Fahd al-Qahtani of Enec.In spite of such initiatives, Bismark Tyobeka, a South African nuclear engineer working for the International Atomic Energy Agency, says his country remains short of skills after more than 20 years of operations at the Koeberg plant near Cape Town.“Even if the UAE can train nuclear engineers to be ready, they will all be inexperienced,” he says. “They will need considerable mentoring, job shadowing and a smooth transfer of skills will probably need more time.”For Kepco and for Enec, much credibility rides on timely and efficient delivery. Such schemes remain technically very demanding. A nuclear unit under construction by a rival company at Olkiluoto in Finland is at least four years behind schedule and 50 per cent over budget, according to industry watchers.“Performance like the Olkiluoto experience would be disastrous for the UAE’s plans and for Kepco’s reputation as a nuclear supplier,” says John Wheeler a nuclear manager with Entergy, the US electric power producer.On the other hand, the potential gains for Kepco and Enec are enormous given the high profile of the UAE project. The programme, led and funded by Abu Dhabi, is considered by the US government to be a model for others in the region to follow.“The prestige and marketing value for the Koreans can’t be understated,” says John Wheeler, a nuclear manager with , the US electric power producer. “If they pull off an on-time, on-budget delivery, Enec and Kepco will [look] like superstars.”
21;ETR;Entergy Corp;2010-02-25T18:18:25Z;Nuclear renaissance struggles to fire up;;"Amid the rural homes and thick greenery of Long Island’s North Shore is the biggest testament to the difficulties of building nuclear power plants in the US.It is the Shoreham nuclear power plant – a building from which no steam rises and no hum is heard. Completed in 1984, the $5.3bn (€3.7bn, £3.3bn) plant could not overcome public resistance and obtain an operating licence. It has lain idle ever since.That resistance was echoed in the Vermont Senate on Wednesday when it voted to close an Entergy Corp nuclear power plant 140 miles from Boston when its licence expires in 2012, citing a radioactive leak.If that vote is not overturned, Vermont will be the first state in more than 20 years to shut down a nuclear plant; California took such action in 1989.No reactor has been built in the US in almost three decades. Fears of nuclear accidents run deep following the country’s worst commercial nuclear accident at Pennsylvania’s Three Mile Island plant in 1979, which exposed those nearby to low levels of radiation.That was followed by the Chernobyl disaster in 1986, which killed more than 30 people in Ukraine. US utilities say public resistance is just one of the risks to building nuclear plants. The others are high costs, at about $5bn a reactor, and the lengthy bureaucratic approval process.Yet as the US grapples with energy security, global warming and an ageing nuclear fleet that supplies 20 per cent of the country’s power, the administration of Barack Obama, president, is trying to kickstart the industry.In his 2011 budget request Mr Obama included $54bn in loan guarantees to encourage construction of 10 reactors.While some say the president is using the guarantees to get pro-nuclear Republicans to negotiate on an energy bill, the industry says the guarantees are just what it needs. “The loan guarantees were an absolute prerequisite for the industry,’’ says Dan Krueger, managing director of global generation and energy markets for Accenture, the consultancy.“We should see an accelerating level of investment in US nuclear-related manufacturing, as well as renewed momentum behind proposed nuclear energy facilities,” Mr Krueger says.Given nuclear energy has no carbon emissions, it has won over those keen to block global warming. “Zero emissions has rung the right tone,’’ says Jack Bailey, vice-president of nuclear generation development at Tennessee Valley Authority, the US’s largest public power provider.TVA is considering completing two reactors halted in various stages of construction in the 1980s and two new ones. Yet environmentalists are not universally behind nuclear power.Entergy’s Yankee plant in Vermont had applied for a 20-year extension to keep it open once its original 40-year operating licence expired in two years. This is routine, as the US fleet of 103 plants must continue operating without new reactors to replace it.But James Moore, clean energy programme director at Vermont Public Interest Research Group, says the plant has suffered “old age problems” with the collapse of a cooling tower, a burst pipe and three leaks. He is among those who successfully lobbied the state Senate to block the extension on Wednesday.Larry Smith, spokesman for the plant, says problems there have been minor, with no radioactive material leaking outside the facility, and that the state needs the power. But the facility must prepare to shut down.Only if the $54bn in loan guarantees goes through is the US likely to see a concerted effort to replace such ageing facilities, leading to a ramping up of the equipment manufacturing and expertise needed to fuel expansion of the industry.“It would be the birth of a nuclear renaissance,’’ says Robert Rosner, co-director of the American Academy of Arts and Sciences’ project on the global nuclear initiative and a professor at the University of Chicago.One problem is the long lead times involved. In 2005 Congress approved $18.5bn in loan guarantees, but it took five years for the first conditional commitment: $8.3bn was approved last week for Southern Co, once it receives an operating licence, to help build two reactors in Georgia.“It’s just an extraordinarily long time,’’ says David Crane, chief executive of NRG Energy, which in 2007 became the first company in almost three decades to apply for a licence to build a reactor. According to the government’s schedule, it should get that within the next two years.Dozens of other companies that lined up behind NRG shelved plans after the economic downturn made obtaining credit on such expensive projects even harder.And now low prices of natural gas, providing a competing energy source, have made others even more uncertain. “If natural gas becomes almost free, there won’t be a nuclear renaissance,’’ Mr Crane says."
22;ETR;Entergy Corp;2007-03-04T19:14:07Z;Impact of the TXU bid;;The defining feature of the TXU takeover bid is its peculiar marriage of private equity’s largesse with the US green lobby’s newfound political power. But the Texan utility’s shareholders are not the only ones who stand to profit from this.TXU might have scaled back its plans to build new power plants – a decision announced alongside the deal – even without pressure from environmentalists. But the green angle is important. Wood MacKenzie estimates the industry had planned to build 53 gigawatts of new coal-fired capacity by 2012. TXU has removed 13 per cent of that already. More important, other utilities will think twice about building new coal-fired plants. Renewable and nuclear power cannot fill the resulting gap in the near term, so that means more gas-fired plants, which emit less carbon dioxide than coal. That, in turn, means high and volatile power prices in the near-term.Higher bills could eventually erode public support for action on climate change. By then, though, power generators themselves may have already accepted that the world has moved on. In a parallel with the early 1990s, when legislation to curb sulphur dioxide emissions came in, the industry may prefer the certainty of an agreed federal climate action plan, rather than the constant threat of new laws or a patchwork of state-level initiatives.As in Europe, generators with existing coal and nuclear plants should profit from a US power market linked to gas prices and are likely to start factoring a carbon cost into prices within, say, five years. Those in regions with little spare capacity and poor grid links should do particularly well. Citigroup identifies southern California and the area between Washington DC and Boston as two very constrained areas. That should benefit the likes of Constellation Energy, Exelon and Entergy. Higher power prices will also stoke sector valuations in another way. If TXU does fall to the barbarians, expect more generators to be taken private.
23;ETR;Entergy Corp;2007-01-17T18:31:32Z;Power companies endorse emissions cap bill;;In a sign that US electricity companies are recognising that the Democratic-controlled Congress will seek to impose aggressive climate change initiatives, six companies, including Exelon, one of the largest utility companies, on Wednesday endorsed a bill that would reduce their projected emissions by 25 per cent below projected levels by 2020.Dianne Feinstein, the Senate Democrat from California, and co-sponsor of the cap and trade bill with Tom Carper, a Democrat for Delaware, said the bill was the first time “major industry groups have endorsed a cap and trade bill which establishes emissions reductions as deep and aggressive as this bill”.The six companies, which have broken ranks with the rest of the industry, represent 15 per cent of the US electricity market and operate in 42 states. They include Calpine, Entergy, Florida Power and Light and PG&E Corporation.However, critics say that the six companies have a comparative advantage over rival power companies, in that they are less dependent on creating power from coal and have been more active in moving to nuclear power and wind power.Peter Darbee, chief executive of PG&E, which operates California’s largest utility company, acknowledged there was a degree of self interest by the companies. “There was a lot of push-back against global warming, but in the last few weeks there has been a view of the need to take proactive action to deal with this, otherwise we will be viewed as unconstructive. We want to be at the table.”Ms Feinstein said electricity companies accounted for a third of all US emissions, and that the bill was the first of five bills that would address global warming, including one to raise fuel economy standards by 10 miles per gallon over the next 10 years and a cap and trade proposal for the industrial sector.“You’ve got a cap and trade in seven north-eastern states, and in Europe and also California is looking to enter a cap and trade system.”She acknowledged resistance on Capitol Hill. “Coal dominates and is in 40 states, which makes garnering votes here in the Senate very difficult, so we decided whether there was some parts of industry with which we could work.”The White House also remains firmly opposed to cap and trade.The proposal underlines rising interest in cap and trade on Capitol Hill.
24;ETR;Entergy Corp;2006-09-24T19:20:42Z;US greenhouse gases;;Somewhere, somehow, someone’s going to pay. Two decades after starring in Commando – a film with a storyline as subtle as its tag-line – Arnold Schwarzenegger is gunning for greenhouse gases. California’s governor is at the vanguard of efforts to cut emissions. Last month, the state passed legislation to that effect. Meanwhile, seven northeastern states will cap emissions for power producers and allow them to trade permits from 2009, much like the European Union’s existing system.The White House may be no nearer to turning green – especially when it comes to taxing gasoline. But events like Hurricane Katrina are causing ordinary Americans to think again about climate change. Heavyweight potential presidential nominees on both sides of the political divide back federal emissions controls. Critics should remember that, in spite of a history of tough green measures, California’s economy has outpaced that of the US as a whole since 1970.The EU’s big mistake was to grant too many free emissions permits to power plants – basically handing them money without boosting investment in greener technologies. In the US, any eventual mix of free and auctioned permits would have big effects on utilities. The marginal generators, which set the price, are usually coal or gas-fired plants which would have to incorporate the cost of permits. That would widen margins for low-cost, carbon-free nuclear plants, but could hurt coal-fired generators.Citigroup has tried to quantify the effects of a hypothetical federal cap-and-trade system. In spite of uncertainties, the base-case scenario suggests a double-digit percentage point boost to the net present value of nuclear generators such as Exelon and Entergy. Coal-heavy rivals fare less well, especially in markets where cleaner gas-fired plants set prices or if more permits are auctioned rather than given away. Utilities investors should keep an eye on Arnie.
