;Ticker;Nombre_Completo;Date_Time;Titular;Subtitular;Texto
0;KSS;Kohl's Corp;2020-03-30T21:19:16Z;Macy’s, Gap and Kohl’s put thousands on leave ;Retail chains employing 420,000 say store closures will last longer than expected;"The coronavirus employment crisis deepened on Monday when tens of thousands of US retail workers at companies including Macy’s, Gap and Kohl’s were told that they would be temporarily laid off.In a dark day for the US labour market, a series of the country’s largest chains that employ more than 420,000 people between them warned they had to put workers on a leave of absence without pay as extended restrictions to contain coronavirus would keep stores closed longer than previously thought.Clothing chain Gap, which has about 129,000 staff worldwide, said pay would be “paused” for most store workers in the US and Canada while its stores remained closed. The department store group Macy’s also said it was furloughing most of its 125,000-strong workforce.Kohl’s, too, said it would temporarily furlough most store and distribution centre workers, as well as some corporate office staff. About 85,000 of its 122,000 employees would be affected.Ann Taylor parent Ascena Retail, which as of last summer employed 53,000 people, said all store workers would be put on leave. Gary Muto, chief executive, said it was “one of the most difficult decisions we have ever had to make"".Casper, the mattress company that listed last year, said its retail employees would also be furloughed. The succession of announcements are the latest blow for American workers as stay-at-home rules to curb the spread of Covid-19 brings several sectors including hotels, restaurants and entertainment to a standstill. US jobless claims this month surged the most in a single week since records began in 1967, to 3.3m.While eligibility rules vary by state, furloughed workers can in most
circumstances claim unemployment benefits.In the immediate response to the coronavirus lockdowns, retailers including Macy’s, Gap and Kohl’s had said that despite temporary store closures they would keep paying workers for several days, at least.However, they warned on Monday that social distancing measures and movement curbs meant they would have to keep stores closed for longer than planned.The announcements underscored the mounting toll from the pandemic on the retail sector. Victoria’s Secret parent L Brands, which has about 94,000 employees, said on Friday that most of its store workers would be put on leave without pay.Macy’s, which also owns Bloomingdale's, said on Monday it would be “moving to the absolute minimum workforce needed to maintain basic operations”. The group, whose outlets have all been closed for 10 days, said it was unclear when it would be safe to reopen as it warned the outbreak was taking a “heavy toll” on the business.Unions were critical of the move. Macy’s “needs to do much more for its employees than what they have announced so far”, Stuart Appelbaum, president of the retail, wholesale and department store union, said. “They will be judged in the future by how they treat their employees now.” As of last year, only 7 per cent of the company’s workers were represented by a union.Macy’s has already suspended its dividend, drawn on a line of credit and stopped capital spending to shore up its finances, but it said that “while these actions have helped, it is not enough”. It said it was “evaluating all other financing options”.The company said there would be “fewer furloughs” in its ecommerce business, which remained open, as well as distribution hubs and call centres that support its online operation.Macy’s said it expected “to bring colleagues back on a staggered basis as business resumes”.Sonia Syngal, Gap’s chief executive, said: “We are intensely focused on welcoming back our store teams and customers as soon as we are able.”Kohl’s chief executive Michelle Gass said the decision to furlough staff was “incredibly difficult”, adding: “We look forward to the day that we can reopen our stores to welcome our associates back.”Workers at several of the companies affected by the changes would continue to receive healthcare coverage."
1;KSS;Kohl's Corp;2020-03-30T10:00:29Z;US retailers teeter on the brink as 630,000 outlets close;Analysts predict dozens of nationally-known chains could be headed for insolvency;Few businesses are in greater need of emergency cash than retailers, yet the $2.2tn US stimulus bill is unlikely to prevent bricks and mortar chains hardest hit by the coronavirus shutdown from going to the wall.While Amazon, Walmart and a handful of other operators have the chance to emerge from the crisis in a stronger position thanks to a boom in online deliveries and the rush for household essentials, much of the rest of the sector is facing a historic crunch.Almost 630,000 outlets in the US have been forced to close due to fears about Covid-19 and restrictions on movement to contain its spread, according to Coresight estimates seen by the Financial Times. With the National Retail Federation calculating that $430bn in industry revenues could evaporate over the next three months, the question is how many of them will reopen.Tens of thousands of retail workers are already being furloughed without pay at Victoria’s Secret owner L Brands, while Macy’s warned its workforce of about 125,000 on Monday that it was unclear when stores could reopen and it would start to furlough most of the staff this week.As companies try to conserve cash, dividend payouts have been postponed at groups, including Nordstrom. At the same time, Best Buy, TJX and Kohl’s are among 126 discretionary consumer companies to draw a total $86bn from credit lines, according to Autonomous Research. Some, such as Mattress Firm, have told landlords that they will fail to make required rent payments for April.Another 30 nationally known US retail companies could file for bankruptcy protection this year, predicted industry consultant Jan Rogers Kniffen. Especially vulnerable are department stores and mall-based clothing chains that have long struggled to stay relevant in the age of Amazon.Retail executives and their advisers are pouring over the details of the congressional rescue bill, which includes $454bn in federal loans available to companies stricken by the crisis.How is coronavirus taking its toll on markets, business, and our everyday lives and workplaces? Stay briefed with our coronavirus newsletter.Sign up hereBig questions remain about how and when businesses can access the funds and the conditions attached, although Matthew Shay, head of the NRF, said that taken as a whole the package promised a “crucial bridge” for the sector. Mickey Chadha, senior credit officer at rating agency Moody’s, added the cash could help investment grade retailers “tide over any temporary liquidity issues”.Long before coronavirus, however, many retailers were battling to keep creditors at bay. Household names including Forever 21 and Pier 1 filed for bankruptcy in recent months and the sector accounted for almost a fifth of US corporate debt that defaulted in the fourth quarter.Junk-rated retailers with large debt burdens, cited by the rating agency Moody’s, include luxury chain Neiman Marcus, with outstanding debt of $6.1bn, mass market department store operator JCPenney ($4.2bn), womenswear company Ascena ($1.8bn) and clothing retailer J Crew ($1.4bn).Mark Cohen, director of retail studies at Columbia University and a former chief executive of Sears Canada, doubted federal loans could resuscitate heavily indebted companies. “A business that was struggling going into this crisis and is already leveraged up is unlikely to recover by taking on additional loans” even on favourable terms, he said.Corporate bond markets have become increasingly concerned about how discretionary retailers will cope. A Macy’s bond that matures in 2023, for instance, has tumbled from above $100 at the start of the month to $70, according to Finra data.Macy’s balance sheet has long been in better shape than more distressed rivals, although the department store chain lost its investment grade rating from S&P Global last month and was cut further into junk territory in a spate of sector downgrades last week.The company, which has already suspended its dividend, drawn on a line of credit and stopped capital spending to shore up its finances, said on Monday that “while these actions have helped, it is not enough”, as it drew up the furlough plans.Not everyone is sure coronavirus will lead directly to a wave of retail bankruptcies. “I expect to see an uptick, as companies that were on the edge have greater risk of falling off the edge quicker, but I don’t believe it will be the Armageddon that everyone thinks,” said Perry Mandarino, head of restructuring and co-head of investment banking at B Riley FBR.Such is the scale of the crisis that the bankruptcy process itself is not functioning properly. New York-based Modell’s Sporting Goods has put liquidation sales on hold as customers are unable to visit its stores, and a judge last week granted its request to suspend Chapter 11 proceedings.One leading restructuring banker argued lenders and landlords would do as much as they could to “hit the pause button” for the duration of the crisis. Prof Cohen added it may well be in creditors’ own interests to be more flexible than usual. “The assets that they would seize are currently worth a fraction of what they were before this erupted,” he said. “There will have to be widespread forbearance.”But creditors have bills of their own to pay — as mall owner Taubman pointed out in a memo to tenants, in which it told them it expected rent obligations to be met.Ultimately the longer business remains at a standstill, said Mr Kniffen, the more retailers will fold. “You can draw down on your revolver, you can furlough your employees, you can refuse to pay rent — but if this goes on for a while, you’re going to run out of levers to pull.”And those companies that come through the shutdown bruised, but intact, face the prospect that the impact will be felt long after the virus has been contained, putting them further behind more dominant rivals.The Financial Times is making key coronavirus coverage free to read to help everyone stay informed. Find the latest here.Restrictions on movement threaten to convert even more consumers both to online shopping — benefiting retailers that have been investing in ecommerce — and to chains that remain open through the crisis such as Walmart, which is taking on 150,000 workers to cope with demand.Amazon — which last week snapped up two store leases from bankrupt New York supermarket Fairway as part of an expanding push into bricks and mortar — is hiring 100,000.John San Marco, research analyst at $356bn asset manager Neuberger Berman, said he was spending much of his time trying to assess how much of the coronavirus disruption would endure. But there was no doubt, he said, that the crisis will lead to “a meaningful acceleration of the retail shake-out”.
2;KSS;Kohl's Corp;2020-01-09T17:47:19Z;US mall retailers hit by declining holiday sales;JCPenney shares plunge after company delivers ‘more gloom than the grinch’;The persistent difficulties facing America’s mall-based retailers were demonstrated on Thursday when several of the biggest names in the sector reported falling sales over the crucial holiday trading period.Like-for-like sales at JCPenney, which operates 850 stores and is an anchor tenant at shopping malls across the country, dropped 7.5 per cent year-on-year over the nine-week period to the start of January.While JCPenney reaffirmed its guidance for the full year, including for a like-for-like sales drop between 7 and 8 per cent, it shares fell more than 11 per cent, bringing the decline for the past three years to 85 per cent.“JCPenney’s holiday numbers have more gloom than the grinch,” said Neil Saunders, managing director of GlobalData’s retail division.Kohl’s, which analysts had hoped would manage to improve revenues during the festive season, reported a 0.2 per cent decline in like-for-like sales from a year ago, sending shares in the S&P 500 company down 9 per cent.The disappointing performance at Kohl’s prompted the company to say it now expected full-year diluted earnings to be “at the low end” of its previously announced guidance range, of between $4.75 and $4.95 per share.Michelle Gass, Kohl’s chief executive, said momentum in some areas including beauty and the children’s department had been offset by “softness” in womenswear. The company was “working with speed” on a turnround, she said.At L Brands, which has struggled to adapt to shifting consumer attitudes to lingerie, like-for-like sales dipped 3 per cent in the nine weeks to the start of January.L Brands also reduced its outlook, saying it expected to produce fourth-quarter earnings of about $1.85 per share compared with previous guidance of about $2. Wall Street took the latest decline in its stride as shares in L Brands ticked up 2 per cent. They have lost 70 per cent over the past three years.The latest figures show how many mall-based clothing outlets and department stores are struggling even though overall consumer spending remains robust. Analysts were cautious about drawing conclusions about the wider sector based on them.Companies coping better with the retail upheaval, such as Target and Walmart, had yet to disclose how they had performed over the holiday season, noted Mr Saunders.“There’s a real weakness in some of the results coming out,” he said. “But what we haven’t seen is the pockets of retail that are naturally stronger.”The updates came a day after homeware retailer Bed Bath & Beyond scrapped its full-year financial guidance and warned it expected sales and profitability “to remain pressured”.Macy’s, meanwhile, set out plans to shut almost 30 stores and disclosed a sales decline, although it was less steep than analysts feared.
3;KSS;Kohl's Corp;2019-11-26T17:57:59Z;Department stores fight for relevance ahead of Black Friday;Calligraphy classes and in-store spas among experiments chains are running to counter Amazon;US department store Kohl’s has a plan to counter competition from Amazon, which has stolen a march on the retail chain and its rivals. It has set out to become a dumping ground for unwanted gifts bought from the online retailer.The Amazon return initiative topped chief executive Michelle Gass’s list of reasons to be cheerful as she sought to convince Wall Street that the chain would sparkle this holiday season, which begins this week with Black Friday.The tie-up, which Kohl’s has expanded nationally after a successful pilot, shows the lengths that mid-market department stores on both sides of the Atlantic are being forced to go to in an effort to convince consumers to set foot in their stores. Kohl’s now lets customers bring back items they buy from Amazon to any of its 1,100 outlets, and the store will pack and send them back to the internet retailer free of charge. Ms Gass said she expected the initiative to attract shoppers to Kohl’s and ultimately improve sales. While Ms Gass talked up Kohl’s move to cosy up to its biggest existential threat, the stock market did not appear to share her optimism. As she was detailing Kohl’s holiday plans to analysts last week, its shares fell about 18 per cent after its third-quarter sales targets fell short of analyst expectations and it warned it expected profits to drop at least 12 per cent this year. Kohl’s rival Macy’s followed up two days later with its third profit warning this year. As department stores head into the busiest shopping period of the year, the outlook for them is bleak. IHS Markit forecasts US department store sales will drop 6 per cent in November and December, worse than the 2.8 per cent decline in the 2018 season. This bucks the wider trend in US retail, where IHS expects sales to rise 4.6 per cent year-on-year during the two months, to reach more than $730bn.“In the old days [department stores] acted as a curator of other people’s products under one roof,” said Peter Williams, former chief executive of Selfridges in the UK and now chairman of Superdry. “The internet has blown a hole in that process.” He added: “All the products are available elsewhere and they don’t have a strong enough identity as destinations in themselves.”Stacey Widlitz, founder of SW Retail Advisors, said that product offerings were “a sea of sameness” that left department stores with only price as a distinguishing feature — “hitting the promotional panic button” to encourage footfall and ultimately eating into profit margins.Against this backdrop, department stores’ share of US retail spending has dropped from about a tenth in the 1980s to less than 1.5 per cent, said Craig Johnson, president of Customer Growth Partners, a consultancy. An index of large-cap US department stores has lost 35 per cent of its value this year, making it the worst-performing subsector in the S&P 500 index. Privately-held groups such as mass-market Sears and luxury chain Barneys New York have been through bankruptcy proceedings in the past year. This echoes the fortunes of their counterparts Debenhams and House of Fraser in the UK, both of which have been through administration processes in the past 18 months. “The basic concept [of department stores] is simply not relevant to most shoppers today, particularly millennials,” said Mr Johnson.In the face of all of these pressures, department stores are having to stretch far beyond their roots to reinvent themselves as destinations that offer experiences that are unattainable on a laptop computer. Experiments being run from Dallas, Texas, to Southampton in England include in-store spas, bread-making classes and photography workshops.JCPenney this month opened a store with a “completely reimagined format” just outside Dallas. It features a spa, a barber and fitness classes — as well as in-store Sephora and Disney outlets, a nod to the pulling power of more popular brands.Similarly, the UK’s John Lewis has set up what it describes as “experience playgrounds” in Southampton, where customers can take part in workshops on pursuits from calligraphy to wreath-making. Interior designers, personal stylists and wine experts are among the specialists on site.There are some bright spots, notably in Paris, where the upmarket grands magasins Printemps, Galeries Lafayette, and LVMH-owned Le Bon Marché, have managed to appeal to consumers through a combination of exclusive collections, pop-ups and cultural collaborations — backed by substantial private investment. LVMH is reopening La Samaritaine department store in April following a €750m renovation.High-end UK operators such as Selfridges, Harrods and Harvey Nichols, which are exposed to the London tourist trade and prime sites in larger regional cities, have also fared better.Meanwhile, pressure is on mid-market operators to prove that they can differentiate themselves and turn round their fortunes. At Kohl’s, Ms Gass highlighted launches including a partnership with Elizabeth and James, a clothing brand from the twins Mary-Kate and Ashley Olsen. Macy’s pointed to a womenswear collaboration with Becca Tilley, a dating show star turned social media influencer. Hal Lawton, Macy’s president, said the company had been “working on fashion and trends, and really rejuvenating our exclusive brands”.These strategies are yet to prove they can pay off. “They’ve been throwing a lot of stuff at the wall to see if it sticks,” said Ken Perkins, president of Retail Metrics, a consultancy. “But it’s an uphill battle.”And more widely, the fact that the US department store sector is struggling, even as overall US consumer spending is relatively robust, raises the question of how they will cope in a recession. “It’s scary,” added Mr Perkins.Nordstrom Customers of Rent the Runway, a subscription service for designer clothes, can return items in drop-off boxesJohn Lewis “Experience playgrounds” feature workshops and talks about fashion, beauty and electricalsDebenhams Now offers fish and chips by Harry Ramsden’s at in-store restaurantsMacy’s Partnership with second-hand website ThredUp to sell used clothing in storesJCPenney A “selfie-studio” is among the initiatives at an experimental store in Texas
4;KSS;Kohl's Corp;2019-11-19T23:13:38Z;US retail stocks hit as Kohl’s, Home Depot and Urban Outfitters fall short;Concerns raised about consumer spending ahead of critical holiday shopping season;US retail stocks came under selling pressure after disappointing results from three of the sector’s best known names, Kohl’s, Home Depot and Urban Outfitters, raised concerns about how stores are faring as they head into the holiday shopping season.Both the department store chain Kohl’s and Home Depot, the nation’s largest DIY retailer, reduced financial forecasts for a second time this year. Urban Outfitters sent another negative signal about the sector after the market closed as the fashion clothing company missed quarterly sales forecasts.Executives identified a series of company-specific setbacks, from hitches in an IT rollout at Home Depot to weaker than expected sales of casual womenswear at Kohl’s.Yet the disappointing figures from such a diverse mix of retailers that serve a wide range of consumers added to worries about the health of the wider sector, ahead of the annual Black Friday shopping event.Shares in 13 listed US retailers lost at least 4 per cent in the ensuing sell-off, led by a 19 per cent drop in Kohl’s. Department store rivals Macy’s and Nordstrom saw their shares fall by 11 per cent and 6 per cent, respectively.Michelle Gass, Kohl’s chief executive, cited an “increasingly competitive environment” and unseasonably warm weather in September, as well as “mixed results” from parts of its women’s clothing business.The company, which operates 1,100 stores, underlined the persistent difficulties in the department store sector with like-for-like sales in the most recent quarter that ticked up only 0.4 per cent from a year ago.While this marked an improvement from a 2.9 per cent decline in the previous three months, analysts had forecast a more robust recovery, pencilling in a near 1 per cent rise. The Wisconsin-based company’s net income declined 28 per cent from a year ago to $116m.However, Mrs Gass said that Kohl’s was “positioned for a strong holiday season”, pointing to new brand launches and a national rollout of a scheme under which Amazon customers can return items bought online in Kohl’s stores.Urban Outfitters increased sales 1.4 per cent in the quarter to $987m, shy of analyst forecasts of $1bn, according to Capital IQ. Net income fell from $77.5m a year ago to $55.7m. Its shares tumbled 15 per cent in after-hours trading. to $24.66.The sector-wide sell-off came even though results from TJX, also released on Tuesday, provided evidence that selected retailers were coping well with the competition from Amazon.The discount retail group, which operates TJ Maxx and Marshalls, reported a stronger-than-forecast 4 per cent rise in like-for-like sales and lifted its earnings guidance for the full year.Home Depot, whose shares have been trading near record highs, also performed far better than other retailers in the third quarter. The group generated sales of $27.2bn in the period, a rise of 3.6 per cent from a year ago on a like-for-like basis.However, those results also fell short of forecasts. Craig Menear, chief executive, said an $11bn investment plan designed to better integrate Home Depot’s online and physical presence had yet to generate the expected improvements.“We are seeing benefits from the initiatives — it’s just not at the rate of our original plan,” he told analysts.Mr Menear blamed technology setbacks in particular. IT projects including a new website for business contractors had “proven to be more complex than originally anticipated”.Home Depot said it now expected full-year like-for-like sales to rise 3.5 per cent from last year, weaker than the 4 per cent previously forecast. Although third-quarter net earnings dipped from $2.9bn in the same period a year ago to $2.8bn, the company still expected annual diluted earnings per share to be up 3.1 per cent.Kohl’s said it now expected diluted earnings per share, adjusted for exceptional items, to come in at between $4.75 and $4.95 — a year-on-year decline of between 12 and 15 and per cent. That compares with previous guidance of between $5.15 and $5.45.TJX forecast annual diluted earnings per share to rise between 7 and 8 per cent from a year ago, to range of $2.61 to $2.63. Its shares rose 1.8 per cent to close at $60.64.
