;Ticker;Nombre_Completo;Date_Time;Titular;Subtitular;Texto
137;KSS;Kohl's Corp;2008-10-24T17:16:00Z;Liz Claiborne faces bleak Christmas;;Liz Claiborne, the fashion clothing company, on Friday underlined the bleak Christmas facing retailers in the US and Europe, as it cut its holiday quarter earnings forecast on slumping demand.Bill McComb, chief executive, said the company began to see “real changes in spending patterns” in its more than 700 stores in September.The changes came as US stock markets started to fall, while its department store customers began “dramatically” increased promotional price cuts.“Traffic in malls and street locations is off in every region, including Europe,” he said.“Consumer confidence has clearly been impacted in a way we hadn’t seen earlier this year.”The company said it now expected earnings of 19 to 24 cents per share, from the previous range of 66 to 71 cents. About 85 per cent of Liz Claiborne’s business comes from its wholesale business with mainstream US department stores including Macy’s, JC Penney and Kohl’s.Its own store network includes Lucky Brand, Juicy Couture and Kate Spade stores and the Netherlands-based Mexx.Its rivals VF Corp and Jones Apparel have also cut their forecasts, with VF citing the precipitous decline in consumer confidence in the second half of September.Best Buy, the consumer electronics retailer, also reported a dramatic drop-off in its sales sparked by the bleak news from financial markets in September.In another reflection of doubts over discretionary spending by US consumers, Coca-Cola’s largest US bottler said this week it was expecting sales volumes in North America to fall by about 10 per cent.Following Liz Claiborne’s warning, Moody’s, the debt rating agency, put the company on review for a possible downgrade.Ed Henderson, Moody’s analyst, said the ratings agency “no longer expects the company to show a sustained improvement in sales or margins in the current year”.The company was “unlikely to maintain financial metrics appropriate for an investment grade rating”.Liz Claiborne said it expected to have a total debt balance of $750m to $775m at the end of the year, and expected to generate $300m to $325m of cash flow, which it said would leave it in compliance with covenants on its $750m revolving bank credit facilities.The company also pre-announced its earnings for the third quarter, originally due on November 11, saying it expects to report a loss per share from continuing operations of between 8 and 14 cents.Net sales fell almost 16 per cent to $1bn against the same period last year.
138;KSS;Kohl's Corp;2020-04-25T23:17:40+0000;US high-end retailers battered;;Cut-backs by America’s wealthiest shoppers amid Wall Street’s woes drove down sales at the country’s most exclusive stores in September, according to sales data released on Wednesday by leading retailers.Neiman Marcus, the Dallas-based retailer which operates 64 luxury stores, said comparable sales at its stores fell 15.8 per cent during the month, while its overall revenues fell 11.1 per cent.The retailer’s monthly sales declines are the worst reported by the retailer since September 2002.Neiman Marcus warned last month that it expected its three New York area stores, which include Bergdforf Goodman in Manhattan, to be hit by Wall Street’s troubles ands by a decline in spending by tourists taking advantage of the weak dollar.Its September sales also reflected the hurricanes that affected its Texas stores.Burt Tansky, CEO, said that “based on our September performance and the current economic environment, we expect customer demand will remain weak for an extended period of time”, and warned that the retailer had higher than expected inventory levels.Saks, which derives 20 per cent of its revenue from its flagship store in New York, reported a 10 per cent fall in its comparable sales and a 11.1 per cent fall in total revenues. Nordstrom, which targets a more mainstream affluent customer, reported a 9.6 per cent drop in comparable sales and a 5.8 per cent fall in revenues.Saks said in a statement that it “anticipates the extremely challenging economic environment will continue”, and said it was now expecting sales in the second hald of its fiscal year to drop below its estimate of a low-single digit decline.Blake Nordstrom, president of Nordstrom, said that ”the consumer environment has been impacted by events in the financial markets over the past month”, as the retailer lowered its third quarter earnings forecast by 17 cents, to 32 to 37 cents per share.The dramatic slowdown in spending at Neiman, whose holiday gift catalogue this year includes exotic luxury items such as a $60,000 personalised portrait Lego replicas, contrasted with the more robust performance at Wal-Mart and at discount warehouse clubs focused on low cost food and basics.Comparable sales at Wal-Mart’s stores and supercenters rose 2 per cent during the month, while sales at its Sam’s Club warehouse stores rose 4.6 per cent. Costco and BJ’s, the discount club stores, saw US store sales excluding fuel increase by 6 and 5.6 per cent respectively.Richard Galanti, Costco’s CFO, told investors that the retailer was seeing high double digit sales of food and grocery items, while sales of bigger ticket items such as televisions, jewellery and furniture were declining.Stores more focused on discretionary purchases struggled. Target, the discounter that has a heavy focus on fashion and housewares, saw its comparable sales drop 3 per cent. JC Penney and Kohl’s saw comparable sales fall 12.4 per cent and 5.5 per cent. Both retailers cut their third quarter earnings forecasts.Clothing retailers - some of whom report sales on Thursday - have also seen falling sales. American Eagle said its comparable sales were down 6 per cent, and lowered its earnings forecast, while youth brand Zumiez reported a 9 per cent drop.The gloomy same store sales numbers followed consumer spending data released earlier this week by MasterCard Advisors’ Spending Pulse, which reported declines in all sales categories in September.The report, based on MasterCard credit card spending data and estimates of other forms of payment, said sales at speciality retail stores - which include clothing sellers and department stores - fell 7.7 per cent aganst the same period last year, following a 4.1 per cent decline in August.
139;KSS;Kohl's Corp;2008-09-30T09:47:22Z;US and Asia stocks plunge;;Asian equity markets tumbled in reaction to the US House of Representatives rejection of a Bush administration’s $700bn bail-out plan for the financial industry while earlier US stocks suffered their biggest fall since the Black Monday crash of 1987.Financial stocks plunged across the region, leading markets lower. Hong Kong shares dropped as much as 6.1 per cent, the Nikkei in Japan lost 5.0 per cent, and Taiwan, which had been closed on Monday, lost as much as 6.7 per cent. However losses narrowed as the day progressed and Hong Kong, for example, closed with a 0.8 per cent gain. In India, the Sensex was 2.4 per cent higher by mid afternoon in Mumbai at 12,891.82South Korea and Taiwan temporarily banned short selling and Hong Kong’s regulator reminded investors that it would punish aggressive shorting.The MSCI Asia Pacific Index had fallen 3.4 per cent to 107.57 by early evening in Tokyo, extending the drop of 4.9 per cent it made over the previous five days. September looks as thought it will be the regional benchmark’s worst month since for 18 years.“There’s a massive crisis of confidence,” said Khiem Do, head of multi-asset at Baring Asset Management in Hong Kong. “I’m buying today. I love to buy when there’s panic. It’s the time to get companies with good long-term prospects cheaply.” He said the MSCI Asia Pacific index was trading at a bargain valuation of around 10.5 times earnings.Asian investors took their cue from the US markets, where the S&P 500 fell 8.8 per cent, its worst day since falling 20.5 per cent on October 19, 1987. The Dow Jones Industrial Average fell by 7 per cent, close to the 7.3 per cent it fell when markets reopened after the September 11 attacks on the US in 2001.Oil fell by more than 10 per cent overnight. Nymex light sweet crude was trading at $96.42 a barrel by late afternoon in Singapore.The yen rose as investors returned money to Japan which they had borrowed there cheaply to deposit in other countries such as Australia with much higher interest rates. It reached Y103.54 to the dollar before weakening by more than one per cent beyond Y104.80.The South Korean won, however, hit Won1,230 to the dollar, its weakest for nearly five and a half years before strengthening slightly to Won1,206.75.Banks fell across the Asia-Pacific region, and so did exporters as investors worried about the prospects for the US economy, their biggest market.Among Japan’s big banks, Mitsubishi UFJ Financial, which on Monday bought a 20 per cent stake in Morgan Stanley, fell as much as 7.0 per cent, although it closed 4.7 per cent lower at Y893. MUFG lost about $500m on the $9bn investment overnight as Wall Street punished financial stocks.Nomura Holdings, Japan’s largest broker, dropped 7.3 per cent to Y1,326 in Tokyo and HSBC, the company with the biggest weighting in Hong Kong’s Hang Seng index, Sumitomo Mitsui fell by 7.1 per cent to Y630,000 and Sumitomo Trust & Banking dropped 6.6 per cent to Y670.In India, ICICI Bank dropped 7.2 per cent at the open as rumours circulated about the bank’s financial position before quickly changing direction to rise as much as 8.4 per cent to Rs534.50 after the Reserve Bank of India guaranteed the bank’s deposits. ICICI’s managing director, K V Kamath, called the rumours “baseless and malicious”.Industrial & Commercial Bank of China, the world’s biggest bank by market value, lost as much as 8.7 per cent in Hong Kong but ended the day 1.6 per cent higher at HK$4.58 (ICBC was not traded in Shanghai as mainland markets are closed until Monday for the Golden Week of public holidays.)The region’s biggest market, Japan, fell to its worst closing levels since June 2005. The Nikkei 225 average ended 4.1 per cent lower at 11,259.86 and the broader Topix index ended 3.6 per cent lower at 1,087.41.Among leading electronics companies, Sony fell 7.1 per cent to Y3,150, Canon lost 6.1 per cent to Y3,820 and the games maker Nintendo was down 4.0 per cent to Y43,400.The Hang Seng index closed 0.8 per cent higher at 18,016.21 and the main sub-index of mainland companies listed in the territory was 1.3 per cent higher at 9,070.31The pain was spread across most of the territory’s listed companies. Bank Of East Asia fell by 2.0 per cent to HK$24.00 and China Merchants Bank fell by 2.8 per cent to HK$18.22. But Wing Lung Bank rose by 6.2 per cent to HK$155.10 as China Merchants completed its purchase of Wing Lung.The oil producer Cnooc fell by 1.7 per cent to HK$8.85 but mainland refiners rose as cheaper crude helps them to improve margins as Beijing controls the price of petrol and other refined products. PetroChina rose by 1.0 per cent to HK$8.00 and Sinopec gained 2.4 per cent to HK$6.03.However BYD, the battery maker, rose for the second day running after the billionaire investor Warren Buffett took a 10 per cent stake on Monday. BYD rose by 7.9 per cent to HK$12.84.Australia suffered twice over: financial companies followed their peers around the world, and resource and energy producers were also hit by the fall in the price of crude and declining metals. The S&P/ASX 200 index ended 4.3 per cent lower at 4,600.50, a 21-month closing low.BHP Billiton, the world’s largest miner and a big oil producer, fell by 9.5 per cent to A$31.00 and Rio Tinto fell by 11.5 per cent to A$84.50.Fortescue Metals, an iron ore miner, fell by 16.8 per cent to A$4.66 on worries about declining global demand.Among the big banks, National Australia Bank fell by 5.6 per cent to A$24.26 and St George Bank fell by 6.8 per cent to A$28.60.Financial companies that depended on cheap credit to buy infrastructure and other assets also fell sharply. Babcock & Brown fell by 17.2 per cent to A$1.95. Macquarie dropped by more than 3.0 per cent but closed 0.5 per cent lower to A$37.00.Elsewhere in Asia, the Kospi closed 0.6 per cent lower at 1,448.06 in Seoul. In Singapore, the Straits Times Index was 0.3 per cent lower late in the afternoon session at 2,353.23 and the Stock Exchange of Thailand index was 0.6 per cent lower late in the afternoon session at 597.82On Wall Street, the S&P 500 – already pushed lower after an authorities-brokered sale of Wachovia and bail-outs in Europe deepened concerns over the health of the banking sector – plunged 7.2 per cent immediately after the Congressional vote, a fall that worsened towards the close. The Dow Jones closed down 777.7 points, its biggest one-day point decline ever.“This is brutal,” said Marc Groz, chief executive of Topos, a quant hedge fund, who was senior associate at Morgan Stanley at the time of the 1987 crash. “’87 doesn’t compare to this – it’s so systemic.”“Everyone’s in shock,” agreed Richard Parker, managing director of institutional equity trading at Stanford Financial, who said the market did not expect the vote to be brought before the house were there no confidence it would be passed.The Chicago Board Options Exchange Volatility Index, known as Wall Street’s fear gauge, shot up 34.5 per cent to 46.7 after the vote, its highest closing level on record.The market’s afternoon plummet came in spite of the Federal Reserve and European Central Bank’s move to double the size of their currency swap line.Smaller banks were among the biggest victims. Regional banks led the fall-out from a worsening crisis of confidence. National City sank 63.3 per cent to $1.36 – after the Ohio lender insisted it had no need to raise additional capital.Sovereign Bancorp, Fifth Third and Regions Financial plunged 72.2 per cent to $2.33, 43.6 per cent to $9.11 and 33.3 per cent to $9.80, respectively.The overall financial sector fell 15.5 per cent. Custodian banks, normally seen as among the safest banking stocks, suffered, with State Street losing 27 per cent to $44 and Bank of New York Mellon down 27.2 per cent at $26.50.By the close in New York, the S&P was 8.7 per cent lower at 1,107.06 – its biggest fall since 1987. The Dow Jones fell 7 per cent lower to 10,365.45 and the Nasdaq Composite Index was 9.1 per cent lower at 1,983.73.The index of stocks placed on the SEC’s short-ban list, compiled by Bloomberg, fell 11.8 per cent, below the level before the ban was introduced.Other large US financials were sharply lower as global money markets remained in paralysis. JPMorgan Chase fell 15 per cent at $41.Wachovia lost 81.6 per cent of its market capitalisation, to $1.84 a share. Citigroup agreed to buy most of its assets and liabilities in a deal brokered by the Federal Deposit Insurance Corporation. Citigroup fell 11.9 per cent to $17.75The embattled bank was in talks over the weekend with Wells Fargo and Banco Santander as well as Citigroup. Wells Fargo fell 10.9 per cent at $33.25.Morgan Stanley lost 15.2 per cent to $20.99 after the investment bank finalised a deal to sell a 21 per cent equity stake to Mitsubishi UFJ Financial Group, Japan’s largest bank, for $9bn.The energy sector, fell 10.9 per cent as crude fell more than 9 per cent to hit $96 a barrel in Nymex trading. Commodities stocks set new lows for the year as oil fell below $100 a barrel on concerns over the global outlook. US Steel and Alcoa and Freeport-McMoRan Copper & Gold fell 17.1per cent to $72.33, 9.2 per cent to $21.38 and 16.6 per cent to $10.60 respectively.The technology sector suffered heavy losses, down 9.2 per cent, in losses that rivalled the bursting of the tech bubble.Apple, the maker of iPods, iPhones and Mac computers, sank 17.9 per cent to $105.26. Earlier in the day, Morgan Stanley and RBC cut their recommendations on the stock due to slower demand.Google fell 11.6 per cent to $381, below $400. Amazon fell 10.4 per cent to $63.35.Automotive stocks suffered declines even after Congress voted to fund $25bn of government low-interest loans to help the sector. General Motors and Ford lost 12.8 per cent to $8.51 and 13.3 per cent to $4.17, respectively.In the consumer discretionary sector, Urban Outfitters and Kohl’s fell 7.8 per cent to $32.21 and 7.6 per cent to $45.38 after Thomas Weisel Partners downgraded its recommendations.
140;KSS;Kohl's Corp;2008-09-30T06:37:30Z;US stocks plunge after bail-out vote;;US stocks suffered their biggest fall since Black Monday in response to the failure of Congress to approve the Treasury’s $700bn bail-out plan.The S&P 500 – already pushed lower after an authorities-brokered sale of Wachovia and bail-outs in Europe deepened concerns over the health of the banking sector – plunged 7.2 per cent immediately after the Congressional vote, a fall that worsened towards the close. The Dow Jones closed down 777.7 points, its biggest one-day point decline ever.“This is brutal,” said Marc Groz, chief executive of Topos, a quant hedge fund, who was senior associate at Morgan Stanley at the time of the 1987 crash. “’87 doesn’t compare to this – it’s so systemic.”“Everyone’s in shock,” agreed Richard Parker, managing director of institutional equity trading at Stanford Financial, who said the market did not expect the vote to be brought before the house were there no confidence it would be passed.The Chicago Board Options Exchange Volatility Index, known as Wall Street’s fear gauge, shot up 34.5 per cent to 46.7 after the vote, its highest closing level on record.The market’s afternoon plummet came in spite of the Federal Reserve and European Central Bank’s move to double the size of their currency swap line.Smaller banks were among the biggest victims. Regional banks led the fall-out from a worsening crisis of confidence. National City sank 63.3 per cent to $1.36 – after the Ohio lender insisted it had no need to raise additional capital.Sovereign Bancorp, Fifth Third and Regions Financial plunged 72.2 per cent to $2.33, 43.6 per cent to $9.11 and 33.3 per cent to $9.80, respectively.The overall financial sector fell 15.5 per cent. Custodian banks, normally seen as among the safest banking stocks, suffered, with State Street losing 27 per cent to $44 and Bank of New York Mellon down 27.2 per cent at $26.50.By the close in New York, the S&P was 8.7 per cent lower at 1,107.06 - its biggest fall since 1987. The Dow Jones fell 7 per cent lower to 10,365.45 and the Nasdaq Composite Index was 9.1 per cent lower at 1,983.73.The index of stocks placed on the SEC’s short-ban list, compiled by Bloomberg, fell 11.8 per cent, below the level before the ban was introduced.Other large US financials were sharply lower as global money markets remained in paralysis. JPMorgan Chase fell 15 per cent at $41.Wachovia lost 81.6 per cent of its market capitalisation, to $1.84 a share. Citigroup agreed to buy most of its assets and liabilities in a deal brokered by the Federal Deposit Insurance Corporation. Citigroup fell 11.9 per cent to $17.75The embattled bank was in talks over the weekend with Wells Fargo and Banco Santander as well as Citigroup.Wells Fargo fell 10.9 per cent at $33.25.Morgan Stanley lost 15.2 per cent to $20.99 after the investment bank finalised a deal to sell a 21 per cent equity stake to Mitsubishi UFJ Financial Group, Japan’s largest bank, for $9bn.The energy sector, fell 10.9 per cent as crude fell more than 9 per cent to hit $96 a barrel in Nymex trading. Commodities stocks set new lows for the year as oil fell below $100 a barrel on concerns over the global outlook. US Steel and Alcoa and Freeport-McMoRan Copper & Gold fell 17.1per cent to $72.33, 9.2 per cent to $21.38 and 16.6 per cent to $10.60 respectively.The technology sector suffered heavy losses, down 9.2 per cent, in losses that rivalled the bursting of the tech bubble.Apple, the maker of iPods, iPhones and Mac computers, sank 17.9 per cent to $105.26. Earlier in the day, Morgan Stanley and RBC cut their recommendations on the stock due to slower demand.Google fell 11.6 per cent to 381, below $400. Amazon fell 10.4 per cent to $63.35.Automotive stocks suffered declines even after Congress voted to fund $25bn of government low-interest loans to help the sector. General Motors and Ford lost 12.8 per cent to $8.51 and 13.3 per cent to $4.17, respectively.In the consumer discretionary sector, Urban Outfitters and Kohl’s fell 7.8 per cent to $32.21 and 7.6 per cent to $45.38 after Thomas Weisel Partners downgraded its recommendations.
141;KSS;Kohl's Corp;2008-09-04T18:36:25Z;Thriftiness boosts US lower-cost stores;;US shoppers maintained their focus on keeping costs down as they embarked on the “back-to-school” shopping season, favouring Wal-Mart and other low-cost retailers over department and fashion stores, according to August sales figures.Wal-Mart saw sales at its supercentre and discount stores open at least a year rise 2.8 per cent, led by its grocery and health sales, which includes pharmacy. Together with its Sam’s Club warehouse stores, sales rose 3 per cent, ahead of its forecast of between 1 and 2 per cent growth.Eduardo Castro-Wright, head of Wal-Mart’s US stores, said the retailer had gained market share as a result of the relative strength of its business. The retailer forecast comparable sales growth of between 2 and 3 per cent for September.Wal-Mart again outdid Target, its main rival, which aims at attracting more discretionary spending. Target’s comparable sales fell 2.1 per cent.JC Penney and Kohls, the department stores, reported comparable sales falls of 4.9 and 5.8 per cent respectively on Wednesday.However, other price-focused stores did comparatively well, with the Family Dollar chain reporting a 3.6 per cent increase in sales at its network of small neighbourhood stores. Costco and BJ’s, the bulk warehouse club stores, reported US comparable sales gains of 6 per cent and 7.7 per cent, excluding their fuel sales.At BJ’s, bulk food sales far outstripped other goods, up 11 per cent, against a 2 per cent increase for general merchandise, in another indication of shoppers focusing on saving money.In teen fashion – normally a beneficiary of back-to-school spending – the lower-priced Aeropostale chain reported a 13 per cent in­crease in comparable sales, while Abercrombie & Fitch saw comparable sales fall 11 per cent.Ken Perkins, of Retail Metrics, said the data showed that “necessities have taken centre-stage against a backdrop of rising prices and less discretionary income”.Retail Metrics’ monthly index of same-store sales rose 2 per cent.Sanjay Srikanth of retail consultants AT Kearney said the back-to-school performance underlined concerns about the coming holiday season. “Everyone is tightening their inventories and expecting a fairly difficult holiday season relative to last year.”The S&P 500 was down 1.8 per cent on Thursday at lunchtime amid broad-based weakness. The S&P retail index was down 1.4 per cent, led by a 6.6 per cent fall in TJ Maxx and a decline of 5.9 per cent in Abercrombie and Fitch. Wal-Mart was up 1.3 per cent.Additional reporting by Michael MacKenzie in New York
