;Ticker;Nombre_Completo;Date_Time;Titular;Subtitular;Texto
48;KSS;Kohl's Corp;2015-02-04T18:27:44Z;Gilead sinks on discounting worries;Consumer discretionary and telecoms offer support to S&P 500;Gilead Sciences shares tumbled on Wednesday despite exceeding fourth-quarter earnings and sales estimates after it said it would have to offer discounts on its hepatitis C drug.The California-based company said it would make a “gross to net adjustment” of 46 per cent on US sales of its Harvoni and Sovaldi pills this year.Sales of the company’s older hepatitis C medication, Sovaldi, slowed to $1.73bn from a quarter earlier as patients transitioned to its successor, Harvoni.The new medication, which has a cure rate of 94-99 per cent and a $94,500 price tag for a 12-week treatment, beat Wall Street estimates at $2.11bn. Sales a quarter earlier were limited as the medication was only available in Europe.“Gilead expects lower margins to be offset by higher patient volumes and fewer eligibility restrictions, including treating F0 patients (no fibrosis) in select agreements,” said Ian Somaiya, an analyst at Nomura.Gilead expects to have capacity to treat more than 250,000 patients for hepatitis C in 2015.Matthew Roden, an analyst at UBS, said market penetration would rise as the drug became more affordable, but in the short term “more patients are captured by Gilead ahead of further competition”.But he added that year estimates beyond 2015 would decrease because more patients would have been cured.Gilead profits more than tripled from a year earlier to $3.49bn, or $2.18 a share in the three months to the end of December, while sales more than doubled to $7.3bn.Gilead announced that it would pay a 43 per cent quarterly dividend and announced a $15bn share buyback programme.Shares of Gilead, which have climbed more than 18 per cent in the past year, fell more than 8 per cent to $98.43, wiping $16.5bn in market capitalisation.Shares of Chipotle Mexican Grill fell 7 per cent to $676.00 after the restaurant chain reported a 16.1 rise in same-store sales in the fourth quarter, shy of Wall Street estimates for 16.5 per cent growth.Earnings of $3.84 a share topped forecasts, while sales of $1.1bn were in line with estimates.Ralph Lauren was the worst performing stock on the US benchmark after the company reported a 9 per cent drop in fiscal third-quarter profits to $215m or $2.41 a share and sales of $2.03bn that missed Wall Street estimates.The retailer expects fiscal 2015 revenue to rise 4 per cent in constant currency terms, lower than its previous estimates for 5-7 per cent growth. Its shares fell 18 per cent to $139.71.Walt Disney shares advanced nearly 8 per cent to $101.28 after it topped fiscal first-quarter earnings and sales estimates driven by sales of consumer products and home entertainment related to its 2013 animated hit Frozen.Kohl’s reported a 3.7 per cent rise in same-store sales, ahead of its forecast for 2-3 per cent growth, lifting shares up more than 6 per cent to $66.87.Consumer discretionary and telecoms stocks offered support to the US benchmark as lower oil prices and healthcare stocks weighed on the index.The S&P 500 fell 0.4 per cent to 2,041.51, the Dow Jones Industrial Average was little changed at 17,673.02 and the Nasdaq Composite fell 0.2 per cent to 4,716.70.mamta.badkar@ft.comTwitter: @mamtabadkar
49;KSS;Kohl's Corp;2014-10-28T17:55:50Z;Amgen climbs after strong sales figures;US stocks rise ahead of the Federal Reserve’s two-day monetary policy meeting;Global biotechnology company Amgen was one of the best-performing stocks on the S&P 500 after it beat third-quarter sales estimates and raised its full-year guidance.Amgen reported net income of $1.24bn, or $1.61 a share, down from $1.37bn or $1.79 a share in the same period a year ago. Revenues climbed 6 per cent to $5.03bn.Wall Street analysts were looking for earnings of $1.85 a share on sales of $4.96bn. Adjusted earnings of $2.30 a share beat expectations of $2.11 a share.The company also boosted its 2014 revenue guidance to a range of $19.8bn-$20bn and adjusted earnings per share in the range of $8.45 to $8.55.“While we take comfort that it appears Amgen’s base business has largely stabilised, we believe the quarter will be overshadowed by the [October 28] Business Review meeting,” Ian Somaiya, an analyst at Nomura, said.Amgen has been under pressure from activist investor Daniel Loeb, whose hedge fund Third Point has a stake in the company, to split into two.During an analyst meeting, Robert Bradway, chief executive of Amgen, said he was not convinced that splitting the company would add much value to shareholders, according to Michael Yee, an analyst at RBC Capital Markets.Shares of Amgen climbed 6 per cent to $157.19 and are up 38 per cent so far this year.Kohl’s lagged behind the S&P 500 after the US department store chain warned on Monday that quarterly profits would be at the low end of its earlier guidance as sales softened in October.Lex discusses whether the biotechnology group is better apartIt expects earnings in its third quarter to be at the low end of earlier guidance of between $4.05 and $4.45 a share.Analysts on Wall Street had forecast earnings of $4.29 per share before Monday’s announcement.Shares of Kohl’s fell nearly 7 per cent to $54.66.Coach shares dropped 6 per cent to $34 after the luxury handbag maker said it expected a mid to high 20 per cent decline in comparable store sales in fiscal year 2015.The retailer reported a 10 per cent decline in sales to $1.04bn in the three months to the end of September that were modestly ahead of expectations for $1.01bn.Profit fell 45 per cent to $119.1m, or 43 cents per share. When excluding costs related to the company’s reorganisation, Coach said it earned 53 cents a share. Wall Street analysts had forecast profit of $123m, or 44 cents per share.Twitter shares fell 10 per cent to $43.78. The social media company had its rating cut by at least three investment banks on Tuesday after user growth in its latest quarter slowed.Whirlpool shares climbed 7 per cent to $168.06 after the maker of home appliances reported a higher third-quarter profit.Net income of $230m, or $2.88 per share, was up from $196m or $2.42 a share in the year-ago period.US stocks were higher ahead of the Federal Reserve’s two-day monetary policy meeting, in which investors expect the Fed to strike a dovish tone.The benchmark S&P 500 gained 1.2 per cent to 1,985.05, while the Dow Jones Industrial Average gained 1.1 per cent to 17,005.75. The Nasdaq Composite rose 1.8 per cent to 4,564.29.Email: mamta.badkar@ft.comTwitter: @mamtabadkar
50;KSS;Kohl's Corp;2014-09-18T16:55:59Z;Peabody sinks after Goldman downgrade;;Peabody Energy, the largest US coal producer, led the laggers on the benchmark S&P 500 after brokerage Goldman Sachs dimmed its view on the company as pressure on global coal markets persist.Weak Chinese demand and high Australian supply of coal is expected to weigh on the price through the remainder of the year, analysts with the investment bank said.Lower demand from US utilities is also expected to depress coal prices.Spot metallurgical coal prices have hovered near $115 per metric ton this year, below average levels over the past three years.Goldman on Thursday subsequently cut its fourth-quarter price target for met coal to $120 from $132 per metric ton.“Many investors have been surprised by the lack of volatility in met pricing – with prices effectively unchanged for six months,” Neil Mehta, an analyst with Goldman, said.“We attribute the flatlining of pricing to the role of China, which is significantly less active in the seaborne market, and typically acts as the swing driver of pricing.”Mr Mehta lowered his rating on Peabody to ‘sell’ from ‘neutral’, sending its shares 5 per cent lower to $13.49.Rival Consol Energy declined 2 per cent $37.98 while Arch Coal slipped 5 per cent to $2.65.Goldman becomes the second investment bank this week to downgrade Peabody to ‘sell’ or sell-equivalent, following Nomura.Rite Aid, the third-largest US drugstore chain, cut its full-year profit forecast on Thursday as a number of medications came off patent, weighing on the retailer’s margins.The company, which has about 4,600 stores in the US, said full-year profits would be as much as 25 per cent lower than earlier estimates, ranging between $223m and $333m on sales of $26bn-$26.3bn.Rite Aid had earlier projected sales between $26bn and $26.5bn.Executives with Rite Aid blamed a delay in the introduction of generic version of some medications as well as lower insurer reimbursement rates on the introduction of new generic drugs for the profit warning.Rite Aid shares slumped 19 per cent to $5.41, the worst performing stock on the Russell 1000.Rival Walgreens fell 1 per cent to $63.18 and CVS declined 1 per cent to $81.18.Kohl’s shares climbed after analysts with Citi lifted their rating on the retailer to ‘buy’ from ‘neutral’, as chilly weather and encouraging back-to-school sales lift the company’s third-quarter prospects.“We expect an improved product assortment, loyalty programme leverage and prudent inventory management to drive comp store sales and margins,” Oliver Chen, an analyst with Citi, said.Kohl’s shares rose 2 per cent to $62.50.ConAgra shares led the S&P 500, advancing 5 per cent to $33.48, after the company reported first-quarter profits ahead of Wall Street expectations.The packaged foods producer, which owns the Hunt’s ketchup and Hebrew National hot dog brands, said profits rose to $484.5m in the quarter.When adjusting for certain items, the company said it earned 39 cents a share, two cents ahead of consensus forecasts.Overall, US equity markets climbed to record highs following Wednesday’s Fed decision. The S&P 500 rose 0.5 per cent to 2,011.36 while the Dow Jones Industrial Average advanced 0.6 per cent to 17,265.99.The technology-heavy Nasdaq Composite increased 0.7 per cent to 4,593.42.eric.platt@ft.comTwitter: @ericgplatt
51;KSS;Kohl's Corp;2014-08-14T20:42:41Z;Utilities climb amid appetite for haven assets;;Utilities led a languid trading day as markets digested stagnant European economic activity as a drop in yields on German and US treasuries made the sector comparatively more attractive.Investors shifted back into haven assets, particularly higher dividend-paying equities in the US, and out of higher growth sectors including the technology industry.The reversal into US utilities, including Pinnacle West, Entergy and Exelon, which all climbed more than 1 per cent, followed a difficult quarter for the sector.Since the start of July, utilities have lagged behind all others on the benchmark S&P 500, falling 5.2 per cent.Analysts with Credit Suisse noted that much of the weakness at the end of July related to “market concern over Fed activity and the threat of rising interest rates”.Sluggish activity across Europe, which economists with IHS Global Insight said faced significant growth constraints, and a Federal Reserve cautious of lifting rates amid a fragile recovery, has made utilities more appealing.“Fiscal policy is still generally restrictive, despite increased flexibility over countries’ fiscal targets, and tight credit conditions persist in several countries amid still significant banking sector problems,” said Raj Badiani, European economist with IHS.The Dow Jones Utilities Average advanced 0.8 per cent to 545.91 while the Russell 2000 technology index declined 0.2 per cent to 2,047.88.Shares of Pinnacle West rose 1.8 per cent to $54.35, Entergy climbed 1.5 per cent to $73.01 and Exelon advanced 1.2 per cent to $31.83.Cisco shares were under pressure after the company said it would lay off 6,000 employees, or 8 per cent of its workforce, beginning in its current fiscal quarter as it seeks to trim costs and better compete with rivals.The San Jose, California-based company said it would incur a pre-tax charge of $700m relating to the restructuring.Cisco, like venerable tech giants IBM and Hewlett-Packard, has found difficulty lifting revenues, particularly as emerging markets struggle to maintain economic growth rates seen over the past decade.John Chambers, the Cisco chief executive, highlighted the “economic and geopolitical challenges” in China, Brazil, Russia, Argentina, Turkey and Thailand for some of the weakness.Cisco declined 2.6 per cent to $24.54 while HP rose 0.8 per cent to $35.59.Berkshire Hathaway, the company controlled by billionaire Warren Buffett, soared to $200,000 for the first time on Thursday.The Omaha, Nebraska-based company’s class A shares advanced 1.6 per cent to $202,850 valuing Berkshire at more than $326bn.Kohl’s buoyed the wider department store sector after it said profits exceeded expectations as it trimmed costs and saw an uptick in July sales.The Wisconsin-based retailer said quarterly sales fell 1 per cent to $4.24bn.Profits were little changed at $232m, or $1.13 per share. Analysts on Wall Street had expected earnings of $1.07 a share.Kevin Mansell, chief executive, told analysts on a call that the company saw sales momentum at the start of July, reporting “a positive comp for the first time in several months”.The results followed figures from Macy’s on Wednesday, which fell short of analyst forecasts.Kohl’s shares rose 3.3 per cent to $56.91. Rival Dillard’s edged up 0.2 per cent to $115.60 while JC Penney climbed 4 per cent to $9.74, ahead of stronger results which lifted the stock another 5 per cent to $10.24 in after-market trading.Restaurant chain Noodles & Co tumbled 16 per cent to $21.16 after the company said second-quarter profits and sales missed analyst expectations as same-store sales declined.The company said overall sales advanced 11 per cent from a year earlier to $99.5m as it continued to open new restaurants, while profits climbed to $3.5m, or 11 cents per share.Overall, US equity markets advanced as new figures showed recent jobless claims hovering near pre-crisis levels.The S&P 500 advanced 0.4 per cent to 1,955.18 while the Dow Jones Industrial Average rose 0.4 per cent to 16,713.58. The technology-heavy Nasdaq Composite rose 0.4 per cent to 4,453.eric.platt@ft.comTwitter: @ericgplatt
52;KSS;Kohl's Corp;2014-08-13T16:09:17Z;Department stores slip on Macy’s warning;;Shares in US department store operators slipped after one of the country’s largest chains warned an improving second half would not fully compensate for weakness at the beginning of the year.Macy’s, which also owns the Bloomingdale’s luxury chain, said full year same-store sales – a key measure for retailers – would likely rise between 1.5 and 2 per cent, below initial projections as high as 3 per cent.The bitter US winter eroded first-quarter profits, increasing the importance of the so-called ‘back to school’ shopping period for both Macy’s and its rivals.Terry Lundgren, Macy’s chief executive, said the retailer was approaching the second half with optimism “tempered with the reality that many customers still are not feeling comfortable about spending more in an uncertain economic environment”.Overall revenues for the quarter ended August 2 climbed 3 per cent from a year earlier to $6.2bn. Profits edged 4 per cent higher to $292m, or 80 cents per share. Both figures were shy of analyst estimates.The results coincided with monthly retail sales figures from the Department of Commerce, which fell short of Wall Street expectations.The figures showed virtually no change in overall sales in July from a month earlier but a 0.7 per cent decline in sales at department stores.Analysts with Wells Fargo noted Macy’s had the poor fortune of being the first mall-based retailer to report quarterly results.“Once all have reported, we don’t think Macy’s will seem so bad,” Paul Lejuez, an analyst with Wells Fargo, said. “After all, gross profit dollars increased showing that the company is at least driving sales with its promotions. Not all will be so fortunate.”Macy’s shares slumped 5 per cent to $56.50. Rival Nordstrom declined 1 per cent to $68.06, Sears fell 2 per cent to $35.89, Kohl’s declined 2 per cent to $54.94 and JC Penney slipped 2 per cent to $9.32.Yahoo shares climbed after Alibaba amended an agreement with the parent company of Alipay, the online payment processor it spun off three years ago, that capped the amount of money it could have earned in an initial public offering or other “liquidity event”.In a filing with US securities regulators, Alibaba said it would now receive at least $9.38bn in a liquidity event – representing its stake in Alipay’s parent, Small and Micro Financial Services Company. Alibaba was previously set to receive between $2bn-$6bn.Yahoo, which holds a 22.5 per cent stake in Alibaba, rose 2 per cent to $36.20.Shares in King Digital Entertainment, the UK gaming company, tumbled 23 per cent to $14.00 after it warned that the money players are spending on its flagship game, Candy Crush Saga, has moderated.As a result, King, which was valued at $7bn in its March initial public offering, cut its forecast for gross bookings to between $2.25bn and $2.35bn for the full-year.American Apparel shares slipped 5 per cent to $0.86 after the struggling retailer said sales stalled in the three months to the end of June.The Los Angeles-based company said its loss narrowed to $15m, or 9 cents per share, from $38m a year earlier. Analysts on Wall Street had expected a loss of 6 cents per share in the period.The company said it would also delay filing its quarterly report with US securities regulators to give new board members time to review its financials.Fossil Group, which makes watches for Burberry, Michael Kors and Emporio Armani, along with its own namesake brand, was under pressure after the company said operating margins declined as sales growth fell to its slowest pace since 2012.Second-quarter profits slid 22 per cent to $52.5, or 98 cents per share, as the company continued to invest in new stores.Sales climbed 9.6 per cent to $774m. Analysts had expected profits of $50.5m from sales of $771m.The figures are unlikely to allay concern as competitors prepare to unleash their own smart watches.Apple has marshalled the most attention for its possible entry into the watch market. Morgan Stanley estimates Apple will sell between 30m and 60m watches, generating sales of $9bn in its first year.Shares of Fossil slipped 6 per cent to $96.50.Overall, US equity markets firmed despite softer economic data. The S&P 500 rose 0.7 per cent to 1,946.72 while the Dow Jones Industrial Average climbed 0.6 per cent to 16,651.80.The technology-heavy Nasdaq Composite advanced 1 per cent to 4,434.13.eric.platt@ft.comTwitter: @ericgplatt
53;KSS;Kohl's Corp;2012-11-29T23:44:53Z;Sandy batters sales at US stores;Sales fall despite pick-up in post-Thanksgiving shopping;Superstorm Sandy turned November into a bad month for US department stores as they reported falling sales, despite a pick-up in post-Thanksgiving shopping and modest overall growth across the retail sector.As the disruption caused by Sandy suppressed consumer spending on non-essentials, Macy’s recorded a 0.7 per cent fall in sales at stores open at least a year, its first decline in three years.Terry Lundgren, chief executive of Macy’s, said: “Despite the largest volume Thanksgiving weekend in our company’s history, we were not able to overcome the weak start to the month, which included the disruption of Hurricane Sandy.”Across the retail sector, three-quarters of companies reported sales that fell short of expectations, according to Retail Metrics.The results follow mixed signals from the traditional start of Christmas shopping around Black Friday last week, with ShopperTrak estimating that sales rose a modest 2.7 per cent on the four days from Thanksgiving on Thursday to Sunday.However, online sales surged, according to data from IBM, with double-digit growth.For the whole of November, Kohl’s, a mid-market department store, reported a 5.6 per cent fall in like-for-like sales.At Nordstrom, an upmarket rival, sales were down 1.1 per cent but the company said they had rebounded to historic levels in the second half of the month.Jason Buechel, a senior executive in Accenture’s retail division, noted that in addition to inhibiting consumer spending the superstorm had led to the temporary closure of some stores and disrupted distribution.JC Penney, the department store, whose quarterly sales have been plummeting in the midst of a wrenching transformation, does not report monthly sales figures.At 17 retailers that report monthly figures – excluding drug stores – like-for-like sales rose 1.6 per cent from last November, according to Thomson Reuters.Order Barney Jopson’s startling account of the hidden influence and boundless ambition of Amazon, overlord of a mini-economy that goes well beyond online shoppersThe figure fell short of forecasts of 3.3 per cent growth and led to a 0.5 per cent fall in the New York stock market’s retail index, while equities overall rose 0.4 per cent.Barnes & Noble shares fell 11 per cent after it reported a quarterly profit but slower digital sales growth.While some money that consumers would have spent on discretionary purchases shifted to materials for post-storm clean-up and repair, sector-wide figures suggested this did not have a net positive effect on sales.Shopping patterns in November were also distorted by the US election on November 6, which was preceded by political advertising that raised the price of commercials and drove many retailers off the air.Ken Perkins of Retail Metrics, a research group, said: “We caution not to read too much into these soft numbers given all the disruptions and would look to December as a better gauge of consumer spending.”
