;Ticker;Nombre_Completo;Date_Time;Titular;Subtitular;Texto
87;KSS;Kohl's Corp;2010-11-11T19:03:08Z;Technology stocks lead Wall Street losses;;A cautious outlook from Cisco sent the technology company’s shares tumbling and dragged down US stocks.Cisco dropped 16.2 per cent to $20.52, pulling down the S&P 500 information technology index by 1.8 per cent.The S&P 500 closed down 0.4 per cent at 1,213.54, the Dow Jones Industrial Average lost 0.7 per cent to close at 11,283.10 and the Nasdaq Composite closed 0.9 per cent lower at 2,555.52.The world’s largest maker of computer networking equipment forecast sales and profits lower than analysts had estimated.John Chambers, chief executive, said the company faced a “challenging economic environment” and that it had missed revenue expectations in the quarter because of an unexpected drop-off in spending by the public sector, especially in Europe.It predicted that revenue would grow by 3-5 per cent in the second quarter, much less than the consensus forecast for a 13 per cent increase.Analysts at JPMorgan, who lowered their price target for the stock to $24.50 but kept its “overweight”’ rating, said: “Government spending was a risk but we believe that Cisco guidance indicates that this large part of the global economy, particularly US state and European governments, may be deteriorating rapidly.“Guidance for full-year revenue growth of 9-12 per cent seems ambitious to us considering the speed and severity of this reduction – our new forecast is for 6.4 per cent revenue growth for the full fiscal year.”They added that as Cisco said it was gaining share in seven of its nine largest markets, this was probably an early sign of a wider problem and not Cisco-specific.Brad Thompson, fund manager at Frost Investment Advisors, which owns Cisco shares, said: “We’re taking a pretty close look at it.”“Technology is currently the most consensus trade among institutional investors,” he added. “Everybody is pretty much placing a bet in that space but Cisco is a bellwether with its tentacles in business and government.”Shares in Cisco’s rivals also suffered with Cavium Networks 4.4 per cent lower at $34.53.Mr Thompson said the drop in government spending would affect other parts of the technology supply chain, as well as the money flowing from government to healthcare and defence companies.Among the suppliers, Jabil Circuit gave up 4.6 per cent to $14.40, Altera fell 2.8 per cent to $32.90 and Xilnix was down 3.3 per cent to $26.50.Other technology stocks also slumped with Dell falling 3.9 per cent to $13.93 and Hewlett-Packard losing 2.4 per cent to $43.10.Elsewhere in earnings news, Disney reported late in the trading session. Shares slumped 2.9 per cent to $35.93 after it missed profit estimates in its fourth quarter.Income from pay-TV services for ESPN which last year was recorded in the fourth quarter, came in an earlier quarter this year. This outweighed strong advertising sales and receipts for films including Toy Story 3.Viacom gained 3.1 per cent to $44.59 after it beat analysts’ estimates with its fourth-quarter profit. The owner of MTV Networks and Comedy Central joined other cable operators in reporting results buoyed by higher advertising sales.The popularity of its hit show Jersey Shore helped viewing figures and advertising revenue rose 8 per cent. The company also said it planned to sell Harmonix, the Rock Band music video game developer.In retail, Kohl’s department store chain forecast profits and sales in its fourth quarter that were above some analysts’ expectations. The retailer reported quarterly profit in line with expectations and said it had gained market share. Its shares edged up 0.3 per cent to $52.41.Rival Macy’s reported strong earnings on Wednesday, which buoyed other department store stocks.In financials, Bank of America dropped 1.6 per cent to $12.37 after it said it would sell its right to buy extra shares in a $9.3bn rights issue by the China Construction Bank to the Singapore state investment agency.
88;KSS;Kohl's Corp;2010-11-05T17:52:35Z;US retailers bring sales offers forward;;Leading US retailers have this weekend thrown themselves into a frenzy of early holiday sales offers, three weeks before the traditional start of the US Christmas shopping season on “Black Friday” – the day after the Thanksgiving holiday.From the “Biggest Sale of Them All” at JC Penney, the mid-price department store, to the “Bigger than Black Friday” online event at the discounter Kmart, retail analysts say this year’s weekend deals mark a significant acceleration of pre-Thanksgiving activity, as retailers try to secure an early share of holiday spending.Kathy Grannis, of the National Retail Federation, said that while only a few retailers had tried out pre-Black Friday sales events last year, “it seems it was a hit”. “This is retail, so if something catches on, we certainly better do it again.”Joel Bines, a retail analyst at AlixPartners, said that the holiday shopping season was in effect now under way by the start of November: “Retailers have recognised that once the air starts getting chilly, people seem to be ready to think about their holiday shopping.” Black Friday is so named because it once marked the day when the holiday shopping rush pushed retailers’ ledgers into positive territory.This weekend has seen a particularly intense battle over consumer electronics, one of the most popular gift categories.Walmart, the largest US retailer, has launched a two-day sale with price cuts of more than 25 per cent on laptops, video games and high-definition televisions.Best Buy, the largest electronics retailer, has countered with a two-day sale. Amazon, the online retailer, started its offers last weekend but has thrown in a two-day electronics sale this weekend to match Best Buy and Walmart.The onslaught of bargains also includes techniques traditionally associated with Black Friday such as early opening and offers that only last until lunchtime. JC Penney is offering 60 per cent off selected items before 1pm on Saturday, while rival Kohl’s opened an hour earlier at 6am on Saturday for its three-day “Power Shopping Sale” and will stay open an hour later until midnight.Some stores are also hoping they will be able to get customers who shop early to come back before Christmas.Victoria’s Secret, the lingerie store owned by Limited Brands, is distributing gift cards to anyone who spends more than $10 in November, valid only during the first 19 days of December. The battle for sales comes against sluggish overall consumer demand, with the NRF forecasting that retail sales in November and December will rise by 2.3 per cent against last year.
89;KSS;Kohl's Corp;2010-11-04T20:54:32Z;Financials lead sector gains in US stocks;;Financials, materials and energy shares led US stocks to their highest levels in two years as investors cheered the Federal Reserve’s decision to extend quantitative easing.All 10 main sectors of the S&P 500 rose with nine up more than 1 per cent.The S&P 500 closed up 1.9 per cent to 1,221.04, the Dow Jones Industrial Average had gained 2 per cent to close at 11,434.77 and the Nasdaq Composite closed 1.5 per cent higher at 2,577.34.The dollar weakened and commodity and oil prices rose, helping the energy sector to add 3 per cent and the materials sector to advance 3.3 per cent.ExxonMobil soared 2.1 per cent to $69.38 and Chevron climbed 3 per cent to $85.14. Cliffs Natural Resources jumped 4.7 per cent to $70.00 and Freeport-McMoRan Copper & Gold surged 7 per cent to $103.89.Stephen Wood, chief market strategist for North America at Russell Investment, said stocks could rally into the end of the year as diminished uncertainty after quantitative easing, the midterms and stabilising jobs and housing data helped investor confidence.“Cyclicals like energy and materials are very good suspects for leading markets [where as] financials have a lot of question marks like Basel III and Dodd-Frank,” he said.He added that natural resources stocks were soaring partly due to quantitative easing but also because of expectations that China would end its tightening cycle in the first half of next year.The financials rallied later in the session, up 3.4 per cent, after it was reported that the Federal Reserve might allow banks with strong capital levels to increase dividends. The two biggest banks by assets led the risers. Bank of America jumped 5.2 per cent to $12.12 and JPMorgan Chase shot up 5.5 per cent to $39.80.Meanwhile, the S&P 500 retailers index rose 1.7 per cent, lifting the wider consumer discretionary sector by 1.6 per cent as retailers reported their October same-store sales.Gap, Target and Macy’s all beat expectations. Gap jumped 6.1 per cent to $20.43, Target climbed 1.5 per cent to $54.76 and Macy’s gained 6.6 per cent to $25.56.Even shares in Kohl’s, where same-store sales fell and the retailer lowered its third-quarter outlook, rose 2.3 per cent to $51.92.Some retailers also reported their quarterly earnings. Limited Brands, which owns the Victoria’s Secret chain, advanced 5.3 per cent to $31.43 after it beat estimates. Shares in Limited Brands have risen 68.2 per cent this year.In food retail stores, Whole Foods rocketed 15.1 per cent to $47.27 after the upmarket grocer raised its 2011 profit forecast and beat expectations in its fourth quarter. Same-store sales rose 8.7 per cent as customers dipped into their pockets for more organic and gourmet foods.At the other end of the spectrum, Costco, the warehouse club operator, said its same-store sales rose 6 per cent in October. Its shares were higher by 3.7 per cent to $65.48.News Corp, the owner of Fox News and newspapers around the world, beat expectations as advertising recovered. Revenue grew 17 per cent at Fox News after it led the cable news ratings, helping to increase operating income at the division by 23 per cent. But its shares edged down 0.6 per cent to $14.75.Cable operators also beat expectations with their quarterly earnings as they added more internet and phone subscribers.Time Warner Cable said it added more internet customers even though the number of basic video subscribers fell. Revenue and profit rose and the company said it would launch a $4bn share buy-back programme. Its shares advanced 4.5 per cent to $62.33.Cablevision Systems also reported better-than-expected results. Its shares jumped 2.6 per cent to $28.36.US-listed shares in PotashCorp dropped 2.4 per cent to $141.97 after the Canadian government rejected BHP Billiton’s $39bn bid. Potash shares have risen 29.2 per cent this year as the Australian miner has pursued the company. BHP Billiton, which added 6 per cent to $91.20, has 30 days to appeal.
90;KSS;Kohl's Corp;2010-10-08T22:46:57Z;Pershing and Vornado reveal JC Penney stake;;"Pershing Square, the activist investor fund run by Bill Ackman, and Vornado, the real estate investment trust, have acquired control of a combined 26.7 per cent of JC Penney, in a challenge to the management of the mid-range US department store.Pershing Square said on Friday it had control of 16.8 per cent of the department stores shares, making it the retailer’s largest shareholder, while Vornado said in separate regulatory filing that it had acquired a 9.9 per cent stake. Both said they planned to cooperate and would hold talks with management on issues including finances and strategy.Wall Street analysts said the combined move is likely to focus attention on JC Penney’s real estate assets.Mr Ackman fought an unsuccessful proxy battle with the management of Target three years ago, after proposing spinning off the discount retailer’s extensive real estate holdings into a separate real estate investment trust.Vornado’s significant retail moves have included taking part in the private equity buy-out of Toys R Us in 2006, and supporting the 2005 merger of Sears and Kmart by Eddie Lampert, the hedge fund billionaire.JC Penney, founded in 1902, operates more than 1,000 department stores that are mainly based in regional shopping malls and are aimed at middle-income customers.Under Mike Ullman, chief executive since 2004, the retailer has focused on differentiating itself from competition from lower price retailers such as Target and
Walmart by evolving a successful private label strategy.It has also faced intense rivalry from Kohl’s, a rapidly expanding chain that has successfully developed off-mall locations, while JC Penney’s stores have been hit by overall declines in traffic levels at regional malls.The retailer is set to unveil a new partnership with Mango, the European fast fashion brand, and is expanding a network of Sephora-branded beauty and cosmetic store-within-a-store units.In the filing, Pershing said it had begun building its JC Penney stake in mid-August, took a break in early September and then resumed buying at the end of the month before finishing on Thursday. Vornado started building its stake at the end of September, and also finished on Thursday.Most of Pershing’s shares were accumulated when the retailer’s stock was trading around $20. Its shares have risen sharply this month, and closed on Friday up over 2 per cent at $32.49.Mr Ackman’s recent investments have included General Growth Properties, one of the largest owners of US shopping malls, where he backed an $8.5bn recapitalisation plan to help the company emerge from bankruptcy. He is also a significant shareholder in Borders, the second largest US bookstore.Pershing manages about $7bn. It also said on Friday it had acquired an 11 per cent stake in Fortune Brands, a company whose brand portfolio includes the Jim Beam bourbon, home security, kitchen cabinets, and gold products."
91;KSS;Kohl's Corp;2010-10-07T14:42:15Z;Late back-to-school buying lifts retail sales;;US chain retailers reported broadly better-than-expected store sales during September, supported by last minute back-to-school and college shopping that boosted teen and youth retailers in particular.Ken Perkins of Retail Metrics, which tracks the monthly figures, said its index of same store sales rose 2.7 per cent in September. He cited strong back-to-school selling “coupled with attractive fall fashions, aggressive promotions and a near-record September stock market rise” as factors supporting the performance.Limited Brands, whose store brands include Victoria’s Secret, Pink and Bath & Body Works, reported a 12 per cent increase in sales at stores open at least a year, with margins up “significantly” as the company avoided the price-cutting promotions seen last year.Macy’s, the largest traditional department store chain, said same store sales rose 4.8 per cent. Terry Lundgren, chief executive, said the back-to-school period was “one of our most successful in years”. He highlighted the performance of its Material Girl teen clothing collection, a joint venture with Madonna, and its American Rag clothing for teen boys.JC Penney said its sales rose 5.1 per cent, ahead of expectations. Its rival Kohl’s saw comparable sales up 3 per cent. Kohl’s said on Wednesday that it would increase its temporary holiday staff hiring this year by 20 per cent, reflecting new store additions and increasing confidence in holiday demand.Luxury and high-end stores also performed well, with Neiman Marcus reporting same store sales up 4.7 per cent, Nordstrom up 7.5 per cent and Saks up 6.5 per cent.Michael Niemira, chief economist at the International Council of Shopping Centers, said the strong performance of higher-end spenders was “especially encouraging for the economy and the upcoming holiday-shopping season because the top 20 per cent of households by income account for nearly 40 per cent of total consumption”.Several teen and youth fashion retailers who have struggled over the past year with sluggish discretionary spending also fared better than expected. Abercrombie & Fitch reported a 13 per cent increase in sales at stores open at least a year. Zumiez, a teen retailer, said its same store sales rose 17 per cent, and raised its earnings guidance for the quarter. Buckle and Aeropostale both saw comparable sales up 3 per cent.But Target, the discount retailer, said its 1.3 per cent increase in comparable sales was lower than it had expected, despite being pleased with its back-to-school performance. Walmart, the largest US retailer, does not report comparable sales on a monthly basis.Gap, the largest US clothing retailer, reported a 1 per cent drop in same store sales, saying that September had been more challenging that it had expected.Sales at its Gap stores in North America fell 1 per cent, despite efforts to draw sales with a large marketing focus on black denim pants that the company said would increase inventory levels. Gap’s lower-price Old Navy stores reported a 5 per cent drop.Costco, the warehouse club, said on Wednesday that its same store sales rose 5 per cent, also slightly above Wall Street’s expectations, although US store sales excluding fuel were slightly below forecasts, at 2 per cent.
92;KSS;Kohl's Corp;2020-04-25T23:17:40+0000;Retail: Digital-savvy shoppers drive change;;Best Buy, the largest US electronics retailer, is testing a system that sends messages about special offers to customers’ mobile phones when they enter its stores.Kohl’s, the mid-price department store, is rolling out in-store touch screen kiosks that will allow customers to order online items that are not available in the store.JCPenney, its rival, is moving towards the launch of a mobile e-commerce platform, and has just upgraded its website search system.Walmart, the international retail group, is creating a global e-commerce platform.Customer demand may still be sluggish after the recession of the past two years, but US retailers have been continuing to spend money on technology aimed at their customers.“Retailers have maintained as spending priorities anything that may enhance the customer relationship or experience,” says Nikki Baird, of Retail Systems Research, a consultancy that specialises in retailers’ information systems. “Everything else has struggled.”The current spending on customer-facing technology is supported by the need, in a slow-growth economy, to deliver increased sales by luring shoppers away from rivals, says Ms Baird. But it also reflects a significant shift in the traditional world of retail technology.Instead of introducing customers to technology aimed at increasing operational efficiency, such as bar codes, or electronic payments, retailers are now struggling to stay abreast of the technology at the fingertips of their customers.Shoppers equipped with smartphones can now use tools from the online world in-store. They can check prices at rival stores and look for independent product reviews. They can use their phones to receive digital offers, and increasingly to access payment systems and complete transactions.But dealing with the digitally equipped “multichannel” shopper is presenting challenges for the industry that go well beyond what the customer sees in the store.“It may start with the customer,” says Ms Baird. “But as soon as we go down that path, there are questions to do with business models, supply chain design, how you compensate stores for online sales that happen at an [in-store] kiosk. These are big issues for a retailer.”“It’s not just about integrating channels, it is about changing your business model, and no one wants to hear that.”For retailers, the challenges of creating a single customer experience both online and in stores can encompass basic considerations such as ensuring the prices or offers are the same whether the customer is buying in a shop or via the internet.In one of the most radical responses to the challenge, Moosejaw, a small outdoor equipment retail chain based in Michigan, has done away with a separate computer system for its point-of-sale devices.Instead, the in-store machines connect to the same IBM Websphere Commerce database as its e-commerce site, which is also used by its call-centre sales staff. The system also operates a loyalty reward scheme – the customer’s purchase history is accessible in all channels. “All the channels are updated in real time and can each offer the exact same features,” says Gary Wohlfeill, Moosejaw’s creative director.With just seven stores, Moosejaw’s multichannel transformation was relatively straightforward.At the other end of the scale, Tom Nealon, chief information officer at JCPenney since 2006, is overseeing the creation of a digital platform for the retailer, which has more than 1,000 stores and sales of $17bn last year. The platform, he says, will eventually encompass “all the main pro­cesses you need to run any business”.“Traditionally, a digital platform is certainly customer-experience kind of stuff,” he says. “But even there, we take it deeper into order management, fulfilment, enterprise planned allocation, customer analytics. It is really quite comprehensive.”Initially, JCPenney’s online business – worth more than $1bn annually – was largely built on its “big book” catalogue business, which presented customers with more conservative products than its stores.The shift to a single buying system and fully-aligned merchandise meant that some sales were lost in the trans­ition, with the old big book catalogue finally discontinued this year.Mr Nealon says the introduction of the new technology has largely followed rather than led those organisational changes, which he said were “a huge first step”.Once the new teams started working together, “that’s when you started to see what the process needs were, and how you were going to build the technology out.”The first part of the e-commerce platform to be launched will, however, be its mobile e-commerce capability – an area that is gaining attention from a range of leading retailers, including Walmart, Target, Best Buy and Sears Holdings.But, while most now have mobile phone applications that allow customers to browse their website or locate stores, they provide “brand-building” and information, rather than mobile transactions, which require a full digital platform.“Mobile has become a huge priority just in the past eight or nine months,” says RSR’s Ms Baird. “The CIOs I’ve talked to say that, while they are throwing out customer-facing applications, they are frantically working on the back-end to be able to support them in an efficient, sustainable and leverageable way.”Smartphone apps, says Mr Nealon, raise the question “to what degree do you intend to transact business through that application?”“That’s where the new digital platform comes in. You actually have to have the order management, fulfilment and the pricing capability [to support mobile transactions]. That’s what we’re building out right now.”
