;Ticker;Nombre_Completo;Date_Time;Titular;Subtitular;Texto
44;MPC;Marathon Petroleum Corp;2012-01-06T22:00:11Z;US stocks start year on front foot;Strong US data buoy markets;US stocks started the year on an upbeat note as economic data continued to surprise on the upside.By the close yesterday, the S&P 500 was 1.8 per cent higher over the week at 1,280.68, breaking above its 200-day moving average, an indication some investors think the rally has further to run.After opening lower on Wednesday and Thursday, the benchmark index turned positive each day as stocks gathered momentum, almost repeating the trick on Friday but closing down slightly.“At open, the market is still dominated by European fears,” said Ryan Detrick, chief technical strategist at Schaeffers Investment Research. “But it’s a positive sign that bulls are tending to take charge on the realisation that the US economy appears to be improving faster than expected.”The Dow Jones Industrial Average produced a weekly gain of 1.2 per cent at 12,359.92, while the tech-heavy Nasdaq Composite index was up 2.7 per cent to 2,674.22.Stocks along the hard disk drive supply chain rallied on higher than expected fourth-quarter shipments. Seagate Technology said it had dispatched 47m hard disk drives in the three months to January in a sign that flooding in Thailand affected production less than expected. Seagate climbed 11.6 per cent to $18.30, while rival manufacturer Western Digital rose 8.2 per cent to $33.49.Semiconductor manufacturers LSI Corp, up 12.9 per cent to $6.72, and Micron Technology, up 14.5 per cent to $7.21, rallied in anticipation of stronger demand for computer memory chips.Bank of America climbed 11.2 per cent to $6.18, topping $6 for the first time since November, on the back of its strongest one day gain since October on Thursday. Analysts struggled to explain the stellar performance, which came as Citigroup analysts slashed earnings estimates for BofA, citing costs to settle mortgage-related lawsuits. Some suggested arbitrageurs might be buying BofA shares after the cost of protecting against a default by the bank fell in December without a corresponding rally in the stock price.Talk of a possible government plan to boost the housing market sent shares in homebuilder PulteGroup up 12.5 per cent to $7.10.It might also have helped large mortgage lenders outperform – SunTrust was up 11.6 per cent to $19.75 and Hudson City Bank, a New Jersey-based mortgage lender, rose 9.3 per cent to $6.83. But investment banks, which do not originate mortgage loans, lagged behind the pack.Goldman Sachs was up just 3.3 per cent to $93.42 while Jefferies climbed only 0.7 per cent to $13.85. Douglas Sipkin, of Ticonderoga Securities, slashed his quarterly earnings forecast for Goldman to 97 cents a share from $4.12 and tipped Morgan Stanley for a 59 cents a share loss, citing the weak trading environment.But Mr Sipkin said US investment banks could benefit from “widening bid- ask spreads, driven by the major retrenchment of European competitors”.CME Group, the largest US exchange by market capitalisation, fell 4 per cent to $234.00 and IntercontinentalExchange was off 4.6 per cent to $115.01 as JPMorgan analysts downgraded both exchanges to neutral, arguing that the companies’ estimates appeared optimistic and might have to be revised down.MasterCard fell 8 per cent to $342.92 as Janney analysts said the “secular shift from paper [money] to card [spending]” may be complete, and removed its “buy” recommendation on the stock as well as Visa.Chesapeake Energy climbed 7.6 per cent to $23.98 after concluding a $2.3bn joint venture with French oil giant Total and EnerVest for shale gas and oil exploration in Ohio.Investor reaction was initially muted but the stock rallied late in the week, when the company said it had used JV revenues to reduce debt by $1.4bn to $10.3bn in the fourth quarter.Devon Energy was up 4.4 per cent to $64.75 after concluding its own $2.5bn shale joint venture with China’s Sinopec. But refiners sold off sharply after Tesoro said it could post a fourth-quarter loss of up to 80 cents a share because of collapsing margins. Tesoro fell 1.8 per cent to $22.95 followed by rivals Marathon Petroleum, off 4.9 per cent to $31.66, and Valero Energy, down 3.2 per cent to $20.37.Tesoro cited the narrowing of the Brent-WTI spread from $26 a barrel to $8 a barrel over the quarter, which cut margins at its mid-continent refineries, which account for 17 per cent of capacity and have benefited from access to cheaper WTI.Holiday sales reporting from US retailers drove stocks in different directions were mixed. Gap fell 3 per cent to $18 after December sales came in 4 per cent lower than the previous year. Ross Stores, the discount clothing chain, rose 6.8 per cent to $50.74 on a 9 per cent increase in same-store sales that easily beat the consensus analyst forecast of 4.2 per cent.Barnes & Noble slumped 19.9 per cent to $11.61 after the company said it was considering a sale of its Nook e-reader business.Netflix climbed 22.3 per cent to $84.70 after the company said subscribers streamed 2bn hours of video on its website in the fourth quarter, although it did not provide data from previous quarters for comparison.Alcoa climbed 6 per cent to $9.17 over the week, before it kicks off fourth quarter reporting season on Monday.But the stock slipped 2 per cent on Friday after the aluminium producer said it was cutting global capacity by 12 per cent and idling smelters in response to falling aluminium prices. Several analysts are predicting a quarterly loss for the company on Monday.
45;MPC;Marathon Petroleum Corp;2012-01-05T22:31:57Z;US oil refiners in sharp sell-off;;US oil refiners sold off sharply after Tesoro said it could post a fourth-quarter loss of up to 80 cents a share because of collapsing margins.Tesoro fell 5.9 per cent to $22.60 followed by rivals Marathon Petroleum, off 5.5 per cent to $31.92, and Valero Energy, down 3 per cent to $19.81.The rising price of California crude turned a third-quarter discount of $6 a barrel into a premium of 5 cents a barrel at Tesoro’s California refineries, which account for 40 per cent of its output.The group cited the narrowing of the Brent-WTI spread from $26 a barrel to $8 a barrel over the quarter, which cut margins at its mid-continent refineries, which are 17 per cent of capacity and have benefited from access to cheaper WTI.“The level of weakness at Tesoro was unexpected and investors have taken it as a signal to exit all refiners,” said Fadel Gheit, an analyst at Oppenheimer.Elsewhere, US stocks reversed early losses to end the day in positive territory, with banks leading. Bank of America climbed 8.6 per cent to $6.31, topping $6 for the first time since November, on its best one day gain since October.Analysts struggled to explain the stellar performance, which came as Citigroup analysts slashed their profit estimates for BofA citing costs to settle mortgage-related lawsuits.Some suggested arbitrageurs might be buying BofA shares after the cost of protecting against a default by the bank fell in December, without a corresponding rally in the stock price.Talk of a possible government plan to boost the housing market sent shares in homebuilder PulteGroup up 7.7 per cent to $7.04.That may also have helped large mortgage lenders outperform. SunTrust was up 5.4 per cent to $19.66, and Regions Financial climbed 4.2 per cent to $4.52, while some investment banks, which do not originate mortgage loans, sat out the rally. Goldman Sachs slipped 0.2 per cent to $94.58.The S&P 500 remained above its 200-day moving average for a third day, a sign of bullish sentiment, while Goldman Sachs reported that one-month realised correlation between the S&P 500 and its sectors, excluding financials, has fallen to its lowest level since August. That is an indication that macro concerns, which tend to shift all stocks in the same direction and increase realised correlation, weighed less on US investors in December.The Dow Jones Industrial Average closed off a fraction at 12,415.70.The tech-heavy Nasdaq Composite index climbed 0.8 per cent to 2,669.86, as stocks along the hard disk drive supply chain rallied after Seagate Technology said fourth quarter shipments had been strong, a sign that flooding in Thailand affected production less than expected.Seagate climbed 6.4 per cent to $17.90 as it raised guidance, while rival hard disk drive manufacturer Western Digital climbed 4.7 per cent to $32.76.LSI Corp, which makes semiconductors used in hard drives, rose 7.7 per cent to $6.70 as Betsy Van Hees, analyst at Wedbush securities, recommended clients buy the stock on the Seagate results.Holiday sales reporting from US retailers drove stocks in different directions. Gap fell 3.2 per cent to $18.27 after December sales came in 4 per cent lower than the previous year. Ross Stores, the discount clothing chain, climbed 5.9 per cent to $50.42 on a 9 per cent increase in same-store sales that easily beat the consensus analyst forecast of 4.2 per cent.JC Penney fell 2.7 per cent to $33.97 after the department store chain lowered fourth-quarter profit guidance to 70 cents a share from above $1 a share, while Constellation Brands, which sells imported wines and beers, fell 6 per cent after slightly missing earnings estimates.Barnes & Noble slumped 17.1 per cent to $11.24 after the company said it was considering a sale of its Nook e-reader business.Consumer discretionary stocks had led the S&P 500 on Wednesday as investors piled into the sector in anticipation of strong December sales, which overall were up 3.6 per cent year on year, according to data from Retail Metrics. “It’s not surprising to see investors buy the rumour and sell the news,” said Richard Jaffe, retail analyst at Stifel Nicolaus.Shares in seed maker Monsanto rose 5.5 per cent to $76.68 as the company posted strong earnings, boosted by rising demand from South America.MetroPCS slumped 8.9 per cent to $8.01 as the mobile phone network’s pace of growth slowed. The company added 197,000 subscribers in the last three months of 2011, a third lower than the same period in 2010, and substantially beneath analysts’ expectations.Fertiliser manufacturer Mosaic climbed 1.9 per cent to $53.30 as the company posted solid results and said the prices for phosphate-based fertilisers had bottomed following output cuts and a rally in grain prices.
46;MPC;Marathon Petroleum Corp;2011-12-06T21:59:31Z;US stocks steady despite warning on EFSF;;Shares in Darden Restaurants tumbled 12.4 per cent to $41.82, as steep discounts failed to attract customers to its flagship Olive Garden chain in November.Same-restaurant sales at Olive Garden, which brings in almost half of Darden’s total sales, fell 5.7 per cent in November, a third straight month of declines, triggering a reappraisal of the stock by analysts.“When concepts lose their resonance with customers it doesn’t come back quickly,” said Rachel Rothman, a retail analyst at Susquehanna Financial, who had a “buy” recommendation on the stock before Tuesday’s announcement.“Turnrounds generally take not just a few quarters, but over a year,” she added.Restaurant stocks have benefited from solid consumer spending so far this year, and analysts stressed Darden’s woes were company specific, as other consumer discretionary stocks escaped unharmed.Elsewhere, US indices were broadly flat, despite Standard & Poor’s warning that the eurozone’s bail-out mechanism, the European Financial Stability Facility, could face a rating downgrade, once a review of eurozone sovereigns is complete.The S&P 500 edged up 0.1 per cent to 1,258.47, and the Dow Jones Industrial Average climbed 0.3 per cent to 12,150.13. The Nasdaq Composite index slipped 0.2 per cent to 2,649.56.“The tape doesn’t lie,” said Quincy Krosby, market strategist at Prudential Financial. “A knock to the EFSF rating had already been discounted by the market. If anything it’s a further catalyst for a positive conclusion to the eurozone summit at the end of the week.”MetroPCS was the standout performer in the S&P 500, gaining 7.8 per cent to $8.87, as Braxton Carter, the mobile phone network’s chief financial officer, told an investor conference that the company was considering bidding for new spectrum to meet the growing demand of a data-hungry customer base.“Store traffic has been very strong for MetroPCS so we expect good gross customer additions for the quarter,” said Kevin Smithen, telecom analyst at Macquarie. “The unknown is what the churn rate is going to be, its impossible to estimate how many customers are leaving.”Rival Sprint Nextel fell 1.5 per cent $2.61, as its wireless network provider Clearwire said it would issue new shares to raise $595m in new capital.Last week Sprint had committed to maintain its 54 per cent stake in Clearwire, meaning it must stump up around $300m of the capital raise.The dilution impact of the new share issuance sent Clearwire shares tumbling to as low as $2.09, but the stock closed up 11.1 per cent to $2.50.“Clearwire shares trade around the probability of bankruptcy, and that has been alleviated incrementally by the funding component,” said David Dixon, telecom analyst at FBR Capital Markets.Fertilisers were among the other big movers, after Norway-based Yara, the world’s largest nitrogen-based fertiliser producer, said demand would be strong next year, as high commodity prices provided farmers with an incentive to apply.CF Industries, the second largest nitrogen-based fertiliser company, climbed 4.3 per cent to $146.82. Potash producers Mosaic and PotashCorp were up 3.4 and 3.9 per cent to $53.19 and $43.54 respectively.Yara’s guidance comforted the industry, which has been rocked in recent weeks by fears that the weak rupee would lead Indian farmers to cut back on fertiliser imports or demand price discounts.Petrol refiner Tesoro lost 6.1 per cent to $23.31 after Credit Suisse analysts changed their guidance on the stock to “neutral”.Analyst Edward Westlake remained upbeat on the refining sector, but said other companies such as Marathon Petroleum offered more compelling value.“A lack of dividend support [at Tesoro] leaves the shares more vulnerable to short term movements in margins and compressing free cash flow in 2012,” he told clients.Marathon shares climbed 0.7 per cent to $34.64.Halliburton was rocked by BP’s allegations that the oilfield services company had intentionally destroyed evidence relating to the Deepwater Horizon disaster in the Gulf of Mexico last year.The stock slipped 3.9 per cent to $35.57.Regional banks took a hit after Deutsche Bank said they may need to cut costs by as much as ten per cent to meet efficiency targets if revenues do not meet targets. SunTrust Banks fell 6.4 per cent to $18.03, Regions Financial declined 3.5 per cent to $4.16 and First Horizon was off 4.4 per cent to $7.43.LinkedIn Corp climbed 4.7 per cent to $73.20 after Morgan Stanley recommended clients buy shares in the professional-networking website, arguing its valuation was compelling, after steep falls in the share price in recent weeks.Eli Lilly climbed 3.9 per cent to $38.86 after Sanford Bernstein analysts said the current valuation assumed “extraordinarily low” expectations for the success of the group’s Alzheimer’s treatments. Tim Anderson, an Sanford Bernstein analyst said Eli’s market capitalisation could double if its latest Alzheimer’s drug, Solanezumab, proved successful.3M climbed 1.5 per cent to $82.13 after the maker of Scotch Tape and Post-it Notes forecast 2012 earnings would be $6.25 to $6.50 a share, compared with the average analyst estimate of $6.27.
47;MPC;Marathon Petroleum Corp;2011-11-16T22:03:17Z;Eurozone contagion fears drive US bank sell off;Midwestern refiners hit by narrowing Brent-WTI spread;A warning from Fitch Ratings that US banks are vulnerable to contagion from the eurozone debt crisis trigerred a late sell-off on Wall Street.“Unless the eurozone debt crisis is resolved in a timely and orderly manner, the broad outlook for US banks will darken,” Fitch analyst Joseph Scott wrote.The financial sector of the S&P 500 tumbled 2.5 per cent, led down by Morgan Stanley, which fell 8 per cent to $14.66.Goldman Sachs fell 4.2 per cent to $95.60, Citigroup was off 4.1 per cent to $26.86, Bank of America fell 3.8 per cent to $5.90, and JPMorgan fell 3.8 per cent to $31.47.In another sign of rising financial contagion, the two year interest rate swap spread over Treasuries, which is seen as a proxy for US bank counterparty risk, rose above 50 basis points for the first time since May 2010.Earlier, the S&P 500 had moved slightly positive, as soild industrial production and housing market data added to a sense that US markets were shaking off eurozone shackles. But the benchmark US index eventually closed down 1.7 per cent to 1,236.92.“Its very frustrating. We’re trying to shift back to a US-centric analysis, but this Fitch report has brought the eurozone back into focus,” said Phil Orlando, chief investment officer at Federated Investors.The Dow Jones Industrial Average was off 1.6 per cent to 11,905.97, and the Nasdaq Composite index fell 1.7 per cent to 2,639.61.Elsewhere on Wednesday, companies along the hard drive supply chain were given a boost, after Western Digital Corp, the single largest manufacturer, said it had reached a deal with Japanese electronics manufacturer TDK to buy “heads” – a crucial component in hard drives, which Western Digital has had trouble manufacturing since it closed factories due to flooding in Thailand last month.Western Digital shares closed up 7.1 per cent to $26.82, also boosted by a report that the European Commission will clear the company’s bid to acquire Hitachi’s hard drive unit.“This is a big deal as heads were the biggest challenge to restarting production,” said Jayson Noland, a tech analyst at Robert W Baird, “but it’s impossible to quantify the impact until we get details on the deal from Western,” he cautioned.Quarterly results from Dell were more sobering for the sector, with revenue from sales of personal computers, still the single largest source of demand for hard drives, falling 4 per cent year-on-year.Dell shares were off 3.2 per cent to $15.13, although some analysts were encouraged by signs of strong growth in storage and enterprise services.“The company seems to be executing its plan to transform into higher value and higher margin areas,” said Jeffrey Fidacaro at Susquehanna.Semiconductor manufacturer Micron Technology surged 23.4 per cent to $6.74, after a jury dismissed claims that the company had colluded with Korean firm Hynix Semiconductor to fix the prices of computer memory chips.The case had been brought by Rambus, a tech innovation company, which had been seeking more than $4bn in damages.The market capitalisation of Rambus, which relies on aggressive litigation to protect its patent rights, collapsed, falling more than 60 per cent to $7.11.“Following two key legal losses, which we believed were the cornerstone to our investment thesis in Rambus, we are now recommending investors exit positions,” Jeff Schreiner, an analyst at Capstone investments, told clients as he dropped coverage of Rambus after the decision.Midwestern oil refiners took a hit, as the discount of WTI crude oil to Brent crude shrunk to its lowest in more than six months.Western Refining Inc fell 13.5 per cent to $13.42, and CVR Energy tumbled 16.3 per cent to $18.38. Both companies are almost exclusively dependent on WTI, which has sold at a steep discount to Brent for most of the year, as transport constraints created a supply glut at the WTI terminal in Cushing, Oklahoma.News that Canadian firm Enbridge will allow WTI crude to flow to the Gulf Coast from Cushing through a newly acquired pipeline next year erased much of that discount.Even refiners with a small exposure to WTI were significantly affected.Shares in Tesoro fell 6.9 per cent to $25.00. WTI only accounts for 20 per cent of Tesoro’s crude, but Citigroup had expected that output to produce 60 per cent of 2012 earnings because of the lower input costs.The share prices of refiners with as little as 15 per cent exposure to WTI crude, such as Valero Energy, have seen strong correlation with the Brent-WTI spread this year, at least until August, when they were caught up in the wider market sell off. Valero fell 9.3 per cent to $22.56 on Wednesday.Abercrombie & Fitch plunged 13.6 per cent to $48.10, after third-quarter results badly disappointed analysts. Earnings per share of 56 cents were a full 15 cents lower than the average analyst expectation in a Bloomberg poll.Autodesk rose 4.5 per cent to $35.58, after the design software maker reported third-quarter profit of 44 cents a share, exceeding analyst estimates, despite worries about that business would cut back on spending given global growth concerns.
48;MPC;Marathon Petroleum Corp;2011-11-09T22:13:59Z;US stocks drop on further eurozone woes;S&P 500 and Nasdaq turn negative for 2011;US stocks closed sharply lower on Wednesday, with financials bearing the brunt of a Europe-inspired sell-off as the S&P and Nasdaq Composite turned negative for 2011.The financial sector of the S&P 500 fell 5.4 per cent in response to reports that European leaders may allow the eurozone to break up.As analysts put out notes examining individual banks’ exposure to Italy, whose sovereign bonds had hit euro-era highs in the morning session, Jefferies fell 10.1 per cent to close at $11.18. The New York-based investment bank, which is a market-maker in Italian government bonds, spent last week battling to reassure investors about its exposure to eurozone debt.Morgan Stanley fell 9 per cent to $15.76, once again suffering more than other big US banks, as filings showed it had recently carried $1.79bn in net exposure to Italy, after hedges.Goldman Sachs was off 8.2 per cent to $99.67 after the bank said it had $2.3bn of exposure to the Italian government, of which all but $700m is hedged, generally with investment-grade counterparties.Among the commercial banks, Citigroup fell 8.2 per cent to $28.85 and Bank of America was off 5.7 per cent to $6.16.Credit default swaps on US banks also moved upwards on Wednesday. The cost of default protection on Morgan Stanley’s debt rose 50 basis points to 445bp, according to data from Markit. That equates to $445,000 a year to insure $10m of Morgan Stanley debt for five years, but is still well off the 584bp seen at the start of October.The S&P 500 closed at 1,229.1, down 3.7 per cent for its worst daily performance in three months, and decisively back into negative territory for the year.The Nasdaq Composite slipped 3.9 per cent to 2,621.65, in negative territory for the year for the first time in more than a week.General Motors, plunged 10.9 per cent to $22.31 after the Detroit carmaker posted a quarterly net profit of $1.7bn, 15 per cent lower than the same period last year, and said it would not break even in Europe this year.Software maker Adobe Systems was down 7.7 per cent to $28.08 after the company cut its 2012 revenue forecast and said it would axe 750 jobs at a cost of up to $78m in the fiscal fourth quarter.The company is to reduce its focus on enterprise software for governments and businesses, and stop adapting its Flash Player software for mobile devices and tablets, calling time on a long battle to persuade the likes of Apple to adopt Flash.“A year ago Adobe would have said Flash was critical to the company’s future,” said Chris Hickey, software analyst at Atlantic Equities, from Adobe’s analyst day in New York. “But Flash-specific products only make up a small percentage of revenues, and I think the sell-off in the stock is overdone.”All 30 companies in the Dow Jones Industrial Average were down – an alarming sign of stocks moving in lockstep in response to macro news from Europe.The blue chip-heavy index fell 3.2 per cent to 11,780.87, with China-exposed stocks among the biggest fallers. Alcoa was down 5.4 per cent to $10.20 and Caterpillar fell 4.4 per cent to $91.64, as fears grew that the eurozone crisis is leading banks to tighten lending in Asia.Hewlett-Packard fell 5.4 per cent to $26.33 after a conference call with Meg Whitman, chief executive, failed to clarify whether the company plans to sell its webOS platform.A sale of the software, which was purchased from Palm for $1.2bn in 2010 to run on HP’s failed tablet offering, would probably mean the company accepting a loss.Computer Sciences Corp plunged 15.4 per cent to $27.90 after slashing its full fiscal year earnings forecast to a range of $4.05 to $4.10 a share. It had predicted earnings in the range of $4.70 to $4.80 per share in August.The IT outsourcing company is heavily dependent on US government contracts, and blamed “federal budget uncertainty”, for its lowered guidance.Best Buy was the only stock in the S&P 500 to record gains. It rose 1.4 per cent to $27.22 after Cleveland Research said its survey of individual stores indicated same-store sales growth was positive in October.Groupon executives may be relieved at the timing of last week’s initial public offering, which priced at $20. The stock fell another 3.5 per cent on Wednesday, and is down 7.7 per cent for the week at $24.02, after popping up to $29.52 on its debut last week.
