;Ticker;Nombre_Completo;Date_Time;Titular;Subtitular;Texto
13;MPC;Marathon Petroleum Corp;2016-06-29T21:49:51Z;Murphy Oil drives Wall Street energy rally;All main S&P 500 sectors close in the black;Energy stocks helped lead a second consecutive day of gains on Wall Street, buoyed by rising oil prices.The S&P 500 energy sector climbed 2 per cent on the day in New York, with materials also gaining, up 1.7 per cent, as the price of Brent crude rose 2 per cent to $50.61 a barrel.After two days of volatility and losses exceeding $1tn for US stocks over Friday and Monday, equity markets have staged a comeback as concerns over Britain’s vote to exit the EU subside. US data showing falling crude inventories helped oil prices rise, with some analysts also pointing to a potential strike in Norway — the largest crude oil producer in western Europe — as contributing to the rally.Murphy Oil, an oil and gas exploration and production company, helped lead the sector’s rebound, rising 6.4 per cent to $32.01.Marathon Petroleum, the fourth-largest oil refinery in the US, rose 4.4 per cent to $37.26. Noble Energy gained 3.5 per cent to $36.31.It was a different story for Texas-based Southwestern Energy. Its stock price fell 6.2 per cent on Wednesday to $13.03, the worst performance across the S&P 500 index, after the company offered 75m common shares to the public.The company intends to use proceeds from the stock offering to repay $375m of debt. Its share price rose by more than 10 per cent on Tuesday after extending maturities and tweaking conditions on more than $2bn of outstanding credit.The financials sector also had a strong rally, rising 2.3 per cent. The sector had been hard hit after the UK’s vote to leave the EU and was braced for the release by the Federal Reserve of bank’s stress test results on Wednesday evening.Utilities also made gains after initially lagged behind the broader stock market rally, rising 0.3 per cent. The sector typically performs well when investors are defensive, making its underperformance indicative of some renewed risk appetite.Elsewhere, Nike, the sports clothing and equipment brand, saw its stock price bounce 3.8 per cent to $55.13, having fallen by more than 6 per cent in after-hours trading on Tuesday following a mixed earnings report.Nike reported profits of 49 cents a share for its fiscal fourth quarter, above analysts’ expectation of 48 cents a share. But the focus turned to underwhelming revenues growth, which rose 6 per cent to $8.24bn, below the market’s target of $8.28bn.“We remain bullish on both secular and structural tailwinds for Nike’s business,” said analysts at Stifel. “Stiffer [currency] headwinds and a more volatile macro picture, however, leave us slightly more cautious on near-term fundamentals.”Rival sporting goods producer Under Armour rose 5.9 per cent to $39.75, making it one of the best performing stocks in the S&P 500 index.Alcoa, the metals producer, outlined plans for its split into two companies, hiving off mining, refining and smelting from the more profitable materials production business that serves transportation and construction industries.The announcement sent the company’s stock down 2.5 per cent to $9.10. The spun off company will retain the Alcoa name, while the remaining assets will begin trading under a new name of Arconic.Overall, the S&P 500 rose 1.7 per cent to 2,070.8, the Dow Jones Industrial Average gained 1.6 per cent to 17,694.7 and the Nasdaq Composite increased 1.9 per cent to 4,779.3.
14;MPC;Marathon Petroleum Corp;2016-06-28T17:17:21Z;Energy shares lead Wall Street’s rebound as risk aversion eases;Traders cautious on rebound in stocks and decline in market volatility;Energy companies led the way higher on Tuesday as US stocks recouped some of the steep losses suffered in the wake of the UK’s unexpected vote to leave the EU.The energy sector gained 2.6 per cent helped by a move higher in crude oil. The dollar also gave up ground after rallying in recent days, supporting commodities.Traders and strategists were nonetheless cautious on the rebound in stocks, warning that while the losses of the past two days were extreme — the S&P 500 lost nearly $1tn of value in Friday and Monday’s rout — more volatility was likely ahead with the second-quarter ending on Thursday.“It is just simply a technical rebound in response to a very sharp sell-off,” said Randy Frederick, managing director of trading and derivatives at Charles Schwab. “I have been cautioning people that it is probably shortlived and we may see a pullback.”Traders also said a covering of short sales contributed to the move higher on Tuesday.The S&P 500 rose 1.8 per cent to 2,036.09 while the Nasdaq Composite was 2.1 per cent higher. The CBOE’s Vix, a measure of implied volatility for the S&P extended its drop and fell below 20 — its long-term moving average.“The Vix pulling down toward 20, stabilisation in European equity markets and . . . stabilisation in gold or oil [are the right signs],” Mr Frederick said. “But you need a few days before you say there is an opportunity here.”Among energy companies, ExxonMobil rose 2.3 per cent to $90.91 while Devon Energy gained 6.6 per cent to $35.99 and Marathon Petroleum was up 8.4 per cent at $35.70.Bank stocks, which have been hard hit over the past few sessions, also rose on Tuesday. The financials sector of the benchmark index added 2.5 per cent with Citigroup up 5.1 per cent at $40.44, Bank of America adding 4.3 per cent to $12.70 and JPMorgan gaining 3.3 per cent to $59.52.Banks have been pressured as market participants have dialled back tighter interest rate policy expectations from the Federal Reserve in the wake of Brexit and ensuing market turmoil. Sharply lower US Treasury yields worry investors as low rates squeeze margins for banks.Technology shares also rebounded on Tuesday after coming under recent pressure given their natural cyclicality and exposure to Europe. Microsoft was up 2.1 per cent to $49.44.Utilities companies were the laggards, up just 0.3 per cent. As the broader market sold off, utilities had outperformed due to expectations of lower interest rates remaining for an extended period. In spite of selling on Tuesday, high dividend paying companies such as utilities are expected to remain in favour.Meanwhile, Lending Club, the embattled peer-to-peer lender, gained 7.2 per cent to $4.61 on news that it would cut its staff by 12 per cent. The group has also named a new chief executive after the departure of Renaud Laplanche in May over allegations of loan mis-selling and an undisclosed personal interest in a fund. However, an ongoing review, whose results were revealed on Tuesday, found that there had been further improprieties at the company.
15;MPC;Marathon Petroleum Corp;2016-06-12T10:22:16Z;Oil majors find virtue in integration;Slump in crude prices highlights benefits in owning upstream and downstream businesses;He was reporting record losses amid a prolonged industry downturn, and facing a big shareholder revolt against his 20 per cent pay rise. But Bob Dudley, BP’s chief executive, did manage to find one bright spot amid the gloom at the company’s annual meeting.“Not so long ago I used to hear a lot of advice about how we should separate out our downstream business and sell it off,” he told shareholders in April. “I don’t hear that so much any more.”Mr Dudley was reflecting what executives at the largest energy companies have been saying for the past year or so: that this downturn, the worst in 30 years, has vindicated the business model of the “vertically integrated” oil groups. These companies combine the upstream activities of finding and developing oilfields with downstream functions such as refining crude and selling petroleum products.As in many other industries, oil companies have been facing growing pressure to become more focused. However, since the collapse in crude prices began in mid-2014, that pressure has gone into abeyance. Low prices have crushed profits from oil and gas production, but helped refining and chemicals businesses, supporting integrated groups’ earnings.Yet while the questions over the value of integration may have eased off for a while, they are unlikely to have disappeared for good.There are two principal benefits from being an integrated company. One, in the words of Rex Tillerson, chief executive of ExxonMobil, is that it “captures the highest value for every molecule that flows through our facilities”.As he explained it to analysts in March, Exxon can adjust its production to serve the most profitable markets.“We react more effectively and rapidly to changes in the business environment,” said Mr Tillerson. “Our global supply organisation utilises sophisticated demand planning and marketing tools that provide insights to achieve the best value for our upstream production.”The second professed benefit of the integrated model has come into focus during the oil slump: that owning both upstream and downstream businesses creates a hedge against a drop in the price of crude.In 2014, Royal Dutch Shell generated $16.5bn in profit from its upstream operations and $6.3bn downstream. The following year, the balance flipped: upstream earnings slumped to just $1.8bn, while downstream profits remained roughly flat, adjusting for one-off items.John Abbott, Shell’s head of downstream, says: “The business is very cyclical. Sometimes value will be in the upstream . . . sometimes it will be in the downstream. I’ve lost count, to be honest, over the last 35 years, how many times that has happened.”Weak oil prices helped refiners last year as crude fell faster than the value of refined products, boosting margins. BP reported average refinery margins of $17 a barrel last year, up 18 per cent compared with 2014.For more than 20 years, both of those putative benefits derived from integration have been challenged.Advocates for break-up accepted downstream profits could provide stability during an oil price slump, but argued the costs of the added complexity outweighed the benefits.They also pointed out physical integration — companies refining their own crude — was dwindling. Frederic Choumert of Roland Berger suggests most large international companies might run only 20 per cent of their production through their own refineries.The financial crisis subdued those break-up calls for a while, but as markets recovered the pressure re-emerged. In 2011, researchers at Oppenheimer argued large US oil groups could raise their valuations 20 per cent by spinning off their refining and marketing operations.A few US companies acted on those recommendations. Marathon Oil spun off its downstream operations as Marathon Petroleum in 2011, and ConocoPhillips did the same with Phillips 66 in 2012.Under pressure from Elliott Associates, an activist investor, Hess sold off its terminals and pulled out of refining in 2013, to focus on production.At first glance, the slump in oil prices since 2014 might seem to have made those moves look rash. In the past two years, Hess shares have dropped by 34 per cent, Conoco’s by 41 per cent and Marathon Oil’s by 61 per cent.But adding in the performance of the spun off refining businesses, the break-ups do not look like big mistakes. The weighted average total shareholder return for Conoco and Phillips 66 since the 2012 split, including dividends, has been 40 per cent. Over the same period. Chevron’s total shareholder return has been 12 per cent and Exxon’s 18 per cent.Mr Choumert argues if oil companies want to remain in upstream and downstream activities, they have to show investors there are real advantages to the model, whether in terms of scale and financial strength, or in physical integration.Some companies have been responding to those concerns. BP has restructured its US downstream operations, selling two refineries, to focus on those that are closely linked to its marketing businesses.Tufan Erginbilgic, BP’s head of downstream, says: “We are trying to create differentiated business models so we can generate differentiated returns . . . Then we are not going to have one good month for the company and another month not good.”Some companies are even expanding their downstream operations. Total is planning to get involved in building more liquefied natural gas terminals and power plants, to drive demand for the gas it produces.None of this, however, means the argument for splitting up vertically integrated companies has gone for good, not least because refining margins have slipped back again this year.Occo Roelofsen, a senior partner at McKinsey, which has published multiple papers in the past advocating break-up, says the argument looks weaker now.“The debate has shifted because large companies have improved their performance and lowered their costs during the downturn more than we thought,” he says.Mr Choumert, however, thinks there will still be pressure for change, especially at smaller integrated companies such as Repsol of Spain.“I would not be surprised if there is a move made on them to try to get them to realign their business.”The arguments over what segments of the oil value chain belong in the same company stretch back more than 150 years.John D Rockefeller’s Standard Oil took control of the US oil business in the 1870s by dominating the refining and transport industries, which gave him leverage over the fragmented production companies, but it was not initially a significant producer.Standard subsequently acquired more wells, and by the end of the century accounted for 32 per cent of US crude output, according to Ron Chernow in Titan, his magisterial biography of Rockefeller. Even so, Standard’s position in the upstream industry was always weaker than its grip on refining and transport. At the time of its break-up in 1911, it owned 70 per cent of US refining capacity, but only 14 per cent of its crude productionIn the 1950s and 60s, when the cartel of large western companies known as “the seven sisters” controlled the global market, owning the entire value chain helped them maintain their dominance.In the 1960s and 70s, though, the oil-producing countries of the Middle East and North Africa took control of their industries with a series of nationalisations. Western companies were forced to range further afield in search of reserves, to Alaska, sub-Saharan Africa and central Asia, and as they did so their refineries became increasingly distant from their wells, according to Richard Forrest of AT Kearney.The emergence of a truly liquid global spot market for crude in the 1980s made it less important for companies to lock up supply chains internally to ensure reliable flows of crude. Physical integration — companies processing their own crude in their refineries — went into decline.
16;MPC;Marathon Petroleum Corp;2020-04-25T21:12:53+0000;Exxon beat fails to bolster energy stocks;Gains in recovering sector diminish slightly by week’s end;Despite jumping above analysts’ low expectations hurdle, ExxonMobil’s 63 per cent fall in first-quarter earnings set the tone for an energy sector unable to buck US equities’ losing session.The S&P 500 energy sector ended Friday down 0.1 per cent, diminishing its weekly gain to 0.5 per cent. Oil and gas producers are big winners on the index this year, up 12 per cent — propelled by higher energy prices.Oil is on track for its biggest monthly gain in seven years with both West Texas Intermediate and Brent, the international benchmark, up over 20 per cent in April.Prices have rebounded from below $27 per barrel in the early weeks of the year — a 13-year low — on hopes that falling US production will help counter the ongoing oversupply and high crude oil inventories.Exxon, the world’s fourth-largest company by market capitalisation, released first-quarter results on Friday. Revenues were down 28 per cent while earnings fell 63 per cent year on year.The declines were less than expected and shares rose 1.9 per cent to $89.77, before closing up just 0.5 per cent at $88.45. Exxon’s shares were already up this week, despite the downgrade by Standard & Poor’s of the company to AA+.Market sentiment did improve when the US major showed restraint in increasing its dividend by just 3 per cent, the smallest rise in nearly a decade.In contrast, Chevron doubled expected losses. The US’s second-largest oil group reported a first-quarter after-tax loss of $725m.Its shares traded down 1.8 per cent to $100.61, closing 0.1 per cent down at $102.33. The stock remains up almost 14 per cent since the start of the year.Occidental Petroleum, another integrated oil and gas company, traded up 0.6 per cent to $76.67.Oil and gas refiners and marketers lost ground though. Marathon Petroleum dropped 4.6 per cent to $39.08, Phillips 66 fell 6.5 per cent to $82.05, Tesoro Corp was off 6.4 per cent to $79.76 and Valero Energy tumbled 3.4 per cent to $58.85.Exploration and production companies were broadly flat except for Range Resources, which was up 8.3 per cent to $44.11 as its first-quarter adjusted net loss of $17m was nearly half the size of consensus expectations. BMO, Goldman Sachs and Jefferies raised their target price for the company.National Oilwell Varco’s first-quarter results saw UBS among others raise their target price, while Goldman cut. Its shares rose 9 per cent to $36.07 while other drillers and equipment providers remained broadly flat.The S&P 500 traded down 0.5 per cent to 2,065 on Friday. The consumer discretionary sector was up 0.5 per cent while healthcare was down 1.5 per cent and tech was off 0.9 per cent.The Nasdaq Composite index was down 0.6 per cent to 4,775 and the Dow Jones Industrial Average was 0.3 per cent lower to 17,773.California-based Rovi, a creator of digital entertainment guides, has agreed to buy DVR-maker TiVo for about $1.1bn, about $10.70 a share in cash and stock.Rovi also announced first-quarter results where revenues slightly beat expectations. TiVo shares traded up 5.9 per cent to $9.98 while Rovi shares rose 1.5 per cent to $17.62.Monster Beverage, maker of Peace Tea, Full Throttle and various energy drinks, led the S&P 500 index up 12.9 per cent to $144.22.Better than expected first-quarter results saw revenues up 8.5 per cent and earnings up to $166m compared with $4m in the first quarter 2015. The company also announced plans to tender an offer for a $2bn buyback funded from cash.Amazon shares gained 9.6 per cent to $659.59, the third most in the S&P 500 index as it reported its most profitable quarter ever as heavy investments started to pay off.
17;MPC;Marathon Petroleum Corp;2016-01-27T13:04:45Z;Oil producer Hess reports first FY loss in 13 years;;The decision by Hess to exit its refining and gas station businesses to become a pure play oil and gas producer looks increasingly ill-timed.The New York-based company reported its fourth consecutive quarter of revenue declines and losses as the collapse in global crude prices battered sales, forcing it to take a $1.35bn impairment charge on its assets. The company’s loss widened to $1.8bn for the final three months of the year from $8m a year ago, after revenue tumbled 45 per cent to $1.38bn.The quarter takes Hess’s total loss for 2015 to over $3bn, compared to a profit of $2.37bn in 2014. This is the company’s first annual loss in 13 years.While energy companies around the world have been hard hit by the 72 per cent drop in crude prices since June of 2014, some have been able to lean on their “downstream” refining business to help stem some of the bleeding from its “upstream” oil exploration and production unit.This is not the case for Hess however. Under pressure from activist shareholder Elliot Management, the company announced plans to exit its refining business in 2013 to focus on what was then the more profitable work of exploring for and extracting oil and gas. It followed up a year later with the sale of its iconic gas station chain to Marathon Petroleum for $2.87bn.Hess has subsequently used the proceeds to focus on shale oil production in the Bakken. The company bought 34 gross operated wells on production in the fourth quarter, bringing the year-to-date total to 219 wells.Net debt totalled $6.6bn at the end of 2015, compared to the company’s market capitalisation of $9.8bn.Shares in Hess, down 50 per cent over the past 12 months, fell 1.3 per cent in pre-market trading.
