;Ticker;Nombre_Completo;Date_Time;Titular;Subtitular;Texto
24;MPC;Marathon Petroleum Corp;2014-06-25T17:00:54Z;US refiners hit by Pioneer’s export move;;US oil refiners fell by their greatest rate in more than two and a half years after a Texas company was given permission to export very light oil from the US, circumventing traditional refiners.The private decision for Pioneer Natural Resources could open the door to unrefined crude export for the first time since the 1970s, analysts said.Under current law, export of unrefined crude oil and condensate produced from oilfields is not allowed. However, once that oil has been refined into another fuel – such as gasoline, jet fuel and diesel – it can leave the country.The news that oil producers could export a type of oil that is lighter than regular crude depressed shares of refiners and sent the S&P Oil & Gas Refining & Marketing Index to its biggest one-day decline since 2011.Valero tumbled 8.29 per cent to close at $51.35, Phillips 66 slumped 4.21 per cent to $81.36 and Marathon Petroleum fell 6.34 per cent to end at $80.97.Analysts with Wells Fargo warned that the sharp pullback could be overdone as condensate demand and the size of initial exports, which are expected to begin this summer, are unknown.“We recognise that this will shake confidence in the refining outlook but this is not the end of the road, in our opinion – just an anticipated bump,” analyst Roger Read said.“Unfettered crude exports will require an act of Congress and the political will for that is undeveloped at this point.”The decision lifted independent oil producers, including those drilling in Eagle Ford and Bakken shale of Texas and North Dakota.Shares of SM Energy rose just over 6 per cent to $84.96, Pioneer advanced 5.15 per cent to $233.07 and Rosetta Resources climbed 5.25 per cent to close at $53.69.US broadcast networks were boosted by a Supreme Court ruling that found streaming television service Aereo violated their copyright in a decision that safeguards a key revenue stream for the companies.Broadcast networks – including CBS, Fox, ABC and NBC – earn some $4bn a year from so-called retransmission fees from cable distribution companies like Comcast, Time Warner Cable and Dish.A win for Aereo would have allowed cable distributors to follow its model of using tiny antennas to capture over-the-air television and redistribute it for free.June 2014: Michael Mackenzie discusses with Gregory Meyer how sectarian violence in Iraq coupled with high oil consumption in the US may affect the markets.The retransmission fees, which research firm SNL Kagan forecasts will rise to $7bn in coming years, have become a backbone for revenue at the networks.CBS, which is the largest US standalone broadcast network, rose more than 6 per cent to $62.48.Walt Disney shares advanced 1.48 per cent to $83.90, Twenty-First Century Fox rose almost 2 per cent to $34.88 and Comcast, which owns NBC, climbed more than 1 per cent to $53.21.Shares of Monsanto, the world’s largest maker of genetically modified seeds, climbed just over 5 per cent to $126.73 after the company raised its full-year earnings forecast and said it planned a new two-year $10bn share buyback programme.The company also announced a goal of doubling annual earnings by 2019 on the back of strength in its core seeds business and new big data offerings.Barnes & Noble, the US bookseller fighting fires both in its brick-and-mortar and digital businesses, said on Wednesday that it will split its Nook and retail divisions into two separate companies.“We have determined that these businesses will have the best chance of optimising shareholder value if they are capitalised and operated separately,” chief executive Michael Huseby said.The split is expected to take place in the first few months of 2015. Its shares rose 5.3 per cent to $21.65. Pearson, the owner of the Financial Times, holds a minority stake in the Nook business.Overall, US equity markets advanced despite a report that showed economic activity contracted at a worse than expected 2.9 per cent rate in the first three months of the year.The benchmark S&P 500 rose 0.49 per cent to close at 1,959.53 while the Dow Jones Industrial Average inched 0.29 per cent higher to 16,867.51. The technology-heavy Nasdaq Composite gained 0.68 per cent to end the day at 4,379.76.eric.platt@ft.comTwitter: @ericgplatt
25;MPC;Marathon Petroleum Corp;2014-01-12T17:37:54Z;Oil refiners: Sweet surrender;Crude export ban should be lifted along with other measures of energy protectionism;US oil production is about as fast these days as the US government is slow. Nevertheless, momentum is steadily building, both politically and commercially, to allow domestic crude to be marketed abroad. And it presents a good opportunity to review other regulations that distort the energy supply chain.The export ban, instituted in the days of the 1970s Arab oil embargo, has now created a market distortion where domestic crude prices have diverged from the global one. And that has been wonderful news for US refiners who acquire that cheap US crude and then sell refined products such as diesel around the world at prices set by that higher global level.US oil production is expected to grow to more than 9m barrels a day by 2015. Gulf Coast refiners such as Valero, Marathon Petroleum and Phillips 66 now benefit from the recent split between the falling Light Louisiana Sweet crude and the global Brent prices. JPMorgan believes there will be a medium-term gap of $10 between another US crude oil benchmark, WTI and Brent. The bank said last month that would boost the value of its US refiner universe by a third. Nice work if you can get it.So it is unsurprising that Valero and other refiners will oppose lifting the export ban (though others such as Phillips 66 are supportive). Supporters of the ban say it lowers prices at the pump. However, US petrol usage remains tepid while exports of refined products have rocketed to almost 3m barrels a day, double 2006 levels.So instead of vainly losing the fight on the crude exports, refiners would be wise to broach reform of the Jones Act, another form of protectionism. The Jones Act forces shipping between US ports to be handled by domestic vessels and crews. As such, refiners on the east coast face transport costs of perhaps double or triple what a foreign ship would command. If the refiners do not deserve favoured status from Uncle Sam, neither do shippers.Email the Lex team in confidence at lex@ft.com
26;MPC;Marathon Petroleum Corp;2013-10-10T23:12:53Z;US eyes cutting ethanol usage;;The US would ratchet back its ethanol consumption mandate for the first time under a proposal that would ease costs for oil refiners and cool demand for farmers’ corn.The White House is considering a plan to require 15.21bn gallons of ethanol and biodiesel to be blended into motor fuels next year, well below the 18.15bn mandate dictated by Congress.The proposal, outlined in draft documents seen by the Financial Times, comes almost six years after lawmakers passed the mandate in an attempt to wean the US from foreign oil and back income for corn belt states.This policy crashed into the unexpected reality of weaker fuel consumption and an oil industry reluctant to sell petrol containing more than 10 per cent ethanol, making the targets unachievable in a problem known as the “blend wall”.The Environmental Protection Agency’s preferred option would hit not only Brazilian sugarcane growers, who export ethanol to the US, but for the first time cut required volumes of ethanol refined from corn. Less than 13bn gallons of corn ethanol would have to be sold under the draft proposal, below levels in force in the past two years and well below the 14.4bn statutory mandate for 2014.This would hit US ethanol refiners, such as Archer Daniels Midland and Poet as well as the farmers who sell them 35 per cent of the nation’s corn crop.EPA has sent its draft proposal to the White House Office of Management and Budget for review and has not released it for public comment. The agency, largely closed owing to the federal government shutdown, did not respond to requests for comment.A September 6 document indicates EPA plans to invoke powers to declare “inadequate domestic supply” as a way to justify the deviation from the congressional mandate. The Renewable Fuels Association, a biofuels lobby group, said this would be “patently unlawful”.“There is no basis to suggest that the strict criteria for a general waiver are met today,” said Bob Dinneen, RFA president.The renewable fuel and oil sectors have been at war with one another over the biofuels mandate, even as fuel retailers need some ethanol to meet emissions and octane requirements.Oil refiners’ shares responded positively to reports of the proposal. Valero, which also runs ethanol plants, closed 4.7 per cent higher, while HollyFrontier was up 6.1 per cent, Marathon was up 5.2 per cent and Phillips 66 was up 2.9 per cent.The American Petroleum Institute argues that the law’s requirements should be waived for next year on the grounds that because of the limit to ethanol use set by the blend wall, the mandate would cause “severe economic harm,” including “significant increases in the cost of fuel and substantial fuel supply shortages in the United States”.Patrick Kelly of the API said if the reported EPA proposals were confirmed, “directionally they’re doing the right thing, although we just think they could have gone a little further”.Jason Bordoff of Columbia University’s Center on Global Energy Policy said that if the figures were confirmed, he would expect a sharp fall in the price of the biofuels credits, known as Renewable Identification Numbers, used by fuel suppliers to meet their regulatory obligations.“This potential reduction is more than what many in the market were expecting,” he said. “Industry could comply with these renewable fuel obligations without the incentive of a high RIN price to build out E85 infrastructure or produce more biomass-based diesel.”
27;MPC;Marathon Petroleum Corp;2013-02-08T17:08:34Z;US crude exports argument needs refining;;President Barack Obama wants to double US exports. Will these include crude oil?This question, absurd until recently, is becoming serious. The US may still be a huge crude importer but rises in domestic supplies are shutting out millions of foreign barrels. This week the head of the International Energy Agency – a group that looks after western nations’ energy security – pointedly warned the US oil boom will end if Washington fails to lift its ban on most crude exports.And Lisa Murkowski, the senior Republican on the Senate energy and natural resources committee, declared: “All agencies should review policies affecting energy exports and remove unnecessary impediments. Energy exports are good for our economy.”The impending fight could overshadow current arguments over US exports of liquefied natural gas. Politicians, businesses inside and outside the energy industry and environmentalists will join the fray – with high stakes for investors.Exports would shuffle the boom’s winners and losers. Refiners, the weaklings of the oil patch a few years ago, have reaped windfalls buying oil at depressed US prices and processing fuel for sale at higher international prices. In the past two years the S&P 500 refining and marketing index, composed of stocks such as Valero and Marathon Petroleum, had total returns of 90 per cent.The companies drilling the oil have not been so fortunate. Daily US crude production has risen by 1.3m barrels in the past two years, reaching a 19-year high of 6.9m barrels a day. Yet shares of exploration and production companies lost 2.4 per cent.Most new output is high-quality, low-sulphur crude from states such as North Dakota and Texas. Many US refineries are set up to process heavier, lower-quality crude. Others sit far from pipelines so can be served only by costly trains and US-flagged tankers.“It may make sense to export a certain type of oil that you don’t have refinery capacity in a locality to be able to use,” says John Felmy, chief economist at the American Petroleum Institute, a lobbying group whose members include Chevron and Exxon Mobil.Refiners see it differently. They say they are adjusting to handle the new supplies. At Valero, high-quality sweet crude used to be a third of its feedstock, a spokesman says. Now it’s about half. To capture some of the stunning output from the Eagle Ford shale in Texas, Valero built a truck terminal at its nearby Three Rivers refinery. It plans to buy 2,000 railway tank cars this year to collect more cheap inland crude.It has also received permission to export some US crude to a Valero refinery in Quebec, Canada. But the spokesman suggests untrammelled US exports would be a bad idea: “It actually makes more sense to keep the oil here and refine it at a low cost and then export products.” Valero has been central to the US’s emergence as a top global diesel and petrol exporter.Exports of crude are much more politically sensitive than products. Shipments are effectively blocked to everywhere but Canada. But the restrictions, which date to the late 1970s, were irrelevant until now.Maria van der Hoeven, IEA executive director, argued in the Financial Times that the US needs to loosen export restrictions lest weak oil prices force drillers to give up on exploration.This seems improbable. Producers in North Dakota have found customers in states as far away as New Jersey despite high delivery costs. An easier fix to the refinery mismatch might be to let cheaper foreign tankers carry oil to the east coast.Further, environmentalists will argue, selling extra light crude abroad will simply feed demand for the heavier – and from a global warming perspective, more dangerous – oil poised to flow on the proposed Keystone XL pipeline from Canada.But there is another reason why enabling crude export makes sense, says Bill Reinsch, former undersecretary for export administration at the US Department of Commerce. The US is leaning on allies to stop buying Iranian crude amid sanctions over the Islamic Republic’s nuclear programme. “It’s hard to tell them, ‘Don’t buy from Iran,’ and then deny them an alternative source,” Mr Reinsch says.The arguments are still at a crude stage. Expect sharp refinements.gregory.meyer@ft.com
28;MPC;Marathon Petroleum Corp;2013-01-27T18:56:42Z;Refiners reap gains of US shale oil boom;;The US refining industry has been enjoying a remarkable revival thanks to the shale boom, making shares in companies such as Marathon Petroleum and Tesoro the best-performing of any large energy companies worldwide last year.In a sign of how shale oil and gas production is reshaping the global industrial landscape, refining has become more internationally competitive in the US, enabling it to export record volumes of oil products such as diesel fuel.An analysis published on Monday by PFC Energy, a consultancy, shows that in 2012 shares in US refiners rose by between 57 and 105 per cent, making their strongest recoveries since the collapse in oil prices and refining profit margins in 2008-09.The leading US refiners report full-year results this week and they are all expected to report strong gains with analysts forecasting earnings per share up 40 per cent at Valero Energy, 44 per cent at Tesoro and 63 per cent at Marathon Petroleum.The foundation for the revival in US refining has been the shale oil boom, made possible by advances in horizontal drilling and hydraulic fracturing that have unlocked previously inaccessible reserves.Onshore production in states led by North Dakota and Texas has opened a wide gap between prices for inland US oil and internationally traded crude.On Friday night, international benchmark Brent crude was about $113 per barrel while US West Texas Intermediate at Cushing, Oklahoma, was about $96 and at Midland in west Texas was cheaper again at about $88.Refiners that can secure supplies of those cheaper crudes have a competitive advantage, both increasing their margins in the US and making them more competitive in export markets, particularly in emerging economies such as Mexico where – unlike in the US – fuel demand is still growing.“The entire structure of the US refining industry has been turned on its head,” says Robin West, of PFC. “Up until recently, oil was imported, refined on the coast and then transported inland. Now the crude is being produced inland and sent to the coasts and it’s a goldmine for the refineries that have access to it.”Inland refineries closer to the new production have been the principal beneficiaries. Shares in Dallas-based HollyFrontier, which has refineries in Kansas, Wyoming, New Mexico, Oklahoma and Utah, more than doubled last year.However, coastal refineries have also been able to secure cheaper supplies, sometimes by reversing the flows of pipelines – as with the Seaway pipeline which once took oil from Texas to Cushing but now goes the other way– or by moving oil on trains.Phillips 66, the refining, pipelines and chemicals group spun off from ConocoPhillips, said last year it was planning to buy up to 2,000 rail tank cars to take cheaper inland crude to its refineries on the coastThe wider distribution of cheap crude has meant that even Valero, which has half of its refineries in the Gulf of Mexico region, has benefited.US refiners have also been helped by the cheap price of natural gas – another result of the shale boom – which is a big input cost for refineries.Problems including the fire at Chevron’s Richmond refinery in California and an accident at new facilities owned by Royal Dutch Shell and Saudi Aramco at Port Arthur, Texas, also helped by keeping capacity out of the market.US refiners’ shares have not generally regained their peaks in the boom of the mid-2000s, sometimes known as “the golden age of refining”.From their highs in 2007, Tesoro’s shares are down about 30 per cent while Valero’s are down 50 per cent.Set against a patchy performance for the global energy industry last year, however, their record is particularly impressive.PFC’s analysis of the world’s 50 largest energy companies by market capitalisation shows shares in the US companies producing shale oil and gas had a mixed year, hit by weak natural gas prices.EOG’s shares rose 20 per cent but Devon’s fell 18 per cent. The largest western oil groups’ shares were flat or down slightly while national champions PetroChina and Gazprom were down 7 per cent and 8 per cent, respectively.With the US oil boom continuing, the refining industry’s strength seems set to continue, for a year or two at least.However, Mr West warns that, as new refining capacity comes on stream, profitability will come under pressure.Chi Chow, an analyst at Macquarie Capital, agrees. “There are eight new hydro-crackers for diesel planned to come on stream in the US and Europe,” he says.“You’re going to see the tight supply-demand balance that there has been for diesel start to loosen. Margins will flatten and potentially start to decline.”In this perennially cyclical industry, even if the shale boom persists, the boost it gives to refiners may not last too much longer.
29;MPC;Marathon Petroleum Corp;2012-10-12T13:36:42Z;Letter from Lex – popular uprising;A week featuring anti-aircraft and anti-bank weapons;This week resembled a popular uprising featuring anti-aircraft and anti-bank weapons. The German government shot down a deal to create a world-beating European aerospace and defence company leaving EADS’ long-term strategy in tatters. Then Walmart and Amex unveiled their anti-bank weapon, a service providing lower income households with an alternative to debit cards and current accounts. Greek citizens could do with a similar service as their banking sector has been whittled down from six to three players. In the UK, Barclays made another bolt-on acquisition in the form on ING’s lossmaking online bank as regulators simultaneously eased capital requirements in an effort to stimulate lending and the economy. The move came as the IMF estimated that tighter regulation will see European banks’ total assets fall by $2.8tn by the end of next year.Other companies were also feeling the sting of European regulators. Google offered to put clear labels on its own services in an attempt to appease them while UPS may have to offer significant remedies if it is to complete its €5.2bn takeover of TNT Express. Elsewhere the news was about phones, cars and resources.Japanese telecoms company SoftBank is in talks to acquire a $12.8bn stake in the US’ third largest mobile operator. But Chinese telecoms equipment makers Huawei and ZTE may soon be barred from doing business in the US after a Congressional committee said they posed a threat to national security in a move that smacks of protectionism. In the automotive sector, Toyota issued its biggest single vehicle recall to date as European carmakers still showed no signs of reducing the region’s 35 per cent production overcapacity. In the mining sector, the complex web of debt-ridden businesses and governance mishaps that is Bumi looked like it might finally put investors out of their misery. In the oil & gas sector, BP sold its Texas City refinery to Marathon Petroleum for $1.8bn as the CEO of the world’s biggest oil producing company, Rosneft, dangled the keys to the Arctic Ocean and the Kremlin before the eyes of western investors. Scotland may be relying on the oil & gas sector if it achieves independence in its 2014 referendum, but many Scots may be dismayed to discover that any Tartan index would be far more dependent on the financial sector.John Casey, Lex Publisher
30;MPC;Marathon Petroleum Corp;2020-04-25T18:31:28+0000;Marathon/BP – bargain purchase;Downstream has trounced the upstream guys;No one likes to be upstream without a paddle. But investors are learning to love being downstream. Marathon Petroleum’s purchase on Monday of the Texas City refining complex from BP offers some sharp evidence. The buyer was part of Marathon Oil, until it split its upstream and downstream operations into separate companies in 2011. That experiment worked – the combined market capitalisation of the new companies is more than $40bn, twice what the parent was worth when it split. Downstream has also trounced the upstream guys this year – its shares are up 75 per cent against zero for upstream.That is at least partly explained by the fact that the split has left Marathon Petroleum free to expand in a refining sector that upstream has never much liked. In fact, the refining business is flourishing (relatively) in the US, where margins are more robust than in Europe because of the big domestic market and a concentration on high-value products such as jet fuel.Marathon is paying $1.8bn for the Texas City plant and inventory. That is a big discount to what BP received when it sold its Carson City refining complex in California to Tesoro in August. That involved a smaller plant (266,000 barrels a day of refining capacity compared with 475,000 at Texas City) but it fetched a similar price. That may reflect the tragic recent history of Texas City – an explosion in 2005 that killed 15 people. BP has had this sale on its to-do list for a while.The purchase looks a bargain for Marathon given that BP has spent $1bn turning Texas City into one of the most modern refineries in the US. Marathon already has a plant in Texas City refining 80,000 b/d, so BP’s plant will give it more heft. The company forecasts that it can wring pre-tax earnings synergies of $440m from the plant up to 2017. Given Marathon’s record, that looks eminently achievable.Email the Lex team in confidence at lex@ft.com
