;Ticker;Nombre_Completo;Date_Time;Titular;Subtitular;Texto
19;MCO;Moody's Corp;2019-11-08T09:01:16Z;Indian stocks slip after Moody’s lowers outlook to negative;Rating agency cites deepening economic slowdown and insufficient government action ;Indian stocks wobbled on their record-high perch after Moody’s lowered its outlook for the country to negative, citing concern over a deepening economic slowdown and insufficient government action.The New York-based credit rating agency said it was less confident about the government’s ability to manage the slowdown, which has seen growth in gross domestic product fall to 5 per cent year-on-year between April and June, a six-year low.Growth has been curtailed by a severe liquidity squeeze, prompted by an intensifying crisis in India’s enormous shadow-banking system and bad loans at its public and private banks.The negative outlook reflected in part “lower government and policy effectiveness at addressing longstanding economic and institutional weaknesses than Moody’s had previously estimated”, it said. The rating agency cited demand for reforms to labour and land laws in order to boost productivity and stimulate private investment.India is currently two notches away from losing its hard-earned investment grade status. Moody’s, which first gave India a premier ranking in 2004, proceeded to upgrade its rating a second time in 2017 amid optimism about early reforms made in Prime Minister Narendra Modi’s first term.The Bombay Stock Exchange’s Sensex index fell 0.8 per cent on Friday, having risen to a record of 40,684 points a day earlier. Indian 10-year bonds sold off a little, with yields up 3 basis points to 6.534 per cent, while the rupee softened to 71.3 against the dollar from 71.The government retorted that it has undertaken a series of initiatives to counter the slowdown and reform India’s economy, from the corporate-tax cut and real estate investment to scrapping a controversial tax increase on foreign portfolio investors.“These measures would lead to a positive outlook on India and would attract capital flows and stimulate investments,” the finance ministry said. “The fundamentals of the economy remain quite robust with inflation under check and bond yields low. India continues to offer strong prospects of growth in [the] near and medium term.”Indian stocks have been on a bull run since Mr Modi’s government announced in September that it would cut corporate taxes from an effective rate of 35 per cent to 25 per cent.The rally in Indian stocks accelerated this week after finance minister Nirmala Sitharaman announced that the government would commit Rs100bn ($1.4bn) to invest in the country’s struggling real estate sector, helping to restart projects that have become stuck amid a severe credit crunch sparked by a funding squeeze in India’s financial system.That prompted the stocks of major real estate developers such as DLF to surge higher. The market also got a boost after China and the US on Thursday agreed to remove some tariffs, increasing hopes that the pair would strike a truce after a 20-month trade war.Moody’s decision to lower its India outlook halted the rally, sparking concerns that further economic deterioration could ultimately lead to an investment downgrade. The rating agency cited the risk of increasing government debt levels, forecasting a fiscal deficit of 3.7 per cent of gross domestic product in the year ended March 2020. The government in July laid out a target of 3.3 per cent.Analysts at Nomura cited the risk to Indian equities and earnings from the sharper-than-expected slowdown, and forecast that GDP growth will fall further to 4.2 per cent in the coming quarter.“With tight domestic credit conditions persisting amid weak global demand, we now expect India’s recovery to be delayed and the pick-up to remain below potential,” it said.Additional reporting by Daniel Shane in Hong Kong
20;MCO;Moody's Corp;2019-11-04T17:05:13Z;Moody’s reprieve buys South Africa time to repair its finances;Credit rating agency has opted against downgrading country’s debt to junk — for now;Cities across South Africa are due to host parades for the country’s rugby team in coming days, following last weekend’s emphatic victory in the World Cup final in Japan. In financial markets, too, there were scenes of celebration on Monday after Moody’s elected not to downgrade the country’s debt to junk.Late on Friday the US credit rating agency decided to keep the sovereign debt in investment-grade territory — meaning it is eligible to be bought by most institutional investors — even after a budget update from Cape Town showed continuing struggles with ballooning debt and a widening fiscal deficit. On Monday the rand gained about 1.6 per cent against the US dollar, easily the biggest rise among major currencies, while the price of protecting the country’s debt against default fell by the most since June.Yet the verdict from Moody’s is hardly a vote of confidence in Africa’s second-biggest economy. The agency cut its outlook for the debt from “stable” to “negative”, citing a material risk that the government would be unable to repair its finances.The government now has three months to demonstrate a tangible change of course ahead of its budget in February, or a downgrade is inevitable, according to Luis Costa, lead strategist at Citi.“It’s a stay of execution,” agreed Paul Greer, portfolio manager for emerging markets debt at Fidelity in London.For now, Moody’s decision prevents an automatic expulsion from the FTSE World Government Bond index, which would have caused investors to sell bonds en masse and could have made it more expensive for South Africa to raise money. A cut to junk in February could generate an exodus of up to $15bn from passive, index-tracking funds and other rating-restricted investors, said Magdalena Polan, emerging markets strategist at LGIM.South Africa’s national debt, currently about 3tn rand (about $200bn), was set to balloon to 4.5tn rand during the next three years without drastic action, said Tito Mboweni, finance minister, in an address to parliament last week. The former central bank governor took one of the country’s hardy aloe ferox plants to the lectern as he gave his budget speech.The consequence of not acting now would be grave for South Africa“This is a serious position to be in. Our little aloe is not doing well. It needs attention, like our public finances,” Mr Mboweni said.“The consequence of not acting now would be grave for South Africa. Over time, the country would likely face mounting debt service costs and higher interest rates and may enter a debt trap,” he added.Moody’s has been an outlier for a while. Other big credit rating agencies such as Standard & Poor’s and Fitch cut South Africa’s rating to junk in 2017 as corruption hollowed out state-owned enterprises under former president Jacob Zuma, who quit last year.If Moody’s was to preserve its rating, said analysts, President Cyril Ramaphosa’s ruling African National Congress needed to come good on its promised macroeconomic reforms, including the restructuring of debt-laden public enterprises such as Eskom. The power company sells almost all of South Africa’s electricity but can no longer keep up payments on 450bn rand of debt without state help.Bailouts to keep the lights on are likely to push South Africa’s debt to more than 80 per cent of its gross domestic product by the end of the next decade, according to Mr Mboweni. That is a much higher ratio than was forecast just months ago, when the government said the debt ratio could be held at less than 60 per cent.The government appears to be playing what analysts have called a poker game over future support for Eskom. The utility’s managers have pushed for the state to directly take over a large chunk of its debts so the company could borrow more cheaply. But the finance minister has insisted that they must first split Eskom’s unwieldy monopoly into three more manageable businesses.However, analysts say Mr Ramaphosa is hostage to union allies of the ANC who have threatened to take to the streets over what they see as a bid to privatise Eskom.Workers’ groups are also likely to oppose attempts to control another big driver of South Africa’s debt increase: public-sector wages. The government’s spending on civil servants’ salaries equates to 46 rand out of every 100 collected in tax.Meanwhile, tax collection is weakening due to the sluggish economy, with the South African Treasury slashing its forecast for this year’s growth by a full percentage point, to 0.5 per cent. It will mean another year in which GDP per head has fallen as the country’s population growth outpaces the economy.Despite the sombre outlook, analysts and asset managers believe that last week’s midterm budget was the first time in many years that South Africa has presented a realistic picture of its financial position.“Yes, the accumulation of debt is concerning, [and] it will lead to lower growth in the short term and raise tensions in society,” said Gustavo Medeiros, deputy head of research at Ashmore in London. “However, there is already an institutional fight against the old ANC practices and there’s a real chance that this fight gets won over time.”“The cannons are aiming in the right direction,” agreed Mr Costa of Citi. “Though policy implementation will be slower than the markets expect.”
21;MCO;Moody's Corp;2019-11-01T23:01:56Z;S Africa debt risks junk status after Moody’s cuts outlook;Cut signals rating agency’s concern that Ramaphosa government will fail to restart economy;Moody’s cut its outlook for South Africa’s rating from “stable” to “negative”, leaving the debt of Africa’s most industrialised nation on the brink of junk status.Moody’s, the last big credit rating agency to classify South Africa as investment-grade, retained the country’s Baa3 rating on Friday.But it warned that failure by President Cyril Ramaphosa’s government to fix slowing economic growth and rising debts may soon lead to a downgrade to junk.“The current rating rests on the government’s ability to quickly develop a credible strategy to halt and ultimately reverse the rise in debt. Such a strategy has not been forthcoming to date,” Moody’s said.The negative outlook signalled Moody’s concern that Mr Ramaphosa’s ruling African National Congress “will not find the political capital to implement the range of measures it intends” to restart the economy, it added.Mr Ramaphosa promised a “new dawn” when he replaced Jacob Zuma as South Africa’s president last year after a lengthy period of rising corruption in the state.But he has been hard pressed by vicious infighting in the ANC over reforms such as tackling a crisis at Eskom, the state power monopoly that has been called the biggest threat to the economy.Eskom sells nearly all of South Africa’s electricity but, because of waste and corruption, it can no longer keep up payments on R450bn ($30bn) of its mostly state-guaranteed debts without government help, straining public finances to the limit.Tito Mboweni, finance minister, warned this week that, without reforms, bailouts for Eskom and a bloated public-sector wage bill would raise state debts from less than 60 per cent of GDP to a danger level of 70 per cent over the next three years.Moody’s added that structural blocks in the post-apartheid economy, such as the world’s worst inequality rate and high joblessness, were sapping reform efforts “to an even greater extent than previously expected”.Mr Mboweni’s Treasury believes that the economy will grow only 0.5 per cent this year. Factories, mines, shops and smelters have all been battered by Eskom-imposed rolling power blackouts in 2019.A complete fall into junk status would bar South Africa’s debt from global bond indices tracked by investors, making it even more expensive to raise money on the markets.Mr Mboweni’s next budget in February is increasingly being seen as a critical moment to turn the fiscal tide for South Africa.“The development of a credible fiscal strategy to contain the rise in debt, including in the 2020 budget process and statement, will be crucial to sustain the rating at its current level,” Moody’s said.
22;MCO;Moody's Corp;2019-11-01T09:54:55Z;Markets poised for South African sovereign debt review;Downgrade by rating agency Moody’s has potential to trigger substantial bond sales;Moody’s will announce its much awaited review of South Africa’s sovereign debt on Friday evening, which could trigger substantial outflows from government bonds.Moody’s is the only one of the top three rating agencies which still has an investment grade assigned to South Africa’s sovereign debt. Fitch downgraded South Africa to junk in April 2017 and S&P did likewise in November of the same year.The ratings company will either maintain its current investment grading for South Africa, at Baa3, change its outlook to negative, or downgrade the sovereign debt to junk. A downgrade to junk would likely trigger substantial sales of the nation’s bonds, and cause South Africa to lose its place in the FTSE World Government Bond Index.“A downgrade would exacerbate fiscal woes by raising borrowing costs at the time when the government is already struggling to consolidate public finances,” Rabobank analysts wrote in a note.The rating revision follows the government’s midterm budget, published on Wednesday, which stated that the country’s fiscal deficit would increase from 5.3 per cent to 6.5 per cent of GDP, amid sluggish growth and multiple bailouts of state-owned enterprises.Eskom, the beleaguered state-owned power company, is set to receive R138bn (£7bn) in bailouts until March 2020.
23;MCO;Moody's Corp;2019-10-03T05:00:25Z;US shopping mall vacancies hit 8-year high;Bankruptcies and lower footfall pose serious challenges for retailers;Vacancies in US shopping malls have hit an eight-year high but new data show that some areas are coping with the retail upheaval far better than others and the gap is widening.The proportion of units lying empty in some cities, including Indianapolis and Birmingham, Alabama, is about four times higher than the economic hotspot of San Francisco, according to new data from Reis, part of Moody’s Analytics.The signs of difficulty in local retail property markets come as landlords brace for a wave of store closures following the bankruptcy of Forever 21 this week. The fast-fashion retailer, which has 32,800 employees globally, has earmarked 178 locations for closure across the US.Jonathan Goulding, the company’s chief restructuring officer, said in court documents that Forever 21 was “saddled with excessive floor space” in several unprofitable markets.The company’s stores occupy 12.2m sq ft worldwide and tend to be especially large, prompting worries that mall operators will struggle to find replacement tenants.“It’s definitely a concern because there’s not that many retailers that will want that amount of space,” said Neil Saunders, retail managing director at consultancy GlobalData. “In some locations there’s just a real glut of space.”The Reis data published on Thursday, which track 77 metro areas, show 9.4 per cent of units were empty in the third quarter — equalling a post-financial crisis high reached in 2011.The retail vacancy rate was less than 7 per cent in 17 cities, led by San Francisco with a 4.1 per cent rate. By contrast, 24 cities saw vacancy rates above 12 per cent, including Memphis, Buffalo and Albuquerque.In 43 cities, including Chicago, Seattle and Las Vegas vacancy rates improved over the past year.The metric worsened in several areas where there were already a higher than average proportion of empty properties. In Syracuse, New York, retail vacancies rose 2.4 percentage points over the past year to 14 per cent.Shopping malls have borne the brunt of a wave of closures and bankruptcies this year. Gap and Victoria’s Secret are among several household names to announce closure plans, while Payless ShoeSource and Charlotte Russe have each launched bankruptcy filings.Some analysts blamed Forever 21’s demise on changing tastes among younger shoppers and overexpansion, but Mr Goulding said a drop in mall footfall was the “most significant” factor.“As its neighbours have closed, the number of customers walking past Forever 21 has declined,” he said.
24;MCO;Moody's Corp;2019-10-01T18:12:35Z;Moody’s puts Lebanon under review for downgrade as monetary crisis deepens;;Moody’s said it placed Lebanon’s already non-investment grade credit rating under review for a further downgrade, another knock for one of the world’s worst indebted countries.Lebanon’s huge debts — more than 150 per cent of gross domestic product — are eroding its central bank foreign currency reserves, credit analysts have warned.Fitch has already downgraded its rating for the small Mediterranean nation, which is experiencing economic slowdown and has a severe trade deficit. S&P did not downgrade the bonds but gave a harsh review of Beirut’s creditworthiness.Moody’s has a Caa1 rating on Lebanon’s debt. It said in a statement on Tuesday it would take 90 days or more to assess whether or not the Mediterranean nation’s fractious political leadership was able to see through its 2020 budget, unlock “confidence-enhancing” international finance packages for infrastructure projects, or land support from traditional Gulf backers.It stressed the review had been triggered by the “recent significant tightening in external financing conditions and the reversal in the bank deposit inflows that are essential in enabling Lebanon to meet the government’s financing needs.”Lebanon has long-relied on a growing deposit base, largely supplied by its huge diaspora, to help meet its foreign currency needs. But that trend has reversed course this year, raising concerns about how the country will pay for imports and debt servicing.Lebanon has never defaulted on its debt. Politicians and analysts alike have warned of the worsening fiscal and economic position, and demonstrators took to the streets of Beirut this weekend to protest over joblessness, lack of service provision and corruption.
25;MCO;Moody's Corp;2019-09-09T23:00:34Z;Ford credit rating downgraded to junk by Moody’s;Action comes against backdrop of carmaker’s $11bn restructuring plan;Ford’s credit rating has been cut to junk by Moody’s Investors Service, which cited weak earnings and cash generation as the carmaker undergoes a costly restructuring.The company, which has about $100bn of debt globally, in the form of bonds and loans, is trying to retool its business “from a weak position as measures of cash flow and profit margins are below our expectations, and below the performance of investment-grade rated auto peers”, Moody’s said in its report.Ford has said it will take charges totalling $11bn in a restructuring aimed at improving profitability and better positioning itself to capitalise on new technologies including electric and self-driving vehicles. The company has announced job cuts and plant closures in Europe, while also reducing salaried staff across the globeIt also has formed an alliance with the German carmaker Volkswagen in which they will share development costs on electric cars.Ford now faces the challenge of addressing operational problems as demand in major markets is softening, and as the auto industry is contending with an unprecedented pace of changeShares in Ford were down more than 3 per cent in after-hours trading following the Moody’s announcement, having been up more than 2 per cent during the day’s formal session. The stock had gained 25 per cent since the start of 2019, as of Monday’s closing price.Moody’s cut the rating on Ford’s bonds one notch from Baa3, the lowest investment grade rating, to Ba1, the highest rung of the junk bond scale. The other two major credit rating agencies, S&P Global Ratings and Fitch, each have investment-grade ratings for the company.The yield on Ford’s 10-year bond, issued earlier this year, shot higher following the announcement from Moody’s, rising 15 basis points to 4.93 per cent.“The erosion in Ford’s performance has occurred during a period in which global automotive conditions have been fairly healthy,” Moody’s said. “Ford now faces the challenge of addressing these operational problems as demand in major markets is softening, and as the auto industry is contending with an unprecedented pace of change relating to vehicle electrification, autonomous driving, ride sharing, and increasingly burdensome emission regulations.”The downgrade raises the risk that Ford could end up in high-yield market indices, where it will be a significant presence. According to Bank of America Merrill Lynch analysts, $34.5bn of Ford’s US bonds would be eligible for inclusion and would represent 2.9 per cent of the total US high yield market.The debt remains in investment-grade bond indices for now, however, since a majority of the rating agencies still have an above-junk rating. S&P said in July that it expects to downgrade the company by one notch sometime this year, but that it would still maintain an investment grade rating on the company.“A two-notch downgrade to a speculative-grade rating is unlikely over the next 24 months unless a higher risk of a US recession coincides with a lack of profitability improvements in Europe and China, which — together — would reduce the cash cushion Ford would need to withstand the next downturn,” S&P wrote in its most recent report.Investors have become concerned in recent years over the rising numbers of companies happy with issuing debt at the very lowest rungs of investment grade. They fear worsening economic conditions could imperil companies’ ability to service bloated debt loads, leading to downgrades.Prices could then fall precipitously, since some bond fund managers would be forced to offload the debt, bound by strict investment mandates that prohibit holding lower-rated bonds.But some analysts and investors downplayed the impact of Ford’s downgrade.“I think the Ford situation is understood by investors to be sufficiently idiosyncratic,” said Hans Mikkelson, a strategist at Bank of America Merrill Lynch. “This is not a sign that you are going to see a raft of downgrades from triple-B to high yield.”
26;MCO;Moody's Corp;2019-08-29T11:55:57Z;Wirecard rated just above junk by Moody’s as it launches €500m bond;Rating agency gives German fintech lowest possible investment grade classification;German financial technology group Wirecard has been rated just above junk status by rating agency Moody’s as it looks to issue a €500m bond.Moody’s assigned a Baa3 rating — the lowest investment grade classification — to both Wirecard generally and the planned unsecured notes specifically, citing constraints including the payment company’s size relative to US rivals and the “constant threat” of competition from new market entrants and technologies.But the rating agency also cited positives including Wirecard’s strong market position in Asia an Europe, its diversity, scalability and “sound financial profile”.“Wirecard’s Baa3 issuer rating reflects its leading position in the payment processing market, especially in Europe and in the strongly growing Asian markets and its comprehensive product portfolio in the highly competitive industry,” said Dirk Goedde, Moody’s lead analyst for Wirecard.Based out of Aschheim, Germany, Wirecard has grown rapidly in recent years, selling technology and knowhow used by businesses to take payments from customers. Its share price has been under pressure since late last year when it became embroiled in an accounting scandal.Moody’s gave the group a stable outlook and said it expects it to generate growth in adjusted earnings before interest tax depreciation and amortisation in the “high-teens to mid-twenties” over the next 12-18 monthsIt added that it does not expect Wirecard to exceed an adjusted debt to ebitda ratio of three times, including the new €500m bond and an “envisaged” €900m investment by Japan’s SoftBank via a convertible bond that was announced earlier this year.Wirecard plans to begin a roadshow for the new five-year bond on September 2 to meet with fixed income investors. Crédit Agricole, Deutsche Bank and ING will act as global coordinators, while Citi and Credit Suisse will be active bookrunners.
