;Ticker;Nombre_Completo;Date_Time;Titular;Subtitular;Texto
41;MCO;Moody's Corp;2018-03-23T23:12:20Z;Moody’s keeps South Africa credit rating at investment grade;Ramaphosa’s reforms are given a chance to succeed after turmoil of Zuma era;South Africa avoided a further downgrade in its credit rating to junk status after Moody’s kept the country at investment grade, citing the beginning of reform under President Cyril Ramaphosa.The agency said on Friday that keeping South African government bonds at one notch above junk reflected its “view that the previous weakening of South Africa’s institutions will gradually reverse”, a reference to the political turmoil under Jacob Zuma, the former president.Mr Ramaphosa, leader of the ruling African National Congress, became president last month after the party forced Mr Zuma from power under a cloud of corruption allegations.Mr Zuma was accused of allowing so-called state capture to target critical fiscal institutions such as the treasury and revenue service, leading Fitch Ratings and S&P to downgrade South Africa to junk in 2017.A further downgrade by Moody’s would have kicked Africa’s most industrialised economy out of international indices followed by bond investors, endangering the financing of government debts, which ballooned under Mr Zuma.The previous weakening of South Africa’s institutions will gradually reverseMoody’s said its outlook for the credit rating was stable, balancing “significant growth potential” for the economy against the risks of continued infighting in the ANC affecting Mr Ramaphosa’s “still to be tested” administration.Averting junk status by all three of the main rating agencies is a reprieve for Mr Ramaphosa, who has promised to restore economic stability and to remove corruption from government.The beginning of the presidency of the former trade unionist turned business leader “offers a real prospect of a decisive reversal” in South Africa’s decline, Moody’s said.The agency praised “the speed with which the president has moved to replace the leadership in key institutions”, including removing Mr Zuma’s cronies as finance minister, head of the tax authority and overseer of state-owned companies.But it warned that it was still “early days” for reform and said that the debts of mismanaged state-owned firms such as Eskom, the power monopoly, still threaten government finances.As a result of a tough state budget that raised taxes days after Mr Ramaphosa became president, government debt is likely to stabilise at 55 per cent of gross domestic product between now and 2020, Moody’s said.“While an unchanged rating was a foregone conclusion for markets, and very much priced in, the changing of the outlook to ‘stable’ is important news, in our view,” said Razia Khan, chief economist for Africa at Standard Chartered.
42;MCO;Moody's Corp;2018-03-15T05:15:25Z;Global rating agencies: creditable;Bond spreads still react to downgrades and changes to outlooks;Do global credit rating agencies have anything to tell the market that it cannot find out for itself? The jaded bond investor’s answer would be no. How else to explain the lack of price reaction to such seismic events as the UK’s loss of its gold-plated AAA status or Portugal’s return to the investment grade club. Recent credit rating moves in Turkey and Italy have produced similarly lacklustre results. The minimal market reaction suggests government ratings could be scrapped without much protest.The reason they will stick around is that no one has yet come up with an alternative. Attempts to defang the agencies after they missed the risks in collateralised debt obligations, and were then accused of accelerating the European debt crisis, fell flat. Agencies are still paid by the organisations they rate — a clear conflict of interest — and the sector is still dominated by three big companies: S&P, Moody’s and Fitch. Their views remain a key benchmark by which investors allocate funds and the alphabet soup they use to indicate creditworthiness has not changed.There is also some evidence to suggest that their ratings do offer markets new information on sovereign bonds — even if knee-jerk price reactions are missing. Looking at credit default swap spreads on 55 sovereign bonds between 2005 to 2013, the Bank for International Settlements has found that spreads noticeably respond in the three weeks after a rating downgrade event.The nuance missing from previous analysis is that spreads react more to a change in outlook than a change in rating. Bad economic news made public can move bond prices before credit agencies place sovereign debt on negative outlook, but an actual outlook announcement will still cause a rise in CDS spreads — particularly for bonds just at or just below investment grade.Regulators should still be more vigorous in expanding the universe of rating agencies. But the argument that the crisis diminished credit agencies for good lacks credibility.
43;MCO;Moody's Corp;2020-04-25T00:30:02+0000;Moody’s downgrades Turkey on political, economic risks;Agency cites concerns about the country’s wide current account deficits;Moody’s downgraded Turkey’s debt on Wednesday, warning of the erosion of checks and balances under the leadership of President Recep Tayyip Erdogan and an increased risk of an external economic shock.The agency lowered the country’s sovereign debt rating one notch to Ba2 from Ba1, with a stable outlook, citing concerns about the country’s wide current account deficits, higher external debt and large rollover requirements in the context of political uncertainty and rising global interest rates.“This overall picture suggests that the possibility of a sudden, disruptive reversal in foreign capital inflows, a more rapid fall in already inadequate FX reserves and, in a worst-case scenario, a balance of payments crisis, while still quite low, has increased beyond Moody’s expectations a year ago,” it said.Moody’s voiced alarm about the “continued loss of institutional strength” in Turkey, where Mr Erdogan has been accused by opponents of putting political pressure on the judiciary and the central bank.It said that this had led to “further erosion in the effectiveness of monetary policy and further delays in implementing core structural economic reforms.”It warned that a radical strengthening of the office of the presidency, due to come into force after the next elections, would further undermine the predictability and effectiveness of Turkish policymaking.Moody’s decision pushes its rating on Turkey further into junk territory. Other major agencies Fitch and S&P have also assigned the country non-investment grade ratings.
44;MCO;Moody's Corp;2018-02-20T06:54:47Z;Moody's mulls PNB downgrade as concerns deepen around $1.8bn fraud;;"Rating agency Moody's has put India's Punjab National Bank under review for a downgrade as concerns deepen around the $1.77bn fraud reported by the lender last week.Shares in PNB, the country's second-biggest state-controlled lender, have plummeted since it announced last Wednesday that it had been defrauded by a group of businessmen, acting with the connivance of staff at a Mumbai branch, who obtained $1.77bn in trade loans without going through proper approval processes.On Tuesday, Moody's said it expected that ""PNB will need to provide for at least a substantial portion of the exposure. As a result, the bank's profitability will likely come under pressure.""The agency added that if PNB had to provide for its entire exposure to the alleged scam, then the bank's ""capital position would deteriorate markedly, and fall below minimum regulatory requirements…Consequently, PNB may need to raise capital externally — mainly from the government"".Moody's further noted that the discovery of the alleged fraud highlighted ""the weak operational controls and corporate governance at the bank"".Shares in PNB fell 4.6 per cent on Tuesday morning, bringing the total decline since the shock announcement to 31 per cent."
45;MCO;Moody's Corp;2017-12-03T05:00:25Z;Movers & shakers: December 4;Boris Collardi, currently chief executive of Julius Baer, is to join Pictet next year;• Boris Collardi is to join Pictet as a partner and co-head of global wealth management next year, working alongside Rémy Best, who has headed the division since 2014. Mr Collardi is currently chief executive of Julius Baer, a rival Swiss private bank. He will become Pictet’s seventh partner.• Deutsche Asset Management has appointed Mark McDonald as global head of private equity secondaries, a London-based role. Mr McDonald joins the €711bn asset manager from Credit Suisse.• Moody’s has hired Julián García De Pablo as vice-president in its relationship management team for Europe, the Middle East and Africa. Based in Madrid, Mr García De Pablo joins the ratings group from Banco Santander.• Philip Dawes has joined BNP Paribas Asset Management as head of institutional sales in the UK and Ireland, a newly created role. Based in London, he was recruited by the €571bn asset management arm of the French banking group from Allianz Global Investors.• There are two new faces at BNP Paribas Securities Services. The unit, which has more than $10tn in assets under custody, has recruited Adnan Hussain as global head of agency lending and head of market and financing services in the UK. Mr Hussain joins from RBC. Simone Broadfield has been appointed head of agency lending for Asia-Pacific, joining from Citi.• Jenny Yoe has joined State Street Global Advisors as head of UK pensions. Based in London, Ms Yoe joins from River & Mercantile Asset Management.• Two new hires at Hermes GPE, which focuses on managing the private equity assets of institutional investors. Sanjeev Phakey joins from the Universities Superannuation Scheme to focus on investments in Emea, while Fidel Manolopoulos has been recruited from Mojo Capital. Both will be based in London.• Northern Trust has appointed Mike Mahoney as a transition manager for Emea. Based in London, Mr Mahoney joins the asset and wealth manager from State Street Global Markets.• Weatherbys Private Bank has appointed Henry Taylor as an associate director. Mr Taylor joins the family-owned UK private bank from Lloyds Banking Group, where he was a relationship director in corporate banking.• QMA has hired John Gee-Grant as head of international distribution and global consultant relations, a new role at the $133bn quant-focused investment business of Prudential Financial, the US-listed insurer. Mr Gee-Grant joins from BlackRock.
46;MCO;Moody's Corp;2017-08-31T18:36:15Z;Rating agencies warn on failure to raise US debt limit;Signs of angst in Treasury market amid contentious debate in Washington;Credit rating agencies have ratcheted up their warnings over the consequences should a divided Washington fail to raise the US debt ceiling, with anxiety beginning to surface in the $14tn Treasury market.S&P Global, the largest of the world’s three dominant rating agencies, cautioned that a failure by Congress to lift the debt ceiling would likely be “more catastrophic” than the collapse of Lehman Brothers in 2008 that brought the global financial crisis to a head.The alarm from S&P comes ahead of what is expected to be a contentious debate in Washington about lifting the Treasury’s self-imposed borrowing authority. The Treasury department has already resorted to extraordinary measures to pay the nation’s bills, and Treasury secretary Steven Mnuchin has told congressional leaders that they should act by September 29.Analysts with rival Fitch warned last week that a failure to raise the debt ceiling in a timely manner would result in a review of its triple-A rating on the US with “potentially negative implications”, signalling a cut to either its outlook or rating. Moody’s, which also rates the US triple-A, has said if a debt payment is missed it would also have “negative rating implications”.S&P chief US economist Beth Ann Bovino said a default on US government debts would be “devastating” to markets and the economy. Her team forecasts that a default would result in a contraction in government spending and would push the US economy back into recession, “wiping out much of the progress made by the recovery”. S&P downgraded the US credit rating to double-A plus in 2011.Investors and economists expect the Treasury will hit its debt limit in early to mid-October. Dislocations in Treasury markets have appeared for debts maturing on October 12 and 19, with money managers demanding greater compensation to hold those obligations. Debts maturing on October 19 traded hands on Wednesday with a yield of 1.1 per cent, 16 basis points above bills that mature at the end of September and 10 basis points higher than debts that come due at the start of November.Matt Zames, a former top JPMorgan banker, last year sent an open letter to then Treasury secretary Jack Lew arguing that the debt ceiling system was “the most glaring flaw in the government’s financing system”, and warned that a US default would be disastrous.“The possibility that future debt limit showdowns could introduce market uncertainty and trigger another catastrophic financial crisis still exists and remains the unresolved ‘elephant in the room’,” he wrote to Mr Lew. “It is time to introduce an alternative method of raising the debt limit.”JPMorgan analysts recently detailed a wide array of factors that could cause mayhem even in the case of a temporary “technical” US debt, such as the impact on money markets stuffed to the gills with Treasuries, or how the financial system might function if one of its prime collateral assets were in default.While there are no “cross-default” provisions in Treasuries — so a default on one security would not necessarily mean a technical default on the US government’s entire debt burden — the bank warned that “market liquidity will probably be substantially impaired”.
47;MCO;Moody's Corp;2020-04-25T03:00:02+0000;China’s real credit risk lurks in shadow finance;A crackdown on irregular dealings is creating collateral damage;"The downgrading of the world’s second-largest economy’s sovereign debt rating should rank as an important event. But financial markets greeted China’s downgrade last week by Moody’s, the credit rating agency, with their version of a nonchalant shrug. Chinese domestic bond prices remained steady and Hong Kong’s main stock index actually rose during the week.But the non-event should not lull observers into complacency. China not only has one of the most highly leveraged corporate sectors in the world — with company debts equivalent to about 170 per cent of gross domestic product — it is also engaged in risky manoeuvres to cut an overgrown shadow finance sector down to size.Indeed, the market’s shrug says more about the structure of China’s financial architecture than it does about the very considerable risks that lurk within it. The truth is that foreign rating agencies have little influence over domestic bond investors and foreign ownership of Chinese bonds amounts to just $61.5bn, or 4 per cent of the total.In any case, China’s outstanding foreign debt stood at a modest $1.42tn — or just 13 per cent of GDP — at the end of 2016. Beijing’s huge stash of foreign exchange reserves, which currently stands at $3tn, makes it highly unlikely that the country would default on its sovereign bonds.Nevertheless, the one-notch relegation of Moody’s rating to A1 should encourage observers to delve into the strange nature of Chinese financial risk. Although the downgrade puts China on a par with Israel, Saudi Arabia and the Czech Republic, there is almost no equivalence between the challenges it faces and those of these countries.The risks inherent in China’s system derive mainly from the regulatory disobedience of a state-owned phalanx of banks and companies that have reaped handsome returns from a booming netherworld of shadow finance. This twilight domain has tripled in size over the past five years to be worth $9.4tn, or about 87 per cent of GDP, at the end of last year, according to Moody’s estimates.In recent months, the China Banking Regulatory Commission (CBRC) and other official bodies have sought to re-impose Beijing’s authority by cracking down on a long list of irregular but commonplace financial dealings. Guo Shuqing, the CBRC chairman, has been quoted as saying he would rather resign than see the banking system become a “complete mess”.But the crackdown is creating collateral damage. A squeeze on the money market, a font of shadow finance liquidity, has driven short-term interest rates higher, raising the costs of funding not only for irregular dealings but also for legitimate mid-sized banks and companies that rely on such funding to manage stretched balance sheets.Bond market defaults are relatively new; the first one was permitted in 2014. But this year there have been 13 defaults so far, the most recent in late May when Dalian Machine Tool Group — one of the world’s largest machine-tool companies — failed to repay the principle and interest on debt issued.The potential for debt default contagion is huge, due to a widespread practise of companies guaranteeing other companies’ loans. Nearly half of the lower-rated companies in China have extended loan guarantees of more than 30 per cent of the value of their equity, according to Everbright Securities, a Chinese brokerage. Thus while the Moody’s downgrade may not signal a clear and present danger, it should alert investors to the myriad credit risks within China’s opaque economy."
48;MCO;Moody's Corp;2016-09-28T22:04:22Z;Moody’s trims staff to contain expenses;Market turbulence cut the rating agency’s revenue early in the year;Moody’s has axed 30 staff across its business as the rating agency seeks to contain costs after a challenging start to the year, according to people briefed on the situation.The job cuts are concentrated among analysts but include some staff from other areas of the company.Moody’s, which issues ratings and research across a range of bonds and other securities, struggled at the start of the year, after widespread market turmoil curtailed the issuance of bonds and structured products, cutting the company’s income from rating new transactions.The pace of new deals has picked up in recent months but Moody’s executives highlighted concerns over political risks, including the US presidential election, at an investor conference on Wednesday, at which they also discussed plans to rein in expenses.Some cost savings would come from using employees in lower-cost locations such as India, Sri Lanka, China and Costa Rica, said Linda Huber, Moody’s chief financial officer, according to a Bloomberg transcript of the event.“We haven’t liked the way the revenues have come in . . . we realised we have to work on expenses because we’ve had a tougher time with revenue,” she said.First-quarter revenue missed analysts’ estimates by $37m, coming in at $816m. Revenues recovered in the second quarter, beating estimates by $25m at $929m, according to Bloomberg data. The company’s share price is up 9 per cent for the year but fell 0.4 per cent on Wednesday despite it raising its full-year earnings outlook at the investor conference.“Increased issuance activity combined with a greater impact from our cost savings initiatives has resulted in a modestly improved outlook,” said Raymond McDaniel, Moody’s chief executive, in a statement.The move to axe analysts in an effort to cut costs is unusual for the company, which rarely engages in large-scale firings, according to the people. Moody’s has about 1,600 analysts in total, according to regulatory filings.Moody’s is separately under investigation by the Department of Justice for allegedly inflating credit ratings on mortgage bonds that were at the centre of the 2008 financial crisis. Rival rating agency S&P Global Ratings, has already settled over similar allegations, paying out $1.5bn.John Goggins, general counsel at Moody’s, was asked about the investigation at Wednesday’s investor conference. He said it was not appropriate to comment on the ongoing investigation but Moody’s would make appropriate disclosures in the event of material developments in any litigation matter.Moody’s declined to comment on the job cuts.
49;MCO;Moody's Corp;2016-09-15T16:10:01Z;South Africa political woes trigger downgrade review on state groups;Credit rating agency raises concerns about corporate governance;Five of South Africa’s state-owned companies, including the power utility Eskom, have been threatened with a credit rating downgrade over concerns about corporate governance and the political climate in Africa’s most industrialised economy.Moody’s, the credit rating agency, placed its Ba1 rating on Eskom under review due to “the rising funding challenges faced by [the company] in the context of an adverse regulatory framework and evolving political environment”.It is also reviewing the ratings of Development Bank of Southern Africa, Industrial Development Corporation, Land and Agricultural Development Bank of South Africa, and the South African National Roads Agency.Moody’s decision comes at a delicate moment for South Africa’s sluggish economy. Though the country has thus far managed to stave off recession, growth is low and the government continues to battle high unemployment and yawning inequality. Both were significant factors in the ruling African National Congress’s worst-ever electoral performance in local elections in August.It also comes amid a high-stakes power struggle that has pitted the Treasury against powerful state entities, including Eskom. The Treasury has publicly accused Eskom, the biggest buyer of South African coal, of hindering an investigation into a contract with Tegeta Exploration and Resources, a company with ties to the powerful Gupta family. Eskom has said it has co-operated with the Treasury’s requests and the Guptas deny any wrongdoing.South Africa’s state-owned enterprises, which are a major employer and provide vital infrastructure and services across the country, have come under scrutiny in recent years for their poor management and performance. Among other problems, they are also a huge strain on the government’s already stretched coffers.In his budget speech this year, Pravin Gordhan, finance minister, emphasised the need to reform the country’s state-owned companies, and pledged that further government financial support to them would depend on “firm resolution of governance challenges”.In August, President Jacob Zuma was named head of a new council tasked with overseeing state-owned enterprises, a move that raised questions over the necessity and motivation of adding another layer of supervision over the companies.In recent months, Mr Gordhan has been the subject of a controversial probe into the tax authority by a special police unit, raising concerns that Mr Zuma may be seeking to remove him and replace him with a more pliant finance minister. Mr Zuma has said he fully supports Mr Gordhan but could not intervene in the investigation.Anoj Singh, Eskom’s chief financial officer, described the Moody’s review as “unfortunate” and said the company’s financial position had improved following a turnround plan.Moody’s said the utility’s rating could be confirmed if it demonstrated it has continuing access to liquidity and the agency’s assessment of its government support remains unchanged.Moody’s said the utility’s rating could be confirmed if it demonstrated it has continuing access to liquidity and the agency assesses that its government support remains unchanged.Earlier this month, Futuregrowth Asset Management, a specialist investment firm that manages about R170bn ($11bn) in assets, said it would stop lending to several of South Africa’s largest state-owned enterprises, including the five placed on review by Moody’s, due to concerns over the companies’ governance and “decision structures”.
