;Ticker;Nombre_Completo;Date_Time;Titular;Subtitular;Texto
70;MCO;Moody's Corp;2015-01-13T22:36:19Z;Contractors caught in Petrobras scandal;Fitch cuts ratings for builders facing financing constraints in wake of kickbacks probe;"The fallout from a scandal at Brazil’s Petrobras deepened on Tuesday with the downgrade of the credit ratings of several of the state-run oil operator’s construction contractors.Fitch downgraded its ratings for builders Construtora Queiroz Galvão, Galvão Participações, Galvão Engenharia and Mendes Júnior Trading and Engenharia with the first three remaining on negative outlook.The rating agency said it was concerned that an investigation into allegations of a political kickback scheme at Petrobras meant “decreasing financing options for most companies in the sector; yet-to-be determined punitive measures . . . and the potential restructuring, suspension or delays [of] existing contracts with Petrobras”.Employees of Petrobras and some of its contractors have been accused by police of inflating the value of projects for their own profit and paying kickbacks to politicians, mostly from the ruling Workers’ Party coalition.While some of the contractors have denied involvement, the sector is under scrutiny in markets after OAS, another Petrobras contractor, missed two payments on its debt and is edging closer to a formal default.Petrobras has also frozen payments to 23 construction groups, raising the prospect of further financial distress in a sector that is considered essential to the country’s drive to improve its inadequate infrastructure.The impact of the scandal has started to spread beyond construction to other service providers of Petrobras, with Moody’s Investors Service announcing on Tuesday it was reviewing the ratings of the oil company’s drilling rig contractors.Moody’s said this was due to “the convergence of a number of credit pressures, including weakening industry fundamentals, uncertainties due to the ongoing corruption allegations and liquidity risk associated to the deteriorating credit profile of [Petrobras]”.In its statement, Fitch said, however, that it had maintained the ratings of several of Brazil’s bigger construction groups that were also caught up in the scandal.One of these, Camargo Corrêa, had seen its chief executive, vice-president and chairman of the board of its engineering and construction subsidiary incarcerated, Fitch said.Yet the engineering unit accounts for only a relatively small proportion of the group’s earnings, which are supported by its cement division.“If Petrobras’ ban continues for six months, and if it extends to the cement division, a negative rating action is likely,” Fitch said of Camargo Corrêa.It said two other large contractors, Construtora Andrade Gutierrez and Construtora Norberto Odebrecht, were also on the list of companies temporarily banned from new deals with Petrobras. But Fitch did not downgrade them, saying Petrobras represented only a fraction of their order books."
71;MCO;Moody's Corp;2020-04-25T03:00:02+0000;Rating agencies: Outlook unchanged;Criticised for their role in the crisis, the big three actors were expected to reform – but their efforts have come unstuck;"Paul Taylor reaches into a folder of papers. “Cue another prop,” he says. The chief executive of Fitch Ratings, the number three credit rating agency, brandishes a report his analysts recently put out entitled “Bond bubble threat for US corporate bond investors”, which warns that there could be significant losses across the financial system if interest rates rise and bond prices go south. It is the latest in a string of “big picture” publications designed to persuade us that Fitch is thinking big thoughts, that it is taking a bird’s-eye view of the world economy and that it is not the type of company to miss, say, a whopping financial crisis in the making.“We have a lot of internal debate,” he says. “I could give you all kinds of internal discussion, emails and documents from 2004 about the US housing market. None of that was ever published as research – and at the end of it we didn’t follow it, we got it wrong. But had we had some kind of report out at that point saying, ‘we’re concerned about this, we’re not sure, we think about it, there’s some tail risk going on here’, then we’d have been in a far better position than we currently are, because we wouldn’t be seen as quite so silly as people think we were.”Rating agencies’ outsized role in the credit crisis is well known. By validating the transformation of subprime mortgages into triple A rated securities, based on mistaken assumptions about the US housing market, they contributed to the infection of the global financial system.The public and political opprobrium has been intense, with much of the blame laid at a central conflict of interest in the agencies’ business model, namely that they are beholden for their revenues on the issuers of the debt they are judging. Their high-impact downgrades of sovereign debt in Europe and the US have made them even more unpopular.Yet one by one, ideas for radical reform of the industry have failed. Issuers still pay the bills and still get to pick which agency rates their debt. Power is still concentrated in the big three agencies – Standard & Poor’s, Moody’s and Fitch – that rate 96 per cent of all the world’s bonds. And attempts to strip credit ratings of their central role in financial regulation are proving complicated. So why does the post-crisis landscape look such a lot like it did pre-crisis? Critics of the industry point to intense lobbying by rating agencies and Wall Street more generally, as powerful market actors assert their self-interest.But there is an alternative view, recognised by some of the smaller rating agencies who hope to gain from the discomfort of the big three, which is that many mooted changes foundered on the rocks of impracticality.Executives at the leading agencies say the need for radical change was always based on a false premise.In the long menu of possible causes of the credit crisis from which historians will choose, the “issuer-pays” business model of the credit rating agencies will surely remain a favourite.The model has proved impossible to change.To continue reading, click here“That conflicts of interest led to inflated ratings at Moody’s is a concept I categorically reject,” says Raymond McDaniel, the agency’s chief executive. “One way to try and answer this is to make the argument in the negative. Why would it affect only housing and why would it affect only mortgage securities?”While the assumptions about ever-rising house prices were wrong, other Moody’s ratings on complicated structured finance products, based on different assumptions about how many people would pay their credit-card bills or make good on their car loans, performed well over the deep recession, he said. Fitch and S&P make a similar point.In the US, a Senate committee found that credit rating agencies “at times gave into pressure from the investment banks and accorded them undue influence in the ratings process”, but no evidence that has led to any action by regulators. An Australian court, finding against S&P, said a “reasonably competent” rating agency could not have given a triple A rating to mortgage-backed securities that the judge described as “grotesquely complicated”, but in the US and Europe agencies have so far largely been successful in fighting off liability for the fallout from faulty ratings.Rating agencies’ processes for managing conflicts of interest are now more closely scrutinised following a demand by the G20 in 2009 that they be brought under the oversight of regulators. Nine agencies are formally registered in the US and 20 in Europe.Outside the big three there is consternation. Smaller rivals fear that the cost of new rules is entrenching the status quo, making it ever harder to shake up the industry.“It’s hard for anybody to complain too loudly about all this new, relatively onerous regulation because it’s pretty obvious why we are finding ourselves in this situation,” says Dan Curry, president at DBRS, Canada’s dominant rater, which has been trying to build a bigger global footprint. “We tried to politely point out to regulators that they designed all this regulation looking at, particularly, Moody’s and S&P, and a lot of these smaller agencies are going to get caught in the crossfire. Everyone’s saying they’d like more competition but what you’re doing is impeding competition and creating big barriers to entry.”According to executives at the big three companies, they are entrenched for a reason: reputations and analytical prowess built up over generations. S&P traces its history back to 1860, when Henry Varnum Poor published his History of the Railroads and Canals of the United States; John Moody & Company published Moody’s Manual of Industrial and Miscellaneous Securities in 1900. Fitch, established in 1913, thinks of itself as a hungry young challenger, and the best horse for those looking to back competition in the industry.Mr McDaniel is sceptical that the industry can sustain many more actors. “There were eight or nine agencies back in the late 80s and early 90s. They had a choice to compete or to sell out, and they chose to sell.”On both sides of the Atlantic, reformers have pushed an idea they say will deal with the conflict of interest at the heart of the “issuer pays” business model and encourage more competition for the big three. The idea is that there would be an independent body to stand between the issuers of asset-backed securities and the rating agencies, assigning work on new issues to agencies in rotation or according to expertise. Smaller rivals that might otherwise find it hard to persuade issuers to use them will be able quickly to build a record of ratings.However, a reform package unveiled in November by Michel Barnier, EU commissioner for financial services, limited the idea to so-called resecuritised products – instruments that have all but died out since the financial crisis.In the US, the idea of a central rating assignment body is being championed by Senator Al Franken, but a Securities and Exchange Commission report last month sounded sceptical. It spent 390 words on the benefits of the idea and 1,700 words on the drawbacks, and recommended only that there be more discussion.“This is the easiest way to make sure there is no conflict of interest and to break the oligopoly,” Mr Franken said. “Unless it is addressed, people are going to get hurt again and the whole economy is going to get hurt again.”In some areas of the market, there are stirrings of greater competition. When it comes to ratings on new commercial mortgage-backed securities (CMBS), instruments made out of parcels of loans on office blocks and retail parks, you are as likely to find newcomers Kroll, Morningstar and DBRS as you are S&P, which withdrew from the market for a year while it fixed mistakes in its ratings model.Yet for all DBRS’s progress, and even if the Franken plan were to be implemented, Mr Curry cautions that it will be a long time before newcomers nibble any significant market share from the big three. “Even something that looks like a big change is going to actually cause things to change gradually over many years,” he said.…There is at least one other big item on the reform agenda that is being implemented. The G20 urged regulators around the world to stop relying on credit ratings for judging the safety and soundness of the banks and financial companies under their purview. So what if S&P and Moody’s decide that the assets on a bank’s balance sheet are investment grade? Regulators should come up with other ways to decide how risky an asset is and therefore how much capital a bank must hold in reserve in the event of losses. The idea is to reduce the importance of credit ratings to the overall financial system and to make sure there is less damage the next time that the agencies miss, for example, a whopping crisis in the making.However, it has proved easier to wipe away references to credit ratings than it has been to decide what to replace them with.The Bank for International Settlements, writing new international capital requirements known as Basel III, is consulting on complicated rules governing how banks can use their own internal models for deciding the credit risk of structured finance assets. It recognises, however, that some smaller institutions will not be sufficiently sophisticated to do this and will instead have to rely on rating agencies after all.Some work by the UK Financial Services Authority has found that banks’ own models, relative to external credit ratings, will sometimes understate the risks.Larry White, the New York University professor who argued for eliminating ratings from prudential regulations, admits it is hard work. “You need more regulators, you need them to be well paid and you need them to be respected.”It is at least work that the rating agencies themselves profess to welcome. None wants their ratings to be treated as gospel; none wants downgrades to cause shockwaves through the financial system because of automatic triggers in capital rules. They just want to be seen making an honest, educated and hopefully more successful job forecasting the future.“I don’t want to give the impression we haven’t changed,” Fitch’s Mr Taylor says. “We’ve changed lots. We’ve changed people, we’ve changed process where we’ve needed to, we’ve got a lot better at publishing more information. But I don’t want to just sell that point. The important point is lots of what we were doing was working absolutely fine and has continued to work fine. And one of the reasons I feel a bit sorry for ourselves is, if you look at the people who use our product, if you look at our customers, they know that.”"
72;MCO;Moody's Corp;2010-05-04T17:42:16Z;Barnier considers EU rating agency;;The European Union senior financial services regulator said on Tuesday he would look at setting up a European credit rating agency, as he expressed concern over the way in which Greek debt was dealt with.Michel Barnier, EU internal market commissioner who has responsibility for the financial services sector, told European lawmakers that he had watched, with surprise, the “rapid deterioration of the [Greek] rating”.“I’m as frustrated as you are,” he said.Speaking to the European parliament’s economic and monetary affairs committee, Mr Barnier said the agencies had considerable power and that was why he urged them last week to act responsibly and consider the impact of their actions.The commissioner noted that new pan-EU rules governing credit rating agencies – which will require them to register for the first time and be more transparent about their ratings methodologies – will come into force in December. This legislation was passed last year, in the immediate aftermath of the 2008 financial turmoil when the role of agencies was subject to much criticism.Mr Barnier held out the possibility that there could now be further constraints on agencies’ activities. “Will that be enough ? I don’t know. We’ll have to evaluate the situation very quickly,” he told MEPs.One area the commissioner highlighted, in particular, was whether there should be more diversity in the rating agency market – which is dominated by three players, Standard & Poor’s, Moody’s, and Fitch.“We need more competition and diversity in rating agencies,” he said.The creation of a new European-based rating agency, which could specialise in sovereign debt, could help resolve that problem.But Mr Barnier gave few details of how such an institution might work and whether, for example, it should be publicly or privately owned. Officials said later the commission’s thinking in this area was still at a very early stage.Rating agencies maintained on Tuesday that they were performing a duty to investors by providing an independent view of long-term credit risk.Mr Barnier’s comments came in the course of a wide-ranging hearing, in which he laid out the commission’s extensive plans for new financial services regulation this year and promised that Brussels would fulfil all its G20 commitments on this score over the next 12 months.Mr Barnier also said he would be asking the commission to adopt a “green paper” aimed at reinforcing corporate governance in financial groups next month and going ahead with improvements to the deposit guarantee fund directive this summer.He also pledged to go further, in terms of new disclosure rules on short selling, than the current proposals put forward by EU securities regulators.The commissioner also proposed delaying the entry into force of solvency rules for the insurance sector until the end of 2012. Although the delay is just two months, it could give more time to thrash out fine details for the new regime, which are proving contentious, and fit better with the accounting deadlines of most EU insurers.
73;MCO;Moody's Corp;2010-04-28T23:17:58Z;CDO fees flow to ratings agencies;;Credit rating agencies are still being paid millions of dollars a year to report on the performance of collateralised debt obligations that have lost most of their value despite having been issued in many cases with triple A stamps of approval.The fees, known as “ratings surveillance” payments, are paid to the agencies ahead of any payments to investors under the terms of the CDO contracts – and without regard to how accurate the original ratings were.US regulators including the Federal Deposit Insurance Corporation have proposed new rules to link such fees to the performance of the underlying deals. This was not a common practice in the run-up to the financial crisis.The terms of the CDO contracts highlight how lucrative these instruments were for the agencies, with annual pay-outs of up to $50,000 made to track deals. Such payments come on top of the fees received to rate the initial transactions. The fees paid to the rating agencies have become controversial following the collapse of so many securities that were issued with the highest ratings.A congressional investigation found last week that Moody’s Investors Service and Standard & Poor’s, the biggest rating agencies, were unduly influenced in assigning ratings on CDOs by the banks that paid these fees.Ratings surveillance fees are still being paid on CDOs that have suffered “an event of default”, meaning payments to some investors have ceased. Such CDOs often escape liquidation because of the complexity of the underlying contracts.Ramius, which handles CDO liquidations, estimated that 290 mortgage-related CDOs that have had an “event of default” have not been liquidated yet.As long as these CDOs are not liquidated, they typically allow for payments to service providers, including ratings agencies.These payments are at the top of the “waterfall”, the term used to describe the way money is passed through CDOs, which pool debts or securities and distribute the cash to investors. Even the most distressed CDOs often still generate some cash.From 2004 to 2007, Moody’s and S&P produced a record number of ratings and record revenues, primarily because they expanded their business rating mortgage-backed securities and CDOs.The liquidation of CDOs has created friction between investors in different tranches. In some cases the rights of various investors are not clear in the contracts underpinning the deals. These legal battles mean even toxic CDOs can continue to exist for many years.Moody’s and S&P declined to comment.
74;MCO;Moody's Corp;2010-04-28T21:42:50Z;Senator targets ‘conflicts of interest’;;Carl Levin, the Democratic senator who presided over this week’s 11-hour interrogation of Goldman Sachs executives, on Wednesday laid out a case for legislation to end “conflicts of interest” on Wall Street.Mr Levin said his committee’s 16-month inquiry into the root causes of the financial crisis has resulted in “deeply troubling findings” that underlined the need for financial services reform.His office said he planned to introduce legislation to address conflicts at credit ratings agencies, end the issuance of negatively amortising mortgage loans and patch holes in regulatory enforcement.Any legislation sponsored by Mr Levin would be added as an amendment to the financial regulation reform bill that is being hashed out in the Senate.“We have got to build a fence against these kinds of excesses,” Mr Levin said.There are other steps he could take in the wake of the permanent subcommittee’s investigation into Goldman. The panel will issue a final report on its findings and has left open the possibility that its investigation could continue. It could also hold further hearings into complex financial products sold on Wall Street.The Senate panel has the authority to refer matters to the US Department of Justice, a right it has used sparingly in its history.For Goldman and other firms in Mr Levin’s line of fire – including Moody’s and Standard & Poor’s, the rating agencies – this means pressure from the committee could continue after the hearings end.Referrals are taken seriously by the DoJ because of the panel’s long history of bipartisanship, said Ray Shepherd, a former chief counsel of the committee when it was run by ex-Senator Norm Coleman.The subcommittee – officially known as the Permanent Subcommittee on Investigations – was established during the second world war, when it investigated war contracts.The committee’s power was abused by Joseph McCarthy, who chaired it in 1953 and used it to investigate whether government officials were communists.This led to rules that force the panel to act in a bipartisan fashion. Mr Levin has proven to be one of the most effective chairmen of the subcommittee.Investigations into money laundering in the late 1990s led to rules enshrined in the Patriot Act. Mr Levin has investigated Riggs Bank, KPMG, Enron and UBS, each of which faced legal scrutiny by criminal or civil authorities.
