;Ticker;Nombre_Completo;Date_Time;Titular;Subtitular;Texto
0;MCO;Moody's Corp;2020-04-25T03:00:02+0000;Rating agencies brace for backlash after rash of downgrades;Critics claim S&P, Moody’s and Fitch might be poised for rerun of 2008 financial crisis;"Credit rating agencies are scrambling to adjust to the coronavirus pandemic, slashing assessments of vulnerable companies under the scrutiny of critics who blame them for exacerbating the last financial crisis.The agencies — led by the big three of S&P Global, Moody’s and Fitch — have pushed through large amounts of rating downgrades as the Covid-19 outbreak has accelerated. March had the fastest pace of downgrades, on records going back to at least 2002, according to a report last week from Bank of America. The bank added that more issuers could expect to have their ratings docked in the weeks ahead.To critics, this is a rerun of the 2008 financial crisis, when ratings that were set too high came tumbling down, magnifying a sense of alarm, particularly in markets for securitised products that were packed with mortgage-backed bonds.“Here we are, déjà vu all over again,” said Dennis Kelleher, head of Better Markets, a consumer advocacy group. Ratings are being cut “after what appears to be . . . significant ratings inflation, also just like last time”, he said.Agencies say they are simply reacting to changed circumstances, reflecting sudden strains that have emerged as a result of the coronavirus outbreak. “We are really just trying to call it as we see it, being balanced, but also acknowledging that this is a very big stress that the economy is facing,” said Craig Parmelee, global head of practices at S&P.About 80 per cent of S&P’s ratings actions since early February — about 213 downgrades out of 4,000 rated non-financial companies — have been on issuers already in “junk” territory before the coronavirus crisis, the company noted.“We are taking a considered approach to downgrades across geographies and asset classes,” said Anne Van Praagh, head of Moody’s credit strategy and research. “Our job is not to move all ratings down; that does not serve anybody. Our job is to identify the outliers.”Concerns that ratings were set too high before the coronavirus outbreak stem from the business models of the agencies, which are paid by the companies and the governments whose creditworthiness they assess. A rating from a top agency can make the sale of a bond or a loan much easier, providing investors with notionally independent views of the borrower’s prospects. Such views are also hard-wired into the mandates under which many fund managers operate, forcing them to sell bonds if ratings drop below certain thresholds.The Financial Times is making key coronavirus coverage free to read to help everyone stay informed. Find the latest here.But issuers generally pay to be rated — a structure that can cause conflicts, leading to accusations that agencies compete to win business by offering high ratings.In 2015, S&P agreed to pay the US and states about $1.4bn to settle allegations that it boosted ratings on mortgage-backed securities in the run-up to the crisis, admitting that it held off on downgrades for fear of losing market share. Moody’s paid $864m in 2017 to settle similar charges.Today the pair accounts for 81 per cent of outstanding credit ratings, according to a January 2020 report from the Securities and Exchange Commission. Fitch makes up another 13.5 per cent of the market.Before the outbreak intensified, regulators had been asking questions about the agencies’ business practices. In November SEC chair Jay Clayton said the activities of the agencies should be “continually” monitored, while asking whether there were “alternative payment models” that would better align the interests of rating agencies with investors.Egan-Jones, a smaller rating agency that is paid by investors rather than issuers, said in a January letter to the SEC that “no amount of disclosure or internal separation of ratings and marketing staff is sufficient to overcome the taint created by such conflicts”.In their letters of response to the SEC, Moody’s and S&P said potential conflicts were inherent in all rating-agency business models.It is still the same after 10 years. Nothing much has changedAnalysts note that the “issuer pays” model also causes some recipients of downgrades to behave as if they are aggrieved customers of the agencies, rather than subjects of unbiased assessments. Last month SoftBank, the debt-laden Japanese group, complained about a downgrade from Moody’s, saying the agency had made “excessively pessimistic” assumptions about the market environment.Investors often make decisions independently of the assessments of rating agencies. This week, cruise operator Carnival paid handsomely for a new bond issue despite its “investment-grade” ratings, as fund managers judged the company to be in peril after the viral outbreak.The debate over rating agencies’ business models is unlikely to fade, as this time the scope of cuts is much broader than the realm of structured products. Already, downgrades of big companies such as carmaker Ford and retailer Marks and Spencer, from the lowest rung of investment-grade ratings into junk, have appeared to cause ructions in credit markets.The old flaws in business models are becoming obvious once more, said Riddha Basu, an assistant professor at George Washington University.“It is still the same after 10 years,” he said. “Nothing much has changed.”"
1;MCO;Moody's Corp;2020-03-30T16:11:39Z;South Africa’s rand hits record low after debt downgrade;Coronavirus inflicts further damage on country already hit by poor economic growth;The South African rand hit a record low against the US dollar after Moody’s removed the last investment-grade credit rating for Africa’s most industrialised economy, citing the hit to economic growth from the coronavirus pandemic.The rand weakened as much as 2 per cent to move past 18 against the US dollar on Monday, following the rating agency’s downgrade of South African debt to junk on Friday. By mid-afternoon, the currency had regained a little ground to trade at 17.99.The Moody’s downgrade completed South Africa’s descent into junk status after rivals S&P Global and Fitch Ratings removed their investment-grade ratings in 2017, highlighting mounting strains on public finances and persistently poor economic growth.South African bonds will now be removed from indices used worldwide to track investment-grade debt, adding to pressure on the currency as some investors will be forced by their mandates to sell their holdings.Moody’s kept the country’s debt on a negative outlook as it said that the shutdown of pandemic-struck economies around the world “will exacerbate” economic and fiscal challenges.“South Africa is entering a period of much lower global growth in an economically vulnerable position,” the rating agency said. “The government's own capacity to limit the economic deterioration . . . is constrained.”The country is under a three-week lockdown ordered by president Cyril Ramaphosa. Cases of coronavirus in South Africa have surged past 1,000.Even before the crisis, government debts were expected to rise to more than two-thirds of economic output as a result of costly bailouts for struggling state companies and weak growth.“To say we are not concerned and trembling in our boots about what might be in the coming weeks and months is an understatement,” said Tito Mboweni, the South African finance minister, at the weekend.FTSE Russell, operator of the widely-used benchmark World Government Bond index, has postponed the removal of South African bonds until the end of April because of what it called “extremely stressed” markets.The Financial Times is making key coronavirus coverage free to read to help everyone stay informed. Find the latest here.South African bonds have a weighting of about 0.4 per cent in the index, which implies up to $10bn of forced selling, according to UBS analysts. They said part of this outflow was likely to have taken place, adding: “As a rough rule of thumb, we estimate that a $5bn portfolio outflow shock can be neutralised by a 5 to 10 per cent depreciation in the real exchange rate.”The rand has lost more than a quarter of its value this year.South African government debt has sharply sold off in recent weeks as investors pulled money out of emerging markets at a record pace.The yield on South African 10-year bonds rose above 12 per cent last week before the country’s central bank announced it would begin buying government debt in secondary markets to calm the turmoil.
2;MCO;Moody's Corp;2020-03-25T19:13:51Z;SoftBank tries to debunk junk rating;Amazon and Flipkart couriers caught in Indian lockdown, Royole FlexPai 2 foldable;"The state of SoftBank’s finances has become a very touchy subject for the Japanese tech combo as it comes under increasing fire over its investment strategy and takes extraordinary measures to rein in debt.It put out a two-page statement attacking the Moody’s credit rating agency on Wednesday for a downgrade that put it deeper into junk territory.“While Moody’s continues to characterise SBG’s financial policy as aggressive, we believe that, even applying Moody’s stated rating criteria to the Program, there is no rationale for a two-notch downgrade to SBG’s ratings,” it said.The downgrade came two days after SoftBank said it planned to sell $41bn of its assets to pay down its heavy debt load and to increase the scale of a share buyback. Those actions have triggered a 55 per cent jump in its share price, which fell to a four-year low last week as investors panicked over its hefty debt exposure. That stood at $170bn at the end of last year, so the $23bn just allotted by SoftBank for paying off debt will not make a big dent in that.It’s this kind of irritating scrutiny by the likes of Moody’s that makes a founder like Masayoshi Son think about going private, which is exactly what happened last week, according to our FT scoop.1. Amazon and Flipkart caught up in Indian freeze
India’s biggest ecommerce businesses Amazon and Walmart-owned Flipkart have been forced to suspend all services, amid confusion over whether their couriers are exempt from the strict 21-day coronavirus lockdown.2. Broadband engineers lockdown
Frustrated broadband users in the UK looking to change internet provider may not be able to switch after BT said its Openreach engineers would prioritise essential fault repairs and upgrades to avoid unnecessary home visits. Broadband provider Virgin Media is hiring 500 call centre people in the UK to cope with customers looking to upgrade their broadband. 3. BBC suspends job cuts
The BBC has suspended a sweeping reform of its news operations to concentrate on its public broadcasting role during the coronavirus crisis, temporarily saving the jobs of hundreds of journalists. Director-general Tony Hall said the proposed £40m worth of cuts, which would lead to shows being taken off air and 450 job losses, was to be put on ice.4. Tech predictions for a post-virus world
It is hard to imagine what the world will look like in a year’s time after just a few weeks of coronavirus-enforced quarantine. Will “stream shaming” become a popular pastime? Will iPod prices shoot up on eBay? Tim Bradshaw predicts what he might be reporting on a year from now.Chinese start-up Royole has been a pioneer in flexible and foldable screens in phones, beating Samsung and Huawei to the punch in 2018 with the first commercialised foldable phone, the Royole FlexPai (pictured above).It has been slower out of the blocks with its follow-up, the FlexPai 2, finally unveiling some details of its forthcoming model in a Wednesday presentation. It comes with a large, 7.8-inch external 'outie' display with a 4:3 aspect ratio, reports Tech Radar. It will also feature a more robust hinge system. The launch is expected in the next three months, but no pricing is available yet"
3;MCO;Moody's Corp;2020-03-25T12:24:02Z;SoftBank attacks Moody’s after debt downgrade;Rating agency’s decision to move technology group down two notches draws angry response;SoftBank has demanded that Moody's remove all of its bond ratings on the Japanese conglomerate, after the rating agency issued a two-notch downgrade that cut its debt deeper into junk status. The group led by Masayoshi Son, the risk-seeking Japanese dealmaker, immediately accused Moody’s on Wednesday of having “biased and mistaken views”.The downgrade came two days after SoftBank said it planned to sell $41bn of its assets to pay down its heavy debt load and to hugely increase the scale of a share buyback.Those actions have triggered a 55 per cent jump in SoftBank share price, which fell to a four-year low last week as investors panicked over its hefty debt exposure. Moody’s cited SoftBank’s “aggressive financial policy” for its decision to cut its rating from Ba1 to Ba3, saying the value of the group’s portfolio would be reduced if it sold off its lucrative stakes in Chinese ecommerce group Alibaba and Sprint during the market volatility caused by the coronavirus pandemic. “Asset sales will be challenging in the current financial market downturn, with valuations falling and a flight to safety,” said Motoki Yanase, Moody’s senior credit officer, in a statement. The company hit back, saying: “[SoftBank Group] believes that Moody’s ratings action is based on excessively pessimistic assumptions regarding the market environment and misunderstanding that SBG will quickly liquidate assets without any thorough consideration.”The downgrade may increase borrowing costs for the group, which has $55bn in net debt. Yields on SoftBank’s perpetual bonds, which have no maturity date, climbed above 11 per cent after a sell off in Wednesday morning trading.The FT revealed this week that Mr Son explored an attempt to take the company private over the weekend with investors including activist hedge fund Elliott Management, before choosing to proceed with a plan to sell its assets.While the company has not revealed what it will sell, analysts expect the sale to be a mix of its shares in US carrier Sprint following its merger with T-Mobile, Alibaba, and its domestic mobile unit which is listed on the Tokyo market. People close to the company said the choice of assets would change depending on market conditions. This month, rating agency S&P Global cut its outlook on SoftBank to negative after it also raised concerns about the group’s earlier plan to carry out a smaller share buyback. But following SoftBank’s announcement on Monday, S&P said the huge asset sale has “potential to ease the downward pressure on its credit quality” and reduce its debt load by ¥2tn ($18bn). “As much as we hate to pick sides, we do not follow Moody's rationale here,” said Mary Pollock, an analyst at research firm CreditSights. But Ms Pollock said that she believed the rating agency was behind the curve in cutting the Japanese group's rating.“We would go so far as to say Moody's are using the [SoftBank Group] asset sale announcement as an excuse to re-rate a credit which was overdue a downgrade,” she said.While its debt relative to cash flow mean that western rating agencies class SoftBank as junk, the group has an investment-grade rating from the local Japanese rating agency, JCR.SoftBank has taken advantage of this higher domestic credit rating to raise debt from retail investors. The group last year became the biggest issuer of debt sold to “Mrs Watanabe”, the catch-all term for Japan’s army of retail investors, accounting for more than half of all outstanding retail bonds from companies and financial institutions in March last year.
4;MCO;Moody's Corp;2020-04-25T03:00:02+0000;Corporate borrowing costs soar amid default fears;Interest rates for even highly rated companies double from levels of days ago;Borrowing costs for companies around the world are rising dramatically despite central bank interest rate cuts as rating agencies warn that the economic impact of the coronavirus will lead to a surge of corporate downgrades and defaults.Fears about creditworthiness are prompting investors to put their money in the most easily traded securities — such as short-term government debt — raising borrowing costs for more highly rated corporate borrowers and choking off credit to riskier ones.Rating agency Moody’s estimates the default rate for speculative-grade companies could hit nearly 10 per cent, with energy companies particularly hard hit. That is up from 2.3 per cent a year ago, and a historical average of 4 per cent.“I think the pandemic coupled with the oil price crash and the asset price declines are creating a severe and extensive credit shock across regions, sectors and markets,” said Anne Van Praagh, a researcher at Moody’s.“The combined credit effects are unprecedented. This is not like anything we have seen before.”Even highly rated companies that have been able to sell bonds during the outbreak have agreed to deals that will increase their total financing costs by hundreds of millions of dollars as revenues are threatened by an economic downturn.The average yield for investment-grade corporate debt has risen from a year to date low of 2.26 per cent two weeks ago to 4.7 per cent on Friday, according to an index run by Ice Data Services.“It’s brutal. We have never seen such a big move in such a short amount of time,” said Monica Erickson, a portfolio manager at DoubleLine. “This is the quickest and most severe I have ever experienced, and I was around for 2008.”For higher-risk “junk” rated companies, the sell-off has been even more severe, with the average yield on an index run by Ice doubling this month to over 10 per cent.Companies have scrambled to raise as much cash as possible, with roughly $60bn of bonds sold by investment grade companies this week in the US, including more than $16bn on Friday.The companies selling debt are all high-quality names, such as a $5bn bond sale for Coca-Cola and an $8bn deal for Intel, with those outside the very top tier still shut out from capital markets.“Companies are focused on increasing liquidity, drawing down revolvers and accessing cash wherever possible. They are preparing for the worst because we are in an unprecedented environment,” said Ms Erickson.
5;MCO;Moody's Corp;2020-02-19T13:42:02Z;Bankruptcy risks rise for US shale;Credit crunch looms for producers as ‘staggering’ amount of debt nears maturity;Bankruptcy risks in the US shale sector are rising, with weak oil prices and tightening access to credit worsening the outlook for some producers just as a “staggering” $86bn in debt maturities start to come due.Speculative-grade, or subinvestment, debt makes up more than 60 per cent of the total to be repaid between now and 2024, “implying a higher degree of default risk for the industry”, said Moody’s, the rating agency, in a report on Wednesday. Speculative-grade maturities will peak in 2022, dwarfing investment-grade maturities by almost two to one that year, Moody’s said. But weakening oil and gas prices, and bearish market sentiment — caused by expectations of a global oil-supply overhang in the first half of 2020 — will hurt producers’ efforts to raise more money this year, in turn threatening to starve them of capital to invest in production to keep cash flow intact, said analysts.Companies already rated at subinvestment level and those focused on natural gas are especially exposed and will face investors that have developed a “risk aversion” to the sector, said the Moody’s report. Natural gas-focused Antero Resources, EQT and Chesapeake, which between them hold debt of more than $5bn due to mature between now and 2024, were among 12 companies Moody’s said would face a “particularly challenging” refinancing outlook.“While these companies have already taken some measures to address maturities, more needs to be done,” said Moody’s.In January, the average interest rate paid by shale producers for corporate debt rated by Moody’s as B3, or highly speculative, was 400-500 basis points above the average for B3 rated debt across all sectors, said Sajjad Alam, the lead author of the Moody’s report. Oil prices have fallen more than 15 per cent since early January, reflecting worries about global oversupply that have been exacerbated by the weakness of Chinese demand since the coronavirus outbreak. Meanwhile, front-month US natural gas prices plunged to their lowest February close in 20 years last week, amid unseasonably warm weather.But US shale producers are also victims of their own longer-term success. Natural gas output in the Lower 48 states of the contiguous US has almost doubled since 2005 and crude oil production has leapt almost 160 per cent since 2008.US natural gas production, which hit a record high in 2019, would rise by another 2 per cent this year, according to a forecast last week by the Energy Information Administration, a division of the Department of Energy. Crude oil production would increase almost 8 per cent, to 13.2m barrels a day, it said.That already represents a slowing of recent annual growth rates, but the looming credit crunch and increased cost of capital for indebted producers, alongside persistent weakness in oil and gas prices, could further damp production growth expectations, said analysts.
6;MCO;Moody's Corp;2020-02-18T19:44:23Z;Moody’s downgrades Renault to ‘junk’ after profits almost wiped out;French carmaker punished on worries it will struggle to restore healthy operating margins;French carmaker Renault has suffered a downgrade to “junk” status as it was punished for poor results last year when the group’s profits were almost wiped out.Rating agency Moody’s dropped the group’s debt to one notch below investment grade, which was triggered by the company’s “substantially weakened” operating performance last year.Rival rating agency S&P has put the company on “credit watch negative”, meaning it could also drop the group to junk. The other main agency Fitch has an investment grade rating for the company’s debt.The downgrade of the French carmaker’s debt to Ba1 by Moody’s was based on its view that the carmaker would need time to restore healthy profit margins.“Based on the company’s 2020 guidance anticipating a further decline in the group’s operating margin and the continuing weakness of the market environment, we do not expect that Renault will be able to restore healthy operating margin levels in the medium term,” Moody’s said in a statement. Moody’s outlook for the rating is now stable.S&P said the move “reflects our belief that a recovery in free cash flow generation in line with our earlier expectations . . . might take longer than 24 months.“We believe that the company's intended countermeasures could be difficult to implement, given the unfavourable market conditions, and this could stir up resistance from various stakeholders.”Renault declined to comment.The carmaker’s shares have fallen close to 30 per cent this year. That performance follows a year during which the arrest of former boss Carlos Ghosn shook the group and its relationship with partner Nissan and saw both sides of the alliance shake up their management teams.Those pressures are piled on top of the woes suffered by the car industry at large, which is grappling with slowing demand in China and tough new targets for CO2 emissions.Renault last week revealed that its profits were almost wiped out in 2019 as it faced falling margins in its core business — predicted at 3 to 4 per cent next year, down from 4.8 per cent in 2019 — and a collapse in income from Nissan. Contributions from Nissan, of which Renault owns 43 per cent, dropped 84 per cent to €242m last year. This followed the worst performance at the Japanese carmaker for a decade.Renault also cut its dividend and lowered profit guidance for this year as it launched a €2bn restructuring effort, with interim chief executive Clotilde Delbos set to announce swingeing cuts in the near future.However, sentiment was further hit on Tuesday, said analysts, by French finance minister Bruno Le Maire warning the company that it should not close factories or endanger French jobs as part of its cost-cutting.Renault will hope to have put some of its issues behind it by the time incoming chief executive Luca de Meo, who replaces ousted Thierry Bolloré, joins the group this summer from Volkswagen.“Over the past 20 years, Renault has gone from daring to drifting, selling both low-margin products and assets under pressure over time,” said Philippe Houchois, an analyst at Jefferies, in a note to clients.
