;Ticker;Nombre_Completo;Date_Time;Titular;Subtitular;Texto
87;RL;Ralph Lauren Corp;2010-02-15T23:19:52Z;US stores cautious in spite of robust results;;"US retailers, including Walmart, will give a further reading of the state of US consumer confidence this week as they start the sector’s reporting of earnings for the important holiday quarter.Overall monthly sales have remained significantly below pre-crisis levels, but analysts on Wall Street are expecting the sector as a whole to benefit from holiday demand that was at the high end of most retailers’ expectations.Profit margins are also expected to have benefited from broad cost reduction efforts introduced by many retailers last year, and from reduced clearance of unsold merchandise, as they entered the season with inventory levels that had been significantly reduced.Other retailers reporting this week are Abercrombie & Fitch, the youth fashion retailer; Whole Foods Market, the natural and organic supermarket; Office Max, the office supplies retailer; and JC Penney, the department store operator.The comparatively positive mood has been reinforced by positive early guidance from Ann Taylor, the women’s clothing retailer, which said its fourth-quarter earnings would be “substantially higher” than a year ago, on better-than-expected sales of about $470m and an improved gross margin, reflecting reduced price markdowns.Macy’s, the department store, Gap, the clothing store and Kohl’s, the discount department store all raised earnings guidance earlier this month after announcing their January sales results.Branded clothing companies including Polo Ralph Lauren and VF Corp, which operate their own stores as well as supplying department stores and other retailers, have also been reporting comparatively robust results, again reflecting tightly managed inventory and cost-cutting.Polo Ralph Lauren as well as Estée Lauder have reported improved luxury and aspirational spending that is likely to boost performance at traditional department stores.But most retailers are expected to maintain their conservative view of the year ahead, with the National Retail Federation predicting a sales rise for the industry of about 2.5 per cent.Eric Wiseman, chief executive of VF, whose brands include Lee jeans and Nautica sportswear, said last week he expected retailers to continue to focus on managing existing inventory levels more efficiently, rather than restocking.“Everybody is working on speed and being more responsive in our inventory management,” he said.Michael Dart, a retail consultant at Kurt Salmon Associates, argues that the overall low growth prospect means retailers will now focus resources on initiatives to improve the top and bottom lines."
88;RL;Ralph Lauren Corp;2020-04-25T23:17:40+0000;US shoppers splash out on luxury items;;More prosperous American shoppers seem to be defying continuing high unemployment levels and economic uncertainty to renew their spending on luxuries such as jewellery, fashion and cosmetics.That is the picture emerging from the current round of US earnings and sales reports.Tracey Travis, chief financial officer of Polo Ralph Lauren, said last week that the fashion brand and retail company had “slowly begun to see the gradual return of our core luxury customer”, including buyers of couture dresses that sell for more than $4,000.Fabrizio Freda, chief executive of Estée Lauder, has said that sales of its beauty products at “prestige” stores – such as traditional department stores – had grown faster than at “mass” drugstores and discounters during November and December, reversing the trend seen earlier in the year.“We view this as a return of the aspirational consumer,” he said.Sales of cognac in the US had jumped 19 per cent by volume during the fourth quarter compared with the same period last year, according to BNIC, France’s trade association of cognac makers.Last week’s January sales figures from leading US chain stores reinforced the picture of growing readiness to spend, with Neiman Marcus, Saks, ­Nordstrom and Bloomingdale’s – the top upmarket US department stores – reporting strong sales growth, albeit from the depressed levels of a year ago.Neiman Marcus, which operates about 43 luxury fashion stores serving the most affluent US consumers, said that its strongest categories included women’s couture clothing and precious jewellery.Abercrombie & Fitch, the youth retailer known for its $60 polo shirts, reported that comparable sales had risen 8 per cent, its first monthly increase for 20 months, in spite of teenage unemployment running at about 26 per cent.The evidence of greater readiness to spend comes in spite of continuing high unemployment, with about 20 per cent of the US population unemployed or working casually or part time.Richard Hastings, retail strategist at Global Hunter Securities, said that roughly half of the 80 per cent of Americans fully employed were not affected by the depressed housing market and were now more ready to spend as they had become less concerned about their own jobs.The strength in the January sales numbers “suggests that sufficient spending is coming from the least affected parts of the consumer universe”, he said.
89;RL;Ralph Lauren Corp;2010-02-04T18:59:39Z;US retailers boosted by strong January;;Spending by US shoppers continued to bounce back from last year’s post-crash lows, with retailers ranging from luxury department stores to teen fashion boutiques on Thursday reporting stronger sales in January.Retail Metrics said its index of chain retailers’ same-store sales figures rose 3.3 per cent, higher than the 2.4 per cent forecast, the fifth successive month of positive year-on-year sales growth shown by the index.Retailers including Gap, Kohl’s and Macy’s, saw their shares rise as they raised expectations for their fourth-quarter earnings.The monthly sales numbers offered further indications of returning demand for prestige and luxury goods, with Saks and Neiman Marcus, the luxury fashion department stores, reporting increases of 6.8 per cent and 7 per cent, respectively.Nordstrom, the upmarket department store, saw its comparable sales jump 14 per cent.Macy’s, the largest traditional department store chain, highlighted a strong performance from its luxury Bloomingdales stores, as it reported a 3.4 per cent increase in same-store sales for the month and raised its earnings guidance.The performance of the prestige stores fits with recent comments from Polo Ralph Lauren, the clothing brand company, and from Estée Lauder, the cosmetics maker, which have both reported stronger demand for their higher-priced products.The more mainstream retailers also enjoyed sales that were stronger than had been expected.Comparable sales at Kohl’s, the discount department store, rose 6.5 per cent, although Kevin Mansell, chief executive, said customers “remain conservative in their discretionary spending”.Kohl’s rival JC Penney reported a 4.6 per cent decline in comparable sales, but said this was better than the forecast decline of 5 to 8 per cent.Speciality clothing retailers also fared significantly better than last year, with Aéropostale’s same-store sales up 6 per cent, American Eagle up 10 per cent and Abercrombie & Fitch up 8 per cent.The Limited, which owns the Victoria’s Secret lingerie stores, reported a 6 per cent increase in same-store sales while Gap, the largest US speciality clothing seller, reported a 5 per cent gain, led by a 10 per cent increase at its low-cost Old Navy chain in the US and positive sales at its Gap and Banana Republic brands.Comparable sales at Target, the discounter, rose 0.5 per cent, lower than Wall Street had expected. Walmart, the largest US retailer, no longer reports its same-store sales on a monthly basis.January is traditionally a month of transition for retailers, as they dispose of excess holiday inventory and prepare to bring in the spring ranges.
90;RL;Ralph Lauren Corp;2010-02-03T21:56:34Z;Wall Street falls after disappointing results;;"Wall Street lingered in negative territory on Wednesday after disappointing company results gave investors an excuse to pause following the market’s strongest two-day rally this year.The benchmark S&P 500 finished 0.6 per cent at 1,097.28, the Dow Jones Industrial Average fell 0.3 per cent to 10,270.55 but the Nasdaq Composite was unchanged at 2,190.91.US stocks fell almost 4 per cent in January on concerns over new banking regulations and the pace of economic growth in China. However, the S&P 500 index staged a recovery earlier this week on the back of positive manufacturing data, rising 2.7 per cent over Monday and Tuesday.But Pfizer, the world’s biggest drugmaker, weighed on the market on Wednesday, dropping 2.3 per cent to $18.62. The group missed quarterly estimates and also gave a disappointing outlook, citing the impact of a stronger dollar on its international sales.Walgreen, the retail pharmacy chain, fell 5.9 per cent to $34.62 after posting a surprise drop in January sales. Revenue from stores open for more than a year fell
1.1 per cent after analysts had expected a 2.2 per cent gain. The chain blamed falling prices for generic drugs and the fact that January 2010 had contained one weekday less than the previous year.Western Union showed the steepest decline on the S&P 500, losing 8.9 per cent to $17.17. The world’s largest money-transfer business reported a 6.6 per cent decline in quarterly profits and gave a pessimistic outlook for the coming year. It was the first time in five quarters that the company managed to only meet the consensus estimate rather than beat it.The series of corporate disappointments overshadowed the release of positive unemployment data. Private companies in the US last month cut jobs at the slowest rate in two years, according to the latest survey by ADP employer services.“Wall Street remains reticent to move ahead in the face of data suggesting only modest expansion,” said Andrew Wilkinson, a senior market analyst at Interactive Brokers. “Investors’ muted response conveys the perspective that every silver lining comes with a cloud attached. What the street wants to see is job creation and so a slower pace of lay-offs isn’t providing enough impetus at present.“Each positive earnings report seems to come complete with some sort of revenue or profit caveat,” he added.Polo Ralph Lauren posted better-than-expected quarterly profits but the fashion group missed its revenue forecast, sending the shares down 8.4 per cent to $78.51.The media industry was also in focus. AOL reported a decline in quarterly revenues due to continued weakness in the advertising market but the shares still climbed 2.4 per cent to $25.23 because the results were better than expected.AOL, which Time Warner spun off last December, also reported a profit compared with a loss in the previous year.Meanwhile, Time Warner swung to a quarterly profit and became the second media company to raise its dividend this week. But investors were quick to claim profits and the shares dropped 2.1 per cent to $27.90.After the market’s close on Tuesday, News Corp had also announced it would raise its dividend by 25 per cent after the media group’s quarterly results beat expectations.Improving demand for advertising and the success of its 3-D movie Avatar, which has brought in more than $2bn in ticket sales, allowed the group to increase its revenues by 10 per cent over the period. News Corp also sharply increased its full-year earnings guidance, helping to boost its shares 7.1 per cent to $13.67.Shares in Alcoa initially rose after UBS upgraded the country’s largest aluminium producer to “buy”. Analysts at the bank noted that the stock’s recent correction was overdone given the longer-term prospects for Chinese growth and re-stocking by US and European businesses. The shares were later down 1.1 per cent at $13.49.But McDonald’s gained 1.8 per cent to $65.21 as Goldman Sachs added the fast-food empire to their “conviction buy” list."
91;RL;Ralph Lauren Corp;2010-01-01T19:25:00Z;Fashion patriarch fronts a model of success;;"There is a ritual at the end of every Ralph Lauren fashion show. After the final model parade, Mr Lauren appears on the runway to take his bow, and his family – wife Ricky, sons David and Andrew, daughter Dylan, David’s girlfriend Lauren Bush, who used to model for the brand – rise to their feet in a standing ovation, followed by hugs and kisses.It is a rite of patriarchal devotion that has become as intrinsic to the brand as its polo player logo. Mr Lauren, 69, founded the company 42 years ago. It counts his brother Jerry as executive vice-president of men’s design, and his son David as senior vice-president of advertising, marketing and corporate communications; Ralph Lauren remains the largest shareholder.But he insists it is “not a family company. It’s a public company built on an individual vision. There are 41 people in the company who have been here 21 years or longer, and only one of those [Jerry Lauren] is actually a member of my family. I’ve had an outside president almost since I started.”This conscious balancing act between the image of overt family involvement and the insistence on active external management is one of the hallmarks of the Polo Ralph Lauren Corp. The group embraces the numerous Ralph Lauren lines, extending from high-end luxury to jeans and athletic wear and home wear, as well as the accessible Club Monaco, Chaps and American Living brands.Revenues for fiscal 2009 were $5bn, and the company has been one of the few fashion and luxury success stories during the recession.“They ended 2009 with a very strong balance sheet, with liquidity of about $1bn, and a very small debt,” says Dana Telsey, chief executive of the Telsey Advisory Group. Operating profit for the second quarter of last year was almost $250m.This has enabled the company to pursue an aggressive expansion strategy, taking direct ownership of its Japanese licences and opening an elaborate new flagship store in Paris in the spring. Almost 50 per cent of capital expenditure is now dedicated to international growth.“It’s the only fashion company I know managed like a Fortune 500 company,” says an industry source who has worked with many high-end fashion brands, including Ralph Lauren.William S. Susman, president of Financo, an investment bank dedicated to the retail sector, says it was Mr Lauren’s decision to “institutionalise” his company by taking it public in 1997, long before most family run European brands had even considered the idea, that set the tone for the management strategy.“He made it a global business with family members,” Mr Susman says.He believes it was a decision aimed at ensuring the brands’ legacy and continuity, and that it has largely succeeded. The strategy positions Mr Lauren, the company’s chairman and chief executive, as the guiding light of the company.His role is complemented by president and chief operating officer Roger Farah, 56, a highly respected fashion executive hired in 2000. Mr Farah functions as the merchant and corporate strategist. According to insiders, however, the classic corporate/creative divide that exists at many fashion companies – where the stereotype has the manager shielding the creativity of the designer from the distractions of finance – does not hold true at Ralph Lauren.“It’s not like Ralph is protected from business decisions,” says Candy Pratts Price, who served as the company’s vice-president and creative director in the late 1990s. “Ralph knows everything, and signs off on everything, from stationery to hedging strategies. This can be frustrating if you like decisions made very fast, but it also ensures consistency.”Mr Lauren calls his relationship with Mr Farah a “partnership”. The two men have offices next to each other, and talk, says Mr Lauren, “every day, including weekends”.Marie Driscoll, an equity analyst at Standard & Poor’s, characterises Mr Farah’s approach as “methodical and low-key”. Ms Pratts Price says: “Ralph is not a yeller. But ‘it’s not me’ is a line you hear a lot.”Mr Susman says: “If something were to happen to Ralph tomorrow, I think the perception is that the brand is so well run, the stock price wouldn’t go down.”This makes Mr Lauren a canny anomaly in the fashion world, where questions of succession have bedevilled brands such as Emanuel Ungaro, which has had a revolving door of designers and directors since its founder retired.However, Michael Gould, chief executive of Bloomingdales, the department store, where Ralph Lauren’s multiple lines make it the biggest wholesaler represented in the store, calls Mr Lauren the “essence” of the brand.Mr Lauren is not unaware that outsiders believe his son is in line to succeed him, but he is quick to damp the rumours: “People ask if David will take over after me, but it’s far from the case at this time. It’s not a foregone plan.”"
92;RL;Ralph Lauren Corp;2009-09-29T20:43:12Z;Wall Street slides in choppy trading;;"US stocks edged lower in choppy trading on Tuesday after data on the housing market and consumer sentiment gave investors mixed signals about the state of the economy.Wall Street opened higher after the S&P/Case-Shiller US home price index showed prices in July had risen 1.6 per cent compared with a 1.4 per cent increase in June.Economists polled by Reuters had been expecting prices in the 20-city index to have risen only 0.5 per cent.However, the latest reading on consumer confidence, released an hour later, was worse than expected and forced stocks to pare some early gains.The S&P 500 closed 0.2 per cent lower at 1,060.61. The Dow Jones Industrial Average fell 0.5 per cent to 9,742.20 and the Nasdaq Composite, which led the previous session’s gains, edged 0.3 per cent down to 2,124.04.On Monday, Wall Street recorded its biggest daily gain for over a month after a series of merger deals boosted hopes of economic recovery.“After yesterday’s surge, that number [the consumer confidence reading] attracted some selling,” said Peter Cardillo, chief market economist at Avalon. “But we’re at the end of the quarter and I suspect we’ll probably see the market continue its advance over the next few days.”Energy stocks dragged the market downward on Tuesday after oil prices sunk lower on a weak demand outlook. Chevron fell 1.1 per cent to $70.91 while ExxonMobil lost 0.8 per cent to $69.07.KBR, the engineering, construction and services company, gained 1.8 per cent to $23.32 after winning a contract to work on a gas project at Saudi’s Shaybah oilfield.Pharmaceuticals stocks also weighed on the Nasdaq. Repros Therapeutics dropped 13.9 per cent to 93 cents after the company said the Food and
Drug Administration requested additional data on the company’s lead drug, Proellexin, in order to resolve the clinical hold placed on it.Sequenom shocked the market by announcing that it had dismissed nearly its entire top management team as a result of a scandal involving the mishandling of data on its pre-natal Down’s syndrome test. Its shares dropped 39.2 per cent to $3.46.However, Astrotech, which owns and operates spacecraft pre-launch facilities, soared 157.5 per cent to $3.10 after saying it was considering options to boost shareholder value, including a possible sale of the company.At the same time, the Texas-based company posted a profit in the fourth quarter compared with a loss in the same period last year.Consumer stocks lifted the market from the opening bell. Walgreen, the US pharmacy chain, rose 9.2 per cent to $37.35 after the company’s quarterly results beat expectations.The company said profit had fallen, mainly due to weak sales of summer merchandise and the costs of refurbishing its stores.As part of a widescale restructuring plan, the retailer has also cut back on store openings and reduced its workforce but said the measures would take time to pay off.Some of Walgreen’s rivals also benefited from the optimism in the sector with CVS Caremark rising 3.4 per cent to $36.07.Citigroup gave a boost to carbonated soft drinks makers after saying the sector offered good opportunities for growth. Coca-Cola was rated “buy” in new coverage at the firm, which cited markedly better earnings growth in 2010. Its shares rose 0.3 per cent to $53.31.Dr Pepper Snapple Group was also rated “buy” and rose 2.9 per cent to $28.55.Polo Ralph Lauren gained 4.2 per cent to $77.38 after Goldman Sachs upgraded to “buy” and said it expected a near-term recovery to drive sales.Gannett, the largest US newspaper chain and publisher of USA Today, rose 17.6 per cent to $11.74 after forecasting third-quarter earnings above expectations.Lamar Advertising rose 6.6 per cent to $27.16 after Barclays Capital raised the billboard owner to “overweight” and raised its price estimate, saying the company had managed to contain costs."
93;RL;Ralph Lauren Corp;2009-09-14T10:55:16Z;John Lewis targets upmarket fashion market;;John Lewis is launching a push into upmarket fashion, taking on the likes of House of Fraser by focusing on designer labels.The employee-owned company, which is seen by many as a bellwether for the UK high street, is defying the trend of retailers moving into lower budget lines to attract cash-strapped customers, and focusing its fashion arm on more upmarket brands.Andy Street, chief executive of John Lewis, said: ”This is really crucial for us. We have an outstanding business in homewear but have underplayed our hand in fashion.”John Lewis will stock 30 new brands, and over 200 brands on its new website, which goes live on Monday. The new brands include Stella McCartney lingerie, Ralph Lauren and Orla Kiely accessories.“Our customers are more premium than those of Harrods or Harvey Nicks, and this reflects that,” said Peter Ruiz, the group’s head of fashion.The move is in contrast to the position being taken in its homeware department, where the company has launched a value range to compete with cheap non-food offers at supermarkets.But John Lewis believes there is still room to move upmarket in its fashion business, which has been the fastest growing area for the company during the recession.The company’s new Cardiff store, which is due to open on September 24, will be the first to stock the full line of new fashion brands. The shop floor for women’s wear will differ significantly from those in other John Lewis stores, offering wider spaces in which to shop, private areas with free fashion advisers and what Mr Ruiz describes as a “sense of theatre”.Tony Shiret, a retail analyst at Credit Suisse, said: “The clothing market is being squeezed in the middle, with some customers moving to discounters such as Primark and TK Maxx, so a move to extend the line at the upper end is a sensible idea.”The move will bring John Lewis into direct competition with House of Fraser, which was hit by the bankruptcy of Baugur, the Icelandic investment group which held a controlling stake in the company.“If you want to be really Machiavellian John Lewis might be putting itself in a position where it can take over stores from House of Fraser if it is forced to sell them,” said Mr Shiret.John Lewis may also be able to snap up market share from the gap in the market left by Principles, the fashion company that collapsed after its backer, Mosaic, was placed into administration by Kaupthing, the failed Icelandic bank.Online fashion sales have been growing even faster than the in-store business, however, and it is this arm of the group that will see a major overhaul, overseen by Robin Terrell, managing director of John Lewis Direct.Online fashion sales currently make up only a small proportion of total online sales, and John Lewis executives want to move it closer towards the 30 per cent seen in its physical stores, which would mean adding £70m in revenues.Analysts have been sceptical of the potential for growth in online fashion, saying many customers prefer to try on clothes before buying. But John Lewis executives think their offer to collect and refund any unwanted item after delivery will convince people to buy online.But they admit plans to deliver items in luxury boxes or with hanging materials may drive up prices. “Customers want value, but that does not necessarily mean low price,” said Mr Terrell. “They want to know when they will get it and when they do, it won’t be crumpled up and unwearable.”John Lewis will report its interim results on Thursday, with Waitrose, its supermarket business, expected to do well following the launch of its value range.
