;Ticker;Nombre_Completo;Date_Time;Titular;Subtitular;Texto
27;RL;Ralph Lauren Corp;2015-07-17T15:18:01Z;High summer hit-list;From the hottest shades to the coolest games, strike all the right notes this season with a little help from Harriet Quick;"Following on from the 1970s trend, the predictable logic of fashion welcomes the 1980s.Coloured shades and tinted lenses reflect the era, and are made for standing out in a sea of well-mannered, neutral frames.Bold red looks best with sleek hair — clash with pinks or set off with monochrome clothes.For him, a reboot of a classic, these lilac-tinted Ray-Ban aviators are a dashing complement to silver hair (£160, ray-ban.com).For her, the hip collaboration Adam Selman x Le Specs delivers punch with its “Playgirl” style sunglasses in vivid red (£69, lespecs.com).Terry towelling has re-emerged from its 1950s heyday to become this summer’s playtime fabric of choice. The tactile material keeps its debonair Mr Ripley charm whatever the weather.Polo Ralph Lauren: The classic polo rejigged (£85, ralphlauren.com). See also Orlebar Brown (£95, orlebarbrown.com) and Vilebrequin, for a longer, wider fit (£105, vilebrequin.com).A star of the London men’s collections, the bomber jacket is holding its own in the style stakes. Shapes have shifted from sporty to the slightly retro. With its zipped pockets, Paul Smith’s garment-dye bomber in tan has a handsome utilitarian appeal (also available in navy and dark grey, £249, paulsmith.co.uk), while this Gucci slim-fit reversible midnight-blue satin bomber delivers panache (£900, mrporter.com).It’s time to leave the hot pinks and flaming reds alone and turn towards less predictable aquas and darker blues. The new chalky hues are a good counterpoint to summer’s taste for watercolour-style florals and broderie anglaise.Pepperminty: This fresh blue by Ciaté will delight in azure swimming pools (£9, ciatelondon.com). Ni Toi Ni Moi: Christian Louboutin’s mesmerising jade looks wonderful against a tan (£36, selfridges.com). Fortissimo: Chanel’s deep, shimmering shade is glamorous in the sunshine (£18, selfridges.com).With the mega trend for 1970s maxi skirts and other bohemian delights arrives a wave of rustic and ethnic summer sandals. Criss-crossing, thong or asymmetric straps offer all manner of foot decoration. Spanish-born, Florence-dwelling Alvaro González works with local craftsmen on his men’s and women’s collections of vegetable-dyed vachetta leather and exotic skin styles, while sunglasses and swimwear entrepreneur Anna Laub, of Prism London, has just debuted a new line of handmade sandals. Álvaro González (£280, matchesfashion.com). Prism Bora Bora sandals (£200, prismlondon.com).Everyone needs a versatile tote that can whisk you from work to a weekend away with room for gadgets, make-up and a party dress — make the right investment and it will carry you through the autumn months, too. Valentino Vertical Tote (£1,860, valentino.com). Victoria Beckham shopper-style tote in pom-pom red python (£1,850, victoriabeckham.com). See also Azzedine Alaïa laser-cut tote (£2,890, net-a-porter.com).There’s something about the sun that raises the competitive heat and we are witnessing the return of bat-and-ball games. That light “thwack, thwack” is one of the best sounds of summer and Frescobol Carioca’s Bat Ball offers in spades. Brit-Brazilian duo Max Leese and Harry Brantly are behind this beach-lifestyle brand. Bats are made from Brazilian reclaimed wood and come with a choice of coloured racket bands (£190, frescobolcarioca.com).This versatile, genteel length is proving a long-player: the mid-calf skirt will see you right through to the autumn.Wear today with strappy sandals and a camisole and later in the season, with a wool-knit and a pair of knee-high boots.See by Chloé (£250).Sample more than 100 authors in Tank magazine’s “Summer Reader” issue (£8)— entries were nominated by tastemakers and designers including Jason Wu, Isabel Marant and Dries Van Noten.If the prose grabs you, scan the pages (with the free Fashion Scan app) to buy the audio or ebook.A huge trend for autumn, fringes can be found on bags, hems and coat sleeves.Swish ahead this summer in this Proenza Schouler plaid, basket weave canvas top (£1,275); Louis Vuitton shoes (£795); and shirt by MSGM, £405 (all net-a-porter.com)."
28;RL;Ralph Lauren Corp;2015-05-10T22:49:10Z;Greek Eurogroup talks dominate week ahead agenda;Spotlight on the eurozone where GDP figures, Greek debt talks and the UK inflation report are scheduled;A UK general election that delivered an unexpectedly decisive outcome sent the pound soaring this week, but investors will switch their attention elsewhere in the coming days.Greece will once again be in the spotlight, while in Britain focus will switch from politics to the Bank of England’s quarterly inflation report.Here’s a preview of what to expect in coming days.Eurogroup MeetingEuro area finance ministers assemble in Brussels on Monday, with Greece again dominating the agenda.Despite the “more constructive atmosphere” in recent talks, Thomas Harjes, an economist at Barclays, cautions that: “We do not expect an agreement that would unlock the payment of the remaining €7.2bn” which the cash-strapped government in Athens has been seeking.US retail salesThe retail sales report for April is the next window investors will get on the US economy.Core retail sales, which strip out the more volatile auto and gasoline sales, are expected to have risen 0.6 per cent — an outcome that would bolster optimism the economy is rebounding from a testing first quarter.“Prospects for a second quarter rebound in GDP depend critically on the performance of consumer spending,” Jay Feldman, an economist at Credit Suisse, said. “The April retail sales report will be the first key test.” The report is due for release at 8:30am on Wednesday.Bank of England inflation reportAfter a purdah during the election campaign, the Bank of England breaks its silence with its latest quarterly inflation report on Wednesday.Alongside new inflation and growth forecasts, investors will be watching for clues from Mark Carney, the Bank’s governor, on the timing of an interest rate rise.Euro area GDPA stirring in consumer demand is expected to have helped drive a modest recovery in first-quarter growth in the eurozone, economists expect GDP figures to show on Wednesday. Economists estimate the eurozone economy grew 0.4 per cent from the prior quarter.EarningsAs the US earnings season winds down, just 15 S&P 500 companies are expected to report results. The roster includes Actavis, Macy’s, Ralph Lauren, Cisco Systems, Precision Castparts, Kohl’s and Nordstrom.The week that was, in four charts
29;RL;Ralph Lauren Corp;2015-02-20T16:13:42Z;The dawn of man: New York men’s fashion week;Designers showed a new confidence on the catwalk with their sophisticated and commercial collections;"“We have arrived” — that was the feeling one got from the dozens of New York menswear shows that took place over 10 brittle days this month.It was the last time the menswear collections were to be tied to the womenswear schedule. Two and a half years after London created a viable men’s fashion week — cracking the duopoly held by Paris and Milan — New York’s small but growing cohort of menswear designers is to get its own this July. The move appears to have prompted a maturation and a new ease in the collections: ranges were sophisticated and commercial, even those from designers known for their whimsy, charm or, shall we say, provocation.At Hood by Air, Shayne Oliver’s cult label, gone were the Plexiglas chokers and Great Danes of seasons past. He did not give up entirely on the theatrics — models’ faces were covered with stockings threaded with padlocks — but sharply-collared pleated shirts and wide-legged trousers, as well as a rich camel wool trenchcoat, showed what the team at HBA is capable of: something far beyond streetwear.It’s the brand to watch, even if more attention is paid to Public School. The New York label, fresh from a string of awards, reworked the cool outerwear for which it is known. A grey melange wool coat, mohair bomber and shearling dolman jacket will be on buyers’ lists for autumn. A double-breasted coat stood out amid what was ostensibly a womenswear runway. This was not necessarily a bad thing: womenswear continues to dwarf its male counterpart but the rapid growth of menswear has made it something of a Valhalla for retailers.Duckie Brown, which has dabbled in women’s, stuck to men this time in what was a toned-down, minimalist showing from the outré brand. It was one of the label’s best collections, including transparent silk tops and a pink blush collarless wool overcoat.Tim Coppens, who has also slowly dipped into womenswear, put together one of his strongest runways — a point true for peers Patrik Ervell and the brothers behind Ovadia & Sons. Coppens took inspiration from photographer Derek Ridgers’ shots of punks and skinheads. It was a bit more “raw” than what he typically does, he said backstage. The opening look, a sharp tailored duffel jacket with a leather harness, was simply too cool.Ervell also went for raw, checking brutalist architecture in his show notes. The aviator jackets, as well as an oil-spill overcoat that shimmered a rust colour, had utility. Trousers here were cut wide, a trend spotted at Perry Ellis and Porsche Design, too. Ovadia slowed the pace at its show (models took their time on the catwalk) to fine effect. The clothes were wearable and refined; a bit more urban than the smart sportswear and eveningwear at Ralph Lauren. A silk navy suit worn over a pink cotton T-shirt, a patchwork sweater and a blue calfskin-and-down coat felt luxurious.Billy Reid upped the luxe as well, although with a more relaxed approach, removing darts to give his garments an unstructured feel. With the temperatures outside below freezing, the knit-heavy collection felt timely. Textures were given particular attention, including one grey wool angora overcoat with saddle-brown lapels that looked like an aged rug you’d be remiss to part with.J Crew also slouched it up with alpaca crewnecks and shawl cardigans. Frank Muytjens, director of menswear design, said he was aiming for something more tactile, taking inspiration from army supplies. Todd Snyder, a J Crew alum, took the opposite approach with rigid tailoring, but the collection fell flat, lacking the preppy punch on which Snyder has built his brand.Ahead of menswear’s breakaway, there is industry concern that, with few mega-brands in the schedule, younger designers will struggle to attract big foreign buyers to New York in July when they are normally bound for Europe. But in this last dress rehearsal, there is reason for hope. Gents, David Hart and N Hoolywood all showed fine collections, while Laurence Chandler, one of the designers behind Rochambeau, constructed chunky cable-knit sweaters, a translucent puffer jacket and a solid navy top with rubberised buckles.“This is making sense,” Chandler said of the decision to elevate New York’s menswear designers, adding that he hoped to secure the company’s 30th stockist this year. So long as those buyers make their way across the Atlantic, he won’t have a problem at all.Photographs: Catwalking.com"
30;RL;Ralph Lauren Corp;2015-02-20T01:26:06Z;Ralph Lauren — New York Fashion Week AW15 show report;The US luxury retailer plays it safe in neutral colours and clean cuts;"Ralph Lauren has had a horrible year. Profits plummeted 9.3 per cent in the last quarter, and the share price dropped to a low not seen since 2012.The problem is one of scale: Ralph Lauren is a big beast, with myriad diffusion lines, accessories, children’s clothes and homeware all part of the brand’s all-American umbrella. One hit hurts the whole, and the results have propelled the company to announce a re-examination of its management structures. They want to wrest back control of the ancillary lines that have operated on a more regional basis, and consolidate once more.In terms of business the womenswear division has the same centrifugal purpose: it consolidates the brand’s focus and announces its intentions for the next quarter. Ready-to-wear is, after all, the jewel from which all the other Lauren lines are chipped.The forecast for next season was to play it safe: a palette of cream, fawn and heather woollens; and simple clothes cut in classic Lauren lines: three-quarter-length skirts and cable knits, layered cashmere poncho tops and polo necks, and slim-hipped, wide-legged Annie Hall trousers. The silhouette was svelte and smart.There were demonstrations of daring: trapper-hats, fur overthrows of indiscernible origin that trailed towards the floor in shaggy rags and lots of sequin embellishments and low-slung, big-buckled belts. But these were a rather nasty distraction. Just as the group has announced the streamlining of its operations, this AW15 collection would have benefited also from a more rigorous management.Photographs: Catwalking.comFor more reports from the New York shows, go to our fashion weeks page on the FT web app, or visit our AW2015 fashion weeks hub on FT.com"
31;RL;Ralph Lauren Corp;2015-02-04T18:27:44Z;Gilead sinks on discounting worries;Consumer discretionary and telecoms offer support to S&P 500;Gilead Sciences shares tumbled on Wednesday despite exceeding fourth-quarter earnings and sales estimates after it said it would have to offer discounts on its hepatitis C drug.The California-based company said it would make a “gross to net adjustment” of 46 per cent on US sales of its Harvoni and Sovaldi pills this year.Sales of the company’s older hepatitis C medication, Sovaldi, slowed to $1.73bn from a quarter earlier as patients transitioned to its successor, Harvoni.The new medication, which has a cure rate of 94-99 per cent and a $94,500 price tag for a 12-week treatment, beat Wall Street estimates at $2.11bn. Sales a quarter earlier were limited as the medication was only available in Europe.“Gilead expects lower margins to be offset by higher patient volumes and fewer eligibility restrictions, including treating F0 patients (no fibrosis) in select agreements,” said Ian Somaiya, an analyst at Nomura.Gilead expects to have capacity to treat more than 250,000 patients for hepatitis C in 2015.Matthew Roden, an analyst at UBS, said market penetration would rise as the drug became more affordable, but in the short term “more patients are captured by Gilead ahead of further competition”.But he added that year estimates beyond 2015 would decrease because more patients would have been cured.Gilead profits more than tripled from a year earlier to $3.49bn, or $2.18 a share in the three months to the end of December, while sales more than doubled to $7.3bn.Gilead announced that it would pay a 43 per cent quarterly dividend and announced a $15bn share buyback programme.Shares of Gilead, which have climbed more than 18 per cent in the past year, fell more than 8 per cent to $98.43, wiping $16.5bn in market capitalisation.Shares of Chipotle Mexican Grill fell 7 per cent to $676.00 after the restaurant chain reported a 16.1 rise in same-store sales in the fourth quarter, shy of Wall Street estimates for 16.5 per cent growth.Earnings of $3.84 a share topped forecasts, while sales of $1.1bn were in line with estimates.Ralph Lauren was the worst performing stock on the US benchmark after the company reported a 9 per cent drop in fiscal third-quarter profits to $215m or $2.41 a share and sales of $2.03bn that missed Wall Street estimates.The retailer expects fiscal 2015 revenue to rise 4 per cent in constant currency terms, lower than its previous estimates for 5-7 per cent growth. Its shares fell 18 per cent to $139.71.Walt Disney shares advanced nearly 8 per cent to $101.28 after it topped fiscal first-quarter earnings and sales estimates driven by sales of consumer products and home entertainment related to its 2013 animated hit Frozen.Kohl’s reported a 3.7 per cent rise in same-store sales, ahead of its forecast for 2-3 per cent growth, lifting shares up more than 6 per cent to $66.87.Consumer discretionary and telecoms stocks offered support to the US benchmark as lower oil prices and healthcare stocks weighed on the index.The S&P 500 fell 0.4 per cent to 2,041.51, the Dow Jones Industrial Average was little changed at 17,673.02 and the Nasdaq Composite fell 0.2 per cent to 4,716.70.mamta.badkar@ft.comTwitter: @mamtabadkar
32;RL;Ralph Lauren Corp;2015-02-04T16:59:12Z;Ralph Lauren shares slide on profit fall;US luxury retailer hit by strong dollar;Ralph Lauren reported a 9.3 per cent drop in quarterly profit, stung by a stronger dollar and weaker than expected sales, sending shares in the US luxury retailer down more than 18 per cent on Wednesday.The company said net income fell to $215m, or $2.41 a share, in the third quarter to December 27, down from $237m, or $2.57 a share, in the same period a year earlier. Net revenue rose 0.9 per cent to $2.03bn, missing Wall Street expectations for the holiday season.Ralph Lauren said it now expected revenue growth of about 4 per cent in 2015, compared with a previous projection of as much as 7 per cent.Like other global luxury groups, including Richemont and Prada, Ralph Lauren has been grappling with foreign currency swings in recent months.Robert Drbul, a Nomura analyst, said this week that because Europe and Asia made up about a third of Ralph Lauren’s revenue, it could face a potential $100m negative impact this fiscal year as the dollar appreciated against the euro and other currencies.But the company remained cautiously upbeat on Wednesday, and looked to reassure investors with an 11 per cent increase in the quarterly cash dividend on common stock to $0.50 a share.“Although our sales were below the expectations we had set, we navigated through the volatile global marketplace by controlling the controllable and delivered an operating margin at the high end of our outlook. Foreign exchange and global consumer spending remain unpredictable, and we are planning our business accordingly,” said Jacki Nemerov, chief operating officer.Ms Nemerov said the group would be implementing a global brand management structure in the coming months that aimed to “operate in a more customer-centric way and provide substantial operating efficiencies”. Ralph Lauren reported $124m in capital expenditures, compared with $81m a year earlier. Arch-rival Michael Kors reports its latest earnings on Thursday.Ralph Lauren’s shares closed 18 per cent lower at $139.71.Hugo Boss was also hit by rising costs, taking a €19m one-off charge due in part to an overhaul of its Middle Eastern distribution network. The German fashion and lifestyle house on Wednesday reported weaker than expected fourth-quarter sales and profit as it contended with stagnant demand in its European home market.Total revenue for the period rose 5 per cent to €684m, missing analysts’ average estimate of €699.4m.“2015 will not become any easier in light of the many economic and political uncertainties,” said Claus Dietrich Lahrs, chief executive.He added that the company would focus expansion efforts in the emerging economies in Asia and eastern Europe to stem the decline in demand in western Europe.Shares in Hugo Boss fell nearly 3 per cent by close of trading in Frankfurt.
33;RL;Ralph Lauren Corp;2014-09-12T01:02:58Z;New York Fashion Week: Day 7;Show reviews from Ralph Lauren and Calvin Klein;"The final day of fashion week in New York always holds a sense of closure, comfort and routine before the circus packs up for London. Partly, this stems from the fact that the same two titan US brands close each season in the same ritualised way. But also, in part, the sense of ritual arises because the catwalks hold few surprises.As usual, Ralph Lauren selected an exotic foreign clime – in this case India – and applied his distinctive Midas touch to a series of feminine, well-executed designs.The fulcrum of the collection was traditional utilitarian safari attire, then adorned with lashings of silk in a rich kaleidoscope of colour dripping with diamanté embellishments. Take the opening look, pocketed khaki cargo pants with a deep purple sari-inspired top and billowing train, or a gauzy double breasted reworking of a utility jacket in citron paired with sleek suede pants and a beaded sports top of cascading semi-precious stones.A series of top-to-toe khaki looks – 1940s style suit skirt combos, or peplum top with pencil skirt – provided an aura of timeless elegance, before an eveningwear finale that married the rigour of sage gazar safari shirts with the fluidity of cascading tulle skirts in dazzling burnt oranges, lemon yellows and magenta.Over at Calvin Klein, Francisco Costa also stuck to what he knew – minimal, streamlined stricture – while simultaneously weaving in a chic and maximal experimentalism via highly technical materials and texture blocking. Navy sleeveless tank dresses were blended with sheer viscose underskirts, spinning into an overall effect of soft form-fitting layers; graphic, creamy, Mondrian-style contrasting blocks made their way on to pleated pants and fluted skirts; and papyrus white and silver engineered knitted dresses and driving coats that shimmered with understated and elegant sophistication.The colour palette, a sea of red, white and blue, felt on point – both on the anniversary of September 11, but also as a reminder of the strong American identity woven into the Calvin Klein aesthetic that Mr Costa appears keen to maintain."
34;RL;Ralph Lauren Corp;2014-09-04T17:03:57Z;PVH leads retail sector higher on ECB stimulus news;;Consumer discretionary stocks climbed on Thursday, buoyed by new stimulus measures from the European Central Bank and data that showed firmer US economic activity than some economists had expected.The sector, which remains among the worst performing this year after a frigid winter, has been lifted over the past two weeks as investors rotate back into stocks set to benefit from economic expansion.Figures out from ADP showed US payrolls rose by more than 200,000 in August, while initial jobless claims hovered near post-crisis lows and a reading on the country’s service sector showed the fastest pace of growth in nine years.Analysts with Goldman Sachs said they expected retail spending to “gain some ground and advance at a pace more aligned with income growth”, noting anecdotal evidence showed signs of improvement in the key back-to-school selling season.“Consistent income and employment trends remain supportive of a solid backdrop for spending,” Matthew Fassler of Goldman said. “Retail sales and consumer spending growth are in fact consistent, though below levels implied by macro drivers.”Mr Fassler added commodity price pressures, including gas and food costs, had moderated from a year earlier, allowing consumers to shift spending to other areas.“Growth in disposable income is accelerating nicely, on both better growth in wages and salaries, and on the absence of a tax hike,” he said.The decision by the ECB to cut interest rates to a record low and to begin a programme of private-sector asset purchases to spur economic activity also buoyed the sector and broader market on Thursday.Jonathan Glionna, a strategist with Barclays, noted the European market was the second most important sales market for S&P 500 companies.“US equity investors should continue to monitor Europe closely because a revenue growth revival will be difficult to achieve if this important market does not begin growing faster soon,” Mr Glionna said.PVH, the owner of Calvin Klein and Tommy Hilfiger, was among the top performing stocks on the day, after it reported better than expected quarterly results and its chief executive said gains over the remainder of the year would be in part fuelled by improvements in Europe.The company, which affirmed its full-year earnings guidance after market close on Wednesday, soared 10 per cent to $128.38.“We believe that same store sales trends at company-owned Calvin Klein stores in the long-struggling Europe region finally have turned positive in August,” Michael Binetti, an analyst with UBS, said.Venerable names across the sector, including department stores, luxury goods makers and electronics retailers, climbed as well.Best Buy rose 3 per cent to $32.17, Under Armour advanced 2 per cent to $71.96, Victoria’s Secret owner L Brands increased 1 per cent to $64.62 and Ralph Lauren gained 2 per cent to $172.46.Mattress Firm shares jumped 10 per cent to $62.69 after the company agreed to buy The Sleep Train for $425m in a bid to capture more business on the US west coast.Sleep Train’s owners will receive a mix of cash and shares as part of the acquisition.Mattress Firm said the combination would “deliver significant synergies and provide our customers with a greater level of selection”.According to the retailers, the acquisition will generate about $20m of cost savings within three years. The combined company will also maintain both brands.BP slumped after a US District Court in New Orleans found the company acted with gross negligence and wilful misconduct in the 2010 Deepwater Horizon disaster.New York-listed shares of the energy company, which is exposed to penalties of up to $18bn, declined 6 per cent to $44.89.Overall, the S&P 500 fell 0.2 per cent to 1,997.65 while the Dow Jones Industrial Average declined 0.1 per cent to 17,069.58. The technology-heavy Nasdaq Composite lost 0.2 per cent to 4,562.29.eric.platt@ft.comTwitter: @ericgplatt
