;Ticker;Nombre_Completo;Date_Time;Titular;Subtitular;Texto
54;RL;Ralph Lauren Corp;2012-01-04T21:46:24Z;US retailers climb in flat market;Yahoo falls on naming of new chief executive;"Retail stocks rallied strongly as investors geared up for Thursday’s holidays sales reporting with apparel chains and luxury names to the fore.Ralph Lauren rose 4.2 per cent to $142.88 while VF Corp, which owns brands including Eastpak and The North Face, climbed 4.4 per cent to $134.38.Gap, which will report December sales figures today, was up 1.8 per cent to to $18.88 and Urban Outfitters climbed 2.4 per cent to $28.41.“All the indications are that volumes were up in December so same-store sales figures will probably look good,” said Daniela Nedialkova at Atlantic Equities. “But December was very promotional, so I will be looking for commentary on margins and profits, not just sales,” she cautioned.Elsewhere, US stocks ended the day flat as investors throttled back from Tuesday’s rally. The S&P 500 closed at 1,277.3, less than a quarter of a point up for the day, with financials bearing the brunt of selling, off 0.5 per cent.Morgan Stanley fell 0.9 per cent to $15.94, while the afterglow from Citigroup’s $2.5bn bond offering on Tuesday, its largest such debt issue since 2009, did not last long. Its shares fell 0.6 per cent to $28.17.The Dow Jones Industrial Average edged up 0.2 per cent to 12,418,42 and the Nasdaq Composite index was flat at 2,648.36, although the Nasdaq had opened sharply lower as technology stocks suffered.Ebay, the auction website, fell 3.8 per cent to $30.16 after Yahoopoached Scott Thompson from Ebay-owned PayPal as its new chief executive. Yahoo investors were unimpressed however, sending shares down 3.1 per cent to $15.78.Data storage company Netapp fell 3.1 per cent to $35.64 after a downgrade from Credit Suisse analysts, who tipped the company’s rate of market share growth to slow in 2012.Shares in Salesforce.com, which develops cloud-based software for businesses, slumped 3.7 per cent to $97.48. The stock was a darling of internet investors in 2009 and 2010 as it saw rapid customer growth but Mark Moerdler at Sanford Bernstein said the company may be unable to prize more market share from smaller rivals. “Looking forward, we believe it will become more difficult for Salesforce.com to grow,” Mr Moerdler wrote to clients.Netflix shares surged 11.4 per cent to $80.45, after the company said users had streamed 2bn hours of video from its website in the fourth quarter. However Netflix did not provide comparative figures for previous quarters.Cabot Oil & Gas climbed 7.2 per cent to $82.32 after the company raised its dividend 33 per cent to 16 cents a share and announced that it had doubled production in the Marcellus Shale during 2011. Separately, Cabot announced a two-for-one stock split.Shares of car vendor AutoNation fell 6.8 per cent to $33.26 after Edward Lampert’s ESL fund cut its stake in the company to 52.5 per cent from 56.4 per cent. Mr Lampert also reduced ESL’s stake in car parts retailer AutoZone to 12.6 per cent from 21.7 per cent, but after falling sharply at the open, shares recovered to close 2.2 per cent higher at $326.96.Chipotle Mexican Grill climbed 2.2 per cent to $348.75 after Goldman Sachs analysts added the fast food restaurant to its “conviction buy” list, tipping the company for earnings growth of 35-0 per cent this year as food costs fall, boosting margins.Shares in Chipotle rose almost 60 per cent in 2011 after more than doubling in value in 2010.Ford Motors rose 1.5 per cent to $11.30 as December sales rose 10 per cent, beating most analyst estimates. General Motors saw December sales growth of 5 per cent, which gave shares a 0.5 per cent fillip to $21.15. Both companies were left in the dust by Chrysler, which saw December sales leap 37 per cent compared with the previous year.Discount website Groupon fell 2.5 per cent to $18.79, significantly below the $20 offer price for its November IPO.Solar panel manufacturer First Solar fell 3.1 per cent to $34.70 as the Commerce Department said a decision on additional tariffs for Chinese solar-equipment would be delayed by a month to mid-February.CF Industries was up 2.7 per cent to $157.99, after Citigroup analysts recommended the nitrogen fertiliser producer.""Given the recent slowdown in fertiliser sales, we now prefer nitrogen as our top nutrient – nitrogen cannot be stored in the ground so its application tends to be steady,” Citi analysts told clients. MasterCard, off 3.3 per cent to $356.25, and Visa, off 1.8 per cent to $101.15, both fell as Janney analysts said the “secular shift from paper [money] to card [spending]” may be complete, and removed its buy recommendations from both stocks.Hospital operator Tenet Healthcare slid 5.4 per cent to $4.69, as investors continued to fret about long-term government funding for Medicare after Citigroup downgraded the sector on Tuesday."
55;RL;Ralph Lauren Corp;2011-12-15T22:35:08Z;Michael Kors shares jump 21% on debut;;Shares of Michael Kors, the upmarket fashion and accessories brand, jumped 25 per cent on their debut on the New York Stock Exchange.On Wednesday night, Michael Kors launched the biggest-ever initial public offering in US fashion. , selling more shares than expected in a deal valuing the company at $3.8bn, some 45 times its earnings.The IPO market in the US will end a busy week, as companies rush to go public before year-end, with a debut for Zynga, the online games developer, expected on Friday.Despite extremely choppy capital markets that have led to a record number of deals being delayed in 2011, investors have shown a willingness to buy high-profile offerings of growth companies, such as social networking groups and retailers seeking to access emerging markets.Michael Kors’s $944m offering surpassed the IPO of Ralph Lauren in 1997, according to Dealogic. Kors is seeking to expand its brand, which has been aided by the celebrity profile in the US of its eponymous founder, to Europe and Asia.In trading, the shares opened at $25 and close the day at $24.20, a rise of 21 per cent from the IPO price at $20. That is better than the average first-day gain of 10 per cent for US IPOs this year, according to Dealogic.Retail has been a standout sector in US IPOs this year. The second-best performing debut was GNC Holdings, the vitamins seller, whose shares are up 73 per cent since a March offering.Dunkin’ Brands, parent of Dunkin’ Donuts, has also outperformed, rising 33 per cent since its IPO. Both groups have cited overseas expansion as part of their need for capital.Those performances contrast with high-profile debuts in Hong Kong, where Kors is headquartered. Prada, the Italian fashion house, chose to list in Hong Kong this year in order to better market its brand to China’s fast-growing luxury market, but its shares have fallen 16.8 per cent since its listing.“Despite the volatility, 2010 and 2011 have seen good windows for both tech and high-growth consumer and retail stories,” said JD Moriarty, co-head of Americas technology equity capital markets at Bank of America Merrill Lynch.An IPO earlier this week of Jive Software, maker of social networking software to businesses, also jumped 25 per cent at its debut after pricing at the top of its projected range.Though the US IPO market this year is on track be about 50 per cent smaller than it was in 2007, tech IPOs are running on a pace roughly equal to pre-crisis levels, with $10.5bn expected to be raised in 42 deals.
56;RL;Ralph Lauren Corp;2011-12-14T22:59:25Z;Kors shares open 25% higher;;Shares of Michael Kors, an upmarket fashion and accessories brand, jumped 25 per cent on their debut on the New York Stock Exchange.On Wednesday night, Kors launched the biggest-ever public offering in US fashion, selling more shares than expected in a deal that will value the company at nearly $4bn.The New York flotation surpassed the $882m offering of Ralph Lauren in 1997, according to Dealogic, despite growing concern over the resilience of luxury spending.The deal was heavily oversubscribed and priced at $20 a share, above the projected range of $17 to $19. Investors in the company sold 47.2m shares, more than the 41m initially offered and raising $944m. The sale valued the company at $3.8bn.In trading, the shares opened at $25, and as of midday are at $24.25, a rise of 21.3 per cent. That is better than the average US IPO this year, which saw a first-day gain of 10 per cent, but well below the biggest “pops” of the year, such as the 109 per cent jump for LinkedIn.Michael Kors is a high-profile brand in the US, where it earned 89 per cent of its $758m revenue in its past fiscal year, but it wants to expand its presence in Europe and Asia, where it lags behind rivals such as Coach, Burberry, Hermès, Louis Vuitton and Marc Jacobs.At the IPO price, Michael Kors’ valuation is equal to 44 times its net earnings in the past four quarters, compared with Burberry’s valuation of 24 times trailing earnings and a multiple of 19 at Coach.Vanessa Friedman blogs on the fashion/luxury industry from both a corporate and consumer point of viewStacey Widlitz, an independent retail analyst, said: “It’s coming to the market at a time where we’re questioning the rate of growth in luxury, so the valuation …is quite expensive compared to peers.”Luxury has been one of the most resilient parts of retail since the global financial crisis, thanks to the continued spending of well-off consumers but in recent months stock market volatility and the eurozone crisis have raised concerns over whether they will retrench. “The idea is to get this IPO in before we see any downturn in luxury,” said Ms Widlitz.The company was founded 30 years ago by Michael Kors and continues to make clothes that are classic rather than trendy. However, the majority of its wholesale and retail sales now come from accessories such as handbags, leather goods, jewellery and watches.The company is registered in the British Virgin Islands and has its headquarters in Hong Kong.Since 2004, awareness of the company in the US has been boosted by the role of founder Mr Kors as a judge on Project Runway, a reality television show about fashion designers.Mr Kors is the company’s chief creative officer and the IPO will reduce his stake in the business from 11.7 per cent to less than 9 per cent.Unlike many companies that take months to build investor demand, Michael Kors filed to go public just two weeks ago.Scott Sweet, senior managing partner at IPO Boutique, an investor advisory, said the deal came together quickly thanks to the company’s established brand and its strong following among international financiers.“Investors consider them a comparable name to Burberry and Prada in the high-end market,” he said. “They also have free advertising on the television show.”Despite its Hong Kong base, Michael Kors decided to go public in the US after companies such as Prada debuted poorly in Hong Kong. Prada’s $2.1bn IPO in June priced at the bottom of its projected range and the shares fell in first-day trading.Michael Kors’ biggest shareholder is Sportswear Holdings, a private equity group led by Silas Chou and Lawrence Stroll that also owns stakes in Tommy Hilfiger Asia and Hackett.It acquired a majority stake in Michael Kors in 2003, which will be diluted to 37.7 per cent from 51.9 per cent by the share offering.
57;RL;Ralph Lauren Corp;2011-12-02T22:58:23Z;US luxury retailers lose some lustre;;"US equities enjoyed their best week since March 2009 but chinks appeared in the emerging market consumer thesis that has given luxury retail stocks strong support so far this year.The S&P 500 closed the week up 7.4 per cent to 1,244.28, after the market surged 4.3 per cent on a Fed-fuelled Wednesday, and held on gains, as the US unemployment rate dipped below 9 per cent for the first time since spring.“The Fed-ECB action to lower borrowing rates for European banks shows officials understand the magnitude of the problem,” said Phil Orlando, chief equity strategist at Federated Investors.“As long as European news flow improves incrementally, we think this rally can run another 7 or 8 per cent beyond 1,350, as investors refocus on positive domestic data.”Amid the rally, it was a tough week for luxury retailers, whose exposure to emerging market consumers has made them stars in a poor year for equities.Tiffany closed the week down 2.7 per cent to $67.60 after warning of soft fourth quarter sales in Europe and the north-eastern US.Investors took fright, despite continued strong growth in China.""No matter how good the performance in Asia, mature markets still matter,” said David Schick, retail analyst at Stifel Nicolaus. “We’re starting to see weakness in financial markets impacting on high end consumer spending.”Ralph Lauren and Coach both fell on Tiffany’s guidance before recovering to end the week in positive territory, and the consumer discretionary sector of the S&P 500, which normally outperforms in rallies, lagged behind the broad index.Other retail stocks were propelled in different directions as November sales figures revealed winners and losers from the start of holiday shopping on Black Friday.Kohl’s slipped 2.5 per cent to $50.51, after the department store saw same-store sales fall 6.2 per cent compared with November last year, despite opening at midnight on Thanksgiving to draw in Black Friday bargain hunters.That helped rival Ross Stores climb 8.2 per cent to $92.42 on year-on-year same store sales growth of 5 per cent.Elsewhere the rally was strongly cyclical. Metal, mining and energy stocks soared on rising commodity prices, and hopes that monetary easing in China would offer support to the country’s resource-intensive construction industry.Steel stocks performed particularly strongly with Alpha Natural Resources, which mines metallurgical coal used in steelmaking, rising 28.2 per cent to $24.11, AK Steel Holding rose 16.8 per cent to $8.22 and US Steel climbed 24.9 per cent to $27.81.“The Policy accommodation may support Chinese steel consumption, reducing the chances of oversupply, which would depress prices and hurt US companies,” said Aldo Mazzaferro, a steel analyst at Macquarie.But other analysts said the rally had more to do with trading patterns than fundamentals.“Steel stocks are heavily short sold, and shorts are buying shares to cover their positions,” said David Lipschitz at Crédit Agricole Securities.Some energy stocks sat out the rally, as investors remained wary of companies carrying debt.Transocean fell 3.9 per cent to $42.76, after announcing plans to issue 29.9m new shares and raise up to $2.5bn in the corporate bond market, to refinance outstanding debt.Robin Shoemaker at Citigroup said the dilution effect could reduce earnings per share by as much as 55 cents to $3.85 in 2012.“We believe Transocean is partially financing with equity to meet near term liquidity obligations while trying to avoid losing its investment grade credit rating,” he told clients.The financial sector of the S&P 500 was up 9.5 per cent, led by Citigroup, which climbed 19.2 per cent to $28.17 and Morgan Stanley, up 17 per cent to $15.52.Hospital owners and medical device manufacturers had a tough day on Friday after Wells Fargo said Medicare carriers in 11 key states will perform pre-payment audits for inpatient hospital linked to certain cardiovascular and orthopaedic conditions from the start of the new year.Hospital operator Tenet Healthcare fell 10.7 per cent on Friday to end the week up just 0.2 per cent to $4.18. Device manufacturer St Jude Medical tumbled 7 per cent, to end the week up 3 per cent to $35.83.Western Digital Corporation rose 25.8 per cent to $31.44, hitting levels not seen since flooding forced the hard disk drive manufacturer to close production facilities in Thailand more than a month ago.The company raised its current quarter revenue forecast to at least $1.8bn from a previous maximum of $1.25bn, as supply chain pressure eased.Fertiliser companies underperformed broad markets, as concerns mounted that Indian farmers will import less nutrient.Mosaic and Potash Corporation suffered losses early in the week as Indian farming co-operatives pushed for discounts on potash imports of up to 35 per cent in dollar terms, to reflect rupee weakness.Mosaic ended the week up 3.8 per cent to $51.78 and Potash Corporation up 4 per cent to $42.29.CF Industries, which supplies India with nitrogen-based fertilisers, had fared better earlier in the week, but fell Friday to close the week up just 0.7 per cent to $140.73, as reports suggested Indian orders for urea declined significantly in November compared with October."
58;RL;Ralph Lauren Corp;2011-11-29T22:09:20Z;Tiffany sales warning hits luxury stocks;Tiffany shares hit by US and European weakness;Investors dumped shares in luxury retailers after Tiffany forecast “weakness” in fourth quarter sales in Europe and the northeastern United States.Tiffany shares fell 8.7 per cent to $67.22, Coach was off 3.1 per cent to $60.20 and Ralph Lauren fell 3.2 per cent to $140.66.Luxury retailers have been a rare bright spot in the S&P 500 this year, as investors buy into their exposure to emerging market consumers.“But these share price moves show mature markets still matter,” said David Schick, a retail analyst at Stifel Nicolaus.“We’re starting to see weakness in financial markets impacting on high end consumer spending.”However, other analysts said the emerging market thesis still stood and the sell-off was excessive.“Tiffany’s Asia-Pacific results were exceptional in the third quarter, and the company still raised guidance for the fourth quarter there,” said Dorothy Lackner, at Caris & Company.US indices were broadly higher as investors shook off Fitch Rating’s decision to cut the outlook on US government debt to negative and the fifth consecutive month of falls in US home prices.The S&P 500 closed up 0.2 per cent at 1,195.19, while the Dow Jones Industrial Average climbed 0.3 per cent to 11,555.63.“Fitch cutting their outlook on the US and press reports that S&P may cut its outlook on France just don’t cut it as major events any more, given how much fear has already been priced into markets,” said Colin Cieszynski, the chief market strategist at CMC Markets.But the Nasdaq Composite index nudged down 0.5 per cent to 2,515.51, weighed down by Apple and Google, two of the most highly weighted stocks in the index.Apple fell 0.8 per cent to $373.20 and Google was down 0.9 per cent to $582.93 after a wireless industry body went ahead with a plan to launch voluntary age ratings for smartphone apps, without participation by the two tech giants.Shares of AMR Corporation collapsed to 26 cents after the parent company of American Airlines filed for a Chapter 11 bankruptcy. American has called time on attempts to renegotiate pension and benefit costs with pilots.Semiconductor manufacturer Corning suffered heavy selling after unexpectedly lowering fourth quarter sales guidance.The stock fell 10.8 per cent to $13.19, as the company said sales of a major LCD screen product will rise only 5 to 10 per cent quarter on quarter, compared to prior guidance of a 20 per cent sequential rise.Hospira fell 9.1 per cent to $28.17 after RBC Capital Markets said a long running Food and Drug Administration investigation into the medical device marker’s main manufacturing plant may cause “widespread” production breakdowns, and take two to three years to correct.Netflix fell 3.4 per cent to $67.57 after Standard & Poor’s downgraded the company’s debt another notch, citing the risks involved in the video streaming website’s capital intensive overseas expansion.Home Depot was the standout performer in the S&P 500 and the Dow Jones. Shares rose 5.3 per cent to $38.96 after the company’s chief financial officer told an analyst breakfast meeting that November sales had been better than expected.Hard-drive manufacturers Western Digital climbed 4.7 per cent to $27.80.The company was following on the coat tails of rival Seagate Technology, which was up 3.7 per cent to $16.58, after releasing a positive update to fourth-quarter guidance, even as widespread flooding in Thailand wreaks havoc with supply chains.“[Seagate’s] guidance update was driven by increasing industry-wide prices [for hard drives] rather than anything company specific,” said Joe Yoo at Citigroup.Mr Yoo said rising prices should reduce Western Digital’s fourth quarter net loss to roughly $150m, compared to the company’s most recent guidance of $300m.Banks gave back some of their gains from Monday’s rally.Morgan Stanley fell 3.6 per cent to $13.31, leaving the investment bank up just 0.4 per cent for the week, significantly underperforming the S&P 500, which is up almost 3 per cent.Bank of America was down 3.2 per cent to $5.08, after touching a new year low of $5.03 during the day.But Nomura analyst Brian Foran gave bank executives some cheer, arguing retrenchment by European lenders from the US markets could benefit midsize US banks.“This creates an opportunity for US banks such as US Bancorp, PNC and Wells Fargo who are big enough to serve large corporate borrowers and are now able to replace Europeans as they pull out,” Mr Foran wrote to clients.PNC was up 1.2 per cent to $50.83.
59;RL;Ralph Lauren Corp;2011-11-25T19:19:49Z;Wall St battle turns into Black Friday store wars;Consumers pack stores amid ‘Occupy’ protest and pepper spray;Protests against excessive consumption and a pepper spray attack by an aggressive bargain-hunter marked the two extremes of a busy post-Thanksgiving shopping day.US retailers opened earlier than ever on the eve of the day known as Black Friday, seeking to secure a share of holiday spending that may rise only modestly from last year due to consumer worries over jobs and housing.Full-bore consumerism has long been a pillar of the American economy. But this year Black Friday, which often accounts for 10 per cent of all holiday spending, became the latest target of Occupy Wall Street’s grassroots activism.“Stop supporting big companies. Support the working class. Support small business. Stop feeding the rich,” yelled half a dozen Occupy protesters at some of the 10,000 people that Macy’s estimated were waiting for its flagship store in Manhattan to open at midnight.One protester asked people standing inches away from him: “Are you guys listening?” The answer seemed to be no.At the front of the queue was Robert Glover, a Brooklyn transport worker and newspaper delivery man who was more interested in buying a Polo Ralph Lauren shirt than debating whether he was enriching America’s “1 per cent”.“They’re just saying that because they can’t afford to shop here,” Mr Glover told the Financial Times. “I don’t really care. I’m buying stuff for myself. No one else.”Early openings by Macy’s, Target, Best Buy, Toys R Us and Walmart before the end of Thanksgiving sparked criticism from some employees and commentators who said they were ruining the stay-at-home tranquillity of the holiday.At a Walmart in Porter Ranch, California, a 10pm stampede through the doors turned ugly when police said a woman used pepper spray to “gain an upper hand” over her fellow shoppers. Up to 20 people suffered minor injuries as the woman attempted to clear a path to the electronics section.The National Retail Federation has estimated that holiday spending will rise by 2.8 per cent from a year ago. In 2010, holiday sales increased by 5.2 per cent to $452bn after two years of declines.“The pepper spray scenario is the new way of the world. People will do anything they can to get that deal,” said David Bassuk at AlixPartners, a consultancy. But Mr Bassuk added he was not convinced retailers were offering better bargains. “It is all marketing. It really is. But what you see with the long lines is that marketing works.”
