;Ticker;Nombre_Completo;Date_Time;Titular;Subtitular;Texto
16;REGN;Regeneron Pharmaceuticals;2016-04-01T21:26:42Z;Urban Outfitters jumps on positive sales;Stocks helped by report showing US factory sector had expanded;Shares in Urban Outfitters, the retailer behind such brands as Anthropologie, Free People and its eponymous brand, popped on Friday after it suggested comparable sales were positive.The retailer jumped 3.63 per cent to $34.29 by the close after it said that “thus far” during its fiscal first quarter, comparable sales had grown in the low single digits. That compares with a consensus for a 1 per cent decline.Momentum picked up in March. Urban Outfitters had previously signalled that same-store sales at all three brands could decline during the quarter. Sales had been boosted by the leap year, it said.The retailer has faced increased competition from fast fashion retailers such as Zara and H&M.Urban Outfitters said it was acquiring a pizza chain last year in an attempt to lure customers back. “We remain favourable regarding the long-term outlook of the company,” said Richard Jaffe, an analyst at Stifel.The retailer was “driven by a talented management team, significant growth opportunities, industry-leading omnichannel capabilities and strong brand equity, fuelled by highly differentiated merchandise assortments that resonate well with each brand’s targeted customers”.Urban Outfitters shares have advanced 50 per cent this year.Stocks turned mildly positive by midday after a report from the Institute for Supply Management showed that the US factory sector expanded last month for the first time since August.By the close, the S&P 500 was up 0.6 per cent at 2,072.78, the Dow Jones Industrial Average had climbed 0.6 per cent to 17,792.75 and the Nasdaq Composite was 0.9 per cent higher at 4,194.54.Regeneron Pharmaceuticals was the biggest gainer, jumping 12.43 per cent to $405.25. With Sanofi it said two late-stage studies of dupilumab, a treatment for atopic dermatitis, a chronic inflammatory skin disease, had met primary targets.BlackBerry fell 7.5 per cent to $7.48 after it said sales had fallen 30 per cent to $464m in the fourth quarter from the year before.The smartphone maker swung to a net loss of $238m, or 45 cents a share, in the three months to the end of February, compared with a profit of $28m, or 5 cents a share, in the quarter a year before.Analysts on Wall Street had forecast a loss of 21 cents a share on sales of $561.8m. Adjusting for one-off items, the company reported a narrower than expected loss of 3 cents a share.Tesla rose 3.40 per cent as orders for its mass-market Model 3 car topped estimates.Elon Musk, chief executive, said more than 180,000 orders had been placed in 24 hours.An investor survey conducted by analysts at Evercore ISI had suggested 55,400 orders in the first 72 hours and 117,400 by the end of the year.mamta.badkar@ft.comTwitter: @mamtabadkar
17;REGN;Regeneron Pharmaceuticals;2016-03-31T20:53:34Z;Telecoms and utilities lead quarterly gains for S&P 500;Healthcare and financials are the two big sectors that end the period in the red;The US telecommunications and utilities sectors widely outperformed in the first quarter as the Federal Reserve scaled back its expectations for raising borrowing costs this year.Many strategists forecast a tepid performance from defensive stocks when the first quarter began, adopting the view that a stronger US economy and tighter policy from the Fed would dull investor interest in sectors such as telecoms and utilities.Compared to a 0.8 per cent quarterly rise for the S&P 500, the telecom index stands 15.1 per cent higher for the first quarter, while the utilities index has rallied 14.5 per cent. Telecoms has recorded its best quarterly gain since 2010, while the performance of utilities ranks as the best three month stretch since 2003.Among the main telecoms companies in the S&P, Verizon Communications, a blue-chip telecoms group, rallied 17 per cent to $54.08, while AT&T advanced 13.8 per cent to $39.17.In utilities, Consolidated Edison, a power utility, rose 19.3 per cent to $76.62.On the other side of the spectrum, the two big sectors that ended the quarter in the red were healthcare and financials. Healthcare fell 5.9 per cent, while financials declined 5.6 per cent.Biotechnology stocks sustained a particularly strong hit, with the sector sliding 13.3 per cent, as investors moved away from stocks that are seen as risky and grew more worried about potential regulatory action on drug prices.Regeneron Pharmaceuticals dropped by a third to $360.44, while Gilead, the biggest group in the sector, dropped 9.2 per cent.Financials, meanwhile, came under pressure as the odds for a Fed rate rise for 2016 dimmed and yields on long-term Treasury bonds dropped. Banks earn profits on the difference in the rate they pay for funds and what they earn on loans, so lower-for-longer rates are seen crimping their net interest margins.In addition, there have been lingering concerns about lenders’ exposure to the embattled energy sector. Indeed, Fitch said earlier this month that the default rate among the riskiest US corporate borrowers may hit its highest level ever outside a recession this year.On Thursday the S&P 500 fell 0.2 per cent to 2,059.74, posting a quarterly gain of 0.8 per cent. That leaves the benchmark about 3 per cent below its record closing high of 2,130.82 set in May 2015.The Dow Jones Industrial Average fell by the same margin on the day to 17,685.09, locking in a first-quarter advance of 1.5 per cent. Meanwhile, the Nasdaq Composite was nearly unchanged on Thursday at 4,869.85, logging a quarterly loss of 2.8 per cent.The S&P 500’s mild first-quarter rise belies the intense volatility that sent the market barometer falling more than 11 per cent for the year at one point. But a stabilisation in the price of oil, brighter sentiment on the US economy and action by global central banks stoked a sharp rebound late in the quarter. The CBOE’s Vix, a measure of implied volatility on the S&P 500, was at 13.95 on Thursday, down from a quarterly peak of 28 in mid-February.
18;REGN;Regeneron Pharmaceuticals;2016-03-09T20:52:51Z;US bull market: the best & worst peformers;;The US equity bull market, which is marking its seventh birthday, hasn’t treated every stock equally. fastFT reviews the best and worst performers since the stock market bottomed in March 2009.LeadersGeneral Growth Properties has had the biggest surge of any of the current S&P 500 members were part of the benchmark index when the bull market began on March 9, 2009. The stock, which traded just a little north of a quarter then, has catapulted to $28.24.Despite the giddy advance, the real estate investment trust, which operates US malls, still hasn’t recaptured its all-time high of $49.46 hit in 2007.Regeneron Pharmaceuticals, a biotech company, and Under Armour, a maker of athletic apparel, have also posted impressive runs of more than 2,000 per cent.LaggardsThe list of bull market laggards is stuffed with energy and mining companies hammered by the collapse of many commodities, including oil.Transocean, the offshore oil rig operator, has logged the biggest price drop since the beginning of the bull market. Southwestern Energy and Chesapeake Energy, both big US natural gas producers, have tumbled as well.Another notable company on the list is Staples, the US office supply chain, which has dropped by about a third since the bull market began.
19;REGN;Regeneron Pharmaceuticals;2016-02-25T13:02:50Z;Ireland election: voters not convinced of country’s recovery;Poorer areas not feeling benefit of growing economy and job creation;Paddy Flannery can believe that Ireland’s economic revival has reached his home city of Limerick — even if he cannot feel it for himself.He reads in the newspapers about improvements in Dublin and elsewhere, sees signs of it dotted around Limerick in the form of new jobs and investment, and hears Irish prime minister Enda Kenny’s re-election slogan, “Let’s keep the recovery going”.Yet, from his vantage point in the city’s deprived Moyross district, where unemployment is twice the national average, the recovery is something that is happening elsewhere.“I can see it, but I can’t feel it,” says the community activist, who has campaigned on behalf of the area for most of the 40 years he has lived in it. “It will be a while yet before people [here do],” he adds.His observation captures the ambivalence that many in Ireland feel about the revival of the country’s economic fortunes from its worst ever recession as they prepare to vote in Friday’s general election.Despite Ireland being the fastest growing EU economy last year, voters appear unconvinced by the outgoing government’s assertion that the country has been brought back from the brink. In parts of Limerick, Ireland’s most socially deprived city, Mr Kenny’s claims to take credit for the recovery have largely fallen on deaf ears.His inability to convince voters that they are better off now than during the five-year downturn that began in 2008 has made for an unexpectedly difficult election for Mr Kenny and his ruling Fine Gael party — even as opinion polls show its support at about 30 per cent, meaning it will comfortably remain the single biggest party in the new parliament.Four years ago, Ireland’s jobless rate topped 15 per cent as the effects of the crisis bit deeply. But by last month it had fallen to 8.9 per cent, in line with the eurozone average. Foreign direct investment in the booming pharmaceuticals and technology sectors helped the Irish economy grow 7 per cent last year. A net 50,000 new jobs were created in 2015, according to official data, taking the total since the recovery began in mid-2013 to about 160,000.Critics say Mr Kenny’s recovery is too Dublin-centred. Yet there is evidence that other Irish cities are starting to benefit, too. David Jeffreys, co-founder of Action Point, says revenues at his Limerick-based software developer have jumped from €1m to €7m since 2009, while employee numbers have risen from fewer than 10 to 65.“If you look at where we are now and where we were five or six years ago, it’s two different worlds,” Mr Jeffreys says.The strongest evidence of Limerick’s revival is provided by Regeneron, a US biotech company investing $650m to build a drug-ingredients facility that will employ 500 people in the city by the end of next year.The project has particular resonance for the city because it will be on the site of the former Dell manufacturing facility, which closed in 2010 with the loss of nearly 2,000 jobs.“We have been supported by the whole city, they were biting our hands off” to win the investment, says Niall O’Leary, a Regeneron vice-president. “The city is coming back, too. It’s changed for the better even in the two years I’ve been here.”Yet the skilled, well-paid jobs that will be created by Regeneron — the type on which Ireland’s economic revival has been built — are of little use to most in Moyross. “There are a lot of young males in this area who haven’t done well at school, and this is compounded by the lack of manual labour jobs,” Mr Flannery says.In some ways, Limerick is unlucky. As the rest of Ireland boomed during the Celtic Tiger years of the 1990s and early 2000s, the city descended into years of drug money-fuelled gang violence perpetrated by a handful of local families.The problem has now been tamed, but it has left behind a legacy and almost certainly cost the city jobs and the opportunity for economic progress. “The Celtic Tiger didn’t roar in Limerick, and we missed that period of investment,” says Conn Murray, chief executive of Limerick City and county council.Limerick is still dealing with the consequences of those two lost decades. The lure of out-of-town shopping centres has left O’Connell Street, its handsome main thoroughfare, almost deserted. The city is awash in plans for regeneration and revival, but it is too early to call it even a work in progress.Still, Mr Flannery is optimistic that the recovery will eventually make its way to Moyross. “If the capital is doing well, surely the whole of Ireland will benefit . . . It’s how you disperse it around the country that will make the difference,” he says. “By then,” he adds,” Friday’s election will have long passed.”
20;REGN;Regeneron Pharmaceuticals;2015-10-12T16:33:02Z;Eli Lilly’s heart-drug setback reverberates through pharma sector;Companies recently approved for new cholesterol drugs climb;Shares of several of the US’s largest drugmakers were roiled on Monday after Eli Lilly surprisingly halted development of a new heart drug.Lilly said Evacetrapib, which aimed at increasing levels of “good” cholesterol while reducing levels of “bad” cholesterol, would probably not meet its goals in a clinical trial.Shares of drug heavyweight Merck fell as much as 2 per cent to $49.78 on the back of the news before paring back losses to 0.5 per cent. The Kenilworth, New Jersey-based company is conducting a large, late-stage trial for Anacetrapib, a drug that uses a similar mechanism to Evacetrapib. Analysts are expecting sales of $567.2m for the Merck drug in 2019, and $858.6m the following year, according to a poll by Bloomberg.Jeffrey Loo, equity healthcare research analyst at S&P Capital IQ, said the news from Lilly “raises more uncertainty” about Merck’s drug, but “doesn’t necessarily mean [it] won’t be efficacious”.Eli Lilly shares shed 8 per cent at $79.45 by the close of trading.On the other side of the spectrum, companies that were recently approved for new cholesterol drugs climbed on the day. Amgen, which gained US Food and Drug Administration approval for a drug called Repatha in August, climbed 2 per cent to $153.03. Meanwhile, Regeneron, which in partnership with Sanofi scored a green light from the FDA for Praluent in July, rallied 4.6 per cent to $526.83.Mr Loo said both of those drugs are aimed at lowering “bad” cholesterol among people who do not respond well to so-called statins, such as Lipitor.Elsewhere, Phillips 66 said its board approved an increase in its stock buyback of $2bn, bringing the total authorisation to $9bn. The Houston-based oil refiner also unveiled a $3.6bn capital budget for next year, excluding its Philips 66 Partners’ capital programme.Of those capital expenditures, $2bn will go to the midstream business, which includes the continued construction of a liquefied petroleum gas export terminal on the Gulf Coast. It is also investing in pipeline projects to move crude oil from North Dakota’s Bakken region to market centres across the US.Meanwhile, $1.2bn will be invested in the company’s refining business, with 70 per cent of that sum heading to safety and environmental initiatives.By close, the shares were up 0.4 per cent to $83.87.The US energy sector as a whole dropped after its best week of 2015 amid a decline in the price of crude oil. Chevron, an oil major, fell 1 per cent to $88.75. Marathon Oil, which is a big performer in the shale arena, dipped 3 per cent to $18.96.Freeport-McMoRan, the mining heavyweight, saw its shares dip 4 per cent to $12.94. The move came after a 27 per cent surge last week on news the company might spin off its oil and gas division.Shares of US airlines flew higher on the day. American Airlines rose 3.4 per cent to $43.84, Delta Air Lines climbed 2.7 per cent to $48.49, Southwest Airlines ticked up 3.2 per cent to $41.22 and United Airlines jumped 3.8 per cent to $57.80.Fiat Chrysler shares traded in New York climbed 1.5 per cent to $15.91. The carmaker said late on Friday that it planned to raise nearly $1bn as it spins off a 9 per cent stake of Ferrari in an initial public offering.By close, the S&P 500 added 0.1 per cent to 2,017.46, the Dow Jones Industrial Average rose 0.3 per cent to 17,131.86 and the Nasdaq Composite climbed 0.2 per cent to 4,838.64.
21;REGN;Regeneron Pharmaceuticals;2015-10-06T21:25:23Z;Express Scripts agrees deal for heart drugs;Pharmacy group secures big discount on medicine’s $14,000-a-year price tag;The largest pharmacy group in the US has agreed to make two expensive new heart drugs available to its patients, after securing big discounts from the companies which make the medicines and implementing strict curbs on who is eligible.Express Scripts, the number one pharmacy benefits manager, said it had reached an agreement that covers 25m of its members after the makers of the medicines agreed to cut the $14,000-a-year price tag, although it did not disclose the size of the discount.According to some estimates, the US healthcare system will end up paying more than $20bn a year for the so-called PCSK9 inhibitors, which reduce levels of “bad” or LDL cholesterol by between 55 and 70 per cent.The FDA recently approved two of the drugs — Repatha, made by Amgen, and Praluent, made by Sanofi and Regeneron — for people who have had a heart attack or stroke but cannot reduce their LDL cholesterol to safe levels using statins alone.The drugs were also approved for a genetic condition known as familial hypercholesterolaemia, which leads to dangerously high levels of LDL cholesterol.However, there has been uncertainty over whether companies like Express Scripts, which run prescription drug programmes for employers and insurers, would agree to pay for the medicines because of the huge price tag.Dr Steve Miller, chief medical officer at Express Scripts, said it would not spend more than $750m on the drugs in 2016 because it had secured a discount.The group will also implement an “aggressive utilisation management programme” to ensure only those patients who are eligible for the drugs will receive them.There has been concern that doctors will prescribe the drugs more widely to those patients who experience side effects on statins, which cost less than 50 cents a day, and the utilisation management programme is designed to stop this happening.We did pit them against each other and made it clear we were willing to go exclusive, but the best case scenario is to get the economics you want and the broadest accessDr Miller said both companies had agreed to limit any price hikes for the entire contract, although he would not specify how long the agreement lasts.The negotiation over PCSK9 inhibitors is the most closely watched since Express Scripts refused to pay for Gilead’s $1,000-a-day hepatitis C pill last year and instead signed an exclusive agreement with a rival after securing a big discount.Dr Miller said he was again prepared to give exclusivity to either Amgen or Sanofi-Regeneron but that he had achieved a good enough deal to offer both products.“We did pit them against each other and made it clear we were willing to go exclusive, but the best case scenario is to get the economics you want and the broadest access,” he told the Financial Times.Express Scripts is the first of the large pharmacy benefits managers to sign a deal for the new drugs and its competitors are expected to announce similar agreements shortly.Anthony Hooper, an executive vice-president at Amgen, said: “This is an important milestone for patients. We will continue to engage constructively with other payers to enable patients to have access to Repatha.”
