;Ticker;Nombre_Completo;Date_Time;Titular;Subtitular;Texto
0;REGN;Regeneron Pharmaceuticals;2020-04-25T02:56:01+0000;Sanofi and Regeneron trial arthritis drug as coronavirus treatment;Groups join effort to repurpose existing remedies in fight against global pandemic;"Scientists hunting for ways to adapt existing drugs for use by coronavirus patients are launching a clinical trial in New York to test whether an arthritis treatment could help sufferers and improve survival rates.Sanofi, the French pharmaceutical company, and Regeneron, a US biotech, are trying to find out whether Kevzara, approved to treat rheumatoid arthritis, could help reduce patients’ inflammatory response to coronavirus.Many critically ill Covid-19 patients develop acute respiratory distress syndrome, as their immune system kicks into overdrive. The trial will start at New York hospitals but be expanded to 16 sites. It is expected to enrol up to 400 critically ill coronavirus patients, studying the drug’s impact on their fever and need for extra oxygen. It will also look at whether it prevents deaths or even hospitalisation. Many pharmaceutical companies have started trials based on existing drugs, which have proven they are safe to take, to see if they are effective at treating Covid-19.The drugs fall into three broad categories: antibodies taken and adapted from people who have recovered from the virus and used for infusions for the sickest patients; antivirals, such as drugs designed for HIV, Ebola, and malaria, which could stop the replication of the virus in the earlier stages; and antinflammatories, such as Kevzara, for treating immune system reactions like the one that occurs in the later stage of the disease.A study in China of favipiravir, an antiviral developed by the Japanese Fujifilm group, is due out soon, while the first results from a study into remdesivir, an antiviral originally developed by California-based Gilead for Ebola, is expected in mid-April. Kevzara is an antibody but was not designed for Covid-19. Christos Kyratsous, vice-president of research in infectious diseases at Regeneron, said the drug may be able to provide some “temporary support”, especially in countries where the healthcare systems are overloaded. How is coronavirus taking its toll on markets, business, and our everyday lives and workplaces? Stay briefed with our coronavirus newsletter.Sign up hereHe said anecdotal evidence from studying similar antibodies in China made him optimistic, “but we believe that it needs to be tested in the clinical setting to make sure the data we are getting is unbiased”, he said. John Reed, Sanofi’s global head of research and development, said Kevzara could be a potentially important treatment option across the world. “We expect to rapidly initiate trials outside the US. in the coming weeks, including areas most affected by the pandemic such as Italy.”Sanofi and Regeneron are working on efforts to develop a vaccine to Covid-19. Regeneron is prepared to scale up manufacturing if the trial shows Kevzara is effective, Mr Kyratsous said, with facilities in Alberta, New York and Ireland. Subscribers can use myFT to follow the latest ‘coronavirus’ coverage"
1;REGN;Regeneron Pharmaceuticals;2020-02-27T20:27:40Z;Few winners emerge after brutal stock sell-off;Netflix, Clorox and drugmakers weather market rout sparked by coronavirus;Netflix, Clorox and Gilead Sciences are among the mere handful of winners in the S&P 500 during a market rout this week, as investors back companies most likely to weather economic fallout from a potential pandemic.The S&P 500 has dipped into correction territory just six days after securing a record high, reflecting mounting worries over the spread of coronavirus. The latest sell-off extended the benchmark index’s decline this week to more than 8 per cent, which would mark its steepest drop since the financial crisis.Only five companies have managed to post a week-to-date gain by Thursday afternoon.Regeneron Pharmaceuticals has been the top performer with a 10.4 per cent rise, as the company races to develop treatments for coronavirus. In early February, Regeneron said it was expanding a partnership with the US Department of Health and Human Services and treatments could be made available for testing or “compassionate use” within a few months.Shares in Gilead, whose antiviral drug remdesivir is the subject of a clinical trial for the treatment of Covid-19, have jumped 5.9 per cent.Clorox, known for its disinfecting wipes and other cleaning products, and CME Group are each up more than 3 per cent.Netflix is another unsurprising member of the winners’ circle, with the streaming video giant positioned to remain a fixture on consumers’ screens if offices or schools are forced to close. Shares are up 0.8 per cent this week and about 18 per cent year-to-date.Although they are down for the week, Steris and Quest Diagnostics have notably outperformed the broader market. Steris, which makes sterilisation equipment and other products for medical providers, is down just 0.6 per cent. Quest, a clinical lab, has fallen by the same margin.The utilities sector, considered a defensive play in equities, has recorded the slimmest decline this week at minus 7 per cent. Consumer staples, healthcare and real estate have outperformed the benchmark S&P 500, while energy has registered the steepest decline at 15 per cent.
2;REGN;Regeneron Pharmaceuticals;2019-02-11T17:24:55Z;Sanofi and Regeneron cut price of Praluent by 60%;Drugmakers lower cost of anti-cholesterol drug amid slow take-up and political pressure;Sanofi and Regeneron are slashing the list price of anti-cholesterol drug Praluent by 60 per cent, as the drugmakers respond to pressure from US health insurers and pharmacy benefit managers reluctant to adopt the costly medicine.Praluent will have a list price of $5,850 a year from early March, down from about $14,000 previously. The price cut is designed to make the drug more affordable for older patients using Medicare, cutting out-of-pocket costs to between $25 and $150 a month, depending on the plan.Drugmakers had hoped that injections for people with dangerously high cholesterol would become blockbuster drugs. But Praluent, and its rival Repatha, had struggled to gain traction in a market dominated by statins that can cost less than $50 a year.A 2017 study in the journal Circulation claimed that even for patients with a severe hereditary form of high cholesterol, insurers rejected the drugs 63 per cent of the time. Pharmaceutical companies have faced vocal criticism for high drug prices from both sides of the political divide in the US. Several politicians are floating proposals for government intervention on drug pricing and the Food and Drug Administration, the US regulator, is speeding up approvals of cheaper generics versions of drugs that are no longer under patent. The price cut follows a similarly dramatic discount by Amgen of its anti-cholesterol drug Repatha in October. Praluent now has the same list price as Repatha. French drugmaker Sanofi and Regeneron had already cut the net price for a significant proportion of patients covered by Express Scripts, the largest standalone pharmacy benefit manager in the US. Leonard S Schleifer, president and chief executive at Regeneron, said the cut should help senior citizens who had still found it hard to afford the medicines because of high co-pay costs. “Offering a lower-priced Praluent will help lower seniors’ out-of-pocket costs and thereby remove another barrier to receiving this important medicine,” he said. Michelle Carnahan, North America head of primary care at Sanofi, called on insurers to pass on the price cut to patients. “We hope that payers will do their part to help ensure savings are directly passed on to more patients, through lower out-of-pocket costs,” she said. Praluent was approved by the FDA in 2015 and was the first drug of its kind — called a PCSK9 inhibitor — to receive approval. The drug promotes the body’s ability to remove cholesterol from its own system, and is particularly useful for patients with a severe hereditary form of high cholesterol.
3;REGN;Regeneron Pharmaceuticals;2018-05-01T11:00:27Z;Sanofi slashes price of wannabe-blockbuster cholesterol drug;Sales of Praluent have been hurt by the campaign to limit US pharmaceuticals costs;Sanofi and Regeneron have agreed to slash the price of a novel cholesterol-lowering drug, in an attempt to boost flagging sales of what investors had hoped would be a blockbuster new medicine.The discounts on the US price of Praluent — an injection for people with dangerously high cholesterol who need something more powerful than the cheap statins taken by millions of Americans — are a further sign that pharmaceutical companies are losing their pricing power.Sanofi said it would lower the net price of Praluent for a significant proportion of patients covered by Express Scripts, the largest standalone pharmacy benefits manager (PBM) in the US. Praluent, which was launched in 2015, is part of a new class of cholesterol drugs known as PCSK9 inhibitors, which Sanofi developed in tandem with New York-based biotech Regeneron, its longstanding partner.In exchange, Express Scripts will make it easier for patients to receive the medicine by removing barriers that have been put in place to limit uptake of the expensive drug.The French drugmaker did not disclose the discounted price, but one person briefed on the negotiations said it would be in the range of $4,500-$8,000 per year — a significant reduction of at least 45 per cent on the medicine’s list price of $14,500.Analysts had predicted blockbuster sales for PCSK9 inhibitors, with peak revenues of up to $6bn a year, which would have put them among the best-selling classes of drugs of all time.But health insurers and PBMs balked at the high price tag — which compares to less than $50 for an annual supply of statins — and refused to pay for the medicines unless doctors and patients completed a laborious “prior authorisation” process involving lots of paperwork.Implementing a prior authorisation process for expensive medicines has become a favourite tool of insurers and PBMs seeking to control costs, and it has had a chilling effect on sales of some drugs.Last year, Praluent generated just $195m in sales for Sanofi and Regeneron, and Repatha, a rival drug made by biotech company Amgen, brought in $319m — putting both medicines well short of analysts’ revenue forecasts. Amgen said last year that three-quarters of prescriptions for Repatha in the US were being rejected for reimbursement.The deep discounting announced by Sanofi on Tuesday provides further evidence that insurance companies and PBMs are having some success at holding down drug prices in the US after years of budget-busting increases. A report published last week found that net spending on medicines grew by just 0.6 per cent in 2017, the lowest level of inflation recorded in years.The deal could also boost Praluent’s market share, which has lagged behind Repatha. Express Scripts will make Sanofi the exclusive provider of PCSK9 therapies for 25m patients on its national preferred formulary, and will simplify the prior authorisation process. Doctors prescribing Praluent will have to fill in a single “attestation” form rather than submitting laboratory results and detailed patient histories.Michelle Carnahan, who runs Sanofi’s diabetes and cardiovascular business in the US, said the deal “addressed head-on the frustrations caused by complex pre-authorisation requirements that can hamstring physicians and restrict access to an important medicine”.
4;REGN;Regeneron Pharmaceuticals;2017-10-05T14:43:01Z;Regeneron wins legal case over heart drugs;;Regeneron won a victory in a legal battle over a new class of heart drugs, sending shares in the New York biotech group 1.8 per cent higher.The drugmaker and its partner Sanofi were granted a new trial that will re-examine whether the companies are infringing on patents held by Amgen, which makes a rival drug. The appeal court also reversed a decision that banned the companies from selling their medicine, known as Praluent.Shares in Amgen fell 1.6 per cent as investors digested the news that the company’s drug, Repatha, would not have the market to itself. Sanofi’s Paris-listed stock edged up by 0.6 per cent.Analysts had touted the new cholesterol-lowering drugs, known as PCSK9 inhibitors, as an alternative to the statins taken by millions of people to prevent heart attacks and strokes, which would have made them one of the most lucrative classes of medicines in years.But sales of the medicines have been sluggish since they were launched at the end of 2015, as healthcare systems and insurers have balked at the pricetag — $14,000 a year versus just a few cents a day for generic statins.
5;REGN;Regeneron Pharmaceuticals;2017-07-02T17:34:11Z;Fears over a medical gold rush in cancer drug race;With almost 800 trials under way observers warn scientific rigour is being compromised;It might sound like a strange complaint against an industry often accused of scrimping on research to fund marketing efforts, but some executives and scientists say drugmakers are doing too many clinical trials in the hot new field of immunotherapy.Merck and Bristol-Myers Squibb have dominated the first wave of immunotherapy with their “checkpoint inhibitors”, which release brakes in the immune system so that it can attack tumours, while Roche, AstraZeneca and Pfizer are trying to catch up by launching rival versions. Almost $9bn worth of these checkpoints have been sold since they went on sale two years ago. Early enthusiasm for the medicines has given way to a determination to push response rates substantially higher. Although a minority of about 20 to 30 per cent of patients respond extremely well to the drugs — living for months or years longer than their doctors would expect — the majority derive no benefit. “There is some pushback,” said Jill O'Donnell-Tormey, chief executive of the Cancer Research Institute. “Are there too many trials? Are we just throwing spaghetti at the wall, by taking compound ‘X’ or ‘Y’ and adding it together just to see what happens?” Most scientists say checkpoints do not need to be replaced with something else, but rather augmented with new drugs that can further cajole the immune system into fighting cancer. This has led to an unprecedented amount of clinical research sponsored by drugmakers, which are combining checkpoints with other medicines to try to find a magic bullet to treat cancer. The sheer number of studies has sparked fears that some companies are engaging in a medical gold rush, hoping to chance upon the right cocktail without doing the appropriate scientific groundwork. Almost 800 clinical trials involving a checkpoint are under way in the US, according to a government database, more than 700 of which are testing the drugs in combination with one or more additional medicines. This compares with about 200 in 2015.Some investors are unnerved by such haste, says Brad Loncar, who runs an exchange-traded fund focused on immunotherapy: “People are concerned there is not as much scientific rigour as there should be.” The world doesn’t need any more [checkpoints]. We need other things. We should be finding a way to develop other medicines beyond thesePascal Soriot, chief executive AstraZeneca, which is trialling its own immunotherapy combination, admitted as much in a recent interview with the Financial Times. “The field is very competitive. Right now you have a lot of companies that take bets . . . without a lot of data,” he said. “So we also have to consider the speed, and sometimes we’re going to have to take educated risks with maybe not as much conviction or data to support the clinical programme, but enough of it.” While Mr Loncar believes that the recent surge in clinical trials is fundamentally a good thing for patients, he says the field should move at a speed that allows scientists to fully understand the reasons behind a particular success or failure. “When trials fail there’s not enough time or effort to look at the details to understand why things are not working,” he says. With five checkpoints on the market, the class of medicines is well-established, but many drugmakers are nonetheless developing their own versions, such as Novartis, Eli Lilly and Regeneron. In total, there are roughly 50 of these medicines, pejoratively known as “me too” products, in the pipeline. Some executives say the latecomers may find it increasingly difficult to fill their trials with “naive” patients who have not already been treated with a checkpoint. Many will have taken the drugs already, either because they have completed one of the hundreds of existing studies, or because their doctor has prescribed the medicine to them on an “off-label” basis, whereby they are given an immunotherapy to treat a cancer for which it is not approved.“The level of pre-treatment and controlling for that is something we want to be cognisant of, because we want to ensure we have a consistent set of baseline patients to evaluate,” says Vas Narasimhan, global head of drug development at Novartis. “And I would say that’s getting more complex.” Theoretically, it should not be difficult to recruit participants given that only 4 per cent of cancer patients end up on a trial in the US. But the pharma industry has struggled to widen the pool beyond highly educated people who live in urban centres. Patients can also be reluctant to enter a randomised trial because they might end up in the control group that does not receive the drug, a fear that some companies have tried to assuage by allowing people to cross over into the treatment arm once their cancer worsens. Designing trials in this way can cloud the results significantly, however. Dr Roger Perlmutter, the top scientist at Merck, has little sympathy for laggard companies, arguing they should instead focus their efforts on unearthing new drugs or looking for biological clues that might predict which patients are most likely to respond. “It’s going to be difficult for those who are coming in late, but really that’s the way it should be,” he says. “The world doesn’t need any more [checkpoints]. We need other things. We should be finding a way to develop other medicines beyond these.” And some investors fear that the proliferation of checkpoints could end up commoditising one of the most promising drug classes in years. The rush to develop so many “me-too” drugs is best explained by the widely held belief that checkpoints will form the backbone of combination immunotherapies in the future. Those companies without their own in-house versions will have to strike deals with a rival company every time they discover a promising molecule that might be used in a cocktail, reducing their flexibility and wasting time in a highly competitive field. “We fully recognise there are others out there, but we decided to develop our own because we felt it was a necessary ingredient,” says Dr Israel Lowy, a vice-president at Regeneron. “We wanted the flexibility to trial it in combinations.” He adds: “There is a lot of room to improve if we do come up with the right combination. That’s the future. We are only at chapter one in the book of immunotherapy.” There is a huge excitement about the promise of experimental combination immunotherapies, which contain two or more medicines designed to encourage the immune system to attack cancer. Several companies unveiled encouraging early data on such cocktails last month at the annual meeting of the American Society of Clinical Oncology, the world’s largest gathering of cancer experts. Merck presented favourable results from a small trial combining its immunotherapy, Keytruda, with a drug made by biotech group Incyte: 35 per cent of patients with a certain type of lung cancer responded when given both drugs, about double the rate that doctors would expect if they were taking Keytruda alone. And Bristol-Myers unveiled early data that suggested a new cocktail containing a medicine known as “Lag 3” could help melanoma patients who have already tried an immunotherapy but failed to respond. However, with the price of a single immunotherapy already running at $150,000 per patient each year, many fear that cash-strapped healthcare systems will be unable to bear the cost of treatment regimens that combine two or more drugs. “The individual drugs are very expensive and the system won’t bear adding one on top of another,” says Brad Loncar, founder of an exchange-traded fund focused on immunotherapy. “The combo itself will have to be marketed as a single thing,” he adds, predicting that drugmakers will offer significant discounts for patients who end up taking a cocktail containing several medicines. Mr Loncar predicts that such cost pressures will lead to further consolidation in the immunotherapy field, as companies try to ensure they own all the ingredients in a cocktail so that they can set the price. “The only way to offer these discounts is if you own every component of the combination yourself,” he adds.
