;Ticker;Nombre_Completo;Date_Time;Titular;Subtitular;Texto
9;REGN;Regeneron Pharmaceuticals;2020-04-17T03:30:43Z;Coronavirus creates new priorities for consultants;Deals have dried up in emerging markets. Now the focus is on helping businesses survive the pandemic;Suddenly the music has stopped for dealmakers. Mergers and acquisitions, mainstays of consultancy work, are no more resistant to coronavirus than the rest of the global economy.But the decline in transactions has led businesses to focus their attention elsewhere — in particular, on how to survive and potentially thrive once the recovery comes.Worldwide volumes of M&A activity were down nearly a third in the first three months of the year compared with the same period in 2019, according to Refinitiv, the financial data provider. Asia Pacific experienced a 17 per cent drop.Emerging markets are now growing at their slowest pace since records began and experts predict flat growth at best and declines in gross domestic product in some cases. Rating agency Fitch has forecast anaemic GDP growth of 0.8 per cent for Turkey this year, while it expects South Africa’s GDP to fall by 3.8 per cent and Russia’s by 1.4 per cent.According to Fiona Czerniawska, co-founder of Source Global Research, which advises the professional services industry, the sudden fall in deals is not the prelude to a V-shaped recovery, where the economy suffers a sharp drop followed by an acute rise, but rather to a U-shaped upturn, in which activity picks up more gradually.In part that is because of the constraints imposed by social-distancing measures. “It is much harder to build trust remotely,” says Ms Czerniawska. “In a lockdown it becomes much harder to go beyond the people that you know already. Consultants need to demonstrate that they don’t just bring advice but that they have been involved in developing results in the past.”A downturn presents not only complex scenarios for companies but also opportunities for consultants in emerging markets to help them through the dark times, says Mehmet Sami, founding partner of Pretium Advisory in Istanbul.“[The drop in economic activity] leads to a polarisation in the corporate world,” Mr Sami adds. “The difference between stressed companies and resilient players will be bigger.”So what should consultants in emerging markets be advising companies to do if they are to weather the coronavirus storm?Tim Mahapatra is a London-based managing director at consultancy firm Alvarez & Marsal. He says companies are in survival mode and should be looking at ways of preserving as much cash as possible.“All the conversations with clients right now are about cash optimisation,” he says. “[The pandemic] is changing the mindset for the immediate period of the lockdown.”He says some of the key concerns business leaders face now include questions such as: “What do you do when your revenues stop but you still have to pay your suppliers? How do you take advantage of the range of support that governments are offering? How do you interact with the banks?”Mr Sami agrees that “cash control is going to be paramount” for businesses in emerging economies. He says it will be crucial for companies to make sure they have solid and easy-to-tap sources of credit.“If you don’t have a [credit] line in a bank, you’ll clearly have difficulties. But if you don’t, is a financial institution able to help?” he asks. “The banks could also be under stress as well in emerging markets because the global flows are slowing down. If banks are cautious, will they be able to provide facilities to corporates?”Companies — alongside consultants — need to start modelling various financial scenarios. Their survival may depend on their ability to respond swiftly to a wide range of possible outcomes.There are plenty of unknowns that business leaders need to be thinking about now, says Mr Sami.“What happens if the lockdown continues for the second quarter of this year?” he asks. “When do people think things will gradually improve? You need scenarios to make decisions and stress tests.”The pandemic’s global impact will be shaped, he argues, by the response of regulators and by the “behaviour” of the virus. “While the latter’s impact is unknown, the former creates [a] worldwide regulated supply shock, which results in demand shock,” he says. “In response, corporate leadership — especially boards — have enormous responsibilities and need to exhibit duty of care.”A key task is to set up robust board committees that can work through operational and financial scenarios to protect the business and satisfy regulators. Ultimately, Mr Sami thinks the health crisis will accelerate the “onboarding” of independent directors and consultants who can contribute their knowhow.Businesses need to start implementing “tracking policies” to make sure that manufacturing continues and that it is not hugely disrupted if — or when — coronavirus enters the workforce.“You have to have a good contact tracing system,” says Mr Sami. “If someone gets [coronavirus], make sure you isolate certain goods and people. You do need a lot of workforce protection, especially on the manufacturing side of things, with committees reporting on a regular basis.”The veteran consultant adds that monitoring supply chains is crucial in emerging markets such as Turkey. Where critical supply parts or raw materials are at risk, managers need to find alternative sources and new suppliers. Logistical analysis will help with developing flexible solutions.“This is the time when the effectiveness of the boards will be really questioned.”Whatever the priorities of businesses right now, executives must ensure they keep an eye on the future too, says Alvarez & Marsal’s Mr Mahapatra.Companies will see different types of restructuring depending on the sector — anything from going into administration to mere discussions about sources of credit to get through the rough patch, he says.But it is important to see beyond the immediate crisis. “What will the business look like in 12 months’ time?” he asks. “How do you maximise your chances of survival?”While survival strategies vary hugely, he says, “there are some common considerations”.One is the pivot to cash. Another is the need to secure supply chains in readiness for the rebound. “This includes accelerating payment to key suppliers to ensure they can respond and supporting smaller suppliers to make sure they can survive the next few months,” Mr Mahapatra says.“Prior to the lockdown being lifted, companies will need to ensure availability of labour, liaise with customers and suppliers, and organise inventory to prepare for an uptick in demand. For some, Covid-19 will have a long-term business impact, meaning they need to start repositioning their brands and deliver operational changes now.”With such measures in place, a rapid restart should be achievable. But he warns: “Many companies will emerge from the crisis with higher debt to repay or lower reserves. This will cause them to reprioritise their investment plans, potentially acting as a lag on recovery in the year ahead.”
10;REGN;Regeneron Pharmaceuticals;2017-01-12T16:56:01Z;Sanofi confident it can overturn Praluent patent ruling;French drugmaker faces questions over how to offset declining Lantus revenues;Under pressure to deliver a new blockbuster medicine, Sanofi, France’s biggest drugmaker, bet big on a new class of cholesterol-lowering products with its Praluent treatment.Last week it was dealt a harsh blow after the drug was ordered off US shelves in a patent dispute with rival Amgen. Now Olivier Brandicourt, Sanofi’s chief executive, is facing questions over how he can plug the revenue gap left by the sure and steady decline in sales of its best-selling insulin medicine, Lantus.Mr Brandicourt is confident that the injunction announced last week can be overturned. He also argues it is in the “public interest” that Praluent remains on the market and questions Amgen’s approach to the litigation given the risk of uncertainty for the 18,000 US patients taking the drug.District Judge Sue Robinson ruled that Sanofi and Regeneron, which helped develop Praluent, were infringing patents held by Amgen, which makes a competing drug, Repatha. Sanofi and its US partner were given 30 days to stop selling Praluent in the US, although this was extended to 45 days in a hearing this week.Both drugmakers are appealing against the decision and Mr Brandicourt says they have a “fair chance of winning”.“The judge herself may not have given the full scope of what we wanted to bring to the party and to the jury members, and in our defence I feel we have been a little short changed,” Mr Brandicourt told the Financial Times at the JPMorgan healthcare conference in San Francisco this week.In a market where US president-elect Donald Trump has said pharmaceutical companies are “getting away with murder” over pricing, Mr Brandicourt will find it even harder to make up lost revenue if Sanofi and Regeneron lose their appeal.Analysts at Bernstein had expected Praluent revenues to reach $2.3bn by 2025, making it Sanofi’s biggest medicine by sales.Mr Brandicourt says that withdrawing Praluent from the US is akin to having allowed a single statin to have a monopoly when the drugs were first used in the 1980s, as he says Amgen’s Repatha will be the only drug of its class available in the US.The market for PCSK9 inhibitors could be worth up to $6bn a year at peak, according to analysts. The medicines block a type of protein that reduces the liver’s ability to release LDL or “bad” cholesterol, which is identified as a major cause of heart disease.While it is estimated that as many as a third of US adults take statins, roughly a fifth do not respond well to the treatment and continue to register high levels of cholesterol.Insurers in the US have been reluctant to pay for PCSK9 inhibitors since their launch in 2015, after balking at a price tag as high as $14,000 a year versus a few cents a day for statins.Analysts say, however, that insurers will have to drastically expand access to the medicines if soon-to-be-published research shows they reduce heart attacks and strokes, rather than simply lower cholesterol.Amgen executives told investors in San Francisco this week that about three-quarters of prescriptions for its Repatha were being rejected by insurers and pharmacy benefit managers. The company says it will net about $250m of sales from Repatha in 2016, but the drug would have generated $1bn in revenues if all prescriptions were authorised.Without the potential windfall from Praluent, Mr Brandicourt could struggle to offset declining revenues from Lantus, which had sales of more than $6bn in 2015, and which is being is being challenged by a cheaper “biosimilar” alternative made by Eli Lilly.However, Lantus is a biologic drug harvested from living cells — meaning it is not possible for a generic manufacturer to produce a carbon copy as they can with a pill — so rivals must instead produce a “biosimilar” version that has the same effect. But being relatively new, biosimilars are being used with caution, resulting in a less rapid switch from branded medicines.Mr Brandicourt says Lantus is not facing a “patent cliff”, but rather a long and gradual decline that he describes as a “patent hill”. Goldman Sachs estimates sales will fall to roughly $2.9bn a year in 2020.
11;REGN;Regeneron Pharmaceuticals;2017-01-06T16:47:37Z;Regeneron shares tumble as US court blocks cholesterol drug;Judge says Praluent infringes on patents held by Amgen covering rival treatment;Investors wiped more than $2bn from the market value of Regeneron, the New York-based biotech group, after a court took the highly unusual step of permanently blocking the company from selling its cholesterol-lowering medicine in the US.Regeneron and its commercial partner Sanofi, the French pharmaceuticals group, were ordered to pull their medicine, Praluent, from the market within 30 days by a US district judge, who ruled the drugmakers were infringing on patents held by Amgen.Patent disputes are common in the pharmaceuticals industry, but analysts said it was virtually unprecedented for a court to block sales of an existing medicine that was already being prescribed to thousands of patients a week.Analysts have touted the new cholesterol-lowering drugs, known as PCSK9 inhibitors, as an alternative to the statins taken by millions of people to prevent heart attacks and strokes, which would make them one of the most lucrative classes of medicines in years.Sales of the drugs have been sluggish since they were launched at the end of 2015, as healthcare systems and insurers have balked at the pricetag — $14,000 a year versus just a few cents a day for generic statins.But analysts expect US sales of the cholesterol-lowering drugs to surge to about $6bn a year if soon-to-be-published clinical trials show they can reduce the chances of patients suffering a deadly cardiovascular event.Shares in Regeneron fell 6.5 per cent in early trading in New York, while Sanofi’s Paris-listed stock was down 2.7 per cent. Amgen, which makes the only rival drug, Repatha, gained 3 per cent.Sanofi and Regeneron have 30 days to appeal against the verdict or to come to some kind of commercial arrangement with Amgen, which would most likely involve paying a royalty to their rival.However, a statement from Amgen suggested the company was unwilling to do a deal with the competing drugmakers. “Protecting intellectual property is essential to our industry as it reinforces the incentives for the large and risky investments we make,” said Robert Bradway, Amgen’s chief executive.Amgen said it had the “ability to supply” everyone being prescribed Praluent and that it would “work to ensure a smooth transition for patients who wish to switch”.Regeneron said it would “immediately appeal” against the decision and said the “best interests of patients will be greatly disserved” by the ruling.Amgen now has a monopoly in the US market. The California-based biotech company has a reputation for fiercely protecting its intellectual property and is disparagingly known as a “law firm with fermenters attached” for what some rivals see as a strategy of putting patent disputes before its core business of making drugs.The decision surprised analysts, who were divided on whether Regeneron and Sanofi’s drug will be permanently banned in the US.“Regeneron may appeal or negotiate with Amgen in the meantime, though we think neither are likely to be successful,” said Jeffrey Holford, an analyst at Jefferies.However, Geoff Meacham of Barclays said: “We continue to maintain that this case is far from over and will probably take a few years to play out in appeals.”Ronny Gal, analyst at Bernstein, said: “We have been asked by investors if Amgen would ‘dare’ to force Praluent off the market — we think they certainly would.”Praluent and Repatha block a protein known as PCSK9, which reduces the liver’s ability to release the LDL or “bad” cholesterol that is identified as a major cause of heart disease.PCSK9 inhibitors are not intended to fully replace statins, the main defence against heart disease since the 1990s, but there is a sizeable number of patients who find statins intolerable or who need additional cholesterol reduction.
12;REGN;Regeneron Pharmaceuticals;2017-01-05T22:22:52Z;Amgen blocks competitors from selling rival cholesterol drug;;Amgen won a court ruling that blocks its competitors from selling a rival to its new cholesterol-lowering medicine, sending shares in the large biotech group up by 4.66 per cent in after-hours trading.A US district judge in Delaware ordered Sanofi, the French drugmaker, and Regeneron, the New York biotech, to stop selling their drug Praluent because it infringes on patents protecting Amgen’s medicine, Repatha.Shares in Regeneron, which discovered the drug, were halted, while American depository receipts of Sanofi, the biotech group’s commercial partner, were down 3.98 per cent.Sales of Praluent and Repatha have been sluggish since they were launched in 2015 and 2016, respectively, although analysts predict they will surge in future years if they are proven to reduce heart attacks and other “cardiovascular events” in soon-to-be-published studies.The so-called PCSK9 inhibitors reduce the liver’s ability to release the LDL or “bad” cholesterol that is identified as a major cause of heart disease, and have been touted as an alternative to statins.However, US insurers have resisted paying for the drugs without proof that they actually reduce heart attacks and strokes, rather than just lowering cholesterol.The drugs have a list price of $14,000 per year compared to just a few cents per day for generic statins.
13;REGN;Regeneron Pharmaceuticals;2016-10-17T14:50:33Z;Regeneron, Teva in retreat after drug setback;;Shares of Regeneron Pharmaceuticals and Teva Pharmecuticals were stung Monday morning by news of a clinical trial setback for a new pain drug they are co-developing.Regeneron saw its shares dip by about 1 per cent after announcing that US regulators had put on hold a clinical trial involving an experimental treatment for chronic low back pain due to safety concerns. The drop shaved off about $350m off the stock’s market valuation. Teva, which is collaborating on the drug, also saw its US-listed shares off by about 1 per cent on Monday.The US Food and Drug Administration had ordered the hold and told Regeneron and Teva to amend the study protocol after observing a case of adjudicated arthropathy – a type of joint disease – in one patient who had osteoarthritis. As a result, Regeneron said it had stopped dosing study patients and was working to design a new study phase that excludes patients with osteoarthritis.The drug, fasinumab, aims to offer treatment for millions of Americans who suffers from chronic low back pain and osteoarthritis without the use of highly addictive opioids, by targeting proteins that grow nerve cells. Rivals Eli Lilly and Pfizer are racing to develop a similar drug, tanezumab, which aims to treat osteoarthritis, back pain and cancer pain, which they aim to submit for approval by 2018.Regeneron chief scientist officer George Yancopoulos said in a statement that the company was making “data-driven decisions” for the next study phase that the company hopes “will maximize the potential benefit for patients in need, while minimizing the likelihood of side effects.”Regeneron has seen its share price soar 512 per cent over the past five years, thanks in part to blockbuster sales for Eylea, which treats a degenerative eye disease and saw US sales reach $2.6bn last year, an increase of 54 per cent from the year before. Its shares were trading at about $367.17 on Monday morning, their lowest point since August.
14;REGN;Regeneron Pharmaceuticals;2016-08-22T20:56:26Z;Marathon Oil slips on broad sector fall;US stocks make little progress at start of the week;Marathon Oil led a broad decline in the oil sector’s stocks as crude prices fell back after a bumper seven-session rally.West Texas Intermediate, the US benchmark, fell 3 per cent to $47.05 on Monday, ending a rally that saw its price rise more than 20 per cent since August 2.Last week’s rise came off the back of hopes that Opec and other big oil producers might finally be looking at a long-discussed output freeze. Positive data and bets by hedge funds that the oil price would rise also helped to send prices higher.But Monday’s pullback led to a broad decline in oil company stock prices.Marathon, the Houston-based exploration and production company, led the pack, falling 6.9 per cent to $15.64 amid the additional investor pressure triggered by managerial changes.JR Sult, the company’s chief financial officer, left the company on Monday, citing personal reasons. Pat Wagner, vice-president of corporate development and strategy, has been named interim chief financial officer.Marathon, also the worst-performing stock in the S&P 500 index on Monday, has struggled due to the prolonged drop in oil prices.It reported its sixth straight quarterly loss this month, cutting its production outlook for the year. It has curtailed spending and sold off more than $1bn in assets.It said its revenue fell below $1bn in May for the first time since it became a standalone company in 2002.Other oil stocks also struggled. Murphy Oil was down 3.3 per cent to $29.07, Noble Energy fell 1.5 per cent to $35.57 and Southwestern Energy declined 1.8 per cent to $13.47.At the other end of the spectrum, pharmaceutical companies saw early gains after Pfizer reached a deal worth $14bn to acquire California biotechnology company Medivation.Pfizer, the world’s second-largest drugmaker, saw its stock tick up by 0.2 per cent before giving up ground and closing 0.4 per cent lower at $34.84. Medivation, not in the S&P 500 index, soared higher, up 19.7 per cent to $80.42.The top three performers in the S&P 500 index were pharmaceutical companies.Regeneron rose 3.6 per cent to $418.65, Vertex Pharmaceuticals gained 3 per cent to $100.96 and Alexion Pharmaceuticals climbing 3.3 per cent to $136.53.Elsewhere, clothing brand Urban Outfitters saw its stock fall 3.2 per cent to $36.61 as Goldman Sachs downgraded it from buy to neutral. The bank suggested it was at “near peak” operating performance, leaving less room for meaningful improvement.The S&P 500 was relatively unchanged at 2,182.6, the Dow Jones Industrial Average lost 0.1 per cent to 18,529.4, and the Nasdaq Composite ticked 0.1 per cent higher to 5,244.6.
15;REGN;Regeneron Pharmaceuticals;2020-04-24T23:51:20+0000;Wall Street enjoys best week since late-2015 as stocks rebound;Consumer groups, carmakers and transport sector make gains;US stocks enjoyed their best week since late-2015 as investors recovered from the shock of the UK’s vote to leave the EU and reacted to strong manufacturing data.The Standard & Poor’s 500 stock index was up 3.2 per cent for the week at the close in New York on Friday, a turnround from the previous week’s sharp fall. All of the yardstick’s 10 industry sectors were higher on the week.On Friday consumer stocks led the pack. Netflix, the video streaming service, gained 5.7 per cent to $96.67, Amazon rose 1.4 per cent to $725.68 and Best Buy climbed 2.5 per cent to $31.36.The automotive sector also gained after carmakers reported a solid month of sales. Ford Motor added 1.2 per cent to $12.72 and General Motors rose 2.1 per cent to $28.89. BorgWarner, a car parts supplier, increased 2.6 per cent to $30.29, while AutoNation, a chain of dealerships, was up 1.8 per cent to $47.83.Harley-Davidson, the US motorcycle company, surged 19.8 per cent to $54.25 on an unconfirmed takeover rumour reported by The Fly, a financial website.Air transports also lifted off, with American Airlines up 3.6 per cent to $29.33, United Continental 0.8 per cent higher at $41.37 and Alaska Air Group up 0.8 per cent to $58.74. Cruise ship operator Carnival rose 1.5 per cent to $44.86.Industrial stocks found support in a robust reading from the Institute for Supply Management’s index of US manufacturing activity. Parker-Hannifin, an equipment supplier to mobile and aerospace industries, increased 1.2 per cent to $109.34.Materials stocks also climbed. Investors boosted Alcoa after the aluminium producer this week reiterated plans to break into a commodity business and a company producing specialised metal products, driving the shares up 3 per cent to $9.55. Albemarle, a chemicals company, rose 2.5 per cent to $81.32, while Mosaic, a potash fertiliser producer, gained 1.5 per cent to $26.57.The S&P 500 was up 0.2 per cent for the day to 2,102.9, nearing its all-time high of 2,134.72 reached in May 2015. The Dow Jones Industrial Average gained 0.1 per cent to 17,949.4, and the Nasdaq Composite was 0.4 per cent higher at 4,862.6.The higher index levels reflected the sharp turnround in sentiment among US equity investors after markets were shaken by the UK’s Brexit vote the previous week.Oil and natural gas producers were supported as hot summer weather forecasts suggested stronger air-conditioning demand, which feeds back to power plants that burn gas. Among the gainers in the sector were Chesapeake Energy, up 7.2 per cent to $4.59, and Southwestern Energy, up 3.4 per cent to $13.01.Healthcare stocks added to the market’s strength, helped by Regeneron Pharmaceuticals, up 0.4 per cent to $349.23, and Celgene, up 2.1 per cent to $100.70.On the losing side of the ledger, chipmaker Micron Technology dropped 9.2 per cent to $12.50 after reporting poor sales and cuts to its payroll.
