;Ticker;Nombre_Completo;Date_Time;Titular;Subtitular;Texto
56;WYNN;Wynn Resorts Ltd;2016-02-12T22:20:37Z;Wynn Resorts jumps on Las Vegas fortune;US stocks snap a five-day losing streak;Wynn Resorts shares popped on Friday after the casino operator reported better than expected fourth-quarter profit, boosted by its Las Vegas business.Shares in Wynn jumped 15.83 per cent to close at $69.14 after the company said net income slid to $104.8m or 86 cents a share in the three months ended in December, from $148.4m or $1.07 a share in the year ago period, but topped analysts’ expectations for earnings of 60 cents a share.Adjusting for one-time items, earnings of $1.03 a share eclipsed forecasts.Meanwhile, revenues declined 17 per cent to $946.9m, shy of analysts’ estimates.The decline was driven by a 27 per cent drop in net revenues in Macau, the company’s largest source of revenue. A 3.8 per cent gain in Las Vegas revenues helped offset the decline.Beijing’s crackdown on corruption and the economic slowdown in China has hurt Macau gaming revenues — which have declined for 20 consecutive months.But investors warmed to the stock as billionaire founder Steve Wynn noted that January in Macau “was our best month in a long time”.“While still too early to call an inflection point for Macau, in our view, management expressed a more positive outlook than on their most recent . . . earnings calls,” said Felicia Hendrix, an analyst at Barclays.“VIP trends may remain muted but increased visitation, retail spend and a strong start to Chinese new year is a positive for the mass market.”Wynn shares are down about 50 per cent since the start of 2015.Groupon shares advanced 29 per cent to $2.89 after the US coupon company reported better than expected fourth-quarter results.The Chicago-based company reported earnings of 4 cents a share excluding one-time items, ahead of expectations for break-even.Meanwhile, sales climbed 4 per cent to $917.2m, ahead of analysts’ forecasts for $845.9m. Sales in North America, the company’s biggest source of revenue, climbed 13 per cent.However, the company reported a net loss of $46.5m or 8 cents a share in the three months ended in December, compared with a profit of $8.8m or 1 cent a share in the year-ago period.Analysts had forecast a loss of 5 cents a share.JPMorgan Chase was among the top performers on the S&P 500 index after chief executive Jamie Dimon bought $26m of shares in the US bank in a sign of confidence amid a painful week for financial stocks. The shares climbed 8.33 per cent to $57.49.Investors also bid up other bank stocks. Bank of America rose 7.08 per cent to $11.95 while Citigroup advanced 7.32 per cent to $37.54.American International Group, meanwhile, jumped 4.91 per cent to $53.00 after activist investors Carl Icahn and John Paulson secured representation on the US insurer’s board of directors.Mr Icahn has been calling for AIG to break up but management has resisted in what has become a public spat.US stocks snapped a five-day losing streak as strong US retail sales, a rally in the banking sector and a rebound in oil increased investor appetite for risk.By the close, the S&P 500 had advanced 1.95 per cent to 1,864.41, the Dow Jones Industrial Average had climbed 2 per cent to 15,970.75 and the Nasdaq Composite had gained 1.66 per cent to 4,336.51.
57;WYNN;Wynn Resorts Ltd;2016-01-15T22:07:49Z;Wynn bucks the sell-off on Las Vegas win;US stocks sink following a sharp sell-off in China and more oil price falls;On a day when 96 per cent of companies on the S&P 500 were in the red, shares in Wynn Resorts were rallying after the gaming company reported preliminary fourth-quarter results that showed growth in Las Vegas and earnings in Macau that were modestly above consensus estimates.Shares in Las Vegas-based Wynn jumped more than 13 per cent to $58.36 by the close after the company said it expected revenues in a range of $387m to $395m, compared with $376.8m in the year-ago period. At the close they were flat at $51.50.Meanwhile, adjusted earnings before interest, taxes, depreciation and amortisation (ebitda) were expected to rise to between $123m and $131m, compared with $111.2m a year ago and ahead of forecasts.The company said revenues and earnings in Macau, the Chinese casino gambling centre, are estimated to decline from last year.A slowdown in the Chinese economy coupled with the nation’s crackdown on corruption has seen Macau’s gaming revenue decline for 19 consecutive months.Wynn said adjusted ebitda in Macau is expected to be in the range of $156m to $164m, down from $241.2m in the year-ago period. However, the high end of that range was above consensus estimates for $157m.“Given the high short interest in Wynn Resorts, this pre-release should lead to a sharp short covering rally, which recently has led to swings of 10 per cent or more,” said Harry Curtis, an analyst at Nomura.However, he said that investors should wait to “understand the sustainability of the strength in December in Macau” before jumping in.Shares in Wynn Resorts slumped more than 50 per cent last year.Walt Disney shares fell 5.26 per cent to $93.90 after analysts at Barclays downgraded the stock to “underweight” from “equal weight” and reduced their price target to $89 from $98.Analysts noted that despite boosts to the stock from the latest instalment in the Star Wars film franchise, there is a risk to earnings next year as its sports channel ESPN continues to lose subscribers even as sports programming costs climb.Disney shares have been hurt as viewers increasingly choose to “cut the cord” on their cable and network television subscriptions as competition from online streaming sites such as Netflix and Amazon rises.With Brent crude, the global oil marker, and West Texas Intermediate, the US oil benchmark, both falling below the $30-a-barrel mark, energy stocks took a hit.Marathon Oil was the biggest loser, falling 10.25 per cent to $8.14, shares in Chesapeake Energy declined 4.04 per cent to $3.56 while shares in Transocean dropped 6.45 per cent to $9.86.The S&P 500 energy sector was one of the worst performing sectors alongside information technology.The decline in technology shares was led by Intel, which slid 9.10 per cent to $29.76, after the company issued disappointing sales guidance for the current quarter and amid a broader sell-off in US equities.US markets were lower on Friday following a sharp sell-off in Chinese equities and oil prices that sapped confidence.By the close, the S&P 500 had declined about 2.1 per cent to 1,880.14, the Dow Jones Industrial Average had fallen around 2.3 per cent to 15,985.96 and the Nasdaq Composite was off 2.74 per cent to 4,488.02.mamta.badkar@ft.comTwitter: @mamtabadkar
58;WYNN;Wynn Resorts Ltd;2016-01-07T17:59:10Z;Yahoo leads decliners exposed to China;Broad market losses led by financials, industrials, materials and technology;US companies with exposure to China took a beating on Thursday over rising economic and financial woes for the world’s second-biggest economy.Among the US stocks that declined was Yahoo, which holds a large stake in Alibaba, the Chinese ecommerce heavyweight.The US media and technology company’s shares skidded 6 per cent to $30.16, extending a 12-month decline to 26.5 per cent. Alibaba’s shares dropped 5.9 per cent to $72.77.Several casino companies that have large operations in Macau fell sharply amid fears that a cooling Chinese economy and a corruption crackdown by Beijing will keep gamblers away.Wynn Resorts, which generated 58.7 per cent of its revenue from Macau in the third quarter, sold off by 9.4 per cent to $60.19. Las Vegas Sands dropped 9.1 per cent to $39.79.Also in the red on Thursday were so-called cyclical stocks, which tend to be sensitive to economic fluctuations. Caterpillar, the world’s biggest maker of heavy machinery, dropped 3.4 per cent to $63.94, a steeper fall than US markets more broadly.Metals miners suffered as the price of copper, a key industrial commodity, slumped 1.6 per cent, touching the lowest level since 2009. Freeport-McMoRan, a large copper miner, slid 9.2 per cent to $5.61.Elsewhere KB Home shares fell 14.8 per cent to $10.05 after the homebuilder reported disappointing fourth-quarter results.The Los Angeles-based company reported profits of $44.1m, or 43 cents a share, on sales of $985.8m. This was short of Wall Street estimates for earnings of 50 cents a share, on sales of $1.1bn.KB Home delivered 2,580 homes last quarter, up 16 per cent from a year ago, but chief executive Jeff Mezger said inclement weather and labour shortages in some markets had “tempered” deliveries and “ultimately impacted our profitability for the quarter”.Homebuilders came under pressure after the disappointing results and amid a broader market sell-off. DR Horton fell 4 per cent to $28.53, Lennar slid 4 per cent to $43.43, and PulteGroup dropped 4 per cent to $16.22.Meanwhile Walgreens Boots Alliance said its net earnings in the quarter to November 30 had been 30.5 per cent higher than in the same period in 2014. Adjusted earnings per share clocked in at $1.03, handily topping Wall Street estimates of 96 cents.Shares of the pharmacy chain rallied 2 per cent to $81.17, adding to a 12-month rise of 7 per cent.Investors bid up shares of JC Penney. The department store chain said same-store sales had risen 3.9 per cent during the holiday shopping period as unseasonably warm weather weighed on other retailers, such as competitor Macy’s.JC Penney’s shares advanced 3.6 per cent to $7.26.On Thursday the S&P 500 fell 2.4 per cent to 1,943.09, the Dow Jones Industrial Average shed 2.3 per cent to 16,514.10, and the Nasdaq Composite lost own 3 per cent to 4,689.43.
59;WYNN;Wynn Resorts Ltd;2016-01-04T22:19:54Z;Netflix falls amid US subscriber worries;Downbeat sentiment on China prompts broad sell-off in equities;Netflix was the biggest decliner on the S&P 500 on the first trading day of the year following an analyst downgrade and amid a broader sell-off in US equities.Shares in the online streaming site fell more than 6 per cent to $107.19 after the stock was lowered to “neutral” from “outperform” and the price target cut to $115 from $128 by analysts at Baird. They closed down 3.86 per cent at $109.96.The analysts said their quarterly US subscriber survey suggested “potentially weaker US subscriber results for the second consecutive quarter” compared with a normal quarterly increase into the holiday period.The survey showed 46 per cent of its 3,000 US respondents were Netflix streaming subscribers compared with 47 per cent the previous quarter.“This appears to point to more flattish Q4’15 US subscriber progress and, if accurate, potentially raises some questions around the US subscriber growth trajectory,” said William Power, an analyst with the firm.A $1 price increase, which took effect in October, could have had a greater impact on subscription growth than previously thought, he said.Moreover, Mr Power noted that Netflix’s international subscriber growth could beat forecasts but that the expectation was largely priced in. Netflix shares advanced more than 130 per cent last year.Shares in Tesla were also on the back foot after the electric carmaker reported fourth-quarter total vehicle deliveries at the low end of its guidance range.Its shares fell 6.92 per cent to $223.41 after the Palo Alto-based company said it delivered 17,400 cars in the last quarter, in a filing with the Securities and Exchange Commission on Sunday. This compared with its previous outlook for 17,000 to 19,000 deliveries.The company also said it delivered just 208 of its Model X sport utility vehicle, which launched with a two-year delay in September. Tesla noted that it was prioritising “quality above all else”.The fourth-quarter figures brought its 2015 deliveries to 50,580, the low end of its guidance. However, analysts noted that the automaker had lowered its outlook through the year.Chinese equities plunged on Monday amid concerns about the health of its economy, prompting Beijing to use its circuit breaker rule. That set the tone for global markets. .US-listed shares in Chinese companies were punished, with shares in ecommerce site Alibaba down 5.64 per cent to $76.69.Shares in Baidu, a search engine group, fell 2.65 per cent to $184.03 while shares in Cheetah Mobile fell 2.87 per cent to $15.56.The sell-off in Chinese stocks also weighed on shares of Macau casino operators, though their shares had recovered most of their losses by the close. Wynn Resorts was down 0.61 per cent at $68.77, Las Vegas Sands was down 1 per cent to $43.40, and Melco Crown Entertainment was off 0.77 per cent to $16.67.All 10 big sectors on the benchmark S&P 500 were in the red. The S&P 500 was down 1.53 per cent to 2,012.66, the Dow Jones Industrial Average was 1.58 per cent lower at 17,148.94 and the Nasdaq Composite was off by 2.08 per cent to 4,903.09.mamta.badkar@ft.comTwitter: @mamtabadkar
60;WYNN;Wynn Resorts Ltd;2016-01-03T14:54:15Z;Week ahead: Corporate review US;Amazon revenues set to be a fifth higher than last year’s record, with focus on cloud unit;By almost any measure 2015 was a bumper year for Amazon, the online retailer.The share price has more than doubled and analysts expect this year’s revenues to be a fifth higher than 2015’s record, even in the face of a strong dollar.Soaring retail sales are not the only reason for the Seattle-based group’s success. A subtle but equally important shift has been the decision to break out its cloud computing business as a separate unit in financial results.When the tight-lipped company lifted the veil on Amazon Web Services in April, analysts were surprised by its margins. It has been the group’s most profitable segment this year by operating income.Many in the finance community are salivating over the idea that AWS could become a separate listed entity, given its profits and its fast growth.But a closer look shows that its apparent profitability stems largely from its decision to lease, rather than buy, much of its equipment. Depreciation expenses are set to soar, and the paper profits will be hard to maintain.Brian Pitz of Jefferies expects Amazon’s growth to continue this year, as its retail operations benefit from sizeable investments in warehouses and logistics.“They are taking share of new categories because of their ability to service customers faster than everyone else,” he said.“They’ve created such a moat, no one will be able to catch up.” Leslie HookThere is not a whole lot of loving going on at Whole Foods. Shares of the US supermarket, much of whose goods are labelled organic, dropped by a third in the year just ended, while the S&P 500 has risen 0.7 per cent.Several factors have served to upend Whole Foods. Amid growing concerns over its prices, there has been stiffer competition, particularly given that many mainstream supermarkets such as Kroger have built a strong offering of organic produce, while Walmart has also expanded in this area.According to Neil Saunders, an analyst at the Conlumino research group, other problems include the experience of shopping at a Whole Foods, which critics say in New York is not inviting.And with its focus on the high end — the store has been dubbed “Whole Paycheck” because of its high prices — Whole Foods may be paying too much attention to impressing with new stores instead of keeping existing ones up to scratch.“A combination of falling margins and slowing sales growth presents a long-term danger to profitability,” said Mr Saunders.“The whole purpose of reducing prices should be to attract and keep more customers, with a consequent uplift to the sales line. However, at present this dynamic is not working as effectively as it should.”For 2016 investors will be closely watching to see the extent to which Whole Foods can balance margins and customer traffic.Last month’s $1bn repurchase programme has not revived demand for the shares. Lindsay WhippEvery winning streak comes to an end. This year, after betting heavily on its business in Macau, Wynn Resorts’ luck ran out abruptly.In the nine months to September 2014, the gaming company earned more than $3bn in revenues from its casinos in Macau, compared with just $1.2bn from its business in Las Vegas.But last year, after the Chinese government made it clear that it was no longer acceptable for officials and executives to gamble in Macau, takings at casinos dropped 35 per cent.Revenues at Wynn’s Macau arm declined to $1.9bn in the year to September. Earnings before interest, tax, depreciation and amortisation were 46 per cent lower at $548m.Wynn has postponed the opening of a $4.1bn resort by three months and Steve Wynn, the casino mogul, has criticised Macau for what he calls its “preposterous” policy of limiting how many gambling tables he can have in the new joint.After the shares more than halved from $139 to $65, Mr Wynn bought a million shares. The move was meant to reassure investors after the dramatic price fall but had little effect.November was the 18th consecutive month of shrinking casino revenues in Macau, and casino operators are still doubling down: between them they have committed to almost $27bn in new developments.The plan is to make the switch, as Las Vegas has done, to a family-friendly entertainment hub. But it may be a long time before the transformation kicks in and lady luck shines on Wynn Resorts again. Malcolm MoorePerhaps more than any other company, Netflix has changed the way people watch television.The streaming service has produced its own programming and bought the rights to other producers’ shows and movies, making them available on demand for a set monthly price that is much lower than a standard subscription for cable or satellite services.Its impact, in the US in particular, has been profound. With Netflix and other companies offering on-demand viewing, many viewers are “cutting the cord”, shunning the pricey bundle of channels offered with a cable or satellite subscription in favour of cheaper online alternatives.Fear gripped the media sector this year as evidence grew that cord-cutting was hurting audience ratings and advertising revenues.Netflix was not affected: its shares rose more than 140 per cent over the year. With a market capitalisation of close to $50bn it is worth more than CBS and Viacom combined.Whether the group can sustain subscriber growth and deliver profits that justify its lofty valuation is another matter. Still, on-demand, digital-based viewing is the future of television and Netflix is well placed to benefit. Matthew GarrahanFor Chesapeake Energy last year provided a textbook case of the consequences for a highly leveraged company of steep falls in the price of its principal product.Chesapeake is the second-largest natural gas producer in the US, surpassed only by ExxonMobil, and the slump in US gas prices sent its shares down about 80 per cent.After the departure in 2013 of Aubrey McClendon, the risk-taking entrepreneur who built the company, Chesapeake seemed to be heading in the right direction.It stabilised its finances in October 2014 with a $5.4bn sale of some gasfields to Southwestern Energy at what was described as a “blowout” price.But borrowings built up during its period of rapid growth under Mr McClendon remained high, and net debt was about $10bn at the end of September.As the price of US benchmark Henry Hub gas dropped from more than $3 per million British thermal units at the end of 2014 to below $2 at the end of 2015, earnings were squeezed. Weaker prices for oil and natural gas liquid compounded the problem. Chesapeake reported an underlying net loss of $83m for the third quarter.The energy group has been cutting costs and capital spending to shore up its cash position, but Chesapeake’s future will be shaped by the prices of gas and oil. Ed Crooks
61;WYNN;Wynn Resorts Ltd;2015-10-16T10:29:21Z;Steve Wynn lashes out at ‘preposterous’ Macau regulations;US casino tycoon criticises table allocations as China graft crackdown dents revenues;US casino tycoon Steve Wynn has lashed out at Macau for its “preposterous” policy on the allocation of gambling tables, as China’s corruption crackdown and the slowing economy continue to weigh on gaming revenues in the territory.Mr Wynn was expressing his frustration with the government’s failure to indicate how many betting tables it would allow his company, Wynn Resorts, to operate when it opens its latest 1,700-room, $4.1bn casino early next year.Many of the high-rollers who fuelled the decade-long boom in Macau — the only part of China where casinos are legal — have stopped betting since President Xi Jinping started to clamp down on corruption and money laundering in 2013.Under pressure from the government, Macau’s casinos have been trying to follow the Las Vegas model and diversify into mass market gambling and tourism. But Mr Wynn said that the “rather mystical” way that the government allots table permits makes it difficult for operators to plan for this transition.“Will our property be overwhelming enough to kick that market into a different place?” he asked after the release of disappointing third-quarter results on Thursday. “It’s hard to say. I have no idea how many tables we’re going to have.”The billionaire chairman and chief executive of Wynn Resorts said it was “preposterous” that rival casino group Melco Crown had no idea how many tables it could operate just three weeks before its $2.5bn Studio City resort throws open its doors.“How in the world do we underwrite the job security of the local workforce in Macau, keep the promise of promotions and better opportunity under these circumstances?’ he added. “I’m at a loss to answer that question.”38%Drop in Wynn Resorts’ net revenues in Macau in the third quarter, compared with the same period a year earlierWynn Resorts’ net revenues in Macau fell 38 per cent in the third quarter, compared with the same period a year earlier, to $585m as VIP gaming turnover more than halved to $12bn.Adjusted earnings before interest, taxes, depreciation and amortisation halved to $163m compared with the third quarter of 2014, and undershot analysts’ consensus expectations of $176m.Morgan Stanley said Wynn could cut costs by moving as many as 2,000 of its existing staff to the new resort when it opens in March, but that the total number would depend on the government’s table allocations.Galaxy Entertainment, another Macau casino operator, also reported a significant drop in business during the third quarter, blaming the graft crackdown, China’s slowing economy, smoking restrictions and concerns about the liquidity of the middlemen known as junkets who provide credit to high-rollers.The company, chaired by Chinese billionaire Lui Che Woo, said revenue fell 29 per cent year on year to HK$12.3bn ($1.6bn) while adjusted earnings contracted 36 per cent to HK$2.1bn.Mr Lui said he was “cautiously optimistic that we are starting to see the market stabilise”.The Macau casino regulator had not responded to a request for comment.
