;Ticker;Nombre_Completo;Date_Time;Titular;Subtitular;Texto
94;WYNN;Wynn Resorts Ltd;2012-02-22T18:59:03Z;Wynn raises the stakes in Las Vegas;Tussle with Okada casts a poor light on Nevada’s corporate law;"There isn’t much moral high ground in Las Vegas and Steve Wynn failed to take it this week.Mr Wynn, who pioneered Vegas’s rise from tawdriness to a luxury family resort – and then extended his empire to Macau– spent the weekend not only accusing his former business partner of bribing foreign officials but seizing his $2.5bn stake in Wynn Resorts at a substantial discount. By the time Kazuo Okada woke up on Sunday, his equity had vanished.The Wynn-Okada tussle is an enthralling battle of wills between two hardened Vegas gamblers. It is also a sad reflection of the lack of investors’ rights in Nevada, which takes to deliberate extremes the US tendency to place the interests of corporate directors above those of their shareholders. The irony is that the 70-year-old Mr Wynn may yet be hoist by his own – and his adopted state’s – legal petard.Mr Okada, accused by Wynn Resorts of greasing palms to smooth the construction of a $2.3bn casino complex in Manila, remains a director of the company. Mr Wynn found it easy enough to dump him as a fellow shareholder but showing that he breached his duties as a director will be tougher, for which Mr Wynn is to blame.It is a shame that he muddied things in how he chose to strike against Mr Okada, a former slot machine operator with whom Mr Wynn partnered when plotting a return from the hostile takeover of his Mirage Resorts by Kirk Kerkorian in 2000. If he had been fairer, he could have enhanced his reputation.As it is, instead of looking like a crusader against corruption in Asian gambling – of which there is plenty – Mr Wynn comes across as a brutal infighter who neatly outwitted an inconvenient rival. His stake in Wynn Resorts increased, together with the share price, but his moral authority was diluted.Mr Okada has serious questions to answer. An internal investigation by Louis Freeh, the former director of the Federal Bureau of Investigation, alleged that he and his associates had made $110,000 in cash payments and gifts to foreign regulators. Mr Okada denies misconduct, describing the accusations as “outrageous”.The trouble is that Wynn Resorts’ board – on which Mr Wynn and his former wife Elaine sit – ruled on the matter itself. Rather than waiting for Nevada’s regulators to assess the allegations against Mr Okada, it took things into its own hands. It seized his stake at 31 per cent below the share price, offering to compensate him in cash (plus 2 per cent interest) a decade from now.The board says it had no choice but to act promptly given the seriousness of the allegations. If Mr Okada has breached the Foreign Corrupt Practices Act, which bars US corporations from paying bribes to gain business overseas, it would have been in danger of losing its licences. It also says the terms of the share repurchase were dictated by its articles of incorporation.Perhaps, but that’s because Mr Wynn devised them, as well as insisting on Mr Okada signing over his voting rights and barring him from selling his stake without Mr Wynn’s approval. When battle was joined, the board decided (with a rubber stamp from Moelis & Co, the investment bank) to discount this illiquid, non-voting block.In most places, it would rightly be illegal for a board to confiscate the property of a shareholder of whom it doesn’t approve in such a manner. But this is Nevada and these are the deeds of Wynn Resorts, drafted and signed by Mr Wynn in 2002.Having suffered one takeover, Mr Wynn did his best with his new company to minimise the chances of ever having his authority challenged again. As well as arrogating voting rights, he specified that its directors’ liability “shall be eliminated or limited to the fullest extent permitted” by Nevada law.That is very full indeed, since Nevada has one of the laxest corporate statutes in the US, heavily favouring directors’ rights over those of shareholders. Michal Barzuza, a law professor at Virginia University, describes the state as a “no-liability corporate safe haven”, which “allows officer and directors to avoid liabilities that are almost axiomatic in corporate law”.Nevada’s regime is no accident, since it set out to compete with Delaware, where most US companies incorporate, by being more laissez faire. Its biggest sop to directors is to absolve them of their duty of loyalty to the company, providing that they are not guilty of intentional misconduct or fraud and have not knowingly violated the law.It provides intriguing possibilities in this case, since Wynn Resorts itself says that Mr Okada failed to attend FCPA training or to sign the corporate code of conduct. It also claims that he told other directors that he saw nothing wrong in giving hospitality to regulators in Asia, where it was accepted practice. (The company reports that Mr Okada later denied saying this.)Even on the company’s version of events, Mr Okada could argue that he was not knowingly guilty of anything and thus did not breach his duties as a director in Nevada. Mr Wynn would then find it hard to push him off the board; since his voting stake has gone, it cannot be wielded against him.The Wynn affair casts a poor light on Nevada’s corporate law and the ability of a board – led by a powerful and well-connected Las Vegas mogul – to crush an awkward shareholder. It also tarnishes the US practice of encouraging states to “race to the bottom” in allowing companies to curb investors’ rights.A tussle over whether Mr Okada remains a director may be beside the point since his equity has been cashed. But it provides a chance for Nevada’s courts to show that they don’t just obey Mr Wynn."
95;WYNN;Wynn Resorts Ltd;2012-02-22T00:52:28Z;Okada raises the stakes in Wynn battle;;Kazuo Okada, the Japanese billionaire at the centre of a dispute with Wynn Resorts, is seeking a restraining order against its board to prevent it from redeeming his 20 per cent stake in the company, which operates casinos in Las Vegas and Macao.Wynn Resorts has filed a lawsuit against Mr Okada, a director and co-founder of the company, accusing him of “improper acts” and trying “to convert Wynn Resorts assets for his own benefit”. But people familiar with the situation said Mr Okada would respond with his own lawsuit.Universal Entertainment, the company he controls, said in a statement that Wynn’s actions were “motivated by self-interest and represent the results of an incomplete and otherwise flawed corporate governance process”.As the barbs between the two sides intensified, Bob Miller, the former governor of Nevada who now sits on the Wynn board, said during a press conference call that the company had concluded that Mr Okada was “unsuitable” and “posed an ongoing risk” to Wynn Resorts following an investigation into Mr Okada’s alleged attempts to develop a casino in the Philippines.Mr Miller said Wynn’s gaming licenses “would be put under a cloud” were it not to take action against Mr Okada. Mr Miller added that “it would potentially jeopardise not only our existing licenses, but clearly could be utilised as a sign or our unsuitability for prospective licenses in any other jurisdiction”.Wynn plans to redeem the Japanese tycoon’s stake at a steep discount over a decade, alleging in court papers that the former friend of Steve Wynn, its founder, made unauthorised payments to gaming regulators and violated the US Foreign Corrupt Practices Act.In a lawsuit, filed on Tuesday in district court in Nevada, Wynn alleged that Mr Okada pressed ahead with plans to create a casino in Manila Bay in the Philippines in spite of the company’s objections.“Many doors opened for Okada in the Philippines due to his well publicised relationship with … Wynn Resorts,” the company alleged in the filing.Mr Okada “touted his relationship with and affiliation” with the company “to convince others” that Wynn supported his plan.In the lawsuit, Wynn said that it commissioned an “independent investigation” of the gaming industry in the Philippines and decided against investing in the country. The company alleged that Mr Okada was “undeterred” and arranged for Mr Wynn to meet Benigno Aquino, the president of the Philippines, and was “embarrassed and angry” at having to cancel the arrangements.Mr Okada’s Tokyo-listed gaming group, fell by more than 20 per cent on Monday after news about the redemption of his stake in Wynn. The shares seemed to have hit a floor on Tuesday, falling 0.3 per cent.Mr Okada sued Wynn Resorts in Las Vegas last month, alleging that the company was blocking his efforts to gain access to its financial records after he questioned gifts made by the company to the university. That prompted the US Securities and Exchange Commission last week to open an inquiry into those donations.
96;WYNN;Wynn Resorts Ltd;2012-02-21T21:48:26Z;US stocks on brink of post-crisis high;;US stocks closed within two points of a post-financial crisis high, as a deal on bail-out funding for Greece lifted Wall Street.The S&P 500 closed up 0.1 per cent to 1,362.21. The benchmark index is now up 8.3 per cent in 2012, and having its best start to a year since 1997.However, much money remains parked on the sidelines, with US exchange-traded funds hit by their first net outflows in 2012 last week, according to Deutsche Bank, and more than $25bn redeemed from domestic equity mutual funds in 2012, according to UBS.“[A] pullback seems probable,” Tobias Levkovich, Citigroup’s chief US equity strategist, wrote in a note, in which he advised clients to halt buying in the absence of a correction.The Dow Jones Industrial Average topped 13,000 for the first time since May 2008 in the morning session, before paring back to 12,965.89. That represented a 0.1 per cent gain for the blue-chip heavy index, even as Walmart shares fell 3.9 per cent to $60.07.The world’s largest retailer by sales saw a steep fall in fourth-quarter earnings, as the company discounted heavily to drive sales growth in the US.Shares in Alcoa, the aluminium producer, gained 2.6 per cent to $10.41, after it announced a joint venture with China Power Investment Corporation to produce high-end fabricated aluminium products for the Chinese market.The transport sector of the Dow diverged further from the broad index, falling 1.5 per cent. According to “Dow theory”, a drop in the transport sector may presage a reversal in sentiment, as transport stocks are the first to feel the effects of a slowing economy.But Bill Carcache, a transport analyst at Nomura, shrugged off concerns about the rising oil price, with a bullish note on the freight container leasing space, citing “several better than expected market developments,” and forecasting 97 per cent utilisation rates for container companies.The tech-heavy Nasdaq Composite index fell 0.1 per cent to 2,948.57. Apple, which accounts for more than a 10th of the index’s market capitalisation, gained 2.5 per cent to $514.85, as it threatened legal action against ProView of Taiwan, in a long-running dispute over use of the iPad name in China.Although tech stocks make up 20 per cent of the S&P 500, and Apple shares have gained 25 per cent this year, Morgan Stanley analysts said the sector’s outperformance could continue.“Mega-cap technology stocks look extremely attractively valued against mega-cap stocks in other sectors,” Adam Parker, the investment bank’s chief US equity strategist, wrote in a note.Wynn Resorts climbed 6 per cent to $119.40 as investors responded enthusiastically to the board’s move to forcibly buy out the stake of Kazuo Okada, a Japanese billionaire, who is alleged to have made unauthorised payments to gambling regulators.While most of the share price move appeared to stem from hopes that the long-running boardroom feud may soon be over, Jon Oh at CLSA securities also said the terms of the forced buy-out were favourable to shareholders.Macy’s shares were up 1.2 per cent at $36.69, after fiscal fourth-quarter earnings for the department store chain climbed by 12 per cent.Bank investors appeared to take heart from the Greek bail-out deal, with Morgan Stanley up 0.5 per cent to $19.26 and Citigroup climbing 1.3 per cent to $33.36.Bank of America rose 1.1 per cent to $8.11, rallying again, after shares suffered their first weekly fall of 2012 last week.Shares in the CME Group, the largest US exchange group by market capitalisation, slipped 1.3 per cent to $290.08 as Alex Kramm at UBS removed the stock from his “top pick’s” list after a rally, which has seen shares gain more than 20 per cent by the end of last week.Gas exploration and production companies were hit as US natural gas futures fell on Tuesday, having reached February highs last week.Cabot Oil & Gas fell 1.7 per cent to $36.01, as a joint venture with Williams Partners to build a pipeline from the Marcellus Shale field in Pennsylvania to New York failed to generate enthusiasm.
97;WYNN;Wynn Resorts Ltd;2012-02-20T23:47:58Z;Universal Entertainment shares plummet;;Universal Entertainment, the Japanese gaming group, had more than Y32bn wiped off its stock market value as investors reacted to an acrimonious dispute between Kazuo Okada, its founder, and Steve Wynn, the Las Vegas-based gaming magnate.The two men, once firm friends – and fellow shareholders and directors of Wynn Resorts, which operates casinos in Las Vegas and Macau– have fallen out in spectacular style.According to a person close to the situation, the dispute is likely to intensify on Tuesday when Wynn Resorts is expected to file a lawsuit in Nevada District Court, Clark County, that details alleged breaches of fiduciary duty by Mr Okada and other “related offences”.Wynn Resorts has requested the resignation of Mr Okada from its board and redeemed his 20 per cent stake in the group at a 30 per cent discount to its trading price, alleging that he violated US anti-corruption laws by making unauthorised payments to gambling regulators.The company has issued a 10-year $1.9bn promissory note in redemption of the shares, which pays a two per cent annual interest rate. Mr Okada’s stake at the current trading price is worth $2.77bn.Mr Okada, who made his fortune on pachinko machines, hit back over the weekend, accusing Wynn Resorts of acting like “a Star Chamber and not like a board of a publicly traded company, protecting the interests of its stockholders”.“The decision by the Wynn Board, which followed a rushed investigation that lacks absolute findings, to redeem Universal Entertainment’s nearly 20 per cent holdings in Wynn Resorts based on its project in the Philippines is outrageous,” Universal Entertainment said.Wynn Resorts’ move was prompted by an internal investigation into Mr Okada allegedly detailing “numerous apparent violations of the US Foreign Corrupt Practices Act” by Azure USA, the parent company of Universal Entertainment.The company’s probe was led by Louis Freeh, a former director of the Federal Bureau of Investigation, and allegedly uncovered cash payments and gifts worth approximately $100,000 to “foreign gaming regulators”.Universal Entertainment said it had “not even been provided with the opportunity to review the Freeh Report,” adding it was “more evident than ever” that additional independent oversight was needed on the Wynn Resorts board.“Universal Entertainment will take all legal actions necessary to protect its investment and prevent a forced redemption of its shares,” it said.Mr Okada and Mr Wynn were once close: the upscale sushi restaurant at one of Mr Wynn’s Las Vegas properties was named after Mr Okada, in tribute to his then friend. Mr Wynn said in 2008 that he loved Mr Okada “as much as any man I’ve ever met in my life”.But simmering tensions exploded last month when Mr Okada filed a lawsuit in Clark County District Court, alleging that he had been prevented by Mr Wynn from seeing Wynn Resorts’s financial records. Mr Okada had objected to a $135m donation made by the company to a university in Macau.Universal Entertainment’s Jasdaq-listed shares closed 21 per cent lower at 1,516 yen on Monday, valuing the group at 121.6bn yen.
98;WYNN;Wynn Resorts Ltd;2012-02-20T19:49:25Z;Wynn Resorts: Chinese roulette?;A row between the founders of the casino group is dwarfed by fears over China;This isn’t baccarat. It’s mud-wrestling. Steve Wynn, chairman of Wynn Resorts, and Kazuo Okada, boss of Universal Entertainment, were once friends. They have made piles of money together opening casinos in Las Vegas and Macao. Mr Okada owns (or perhaps owned) a fifth of Wynn Resorts shares. But because of a disagreement over Mr Okada’s plans to build a gambling resort in the Philippines, thereby becoming a regional competitor, accusations of misconduct are flying back and forth. The Wynn Resorts board has voted to redeem Mr Okada’s stake at 30 per cent below the current share price, over a 10-year period.If Mr Okada can be forced to accept these terms, Wynn Resorts shareholders will be delighted. They become the beneficiaries of a very cheap share buy-back. But there will be a long legal wrangle, or a pricier settlement, before the last mud is slung. Wynn’s management has, at least, successfully set the terms of the dispute. The fight is, for now, about whether Mr Okada must accept a discount, not whether he can demand a premium. Well played.But should the conflict make smaller investors in Wynn Resorts nervous? If the prospect of bare knuckled business practices makes any of them jumpy, it is curious that they put their money to work in the casino industry. And if they are inclined to think about risks, they should think about business fundamentals first.Wynn is a very well-run company that has outperformed rivals Las Vegas Sands and MGM by 80 per cent and 120 per cent respectively over five years. But it is a concentrated play on China, which was the source of almost four-fifths of profit in the last quarter. That dependence will rise as it has another mega-hotel planned in Macao. A Chinese slowdown will turn the fuss over Mr Okada into a distant – even pleasant – memory.Email the Lex team in confidence at lex@ft.com
99;WYNN;Wynn Resorts Ltd;2012-02-20T09:16:27Z;Wynn Resorts seeks founder’s resignation;;Wynn Resorts has requested the resignation of Kazuo Okada from its board and redeemed his stake in the company, bringing to a head the long-simmering dispute between Mr Okada and Steve Wynn, his co-founder at the hotel and casino operator.Wynn Resorts’ move follows an internal investigation alleged to have revealed payments from Mr Okada to foreign gaming regulators in apparent violation of US anti-corruption laws.Led by Louis Freeh, a former Federal Bureau of Investigation director, the inquiry found that Mr Okada and his associates had apparently violated US anti-corruption laws over three years, including giving cash payments and gifts totalling $110,000 to overseas regulators. Based on the report, the Wynn board deemed Mr Okada “unsuitable”.Mr Okada was Wynn Resorts’ largest shareholder through Aruze USA, the American unit of Universal Entertainment, the Japanese gaming group in which he owns a majority stake. His 20 per cent stake in Wynn was worth about $2.77bn.But on Saturday, Wynn Resorts unilaterally redeemed the 24m shares held by Aruze, citing provisions in the company’s articles of incorporation that concern a finding of “unsuitability”. Wynn will pay Mr Okada $1.9bn for the shares in 10 years, representing a 30 per cent discount to their market value. The final payment may be more, as the promissory note for the redemption bears an annual interest rate of 2 per cent.Shares of Wynn Macau, the Hong Kong-listed subsidiary, rose 3 per cent on Monday. Analysts said that stock in the casino group would be worth a lot more if the buy-back were to go ahead, although it was unlikely that Mr Okada would accept the board’s decision without a fight.Universal Entertainment shares fell 21 per cent on Monday in Tokyo. The company issued a statement late on Sunday saying it had not had a chance to review the Freeh report but calling the redemption of Mr Okada’s shares “outrageous”.“Universal Entertainment will take all legal actions necessary to protect its investment and prevent a forced redemption of its shares,” it said.The action is the most dramatic development yet in a dispute between Mr Okada and Mr Wynn, his long-time business partner. The rift is tied to Mr Wynn’s 2010 divorce from his wife, Elaine, which left him with about 9 per cent of the company bearing his name, while Mr Okada had more than twice that.Since then, Mr Okada has pursued his own plans through Universal Entertainment to develop a casino in the Philippines, putting the group in competition with Wynn Resorts.Mr Okada sued Wynn Resorts in Las Vegas last month, claiming that the company was blocking him from accessing its financial records after he questioned gifts made by the company to a university in Macao. That prompted the Securities and Exchange Commission last week to open an inquiry into those donations.Mr Freeh’s report was the culmination of a year-long investigation and found that Mr Okada had apparently violated the US Foreign Corrupt Practices Act by making payments to two chief gaming regulators at the Philippine Amusement and Gaming Corporation, which oversees Mr Okada’s licence to operate in that country. Sources close to the situation said that Mr Freeh concluded his investigation after interviewing Mr Okada last week.Robert Miller, a former Nevada governor and chairman of Wynn Resorts’ compliance committee, said the board was “deeply disturbed by the behaviour of Mr Okada”.Wynn Resorts said it would also recommend that Mr Okada be removed from the board of Wynn Macau, its Hong Kong-listed subsidiary. It also said it had filed a lawsuit against Mr Okada and Universal Entertainment for “breach of fiduciary duty and related offences”.Mr Okada could not be reached for comment.Additional reporting by Enid Tsui in Hong Kong
