;Ticker;Nombre_Completo;Date_Time;Titular;Subtitular;Texto
137;WYNN;Wynn Resorts Ltd;2009-10-19T16:45:29Z;Billionaire paid price to revive Sands’ fortunes;;Deep in the heart of the Venetian casino in Las Vegas, past the whirring slot machines, the canals and singing gondoliers, Sheldon Adelson is plotting the next phase of his company’s expansion.Poring over plans for Marina Bay Sands, his new $5.5bn casino hotel project in Singapore, the 76-year-old billionaire is in a combative mood, heaping scorn on the “doubting Thomases” who wrote off Las Vegas Sands during the financial crisis.It has been a tumultuous year for the casino resort group controlled by Mr Adelson. With markets tumbling following the collapse of Lehman Brothers last September, shares in Las Vegas Sands fell 99 per cent. They hit a low of $1.38 in March amid fears the company would breach its debt covenants and be forced into bankruptcy.In an interview with the Financial Times Mr Adelson, who ploughed $1bn of his own money into Las Vegas Sands to keep it afloat, says the company’s critics were wrong. “I kept saying to everybody: our business model is still intact. Why is the stock going down?”“It was bewildering to me. Nothing in our company had fundamentally changed. Our pipeline of growth was there and is still there today.”With resorts across the globe, Las Vegas Sands is asset-rich. But it is also highly leveraged, with net debt of about $10bn and a costly development pipeline that includes its project in Singapore and a cluster of new hotels in Macao that will supplement properties it operates there, such as the Venetian Macao and Sands Macao.Investor fears were stoked by the company’s admission last November that its ability to continue operations was in “substantial doubt” if it failed to raise new capital. The warning came as the group suspended construction of new projects in Macao.Yet Mr Adelson, the son of a Boston cab-driver, has succeeded over the past year in bringing the company back from the brink. A management shake-up and a capital injection of $1bn from the billionaire and his family helped the group to a more sound financial footing.The group shored up its balance sheet and completed a $2.1bn share sale. After hitting $1.38 in March the shares have climbed past $18, valuing the company now at $12bn.More recently, it announced plans for an initial public offering in Hong Kong of its Macao assets. Analysts expect the company to raise $2bn-$3bn, which could further firm up the balance sheet and mean construction of suspended Macao projects is restarted.Mr Adelson declines to comment on the Hong Kong IPO, which could happen by the end of next month. But he denies ever fearing that the group risked bankruptcy. “Never,” he growls. “Not for a moment. I wasn’t going to cap my career of 64 years with a loss.”However, he admits the year had some low points. “I bit the bullet and I sold equity. That was the lowest point …because I felt that my job was to enhance shareholder value and here I had diluted it, including [my own stake].“But I paid the price. I put up $1bn to save the company. We were down as low as [a market capitalisation of] $1bn and we’re back to $12bn today.”The equity sale diluted his stake from 69 per cent to 52 per cent. But the recent revival in the company’s shares has lifted the value of his holding up to $6bn from about $500m at the low point this year.Despite the improvement, his stake is still a long way off $36bn, the approximate value of his holding when Las Vegas Sands shares hit their peak of $144 in October 2007.Mr Adelson credits Michael Leven, his new chief operating officer, for much of the success in turning the company round. Mr Leven replaced Bill Weidner, Mr Adelson’s long-time second-in-command, who left Las Vegas Sands at the end of 2008. With Mr Leven in place, the group embarked on a cost-cutting programme, shedding 6,000 jobs and cutting $600m of costs.As trading conditions have stabilised, Mr Adelson reiterates his support for the group’s business model. Unlike his competitors MGM Mirage and Wynn Resorts, his model depends on the sale of non-core assets, such as shopping malls or condominiums, to support debt incurred in building his casino hotels.“I borrow money and I pay it back from the sale of non-core assets which I build specifically for this purpose. And then I’ll have my core assets debt free.” He estimates markets will return to normal within the next two or three years, allowing him to sell off non-core assets, such as the company’s retail operations in Macao.The past 12 months have been anything but normal, but analysts say Mr Adelson’s actions helped ensure Las Vegas Sands’ survival. “He bought stock in the open market, which was a sign he still believed there was a lot of inherent value in the company,” says Dennis Farrell, a gaming analyst with Wachovia Capital Markets. “It said: we believe this company is a survivor.”
138;WYNN;Wynn Resorts Ltd;2009-10-09T09:49:55Z;Wynn’s debut defies recent gloom;;Wynn Macau, controlled by US gaming tycoon Steve Wynn, rose as much as 13 per cent in its trading debut on Friday, defying the recent trend of disappointing first-day performances by new stocks in Hong Kong.Wynn shares closed up 6.9 per cent at HK$10.78, after hitting HK$11.40 in early trading. The company, which holds the Macao operations of Wynn Resorts, priced its US$1.6bn listing at the upper end of a price range at HK$10.08 a share.While Hong Kong’s initial public offering market has been very active, with a slew of companies still in the pipeline to sell shares in coming months, there has been concern about whether investor demand is cooling after a string of weak debuts.At least five companies dived below their issue prices on their trading debuts in Hong Kong since September. These include Glorious Property, which fell 15 per cent on its first day of trading last week, and Metallurgical Corporation of China, the world’s second largest IPO this year which closed down nearly 12 per cent on its debut last month.This week, Powerlong Real Estate, the Chinese property group, delayed the trading of its shares after pricing its HK$2.75bn (US$353m) IPO below an indicative range.However, sentiments appeared to be improving after five small listings advanced on their first day of trading in the last few days. Fine jewellery designer Eternite surged 62 per cent on Wednesday while Jiangchen, an apparel manufacturer, rose 110 per cent on Thursday.On Friday, people familiar with the situation said that United Company Rusal, the aluminium empire of Russian tycoon Oleg Deripaska, was seeking to raise up to US$2bn in Hong Kong in the next few months to repay debt, restarting an earlier listing plan that was postponed by the financial crisis last year.Goldman Sachs, Credit Suisse, BNP Paribas and Bank of China International are handling the IPO. They declined to comment.Rusal is reportedly in talks with a range of potential cornerstone investors, including Aluminium Corp of China, China Investment Corp, the sovereign wealth find, and Singapore’s Temasek, according to the South China Morning Post in Hong Kong.Wynn sold shares at a time when Macao, the world’s largest gaming market by revenue, is turning around from a weak first half. In August, the former Portuguese colony had its best month after gross gaming revenue jumped 17 per cent year on year to a record high of US$1.4bn.Visa restrictions on residents in neighbouring Guangdong province, one of Macao’s most important feeder markets, have been relaxed. Gamblers are now allowed to visit once a month compared with once every three months previously.Wynn’s strong performance should bode well for Sheldon Adelson’s Las Vegas Sands, which is also planning a Hong Kong listing of its Macao business this year.
139;WYNN;Wynn Resorts Ltd;2009-10-05T23:02:19Z;Ho’s hold on Macao gaming is loosening;;"One senior Macao gaming executive summarises the industry’s explosive growth since 2002 as a journey “from monopoly to oligopoly”.In that year, Stanley Ho’s 40-year monopoly was terminated and concessions extended to five other casino operators, including Las Vegas Sands and Wynn Resorts of the US.Mr Ho, who will turn 88 next month, was hospitalised in August after a fall. The health scare reignited speculation about who will inherit the billionaire’s vast commercial empire – especially Sociedade de Turismo e Diversões de Macau, his holding company; casino operator Sociedade de Jogos de Macau; and Shun Tak Holdings, a property and transport conglomerate.Mr Ho has 17 children by four wives. The two best-known children, Pansy and Lawrence, have Macao gaming joint ventures with, respectively, MGM Mirage and James Packer’s Crown.Pansy and Lawrence would have to exit those investments before becoming involved in SJM, where Mr Ho’s fourth wife, Angela Leong, is a director.Pansy, meanwhile, has the inside track at Shun Tak, where she is managing director."
140;WYNN;Wynn Resorts Ltd;2009-10-05T16:58:23Z;Macao table take outstrips Vegas;;The tables have finally turned for casinos in the world’s largest gambling market by revenue.Their luck appeared to be running out earlier in the year, with concessionaires in Macao, the Chinese special administrative region near Hong Kong, seeing first-half revenues fall 12.4 per cent year-on-year to $6.4bn.But August was a bumper month. Macao’s six licensed casino operators, who manage 32 properties in the tiny territory, raked in $1.4bn in gross revenues – their biggest monthly haul. Casinos on the Las Vegas Strip, by contrast, have been averaging about $470m a month over the past year.“It’s like someone poured boiling water over an anthill,” David Green, gaming practice director at PWC, says, referring to Macao’s now teeming streets and casinos. “[Gamblers] are certainly finding their way here – in hordes.”The invisible hand of the Chinese government seems to lie behind the change. Guangdong, China’s most populous and richest province, is one of Macao’s two most important feeder markets, alongside Hong Kong.In 2007 and early 2008, as Macao’s economy overheated, visa restrictions were imposed on individual travellers from Guangdong, who were previously able to visit Macao up to 24 times a year. Indeed, over the first six months of this year, visitor numbers fell 11.4 per cent to 10.4m.But things have turned around very quickly. According to a recent research report by Credit Suisse, individual travellers from Guangdong may now enter Macao 12 times a year, compared with just six visits at the height of the restrictions. Meanwhile, there are no limits on how many times Guangdong residents can visit Macao as part of a tour group.The policy, and who sets it, has never been clear. “[It] is set in consultation with the central government and the Guangdong [provincial] government,” Steve Wynn, chairman of Wynn Resorts, said at a recent press conference.Mr Wynn – who is spinning off his company’s Macao arm in a $1.6bn initial public offering on the Hong Kong stock exchange – added that the central government’s “liaison office” in Macao, and Macao’s government, also play a role in the deliberations.Industry executives and analysts point to another factor behind the turnround – the availability of credit.Macao’s gaming market is skewed towards high-rollers, or “whales”, who are wined and dined by intermediaries known as “junkets”. More importantly, junkets provide the whales with credit and also collect their debts.“The key function of junket operators is to provide liquidity and credit in Macao – just like banks,” says Gabriel Chan, head of casino and gaming research at Credit Suisse in Hong Kong.Junkets are important because, as huge as Macao’s casino revenues are, they represent only a fraction of what is being wagered. In VIP baccarat – the whales’ game of choice, which accounts for two-thirds of Macao gaming revenues – the house win rate, is typically just 2.85 per cent.Last month Sociedade de Jogos de Macau, the gaming flagship of tycoon Stanley Ho and Macao’s market leader, reported first-half VIP revenues of $1.1bn on “VIP chip sales” of $38.1bn (equivalent to a win rate for the casinos of 2.83 per cent).In reality, relatively little cash changed hands for the nearly $40bn chips that SJM’s junkets “sold” to VIP gamblers in the first half. Most chips were extended on credit, with SJM’s junkets responsible for collecting the $1bn that VIP gamblers actually lost.Mr Chan, at Credit Suisse, estimates that in August alone, Macao junkets extended VIP gamblers more than $31bn in notional credit, compared with a low of $19bn last December.Industry executives and analysts estimate that junkets are now collecting VIP debts two weeks after they are incurred. In the depths of the global financial crisis, the lag was two months.As one Hong Kong-based investment banker puts it, referring to the degree of risk junkets must take: “Junkets really are at the sharp end of the stick.”
141;WYNN;Wynn Resorts Ltd;2009-09-30T16:37:43Z;Strong demand for Wynn IPO;;Wynn Resorts priced the $1.6bn initial public offering of its Macao operations on Wednesday at the top end of an indicative range amid strong demand as investors bet that the city’s gaming market would continue to improve.The US casino operator controlled by Steve Wynn plans to sell a 25 per cent stake in its Macao business in Hong Kong at HK$10.08 a share, the upper end of a price range of HK$8.52 to HK$10.08.In spite of recent disappointing performances of new listings in Hong Kong and competition from a flood of upcoming IPOs, investors rushed to buy Wynn shares on the back of good news on the state of the world’s biggest gaming market.Macao, the former Portuguese colony, had its best month in August after gross gaming revenue jumped 17 per cent year on year to a record high of $1.4bn.Visa restrictions on residents in neighbouring Guangdong province, one of Macao’s most important feeder markets, have been relaxed. Gamblers are now allowed to visit once a month compared with once every three months previously.Wynn’s IPO is being arranged by JPMorgan, Morgan Stanley and UBS.Sheldon Adelson’s Las Vegas Sands is planning a Hong Kong listing of its Macao business this year.Just less than 13 per cent of Wynn’s IPO has been reserved for four tycoons from Hong Kong and Malaysia – Walter Kwok, Thomas Lau, Quek Leng Chan and Chua Ma Yu.Mr Wynn has said the IPO will make his group “more of a Chinese company”, although it will retain just $5m of the Hong Kong IPO proceeds for “general corporate purposes” in Macao.Wynn shares are due to begin trading on October 9.
142;WYNN;Wynn Resorts Ltd;2009-09-24T04:00:24Z;MCC plunges in HK’s worst debut this year;;Metallurgical Corp of China shares plunged on Thursday in Hong Kong’s worst market debut this year as a flood of new listings have made investors more selective.Shares of the dual-listed company, which are also listed in Shanghai, hit a low of HK$5.40 in early trading, 15 per cent lower than the offer price of HK$6.35. The shares later recovered to HK$5.61.Poor showing by the company’s shares in Shanghai, which fell 4.6 per cent to Rmb6.04 on Thursday, also affected the stock’s performance in Hong Kong.MCC shares had begun trading in Shanghai on Monday, when they closed up 28 per cent at Rmb6.94, an increase considered muted by Chinese standards. The shares lost a total of 8.8 per cent over the past two days.The company, which raised a combined US$5.1bn from Hong Kong and Shanghai in the world’s second largest initial public offering this year, is one of China’s largest engineering companies. However, investors have shunned the construction sector where companies have been plagued by low margins.Timothy Fung, China equity strategist at Credit Suisse Private Banking, said investors in Hong Kong had become more cautious because of a strong pipeline of upcoming new listings.“Investors realise they have lots of choices. They have also learnt that IPOs don’t always go up,” said Mr Fung.According to Dealogic, at least 15 companies plan to sell shares in Hong Kong by the end of this year. Wynn Resorts, the casino operator controlled by Steve Wynn, is raising up to $1.6bn by selling a 25 per cent stake in its Macao operation. Speaking in Hong Kong on Wednesday, Mr Wynn said the listing will help the Las Vegas-based group realise its aspirations of becoming “more of a Chinese company”. Trading will start on October 9.Rival Las Vegas Sands, controlled by Sheldon Adelson, is also slated for a listing in Hong Kong this year.Sinopharm, China’s biggest pharmaceuticals distributor, rose 7.88 per cent on Thursday after rising nearly 16 per cent on its debut on Wednesday. The Hang Seng index was down 2.5 per cent.
143;WYNN;Wynn Resorts Ltd;2009-09-23T21:31:46Z;Wynn Resorts upbeat about Hong Kong IPO;;The Hong Kong initial public offering of Wynn Resorts’ Macao operations will help the Las Vegas-based group realise its aspirations of becoming “more of a Chinese company”, according to Steve Wynn, its chairman.Wynn Resorts will raise up to $1.6bn by selling a 25 per cent stake in its Macao operations, as it becomes the first American-based company to establish a presence on the Hong Kong stock exchange.Macao’s gaming market, the world’s largest, was monopolised by Stanley Ho for 40 years until 2002, when five other concessions were extended to investors including Wynn Resorts and Sheldon Adelson’s Las Vegas Sands group.Mr Ho, a Hong Kong-born tycoon of Chinese and Dutch ancestry, likes to present himself as the only truly local casino operator in Macao.His gaming flagship, Sociedade de Jogos de Macau, is still the largest player, with a 30 per cent market share.But its leading position is under threat – especially from Las Vegas Sands, which has built the world’s two largest casinos in Macao, by number of tables.Mr Ho has played the nationalist card repeatedly over the years, fuelling speculation that the Chinese central government is worried about the growing influence of US commercial interests in Macao.Mr Wynn on Wednesday sought to play up his own company’s local credentials, although it will retain just $5m of the Hong Kong IPO proceeds for “general corporate purposes” in Macao.“The IPO is giving us the chance to share ownership of [our Macao] concession with Chinese investors and financial institutions …and basically become more of a Chinese company,” Mr Wynn said at a briefing in Hong Kong.He added that Wynn Resorts had originally hoped to enter Macao in 2002 with a Chinese partner, but a tie-up could not be arranged at the time.Just under 13 per cent of the Hong Kong offering has been reserved for two Hong Kong tycoons, Walter Kwok and Thomas Lau, and two Malaysian tycoons of Chinese descent, Quek Leng Chan and Chua Ma Yu.In contrast to his arch-rival Mr Adelson, Mr Wynn has taken a more cautious approach in Macao. He has so far opened just one property in the former Portuguese colony, the Wynn Macau, with another, Encore, slated to follow in April.But Wynn Resorts seems to have timed its Hong Kong IPO perfectly, with Macao casinos enjoying their best ever month in August after a slow first half.Mr Wynn also said visa restrictions on residents in neighbouring Guangdong province, Macao’s most important feeder market, had recently been relaxed, with gamblers now allowed to visit once a month compared to once every three months previously.
144;WYNN;Wynn Resorts Ltd;2009-09-20T17:13:58Z;Vegas aims to cash in on MGM’s CityCenter;;Las Vegas’s struggling economy will be given a significant boost on Monday when some 12,000 people are appointed to posts at CityCenter, the sprawling $8.5bn resort development seen as crucial to the resurgence of the casino capital.MGM Mirage, which owns other Las Vegas casinos such as the Bellagio and the MGM Grand, has spent four years developing the 18m sq ft CityCenter, which is the largest commercial real estate project in the US.The future of the development, which includes upmarket hotels, a casino, shopping centre and concert arena, fell into doubt this year when MGM Mirage was unable to access frozen credit markets.However, the company secured several debt waivers and has since completed a $2.5bn refinancing, securing the funds needed to complete the development and open it as planned in December.The group also issued new shares, which diluted the stake held by Kirk Kerkorian, its largest shareholder, from 52 per cent to 37 per cent.Jim Murren, chief executive of MGM Mirage, told the FT that CityCenter would be a shot in the arm for Las Vegas, which has been badly hit by the downturn.Unemployment in the city is at 13.6 per cent, well above the US average of 9.7 per cent, while other ambitious construction projects have been abandoned, exacerbating the weakness of the city’s job market.“CityCenter is going to be vital to the ability of Las Vegas to recover from this recession,” he said. “Not only because it represents a project that has survived [the downturn] but because people are going to come from all over the world to see it.”The 12,000 available positions at CityCenter have attracted more than 160,000 applications, underscoring the extent of the downturn that has hit the city.“This concentration of new jobs is not happening anywhere else in the US,” said Mr Murren. “To have it happen [in Las Vegas] will have a profound effect.”While MGM Mirage prepares for the grand opening of CityCenter in December, other casino companies have been less fortunate with their projects.The $3.5bn Fontainebleu development sought bankruptcy protection this summer and 3,500 construction jobs were lost, while other costly projects have been shelved.The downturn followed a decade in which Las Vegas was the fastest-growing city in the US, with plentiful casino jobs and minimal corporate taxation attracting thousands of residents and businesses.But when the consumer credit bubble burst last year the city went into a steep decline, becoming one of the focal points of the housing crisis.Convention business dried up and tourists became more prudent about spending in the resort city.
145;WYNN;Wynn Resorts Ltd;2009-09-09T17:30:47Z;Genting Singapore in rights issue;;Genting Singapore, the Malaysian controlled company building one of two casino resorts in the island state, on Wednesday announced a S$1.63bn (US$1.14bn) rights issue aimed at shoring up its balance sheet and possible acquisitions.The company, a subsidiary of the Genting gaming group of Malaysia, sought to dampen rumours that its Resorts World development at Sentosa was significantly over budget, saying its costs were on track and it would open on schedule early next year.Justin Tan, managing director of Genting Singapore, said the rights issue would “strengthen the company’s financials and put us in a strong position to tap strategic opportunities”.However, analysts said it was likely the project was hitting its revised budget targets but costing much more than the S$5.2bn estimate when the contract was awarded in late 2006.“I think it is probably because of the cost overruns that Genting has had to incur in building this integrated resort,” said Abdul Jalil Rasheed, head of equities at Aberdeen Asset Management in Kuala Lumpur.Mr Rasheed said Genting Singapore might be planning to invest part of the proceeds in initial public offerings in the Macao operations of Wynn Resorts and Las Vegas Sands, which are expected to take place in Hong Kong later this year.Genting Singapore operates casinos and integrated resorts in several countries including Australia, Malaysia, the Philippines and the UK.Genting Singapore said it would offer shareholders one share for every five held at 80 Singapore cents, a discount of 33 per cent to the stock’s last traded price. Genting has agreed to subscribe for its 54 per cent of the rights issue.Genting Singapore shares, which have more than doubled in price this year, closed at S$1.19 on Tuesday. The shares were suspended in Singapore on Wednesday.The rights issue by Genting Singapore follows the sale in May by the family that owns its Malaysian parent of its entire 9 per cent personal stake in the Singapore unit for S$615m.
